"1307.1386","Rachid Ouyed","Rachid Ouyed, Denis Leahy and Nico Koning (Department of Physics &
  Astronomy, University of Calgary, Canada)","""Anti-glitches"" in the Quark-Nova model for AXPs","5 pages. Accepted for publication in Astrophysics and Space Science.
  (Companion paper: http://adsabs.harvard.edu/abs/2014Ap%26SS.350..701K )",,"10.1007/s10509-014-1941-8",,"astro-ph.HE","http://arxiv.org/licenses/nonexclusive-distrib/1.0/","  In the Quark-Nova model, AXPs are quark stars surrounded by a degenerate
iron-rich Keplerian ring (a few stellar radii away). AXP bursts are caused by
accretion of chunks from the inner edge of the ring following magnetic field
penetration. For bright bursts, the inner disk is prone to radiation induced
warping which can tilt it into counter-rotation (i.e. retrograde). For AXP
1E2259+586, the 2002 burst satisfies the condition for the formation of a
retrograde inner ring. We hypothesize the 2002 burst reversed the inner ring
setting the scene for the 2012 outburst and ""anti-glitch"" when the retrograde
inner ring was suddenly accreted leading to the basic observed properties of
the 2012 event.
","[{""version"":""v1"",""created"":""Thu, 4 Jul 2013 16:00:01 GMT""},{""version"":""v2"",""created"":""Thu, 24 Apr 2014 04:09:57 GMT""}]","2015-06-16"
"1307.1387","Uwe Aickelin","Hala Helmi, Jon M. Garibaldi and Uwe Aickelin","Examining the Classification Accuracy of TSVMs with ?Feature Selection
  in Comparison with the GLAD Algorithm","UKCI 2011, the 11th Annual Workshop on Computational Intelligence,
  Manchester, pp 7-12",,,,"cs.LG cs.CE","http://arxiv.org/licenses/nonexclusive-distrib/1.0/","  Gene expression data sets are used to classify and predict patient diagnostic
categories. As we know, it is extremely difficult and expensive to obtain gene
expression labelled examples. Moreover, conventional supervised approaches
cannot function properly when labelled data (training examples) are
insufficient using Support Vector Machines (SVM) algorithms. Therefore, in this
paper, we suggest Transductive Support Vector Machines (TSVMs) as
semi-supervised learning algorithms, learning with both labelled samples data
and unlabelled samples to perform the classification of microarray data. To
prune the superfluous genes and samples we used a feature selection method
called Recursive Feature Elimination (RFE), which is supposed to enhance the
output of classification and avoid the local optimization problem. We examined
the classification prediction accuracy of the TSVM-RFE algorithm in comparison
with the Genetic Learning Across Datasets (GLAD) algorithm, as both are
semi-supervised learning methods. Comparing these two methods, we found that
the TSVM-RFE surpassed both a SVM using RFE and GLAD.
","[{""version"":""v1"",""created"":""Thu, 4 Jul 2013 16:06:25 GMT""}]","2013-07-05"
"1307.1388","Hong Qiao","Qiao Hong, Li Yinlin, Tang Tang, Wang Peng","Introducing Memory and Association Mechanism into a Biologically
  Inspired Visual Model","9 pages, 10 figures",,,,"cs.AI","http://arxiv.org/licenses/nonexclusive-distrib/1.0/","  A famous biologically inspired hierarchical model firstly proposed by
Riesenhuber and Poggio has been successfully applied to multiple visual
recognition tasks. The model is able to achieve a set of position- and
scale-tolerant recognition, which is a central problem in pattern recognition.
In this paper, based on some other biological experimental results, we
introduce the Memory and Association Mechanisms into the above biologically
inspired model. The main motivations of the work are (a) to mimic the active
memory and association mechanism and add the 'top down' adjustment to the above
biologically inspired hierarchical model and (b) to build up an algorithm which
can save the space and keep a good recognition performance. The new model is
also applied to object recognition processes. The primary experimental results
show that our method is efficient with much less memory requirement.
","[{""version"":""v1"",""created"":""Thu, 4 Jul 2013 16:08:56 GMT""}]","2013-07-05"
"1307.1389","Rafayel Kamalian","A.M. Khachatryan, R.R. Kamalian","On the extremal values of the number of vertices with an interval
  spectrum on the set of proper edge colorings of the graph of the
  $n$-dimensional cube","9 pages. arXiv admin note: substantial text overlap with
  arXiv:1205.0125",,,,"math.CO cs.DM","http://creativecommons.org/licenses/by/3.0/","  For an undirected, simple, finite, connected graph $G$, we denote by $V(G)$
and $E(G)$ the sets of its vertices and edges, respectively. A function
$\varphi:E(G)\rightarrow \{1,...,t\}$ is called a proper edge $t$-coloring of a
graph $G$, if adjacent edges are colored differently and each of $t$ colors is
used. The least value of $t$ for which there exists a proper edge $t$-coloring
of a graph $G$ is denoted by $\chi'(G)$. For any graph $G$, and for any integer
$t$ satisfying the inequality $\chi'(G)\leq t\leq |E(G)|$, we denote by
$\alpha(G,t)$ the set of all proper edge $t$-colorings of $G$. Let us also
define a set $\alpha(G)$ of all proper edge colorings of a graph $G$: $$
\alpha(G)\equiv\bigcup_{t=\chi'(G)}^{|E(G)|}\alpha(G,t). $$
  An arbitrary nonempty finite subset of consecutive integers is called an
interval. If $\varphi\in\alpha(G)$ and $x\in V(G)$, then the set of colors of
edges of $G$ which are incident with $x$ is denoted by $S_G(x,\varphi)$ and is
called a spectrum of the vertex $x$ of the graph $G$ at the proper edge
coloring $\varphi$. If $G$ is a graph and $\varphi\in\alpha(G)$, then define
$f_G(\varphi)\equiv|\{x\in V(G)/S_G(x,\varphi) \textrm{is an interval}\}|$.
  For a graph $G$ and any integer $t$, satisfying the inequality $\chi'(G)\leq
t\leq |E(G)|$, we define: $$
\mu_1(G,t)\equiv\min_{\varphi\in\alpha(G,t)}f_G(\varphi),\qquad
\mu_2(G,t)\equiv\max_{\varphi\in\alpha(G,t)}f_G(\varphi). $$
  For any graph $G$, we set: $$ \mu_{11}(G)\equiv\min_{\chi'(G)\leq
t\leq|E(G)|}\mu_1(G,t),\qquad \mu_{12}(G)\equiv\max_{\chi'(G)\leq
t\leq|E(G)|}\mu_1(G,t), $$ $$ \mu_{21}(G)\equiv\min_{\chi'(G)\leq
t\leq|E(G)|}\mu_2(G,t),\qquad \mu_{22}(G)\equiv\max_{\chi'(G)\leq
t\leq|E(G)|}\mu_2(G,t). $$
  For any positive integer $n$, the exact values of the parameters $\mu_{11}$,
$\mu_{12}$, $\mu_{21}$ and $\mu_{22}$ are found for the graph of the
$n$-dimensional cube.
","[{""version"":""v1"",""created"":""Thu, 4 Jul 2013 16:13:12 GMT""}]","2013-07-05"
"1307.1390","Uwe Aickelin","Grazziela P Figueredo, Uwe Aickelin, Peer-Olaf Siebers","Systems Dynamics or Agent-Based Modelling for Immune Simulation?","Proceedings of the 10th International Conference on Artificial Immune
  Systems (ICARIS 2011), LNCS Volume 6825, Cambridge, UK, pp 81-94, 2011",,,,"cs.CE cs.MA","http://arxiv.org/licenses/nonexclusive-distrib/1.0/","  In immune system simulation there are two competing simulation approaches:
System Dynamics Simulation (SDS) and Agent-Based Simulation (ABS). In the
literature there is little guidance on how to choose the best approach for a
specific immune problem. Our overall research aim is to develop a framework
that helps researchers with this choice. In this paper we investigate if it is
possible to easily convert simulation models between approaches. With no
explicit guidelines available from the literature we develop and test our own
set of guidelines for converting SDS models into ABS models in a non-spacial
scenario. We also define guidelines to convert ABS into SDS considering a
non-spatial and a spatial scenario. After running some experiments with the
developed models we found that in all cases there are significant differences
between the results produced by the different simulation methods.
","[{""version"":""v1"",""created"":""Thu, 4 Jul 2013 16:15:11 GMT""}]","2013-07-05"
"1307.1391","Uwe Aickelin","Feng Gu, Jan Feyereisl, Robert Oates, Jenna Reps, Julie Greensmith,
  Uwe Aickelin","Quiet in Class: Classification, Noise and the Dendritic Cell Algorithm","Proceedings of the 10th International Conference on Artificial Immune
  Systems (ICARIS 2011), LNCS Volume 6825, Cambridge, UK, pp 173-186, 2011",,,,"cs.LG cs.CR","http://arxiv.org/licenses/nonexclusive-distrib/1.0/","  Theoretical analyses of the Dendritic Cell Algorithm (DCA) have yielded
several criticisms about its underlying structure and operation. As a result,
several alterations and fixes have been suggested in the literature to correct
for these findings. A contribution of this work is to investigate the effects
of replacing the classification stage of the DCA (which is known to be flawed)
with a traditional machine learning technique. This work goes on to question
the merits of those unique properties of the DCA that are yet to be thoroughly
analysed. If none of these properties can be found to have a benefit over
traditional approaches, then ""fixing"" the DCA is arguably less efficient than
simply creating a new algorithm. This work examines the dynamic filtering
property of the DCA and questions the utility of this unique feature for the
anomaly detection problem. It is found that this feature, while advantageous
for noisy, time-ordered classification, is not as useful as a traditional
static filter for processing a synthetic dataset. It is concluded that there
are still unique features of the DCA left to investigate. Areas that may be of
benefit to the Artificial Immune Systems community are suggested.
","[{""version"":""v1"",""created"":""Thu, 4 Jul 2013 16:19:21 GMT""}]","2013-07-05"
"1307.1392","Rafayel Kamalian","N.N. Davtyan, R.R. Kamalian","An inequality for the number of vertices with an interval spectrum in
  edge labelings of regular graphs","3 pages",,,,"math.CO cs.DM","http://creativecommons.org/licenses/by/3.0/","  We consider undirected simple finite graphs. The sets of vertices and edges
of a graph $G$ are denoted by $V(G)$ and $E(G)$, respectively. For a graph $G$,
we denote by $\delta(G)$ and $\eta(G)$ the least degree of a vertex of $G$ and
the number of connected components of $G$, respectively. For a graph $G$ and an
arbitrary subset $V_0\subseteq V(G)$ $G[V_0]$ denotes the subgraph of the graph
$G$ induced by the subset $V_0$ of its vertices. An arbitrary nonempty finite
subset of consecutive integers is called an interval. A function
$\varphi:E(G)\rightarrow \{1,2,\dots,|E(G)|\}$ is called an edge labeling of
the graph $G$, if for arbitrary different edges $e'\in E(G)$ and $e''\in E(G)$,
the inequality $\varphi(e')\neq \varphi(e'')$ holds. If $G$ is a graph, $x$ is
its arbitrary vertex, and $\varphi$ is its arbitrary edge labeling, then the
set $S_G(x,\varphi)\equiv\{\varphi(e)/ e\in E(G), e \textrm{is incident with}
x$\} is called a spectrum of the vertex $x$ of the graph $G$ at its edge
labeling $\varphi$. If $G$ is a graph and $\varphi$ is its arbitrary edge
labeling, then $V_{int}(G,\varphi)\equiv\{x\in V(G)/\;S_G(x,\varphi)\textrm{is
an interval}\}$. For an arbitrary $r$-regular graph $G$ with $r\geq2$ and its
arbitrary edge labeling $\varphi$, the inequality $$
|V_{int}(G,\varphi)|\leq\bigg\lfloor\frac{3\cdot|V(G)|-2\cdot\eta(G[V_{int}(G,\varphi)])}{4}\bigg\rfloor.
$$ is proved.
","[{""version"":""v1"",""created"":""Thu, 4 Jul 2013 16:19:34 GMT""}]","2013-07-05"
"1307.1393","Trevor Wooley","Joerg Bruedern and Trevor D. Wooley","Cubic moments of Fourier coefficients and pairs of diagonal quartic
  forms",,"J. Eur. Math. Soc. 17 (2015), no. 11, 2887--2901",,,"math.NT","http://arxiv.org/licenses/nonexclusive-distrib/1.0/","  We establish the non-singular Hasse Principle for pairs of diagonal quartic
equations in 22 or more variables. Our methods involve the estimation of a
certain entangled two-dimensional 21st moment of quartic smooth Weyl sums via a
novel cubic moment of Fourier coefficients.
","[{""version"":""v1"",""created"":""Thu, 4 Jul 2013 16:22:19 GMT""}]","2022-03-01"
"1307.1394","Uwe Aickelin","Yihui Liu, Uwe Aickelin","Detect adverse drug reactions for drug Alendronate","Second International Conference on Business Computing and Global
  Informatization (BCGIN), pp 820-823, 2012",,,,"cs.CE cs.LG","http://arxiv.org/licenses/nonexclusive-distrib/1.0/","  Adverse drug reaction (ADR) is widely concerned for public health issue. In
this study we propose an original approach to detect the ADRs using feature
matrix and feature selection. The experiments are carried out on the drug
Simvastatin. Major side effects for the drug are detected and better
performance is achieved compared to other computerized methods. The detected
ADRs are based on the computerized method, further investigation is needed.
","[{""version"":""v1"",""created"":""Thu, 4 Jul 2013 16:24:17 GMT""}]","2013-07-05"
"1307.1395","Christophe Profeta","Christophe Profeta","Some limiting laws associated with the integrated Brownian motion",,,,,"math.PR","http://arxiv.org/licenses/nonexclusive-distrib/1.0/","  We study some limit theorems for the normalized law of integrated Brownian
motion perturbed by several examples of functionals: the first passage time,
the nth passage time, the last passage time up to a finite horizon and the
supremum. We show that the penalization principle holds in all these cases and
give descriptions of the conditioned processes. In particular, it is remarkable
that the penalization by the nth passage time is independent of n, and always
gives the same conditioned process, i.e. integrated Brownian motion conditioned
not to hit 0. Our results rely on some explicit formulae obtained by Lachal and
on enlargement of filtrations.
","[{""version"":""v1"",""created"":""Thu, 4 Jul 2013 16:26:04 GMT""}]","2013-07-05"
"1307.1396","Trevor Wooley","Trevor D. Wooley","Artin's Conjecture and systems of diagonal equations",,"Forum Math. 27 (2015), no. 4, 2259--2265","10.1515/forum-2013-0109",,"math.NT","http://arxiv.org/licenses/nonexclusive-distrib/1.0/","  We show that Artin's conjecture concerning p-adic solubility of Diophantine
equations fails for infinitely many systems of r homogeneous diagonal equations
whenever r>1.
","[{""version"":""v1"",""created"":""Thu, 4 Jul 2013 16:26:58 GMT""}]","2022-11-21"
"1307.1397","Kittipong Kittichokechai","Kittipong Kittichokechai, Yeow-Khiang Chia, Tobias J. Oechtering,
  Mikael Skoglund, and Tsachy Weissman","Secure Source Coding with a Public Helper","45 pages, 12 figures, a short version to be presented at ISIT 2013",,,,"cs.IT math.IT","http://arxiv.org/licenses/nonexclusive-distrib/1.0/","  We consider secure multi-terminal source coding problems in the presence of a
public helper. Two main scenarios are studied: 1) source coding with a helper
where the coded side information from the helper is eavesdropped by an external
eavesdropper; 2) triangular source coding with a helper where the helper is
considered as a public terminal. We are interested in how the helper can
support the source transmission subject to a constraint on the amount of
information leaked due to its public nature. We characterize the tradeoff
between transmission rate, incurred distortion, and information leakage rate at
the helper/eavesdropper in the form of a rate-distortion-leakage region for
various classes of problems.
","[{""version"":""v1"",""created"":""Thu, 4 Jul 2013 16:28:49 GMT""}]","2013-07-05"
"1307.1398","Mar\'ia Luisa Sarsa","C. Cuesta, M.A. Oliv\'an, J. Amar\'e, S. Cebri\'an, E. Garc\'ia, C.
  Ginestra, M. Mart\'inez, Y. Ortigoza, A. Ortiz de Sol\'orzano, C. Pobes, J.
  Puimed\'on, M.L. Sarsa, J.A. Villar and P. Villar","Slow scintillation time constants in NaI(Tl) for different interacting
  particles","4 pages, 3 figures, 5 tables","Optical Materials 36 (2013) 316-320","10.1016/j.optmat.2013.09.015",,"astro-ph.IM physics.ins-det","http://arxiv.org/licenses/nonexclusive-distrib/1.0/","  Very large thallium doped sodium iodide crystals operated underground and in
very low background environment in the context of a dark matter search
experiment have been used to determine scintillation components in the tens of
ms range in the light pulse induced by different interacting particles:
gammas/muons and alphas.
","[{""version"":""v1"",""created"":""Thu, 4 Jul 2013 16:30:15 GMT""}]","2014-07-07"
"1307.1399","Hideaki Maebashi","Hideaki Maebashi, Yasutami Takada","Structural Evolution of 1D Spectral Function from Low- to High-Energy
  Limits","5 pages, 3 figures","Phys. Rev. B 89, 201109 (2014)","10.1103/PhysRevB.89.201109",,"cond-mat.str-el","http://arxiv.org/licenses/nonexclusive-distrib/1.0/","  By exactly analyzing the spin-1/2 Luttinger liquid (LL) and numerically
solving a model of a mobile impurity electron in the LL, we obtain the
one-electron spectral function $A(p,\omega)$ in a one-dimensional (1D) metal in
an entire range of $p$ at zero temperature. For $|p|$ near the Fermi point
$p_{\rm F}$, $A(p,\omega)$ is featured by two prominent peaks of spinon and
(anti)holon representing spin-charge separation, but we also find an additional
cusp structure between them. For $|p| \gg p_{\rm F}$, this structure evolves as
a main peak in $A(p,\omega)$ by swallowing the antiholon mode and its
dispersion relation approaches the one of a free electron, implying the
existence of an electron excitation in the whole region, but not quite a
quasiparticle in the Fermi liquid due to ever existing power-law decay of the
excitation.
","[{""version"":""v1"",""created"":""Thu, 4 Jul 2013 16:37:46 GMT""},{""version"":""v2"",""created"":""Wed, 23 Oct 2013 08:47:30 GMT""}]","2014-05-21"
"1307.1400","Kai Yi","Kai Yi (for the CMS collaboration)","Search for Single and Pair-Production of Dijet Resonances with the CMS
  Detector","Proceedings submitted to Kruger 2012 conference",,,,"hep-ex hep-ph","http://arxiv.org/licenses/nonexclusive-distrib/1.0/","  Searches for new physics in the single and paired dijet mass spectrum are
performed using data collected by the CMS experiment at the LHC at a collision
energy of sqrt{s}=7 or sqrt{s}=8 TeV. No evidence for new physics is found and
upper limits are set for various models. At 95% confidence level, a string
resonance in the single dijet spectrum is excluded for masses between 1 and 4.7
TeV and, for the first time, a coloron in the paired dijet spectrum is excluded
for masses between 250 and 740 GeV.
","[{""version"":""v1"",""created"":""Thu, 4 Jul 2013 16:38:19 GMT""}]","2019-08-14"
"1307.1401","Marek Galewski","Marek Galewski, Elzbieta Galewska and Ewa Schmeidel","A note on a diffeomorphism between two Banach spaces","submitted to a journal for consideration",,,,"math.CA","http://arxiv.org/licenses/nonexclusive-distrib/1.0/","  We provide sufficient conditions for a mapping acting between two Banach
spaces to be a diffeomorphism.
","[{""version"":""v1"",""created"":""Thu, 4 Jul 2013 16:45:16 GMT""},{""version"":""v2"",""created"":""Sun, 12 Jan 2014 21:18:01 GMT""},{""version"":""v3"",""created"":""Tue, 28 Jan 2014 22:23:35 GMT""}]","2014-01-30"
"1307.1402","Xiangping Hu","Xiangping Hu, Ingelin Steinsland, Daniel Simpson, Sara Martino and
  H{\aa}vard Rue","Spatial Modelling of Temperature and Humidity using Systems of
  Stochastic Partial Differential Equations","21 pages, 13 figures",,,,"stat.AP","http://arxiv.org/licenses/nonexclusive-distrib/1.0/","  This work is motivated by constructing a weather simulator for precipitation.
Temperature and humidity are two of the most important driving forces of
precipitation, and the strategy is to have a stochastic model for temperature
and humidity, and use a deterministic model to go from these variables to
precipitation. Temperature and humidity are empirically positively correlated.
Generally speaking, if variables are empirically dependent, then multivariate
models should be considered. In this work we model humidity and temperature in
southern Norway. We want to construct bivariate Gaussian random fields (GRFs)
based on this dataset. The aim of our work is to use the bivariate GRFs to
capture both the dependence structure between humidity and temperature as well
as their spatial dependencies. One important feature for the dataset is that
the humidity and temperature are not necessarily observed at the same
locations. Both univariate and bivariate spatial models are fitted and
compared. For modeling and inference the SPDE approach for univariate models
and the systems of SPDEs approach for multivariate models have been used.
  To evaluate the performance of the difference between the univariate and
bivariate models, we compare predictive performance using some commonly used
scoring rules: mean absolute error, mean-square error and continuous ranked
probability score. The results illustrate that we can capture strong positive
correlation between the temperature and the humidity. Furthermore, the results
also agree with the physical or empirical knowledge. At the end, we conclude
that using the bivariate GRFs to model this dataset is superior to the approach
with independent univariate GRFs both when evaluating point predictions and for
quantifying prediction uncertainty.
","[{""version"":""v1"",""created"":""Thu, 4 Jul 2013 16:45:59 GMT""},{""version"":""v2"",""created"":""Tue, 26 May 2015 16:54:16 GMT""}]","2015-05-27"
"1307.1403","Marek Galewski","Marek Galewski and Ewa Schmeidel","On the well posed solutions for nonlinear second order neutral
  difference equations","Mathematica Slovaca, accepted to be published. arXiv admin note: text
  overlap with arXiv:1304.2501",,,,"math.CA","http://arxiv.org/licenses/nonexclusive-distrib/1.0/","  In this work we investigate the existence of solutions, their uniqueness and
finally dependence on parameters for solutions of second order neutral
nonlinear difference equations. The main tool which we apply is Darbo fixed
point theorem.
","[{""version"":""v1"",""created"":""Thu, 4 Jul 2013 16:48:03 GMT""},{""version"":""v2"",""created"":""Sun, 23 Feb 2014 06:54:48 GMT""},{""version"":""v3"",""created"":""Mon, 19 May 2014 20:47:58 GMT""}]","2014-05-21"
"1307.1404","Kevin Heng","Jae-Min Lee, Kevin Heng, Patrick G.J. Irwin","Atmospheric Retrieval Analysis of the Directly Imaged Exoplanet HR 8799b","Accepted by ApJ. 19 pages, 19 figures, 2 tables. Several improvements
  made (""radius ratio problem"" removed, resolution of contour plots doubled,
  text expanded), major conclusions unchanged",,"10.1088/0004-637X/778/2/97",,"astro-ph.EP astro-ph.GA","http://arxiv.org/licenses/nonexclusive-distrib/1.0/","  Directly-imaged exoplanets are unexplored laboratories for the application of
the spectral and temperature retrieval method, where the chemistry and
composition of their atmospheres are inferred from inverse modeling of the
available data. As a pilot study, we focus on the extrasolar gas giant HR 8799b
for which more than 50 data points are available. We upgrade our non-linear
optimal estimation retrieval method to include a phenomenological model of
clouds that requires the cloud optical depth and monodisperse particle size to
be specified. Previous studies have focused on forward models with assumed
values of the exoplanetary properties; there is no consensus on the best-fit
values of the radius, mass, surface gravity and effective temperature of HR
8799b. We show that cloudfree models produce reasonable fits to the data if the
atmosphere is of super-solar metallicity and non-solar elemental abundances.
Intermediately cloudy models with moderate values of the cloud optical depth
and micron-sized particles provide an equally reasonable fit to the data and
require a lower mean molecular weight. We report our best-fit values for the
radius, mass, surface gravity and effective temperature of HR 8799b. The mean
molecular weight is about 3.8, while the carbon-to-oxygen ratio is about unity
due to the prevalence of carbon monoxide. Our study emphasizes the need for
robust claims about the nature of an exoplanetary atmosphere to be based on
analyses involving both photometry and spectroscopy and inferred from beyond a
few photometric data points, such as are typically reported for hot Jupiters.
","[{""version"":""v1"",""created"":""Thu, 4 Jul 2013 16:50:19 GMT""},{""version"":""v2"",""created"":""Wed, 18 Sep 2013 20:45:46 GMT""}]","2015-06-16"
"1307.1405","Vibhu Gupta Mr.","Vaibhav Madhok, Vibhu Gupta, Angele M. Hamel and Shohini Ghose","Signatures of chaos in the dynamics of quantum discord","6 pages, 6 figures",,"10.1103/PhysRevE.91.032906",,"quant-ph","http://arxiv.org/licenses/nonexclusive-distrib/1.0/","  We identify signatures of chaos in the dynamics of discord in a multiqubit
system collectively modelled as a quantum kicked top. The evolution of discord
between any two qubits is quasiperiodic in regular regions, while in chaotic
regions, the quasiperiodicity is lost. As the initial wave function is varied
from the regular regions to the chaotic sea, a contour plot of the time
averaged discord remarkably reproduces the structures of the classical
stroboscopic map. We also find surprisingly opposite behaviour of two-qubit
discord versus two-qubit entanglement. Our calculations provide the first
evidence of signatures of chaos in dynamically generated discord.
","[{""version"":""v1"",""created"":""Thu, 4 Jul 2013 16:53:59 GMT""},{""version"":""v2"",""created"":""Fri, 5 Jul 2013 04:42:33 GMT""}]","2015-07-21"
