"1307.1574","Rob Wang","Peter W. Glynn and Rob J. Wang","Central Limit Theorems and Large Deviations for Additive Functionals of
  Reflecting Diffusion Processes",,,,,"math.PR","http://arxiv.org/licenses/nonexclusive-distrib/1.0/","  This paper develops central limit theorems (CLT's) and large deviations
results for additive functionals associated with reflecting diffusions in which
the functional may include a term associated with the cumulative amount of
boundary reflection that has occurred. Extending the known central limit and
large deviations theory for Markov processes to include additive functionals
that incorporate boundary reflection is important in many applications settings
in which reflecting diffusions arise, including queueing theory and economics.
In particular, the paper establishes the partial differential equations that
must be solved in order to explicitly compute the mean and variance for the
CLT, as well as the associated rate function for the large deviations
principle.
","[{""version"":""v1"",""created"":""Fri, 5 Jul 2013 10:24:14 GMT""},{""version"":""v2"",""created"":""Tue, 8 Jul 2014 20:40:48 GMT""}]","2014-07-10"
"1307.1575","Liping Zou","Liping Zou","Non-Abrikosov vortices in liquid metallic hydrogen",,"Phys.Lett.A, 377,2182,2013","10.1016/j.physleta.2013.05.052",,"cond-mat.supr-con","http://arxiv.org/licenses/nonexclusive-distrib/1.0/","  We consider non-Abrikosov vortex solutions in liquid metallic hydrogen (LMH)
in the framework of two-component Ginzburg-Landau model. We have shown that
there are three types of non-Abrikosov vortices depending on chosen boundary
conditions at the core of vortices, namely, Neumann (N)-type, Dirichlet
(D)-type and Gross-Pitaevskii (GP)-type vortices. The Neumann-type vortex has a
non-vanishing condensation at the core, that is different from the ordinary
vortex, and the magnetic flux could be reversed as well in LMH. Furthermore, we
have obtained a new type of a neutral vortex which has no magnetic field. The
presence of such a vortex is related to metallic superfluid state suggested by
Babaev.
","[{""version"":""v1"",""created"":""Fri, 5 Jul 2013 10:29:27 GMT""}]","2015-06-16"
"1307.1576","Oleg Kirillov N","Oleg N. Kirillov, Frank Stefani, and Yasuhide Fukumoto","Instabilities of rotational flows in azimuthal magnetic fields of
  arbitrary radial dependence","15 pages, 2 figures, slightly extended, the case of finite Rm
  treated, results were partially presented at the IUTAM Symposium on Vortex
  Dynamics, Fukuoka, Japan, March 10 2013","Fluid Dynamics Research (2014) 46 031403","10.1088/0169-5983/46/3/031403",,"astro-ph.SR math.DS physics.flu-dyn physics.plasm-ph","http://arxiv.org/licenses/nonexclusive-distrib/1.0/","  Using the WKB approximation we perform a linear stability analysis for a
rotational flow of a viscous and electrically conducting fluid in an external
azimuthal magnetic field that has an arbitrary radial profile B_{phi}(R). In
the inductionless approximation, we find the growth rate of the
three-dimensional perturbation in a closed form and demonstrate in particular
that it can be positive when the velocity profile is Keplerian and the magnetic
field profile is slightly shallower than R^{-1}.
","[{""version"":""v1"",""created"":""Fri, 5 Jul 2013 10:31:55 GMT""},{""version"":""v2"",""created"":""Fri, 15 Nov 2013 14:28:42 GMT""}]","2014-05-29"
"1307.1577","Costin V\^ilcu","Jin-ichi Itoh, Joel Rouyer and Costin Vilcu","On the Theorem of the Three Perpendiculars",,,,,"math.MG","http://arxiv.org/licenses/nonexclusive-distrib/1.0/","  We show that the theorem of the three perpendiculars holds in any
n-dimensional space form.
","[{""version"":""v1"",""created"":""Fri, 5 Jul 2013 10:47:28 GMT""}]","2013-07-08"
"1307.1578","Mikami Hirasawa","Mikami Hirasawa and Kunio Murasugi","Various stabilities of the Alexander polynomials of knots and links","92 pages",,,,"math.GT","http://arxiv.org/licenses/nonexclusive-distrib/1.0/","  In this paper, we study distribution of the zeros of the Alexander
polynomials of knots and links in S^3. We call a knot or link ""real stable""
(resp. ""circular stable"") if all the zeros of its Alexander polynomial are real
(resp. unit complex). We give a general construction of real stable and
circular stable knots and links. We also study pairs of real stable knots and
links such that the zeros of the Alexander polynomials are interlaced.
","[{""version"":""v1"",""created"":""Fri, 5 Jul 2013 10:54:07 GMT""}]","2013-07-08"
"1307.1579","Chunfeng Ye","Chunfeng Ye, Lei Zhao, Changqing Feng, Shubin Liu, Qi An","A new method of waveform digitization based on time-interleaved A/D
  conversion","11 pages, 15 figures",,"10.1088/1674-1137/37/11/116102",,"physics.ins-det hep-ex","http://arxiv.org/licenses/nonexclusive-distrib/1.0/","  Time interleaved analog-to-digital conversion (TIADC) based on parallelism is
an effective way to meet the requirement of the ultra-fast waveform digitizer
beyond Gsps. Different methods to correct the mismatch errors among different
analog-to-digital conversion channels have been developed previously. To
overcome the speed limitation in hardware design and to implement the mismatch
correction algorithm in real time, this paper proposes a fully parallel
correction algorithm. A 12-bit 1-Gsps waveform digitizer with ENOB around 10.5
bit from 5 MHz to 200 MHz is implemented based on the real-time correction
algorithm.
","[{""version"":""v1"",""created"":""Fri, 5 Jul 2013 10:56:19 GMT""}]","2015-06-16"
"1307.1580","Hamed Pourkhorsandi","Hamed Pourkhorsandi","Search for Impact Craters in Iran: Citizen Science as a Useful Method","Large Meteorite Impacts and Planetary Evolution V (2013)",,,,"astro-ph.EP","http://arxiv.org/licenses/nonexclusive-distrib/1.0/","  To recognition probable impact craters in Iran, we use Google Earth data in
the first step. Some probable structures identified and studies suggest
non-impact origin for them. Studies on other craters in Iran are in progress.
","[{""version"":""v1"",""created"":""Fri, 5 Jul 2013 10:57:44 GMT""}]","2013-07-08"
"1307.1581","Patrick De Leenheer","Patrick De Leenheer","Optimal placement of Marine Protected Areas",,,,,"math.OC","http://arxiv.org/licenses/nonexclusive-distrib/1.0/","  Overfishing can lead to the reduction or elimination of fish populations and
the degradation or even destruction of their habitats. This can be prevented by
introducing Marine Protected Areas (MPA's), regions in the ocean or along
coastlines where fishing is controlled. MPA's can also lead to larger fish
densities outside the protected area through spill-over, which in turn may
increase the fishing yield. A natural question in this context, is where
exactly to establish an MPA, in order to maximize these benefits. This problem
is addressed along a one-dimensional stretch of coast-line, by first proposing
a model for the fish dynamics. Fish are assumed to move diffusively, and are
subject to recruitment, natural death and harvesting through fishing. The
problem is then cast as an optimal control problem for the steady state
equation corresponding to the PDE which models the fish dynamics. The
functional being maximized is a weighted sum of the average fish density and
the average fishing yield. It is shown that optimal controls exist, and that
the form of an optimal control -and hence the location of the MPA- is
determined by two key model parameters, namely the size of the coast, and the
weight of the average fish density appearing in the functional. If these
parameters are large enough -and precisely how large, can be calculated
exactly- the results indicate when and where an MPA should be established. The
results indicate that an MPA always takes the form of a Marine Reserve, where
fishing is prohibited. The main mathematical tool used to prove the results is
Pontryagin's maximum principle.
","[{""version"":""v1"",""created"":""Fri, 5 Jul 2013 10:59:34 GMT""}]","2013-07-08"
"1307.1582","Nikolai Gagunashvili","Nikolai Gagunashvili","Chi-square goodness of fit tests for weighted histograms. Review and
  improvements","27 pages, 4 figures","Journal of Instrumentation 10 (2015) P05004","10.1088/1748-0221/10/05/P05004",,"physics.data-an astro-ph.IM hep-ex nucl-ex stat.AP","http://arxiv.org/licenses/nonexclusive-distrib/1.0/","  Weighted histograms are used for the estimation of probability density
functions. Computer simulation is the main domain of application of this type
of histogram. A review of chi-square goodness of fit tests for weighted
histograms is presented in this paper. Improvements are proposed to these tests
that have size more close to its nominal value. Numerical examples are
presented in this paper for evaluation of tests and to demonstrate various
applications of tests.
","[{""version"":""v1"",""created"":""Fri, 5 Jul 2013 11:21:05 GMT""},{""version"":""v2"",""created"":""Wed, 30 Oct 2013 11:24:43 GMT""},{""version"":""v3"",""created"":""Fri, 30 May 2014 16:47:58 GMT""},{""version"":""v4"",""created"":""Thu, 19 Feb 2015 14:40:37 GMT""}]","2015-05-13"
"1307.1583","Guido Tiana","Sara Lui and Guido Tiana","The network of stabilizing contacts in proteins studied by
  coevolutionary data",,,"10.1063/1.4826096",,"q-bio.BM","http://arxiv.org/licenses/nonexclusive-distrib/1.0/","  The primary structure of proteins, that is their sequence, represents one of
the most abundant set of experimental data concerning biomolecules. The study
of correlations in families of co--evolving proteins by means of an inverse
Ising--model approach allows to obtain information on their native
conformation. Following up on a recent development along this line, we optimize
the algorithm to calculate effective energies between the residues, validating
the approach both back-calculating interaction energies in a model system, and
predicting the free energies associated to mutations in real systems. Making
use of these effective energies, we study the networks of interactions which
stabilizes the native conformation of some well--studied proteins, showing that
it display different properties than the associated contact network.
","[{""version"":""v1"",""created"":""Fri, 5 Jul 2013 11:22:28 GMT""}]","2015-06-16"
"1307.1584","Uwe Aickelin","Jenna Reps, Jonathan M. Garibaldi, Uwe Aickelin, Daniele Soria, Jack
  E. Gibson, Richard B. Hubbard","Comparing Data-mining Algorithms Developed for Longitudinal
  Observational Databases","UKCI 2012, the 12th Annual Workshop on Computational Intelligence,
  Heriot-Watt University, pp 1-8, 2012",,,,"cs.LG cs.CE cs.DB","http://arxiv.org/licenses/nonexclusive-distrib/1.0/","  Longitudinal observational databases have become a recent interest in the
post marketing drug surveillance community due to their ability of presenting a
new perspective for detecting negative side effects. Algorithms mining
longitudinal observation databases are not restricted by many of the
limitations associated with the more conventional methods that have been
developed for spontaneous reporting system databases. In this paper we
investigate the robustness of four recently developed algorithms that mine
longitudinal observational databases by applying them to The Health Improvement
Network (THIN) for six drugs with well document known negative side effects.
Our results show that none of the existing algorithms was able to consistently
identify known adverse drug reactions above events related to the cause of the
drug and no algorithm was superior.
","[{""version"":""v1"",""created"":""Fri, 5 Jul 2013 11:24:55 GMT""}]","2013-07-08"
"1307.1585","Michael Marsh","M. S. Marsh, S. Dalla, J. Kelly, and T. Laitinen","Drift-induced perpendicular transport of Solar Energetic Particles","Pubilished in ApJ, 2013, 774, 4","ApJ, 2013, 774, 4","10.1088/0004-637X/774/1/4",,"astro-ph.SR","http://arxiv.org/licenses/nonexclusive-distrib/1.0/","  Drifts are known to play a role in galactic cosmic ray transport within the
heliosphere and are a standard component of cosmic ray propagation models.
However, the current paradigm of Solar Energetic Particle (SEP) propagation
holds the effects of drifts to be negligible, and they are not accounted for in
most current SEP modelling efforts. We present full-orbit test particle
simulations of SEP propagation in a Parker spiral interplanetary magnetic field
which demonstrate that high energy particle drifts cause significant asymmetric
propagation perpendicular to the interplanetary magnetic field. Thus in many
cases the assumption of field aligned propagation of SEPs may not be valid. We
show that SEP drifts have dependencies on energy, heliographic latitude, and
charge to mass ratio, that are capable of transporting energetic particles
perpendicular to the field over significant distances within interplanetary
space, e.g. protons of initial energy 100 MeV propagate distances across the
field on the order of 1 AU, over timescales typical of a gradual SEP event. Our
results demonstrate the need for current models of SEP events to include the
effects of particle drift. We show that the drift is considerably stronger for
heavy ion SEPs due to their larger mass to charge ratio. This paradigm shift
has important consequences for the modelling of SEP events and is crucial to
the understanding and interpretation of in-situ observations.
","[{""version"":""v1"",""created"":""Fri, 5 Jul 2013 11:27:24 GMT""},{""version"":""v2"",""created"":""Tue, 9 Jul 2013 10:20:23 GMT""},{""version"":""v3"",""created"":""Thu, 29 Aug 2013 08:05:42 GMT""}]","2013-08-30"
"1307.1586","Blaise Li","Blaise Li","Evaluating strategies of phylogenetic analyses by the coherence of their
  results","6 pages, 3 figures, accepted for publication in Comptes Rendus
  Palevol, based on a work presented at the ""Journ\'ees d'automne 2012 de la
  Soci\'et\'e Fran\c{c}aise de Syst\'ematique""
  (http://www.normalesup.org/~bli/Papers/SFS_2012_BL.pdf)",,,,"q-bio.PE","http://arxiv.org/licenses/nonexclusive-distrib/1.0/","  I propose an approach to identify, among several strategies of phylogenetic
analysis, those producing the most accurate results. This approach is based on
the hypothesis that the more a result is reproduced from independent data, the
more it reflects the historical signal common to the analysed data. Under this
hypothesis, the capacity of an analytical strategy to extract historical signal
should correlate positively with the coherence of the obtained results. I apply
this approach to a series of analyses on empirical data, basing the coherence
measure on the Robinson-Foulds distances between the obtained trees. At first
approximation, the analytical strategies most suitable for the data produce the
most coherent results. However, risks of false positives and false negatives
are identified, which are difficult to rule out.
","[{""version"":""v1"",""created"":""Fri, 5 Jul 2013 11:36:40 GMT""}]","2013-07-08"
"1307.1587","Alexander T\""aschner","Alexander T\""aschner, Esperanza K\""ohler, Hans-Werner Ortjohann,
  Alfons Khoukaz","Determination of hydrogen cluster velocities and comparison with
  numerical calculations","14 pages, 27 figures","The Journal of Chemical Physics 139 (2013) 234312","10.1063/1.4848720",,"physics.atm-clus nucl-ex","http://arxiv.org/licenses/nonexclusive-distrib/1.0/","  The use of powerful hydrogen cluster jet targets in storage ring experiments
led to the need of precise data on the mean cluster velocity as function of the
stagnation temperature and pressure for the determination of the volume density
of the target beams. For this purpose a large data set of hydrogen cluster
velocity distributions and mean velocities was measured at a high density
hydrogen cluster jet target using a trumpet shaped nozzle. The measurements
have been performed at pressures above and below the critical pressure and for
a broad range of temperatures relevant for target operation, e.g., at storage
ring experiments. The used experimental method is described which allows for
the velocity measurement of single clusters using a time-of-flight technique.
Since this method is rather time-consuming and these measurements are typically
interfering negatively with storage ring experiments, a method for a precise
calculation of these mean velocities was needed. For this, the determined mean
cluster velocities are compared with model calculations based on an isentropic
one-dimensional van der Waals gas. Based on the obtained data and the presented
numerical calculations, a new method has been developed which allows to predict
the mean cluster velocities with an accuracy of about 5%. For this two cut-off
parameters defining positions inside the nozzle are introduced, which can be
determined for a given nozzle by only two velocity measurements.
","[{""version"":""v1"",""created"":""Fri, 5 Jul 2013 11:49:16 GMT""},{""version"":""v2"",""created"":""Mon, 6 Jan 2014 08:48:17 GMT""}]","2014-01-07"
"1307.1588","Nicholas Young","Jim Agler and N. J. Young","Symmetric functions of two noncommuting variables","18 pages",,,,"math.CV","http://arxiv.org/licenses/nonexclusive-distrib/1.0/","  We prove a noncommutative analogue of the fact that every symmetric analytic
function of $(z,w)$ in the bidisc $\D^2$ can be expressed as an analytic
function of the variables $z+w$ and $zw$. We construct an analytic nc-map $S$
from the biball to an infinite-dimensional nc-domain $\Omega$ with the property
that, for every bounded symmetric function $\ph$ of two noncommuting variables
that is analytic on the biball, there exists a bounded analytic nc-function
$\Phi$ on $\Omega$ such that $\ph=\Phi\circ S$. We also establish a realization
formula for $\Phi$, and hence for $\ph$, in terms of operators on Hilbert
space.
","[{""version"":""v1"",""created"":""Fri, 5 Jul 2013 11:52:56 GMT""}]","2013-07-08"
"1307.1589","S\'ebastien Labb\'e","S\'ebastien Labb\'e","A counterexample to a question of Hof, Knill and Simon","11 pages, 0 figures","Electronic Journal of Combinatorics 21 (2014) #P3.11","10.37236/3758",,"math.CO cs.FL","http://creativecommons.org/licenses/by/3.0/","  In this article, we give a negative answer to a question of Hof, Knill and
Simon (1995) concerning purely morphic sequences obtained from primitive
morphism containing an infinite number of palindromes. Proven for the binary
alphabet by B. Tan in 2007, we show the existence of a counterexample on the
ternary alphabet.
","[{""version"":""v1"",""created"":""Fri, 5 Jul 2013 11:58:54 GMT""}]","2020-11-17"
"1307.1590","Olivier Minazzoli","Olivier Minazzoli","Conservation laws in theories with universal gravity/matter coupling","6 pages, accepted for publication in Phys. Rev. D","Phys. Rev. D 88, 027506 (2013)","10.1103/PhysRevD.88.027506",,"gr-qc math-ph math.MP","http://arxiv.org/licenses/nonexclusive-distrib/1.0/","  In this paper, we investigate the conservation laws of different type of
particles in theories with a universal gravity/matter coupling. The result
brings new insights about previous studies on universal gravity/matter
theories. Especially, the paper demonstrates that for perfect fluids, there is
an equivalence between the assumption $\L_m=-\epsilon$, where $\epsilon$ is the
total energy density; and the assumption that the matter fluid current is
conserved ($\nabla_\sigma (\rho u^\sigma)=0$, where $\rho$ is the rest mass
density). However, the main result is given in the general case where one does
not make any assumption on the conservation of the matter fluid current.
","[{""version"":""v1"",""created"":""Fri, 5 Jul 2013 12:15:39 GMT""}]","2013-09-03"
"1307.1591","Giorgio Matt","G. Matt, S. Bianchi, A. Marinucci, M. Guainazzi, K. Iwawasa, E.
  Jimenez Bailon","X-ray observations of the Compton-thick Seyfert 2 galaxy, NGC 5643","6 pages. Accepted for publication in A&A",,"10.1051/0004-6361/201321293",,"astro-ph.HE","http://arxiv.org/licenses/nonexclusive-distrib/1.0/","  We present results from a ~55 ks long XMM-Newton observation of the obscured
AGN, NGC 5643, performed in July 2009. A previous, shorter (about 10 ks)
XMM-Newton observation in February 2003 had left two major issues open, the
nature of the hard X-ray emission (Compton-thin vs Compton-thick) and of the
soft X-ray excess (photoionized vs collisionally ionized matter). The new
observation shows that the source is Compton-thick and that the dominant
contribution to the soft X-ray emission is by photoionized matter (even if it
is still unclear whether collisionally ionized matter may contribute as well).
  We also studied three bright X-ray sources that are in the field of NGC 5643.
The ULX NGC 5643 X-1 was confirmed to be very luminous, even if more than a
factor 2 fainter than in 2003. We then provided the first high quality spectrum
of the cluster of galaxies Abell 3602. The last source, CXOJ143244.5-442020, is
likely an unobscured AGN, possibly belonging to Abell 3602.
","[{""version"":""v1"",""created"":""Fri, 5 Jul 2013 12:23:24 GMT""}]","2015-06-16"
"1307.1592","Roberto de Propris","R. De Propris, S. Phillipps and M. Bremer","Deep Luminosity Functions and Colour-Magnitude Relations for Cluster
  Galaxies at 0.2 < z < 0.6","21 pages. A series of figures for individual clusters (the full
  sample) will be made available on the MNRAS website. Accepted by MNRAS",,"10.1093/mnras/stt1262",,"astro-ph.CO","http://arxiv.org/licenses/nonexclusive-distrib/1.0/","  We derive deep $I$ band luminosity functions and colour-magnitude diagrams
from HST imaging for eleven $0.2<z<0.6$ clusters observed at various stages of
merging, and a comparison sample of five more relaxed clusters at similar
redshifts. The characteristic magnitude $M^*$ evolves passively out to $z=0.6$,
while the faint end slope of the luminosity function is $\alpha \sim -1$ at all
redshifts. Cluster galaxies must have been completely assembled down to $M_I
\sim -18$ out to $z=0.6$. We observe tight colour-magnitude relations over a
luminosity range of up to 8 magnitudes, consistent with the passive evolution
of ancient stellar populations. This is found in all clusters, irrespective of
their dynamical status (involved in a collision or not, or even within
subclusters for the same object) and suggests that environment does not have a
strong influence on galaxy properties. A red sequence luminosity function can
be followed to the limits of our photometry: we see no evidence of a weakening
of the red sequence to $z=0.6$. The blue galaxy fraction rises with redshift,
especially at fainter absolute magnitudes. We observe bright blue galaxies in
clusters at $z > 0.4$ that are not encountered locally. Surface brightness
selection effects preferentially influence the detectability of faint red
galaxies, accounting for claims of evolution at the faint end.
","[{""version"":""v1"",""created"":""Fri, 5 Jul 2013 12:25:11 GMT""}]","2015-06-16"
"1307.1593","Basmah Riaz","B. Riaz","Accretion and Outflow Activity in Brown Dwarfs","Invited review to appear in the proceedings of the conference 'Brown
  dwarfs come of age', May 20-24 2013, Memorie della Societa Astronomica
  Italiana",,,,"astro-ph.SR","http://arxiv.org/licenses/nonexclusive-distrib/1.0/","  An investigation of the magnetospheric accretion and outflow signatures in
sub-stellar objects is a natural extension of similar studies conducted on
classical T Tauri stars (CTTS), and helps understand if brown dwarfs (BDs)
follow the same formation mechanism as stars. Over the past decade, evidence
for accretion in very low-mass stars (VLMs) and BDs has been accumulated using
various techniques, which indicates that the overall accretion characteristics
are continuous across the sub-stellar boundary. Outflow activity in VLMs and
BDs has been confirmed based on spectro-astrometry of forbidden emission lines
observed in the optical, and in millimetre continuum images of CO J=2-1
emission. This review summarizes the past and current state of observational
work on accretion and outflow activity in VLMs and BDs, particularly with the
advent of new instruments such as VLT/X-Shooter which has allowed the study of
several accretion and outflow indicators over a wider wavelength range.
","[{""version"":""v1"",""created"":""Fri, 5 Jul 2013 12:28:59 GMT""}]","2013-07-08"
