"1307.1446","Kushal  Dey","Kushal Kumar Dey, Sourabh Bhattacharya","A Brief Tutorial on Transformation Based Markov Chain Monte Carlo and
  Optimal Scaling of the Additive Transformation","61 pages, 22 figures, will appear in Brazilian Journal of Probability
  and Statistics, presented at PCM Gold Medal Award presentations 2013 at
  Indian Statistical Institute, Kolkata",,,,"stat.ME","http://arxiv.org/licenses/nonexclusive-distrib/1.0/","  We consider the recently introduced Transformation-based Markov Chain Monte
Carlo (TMCMC) (Dutta and Bhattacharya (2014)), a methodology that is designed
to update all the parameters simultaneously using some simple deterministic
transformation of a onedimensional random variable drawn from some arbitrary
distribution on a relevant support. The additive transformation based TMCMC is
similar in spirit to random walk Metropolis, except the fact that unlike the
latter, additive TMCMC uses a single draw from a onedimensional proposal
distribution to update the high-dimensional parameter. In this paper, we first
provide a brief tutorial on TMCMC, exploring its connections and contrasts with
various available MCMC methods. Then we study the diffusion limits of additive
TMCMC under various set-ups ranging from the product structure of the target
density to the case where the target is absolutely continuous with respect to a
Gaussian measure; we also consider the additive TMCMC within Gibbs approach for
all the above set-ups. These investigations lead to appropriate scaling of the
one-dimensional proposal density. We also show that the optimal acceptance rate
of additive TMCMC is 0.439 under all the aforementioned set-ups, in contrast
with the well-established 0.234 acceptance rate associated with optimal random
walk Metropolis algorithms under the same set-ups. We also elucidate the
ramifications of our results and clear advantages of additive TMCMC over random
walk Metropolis with ample simulation studies and Bayesian analysis of a real,
spatial dataset with which 160 unknowns are associated.
","[{""version"":""v1"",""created"":""Thu, 4 Jul 2013 18:40:02 GMT""},{""version"":""v2"",""created"":""Thu, 26 Dec 2013 15:24:30 GMT""},{""version"":""v3"",""created"":""Sat, 28 Mar 2015 05:01:14 GMT""},{""version"":""v4"",""created"":""Tue, 15 Sep 2015 18:24:32 GMT""},{""version"":""v5"",""created"":""Thu, 27 Oct 2016 18:25:59 GMT""},{""version"":""v6"",""created"":""Mon, 23 Jan 2017 14:43:42 GMT""}]","2017-01-24"
"1307.1447","Ricardo Corr\^ea","Ricardo C. Corr\^ea and Pablo M. S. Farias","Linear Time Computation of the Maximal Linear and Circular Sums of
  Multiple Independent Insertions into a Sequence","13 pages, 4 figures, 2 tables. Accepted for journal publication",,"10.1016/j.tcs.2016.11.005",,"cs.DS","http://arxiv.org/licenses/nonexclusive-distrib/1.0/","  The maximal sum of a sequence ""A"" of ""n"" real numbers is the greatest sum of
all elements of any strictly contiguous and possibly empty subsequence of ""A"",
and it can be computed in ""O(n)"" time by means of Kadane's algorithm. Letting
""A^(x -> p)"" denote the sequence which results from inserting a real number ""x""
between elements ""A[p-1]"" and ""A[p]"", we show how the maximal sum of ""A^(x ->
p)"" can be computed in ""O(1)"" worst-case time for any given ""x"" and ""p"",
provided that an ""O(n)"" time preprocessing step has already been executed on
""A"". In particular, this implies that, given ""m"" pairs ""(x_0, p_0), ...,
(x_{m-1}, p_{m-1})"", we can compute the maximal sums of sequences ""A^(x_0 ->
p_0), ..., A^(x_{m-1} -> p_{m-1})"" in ""O(n+m)"" time, which matches the lower
bound imposed by the problem input size, and also improves on the
straightforward strategy of applying Kadane's algorithm to each sequence
""A^(x_i -> p_i)"", which takes a total of ""Theta(n.m)"" time. Our main
contribution, however, is to obtain the same time bound for the more
complicated problem of computing the greatest sum of all elements of any
strictly or circularly contiguous and possibly empty subsequence of ""A^(x ->
p)"". Our algorithms are easy to implement in practice, and they were motivated
by and find application in a buffer minimization problem on wireless mesh
networks.
","[{""version"":""v1"",""created"":""Thu, 4 Jul 2013 18:45:57 GMT""},{""version"":""v2"",""created"":""Wed, 29 Jul 2015 21:56:26 GMT""},{""version"":""v3"",""created"":""Tue, 8 Nov 2016 20:03:53 GMT""}]","2017-01-09"
"1307.1448","Paolo Di Lorenzo","Sergio Barbarossa, Stefania Sardellitti, Paolo Di Lorenzo","Distributed Detection and Estimation in Wireless Sensor Networks","92 pages, 24 figures. To appear in E-Reference Signal Processing, R.
  Chellapa and S. Theodoridis, Eds., Elsevier, 2013",,,,"cs.DC cs.IT math.IT","http://arxiv.org/licenses/nonexclusive-distrib/1.0/","  In this article we consider the problems of distributed detection and
estimation in wireless sensor networks. In the first part, we provide a general
framework aimed to show how an efficient design of a sensor network requires a
joint organization of in-network processing and communication. Then, we recall
the basic features of consensus algorithm, which is a basic tool to reach
globally optimal decisions through a distributed approach. The main part of the
paper starts addressing the distributed estimation problem. We show first an
entirely decentralized approach, where observations and estimations are
performed without the intervention of a fusion center. Then, we consider the
case where the estimation is performed at a fusion center, showing how to
allocate quantization bits and transmit powers in the links between the nodes
and the fusion center, in order to accommodate the requirement on the maximum
estimation variance, under a constraint on the global transmit power. We extend
the approach to the detection problem. Also in this case, we consider the
distributed approach, where every node can achieve a globally optimal decision,
and the case where the decision is taken at a central node. In the latter case,
we show how to allocate coding bits and transmit power in order to maximize the
detection probability, under constraints on the false alarm rate and the global
transmit power. Then, we generalize consensus algorithms illustrating a
distributed procedure that converges to the projection of the observation
vector onto a signal subspace. We then address the issue of energy consumption
in sensor networks, thus showing how to optimize the network topology in order
to minimize the energy necessary to achieve a global consensus. Finally, we
address the problem of matching the topology of the network to the graph
describing the statistical dependencies among the observed variables.
","[{""version"":""v1"",""created"":""Thu, 4 Jul 2013 18:51:36 GMT""},{""version"":""v2"",""created"":""Fri, 5 Jul 2013 14:35:38 GMT""}]","2013-07-08"
"1307.1449","Douglas Mons\^ores","Douglas Mons\^ores","Toric Birational Geometry and Applications to Lattice Polytopes","Ph.D. Thesis",,,,"math.AG","http://arxiv.org/licenses/nonexclusive-distrib/1.0/","  Toric geometry provides a bridge between the theory of polytopes and
algebraic geometry: one can associate to each lattice polytope a polarized
toric variety. In this thesis we explore this correspondence to classify smooth
lattice polytopes having small degree, extending a classification provided by
Dickenstein, Di Rocco and Piene. Our approach consists in interpreting the
degree of a polytope as a geometric invariant of the corresponding polarized
variety, and then applying techniques from Adjunction Theory and Mori Theory.
In the opposite direction, we use the combinatorics of fans to describe the
extremal rays of several cones of cycles of a projective toric variety X. One
of these cones is the cone of moving curves, that is the closure of the cone
generated by classes of curves moving in a family that sweeps out X. This cone
plays an important role in the problem of birational classification of
projective varieties.
","[{""version"":""v1"",""created"":""Thu, 4 Jul 2013 18:53:33 GMT""}]","2013-07-05"
"1307.1450","Hao-Ning He","Hao-Ning He, Rui-Zhi Yang, Yi-Zhong Fan and Da-Ming Wei","TeV-PeV neutrinos over the atmospheric background: originating from two
  groups of sources?","5 pages, 1 figure",,,,"astro-ph.HE","http://arxiv.org/licenses/nonexclusive-distrib/1.0/","  In addition to the two ~1 PeV neutrinos, the IceCube Collaboration recently
reported a detection of 26 neutrino candidates at energies from 30 TeV to 250
TeV, implying a confidence level of 4.3\sigma over the atmospheric background.
We suggest that these TeV-PeV non-atmospheric neutrinos may originate from two
groups of sources, motivated by the non-detection of neutrinos in the energy
range 250 TeV- 1 PeV in current data. If intrinsic, the non-detection of 250
TeV-1 PeV neutrinos disfavors the single power-law spectrum model for the
TeV-PeV non-atmospheric neutrinos at a confidence level of ~ 2\sigma. We then
interpret the current neutrino data with a two-component spectrum model. One
has a flat spectrum with a cutoff at the energy ~ 250 TeV and the other has a
sharp peak at ~1 PeV. The former is likely via pp collision while the latter
may be generated by the photomeson interaction.
","[{""version"":""v1"",""created"":""Thu, 4 Jul 2013 18:59:39 GMT""}]","2013-07-05"
"1307.1451","Akaki Rusetsky","A. Agadjanov (Bonn University and SANGU), D. Agadjanov (Bonn
  University and SANGU), A. Khelashvili (Tbilisi State University and SANGU),
  A. Rusetsky (Bonn University)","Generating functional of ChPT at one loop for non-minimal operators","14 pages",,,,"hep-ph","http://arxiv.org/licenses/nonexclusive-distrib/1.0/","  The divergent part of the one-loop effective action in Chiral Perturbation
Theory with virtual photons has been evaluated in an arbitrary covariant gauge.
The differential operator, that emerges in the functional determinant, is of a
non-minimal type, for which the standard heat kernel methods are not directly
applicable. Both SU(2) and SU(3) cases have been worked out. A comparison with
existing results in the literature is given.
","[{""version"":""v1"",""created"":""Thu, 4 Jul 2013 19:00:19 GMT""}]","2013-07-05"
"1307.1452","Igor Salom","Igor Salom","Role of the orthogonal group in construction of osp(1|2n)
  representations","17 pages",,,,"math-ph hep-th math.MP quant-ph","http://arxiv.org/licenses/nonexclusive-distrib/1.0/","  It is well known that the symmetric group has an important role (via Young
tableaux formalism) both in labelling of the representations of the unitary
group and in construction of the corresponding basis vectors (in the tensor
product of the defining representations). We show that orthogonal group has a
very similar role in the context of positive energy representations of
osp(1|2n,R). In the language of parabose algebra, we essentially solve the long
standing problem of reducibility of Green's ansatz representations.
","[{""version"":""v1"",""created"":""Thu, 4 Jul 2013 19:07:44 GMT""}]","2013-07-05"
"1307.1453","Evgeny Polyachenko","E. V. Polyachenko, V. L. Polyachenko, I. G. Shukhman","Equilibrium models of radially anisotropic spherical stellar systems
  with softened central potentials","11 pages, 11 figures, 1 table; accepted to MNRAS",,"10.1093/mnras/stt1236",,"astro-ph.GA","http://arxiv.org/licenses/nonexclusive-distrib/1.0/","  We study a new class of equilibrium two-parametric distribution functions of
spherical stellar systems with radially anisotropic velocity distribution of
stars. The models are less singular counterparts of the so called generalized
polytropes, widely used in works on equilibrium and stability of gravitating
systems in the past. The offered models, unlike the generalized polytropes,
have finite density and potential in the center. The absence of the singularity
is necessary for proper consideration of the radial orbit instability, which is
the most important instability in spherical stellar systems. Comparison of the
main observed parameters (potential, density, anisotropy) predicted by the
present models and other popular equilibrium models is provided.
","[{""version"":""v1"",""created"":""Thu, 4 Jul 2013 19:12:39 GMT""},{""version"":""v2"",""created"":""Fri, 5 Jul 2013 07:26:03 GMT""}]","2015-06-16"
"1307.1454","Ravi Kunjwal","Rajeev Singh, Ravi Kunjwal, R. Simon","Relative volume of separable bipartite states","Essentially the published version","Phys. Rev. A 89, 022308 (2014)","10.1103/PhysRevA.89.022308",,"quant-ph","http://arxiv.org/licenses/nonexclusive-distrib/1.0/","  Every choice of an orthonormal frame in the d-dimensional Hilbert space of a
system corresponds to one set of all mutually commuting density matrices or,
equivalently, a classical statistical state space of the system; the quantum
state space itself can thus be profitably viewed as an SU(d) orbit of classical
state spaces, one for each orthonormal frame. We exploit this connection to
study the relative volume of separable states of a bipartite quantum system.
While the two-qubit case is studied in considerable analytic detail, for higher
dimensional systems we fall back on Monte Carlo. Several new insights seem to
emerge from our study.
","[{""version"":""v1"",""created"":""Thu, 4 Jul 2013 19:20:36 GMT""},{""version"":""v2"",""created"":""Wed, 19 Aug 2015 14:08:04 GMT""}]","2015-08-20"
"1307.1455","Tomas Persson","Tomas Persson","A Note on Random Coverings of Tori","4 pages, The definitions of E_k and mu_k have been corrected",,"10.1112/blms/bdu087",,"math.PR math.CA","http://arxiv.org/licenses/nonexclusive-distrib/1.0/","  This note provides a generalisation of a recent result by J\""arvenp\""a\""a,
J\""arvenp\""a\""a, Koivusalo, Li, and Suomala, (to appear), on the dimension of
limsup-sets of random coverings of tori. The result in this note is stronger in
the sense that it provides also a large intersection property of the
limsup-sets, the assumptions are weaker, and it implies the result of
J\""arvenp\""a\""a, J\""arvenp\""a\""a, Koivusalo, Li, and Suomala as a special case.
The proof is based on a recent result by Persson and Reeve from 2013.
","[{""version"":""v1"",""created"":""Thu, 4 Jul 2013 19:22:42 GMT""},{""version"":""v2"",""created"":""Mon, 7 Apr 2014 07:46:27 GMT""}]","2015-06-12"
"1307.1456","Claudianor Alves","Claudianor O. Alves and Dragos-Patru Covei","Existence of blow-up solutions for a class of elliptic system with
  convection term","Revised version",,,,"math.AP","http://arxiv.org/licenses/nonexclusive-distrib/1.0/","  The present paper concerns with the existence of blow-up solution for a class
of elliptic system with convection term. Here, we prove a result involving sub
and supersolution for a class of elliptic system whose nonlinearity can depend
of the gradient of the solution. This result permits to study the existence of
blow-up solution for a large class of systems.
","[{""version"":""v1"",""created"":""Thu, 4 Jul 2013 19:27:13 GMT""},{""version"":""v2"",""created"":""Sun, 9 Feb 2014 18:23:09 GMT""}]","2014-02-11"
"1307.1457","El Hadi Sadki","E. S. Sadki, H. Okazaki, T. Watanabe, T. Yamaguchi, Y. Takano","Temperature Dependence of the Electrical Transport Properties of
  Multilayer Graphene",,"Nano Studies, 2013, 7, 71-76",,,"cond-mat.mes-hall cond-mat.supr-con","http://arxiv.org/licenses/nonexclusive-distrib/1.0/","  Multilayer graphene (MLG) thin films are deposited on silicon oxide
substrates by mechanical exfoliation (or 'scotch-tape method') from Kish
graphite. The thickness and number of layers are determined from both Atomic
Force Microscopy (AFM) and Raman Spectroscopy. Electrical terminals are
deposited on MLGs in a four-probe configuration by electron-beam lithography,
gold/titanium thermal evaporation, and lift-off. The electrical resistance is
measured from room temperature down to 2 K. The electrical resistance of the
MLGs shows an increase with decreasing temperature, and then decreases after
reaching a maximum value. These results are compared with recent experimental
and theoretical data from the literature.
","[{""version"":""v1"",""created"":""Thu, 4 Jul 2013 19:33:21 GMT""},{""version"":""v2"",""created"":""Mon, 22 Jul 2013 18:46:19 GMT""},{""version"":""v3"",""created"":""Sat, 23 Aug 2014 14:19:27 GMT""}]","2014-08-26"
"1307.1458","Doroteo Mendoza","J. L. Ben\'itez and D. Mendoza","Modulation of the Optical Transmittance in Multilayer Graphene by an
  Electrical Signal","9 pages, 7 figures","An adapted version is published in: Appl. Phys. Lett.
  103(2013)083116","10.1063/1.4819466",,"cond-mat.mes-hall","http://arxiv.org/licenses/nonexclusive-distrib/1.0/","  The modulation of the optical transmittance in multilayer graphene by means
of an electrical signal in the simple configuration of coplanar electrodes is
reported. Besides the fundamental frequency of modulation, higher harmonics
also appear in the transmitted signal. Modulation is also observed in the
optical reflectance. The modulation of the optical properties in multilayer
graphene by electrical signals may be useful for the transmission of
information by optical means.
","[{""version"":""v1"",""created"":""Thu, 4 Jul 2013 19:36:51 GMT""}]","2013-08-26"
"1307.1459","Enea Di Dio","Enea Di Dio, Francesco Montanari, Julien Lesgourgues and Ruth Durrer","The CLASSgal code for Relativistic Cosmological Large Scale Structure","24 pages, 5 figures, few typos in published version corrected, code
  available at http://cosmology.unige.ch/tools","JCAP 11 (2013) 044","10.1088/1475-7516/2013/11/044","LAPTH-036/13, CERN-PH-TH/2013-154","astro-ph.CO","http://arxiv.org/licenses/nonexclusive-distrib/1.0/","  We present some accurate and efficient computations of large scale structure
observables, obtained with a modified version of the CLASS code which is made
publicly available. This code includes all relativistic corrections and
computes both the power spectrum Cl(z1,z2) and the corresponding correlation
function xi(theta,z1,z2) in linear perturbation theory. For Gaussian initial
perturbations, these quantities contain the full information encoded in the
large scale matter distribution at the level of linear perturbation theory. We
illustrate the usefulness of our code for cosmological parameter estimation
through a few simple examples.
","[{""version"":""v1"",""created"":""Thu, 4 Jul 2013 19:43:40 GMT""},{""version"":""v2"",""created"":""Wed, 28 Aug 2013 15:18:54 GMT""},{""version"":""v3"",""created"":""Thu, 21 Nov 2013 09:47:20 GMT""},{""version"":""v4"",""created"":""Fri, 1 Apr 2016 13:10:01 GMT""}]","2016-04-04"
"1307.1460","Carlos Eduardo Pellicer de Oliveira","E. Abdalla, Jeferson de Oliveira, A. B. Pavan, C. E. Pellicer","Holographic Phase Transitions in (2+1)-dimensional black hole spacetimes
  in NMG","19 pages, 36 figures",,,,"hep-th","http://arxiv.org/licenses/nonexclusive-distrib/1.0/","  In this work we aim at the question of holographic phase transitions in two
dimensional systems with Lifshitz scaling. We consider the gravity side
candidate for a dual description as the black hole solution of New Massive
Gravity (NMG) with Lifshitz scaling. We discuss the effects due to the Lifshitz
scaling in the AGGH (Ayon-Beato-Garbarz-Giribet-Hassa\""i{\i}ne) solution in
comparison with the BTZ (Ba\~nados-Teitelboim-Zanelli) black hole. Likewise, we
compute the order parameter and it indicates a second order phase transition in
a (1+1) dimension Lifshitz boundary.
","[{""version"":""v1"",""created"":""Thu, 4 Jul 2013 19:47:22 GMT""},{""version"":""v2"",""created"":""Wed, 10 Jul 2013 17:52:00 GMT""},{""version"":""v3"",""created"":""Wed, 14 Jul 2021 12:13:02 GMT""},{""version"":""v4"",""created"":""Thu, 15 Jul 2021 17:20:25 GMT""},{""version"":""v5"",""created"":""Fri, 16 Jul 2021 12:36:57 GMT""}]","2021-07-19"
"1307.1461","Sung Ho Chae","Sung Ho Chae, Changho Suh, and Sae-Young Chung","Degrees of Freedom of the Rank-deficient Interference Channel with
  Feedback","The material in this paper will be presented in part at the IEEE
  International Symposium on Information Theory (ISIT) 2013 and was in part
  submitted to the Allerton Conference on Communication, Control, and Computing
  2013",,"10.1109/TIT.2015.2428233",,"cs.IT math.IT","http://arxiv.org/licenses/nonexclusive-distrib/1.0/","  We investigate the total degrees of freedom (DoF) of the K-user
rank-deficient interference channel with feedback. For the two-user case, we
characterize the total DoF by developing an achievable scheme and deriving a
matching upper bound. For the three-user case, we develop a new achievable
scheme which employs interference alignment to efficiently utilize the
dimension of the received signal space. In addition, we derive an upper bound
for the general K-user case and show the tightness of the bound when the number
of antennas at each node is sufficiently large. As a consequence of these
results, we show that feedback can increase the DoF when the number of antennas
at each node is large enough as compared to the ranks of channel matrices. This
finding is in contrast to the full-rank interference channel where feedback
provides no DoF gain. The gain comes from using feedback to provide alternative
signal paths, thereby effectively increasing the ranks of desired channel
matrices.
","[{""version"":""v1"",""created"":""Thu, 4 Jul 2013 19:49:24 GMT""},{""version"":""v2"",""created"":""Fri, 5 Jul 2013 05:50:15 GMT""}]","2016-11-17"
"1307.1462","Yuri Shvyd'ko","Yuri P. Stetsko, Yuri V. Shvyd'ko, G. Brian Stephenson","Time-delayed beam splitting with energy separation of x-ray channels",,"Applied Physics Letters 103 (2013) 173508","10.1063/1.4826251",,"physics.optics","http://arxiv.org/licenses/nonexclusive-distrib/1.0/","  We introduce a time-delayed beam splitting method based on the energy
separation of x-ray photon beams. It is implemented and theoretically
substantiated on an example of an x-ray optical scheme similar to that of the
classical Michelson interferometer. The splitter/mixer uses Bragg-case
diffraction from a thin diamond crystal. Another two diamond crystals are used
as back-reflectors. For energy separation the back-reflectors are set at
slightly different temperatures and angular deviations from exact
backscattering. Because of energy separation and a minimal number (three) of
optical elements, the split-delay line has high efficiency and is simple to
operate. Due to the high transparency of diamond crystal, the split-delay line
can be used in a beam sharing mode at x-ray free-electron laser facilities. The
delay line can be made more compact by adding a fourth crystal.
","[{""version"":""v1"",""created"":""Thu, 4 Jul 2013 19:52:05 GMT""}]","2013-11-26"
"1307.1463","Sam Azadi","S. Azadi, W. M. C. Foulkes, and T. D. Kuehne","Quantum Monte Carlo Study of High Pressure Solid Molecular Hydrogen",,"New Journal of Physics 15, 113005 (2013)","10.1088/1367-2630/15/11/113005",,"cond-mat.mtrl-sci","http://arxiv.org/licenses/nonexclusive-distrib/1.0/","  We use the diffusion quantum Monte Carlo (DMC) method to calculate the ground
state phase diagram of solid molecular hydrogen and examine the stability of
the most important insulating phases relative to metallic crystalline molecular
hydrogen. We develop a new method to account for finite-size errors by
combining the use of twist-averaged boundary conditions with corrections
obtained using the Kwee-Zhang-Krakauer (KZK) functional in density functional
theory. To study band-gap closure and find the metallization pressure, we
perform accurate quasi-particle many-body calculations using the $GW$ method.
In the static approximation, our DMC simulations indicate a transition from the
insulating Cmca-12 structure to the metallic Cmca structure at around 375 GPa.
The $GW$ band gap of Cmca-12 closes at roughly the same pressure. In the
dynamic DMC phase diagram, which includes the effects of zero-point energy, the
Cmca-12 structure remains stable up to 430 GPa, well above the pressure at
which the $GW$ band gap closes. Our results predict that the semimetallic state
observed experimentally at around 360 GPa [Phys. Rev. Lett. {\bf 108}, 146402
(2012)] may correspond to the Cmca-12 structure near the pressure at which the
band gap closes. The dynamic DMC phase diagram indicates that the hexagonal
close packed $P6_3/m$ structure, which has the largest band gap of the
insulating structures considered, is stable up to 220 GPa. This is consistent
with recent X-ray data taken at pressures up to 183 GPa [Phys. Rev. B {\bf 82},
060101(R) (2010)], which also reported a hexagonal close packed arrangement of
hydrogen molecules.
","[{""version"":""v1"",""created"":""Thu, 4 Jul 2013 19:52:21 GMT""}]","2015-06-16"
"1307.1464","Jens Wirth","Michael Ruzhansky and Jens Wirth","Global functional calculus for operators on compact Lie groups","23 pages; minor corrections","Journal of Functional Analysis, 267 (2014) 144--172","10.1016/j.jfa.2014.04.009",,"math.FA","http://arxiv.org/licenses/nonexclusive-distrib/1.0/","  In this paper we develop the functional calculus for elliptic operators on
compact Lie groups without the assumption that the operator is a classical
pseudo-differential operator. Consequently, we provide a symbolic descriptions
of complex powers of such operators. As an application, we give a constructive
symbolic proof of the G\r{a}rding inequality for operators in
$(\rho,\delta)$-classes in the setting of compact Lie groups.
","[{""version"":""v1"",""created"":""Thu, 4 Jul 2013 19:52:58 GMT""},{""version"":""v2"",""created"":""Mon, 24 Feb 2014 09:59:46 GMT""}]","2014-05-15"
