"1307.1497","Bang-Yen Chen","Bang-Yen Chen, Franki Dillen, Joeri Van der Veken and Luc Vrancken","Curvature inequalities for Lagrangian submanifolds: the final solution","15 pages",,,,"math.DG","http://arxiv.org/licenses/nonexclusive-distrib/1.0/","  Let $M$ be an $n$-dimensional Lagrangian submanifold of a complex space form.
We prove a pointwise inequality $$\delta(n_1,\ldots,n_k) \leq
a(n,k,n_1,\ldots,n_k) \|H\|^2 + b(n,k,n_1,\ldots,n_k)c,$$ with on the left hand
side any delta-invariant of the Riemannian manifold $M$ and on the right hand
side a linear combination of the squared mean curvature of the immersion and
the constant holomorphic sectional curvature of the ambient space. The
coefficients on the right hand side are optimal in the sence that there exist
non-minimal examples satisfying equality at at least one point. We also
characterize those Lagrangian submanifolds satisfying equality at any of their
points. Our results correct and extend those given in [B.-Y. Chen and F.
Dillen, Optimal general inequalities for Lagrangian submanifolds in complex
space forms, J. Math. Anal. Appl. 379 (2011), 229--239].
","[{""version"":""v1"",""created"":""Thu, 4 Jul 2013 22:47:53 GMT""}]","2013-07-08"
"1307.1498","Barry Sanders","Barry C. Sanders","Efficient Algorithms for Universal Quantum Simulation",,"5th International Conference on Reversible Computation (RC 2013),
  Victoria, BC, Canada, July 4-5, 2013. Proceedings. Lecture Notes in Computer
  Science Volume 7948, 2013, pp 1-10","10.1007/978-3-642-38986-3_1",,"quant-ph","http://arxiv.org/licenses/nonexclusive-distrib/1.0/","  A universal quantum simulator would enable efficient simulation of quantum
dynamics by implementing quantum-simulation algorithms on a quantum computer.
Specifically the quantum simulator would efficiently generate qubit-string
states that closely approximate physical states obtained from a broad class of
dynamical evolutions. I provide an overview of theoretical research into
universal quantum simulators and the strategies for minimizing computational
space and time costs. Applications to simulating many-body quantum simulation
and solving linear equations are discussed.
","[{""version"":""v1"",""created"":""Thu, 4 Jul 2013 22:59:40 GMT""}]","2013-07-08"
"1307.1499","Kazuhiro Takemoto","Kazuhiro Takemoto, Kaori Kihara","Modular organization of cancer signaling networks is associated with
  patient survivability","17 pages, 5 figures","Biosystems 113, 149-154 (2013)","10.1016/j.biosystems.2013.06.003",,"q-bio.MN","http://arxiv.org/licenses/nonexclusive-distrib/1.0/","  Molecular signaling networks are believed to determine cancer robustness.
Although cancer patient survivability was reported to correlate with the
heterogeneous connectivity of the signaling networks inspired by theoretical
studies on the increase of network robustness due to the heterogeneous
connectivity, other theoretical and data analytic studies suggest an
alternative explanation: the impact of modular organization of networks on
biological robustness or adaptation to changing environments. In this study,
thus, we evaluate whether the modularity--robustness hypothesis is applicable
to cancer using network analysis. We focus on 14 specific cancer types whose
molecular signaling networks are available in databases, and show that modular
organization of cancer signaling networks is associated with the patient
survival rate. In particular, the cancers with less modular signaling networks
are more curable. This result is consistent with a prediction from the
modularity--robustness hypothesis. Furthermore, we show that the network
modularity is a better descriptor of the patient survival rate than the
heterogeneous connectivity. However, these results do not contradict the
importance of the heterogeneous connectivity. Rather, they provide new and
different insights into the relationship between cellular networks and cancer
behaviors. Despite several limitations of data analysis, these findings enhance
our understanding of adaptive and evolutionary mechanisms of cancer cells.
","[{""version"":""v1"",""created"":""Thu, 4 Jul 2013 23:24:13 GMT""}]","2013-07-18"
"1307.1500","Taro Inagawa","Taro Inagawa","*-transforms of acyclic complexes","13 pages. arXiv admin note: substantial text overlap with
  arXiv:1211.0738",,,,"math.AC","http://arxiv.org/licenses/nonexclusive-distrib/1.0/","  Let R be an n-dimensional Cohen-Macaulay local ring and Q a parameter ideal
of R. Suppose that an acyclic complex (F_{\bullet}, \varphi_{\bullet}) of
length n of finitely generated free R-modules is given. We put M = Im
\varphi_{1}, which is an R-submodule of F_{0}. Then F_{\bullet} is an R-free
resolution of F_{0}/M. In this paper, we describe a concrete procedure to get
an acyclic complex of length n that resolves F_{0}/(M : Q).
","[{""version"":""v1"",""created"":""Fri, 5 Jul 2013 00:30:36 GMT""},{""version"":""v2"",""created"":""Thu, 12 Dec 2013 03:34:40 GMT""}]","2013-12-13"
"1307.1501","Philippe  Soulier","Rafal Kulik and Philippe Soulier","Heavy tailed time series with extremal independence","Revised version",,,,"math.ST q-fin.RM stat.TH","http://arxiv.org/licenses/nonexclusive-distrib/1.0/","  We consider strictly stationary heavy tailed time series whose
finite-dimensional exponent measures are concentrated on axes, and hence their
extremal properties cannot be tackled using classical multivariate regular
variation that is suitable for time series with extremal dependence. We recover
relevant information about limiting behavior of time series with extremal
independence by introducing a sequence of scaling functions and conditional
scaling exponent. Both quantities provide more information about joint extremes
than a widely used tail dependence coefficient. We calculate the scaling
functions and the scaling exponent for variety of models, including Markov
chains, exponential autoregressive model, stochastic volatility with heavy
tailed innovations or volatility.
","[{""version"":""v1"",""created"":""Fri, 5 Jul 2013 00:37:52 GMT""},{""version"":""v2"",""created"":""Thu, 9 Oct 2014 14:18:05 GMT""}]","2014-10-10"
"1307.1502","Yegor Zenkevich","A. Mironov, A. Morozov, B. Runov, Y. Zenkevich, A. Zotov","Spectral dualities in XXZ spin chains and five dimensional gauge
  theories","9 pages, minor corrections, reference added","JHEP 1312 (2013) 034","10.1007/JHEP12(2013)034","FIAN-TD-12-13, ITEP-TH-24-13","hep-th math-ph math.MP nlin.SI","http://arxiv.org/licenses/nonexclusive-distrib/1.0/","  Motivated by recent progress in the study of supersymmetric gauge theories we
propose a very compact formulation of spectral duality between XXZ spin chains.
The action of the quantum duality is given by the Fourier transform in the
spectral parameter. We investigate the duality in various limits and, in
particular, prove it for q-->1, i.e. when it reduces to the XXX/Gaudin duality.
We also show that the universal difference operators are given by the normal
ordering of the classical spectral curves.
","[{""version"":""v1"",""created"":""Fri, 5 Jul 2013 00:47:58 GMT""},{""version"":""v2"",""created"":""Mon, 23 Sep 2013 09:31:12 GMT""}]","2014-02-18"
"1307.1503","Martin Gugat","Martin Gugat","On Optimized Feedback Control and the Robustification of Opimal Controls",,,,,"math.OC","http://arxiv.org/licenses/nonexclusive-distrib/1.0/","  We consider a system that is exactly controllable. For given initial state,
terminal state and objective function, an optimal control is often
well-defined. Such an optimal control has the disadvantage that although it
works perfectly well for the given initial state, for a perturbed initial state
it often does not make sense. In this talk we present a concept to obtain
robust control schemes by the combination of the optimal control with a
stabilizing feedback law. In this way, also for perturbed initial states the
system is controlled in a reasonable way. In the talk we focus on the boundary
control of the wave equation. However, our concept is applicable to the control
of general time-dependent systems.
","[{""version"":""v1"",""created"":""Fri, 5 Jul 2013 00:54:26 GMT""}]","2013-07-08"
"1307.1504","Laura Paulucci","L Paulucci, E J Ferrer, J E Horvath and V de la Incera","Bag vs. NJL models for color-flavor-locked strange quark matter","7 pages, 3 figures, to appear in Journal Physics G","J. Phys. G: Nucl. Part. Phys. 40 125202, 2013","10.1088/0954-3899/40/12/125202",,"nucl-th astro-ph.SR","http://arxiv.org/licenses/nonexclusive-distrib/1.0/","  We compare the mass-radius relationship of strange stars obtained in two
theoretical frameworks describing the color-flavor-locking state of dense quark
matter: The semi-empirical MIT model and a self-consistent approach using the
Nambu-Jona-Lasinio (NJL) model. In the simplest MIT model extended to include
pairing, one can make the equation of state stiffer by increasing the gap
parameter so that larger maximum masses for these objects can be reached. In
the NJL model, however, such an effect is not possible. To increase the gap
parameter within the NJL model to values comparable to those considered in the
MIT case, a noticeably increase of the diquark-coupling-constant strength is
needed, but this in turn softens the equation of state producing a lower
maximum star mass. This behaviour is interpreted as signalling the system
crossover at high diquark coupling from a BCS regime to a BEC one, a process
that cannot be reproduced within the simple MIT prescription.
","[{""version"":""v1"",""created"":""Fri, 5 Jul 2013 01:09:52 GMT""},{""version"":""v2"",""created"":""Thu, 14 Nov 2013 19:46:26 GMT""}]","2013-11-21"
"1307.1505","Edson de Faria","Edson de Faria and Charles Tresser","Equidistribution of digits in powers and Diophantine approximations","This paper has been withdrawn by the authors because its main result
  becomes trivial due to a much simpler argument",,,,"math.DS","http://arxiv.org/licenses/nonexclusive-distrib/1.0/","  Given integers $a,b>1$ with $\log_b{a}$ irrational, we investigate the
connection between the conjectured asymptotic equidistribution of digits in the
base-$b$ expansion of $a^n$ and the (non-)Diophantine properties of the number
$\theta_{a,b}=\log_b{a}$.
","[{""version"":""v1"",""created"":""Fri, 5 Jul 2013 01:18:31 GMT""},{""version"":""v2"",""created"":""Wed, 4 Mar 2015 15:20:24 GMT""}]","2015-03-05"
"1307.1506","Nicolae Panoiu","Spyros Lavdas, Jeffrey B. Driscoll, Hongyi Jiang, Richard R. Grote,
  Richard M. Osgood, Jr., and Nicolae C. Panoiu","Generation of parabolic similaritons in tapered silicon photonic wires:
  comparison of pulse dynamics at telecom and mid-IR wavelengths","4 pages, 5 figures",,"10.1364/OL.38.003953",,"physics.optics","http://arxiv.org/licenses/nonexclusive-distrib/1.0/","  We study the generation of parabolic self-similar optical pulses in tapered
Si photonic nanowires (Si-PhNWs) both at telecom (\lambda=1.55 \mu m) and
mid-IR (\lambda=2.2 \mu m) wavelengths. Our computational study is based on a
rigorous theoretical model, which fully describes the influence of linear and
nonlinear optical effects on pulse propagation in Si-PhNWs with arbitrarily
varying width. Numerical simulations demonstrate that, in the normal dispersion
regime, optical pulses evolve naturally into parabolic pulses upon propagating
in millimeter-long tapered Si-PhNWs, with the efficiency of this pulse
reshaping process being strongly dependent on the spectral and pulse parameter
regime in which the device operates, as well as the particular shape of the
Si-PhNW.
","[{""version"":""v1"",""created"":""Fri, 5 Jul 2013 01:38:03 GMT""}]","2013-10-02"
"1307.1507","Huiping Geng Ms.","Huiping Geng and Zhen Guo","Uncoupled achromatic condition of a dog-leg system with the presence of
  RF cavities",,,"10.1088/1674-1137/38/6/067001",,"physics.acc-ph","http://arxiv.org/licenses/nonexclusive-distrib/1.0/","  To merge the beam from either of the two injectors to the main linac, a
dog-leg system will be employed in the second Medium Energy Beam Transport
(MEBT2) line of the China ADS driving accelerator. The achromatic condition has
to be guaranteed to avoid beam center excursion against energy jitter. RF
cavities were found indispensable to control the bunch length growth in the
dog-leg system of MEBT2. The full uncoupling between transverse and
longitudinal plane is desired to minimize the growth of projected rms
emittances. The uncoupled achromatic condition of this dogleg system with the
presence of RF bunching cavities will be deduced using the method of transfer
matrixes. It is found that to fulfil the uncoupling condition, the distance
between the bunching cavities is uniquely determined by the maximum energy gain
of the RF cavities. The theoretical analysis is verified by the simulation code
TraceWin. The space charge effect on the uncoupled achromatic condition and the
beam emittance growth will also be discussed.
","[{""version"":""v1"",""created"":""Fri, 5 Jul 2013 01:54:42 GMT""}]","2015-06-16"
"1307.1508","Zhong  Chen","Zhong Chen, Feifei Gao, Zhenwei Zhang, James C. F. Li, and Ming Lei","Multiple-Level Power Allocation Strategy for Secondary Users in
  Cognitive Radio Networks","12 pages",,"10.1186/1687-6180-2014-51",,"cs.IT math.IT","http://arxiv.org/licenses/nonexclusive-distrib/1.0/","  In this paper, we propose a multiple-level power allocation strategy for the
secondary user (SU) in cognitive radio (CR) networks. Different from the
conventional strategies, where SU either stays silent or transmit with a
constant/binary power depending on the busy/idle status of the primary user
(PU), the proposed strategy allows SU to choose different power levels
according to a carefully designed function of the receiving energy. The way of
the power level selection is optimized to maximize the achievable rate of SU
under the constraints of average transmit power at SU and average interference
power at PU. Simulation results demonstrate that the proposed strategy can
significantly improve the performance of SU compared to the conventional
strategies.
","[{""version"":""v1"",""created"":""Fri, 5 Jul 2013 01:59:21 GMT""},{""version"":""v2"",""created"":""Thu, 12 Dec 2013 11:56:52 GMT""}]","2015-06-16"
"1307.1509","Thomas Primer","Thomas Primer, Waseem Kamleh, Derek Leinweber and Matthias Burkardt","Magnetic properties of the nucleon in a uniform background field","9 pages, 14 figures, 2 tables","Phys. Rev. D 89, 034508 (2014)","10.1103/PhysRevD.89.034508",,"hep-lat","http://arxiv.org/licenses/nonexclusive-distrib/1.0/","  We present results for the magnetic moment and magnetic polarisability of the
neutron and the magnetic moment of the proton. These results are calculated
using the uniform background field method on 32^3 x 64 dynamical QCD lattices
provided by the PACS-CS collaboration as part of the ILDG. We use a uniform
background magnetic field quantised by the periodic spatial volume. We
investigate ways to improve the effective energy plots used to calculate
magnetic polarisabilities, including the use of correlation matrix techniques
with various source smearings.
","[{""version"":""v1"",""created"":""Fri, 5 Jul 2013 02:18:41 GMT""}]","2014-03-05"
"1307.1510","Chiang-Mei Chen","Chiang-Mei Chen, Jian-Liang Liu, James M. Nester, Gang Sun","A Reference for the Gravitational Hamiltonian Boundary Term","4 pages",,,,"gr-qc","http://arxiv.org/licenses/nonexclusive-distrib/1.0/","  The Hamiltonian for physical systems and dynamic geometry generates the
evolution of a spatial region along a vector field. It includes a boundary term
which not only determines the value of the Hamiltonian, but also, via the
boundary term in the variation of the Hamiltonian, the boundary conditions. The
value of the Hamiltonian comes from its boundary term; it gives the quasi-local
quantities: energy-momentum and angular-momentum/center-of-mass. This boundary
term depends not only on the dynamical variables but also on their reference
values; these reference values determine the ground state---the state having
vanishing quasi-local quantities. Here our concern is how to select on the
two-boundary the reference values. To determine the ""best matched"" reference
metric and connection values for our preferred boundary term for Einstein's
general relativity, we propose on the boundary two-surface (i) \emph{four
dimensional} isometric matching, and (ii) extremizing the value of the energy.
","[{""version"":""v1"",""created"":""Fri, 5 Jul 2013 02:26:19 GMT""}]","2013-07-08"
"1307.1511","Mihaly Kovacs Dr","Mih\'aly Kov\'acs and Jacques Printems","Weak convergence of a fully discrete approximation of a linear
  stochastic evolution equation with a positive-type memory term",,"J. Math. Anal. Appl., 413 (2014), 939-952",,,"math.PR","http://arxiv.org/licenses/nonexclusive-distrib/1.0/","  In this paper we are interested in the numerical approximation of the
marginal distributions of the Hilbert space valued solution of a stochastic
Volterra equation driven by an additive Gaussian noise. This equation can be
written in the abstract It\^o form as $$ \dd X(t) + \left (\int_0^t b(t-s) A
X(s) \, \dd s \right) \, \dd t = \dd W^{_Q}(t), t\in (0,T]; ~ X(0) =X_0\in H,
$$ \noindent where $W^Q$ is a $Q$-Wiener process on the Hilbert space $H$ and
where the time kernel $b$ is the locally integrable potential $t^{\rho-2}$,
$\rho \in (1,2)$, or slightly more general. The operator $A$ is unbounded,
linear, self-adjoint, and positive on $H$. Our main assumption concerning the
noise term is that $A^{(\nu- 1/\rho)/2} Q^{1/2}$ is a Hilbert-Schmidt operator
on $H$ for some $\nu \in [0,1/\rho]$. The numerical approximation is achieved
via a standard continuous finite element method in space (parameter $h$) and an
implicit Euler scheme and a Laplace convolution quadrature in time (parameter
$\Delta t=T/N$). %Let $X_h^N$ be the discrete solution at time $T$. Eventually
let $\varphi : H\rightarrow \R$ is such that $D^2\varphi$ is bounded on $H$ but
not necessarily bounded and suppose in addition that either its first
derivative is bounded on $H$ and $X_0 \in L^1(\Omega)$ or $\varphi = \| \cdot
\|^2$ and $X_0 \in L^2(\Omega)$. We show that for $\varphi : H\rightarrow \R$
twice continuously differentiable test function with bounded second derivative,
$$ | \E \varphi(X^N_h) - \E \varphi(X(T)) | \leq C \ln
\left(\frac{T}{h^{2/\rho} + \Delta t} \right) (\Delta t^{\rho \nu} + h^{2\nu}),
$$ \noindent for any $0\leq \nu \leq 1/\rho$. This is essentially twice the
rate of strong convergence under the same regularity assumption on the noise.
","[{""version"":""v1"",""created"":""Fri, 5 Jul 2013 03:03:07 GMT""}]","2014-11-07"
"1307.1512","Bang-Yen Chen","Bang-Yen Chen","A survey on Geometry of Slant Submanifolds","124 pages. Published by Katholieke Universiteit Leuven, Belgium, 1990",,,,"math.DG","http://arxiv.org/licenses/nonexclusive-distrib/1.0/","  The present volume is the written version of the series of lectures the
author delivered at the Catholic University of Leuven, Belgium during the
period of June-July, 1990. The main purpose of these talks is to present some
of author's work and also his joint works with Professor T. Nagano and
Professor Y. Tazawa of Japan, Professor P. F. Leung of Singapore and Professor
J. M. Morvan of France on geometry of slant submanifolds and its related
subjects in a systematical way.
","[{""version"":""v1"",""created"":""Fri, 5 Jul 2013 03:11:47 GMT""},{""version"":""v2"",""created"":""Tue, 16 Jul 2013 14:35:24 GMT""}]","2013-07-17"
"1307.1513","Hongyu Wang","Qiang Tan, Hongyu Wang, Ying Zhang, Peng Zhu","Symplectic Cohomology and the Stability of J-Anti-Invariant Cohomology","Sorry, we have made a mistake, the main theorem is incorrect",,,,"math.SG","http://arxiv.org/licenses/nonexclusive-distrib/1.0/","  In this paper, we investigate the relationship between J-anti-invariant
cohomology of a closed symplectic 4-manifold introduced by T.-J. Li and W.
Zhang and new symplectic cohomologies introduced by L.-S. Tseng and S.-T. Yau.
We also prove that the dimension of J-anti-invariant cohomology is constant for
almost structures J which are compatible with a fixed symplectic form.
","[{""version"":""v1"",""created"":""Fri, 5 Jul 2013 03:24:37 GMT""},{""version"":""v2"",""created"":""Thu, 13 Nov 2014 12:19:43 GMT""}]","2014-11-14"
"1307.1514","Lu Lu","Lu Lu, Lizhao You, and Soung Chang Liew","Network-Coded Multiple Access",,,,,"cs.NI cs.IT math.IT","http://arxiv.org/licenses/nonexclusive-distrib/1.0/","  This paper proposes and experimentally demonstrates a first wireless local
area network (WLAN) system that jointly exploits physical-layer network coding
(PNC) and multiuser decoding (MUD) to boost system throughput. We refer to this
multiple access mode as Network-Coded Multiple Access (NCMA). Prior studies on
PNC mostly focused on relay networks. NCMA is the first realized multiple
access scheme that establishes the usefulness of PNC in a non-relay setting.
NCMA allows multiple nodes to transmit simultaneously to the access point (AP)
to boost throughput. In the non-relay setting, when two nodes A and B transmit
to the AP simultaneously, the AP aims to obtain both packet A and packet B
rather than their network-coded packet. An interesting question is whether
network coding, specifically PNC which extracts packet (A XOR B), can still be
useful in such a setting. We provide an affirmative answer to this question
with a novel two-layer decoding approach amenable to real-time implementation.
Our USRP prototype indicates that NCMA can boost throughput by 100% in the
medium-high SNR regime (>=10dB). We believe further throughput enhancement is
possible by allowing more than two users to transmit together.
","[{""version"":""v1"",""created"":""Fri, 5 Jul 2013 03:27:49 GMT""}]","2013-07-08"
"1307.1515","Bang-Yen Chen","Bang-Yen Chen and Leopold Verstraelen","Laplace Transformations of Submanifolds","126 pages. Published by the Center for Pure and Applied Differential
  Geometry (Leuven and Brussel, Belgium), 1995",,,,"math.DG","http://arxiv.org/licenses/nonexclusive-distrib/1.0/","  Let $x : M \to E^m$ be an isometric immersion of a Riemannian manifold $M$
into a Euclidean $m$-space. Denote by $\Delta$ the Laplace operator of $M$.
Then $\Delta$ gives rise to a differentiable map $L :M \to E^m$, called the
Laplace map, defined by $L(p)=(\Delta x)(p)$, $p\in M$. We call $L(M)$ the
Laplace image, and the transformation $L :M \to L(M)$ from $M$ onto its Laplace
image $L(M)$ the {\it Laplace transformation}. In this monograph, we provide a
fundamental study of the Laplace transformations of Euclidean submanifolds.
","[{""version"":""v1"",""created"":""Fri, 5 Jul 2013 03:46:51 GMT""}]","2013-07-08"
"1307.1516","Shiri Chechik","Ittai Abraham and Shiri Chechik","Dynamic Decremental Approximate Distance Oracles with $(1+\epsilon, 2)$
  stretch",,,,,"cs.DS","http://arxiv.org/licenses/nonexclusive-distrib/1.0/","  We provide a decremental approximate Distance Oracle that obtains stretch of
$1+\epsilon$ multiplicative and 2 additive and has $\hat{O}(n^{5/2})$ total
cost (where $\hat{O}$ notation suppresses polylogarithmic and
$n^{O(1)/\sqrt{n}}$ factors). The best previous results with $\hat{O}(n^{5/2})$
total cost obtained stretch $3+\epsilon$.
","[{""version"":""v1"",""created"":""Fri, 5 Jul 2013 04:05:11 GMT""}]","2013-07-08"
"1307.1517","Nandan Mirajkar Mr","Nandan Mirajkar, Sandeep Bhujbal, Aaradhana Deshmukh","Perform wordcount Map-Reduce Job in Single Node Apache Hadoop cluster
  and compress data using Lempel-Ziv-Oberhumer (LZO) algorithm","10 pages, 17 figures, Journal","IJCSI International Journal of Computer Science Issues, Vol. 10,
  Issue 1, No 2, January 2013 ISSN (Print): 1694-0784 | ISSN (Online):
  1694-0814 www.IJCSI.org",,,"cs.DC","http://arxiv.org/licenses/nonexclusive-distrib/1.0/","  Applications like Yahoo, Facebook, Twitter have huge data which has to be
stored and retrieved as per client access. This huge data storage requires huge
database leading to increase in physical storage and becomes complex for
analysis required in business growth. This storage capacity can be reduced and
distributed processing of huge data can be done using Apache Hadoop which uses
Map-reduce algorithm and combines the repeating data so that entire data is
stored in reduced format. The paper describes performing a wordcount Map-Reduce
Job in Single Node Apache Hadoop cluster and compress data using
Lempel-Ziv-Oberhumer (LZO) algorithm.
","[{""version"":""v1"",""created"":""Fri, 5 Jul 2013 04:10:34 GMT""}]","2013-07-08"
