"1307.3658","Ali Ahmadi MR","A. M. Ahmadi, A. Amjadi, A. R. Bahrampour, H. Ravanbod","In-pipe leak detection by Minimum Residual complexity: A Robust time
  Delay Estimation method against correlated noise","Refreshing The figures",,,,"physics.ins-det","http://arxiv.org/licenses/nonexclusive-distrib/1.0/","  In this work, the residual complexity (RC) similarity measure, is employed
for time delay estimation (TDE) in gas pipe leak localization. The properties
of TDE by RC is compared with those of Cross Correlation(CC) and Mutual
Information(MI) similarity measures on our experimental data. The comparison
confirms the advantages of RC relative to CC and MI, in robustness against both
correlated noises and reduction of number of samples. These advantages
originate from not only its mathematical nature of RC similarity measure which
considers inter-dependency but also from broadband frequency of acoustic waves
propagating during gas pipes.
","[{""version"":""v1"",""created"":""Sat, 13 Jul 2013 16:00:59 GMT""},{""version"":""v2"",""created"":""Mon, 26 Aug 2013 11:11:48 GMT""}]","2013-08-27"
"1307.3659","Mihail Silaev","Vasily Vadimov and Mihail Silaev","Nucleation of domain walls by $Z_2$ symmetry breaking transition in
  $p_x+ip_y$ superconductors","5 pages, 2 figures","Phys. Rev. Lett. 111, 177001 (2013)","10.1103/PhysRevLett.111.177001",,"cond-mat.supr-con","http://arxiv.org/licenses/nonexclusive-distrib/1.0/","  We show that time reversal symmetry breaking $p_x+ip_y$ wave superconductors
undergo several phase transitions subjected to external magnetic field or
supercurrent. In such system the discrete $Z_2$ symmetry can recover before the
complete destruction of the order parameter. The topological defects associated
with $Z_2$ symmetry - domain walls can be created in a controllable way by
magnetic field or current sweep according to the Kibble-Zurek scenario. Such
domain wall generation can take place in exotic superconductors like
$Sr_2RuO_4$ and some heavy fermion compounds.
","[{""version"":""v1"",""created"":""Sat, 13 Jul 2013 16:03:03 GMT""}]","2014-09-16"
"1307.3660","Vestislav Apostolov D.","Vestislav Apostolov, Michael Bailey and Georges Dloussky","From locally conformally K\""ahler to bi-Hermitian structures on
  non-K\""ahler complex surfaces","minor revision, final version",,,,"math.DG","http://arxiv.org/licenses/nonexclusive-distrib/1.0/","  We prove that locally conformally K\""ahler metrics on certain compact complex
surfaces with odd first Betti number can be deformed to new examples of
bi-Hermitian metrics.
","[{""version"":""v1"",""created"":""Sat, 13 Jul 2013 16:03:28 GMT""},{""version"":""v2"",""created"":""Mon, 17 Nov 2014 13:53:08 GMT""}]","2014-11-18"
"1307.3661","Danijela Damjanovic","Danijela Damjanovic","Actions with globally hypoelliptic leafwise Laplacian and rigidity",,,,,"math.DS","http://arxiv.org/licenses/nonexclusive-distrib/1.0/","  We prove several results concerning smooth $\mathbb R^k$ actions with the
property that their leafwise Laplacian is globally hypoelliptic. Such actions
are necessarily uniquely ergodic and minimal, and cohomology is often
finite-dimensional, even trivial. Further we consider a class of examples of
$\mathbb R^2$ actions on 2-step nilmanifolds, which have globally hypoelliptic
leafwise Laplacian, and we show transversal local rigidity under certain
Diophantine conditions.
","[{""version"":""v1"",""created"":""Sat, 13 Jul 2013 16:35:14 GMT""},{""version"":""v2"",""created"":""Sat, 20 Jul 2013 17:48:52 GMT""}]","2013-07-23"
"1307.3662","Stanislav Shaposhnikov","Oxana A. Manita and Stanislav V. Shaposhnikov","On the well-posedness of the Cauchy problem for
  Fokker--Planck--Kolmogorov equations with potential terms on arbitrary
  domains",,,,,"math.AP","http://arxiv.org/licenses/nonexclusive-distrib/1.0/","  We study the Cauchy problem for Fokker--Planck--Kolmogorov equations with
unbounded and degenerate coefficients. Sufficient conditions for the existence
and uniqueness of solutions are indicated.
","[{""version"":""v1"",""created"":""Sat, 13 Jul 2013 16:44:07 GMT""}]","2013-07-16"
"1307.3663","Craig Guilbault","Craig R. Guilbault and Carrie J. Tirel","On the dimension of Z-sets","4 pages, no figures",,,,"math.GT","http://arxiv.org/licenses/nonexclusive-distrib/1.0/","  We offer a short and elementary proof that, for a Z-set A in a
finite-dimensional ANR Y, dimA<dimY. This result is relevant to the study of
group boundaries. The original proof by Bestvina and Mess relied on
cohomological dimension theory.
","[{""version"":""v1"",""created"":""Sat, 13 Jul 2013 17:02:58 GMT""}]","2013-07-16"
"1307.3664","Martin Strohmeier","Martin Strohmeier, Vincent Lenders, Ivan Martinovic","On the Security of the Automatic Dependent Surveillance-Broadcast
  Protocol","Survey, 22 Pages, 21 Figures",,"10.1109/COMST.2014.2365951","RR-13-10","cs.CR cs.NI","http://arxiv.org/licenses/nonexclusive-distrib/1.0/","  Automatic dependent surveillance-broadcast (ADS-B) is the communications
protocol currently being rolled out as part of next generation air
transportation systems. As the heart of modern air traffic control, it will
play an essential role in the protection of two billion passengers per year,
besides being crucial to many other interest groups in aviation. The inherent
lack of security measures in the ADS-B protocol has long been a topic in both
the aviation circles and in the academic community. Due to recently published
proof-of-concept attacks, the topic is becoming ever more pressing, especially
with the deadline for mandatory implementation in most airspaces fast
approaching.
  This survey first summarizes the attacks and problems that have been reported
in relation to ADS-B security. Thereafter, it surveys both the theoretical and
practical efforts which have been previously conducted concerning these issues,
including possible countermeasures. In addition, the survey seeks to go beyond
the current state of the art and gives a detailed assessment of security
measures which have been developed more generally for related wireless networks
such as sensor networks and vehicular ad hoc networks, including a taxonomy of
all considered approaches.
","[{""version"":""v1"",""created"":""Sat, 13 Jul 2013 17:05:20 GMT""},{""version"":""v2"",""created"":""Tue, 15 Apr 2014 23:34:33 GMT""}]","2014-11-05"
"1307.3665","Dale A. Frail","D. A. Frail, M. J. Claussen and J. Mehault","Evidence of a Hadronic Origin for the TeV Source J1834-087","4 pages, 1 figure. ApJ Letters, submitted",,"10.1088/2041-8205/773/2/L19",,"astro-ph.HE","http://arxiv.org/licenses/nonexclusive-distrib/1.0/","  We report on the discovery of compact, narrow OH line emission from the
hydroxl molecule at 1720 MHz toward the extended TeV source J1834-087. The
origin of this high energy emission is unknown; it could be powered by one or
more candidate neutron stars (leptonic) or by cosmic rays interacting with
dense gas (hadronic). The OH emission is detected near the center of J1834-087,
coincident with the radio continuum of the supernova remnant W41, and the
radial velocity of the line is the same velocity as a giant molecular cloud
along the line of sight. We argue that the OH is maser emission stimulated by
the interaction of the W41 shock with the molecular cloud. The known
correlation between gamma-ray bright supernova remnants and OH masers favors a
hadronic interpretation for this high energy emission.
","[{""version"":""v1"",""created"":""Sat, 13 Jul 2013 17:22:25 GMT""}]","2015-06-16"
"1307.3666","Ingo Witt","Zhuoping Ruan (Nanjing University), Ingo Witt (University of
  G\""ottingen), Huicheng Yin (Nanjing University)","The existence and singularity structure of low regularity solutions of
  higher-order degenerate hyperbolic equations","37 pages, 6 figures",,,,"math.AP","http://arxiv.org/licenses/nonexclusive-distrib/1.0/","  This paper is a continuation of our previous work [21], where we have
established that, for the second-order degenerate hyperbolic equation
(\p_t^2-t^m\Delta_x)u=f(t,x,u), locally bounded, piecewise smooth solutions
u(t,x) exist when the initial data (u,\p_t u)(0,x) belongs to suitable conormal
classes. In the present paper, we will study low regularity solutions of
higher-order degenerate hyperbolic equations in the category of discontinuous
and even unbounded functions. More specifically, we are concerned with the
local existence and singularity structure of low regularity solutions of the
higher-order degenerate hyperbolic equations \p_t(\p_t^2-t^m\Delta_x)u=f(t,x,u)
and (\p_t^2-t^{m_1}\Delta_x)(\p_t^2-t^{m_2}\Delta_x)v=f(t,x,v) in
\R_+\times\R^n with discontinuous initial data \p_t^iu(0,x)=\phi_i(x) (0\le
i\le 2) and \p_t^jv(0,x)=\psi_j(x) (0\le j\le 3), respectively; here m, m_1,
m_2\in\N, m_1\neq m_2, x\in\R^n, n\ge 2, and f is C^\infty smooth in its
arguments. When the \phi_i and \psi_j are piecewise smooth with respect to the
hyperplane \{x_1=0\} at t=0, we show that local solutions u(t,x), v(t,x)\in
L^{\infty}((0,T)\times\R^n) exist which are C^\infty away from \G_0\cup
\G_m^\pm and \G_{m_1}^\pm\cup\G_{m_2}^\pm in [0,T]\times\R^n, respectively;
here \G_0=\{(t,x): t\ge 0, x_1=0\} and the \Gamma_k^\pm = \{(t,x): t\ge 0,
x_1=\pm \f{2t^{(k+2)/2}}{k+2}\} are two characteristic surfaces forming a cusp.
When the \phi_i and \psi_j belong to C_0^\infty(\R^n\setminus\{0\}) and are
homogeneous of degree zero close to x=0, then there exist local solutions
u(t,x), v(t,x)\in L_{loc}^\infty((0,T]\times\R^n) which are C^\infty away from
\G_m\cup l_0 and \G_{m_1}\cup\G_{m_2} in [0,T]\times\R^n, respectively; here
\Gamma_k=\{(t,x): t\ge 0, |x|^2=\f{4t^{k+2}}{(k+2)^2}\} (k=m, m_1, m_2) is a
cuspidal conic surface and l_0=\{(t,x): t\ge 0, |x|=0\} is a ray.
","[{""version"":""v1"",""created"":""Sat, 13 Jul 2013 17:27:34 GMT""}]","2013-07-16"
"1307.3667","Marcelo Coniglio","Marcelo Coniglio, Francesc Esteva, Llu\'is Godo","Logics of formal inconsistency arising from systems of fuzzy logic","Revised and improved final version. 33 pages, 3 figures","Logic Journal of the IGPL 22(6):880-904, 2014","10.1093/jigpal/jzu016",,"math.LO cs.AI cs.LO","http://arxiv.org/licenses/nonexclusive-distrib/1.0/","  This paper proposes the meeting of fuzzy logic with paraconsistency in a very
precise and foundational way. Specifically, in this paper we introduce
expansions of the fuzzy logic MTL by means of primitive operators for
consistency and inconsistency in the style of the so-called Logics of Formal
Inconsistency (LFIs). The main novelty of the present approach is the
definition of postulates for this type of operators over MTL-algebras, leading
to the definition and axiomatization of a family of logics, expansions of MTL,
whose degree-preserving counterpart are paraconsistent and moreover LFIs.
","[{""version"":""v1"",""created"":""Sat, 13 Jul 2013 18:25:52 GMT""},{""version"":""v2"",""created"":""Wed, 25 Sep 2013 23:45:00 GMT""},{""version"":""v3"",""created"":""Sat, 8 Mar 2014 13:07:10 GMT""}]","2021-03-15"
"1307.3668","Sanjiv Kumar Tiwari","Sanjiv Kumar Tiwari, Michiel van Noort, Andreas Lagg, and Sami K.
  Solanki","Structure of sunspot penumbral filaments: a remarkable uniformity of
  properties","19 pages; 12 figures; accepted for publication in A&A",,"10.1051/0004-6361/201321391",,"astro-ph.SR","http://arxiv.org/licenses/nonexclusive-distrib/1.0/","  The sunspot penumbra comprises numerous thin, radially elongated filaments
that are central for heat transport within the penumbra, but whose structure is
still not clear. To investigate the fine-scale structure of these filaments, we
perform a depth-dependent inversion of spectropolarimetric data of a sunspot
very close to solar disk center obtained by Hinode (SOT/SP). We have used a
recently developed spatially coupled 2D inversion scheme which allows us to
analyze the fine structure of individual penumbral filaments up to the
diffraction limit of the telescope. Filaments of different sizes in all parts
of penumbra display very similar magnetic field strengths, inclinations and
velocity patterns. The similarities allowed us to average all these filaments
and to extract the physical properties common to all of them. This average
filament shows upflows associated with an upward pointing field at its inner,
umbral end and along its axis, downflows along the lateral edge and strong
downflows in the outer end associated with a nearly vertical, strong and
downward pointing field. The upflowing plasma is significantly hotter than the
downflowing plasma. The hot, tear-shaped head of the averaged filament can be
associated with a penumbral grain. The central part of the filament shows
nearly horizontal fields with strengths of ~1kG. The field above the filament
converges, whereas a diverging trend is seen in the deepest layers near the
head of the filament. We put forward a unified observational picture of a
sunspot penumbral filament. It is consistent with such a filament being a
magneto-convective cell, in line with recent MHD simulations. The uniformity of
its properties over the penumbra sets constraints on penumbral models and
simulations. The complex and inhomogeneous structure of the filament provides a
natural explanation for a number of long-running controversies in the
literature.
","[{""version"":""v1"",""created"":""Sat, 13 Jul 2013 18:32:19 GMT""}]","2015-06-16"
"1307.3669","Herv\'e Le Ferrand","Herv\'e Le Ferrand","Robert de Montessus de Ballore's 1902 theorem on algebraic continued
  fractions : genesis and circulation",,,,,"math.HO","http://creativecommons.org/licenses/by-nc-sa/3.0/","  Robert de Montessus de Ballore proved in 1902 his famous theorem on the
convergence of Pad\'e approximants of meromorphic functions. In this paper, we
will first describe the genesis of the theorem, then investigate its
circulation. A number of letters addressed to Robert de Montessus by different
mathematicians will be quoted to help determining the scientific context and
the steps that led to the result. In particular, excerpts of the correspondence
with Henri Pad\'e in the years 1901-1902 played a leading role. The large
number of authors who mentioned the theorem soon after its derivation, for
instance N\""orlund and Perron among others, indicates a fast circulation due to
factors that will be thoroughly explained.
","[{""version"":""v1"",""created"":""Sat, 13 Jul 2013 18:38:20 GMT""}]","2013-07-16"
"1307.3670","Mark Dykman","Vittorio Peano and M I Dykman","Quantum fluctuations in modulated nonlinear oscillators",,"New Journal of Physics 16 (1), 015011 (2014)","10.1088/1367-2630/16/1/015011",,"cond-mat.mes-hall cond-mat.stat-mech quant-ph","http://arxiv.org/licenses/nonexclusive-distrib/1.0/","  With a modulated oscillator, we study several effects of quantum fluctuations
far from thermal equilibrium. One of them is quantum heating, where quantum
fluctuations lead to a finite-width distribution of a resonantly modulated
oscillator over its quasienergy (Floquet) states. We also analyze large rare
fluctuations responsible for the tail of the quasienergy distribution and
switching between the states of forced vibrations. We find an observable
characteristic of these fluctuations, the most probable paths followed by the
quasienergy in rare events, and in particular in switching. We also explore the
discontinuous change of the most probable switching path where the detailed
balance condition is broken. For oscillators modulated by a nonresonant field,
we compare different mechanisms of the field-induced cooling and heating of the
oscillator.
","[{""version"":""v1"",""created"":""Sat, 13 Jul 2013 19:01:25 GMT""}]","2017-09-15"
"1307.3671","Da-jun Zhang","Wei Fu, Zhijun Qiao, Junwei Sun, Da-jun Zhang","The semi-discrete AKNS system: Conservation laws, reductions and
  continuum limits",,"J. Nonlinear Math. Phys., 22, (2015) 321-41",,,"nlin.SI","http://arxiv.org/licenses/nonexclusive-distrib/1.0/","  In this paper, the semi-discrete Ablowitz-Kaup-Newell-Segur (AKNS) hierarchy
is shown in spirit composed by the Ablowitz-Ladik flows under certain
combinations. Furthermore, we derive its explicit Lax pairs and infinitely many
conservation laws, which are non-trivial in light of continuum limit.
Reductions of the semi-discrete AKNS hierarchy are investigated to include the
semi-discrete Korteweg-de Vries (KdV), the semi-discrete modified KdV, and the
semi-discrete nonlinear Schr\""odinger hierarchies as its special cases.
Finally, under the uniform continuum limit we introduce in the paper, the above
results of the semi-discrete AKNS hierarchy, including Lax pairs, infinitely
many conservation laws and reductions, recover their counterparts of the
continuous AKNS hierarchy.
","[{""version"":""v1"",""created"":""Sat, 13 Jul 2013 19:03:16 GMT""}]","2015-06-23"
"1307.3672","Daniel Sevcovic","Sona Kilianova and Daniel Sevcovic","Transformation Method for Solving Hamilton-Jacobi-Bellman Equation for
  Constrained Dynamic Stochastic Optimal Allocation Problem",,,,,"q-fin.PM","http://arxiv.org/licenses/nonexclusive-distrib/1.0/","  In this paper we propose and analyze a method based on the Riccati
transformation for solving the evolutionary Hamilton-Jacobi-Bellman equation
arising from the stochastic dynamic optimal allocation problem. We show how the
fully nonlinear Hamilton-Jacobi-Bellman equation can be transformed into a
quasi-linear parabolic equation whose diffusion function is obtained as the
value function of certain parametric convex optimization problem. Although the
diffusion function need not be sufficiently smooth, we are able to prove
existence, uniqueness and derive useful bounds of classical H\""older smooth
solutions. We furthermore construct a fully implicit iterative numerical scheme
based on finite volume approximation of the governing equation. A numerical
solution is compared to a semi-explicit traveling wave solution by means of the
convergence ratio of the method. We compute optimal strategies for a portfolio
investment problem motivated by the German DAX 30 Index as an example of
application of the method.
","[{""version"":""v1"",""created"":""Sat, 13 Jul 2013 19:17:34 GMT""},{""version"":""v2"",""created"":""Wed, 24 Jul 2013 19:15:52 GMT""}]","2013-07-25"
"1307.3673","Omar Alonso","Alexandros Ntoulas, Omar Alonso, Vasilis Kandylas","A Data Management Approach for Dataset Selection Using Human Computation",,,,,"cs.LG cs.IR","http://arxiv.org/licenses/nonexclusive-distrib/1.0/","  As the number of applications that use machine learning algorithms increases,
the need for labeled data useful for training such algorithms intensifies.
  Getting labels typically involves employing humans to do the annotation,
which directly translates to training and working costs. Crowdsourcing
platforms have made labeling cheaper and faster, but they still involve
significant costs, especially for the cases where the potential set of
candidate data to be labeled is large. In this paper we describe a methodology
and a prototype system aiming at addressing this challenge for Web-scale
problems in an industrial setting. We discuss ideas on how to efficiently
select the data to use for training of machine learning algorithms in an
attempt to reduce cost. We show results achieving good performance with reduced
cost by carefully selecting which instances to label. Our proposed algorithm is
presented as part of a framework for managing and generating training datasets,
which includes, among other components, a human computation element.
","[{""version"":""v1"",""created"":""Sat, 13 Jul 2013 19:29:33 GMT""}]","2013-07-16"
"1307.3674","Bronislav Zakharov","B.G. Zakharov","Medium modification of photon-tagged and inclusive jets in
  high-multiplicity proton-proton collisions","5 pages, 2 figure, journal version","Phys. Rev. Lett. 112, 032301 (2014)","10.1103/PhysRevLett.112.032301",,"hep-ph nucl-th","http://arxiv.org/licenses/nonexclusive-distrib/1.0/","  We study modification of the photon-tagged and inclusive jets in $pp$
collisions at $\sqrt{s}=7$ TeV due to mini-quark-gluon plasma which can be
produced in high multiplicity events. We show that for underlying events with
$dN_{ch}/d\eta\sim 20-60$ the medium effects lead to a considerable
modification of the photon-tagged and inclusive jet fragmentation functions.
For inclusive jets the magnitude of the effect is surprisingly large. The
effect is quite strong even for typical underlying events. We find that at
$\sqrt{s}=7$ TeV the spectrum of charged hadrons is suppressed by $\sim 35-40$
% at $p_{T}\sim 5-10$ GeV.
","[{""version"":""v1"",""created"":""Sat, 13 Jul 2013 19:32:47 GMT""},{""version"":""v2"",""created"":""Sun, 27 Apr 2014 18:16:58 GMT""}]","2014-04-29"
"1307.3675","Chris Dyer","Chris Dyer","Minimum Error Rate Training and the Convex Hull Semiring",,,,,"cs.LG","http://arxiv.org/licenses/nonexclusive-distrib/1.0/","  We describe the line search used in the minimum error rate training algorithm
MERT as the ""inside score"" of a weighted proof forest under a semiring defined
in terms of well-understood operations from computational geometry. This
conception leads to a straightforward complexity analysis of the dynamic
programming MERT algorithms of Macherey et al. (2008) and Kumar et al. (2009)
and practical approaches to implementation.
","[{""version"":""v1"",""created"":""Sat, 13 Jul 2013 19:38:09 GMT""}]","2013-07-16"
"1307.3676","Gabriel Shaughnessy","Vernon Barger, Lisa L. Everett, Heather E. Logan, Gabe Shaughnessy","Discriminators of 2 Higgs Doublets at the LHC14, ILC and
  MuonCollider(125): A Snowmasss White Paper","6 pages, 2 figures. Comments welcome",,,,"hep-ph","http://arxiv.org/licenses/nonexclusive-distrib/1.0/","  The historic LHC discovery of the 125 GeV particle with properties that
closely resemble the Standard Model (SM) Higgs boson verifies our understanding
of electroweak symmetry breaking, but solidifies the need for a resolution to
the hierarchy problem. Many extensions of the SM that address the hierarchy
problem contain a non-minimal Higgs sector. Therefore, as a benchmark
alternative to the SM Higgs mechanism, we study a general 2 Higgs doublet model
(2HDM-G) framework for evaluating future sensitivity to Higgs couplings. We
study how well it can be distinguished from the SM Higgs boson by future
measurements at LHC14, ILC (250, 500,1000 GeV) and a Muon Collider (125 GeV).
Additionally, our study bears on singlet Higgs extensions of two Higgs doublet
models through predicted coupling relationships.
","[{""version"":""v1"",""created"":""Sat, 13 Jul 2013 20:52:40 GMT""},{""version"":""v2"",""created"":""Mon, 22 Jul 2013 19:43:29 GMT""}]","2013-07-23"
"1307.3677","Gerd P\""uhlhofer","G. P\""uhlhofer (2), C. Bauer (1), F. Eisenkolb (2), D. Florin (3), C.
  F\""ohr (1), A. Gadola (3), G. Hermann (1), C. Kalkuhl (2), J. Kasperek (4),
  T. Kihm (1), J. Koziol (5), A. Manalaysay (3), A. Marszalek (5), P.J. Rajda
  (4), W. Romaszkan (4), M. Rupinski (4), T. Schanz (2), S. Steiner (3), U.
  Straumann (3), C. Tenzer (2), A. Vollhardt (3), Q. Weitzel (1), K. Winiarski
  (4), K. Zietara (5) (for the CTA consortium) (6) ((1) Max-Planck-Institut
  f\""ur Kernphysik, Heidelberg, Germany, (2) Institut f\""ur Astronomie und
  Astrophysik, Abteilung Hochenergieastrophysik, Eberhard-Karls-Universit\""at
  T\""ubingen, Germany, (3) Physik-Institut, Universit\""at Z\""urich,
  Switzerland, (4) AGH University of Science and Technology, Krakow, Poland,
  (5) Jagiellonian University, Krakow, Poland)","FlashCam: A fully digital camera for the Cherenkov Telescope Array","In Proceedings of the 33rd International Cosmic Ray Conference
  (ICRC2013), Rio de Janeiro (Brazil). All CTA contributions at arXiv:1307.2232",,,,"astro-ph.IM physics.ins-det","http://arxiv.org/licenses/nonexclusive-distrib/1.0/","  FlashCam is a Cherenkov camera development project centered around a fully
digital trigger and readout scheme with smart, digital signal processing, and a
""horizontal"" architecture for the electromechanical implementation. The fully
digital approach, based on commercial FADCs and FPGAs as key components,
provides the option to easily implement different types of triggers as well as
digitization and readout scenarios using identical hardware, by simply changing
the firmware on the FPGAs. At the same time, a large dynamic range and high
resolution of low-amplitude signals in a single readout channel per pixel is
achieved using compression of high amplitude signals in the preamplifier and
signal processing in the FPGA. The readout of the front-end modules into a
camera server is Ethernet-based using standard Ethernet switches. In its
current implementation, data transfer and backend processing rates of ~3.8
GBytes/sec have been achieved. Together with the dead-time-free front end event
buffering on the FPGAs, this permits the cameras to operate at trigger rates of
up to several tens of kHz.
  In the horizontal architecture of FlashCam, the photon detector plane (PDP),
consisting of photon detectors, preamplifiers, high voltage-, control-, and
monitoring systems, is a self-contained unit, which is interfaced through
analogue signal transmission to the digital readout system. The horizontal
integration of FlashCam is expected not only to be more cost efficient, it also
allows PDPs with different types of photon detectors to be adapted to the
FlashCam readout system. This paper describes the FlashCam concept, its
verification process, and its implementation for a 12 m class CTA telescope
with PMT-based PDP.
","[{""version"":""v1"",""created"":""Sat, 13 Jul 2013 20:53:27 GMT""}]","2019-08-15"
