"1307.3718","Youssri Youssri","E.H. Doha, W.M. Abd-Elhameed and Y.H. Youssri","Nonsymmetric Generalized Jacobi Petrov-Galerkin Algorithms for Third-
  and Fifth-Order two Point Boundary Value Problems",,"Journal of Advanced Research 6 (5), 673-686, (2015)","10.1016/j.jare.2014.03.003",,"math.NA","http://arxiv.org/licenses/nonexclusive-distrib/1.0/","  Two families of certain nonsymmetric generalized Jacobi polynomials with
negative integer indexes are used for solving third- and fifth-order two point
boundary value problems subject to homogeneous and nonhomogeneous boundary
conditions using a dual Petrov-Galerkin method. The key idea behind our method
is to use trial functions satisfying the underlying boundary conditions of the
differential equations and the test functions satisfying the dual boundary
conditions.The method leads to linear systems with specially structured
matrices that can be efficiently inverted. The use of generalized Jacobi
polynomials leads to simplified analysis, very efficient numerical algorithms.
Numerical results are presented to demonstrate the efficiency of our proposed
algorithms.
","[{""version"":""v1"",""created"":""Sun, 14 Jul 2013 10:08:01 GMT""},{""version"":""v2"",""created"":""Sat, 20 Jul 2013 11:25:57 GMT""}]","2019-04-24"
"1307.3719","Florian Maire","Florian Maire, Randal Douc, Jimmy Olsson","Comparison of asymptotic variances of inhomogeneous Markov chains with
  application to Markov chain Monte Carlo methods","Published in at http://dx.doi.org/10.1214/14-AOS1209 the Annals of
  Statistics (http://www.imstat.org/aos/) by the Institute of Mathematical
  Statistics (http://www.imstat.org)","Annals of Statistics 2014, Vol. 42, No. 4, 1483-1510","10.1214/14-AOS1209","IMS-AOS-AOS1209","stat.ME stat.CO","http://arxiv.org/licenses/nonexclusive-distrib/1.0/","  In this paper, we study the asymptotic variance of sample path averages for
inhomogeneous Markov chains that evolve alternatingly according to two
different $\pi$-reversible Markov transition kernels $P$ and $Q$. More
specifically, our main result allows us to compare directly the asymptotic
variances of two inhomogeneous Markov chains associated with different kernels
$P_i$ and $Q_i$, $i\in\{0,1\}$, as soon as the kernels of each pair $(P_0,P_1)$
and $(Q_0,Q_1)$ can be ordered in the sense of lag-one autocovariance. As an
important application, we use this result for comparing different
data-augmentation-type Metropolis-Hastings algorithms. In particular, we
compare some pseudo-marginal algorithms and propose a novel exact algorithm,
referred to as the random refreshment algorithm, which is more efficient, in
terms of asymptotic variance, than the Grouped Independence Metropolis-Hastings
algorithm and has a computational complexity that does not exceed that of the
Monte Carlo Within Metropolis algorithm.
","[{""version"":""v1"",""created"":""Sun, 14 Jul 2013 10:22:35 GMT""},{""version"":""v2"",""created"":""Mon, 9 Dec 2013 00:46:58 GMT""},{""version"":""v3"",""created"":""Fri, 21 Mar 2014 17:22:59 GMT""},{""version"":""v4"",""created"":""Thu, 14 Aug 2014 06:54:15 GMT""}]","2014-08-15"
"1307.3720","Pankaj Kumar","Pankaj Kumar, D.E. Innes","Multiwavelength Observations of an Eruptive Flare: Evidence for Blast
  Waves and Break-out","Solar Physics (published), 15 pages, 8 figures",,"10.1007/s11207-013-0303-y",,"astro-ph.SR","http://arxiv.org/licenses/nonexclusive-distrib/1.0/","  Images of an east-limb flare on 3 November 2010 taken in the 131 \AA\ channel
of the Atmospheric Imaging Assembly onboard the Solar Dynamics Observatory
provide a convincing example of a long current sheet below an erupting
plasmoid, as predicted by the standard magnetic reconnection model of eruptive
flares. However, the 171 \AA\ and 193 \AA\ channel images hint at an
alternative scenario. These images reveal that large-scale waves with velocity
greater than 1000 km/s propagated alongside and ahead of the erupting plasmoid.
Just south of the plasmoid, the waves coincided with type-II radio emission,
and to the north, where the waves propagated along plume-like structures, there
was increased decimetric emission. Initially the cavity around the hot plasmoid
expanded. Later, when the erupting plasmoid reached the height of an overlying
arcade system, the plasmoid structure changed, and the lower parts of the
cavity collapsed inwards. Hot loops appeared alongside and below the erupting
plasmoid. We consider a scenario in which the fast waves and the type-II
emission were a consequence of a flare blast wave, and the cavity collapse and
the hot loops resulted from the break-out of the flux rope through an overlying
coronal arcade.
","[{""version"":""v1"",""created"":""Sun, 14 Jul 2013 10:32:24 GMT""}]","2015-06-16"
"1307.3721","Sergue\""i Andreev V.","S. V. Andreev, A. A. Varlamov and A. V. Kavokin","Scale invariance and universality in a cold gas of indirect excitons","12 pages, 4 figures",,"10.1103/PhysRevLett.112.036401",,"cond-mat.quant-gas","http://arxiv.org/licenses/nonexclusive-distrib/1.0/","  We address theoretically the puzzling similarity observed in the
thermodynamic behaviour of independent clouds of cold dipolar excitons in
coupled semiconductor quantum wells. We argue that the condensation of
self-trapped exciton gas starts at the same critical temperature in all traps
due to the specific scaling rule. As a consequence of the reduced
dimensionality of the system, the scaling parameters appear to be insensitive
to disorder.
","[{""version"":""v1"",""created"":""Sun, 14 Jul 2013 10:38:27 GMT""},{""version"":""v2"",""created"":""Tue, 16 Jul 2013 16:07:18 GMT""}]","2015-06-16"
"1307.3722","Chih-Hong Cheng","Chih-Hong Cheng and Edward A. Lee","Numerical LTL Synthesis for Cyber-Physical Systems","10 pages; work-in-progress report",,,,"cs.SE cs.LO cs.SY","http://arxiv.org/licenses/nonexclusive-distrib/1.0/","  Cyber-physical systems (CPS) are systems that interact with the physical
world via sensors and actuators. In such a system, the reading of a sensor
represents measures of a physical quantity, and sensor values are often reals
ranged over bounded intervals. The implementation of control laws is based on
nonlinear numerical computations over the received sensor values. Synthesizing
controllers fulfilling features within CPS brings a huge challenge to the
research community in formal methods, as most of the works in automatic
controller synthesis (LTL synthesis) are restricted to specifications having a
few discrete inputs within the Boolean domain.
  In this report, we present a novel approach that addresses the above
challenge to synthesize controllers for CPS. Our core methodology, called
numerical LTL synthesis, extends LTL synthesis by using inputs or outputs in
real numbers and by allowing predicates of polynomial constraints to be defined
within an LTL formula as specification. The synthesis algorithm is based on an
interplay between an LTL synthesis engine which handles the pseudo-Boolean
structure, together with a nonlinear constraint validity checker which tests
the (in)feasibility of a (counter-)strategy. The methodology is integrated
within the CPS research framework Ptolemy II via the development of an LTL
synthesis module G4LTL and a validity checker JBernstein. Although we only
target the theory of nonlinear real arithmetic, the use of pseudo-Boolean
synthesis framework also allows an easy extension to embed a richer set of
theories, making the technique applicable to a much broader audience.
","[{""version"":""v1"",""created"":""Sun, 14 Jul 2013 10:49:14 GMT""}]","2013-07-16"
"1307.3723","Francesco Tudisco","Francesco Tudisco","A note on certain ergodicity coefficients",,"Special Matrices 3(2015), pp. 175-185","10.1515/spma-2015-0016",,"math.NA","http://arxiv.org/licenses/nonexclusive-distrib/1.0/","  We investigate two ergodicity coefficients $\phi_{\|\, \|}$ and $\tau_{n-1}$,
originally introduced to bound the subdominant eigenvalues of nonnegative
matrices.
  The former has been generalized to complex matrices in recent years and
several properties for such generalized version have been shown so far.
  We provide a further result concerning the limit of its powers. Then we
propose a generalization of the second coefficient $\tau_{n-1}$ and we show
that, under mild conditions, it can be used to recast the eigenvector problem
$Ax=x$ as a particular M-matrix linear system, whose coefficient matrix can be
defined in terms of the entries of $A$. Such property turns out to generalize
the two known equivalent formulations of the Pagerank centrality of a graph.
","[{""version"":""v1"",""created"":""Sun, 14 Jul 2013 10:50:49 GMT""},{""version"":""v2"",""created"":""Wed, 20 Nov 2013 12:57:13 GMT""},{""version"":""v3"",""created"":""Thu, 12 Nov 2015 16:56:28 GMT""}]","2015-11-13"
"1307.3724","Kiran Kuchi","Kiran Kuchi","Limiting Performance of Conventional and Widely Linear DFT-precoded-OFDM
  Receivers in Wideband Frequency Selective Channels",,,,,"cs.IT math.IT","http://arxiv.org/licenses/nonexclusive-distrib/1.0/","  This paper describes the limiting behavior of linear and decision feedback
equalizers (DFEs) in single/multiple antenna systems employing
real/complex-valued modulation alphabets. The wideband frequency selective
channel is modeled using a Rayleigh fading channel model with infinite number
of time domain channel taps. Using this model, we show that the considered
equalizers offer a fixed post signal-to-noise-ratio (post-SNR) at the equalizer
output that is close to the matched filter bound (MFB). General expressions for
the post-SNR are obtained for zero-forcing (ZF) based conventional receivers as
well as for the case of receivers employing widely linear (WL) processing.
Simulation is used to study the bit error rate (BER) performance of both MMSE
and ZF based receivers. Results show that the considered receivers
advantageously exploit the rich frequency selective channel to mitigate both
fading and inter-symbol-interference (ISI) while offering a performance
comparable to the MFB.
","[{""version"":""v1"",""created"":""Sun, 14 Jul 2013 11:00:40 GMT""}]","2013-07-16"
"1307.3725","Yoshinori Mishiba","Yoshinori Mishiba","Algebraic independence of the Carlitz period and the positive
  characteristic multizeta values at n and (n,n)","11 pages",,,,"math.NT","http://arxiv.org/licenses/nonexclusive-distrib/1.0/","  Let $k$ be the rational function field over the finite field of $q$ elements
and $\bar{k}$ its fixed algebraic closure. In this paper, we study algebraic
relations over $\bar{k}$ among the fundamental period $\widetilde{\pi}$ of the
Carlitz module and the positive characteristic multizeta values $\zeta(n)$ and
$\zeta(n,n)$ for an ""odd"" integer $n$, where we say that $n$ is ""odd"" if $q-1$
does not divide $n$. We prove that either they are algebraically independent
over $\bar{k}$ or satisfy some simple relation over $k$. We also prove that if
$2n$ is ""odd"" then they are algebraically independent over $\bar{k}$.
","[{""version"":""v1"",""created"":""Sun, 14 Jul 2013 11:16:18 GMT""}]","2013-07-16"
"1307.3726","Ali Rezakhani","M. M. R. Koochakie, S. Alipour, and A. T. Rezakhani","Lieb-Robinson Bound and Adiabatic Evolution",,,,,"quant-ph","http://arxiv.org/licenses/nonexclusive-distrib/1.0/","  We extend the concept of locality to enclose a situation where a
tensor-product structure for the Hilbert space is not \textit {a priori}
assumed; rather, this locality is related to a given matrix representation of
the Hamiltonian associated to the system. As a result, we formulate a
Lieb-Robinson-like bound for Hamiltonians local in a given basis. In
particular, we employ this bound to obtain alternatively the adiabatic
condition, where adiabaticity is naturally ensued from a locality in energy
basis and a relatively small Lieb-Robinson bound.
","[{""version"":""v1"",""created"":""Sun, 14 Jul 2013 11:22:11 GMT""}]","2013-07-16"
"1307.3727","Ricardo Guti\'errez","Ricardo Gutierrez, Ricardo Sevilla-Escoboza, Pablo Piedrahita,
  Christian Finke, Ulrike Feudel, Javier M. Buldu, Guillermo Huerta-Cuellar,
  Rider Jaimes-Reategui, Yamir Moreno, Stefano Boccaletti","Generalized synchronization in relay systems with instantaneous coupling","Submitted for publication. 5 pages and 4 figures",,"10.1103/PhysRevE.88.052908",,"nlin.CD cond-mat.other","http://arxiv.org/licenses/nonexclusive-distrib/1.0/","  We demonstrate the existence of generalized synchronization in systems that
act as mediators between two dynamical units that, in turn, show complete
synchronization with each other. These are the so-called relay systems.
Specifically, we analyze the Lyapunov spectrum of the full system to elucidate
when complete and generalized synchronization appear. We show that once a
critical coupling strength is achieved, complete synchronization emerges
between the systems to be synchronized, and at the same point, generalized
synchronization with the relay system also arises. Next, we use two nonlinear
measures based on the distance between phase-space neighbors to quantify the
generalized synchronization in discretized time series. Finally, we
experimentally show the robustness of the phenomenon and of the theoretical
tools here proposed to characterize it.
","[{""version"":""v1"",""created"":""Sun, 14 Jul 2013 11:33:26 GMT""},{""version"":""v2"",""created"":""Tue, 29 Oct 2013 20:28:54 GMT""}]","2015-06-16"
"1307.3728","Graeme Wilkin","Graeme Wilkin","Moment map flows and the Hecke correspondence for quivers","55 pages. Major revision to incorporate the construction of the
  unstable sets based on arxiv://1605.05970",,,,"math.DG math.SG","http://arxiv.org/licenses/nonexclusive-distrib/1.0/","  In this paper we investigate the convergence properties of the upwards
gradient flow of the norm-square of a moment map on the space of
representations of a quiver. The first main result gives a necessary and
sufficient algebraic criterion for a complex group orbit to intersect the
unstable set of a given critical point. Therefore we can classify all of the
isomorphism classes which contain an initial condition that flows up to a given
critical point. As an application, we then show that Nakajima's Hecke
correspondence for quivers has a Morse-theoretic interpretation as pairs of
critical points connected by flow lines for the norm-square of a moment map.
The results are valid in the general setting of finite quivers with relations.
","[{""version"":""v1"",""created"":""Sun, 14 Jul 2013 11:40:33 GMT""},{""version"":""v2"",""created"":""Mon, 7 Nov 2016 01:34:15 GMT""}]","2016-11-08"
"1307.3729","Timothy Hele MChem","Timothy J. H. Hele and Stuart C. Althorpe","Derivation of a true (t->0+) quantum transition-state theory. Part I:
  Uniqueness and equivalence to ring-polymer molecular dynamics
  transition-state-theory","14 pages, 5 figures, 1 table","The Journal of Chemical Physics, 138, 084108 (2013)","10.1063/1.4792697",,"physics.chem-ph cond-mat.stat-mech","http://arxiv.org/licenses/nonexclusive-distrib/1.0/","  Surprisingly, there exists a quantum flux-side time-correlation function
which has a non-zero short-time (t->0+) limit, and thus yields a rigorous
quantum generalization of classical transition-state theory (TST). In this Part
I of two articles, we introduce the new time-correlation function, and derive
its short-time limit. The new ingredient is a generalized Kubo transform which
allows the flux and side dividing surfaces to be the same function of
path-integral space. Choosing this common dividing surface to be a single point
gives a short-time limit which is identical to an expression introduced on
heuristic grounds by Wigner in 1932, but which does not give positive-definite
quantum statistics, causing it to fail while still in the shallow-tunnelling
regime. Choosing the dividing surface to be invariant to imaginary-time
translation gives, uniquely, a short-time limit that gives the correct
positive- definite quantum statistics at all temperatures, and which is
identical to ring-polymer molecular dynamics (RPMD) TST. We find that the
RPMD-TST rate is not a strict upper bound to the exact quantum rate, but a good
approximation to one if real-time coherence effects are small. Part II will
show that the RPMD-TST rate is equal to the exact quantum rate in the absence
of recrossing.
","[{""version"":""v1"",""created"":""Sun, 14 Jul 2013 11:51:26 GMT""}]","2013-07-16"
"1307.3730","Giles Hooker","Giles Hooker","Consistency, efficiency and robustness of conditional disparity methods","Published at http://dx.doi.org/10.3150/14-BEJ678 in the Bernoulli
  (http://isi.cbs.nl/bernoulli/) by the International Statistical
  Institute/Bernoulli Society (http://isi.cbs.nl/BS/bshome.htm)","Bernoulli 2016, Vol. 22, No. 2, 857-900","10.3150/14-BEJ678","IMS-BEJ-BEJ678","math.ST stat.TH","http://arxiv.org/licenses/nonexclusive-distrib/1.0/","  This paper considers extensions of minimum-disparity estimators to the
problem of estimating parameters in a regression model that is conditionally
specified; that is where a parametric model describes the distribution of a
response $y$ conditional on covariates $x$ but does not specify the
distribution of $x$. We define these estimators by estimating a non-parametric
conditional density estimates and minimizing a disparity between this estimate
and the parametric model averaged over values of $x$. The consistency and
asymptotic normality of such estimators is demonstrated for a broad class of
models in which response and covariate vectors can take both discrete and
continuous values and incorportates a wide set of choices for kernel-based
conditional density estimation. It also establishes the robustness of these
estimators for a broad class of disparities. As has been observed in Tamura and
Boos (J. Amer. Statist. Assoc. 81 (1986) 223--229), minimum disparity
estimators incorporating kernel density estimates of more than one dimension
can result in an asymptotic bias that is larger that $n^{-1/2}$ and we
characterize a similar bias in our results and show that in specialized cases
it can be eliminated by appropriately centering the kernel density estimate. We
also demonstrate empirically that bootstrap methods can be employed to reduce
this bias and to provide robust confidence intervals. In order to demonstrate
these results, we establish a set of $L_1$-consistency results for kernel-based
estimates of centered conditional densities.
","[{""version"":""v1"",""created"":""Sun, 14 Jul 2013 11:54:44 GMT""},{""version"":""v2"",""created"":""Wed, 16 Apr 2014 13:37:09 GMT""},{""version"":""v3"",""created"":""Tue, 9 Feb 2016 10:28:29 GMT""}]","2016-02-10"
"1307.3731","Victor Torres-Perez Ph.D.","Victor Torres-Perez, Liuzhen Wu","Chang's Conjecture, The Weak Reflection Principle and the Tree Property
  at $\omega_2$","We prove indeed that $\mathrm{CC}^*+\lnot\mathrm{CH}$ imply the Tree
  Property for $\omega_2$ holds ($\mathrm{TP}(\omega_2)$). However, there was
  an error in our claim. It is not true that $\mathrm{CC}^*$ is equivalent to
  the Weak Reflection Principle at $\omega_2$ ($\mathrm{WRP}(\omega_2)$). The
  question if $\mathrm{WRP}(\omega_2)+\lnot\mathrm{CH}\rightarrow
  \mathrm{TP}(\omega_2)$ remains open",,"10.1016/j.topol.2015.05.061",,"math.LO","http://arxiv.org/licenses/nonexclusive-distrib/1.0/","  We prove that a strong version of Chang's Conjecture, equivalent to the Weak
Reflection Principle at $\omega_2$, together with $2^\omega=\omega_2$, imply
there are no $\omega_2$-Aronszajn trees.
","[{""version"":""v1"",""created"":""Sun, 14 Jul 2013 12:01:42 GMT""},{""version"":""v2"",""created"":""Mon, 7 Aug 2017 11:49:09 GMT""}]","2017-08-10"
"1307.3732","Sejoong Kim","Sejoong Kim and Young-Woo Son","Scattering Theory Approach to Inelastic Transport in Nanoscale Systems","8 pages, 5 figures","Phys. Rev. B 87, 195423 (2013)","10.1103/PhysRevB.87.195423",,"cond-mat.mes-hall","http://arxiv.org/licenses/nonexclusive-distrib/1.0/","  We present a scattering-state description for the non-equilibrium
multichannel charge transport in the presence of electron-vibration couplings.
It is based on an expansion of scattering orders of eigenchannel states.
Examining charge transitions between scattering states, we clarifies competing
inelastic and elastic scattering processes, and compare with the interpretation
based on the non-equilibrium Green's functions formalism. We also derive a
general expression for conductance variations in single-channel systems. It
provides a comprehensive picture for the variation including the well-known
result, the 0.5 rule, from the aspect of interplay between elastic and
inelastic scattering processes.
","[{""version"":""v1"",""created"":""Sun, 14 Jul 2013 12:51:11 GMT""}]","2013-07-16"
"1307.3733","Kasra Rafi","Alex Eskin and Howard Masur and Kasra Rafi","Large scale rank of Teichmuller space","Some corrections have been made. Also, the coarse differentiation
  statement has been modified to state that a quasi-Lipschitz map is
  ""differentiable almost everywhere""","Duke Math. J. 166, no. 8 (2017), 1517-1572","10.1215/00127094-0000006X",,"math.GT","http://arxiv.org/licenses/nonexclusive-distrib/1.0/","  Let X be quasi-isometric to either the mapping class group equipped with the
word metric, or to Teichmuller space equipped with either the Teichmuller
metric or the Weil-Petersson metric. We introduce a unified approach to study
the coarse geometry of these spaces. We show that the quasi-Lipschitz image in
X of a box in R^n is locally near a standard model of a flat in X. As a
consequence, we show that, for all these spaces, the geometric rank and the
topological rank are equal. The methods are axiomatic and apply to a larger
class of metric spaces.
","[{""version"":""v1"",""created"":""Sun, 14 Jul 2013 12:57:30 GMT""},{""version"":""v2"",""created"":""Tue, 21 Oct 2014 13:50:41 GMT""}]","2017-10-18"
"1307.3734","Alexandra Wei{\ss}mann","A. Wei{\ss}mann, H. B\""ohringer, G. Chon","Probing the evolution of the substructure frequency in galaxy clusters
  up to z~1","A&A in press","A&A 555, A147 (2013)","10.1051/0004-6361/201321495",,"astro-ph.CO","http://arxiv.org/licenses/nonexclusive-distrib/1.0/","  Context. Galaxy clusters are the last and largest objects to form in the
standard hierarchical structure formation scenario through merging of smaller
systems. The substructure frequency in the past and present epoch provides
excellent means for studying the underlying cosmological model. Aims. Using
X-ray observations, we study the substructure frequency as a function of
redshift by quantifying and comparing the fraction of dynamically young
clusters at different redshifts up to z=1.08. We are especially interested in
possible biases due to the inconsistent data quality of the low-z and high-z
samples. Methods. Two well-studied morphology estimators, power ratio P3/P0 and
center shift w, were used to quantify the dynamical state of 129 galaxy
clusters, taking into account the different observational depth and noise
levels of the observations. Results. Owing to the sensitivity of P3/P0 to
Poisson noise, it is essential to use datasets with similar photon statistics
when studying the P3/P0-z relation. We degraded the high-quality data of the
low-redshift sample to the low data quality of the high-z observations and
found a shallow positive slope that is, however, not significant, indicating a
slightly larger fraction of dynamically young objects at higher redshift. The
w-z relation shows no significant dependence on the data quality and gives a
similar result. Conclusions. We find a similar trend for P3/P0 and w, namely a
very mild increase of the disturbed cluster fraction with increasing redshifts.
Within the significance limits, our findings are also consistent with no
evolution.
","[{""version"":""v1"",""created"":""Sun, 14 Jul 2013 13:08:24 GMT""}]","2013-07-24"
"1307.3735","Jonathan Hickman","Jonathan Hickman","An affine Fourier restriction theorem for conical surfaces","Revised edition to appear in Mathematika. 18 Pages","Mathematika 60 (2014) 374-390","10.1112/S002557931300020X",,"math.CA","http://arxiv.org/licenses/nonexclusive-distrib/1.0/","  A Fourier restriction estimate is obtained for a broad class of conic
surfaces by adding a weight to the usual underlying measure. The new
restriction estimate exhibits a certain affine-invariance and implies the sharp
$L^p-L^q$ restriction theorem for compact subsets of a type $k$ conical
surface, up to an endpoint. Furthermore, the chosen weight is shown to be, in
some quantitative sense, optimal. Appended is a discussion of type k conical
restriction theorems which addresses some anomalies present in the existing
literature.
","[{""version"":""v1"",""created"":""Sun, 14 Jul 2013 13:23:26 GMT""},{""version"":""v2"",""created"":""Wed, 7 Aug 2013 13:32:46 GMT""}]","2019-02-20"
