"1307.3700","Jacques Roland","J. Roland, S. Britzen, A. Caproni, C. Fromm, C. Gl\""uck and A. Zensus","Binary black holes in nuclei of extragalactic radio sources","24 pages, 34 figures, accepted for publication in Astronomy &
  Astrophysics",,"10.1051/0004-6361/201219165",,"astro-ph.HE astro-ph.CO","http://arxiv.org/licenses/nonexclusive-distrib/1.0/","  If we assume that nuclei of extragalactic radio sources contain binary black
hole systems, the two black holes can eject VLBI components in which case two
families of different VLBI trajectories will be observed. Another important
consequence of a binary black hole system is that the VLBI core is associated
with one black hole, and if a VLBI component is ejected by the second black
hole, one expects to be able to detect the offset of the origin of the VLBI
component ejected by the black hole that is not associated with the VLBI core.
The ejection of VLBI components is perturbed by the precession of the accretion
disk and the motion of the black holes around the center of gravity of the
binary black hole system. We modeled the ejection of the component taking into
account the two pertubations and present a method to fit the coordinates of a
VLBI component and to deduce the characteristics of the binary black hole
system. Specifically, this is the ratio Tp/Tb where Tp is the precession period
of the accretion disk and Tb is the orbital period of the binary black hole
system, the mass ratio M1/M2, and the radius of the Binary Black Hole system
Rbin. From the variations of the coordinates as a function of time of the
ejected VLBI component, we estimated the inclination angle io and the bulk
Lorentz factor gamma of the modeled component. We applied the method to
component S1 of 1823+568 and to component C5 of 3C 279.
","[{""version"":""v1"",""created"":""Sun, 14 Jul 2013 05:24:25 GMT""}]","2015-06-16"
"1307.3701","Kiran Kuchi","Kiran Kuchi","Exploiting Spatial Interference Alignment and Opportunistic Scheduling
  in the Downlink of Interference Limited Systems",,,,,"cs.IT math.IT","http://arxiv.org/licenses/nonexclusive-distrib/1.0/","  In this paper we analyze the performance of single stream and multi-stream
spatial multiplexing (SM) systems employing opportunistic scheduling in the
presence of interference. In the proposed downlink framework, every active user
reports the post-processing signal-to-interference-plus-noise-power-ratio
(post-SINR) or the receiver specific mutual information (MI) to its own
transmitter using a feedback channel. The combination of scheduling and
multi-antenna receiver processing leads to substantial interference suppression
gain. Specifically, we show that opportunistic scheduling exploits spatial
interference alignment (SIA) property inherent to a multi-user system for
effective interference mitigation. We obtain bounds for the outage probability
and the sum outage capacity for single stream and multi stream SM employing
real or complex encoding for a symmetric interference channel model.
  The techniques considered in this paper are optimal in different operating
regimes. We show that the sum outage capacity can be maximized by reducing the
SM rate to a value less than the maximum allowed value. The optimum SM rate
depends on the number of interferers and the number of available active users.
In particular, we show that the generalized multi-user SM (MU SM) method
employing real-valued encoding provides a performance that is either
comparable, or significantly higher than that of MU SM employing complex
encoding. A combination of analysis and simulation is used to describe the
trade-off between the multiplexing rate and sum outage capacity for different
antenna configurations.
","[{""version"":""v1"",""created"":""Sun, 14 Jul 2013 05:56:38 GMT""}]","2013-07-16"
"1307.3702","Ching-hsiao Cheng","C.H. Arthur Cheng, Ying-Chieh Lin, Cheng-Fang Su","The existence of solutions of 2-dimensional incompressible Navier-Stokes
  equations with surface tension in an optimal Sobolev space",,,,,"math.AP","http://arxiv.org/licenses/nonexclusive-distrib/1.0/","  We establish the existence of a solution to the Navier-Stokes equations on a
moving domain with surface tension in an optimal Sobolev space for the case of
two space dimension. No compatibility conditions are required to guarantee the
existence of a solution.
","[{""version"":""v1"",""created"":""Sun, 14 Jul 2013 06:27:35 GMT""}]","2013-07-16"
"1307.3703","Ryo Tamura","Ryo Tamura, Shu Tanaka, Naoki Kawashima","Phase Transitions with Discrete Symmetry Breaking in Antiferromagnetic
  Heisenberg Models on a Triangular Lattice","5 pages, 2 figures",,,,"cond-mat.stat-mech cond-mat.str-el","http://arxiv.org/licenses/nonexclusive-distrib/1.0/","  We study phase transition behavior of the Heisenberg model on a distorted
triangular lattice with competing interactions. The ground-state phase diagram
indicates that underlying symmetry can be changed by tuning parameters. We
focus on two cases in which a phase transition with discrete symmetry breaking
occurs. The first is that the order parameter space is SO(3)$\times C_3$. In
this case, a first-order phase transition, with threefold symmetry breaking,
occurs. The second has the order parameter space SO(3)$\times Z_2$. In this
case, a second-order phase transition occurs with twofold symmetry breaking. To
investigate finite-temperature properties of these phase transitions from a
microscopic viewpoint, we introduce a method to make the connection between
continuous frustrated spin systems and the Potts model with invisible states.
","[{""version"":""v1"",""created"":""Sun, 14 Jul 2013 06:33:50 GMT""}]","2013-07-16"
"1307.3704","Ziwen  Fu","Ziwen Fu","Bubble contributions to scalar correlators with mixed actions","9 pages","Chinese Physics C Vol. 38, No. 6 (2014) 063102","10.1088/1674-1137/38/6/063102",,"hep-lat","http://arxiv.org/licenses/nonexclusive-distrib/1.0/","  WWithin mixed-action chiral perturbation theory (MA$\chi$PT), Sasa's
derivation of the bubble contribution to scalar $a_0$ meson is extended to
those of scalar $\kappa$ and $\sigma$ mesons. We revealed that $\kappa$ bubble
has two double poles and $\sigma$ bubble contains a quadratic-in-$t^2$ growth
factor stemming from the multiplication of two double poles for a general mass
tuning of valence quarks and sea quarks. The corresponding preliminary
analytical expressions in MA$\chi$PT with 2+1 chiral valence quarks and 2+1
staggered sea quarks will be helpful for lattice studies of scalar mesons.
","[{""version"":""v1"",""created"":""Sun, 14 Jul 2013 06:52:52 GMT""}]","2014-04-03"
"1307.3705","Konstantin Zioutas","Konstantin Zioutas, Dieter Hoffmann, Konrad Dennerl, Thomas
  Papaevangelou","On the nature of dark matter in the Coma Cluster","5 pages, 1 Figure",,,,"astro-ph.CO","http://arxiv.org/licenses/nonexclusive-distrib/1.0/","  Recent precise observations of the 2.7 K CMB by the Planck mission toward the
Coma cluster are not in agreement with X-ray measurements. To reconcile both
types of measuring techniques we suggest that unstable dark matter is the cause
of this mismatch. Decaying dark matter, which gravitationally dominates the
galaxy cluster, can affect the estimated hot plasma content, which is then
missing in the measured SZ effect from exactly the same place in the sky. The
model independent lifetime of dark matter decaying entirely to X-rays is
estimated to be about 6x10^{24} sec; this lifetime scales down with the
fraction of the radiatively decaying dark matter. In addition, it is shown that
the potential of such dark matter investigations in space is superior to the
largest volume Earth-bound dark matter decay searches. Other clusters might
provide additional evidence for or against this suggestion.
","[{""version"":""v1"",""created"":""Sun, 14 Jul 2013 07:09:44 GMT""}]","2013-07-16"
"1307.3706","Nicola Scafetta","Nicola Scafetta","Solar and planetary oscillation control on climate change: hind-cast,
  forecast and a comparison with the CMIP5 GCMs","35 Pages, 18 Figures. General Review in ""Mechanisms of Climate Change
  and the AGW Concept: a critical review""","Energy & Environment, Vol. 24 (3&4), Page 455-496 (2013)","10.1260/0958-305X.24.3-4.455",,"physics.geo-ph astro-ph.EP physics.ao-ph physics.soc-ph physics.space-ph","http://arxiv.org/licenses/nonexclusive-distrib/1.0/","  Global surface temperature records (e.g. HadCRUT4) since 1850 are
characterized by climatic oscillations synchronous with specific solar,
planetary and lunar harmonics superimposed on a background warming modulation.
The latter is related to a long millennial solar oscillation and to changes in
the chemical composition of the atmosphere (e.g. aerosol and greenhouse gases).
However, current general circulation climate models, e.g. the CMIP5 GCMs, to be
used in the AR5 IPCC Report in 2013, fail to reconstruct the observed climatic
oscillations. As an alternate, an empirical model is proposed that uses: (1) a
specific set of decadal, multidecadal, secular and millennial astronomic
harmonics to simulate the observed climatic oscillations; (2) a 0.45
attenuation of the GCM ensemble mean simulations to model the anthropogenic and
volcano forcing effects. The proposed empirical model outperforms the GCMs by
better hind-casting the observed 1850-2012 climatic patterns. It is found that:
(1) about 50-60% of the warming observed since 1850 and since 1970 was induced
by natural oscillations likely resulting from harmonic astronomical forcings
that are not yet included in the GCMs; (2) a 2000-2040 approximately steady
projected temperature; (3) a 2000-2100 projected warming ranging between 0.3
$^{o}C$ and 1.6 $^{o}C$, which is significantly lower than the IPCC GCM
ensemble mean projected warming of 1.1 $^{o}C$ to 4.1 $^{o}C$; ; (4) an
equilibrium climate sensitivity to $CO_{2}$ doubling centered in 1.35 $^{o}C$
and varying between 0.9 $^{o}C$ and 2.0 $^{o}C$.
","[{""version"":""v1"",""created"":""Sun, 14 Jul 2013 07:18:00 GMT""}]","2013-07-16"
"1307.3707","Ju-Jun Xie","Ju-Jun Xie, Bo-Chao Liu, and Chun-Sheng An","Coupling constant for $\Lambda(1405)\bar{K}N$","To be published on Phys. Rev. C",,,,"nucl-th hep-ex hep-ph nucl-ex","http://arxiv.org/licenses/nonexclusive-distrib/1.0/","  The value of the $\Lambda(1405){\bar K}N$ coupling constant
$g_{\Lambda(1405)\bar{K}N}$ is obtained by fitting it to the experimental data
on the total cross sections of the $K^-p \to \pi^0\Sigma^0$ reaction. On the
basis of an effective Lagrangian approach and isobar model, we show that the
value $|g_{\Lambda(1405)\bar{K}N}| = 1.51 \pm 0.10$ could be extracted from the
available experimental data by assuming that the $s-$channel $\Lambda(1405)$
resonance plays a dominant role, whereas, the background contributions from the
$s-$channel $\Lambda(1115)$, $t-$channel $K^*$ and $u-$channel nucleon pole
processes are small and can be neglected. However, the $u-$channel nucleon pole
diagram may also give an important contribution in the present calculations.
After the background contributions are taken into account, the above value of
$g_{\Lambda(1405)\bar{K}N}$ is reduced to $|g_{\Lambda(1405)\bar{K}N}| = 0.77
\pm 0.07$, which is not supported by the previous calculations and the recent
CLAS measurements. The theoretical calculations on differential cross sections
are also presented, which can be checked by future experiments.
","[{""version"":""v1"",""created"":""Sun, 14 Jul 2013 07:42:51 GMT""}]","2013-07-16"
"1307.3708","Farzana Meru","Farzana Meru, Marina Galvagni and Christoph Olczak","Growth of grains in Brown Dwarf disks","6 pages, 4 figures, accepted by ApJL",,"10.1088/2041-8205/774/1/L4",,"astro-ph.EP astro-ph.SR","http://arxiv.org/licenses/nonexclusive-distrib/1.0/","  We perform coagulation and fragmentation simulations using the new
physically-motivated model by Garaud et al. (2013) to determine growth locally
in brown dwarf disks. We show that large grains can grow and that if brown
dwarf disks are scaled down versions of T Tauri disks (in terms of stellar
mass, disk mass and disk radius) growth at an equivalent location with respect
to the disk truncation radius can occur to the same size in both disks. We show
that similar growth occurs because the collisional timescales in the two disks
are comparable. Our model may therefore potentially explain the recent
observations of grain growth to millimetre sizes in brown dwarf disks, as seen
in T Tauri disks.
","[{""version"":""v1"",""created"":""Sun, 14 Jul 2013 08:11:09 GMT""}]","2015-06-16"
"1307.3709","Ofer M. Springer","Ofer M. Springer, Nir J. Shaviv","Asteroseismic effects in close binary stars",,,"10.1093/mnras/stt1041",,"astro-ph.SR","http://arxiv.org/licenses/nonexclusive-distrib/1.0/","  Turbulent processes in the convective envelopes of the sun and stars have
been shown to be a source of internal acoustic excitations. In single stars,
acoustic waves having frequencies below a certain cutoff frequency propagate
nearly adiabatically and are effectively trapped below the photosphere where
they are internally reflected. This reflection essentially occurs where the
local wavelength becomes comparable to the pressure scale height. In close
binary stars, the sound speed is a constant on equipotentials, while the
pressure scale height, which depends on the local effective gravity, varies on
equipotentials and may be much greater near the inner Lagrangian point (L_1).
As a result, waves reaching the vicinity of L_1 may propagate unimpeded into
low density regions, where they tend to dissipate quickly due to non-linear and
radiative effects. We study the three dimensional propagation and enhanced
damping of such waves inside a set of close binary stellar models using a WKB
approximation of the acoustic field. We find that these waves can have much
higher damping rates in close binaries, compared to their non-binary
counterparts. We also find that the relative distribution of acoustic energy
density at the visible surface of close binaries develops a ring-like feature
at specific acoustic frequencies and binary separations.
","[{""version"":""v1"",""created"":""Sun, 14 Jul 2013 08:38:11 GMT""}]","2015-06-16"
"1307.3710","Chisa Hotta","Satoshi Nishimoto, Naokazu Shibata, Chisa Hotta","Controlling frustrated liquids and solids with an applied field in a
  kagome Heisenberg antiferromagnet","6 pages 4 figures and 4 page supplementary file. Nature
  Communications, accepted, July 10, 2013",,"10.1038/ncomms3287",,"cond-mat.str-el cond-mat.mtrl-sci","http://creativecommons.org/licenses/by-nc-sa/3.0/","  Quantum spin-1/2 kagome Heisenberg antiferromagnet is the representative
frustrated system possibly hosting a spin liquid. Clarifying the nature of this
elusive topological phase is a key challenge in condensed matter, however, even
identifying it still remains unsettled. Here, we apply a magnetic field and
discover a series of spin gapped phases appearing at five different fractions
of magnetization by means of grand canonical density matrix renormalization
group, an unbiased state-of-art numerical technique. The magnetic field dopes
magnons and first gives rise to a possible Z3 spin liquid plateau at
1/9-magnetization. Higher field induces a self-organized super-lattice-unit, a
six-membered ring of quantum spins, resembling an atomic orbital structure.
Putting magnons into this unit one by one yields three quantum solid plateaus.
We thus find that the magnetic field could control the transition between
various emergent phases by continuously releasing the frustration.
","[{""version"":""v1"",""created"":""Sun, 14 Jul 2013 08:47:41 GMT""},{""version"":""v2"",""created"":""Wed, 17 Jul 2013 13:57:17 GMT""}]","2015-06-16"
"1307.3711","Amol Holkundkar Dr","Amol R. Holkundkar","Parallel implementation of three-dimensional molecular dynamic
  simulation for laser-cluster interaction","5 pages, 7 figures","Phys. Plasmas 20, 113110 (2013)","10.1063/1.4835195",,"physics.comp-ph physics.atm-clus physics.plasm-ph","http://creativecommons.org/licenses/by/3.0/","  The objective of this article is to report the parallel implementation of the
3D molecular dynamic simulation code for laser-cluster interactions. The
benchmarking of the code has been done by comparing the simulation results with
some of the experiments reported in the literature. Scaling laws for the
computational time is established by varying the number of processor cores and
number of macroparticles used. The capabilities of the code are highlighted by
implementing various diagnostic tools. To study the dynamics of the
laser-cluster interactions, the executable version of the code is available
from the author.
","[{""version"":""v1"",""created"":""Sun, 14 Jul 2013 08:50:11 GMT""},{""version"":""v2"",""created"":""Mon, 2 Jun 2014 03:49:48 GMT""}]","2015-06-16"
"1307.3712","Khalid Raza","Khalid Raza and Rafat Parveen","Reconstruction of gene regulatory network of colon cancer using
  information theoretic approach","5 pages, 4 figures, 1 table","Confluence 2013: The Next Generation Information Technology Summit
  (4th International Conference), pp. 461 - 466","10.1049/cp.2013.2357",,"cs.CE cs.ET cs.SY q-bio.MN","http://arxiv.org/licenses/nonexclusive-distrib/1.0/","  Reconstruction of gene regulatory networks or 'reverse-engineering' is a
process of identifying gene interaction networks from experimental microarray
gene expression profile through computation techniques. In this paper, we tried
to reconstruct cancer-specific gene regulatory network using information
theoretic approach - mutual information. The considered microarray data
consists of large number of genes with 20 samples - 12 samples from colon
cancer patient and 8 from normal cell. The data has been preprocessed and
normalized. A t-test statistics has been applied to filter differentially
expressed genes. The interaction between filtered genes has been computed using
mutual information and ten different networks has been constructed with varying
number of interactions ranging from 30 to 500. We performed the topological
analysis of the reconstructed network, revealing a large number of interactions
in colon cancer. Finally, validation of the inferred results has been done with
available biological databases and literature.
","[{""version"":""v1"",""created"":""Sun, 14 Jul 2013 08:51:19 GMT""}]","2014-08-25"
"1307.3713","Chisa Hotta","Chisa Hotta and Naokazu Shibata","""Grand Canonical"" Finite Size Numerical Approaches : a Route to
  Measuring Bulk Properties under Applied Field","5pages, 3 figures","Phys. Rev. B 86, 041108 (2012)","10.1103/PhysRevB.86.041108",,"cond-mat.str-el cond-mat.mtrl-sci","http://arxiv.org/licenses/nonexclusive-distrib/1.0/","  We exploit a prescription to observe directly the physical properties of the
thermodynamic limit under continuously applied field in one-dimensional quantum
finite lattice systems. By systematically scaling down the energy of the
Hamiltonian of the open system from center toward both ends, one could adopt
the edge sites with negligibly small energy scale as a ""grand canonical"" small
particle bath, and an equilibrium states with non-integer arbitrary conserved
numbers, e.g., electron numbers or sz, are realized in the main part of the
system. This will enable the evaluation of the response functions under
continuously varying external field in a small lattice without any fine tuning
or scaling of parameters while keeping the standard numerical accuracy.
Demonstrations are given on quantum spin systems as well as on a Hubbard model
by the density matrix renormalization group calculation.
","[{""version"":""v1"",""created"":""Sun, 14 Jul 2013 08:57:03 GMT""}]","2015-06-16"
"1307.3714","Emilio Lauret","Wai Kiu Chan, Maria Ines Icaza, Emilio A. Lauret","A generalized Hermite constant and its computations for imaginary
  quadratic fields","Accepted for publication in Mathematics of Computation","Mathematics of Computation 84 (2015), 1883-1900","10.1090/S0025-5718-2015-02903-2",,"math.NT","http://arxiv.org/licenses/nonexclusive-distrib/1.0/","  We introduce the projective Hermite constant for positive definite binary
hermitian forms associated with an imaginary quadratic number field $K$. It is
a lower bound for the classical Hermite constant, and these two constants
coincide when $K$ has class number one. Using the geometric tools developed by
Mendoza and Vogtmann for their study of the homology of the Bianchi groups, we
compute the projective Hermite constants for those $K$ whose absolute
discriminants are less than 70, and determine the hermitian forms that attain
the projective Hermite constants in these cases. A comparison of the projective
hermitian constant with some other generalizations of the classical Hermite
constant is also given.
","[{""version"":""v1"",""created"":""Sun, 14 Jul 2013 09:16:23 GMT""},{""version"":""v2"",""created"":""Tue, 31 Dec 2013 00:52:13 GMT""}]","2015-05-12"
"1307.3715","Chao-Kai Wen","Jun Zhang, Chao-Kai Wen, Shi Jin, Xiqi Gao, and Kai-Kit Wong","Large System Analysis of Cooperative Multi-cell Downlink Transmission
  via Regularized Channel Inversion with Imperfect CSIT","13 pages, 9 figures, IEEE Transactions on Wireless Communications",,"10.1109/TWC.2013.081413.120460","TW-Mar-12-","cs.IT math.IT","http://arxiv.org/licenses/nonexclusive-distrib/1.0/","  In this paper, we analyze the ergodic sum-rate of a multi-cell downlink
system with base station (BS) cooperation using regularized zero-forcing (RZF)
precoding. Our model assumes that the channels between BSs and users have
independent spatial correlations and imperfect channel state information at the
transmitter (CSIT) is available. Our derivations are based on large dimensional
random matrix theory (RMT) under the assumption that the numbers of antennas at
the BS and users approach to infinity with some fixed ratios. In particular, a
deterministic equivalent expression of the ergodic sum-rate is obtained and is
instrumental in getting insight about the joint operations of BSs, which leads
to an efficient method to find the asymptotic-optimal regularization parameter
for the RZF. In another application, we use the deterministic channel rate to
study the optimal feedback bit allocation among the BSs for maximizing the
ergodic sum-rate, subject to a total number of feedback bits constraint. By
inspecting the properties of the allocation, we further propose a scheme to
greatly reduce the search space for optimization. Simulation results
demonstrate that the ergodic sum-rates achievable by a subspace search provides
comparable results to those by an exhaustive search under various typical
settings.
","[{""version"":""v1"",""created"":""Sun, 14 Jul 2013 09:21:09 GMT""}]","2016-11-15"
"1307.3716","Thomas Nowak","Glenn Merlet, Thomas Nowak, Hans Schneider, Serge\u{\i} Sergeev","Generalizations of Bounds on the Index of Convergence to Weighted
  Digraphs","17 pages, 3 figures",,"10.1016/j.dam.2014.06.026",,"math.CO","http://arxiv.org/licenses/nonexclusive-distrib/1.0/","  We study sequences of optimal walks of a growing length, in weighted
digraphs, or equivalently, sequences of entries of max-algebraic matrix powers
with growing exponents. It is known that these sequences are eventually
periodic when the digraphs are strongly connected. The transient of such
periodicity depends, in general, both on the size of digraph and on the
magnitude of the weights. In this paper, we show that some bounds on the
indices of periodicity of (unweighted) digraphs, such as the bounds of
Wielandt, Dulmage-Mendelsohn, Schwarz, Kim and Gregory-Kirkland-Pullman, apply
to the weights of optimal walks when one of their ends is a critical node.
","[{""version"":""v1"",""created"":""Sun, 14 Jul 2013 09:40:02 GMT""},{""version"":""v2"",""created"":""Tue, 1 Jul 2014 13:12:50 GMT""}]","2015-03-26"
"1307.3717","Alberto Cetoli","A. Cetoli, J. Brand, R.G. Scott, F. Dalfovo, L.P. Pitaevskii","Snake instability of dark solitons in fermionic superfluids","Accepted for publication in PRA","Phys. Rev. A 88, 043639 (2013)","10.1103/PhysRevA.88.043639",,"cond-mat.quant-gas","http://arxiv.org/licenses/nonexclusive-distrib/1.0/","  We present numerical calculations of the snake instability in a Fermi
superfluid within the Bogoliubov-de Gennes theory of the BEC to BCS crossover
using the random phase approximation complemented by time-dependent
simulations. We examine the snaking behaviour across the crossover and quantify
the timescale and lengthscale of the instability. While the dynamic shows
extensive snaking before eventually producing vortices and sound on the BEC
side of the crossover, the snaking dynamics is preempted by decay into sound
due to pair breaking in the deep BCS regime. At the unitarity limit,
hydrodynamic arguments allow us to link the rate of snaking to the
experimentally observable ratio of inertial to physical mass of the soliton. In
this limit we witness an unresolved discrepancy between our numerical estimates
for the critical wavenumber of suppression of the snake instability and recent
experimental observations with an ultra-cold Fermi gas.
","[{""version"":""v1"",""created"":""Sun, 14 Jul 2013 09:55:09 GMT""},{""version"":""v2"",""created"":""Wed, 31 Jul 2013 00:36:20 GMT""},{""version"":""v3"",""created"":""Wed, 9 Oct 2013 16:22:02 GMT""}]","2013-12-17"
