"1307.3678","Benjamin Jaye","Benjamin Jaye and Fedor Nazarov","Three revolutions in the kernel are worse than one","13 pages, 2 figures",,,,"math.CA math.AP","http://arxiv.org/licenses/nonexclusive-distrib/1.0/","  An example is constructed of a purely unrectifiable measure $\mu$ for which
the singular integral operator whose kernel triples and reverses the argument
of a complex number is bounded $L^2(\mu)$. This is in sharp contrast with the
results known for the Cauchy transform, whose kernel reverses the argument of a
complex number.
","[{""version"":""v1"",""created"":""Sat, 13 Jul 2013 21:05:40 GMT""}]","2013-07-16"
"1307.3679","Claude Bervillier","C. Bervillier","Revisiting the local potential approximation of the exact
  renormalization group equation","Final version, some misprints corrected","nucl.phys.B876 (2013) 587","10.1016/j.nuclphysb.2013.08.008",,"hep-th","http://arxiv.org/licenses/nonexclusive-distrib/1.0/","  The conventional absence of field renormalization in the local potential
approximation (LPA) --implying a zero value of the critical exponent \eta -- is
shown to be incompatible with the logic of the derivative expansion of the
exact renormalization group (RG) equation. We present a LPA with \eta \neq 0
that strictly does not make reference to any momentum dependence. Emphasis is
made on the perfect breaking of the reparametrization invariance in that pure
LPA (absence of any vestige of invariance) which is compatible with the
observation of a progressive smooth restoration of that invariance on
implementing the two first orders of the derivative expansion whereas the
conventional requirement (\eta =0 in the LPA) precluded that observation.
","[{""version"":""v1"",""created"":""Sat, 13 Jul 2013 21:23:22 GMT""},{""version"":""v2"",""created"":""Tue, 24 Sep 2013 07:49:26 GMT""}]","2013-09-25"
"1307.3680","R\'emy Indebetouw","Remy Indebetouw, Crystal Brogan, C.-H. Rosie Chen, Adam Leroy, Kelsey
  Johnson, Erik Muller, Suzanne Madden, Diane Cormier, Frederic Galliano, Annie
  Hughes, Todd Hunter, Akiko Kawamura, Amanda Kepley, Vianney Lebouteiller,
  Margaret Meixner, Joana M. Oliveira, Toshikazu Onishi, Tatiana Vasyunina","ALMA Resolves 30 Doradus: Sub-parsec Molecular Cloud Structure Near the
  Closest Super-Star Cluster","accepted to ApJ",,"10.1088/0004-637X/774/1/73",,"astro-ph.GA","http://arxiv.org/licenses/nonexclusive-distrib/1.0/","  We present ALMA observations of 30 Doradus -- the highest resolution view of
molecular gas in an extragalactic star formation region to date (~0.4pc x
0.6pc). The 30Dor-10 cloud north of R136 was mapped in 12CO 2-1, 13CO 2-1, C18O
2-1, 1.3mm continuum, the H30alpha recombination line, and two H2CO 3-2
transitions. Most 12CO emission is associated with small filaments and clumps
(<1pc, ~1000 Msun at the current resolution). Some clumps are associated with
protostars, including ""pillars of creation"" photoablated by intense radiation
from R136. Emission from molecular clouds is often analyzed by decomposition
into approximately beam-sized clumps. Such clumps in 30 Doradus follow similar
trends in size, linewidth, and surface density to Milky Way clumps. The 30
Doradus clumps have somewhat larger linewidths for a given size than predicted
by Larson's scaling relation, consistent with pressure confinement. They extend
to higher surface density at a given size and linewidth compared to clouds
studied at 10pc resolution. These trends are also true of clumps in Galactic
infrared-dark clouds; higher resolution observations of both environments are
required. Consistency of clump masses calculated from dust continuum, CO, and
the virial theorem reveals that the CO abundance in 30 Doradus clumps is not
significantly different from the LMC mean, but the dust abundance may be
reduced by ~2. There are no strong trends in clump properties with distance
from R136; dense clumps are not strongly affected by the external radiation
field, but there is a modest trend towards lower dense clump filling fraction
deeper in the cloud.
","[{""version"":""v1"",""created"":""Sat, 13 Jul 2013 21:28:35 GMT""}]","2015-06-16"
"1307.3681","J. Maurice Rojas","Martin Avendano, Roman Kogan, Mounir Nisse, and J. Maurice Rojas","Metric Estimates and Membership Complexity for Archimedean Amoebae and
  Tropical Hypersurfaces","21 pages, 5 figures. This version adds a new family of examples
  showing the optimality of another one of our univariate bounds, and contains
  a brief comparison with work of Akian, Gaubert, and Sharify on the matrix
  polynomial problem. Various typos corrected as well",,,,"math.AG cs.CC","http://arxiv.org/licenses/nonexclusive-distrib/1.0/","  Given any complex Laurent polynomial $f$, $\mathrm{Amoeba}(f)$ is the image
of its complex zero set under the coordinate-wise log absolute value map. We
give an efficiently constructible polyhedral approximation,
$\mathrm{ArchtTrop}(f)$, of $\mathrm{Amoeba}(f)$, and derive explicit upper and
lower bounds, solely as a function of the number of monomial terms of $f$, for
the Hausdorff distance between these two sets. We also show that deciding
whether a given point lies in $\mathrm{ArchTrop}(f)$ is doable in
polynomial-time, for any fixed dimension, unlike the corresponding problem for
$\mathrm{Amoeba}(f)$, which is $\mathbf{NP}$-hard already in one variable.
$\mathrm{ArchTrop}(f)$ can thus serve as a canonical low order approximation to
start any higher order iterative polynomial system solving algorithm, such as
homotopy continuation. $\mathrm{ArchTrop}(f)$ also provides an Archimedean
analogue of Kapranov's Non-Archimedean Amoeba Theorem and a higher-dimensional
extension of earlier estimates of Mikhalkin and Ostrowski.
","[{""version"":""v1"",""created"":""Sat, 13 Jul 2013 21:53:50 GMT""},{""version"":""v2"",""created"":""Thu, 25 Jul 2013 19:55:56 GMT""},{""version"":""v3"",""created"":""Mon, 15 Feb 2016 16:29:36 GMT""},{""version"":""v4"",""created"":""Thu, 16 Mar 2017 19:25:16 GMT""}]","2017-03-20"
"1307.3682","Maiia Bakhova","Maiia Bakhova","A reduction of 3-SAT problem to Buchberger algorithm",,,,,"cs.CC","http://arxiv.org/licenses/nonexclusive-distrib/1.0/","  There is a number of known NP class problems, and majority of them have been
shown to be equivalent to others. In particular now it is clear that
construction of a Gr\""{o}bner basis (or Buchberger algorithm) must be one of
equivalent problems, but there was no example. In the following paper the
reduction is constructed.
","[{""version"":""v1"",""created"":""Sat, 13 Jul 2013 21:56:52 GMT""}]","2013-07-16"
"1307.3683","Andrew Lelechenko","Andrew V. Lelechenko","Exponential divisor functions","13 pages","Siauliai Math. Semin., 2015, vol. 10 (18), p. 181-197",,,"math.NT","http://arxiv.org/licenses/nonexclusive-distrib/1.0/","  Consider the operator $E$ on arithmetic functions such that $Ef$ is the
multiplicative arithmetic function defined by $(Ef)(p^a) = f(a)$ for every
prime power $p^a$. We investigate the behaviour of $E^m\tau_k$, where $\tau_k$
is a $k$-dimensional divisor function and $E^m$ stands for the $m$-fold iterate
of $E$. We estimate the error terms of $\sum_{n\le x} E^m\tau_k(n)$ for various
combinations of $m$ and $k$. We also study properties of $E^mf$ for arbitrary
$f$ and sufficiently large $m$.
  Our study provides a unified approach to functions with exponential divisors.
We improve special cases of the Dirichlet asymmetric divisor problem and
several results on the exponential divisor and totient functions.
","[{""version"":""v1"",""created"":""Sat, 13 Jul 2013 22:08:17 GMT""},{""version"":""v2"",""created"":""Mon, 19 Oct 2015 18:54:41 GMT""}]","2015-10-20"
"1307.3684","Andrea Kulier","Andrea Kulier, Jeremiah P. Ostriker, Priyamvada Natarajan, Claire N.
  Lackner, Renyue Cen","Understanding black hole mass assembly via accretion and mergers at late
  times in cosmological simulations","18 pages, 10 figures. Accepted to ApJ; substantial revisions from
  previous version","The Astrophysical Journal, Volume 799, Issue 2, article id. 178,
  16 pp. (2015)","10.1088/0004-637X/799/2/178",,"astro-ph.CO","http://arxiv.org/licenses/nonexclusive-distrib/1.0/","  Accretion is thought to primarily contribute to the mass accumulation history
of supermassive black holes throughout cosmic time. While this may be true at
high redshifts, at lower redshifts and for the most massive black holes mergers
themselves might add significantly to the mass budget. We evolve SMBHs from $4
> z > 0$ using merger trees derived from hydrodynamical cosmological
simulations of a cluster and void region, scaled to the observed value of the
stellar mass fraction to account for overcooling. Mass gains from gas accretion
proportional to bulge growth and BH-BH mergers are tracked, as are black holes
that remain ""orbiting"" due to insufficient dynamical friction in a merger
remnant, as well as those that are ejected due to gravitational recoil. We find
that gas accretion remains the dominant source of mass accumulation in almost
all SMBHs; mergers contribute $2.5\pm0.1\%$ for all SMBHs in the cluster and
$1.0\pm0.1\%$ in the void since $z = 4$. However, mergers are significant for
massive SMBHs. The fraction of mass accumulated from mergers for central BHs
generally increases for larger values of the host bulge mass: in the void, the
fraction is $2\%$ at $M_{*, bul} = 10^{10} M_{\odot}$, increasing to $4\%$ at
$M_{*, bul} \gtrsim 10^{11} M_{\odot}$, and in the cluster it is $4\%$ at
$M_{*, bul} = 10^{10} M_{\odot}$ and $23\%$ at $10^{12} M_{\odot}$. We find
that $40\%$ of SMBHs and $\approx 8\%$ of the total SMBH mass is found orbiting
in the cluster region at $z = 0$. The existence of orbiting and ejected SMBHs
requires modification of the Soltan argument. We estimate this correction to
the integrated accreted mass density of SMBHs to be in the range $6-21\%$, with
a mean value of $11\pm3\%$. We also calculate the total energy output and
strain from gravitational waves emitted by merging SMBHs, and obtain a signal
potentially detectable by pulsar timing arrays.
","[{""version"":""v1"",""created"":""Sat, 13 Jul 2013 22:17:24 GMT""},{""version"":""v2"",""created"":""Tue, 16 Dec 2014 08:23:52 GMT""}]","2015-05-26"
"1307.3685","Xu Wang","Xu Wang","Covering stability of Bergman kernels on K\""ahler hyperbolic manifolds","29 pages",,,,"math.CV math.DG","http://arxiv.org/licenses/nonexclusive-distrib/1.0/","  This paper is a sequel to \cite{Xu}. In this paper, an estimation of the
Bergman Kernel of K\""ahler hyperbolic manifold is given by the $L^2$ estimate
and the Bochner formula. As an application, an effective criterion of the very
ampleness of the canonical line bundle of K\""ahler hyperbolic manifold is
given, which is a generalization of Yeung's result.
","[{""version"":""v1"",""created"":""Sat, 13 Jul 2013 23:47:10 GMT""}]","2013-07-16"
"1307.3686","Hiroyuki Sekiya","Hiroyuki Sekiya (for the Super-Kamiokande Collaboration)","Solar neutrino analysis of Super-Kamiokande","4 pages, 7 figures, for the proceedings of the 33rd International
  Cosmic Ray Conference, Rio De Janeiro 2013 (ICRC2013)",,,,"astro-ph.SR hep-ex","http://arxiv.org/licenses/nonexclusive-distrib/1.0/","  Super-Kamiokande-IV data taking began in September of 2008, and with upgraded
electronics and improvements to water system dynamics, calibration and analysis
techniques, a clear solar neutrino signal could be extracted at recoil electron
kinetic energies as low as 3.5 MeV. The SK-IV extracted solar neutrino flux
between 3.5 and 19.5 MeV is found to be
(2.36$\pm$0.02(stat.)$\pm$0.04(syst.))$\times 10^6$ /(cm$^2$sec). The SK
combined recoil electron energy spectrum favors distortions predicted by
standard neutrino flavour oscillation parameters over a flat suppression at
1$\sigma$ level. A maximum likelihood fit to the amplitude of the expected
solar zenith angle variation of the elastic neutrino-electron scattering rate
in SK, results in a day/night asymmetry of
$-3.2\pm1.1$(stat.)$\pm$0.5(syst.)$%$. The 2.7 $\sigma$ significance of
non-zero asymmetry is the first indication of the regeneration of electron type
solar neutrinos as they travel through Earth's matter. A fit to all solar
neutrino data and KamLAND yields $\sin^2 \theta_{12} = 0.304 \pm 0.013$,
$\sin^2 \theta_{13} = 0.031^{+0.017}_{-0.015}$ and $\Delta m^2_{21} =
7.45^{+0.20}_{-0.19} \times 10^{-5} {\rm eV}^2$.
","[{""version"":""v1"",""created"":""Sun, 14 Jul 2013 00:59:08 GMT""}]","2019-08-14"
"1307.3687","Junzhou Zhao","Junzhou Zhao","On Analyzing Estimation Errors due to Constrained Connections in Online
  Review Systems",,,,,"cs.SI cs.LG","http://arxiv.org/licenses/nonexclusive-distrib/1.0/","  Constrained connection is the phenomenon that a reviewer can only review a
subset of products/services due to narrow range of interests or limited
attention capacity. In this work, we study how constrained connections can
affect estimation performance in online review systems (ORS). We find that
reviewers' constrained connections will cause poor estimation performance, both
from the measurements of estimation accuracy and Bayesian Cramer Rao lower
bound.
","[{""version"":""v1"",""created"":""Sun, 14 Jul 2013 01:37:48 GMT""}]","2013-07-16"
"1307.3688","Lili Fan","Lili Fan and Akitaka Matsumura","Asymptotic stability of a composite wave of two viscous shock waves for
  a one-dimensional system of non-viscous and heat-conductive ideal gas",,,,,"math.AP","http://arxiv.org/licenses/nonexclusive-distrib/1.0/","  This paper is concerned with the asymptotic stability of a composite wave
consisting of two viscous shock waves to the Cauchy problem for a
one-dimensional system of heat-conductive ideal gas without viscosity. We
extend the results by Huang-Matsumura \cite{Huang-Matsumura} where they treated
the equation of viscous and heat-conductive ideal gas. That is, even forthe
non-viscous and heat-conductive case, we show that if the strengths of the
viscous shock waves and the initial perturbation are suitably small, the unique
global solution in time exists and asymptotically tends toward the
corresponding composite wave whose spacial shifts of two viscous shock waves
are uniquely determined by the initial perturbation.
","[{""version"":""v1"",""created"":""Sun, 14 Jul 2013 01:41:41 GMT""}]","2013-07-16"
"1307.3689","Terrence Torres","Tom Banks and T.J. Torres","Two Point Pade Approximants and Duality","11 pages, 5 figures; fixed references, typos and corrected the sloppy
  version of the convergence theorem we quoted with up to date references on
  Pade convergence",,,,"hep-th hep-ph math-ph math.MP","http://arxiv.org/licenses/nonexclusive-distrib/1.0/","  We propose the use of two point Pade approximants to find expressions valid
uniformly in coupling constant for theories with both weak and strong coupling
expansions. In particular, one can use these approximants in models with a
strong/weak duality, when the symmetries do not determine exact expressions for
some quantity.
","[{""version"":""v1"",""created"":""Sun, 14 Jul 2013 02:20:28 GMT""},{""version"":""v2"",""created"":""Tue, 13 Aug 2013 20:39:33 GMT""}]","2013-08-15"
"1307.3690","Rakshith Saligram","Rakshith Saligram, Shrihari Shridhar Hegde, Shashidhar A Kulkarni,
  H.R.Bhagyalakshmi and M.K. Venkatesha","Design of Parity Preserving Logic Based Fault Tolerant Reversible
  Arithmetic Logic Unit","15 pages, 20 Figures, 8 Tables, Iinternational Journal of VLSI Design
  and Communication Systems, June 2013",,,,"cs.AR cs.ET","http://arxiv.org/licenses/nonexclusive-distrib/1.0/","  Reversible Logic is gaining significant consideration as the potential logic
design style for implementation in modern nanotechnology and quantum computing
with minimal impact on physical entropy .Fault Tolerant reversible logic is one
class of reversible logic that maintain the parity of the input and the
outputs. Significant contributions have been made in the literature towards the
design of fault tolerant reversible logic gate structures and arithmetic units,
however, there are not many efforts directed towards the design of fault
tolerant reversible ALUs. Arithmetic Logic Unit (ALU) is the prime performing
unit in any computing device and it has to be made fault tolerant. In this
paper we aim to design one such fault tolerant reversible ALU that is
constructed using parity preserving reversible logic gates. The designed ALU
can generate up to seven Arithmetic operations and four logical operations.
","[{""version"":""v1"",""created"":""Sun, 14 Jul 2013 03:31:10 GMT""}]","2013-07-16"
"1307.3691","Ian Durham","Ian T. Durham","Contextuality: Wheeler's universal regulating principle","Submitted to the 2013 FQXi Essay Contest ""It From Bit or Bit From
  It?""",,"10.1007/978-3-319-12946-4_18",,"quant-ph math-ph math.MP physics.hist-ph","http://arxiv.org/licenses/nonexclusive-distrib/1.0/","  In this essay I develop quantum contextuality as a potential candidate for
Wheeler's universal regulating principle, arguing -- \textit{contrary} to
Wheeler -- that this ultimately implies that `bit' comes from `it.' In the
process I develop a formal definition of physical determinism in the languages
of domain theory and category theory.
","[{""version"":""v1"",""created"":""Sun, 14 Jul 2013 03:32:55 GMT""}]","2018-05-24"
"1307.3692","Shen Chen Xu","Gary L. Miller, Richard Peng, Shen Chen Xu","Parallel Graph Decompositions Using Random Shifts",,,,,"cs.DS","http://arxiv.org/licenses/nonexclusive-distrib/1.0/","  We show an improved parallel algorithm for decomposing an undirected
unweighted graph into small diameter pieces with a small fraction of the edges
in between. These decompositions form critical subroutines in a number of graph
algorithms. Our algorithm builds upon the shifted shortest path approach
introduced in [Blelloch, Gupta, Koutis, Miller, Peng, Tangwongsan, SPAA 2011].
By combining various stages of the previous algorithm, we obtain a
significantly simpler algorithm with the same asymptotic guarantees as the best
sequential algorithm.
","[{""version"":""v1"",""created"":""Sun, 14 Jul 2013 03:41:36 GMT""}]","2013-07-16"
"1307.3693","Jie Han","Jie Han, Yi Zhao","Minimum vertex degree threshold for loose Hamilton cycles in 3-uniform
  hypergraphs","23 pages, 1 figure, Accepted for publication in JCTB",,"10.1016/j.jctb.2015.03.007",,"math.CO","http://arxiv.org/licenses/nonexclusive-distrib/1.0/","  We show that for sufficiently large $n$, every 3-uniform hypergraph on $n$
vertices with minimum vertex degree at least $\binom{n-1}2 -
\binom{\lfloor\frac34 n\rfloor}2 + c$, where $c=2$ if $n\in 4\mathbb{N}$ and
$c=1$ if $n\in 2\mathbb{N}\setminus 4\mathbb{N}$, contains a loose Hamilton
cycle. This degree condition is best possible and improves on the work of
Bu\ss, H\`an and Schacht who proved the corresponding asymptotical result.
","[{""version"":""v1"",""created"":""Sun, 14 Jul 2013 03:49:18 GMT""},{""version"":""v2"",""created"":""Fri, 3 Apr 2015 00:42:40 GMT""}]","2015-04-06"
"1307.3694","Masatoshi Imanishi","Masatoshi Imanishi (1), Kouichiro Nakanishi (2) ((1) Subaru/NAOJ, (2)
  JAO/NAOJ)","High-density Molecular Gas Properties of the Starburst Galaxy NGC 1614
  Revealed with ALMA","19 pages, 9 figures, accepted for publication in AJ",,"10.1088/0004-6256/146/3/47",,"astro-ph.GA astro-ph.CO","http://arxiv.org/licenses/nonexclusive-distrib/1.0/","  We present the results of HCN/HCO+/HNC J=4-3 transition line observations of
the nearby starburst galaxy NGC 1614, obtained with ALMA Cycle 0. We find that
high density molecular gas, traced with these lines, shows a velocity structure
such that the northern (southern) side of the nucleus is redshifted
(blueshifted) with respect to the nuclear velocity of this galaxy. The
redshifted and blueshifted emission peaks are offset by ~0.6"" at the northern
and southern sides of the nucleus, respectively. At these offset positions,
observations at infrared >3 micron indicate the presence of active dusty
starbursts, supporting the picture that high-density molecular gas is the site
of active starbursts. The enclosed dynamical mass within the central ~2"" in
radius, derived from the dynamics of the high-density molecular gas, is ~10^9
Msun, which is similar to previous estimates. Finally, the HCN emission is
weaker than HCO+ but stronger than HNC for J=4-3 for all starburst regions of
NGC 1614, as seen for J=1-0 transition lines in starburst-dominated galaxies.
","[{""version"":""v1"",""created"":""Sun, 14 Jul 2013 03:50:27 GMT""}]","2015-06-16"
"1307.3695","Eugene Bravyi","Eugene Bravyi","On the solvability of linear singular functional differential equations",,,,,"math.CA","http://arxiv.org/licenses/nonexclusive-distrib/1.0/","  Necessary and sufficient conditions for the solvability of boundary value
problems for a family of functional differential equations with a
non-integrable singularity are obtained.
","[{""version"":""v1"",""created"":""Sun, 14 Jul 2013 03:56:06 GMT""}]","2013-07-16"
"1307.3696","Daniel Genin","Daniel Genin and Jolene Splett","Where in the Internet is congestion?",,,,,"cs.NI cs.SI","http://creativecommons.org/licenses/publicdomain/","  Understanding the distribution of congestion in the Internet is a
long-standing problem. Using data from the SamKnows US broadband access network
measurement study, commissioned by the FCC, we explore patterns of congestion
distribution in DSL and cable Internet service provider (ISP) networks. Using
correlation-based analysis we estimate prevalence of congestion in the
periphery versus the core of ISP networks. We show that there are significant
differences in congestion levels and its distribution between DSL and cable ISP
networks and identify bottleneck sections in each type of network.
","[{""version"":""v1"",""created"":""Sun, 14 Jul 2013 04:06:46 GMT""},{""version"":""v2"",""created"":""Fri, 26 Jul 2013 01:27:04 GMT""}]","2013-07-29"
"1307.3697","Tanmoy Das","Tanmoy Das","Weyl semimetals and superconductors designed in an orbital selective
  superlattice","5 pages, 3 fgures (v2): published version including only
  typographical changes","Phys. Rev. B 88, 035444 (2013)","10.1103/PhysRevB.88.035444",,"cond-mat.mes-hall cond-mat.str-el","http://creativecommons.org/licenses/by/3.0/","  We propose two complementary design principles for engineering
three-dimensional (3D) Weyl semimetals and superconductors in a layer-by-layer
setup which includes even and odd parity orbitals in alternating layers -
dubbed orbital selective superlattice. Such structure breaks mirror symmetry
along the superlattice growth axis which, with the help of either a basal plane
spin-orbit coupling or a spinless p+ip superconductivity, stabilizes a 3D Dirac
node. To explore this idea, we develop a 3D generalization of Haldane model and
a Bogoliubov-de-Gennes (BdG) Hamiltonian for the two cases, respectively, and
show that a tunable single or multiple Weyl nodes with linear dispersion in all
spatial directions can be engineered desirably in a widespread parameter space.
We also demonstrate that a single helical Weyl band can be created at the
$\Gamma$-point at the Fermi level in the superconducting case via gapping out
either of the orbital state by violating its particle-hole symmetry but not any
other symmetries. Finally, implications of our results for the realization of
anomalous Hall effect and Majorana bound state are discussed.
","[{""version"":""v1"",""created"":""Sun, 14 Jul 2013 04:15:20 GMT""},{""version"":""v2"",""created"":""Tue, 30 Jul 2013 19:11:03 GMT""}]","2013-07-31"
"1307.3698","Mira Shamis","Mira Shamis","Density of states for GUE, GOE, and interpolating ensembles through
  supersymmetric approach","22 pp. Added interpolating ensembles of Mehta--Pandey. To appear in
  J. Math. Phys. Fixed 2 typos",,,,"math-ph math.MP math.PR","http://arxiv.org/licenses/nonexclusive-distrib/1.0/","  We use the supersymmetric formalism to derive an integral formula for the
density of states of the Gaussian Orthogonal Ensemble, and then apply
saddle-point analysis to give a new derivation of the 1/N-correction to
Wigner's law. This extends the work of Disertori on the Gaussian Unitary
Ensemble. We also apply our method to the interpolating ensembles of
Mehta--Pandey.
","[{""version"":""v1"",""created"":""Sun, 14 Jul 2013 04:24:00 GMT""},{""version"":""v2"",""created"":""Mon, 21 Oct 2013 03:27:28 GMT""},{""version"":""v3"",""created"":""Thu, 14 Nov 2013 01:00:46 GMT""}]","2013-11-15"
"1307.3699","Kai-Min Chung","Kai-Min Chung, Zhenming Liu, Rafael Pass","Statistically-secure ORAM with $\tilde{O}(\log^2 n)$ Overhead",,,,,"cs.CR cs.DS","http://arxiv.org/licenses/nonexclusive-distrib/1.0/","  We demonstrate a simple, statistically secure, ORAM with computational
overhead $\tilde{O}(\log^2 n)$; previous ORAM protocols achieve only
computational security (under computational assumptions) or require
$\tilde{\Omega}(\log^3 n)$ overheard. An additional benefit of our ORAM is its
conceptual simplicity, which makes it easy to implement in both software and
(commercially available) hardware.
  Our construction is based on recent ORAM constructions due to Shi, Chan,
Stefanov, and Li (Asiacrypt 2011) and Stefanov and Shi (ArXiv 2012), but with
some crucial modifications in the algorithm that simplifies the ORAM and enable
our analysis. A central component in our analysis is reducing the analysis of
our algorithm to a ""supermarket"" problem; of independent interest (and of
importance to our analysis,) we provide an upper bound on the rate of ""upset""
customers in the ""supermarket"" problem.
","[{""version"":""v1"",""created"":""Sun, 14 Jul 2013 04:32:12 GMT""}]","2013-07-16"
