"1307.7177","Alexandru Maries","Alexandru Maries and Chandralekha Singh","Exploring Pedagogical Content Knowledge of Physics Instructors and
  Teaching Assistants Using the Force Concept Inventory",,"Physical Review Physics Education Research 12, 010131 (2016)","10.1103/PhysRevPhysEducRes.12.010131",,"physics.ed-ph","http://arxiv.org/licenses/nonexclusive-distrib/1.0/","  The Force Concept Inventory (FCI) has been widely used to assess student
understanding of introductory mechanics concepts by a variety of educators and
physics education researchers. One reason for this extensive use is that many
of the items on the FCI have strong distractor choices that correspond to
students' alternate conceptions in mechanics. Instruction is unlikely to be
effective if instructors do not know the common alternate conceptions of
introductory physics students and explicitly take into account students'
initial knowledge state in their instructional design. Here, we discuss
research involving the FCI to evaluate the pedagogical content knowledge of
both instructors and teaching assistants (TAs) of varying teaching experience.
For each item on the FCI, the instructors and TAs were asked to identify the
most common incorrect answer choice of introductory physics students. We also
discussed the responses individually with a few instructors. Then, we used the
FCI pre-test and post-test data from a large population (~900) of introductory
physics students to assess the pedagogical content knowledge of physics
instructors and TAs. We find that while both physics instructors and TAs, on
average, performed better than random guessing at identifying introductory
students' difficulties with FCI content, they did not identify many common
difficulties that introductory physics students have, even after traditional
instruction. Moreover, the ability to correctly identify students' difficulties
was not correlated with the teaching experience of the physics instructors.
","[{""version"":""v1"",""created"":""Fri, 26 Jul 2013 21:42:37 GMT""}]","2016-06-24"
"1307.7178","Antonino Zanette","Maya Briani, Lucia Caramellino, Antonino Zanette","A hybrid approach for the implementation of the Heston model",,"IMA Journal of Management Mathematics 28 4 (2017) 467-500","10.1093/imaman/dpv032",,"q-fin.CP","http://arxiv.org/licenses/nonexclusive-distrib/1.0/","  We propose a hybrid tree-finite difference method in order to approximate the
Heston model. We prove the convergence by embedding the procedure in a
bivariate Markov chain and we study the convergence of European and American
option prices. We finally provide numerical experiments that give accurate
option prices in the Heston model, showing the reliability and the efficiency
of the algorithm.
","[{""version"":""v1"",""created"":""Fri, 26 Jul 2013 21:44:04 GMT""},{""version"":""v2"",""created"":""Thu, 31 Oct 2013 15:59:56 GMT""},{""version"":""v3"",""created"":""Fri, 19 Sep 2014 12:56:40 GMT""},{""version"":""v4"",""created"":""Thu, 28 Sep 2017 13:42:43 GMT""}]","2017-09-29"
"1307.7179","Alexandru Maries","Alexandru Maries and Chandralekha Singh","Exploring Pedagogical Content Knowledge of Teaching Assistants Using the
  Test of Understanding Graphs in Kinematics",,,"10.1103/PhysRevSTPER.9.020120",,"physics.ed-ph","http://arxiv.org/licenses/nonexclusive-distrib/1.0/","  The Test of Understanding Graphs in Kinematics (TUG-K) is a multiple choice
test developed by Beichner in 1994 to assess students' understanding of
kinematics graphs. Many of the items on the TUG-K have strong distractor
choices which correspond to students' common difficulties with kinematics
graphs. Instruction is unlikely to be effective if instructors do not know the
common difficulties of introductory physics students and explicitly take them
into account in their instructional design. We evaluate the pedagogical content
knowledge of first year physics graduate students enrolled in a teaching
assistant (TA) training course related to topics covered in the TUG-K. In
particular, for each item on the TUG-K, the graduate students were asked to
identify which incorrect answer choice they thought would be most commonly
selected by introductory physics students if they did not know the correct
answer after instruction in relevant concepts. We used the graduate student
data and the data from Beichner's original paper for introductory physics
students to assess the relevant pedagogical content knowledge (PCK) of the
graduate students. We find that, although the graduate students, on average,
performed better than random guessing at identifying introductory student
difficulties on the TUG-K, they did not identify many common difficulties that
introductory students have with graphs in kinematics even after traditional
instruction. In addition, we find that the ability of graduate students to
identify the difficulties of introductory students is context dependent.
","[{""version"":""v1"",""created"":""Fri, 26 Jul 2013 21:52:18 GMT""}]","2015-06-16"
"1307.7180","Mark Dennis","Mark R Dennis and James D Ring","Propagation-invariant beams with quantum pendulum spectra: from Bessel
  beams to Gaussian beam-beams","4 pages, 3 figures, Optics Letters style",,"10.1364/OL.38.003325",,"physics.optics","http://arxiv.org/licenses/nonexclusive-distrib/1.0/","  We describe a new class of propagation-invariant light beams with Fourier
transform given by an eigenfunction of the quantum mechanical pendulum. These
beams, whose spectra (restricted to a circle) are doubly-periodic Mathieu
functions in azimuth, depend on a field strength parameter. When the parameter
is zero, pendulum beams are Bessel beams, and as the parameter approaches
infinity, they resemble transversely propagating one-dimensional Gaussian
wavepackets (Gaussian beam-beams). Pendulum beams are the eigenfunctions of an
operator which interpolates between the squared angular momentum operator and
the linear momentum operator. The analysis reveals connections with Mathieu
beams, and insight into the paraxial approximation.
","[{""version"":""v1"",""created"":""Fri, 26 Jul 2013 22:01:11 GMT""}]","2015-06-16"
"1307.7181","Javier Redondo","Joerg Jaeckel and Javier Redondo","An Antenna for Directional Detection of WISPy Dark Matter","14 pages, 4 figures; Missing references added; New appendix",,"10.1088/1475-7516/2013/11/016","MPP-2013-216","hep-ph astro-ph.CO","http://arxiv.org/licenses/nonexclusive-distrib/1.0/","  It is an intriguing possibility that the cold dark matter of the Universe may
consist of very light and very weakly interacting particles such as axion(-like
particles) and hidden photons. This opens up (but also requires) new techniques
for direct detection. One possibility is to use reflecting surfaces to
facilitate the conversion of dark matter into photons, which can be
concentrated in a detector with a suitable geometry. In this note we show that
this technique also allows for directional detection and inference of the full
vectorial velocity spectrum of the dark matter particles. We also note that the
non-vanishing velocity of dark matter particles is relevant for the conception
of (non-directional) discovery experiments and outline relevant features.
","[{""version"":""v1"",""created"":""Fri, 26 Jul 2013 22:11:58 GMT""},{""version"":""v2"",""created"":""Mon, 5 Aug 2013 21:41:41 GMT""}]","2015-06-16"
"1307.7182","Steven Rieder","Steven Rieder, Rien van de Weygaert, Marius Cautun, Burcu Beygu and
  Simon Portegies Zwart","Assembly of filamentary void galaxy configurations","21 pages, 19 figures, 2 tables, accepted for publication in MNRAS",,"10.1093/mnras/stt1288",,"astro-ph.CO","http://creativecommons.org/licenses/by/3.0/","  We study the formation and evolution of filamentary configurations of dark
matter haloes in voids. Our investigation uses the high-resolution LambdaCDM
simulation CosmoGrid to look for void systems resembling the VGS_31 elongated
system of three interacting galaxies that was recently discovered by the Void
Galaxy Survey (VGS) inside a large void in the SDSS galaxy redshift survey. HI
data revealed these galaxies to be embedded in a common elongated envelope,
possibly embedded in intravoid filament. In the CosmoGrid simulation we look
for systems similar to VGS_31 in mass, size and environment. We find a total of
eight such systems. For these systems, we study the distribution of neighbour
haloes, the assembly and evolution of the main haloes and the dynamical
evolution of the haloes, as well as the evolution of the large-scale structure
in which the systems are embedded. The spatial distribution of the haloes
follows that of the dark matter environment. We find that VGS_31-like systems
have a large variation in formation time, having formed between 10 Gyr ago and
the present epoch. However, the environments in which the systems are embedded
evolved resemble each other substantially. Each of the VGS_31-like systems is
embedded in an intra-void wall, that no later than z = 0.5 became the only
prominent feature in its environment. While part of the void walls retain a
rather featureless character, we find that around half of them are marked by a
pronounced and rapidly evolving substructure. Five haloes find themselves in a
tenuous filament of a few Mpc/h long inside the intra-void wall. Finally, we
compare the results to observed data from VGS_31. Our study implies that the
VGS_31 galaxies formed in the same (proto)filament, and did not meet just
recently. The diversity amongst the simulated halo systems indicates that
VGS_31 may not be typical for groups of galaxies in voids.
","[{""version"":""v1"",""created"":""Fri, 26 Jul 2013 22:18:57 GMT""},{""version"":""v2"",""created"":""Tue, 30 Jul 2013 10:16:00 GMT""}]","2013-08-22"
"1307.7183","Martijn Wubs","Wei Yan, N. Asger Mortensen, and Martijn Wubs","Green function surface-integral method for nonlocal response of
  plasmonic nanowires in arbitrary dielectric environments","20 pages, 9 figures","Phys. Rev. B 88, 155414 (2013)","10.1103/PhysRevB.88.155414",,"cond-mat.mes-hall physics.optics","http://arxiv.org/licenses/nonexclusive-distrib/1.0/","  We develop a nonlocal-response generalization to the Green-function
surface-integral method (GSIM), also known as the boundary-element method
(BEM). This numerically light method can accurately describe the linear
hydrodynamic nonlocal response of arbitrarily shaped plasmonic nanowires in
arbitrary dielectric backgrounds. All previous general-purpose methods for
nonlocal response are bulk methods. We also expand the possible geometries to
which the usual local-response GSIM can be applied, by showing how to
regularize singularities that occur in the surface integrals when the
nanoparticles touch a dielectric substrate. The same regularization works for
nonlocal response. Furthermore, an effective theory is developed to explain the
numerically observed nonlocal effects. The nonlocal frequency blueshift of a
cylindrical nanowire in an inhomogeneous background generally increases as the
nanowire radius and the longitudinal wavenumber become smaller, or when the
effective background permittivity or the mode inhomogeneity increase. The
inhomogeneity can be expressed in terms of an effective angular momentum of the
surface-plasmon mode. We compare local and nonlocal response of free-standing
nanowires, and of nanowires close to and on top of planar dielectric
substrates. Especially for the latter geometry, considerable differences in
extinction cross sections are found for local as compared to nonlocal response,
similar to what is found for plasmonic dimer structures.
","[{""version"":""v1"",""created"":""Fri, 26 Jul 2013 22:19:04 GMT""}]","2013-10-15"
"1307.7184","Alexei Koshelev","A. E. Koshelev","Linear magnetoconductivity in multiband spin-density-wave metals with
  nonideal nesting","5 pages, 2 figures, accepted to Phys. Rev. B, Rapid Communications","Phys. Rev. B 88, 060412(R) (2013)","10.1103/PhysRevB.88.060412",,"cond-mat.supr-con cond-mat.mtrl-sci","http://arxiv.org/licenses/nonexclusive-distrib/1.0/","  In several parent iron-pnictide compounds the resistivity has an extended
range of linear magnetic field dependence. We argue that there is a simple and
natural explanation of this behavior. Spin density wave transition leads to
Fermi-surface reconstruction corresponding to strong modification of the
electronic spectrum near the nesting points. It is difficult for quasiparticles
to pass through these points during their orbital motion in magnetic field,
because they must turn sharply. As the area of the Fermi surface affected by
the nesting points increases proportionally to magnetic field, this mechanism
leads to the linear magnetoresistance. The crossover between the quadratic and
linear regimes takes place at the field scale set by the SDW gap and scattering
rate.
","[{""version"":""v1"",""created"":""Fri, 26 Jul 2013 22:25:32 GMT""},{""version"":""v2"",""created"":""Fri, 2 Aug 2013 19:46:36 GMT""},{""version"":""v3"",""created"":""Mon, 26 Aug 2013 19:24:07 GMT""}]","2013-09-02"
"1307.7185","Fanny Parzysz","Fanny Parzysz, Mai Vu, Fran\c{c}ois Gagnon","Impact of Propagation Environment on Energy-Efficient Relay Placement:
  Model and Performance Analysis","To appear in IEEE Transactions on Wireless Communications",,"10.1109/TWC.2014.022714.131351",,"cs.NI","http://arxiv.org/licenses/nonexclusive-distrib/1.0/","  The performance of a relay-based cellular network is greatly affected by the
relay location within a cell. Existing results for optimal relay placement do
not reflect how the radio propagation environment and choice of the coding
scheme can impact system performance. In this paper, we analyze the impact on
relaying performance of node distances, relay height and line-of-sight
conditions for both uplink and downlink transmissions, using several relay
coding schemes. Our first objective is to propose a geometrical model for
energy-efficient relay placement that requires only a small number of
characteristic distances. Our second objective is to estimate the maximum cell
coverage of a relay-aided cell given power constraints, and conversely, the
averaged energy consumption given a cell radius. We show that the practical
full decode-forward scheme performs close to the energy-optimized partial
decode-forward scheme when the relay is ideally located. However, away from
this optimum relay location, performance rapidly degrades and more advanced
coding scheme, such as partial decode-forward, is needed to maintain good
performance and allow more freedom in the relay placement. Finally, we define a
trade-off between cell coverage and energy efficiency, and show that there
exists a relay location for which increasing the cell coverage has a minimal
impact on the average energy consumed per unit area.
","[{""version"":""v1"",""created"":""Fri, 26 Jul 2013 22:25:58 GMT""},{""version"":""v2"",""created"":""Tue, 21 Jan 2014 20:22:46 GMT""}]","2016-11-15"
"1307.7186","Xiao-Gang He","Dong Xu, Guan-Nan Li, Xiao-Gang He","Large SU(3) breaking effects and CP violation in $B^+ $ decays into
  three charged SU(3) octet pseudoscalar mesons","Review Tex, 20 pages, no figure. Materials extensively extended to
  include momentum dependent decay amplitudes",,"10.1142/S0217751X14500110",,"hep-ph hep-ex","http://arxiv.org/licenses/nonexclusive-distrib/1.0/","  TThe LHCb collaboration has recently reported evidence for non-zero CP
asymmetries in $B^+$ decays into $\pi^+ K^+ K^-,\; \pi^+\pi^+\pi^-,\; K^+ K^+
K^- $ and $K^+\pi^+\pi^-$. The branching ratios for these decays have also been
measured with different values ranging from $5\times 10^{-6}$ to $51\times
10^{-6}$. If flavor $SU(3)$ symmetry is a good symmetry for $B$ decays, in the
case that the dominant amplitude is momentum independent it is expected that
branching ratios $Br$ and CP violating rate differences $\Delta_{CP} = \Gamma -
\overline{\Gamma}$ satisfy, $Br(\pi^+\pi^+\pi^-) = 2Br(\pi^+ K^+ K^-)$,
$Br(K^+K^+K^-) = 2 Br(K^+\pi^+\pi^-)$, and $\Delta_{CP}(\pi^+\pi^+\pi^-) =
2\Delta_{CP}(\pi^+ K^+K^-) = - \Delta_{CP}(K^+K^+K^-) =
-2\Delta_{CP}(K^+\pi^+\pi^-)$. The experimental data do not exhibit the
expected pattern for the branching ratios. The rate differences for $B^+\to
\pi^+\pi^+\pi^-$ and $B^+\to K^+ K^+ K^-$ satisfy the relation between $\Delta
S =0$ and $\Delta S=1$ well, but the other two do not, with the CP asymmetries
having different signs than expected. In this work we study how to including
momentum dependent and also $SU(3)$ breaking effects on these decays to explain
experimental data. We find that only including lowest order derivative terms,
in the $SU(3)$ limit, the decay patterns cannot be explained. Large $SU(3)$
breaking effects are needed to explain the data.
","[{""version"":""v1"",""created"":""Fri, 26 Jul 2013 22:42:34 GMT""},{""version"":""v2"",""created"":""Wed, 31 Jul 2013 16:46:47 GMT""},{""version"":""v3"",""created"":""Mon, 18 Nov 2013 05:21:01 GMT""}]","2015-06-16"
"1307.7187","Alexander Aycock","Leonhard Euler","Methodus inveniendi lineas curvas maximi minimive proprietate gaudentes,
  sive solutio problematis isoperimetrici lattissimo sensu accepti","This paper has been withdrawn by the author",,,,"math.HO","http://arxiv.org/licenses/nonexclusive-distrib/1.0/","  This translation has been withdrawn due to certain imperfections and
mistakes, which are corrected in the version uploaded at The Euler Archive (see
E65 at http://www.eulerarchive.org/)
","[{""version"":""v1"",""created"":""Fri, 26 Jul 2013 22:45:18 GMT""},{""version"":""v2"",""created"":""Wed, 27 Nov 2013 18:01:25 GMT""}]","2013-11-28"
"1307.7188","Stephan Mandt","Stephan Mandt, Adrian E. Feiguin, and Salvatore R. Manmana","Relaxation towards negative temperatures in bosonic systems: Generalized
  Gibbs ensembles and beyond integrability","8 pages, 8 figures, published version","Phys. Rev. A 88, 043643 (2013)","10.1103/PhysRevA.88.043643",,"cond-mat.quant-gas","http://arxiv.org/licenses/nonexclusive-distrib/1.0/","  Motivated by the recent experimental observation of negative absolute
temperature states in systems of ultracold atomic gases in optical lattices
[Braun et al., Science 339, 52 (2013)], we investigate theoretically the
formation of these states. More specifically, we consider the relaxation after
a sudden inversion of the external parabolic confining potential in the
one-dimensional inhomogeneous Bose-Hubbard model. First, we focus on the
integrable hard-core boson limit which allows us to treat large systems and
arbitrarily long times, providing convincing numerical evidence for relaxation
to a generalized Gibbs ensemble at negative temperature T<0, a notion we define
in this context. Second, going beyond one dimension, we demonstrate that the
emergence of negative temperature states can be understood in a dual way in
terms of positive temperatures, which relies on a dynamic symmetry of the
Hubbard model. We complement the study by exact diagonalization simulations at
finite values of the on-site interaction.
","[{""version"":""v1"",""created"":""Fri, 26 Jul 2013 22:52:27 GMT""},{""version"":""v2"",""created"":""Thu, 31 Oct 2013 13:02:51 GMT""}]","2013-11-01"
"1307.7189","Alejandro Corichi","Alejandro Corichi and Asieh Karami","Loop quantum cosmology of k=1 FLRW: Effects of inverse volume
  corrections","18 pages, no figures","Class.Quant.Grav. 31 (2014) 035008","10.1088/0264-9381/31/3/035008","IGC-13/7-5","gr-qc","http://arxiv.org/licenses/nonexclusive-distrib/1.0/","  We consider the k=1 Friedman-Lemaitre-Robertson-Walker (FLRW) model within
loop quantum cosmology (LQC), from the perspective of the two available
quantization prescriptions. We focus our attention on the existence of the so
called `inverse corrections' in the quantization process. We derive the
corresponding quantum constraint operators, and study in detail the issue of
the self-adjointness of the quantum Hamiltonian constraint for two different
quantizations based on open holonomies. Furthermore, we analize in detail the
resulting effective theories, paying special attention to issues such as the
boundedness of different scalar observables such as energy density and
expansion. We show that the inclusion of the inverse corrections solves one of
the main undesirable features of the previous formalism, namely the
unboundedness of the energy density and expansion near the bounce on the full
(effective) phase space. We briefly comment on possible consequences of this
new feature.
","[{""version"":""v1"",""created"":""Fri, 26 Jul 2013 22:52:46 GMT""}]","2016-04-28"
"1307.7190","Dominik Kara","Dominik Kara","Corrections of Order $\alpha \alpha_s$ to W Boson Decays","36 pages, 16 figures, 5 tables; v2 accepted for publication in
  Nuclear Physics B; v3: typos corrected","Nucl.Phys. B877 (2013) 683-718","10.1016/j.nuclphysb.2013.10.024","TTP13-026","hep-ph","http://arxiv.org/licenses/nonexclusive-distrib/1.0/","  We present the calculation of the mixed two-loop QCD/electroweak corrections
to hadronic W boson decays within the Standard Model. The optical theorem is
applied to the W boson two-point function. The multi-scale integrals are
computed with the help of asymptotic expansions, which factorize the three-loop
diagrams into one- and two-loop vacuum and propagator-type integrals.
","[{""version"":""v1"",""created"":""Fri, 26 Jul 2013 23:16:05 GMT""},{""version"":""v2"",""created"":""Fri, 29 Nov 2013 15:14:22 GMT""},{""version"":""v3"",""created"":""Mon, 30 Nov 2015 14:26:47 GMT""}]","2015-12-01"
"1307.7191","Kai Sun","Mengxing Ye and J. W. Allen and Kai Sun","Topological crystalline Kondo insulators and universal topological
  surface states of SmB$_6$","4 pages + 3 pages Supplementary Information, 3 figures",,,,"cond-mat.str-el","http://arxiv.org/licenses/nonexclusive-distrib/1.0/","  We prove theoretically that certain strongly correlated Kondo insulators are
topological crystalline insulators with nontrivial topology protected by
crystal symmetries. In particular, we find that SmB$_6$ is such a material. In
addition to a nontrivial Z$_2$ topological index protected by time reversal
symmetry, SmB$_6$ also has nontrival mirror Chern numbers protected by mirror
symmetries. On the $(100)$ surface of SmB$_6$, the nontrivial mirror Chern
numbers do not generate additional surface states beyond those predicted by the
Z$_2$ topological index. However, on the $(110)$ surface, two more surface
Dirac points are predicted. Remarkably, we find that for SmB$_6$ both the Z$_2$
topological index and the mirror Chern numbers are independent of microscopic
details, which enables us to obtain surface state properties that are
universal.
","[{""version"":""v1"",""created"":""Fri, 26 Jul 2013 23:16:54 GMT""}]","2013-07-30"
"1307.7192","Mehrdad Mahdavi","Mehrdad Mahdavi and Rong Jin","MixedGrad: An O(1/T) Convergence Rate Algorithm for Stochastic Smooth
  Optimization",,,,,"cs.LG math.OC","http://arxiv.org/licenses/nonexclusive-distrib/1.0/","  It is well known that the optimal convergence rate for stochastic
optimization of smooth functions is $O(1/\sqrt{T})$, which is same as
stochastic optimization of Lipschitz continuous convex functions. This is in
contrast to optimizing smooth functions using full gradients, which yields a
convergence rate of $O(1/T^2)$. In this work, we consider a new setup for
optimizing smooth functions, termed as {\bf Mixed Optimization}, which allows
to access both a stochastic oracle and a full gradient oracle. Our goal is to
significantly improve the convergence rate of stochastic optimization of smooth
functions by having an additional small number of accesses to the full gradient
oracle. We show that, with an $O(\ln T)$ calls to the full gradient oracle and
an $O(T)$ calls to the stochastic oracle, the proposed mixed optimization
algorithm is able to achieve an optimization error of $O(1/T)$.
","[{""version"":""v1"",""created"":""Fri, 26 Jul 2013 23:27:23 GMT""}]","2013-07-30"
"1307.7193","Stuart Mirell","Daniel Mirell and Stuart Mirell","Macroscopic Violation of Duality Generated on a Laser Beam","14 pages, 6 figures. Summarizes the theoretical basis given in arXiv:
  1107.1306 and reports newer, more precise experimental results","Journal of Modern Physics Vol. 4, No. 7 pp.911-922 (2013)","10.4236/jmp.2013.47123",,"quant-ph physics.optics","http://arxiv.org/licenses/nonexclusive-distrib/1.0/","  It is shown theoretically and experimentally that passage of a laser beam
through particular conventional Ronchi gratings prepares the beam in an altered
state that violates quantum duality. The violation is characterized by a
readily measured net transfer of energy between the prepared beam and an
unmodified beam from a similar, independent laser. Notably, the experiment is
conducted with the beams at macroscopic power levels where measurability of the
duality-violating transfer is vastly improved over that of the discrete photon
regime. These results are consistent with other recently reported experiments
that have challenged the validity of the duality-related principle of
complementarity.
","[{""version"":""v1"",""created"":""Fri, 26 Jul 2013 23:31:33 GMT""}]","2013-07-30"
