"1307.7122","George Saad","Dieter Mitsche, George Saad and Jared Saia","The Power of Mediation in an Extended El Farol Game","24 pages, 7 figures. Accepted in SAGT'13
  (http://algo.rwth-aachen.de/sagt2013/accepted.php)",,,,"cs.GT","http://arxiv.org/licenses/nonexclusive-distrib/1.0/","  A mediator implements a correlated equilibrium when it proposes a strategy to
each player confidentially such that the mediator's proposal is the best
interest for every player to follow. In this paper, we present a mediator that
implements the best correlated equilibrium for an extended El Farol game with
symmetric players. The extended El Farol game we consider incorporates both
negative and positive network effects.
  We study the degree to which this type of mediator can decrease the overall
social cost. In particular, we give an exact characterization of Mediation
Value (MV) and Enforcement Value (EV) for this game. MV is the ratio of the
minimum social cost over all Nash equilibria to the minimum social cost over
all mediators, and EV is the ratio of the minimum social cost over all
mediators to the optimal social cost. This sort of exact characterization is
uncommon for games with both kinds of network effects. An interesting outcome
of our results is that both the MV and EV values can be unbounded for our game.
","[{""version"":""v1"",""created"":""Fri, 26 Jul 2013 18:40:47 GMT""},{""version"":""v2"",""created"":""Mon, 12 Aug 2013 15:50:02 GMT""}]","2013-08-13"
"1307.7123","Nancy Remage Evans","Nancy Remage Evans (SAO), Howard E. Bond (PSU, STScI), Gail H.
  Schaefer (The CHARA Array, GSU), Brian D. Mason (USNO), Margarita Karovska
  (SAO), and Evan Tingle (SAO)","Binary Cepheids: Separations and Mass Ratios in $5\,M_\odot$ Binaries","accepted in AJ",,"10.1088/0004-6256/146/4/93",,"astro-ph.SR","http://arxiv.org/licenses/nonexclusive-distrib/1.0/","  Deriving the distribution of binary parameters for a particular class of
stars over the full range of orbital separations usually requires the
combination of results from many different observing techniques (radial
velocities, interferometry, astrometry, photometry, direct imaging), each with
selection biases. However, Cepheids---cool, evolved stars of $\sim$$5\,
M_\odot$---are a special case because ultraviolet spectra will immediately
reveal any companion star hotter than early type A, {\it regardless of the
orbital separation}. We have used {\it International Ultraviolet Explorer}
(\IUE) UV spectra of a complete sample of all 76 Cepheids brighter than V=8 to
create a list of {\it all 18} Cepheids with companions more massive than $2.0\,
M_\odot$. Orbital periods of many of these binaries are available from
radial-velocity studies, or can be estimated for longer-period systems from
detected velocity variability. In an imaging survey with the {\it Hubble Space
Telescope} Wide Field Camera 3, we resolved three of the companions (those of
$\eta$ Aql, S Nor, and V659 Cen), allowing us to make estimates of the periods
out to the long-period end of the distribution. Combining these separations
with orbital data in the literature, we derive an unbiased distribution of
binary separations, orbital periods, and mass ratios. The distribution of
orbital periods shows that the $5\, M_\odot$ binaries have systematically
shorter periods than do $1\, M_\odot$ stars. Our data also suggest that the
distribution of mass ratios depends both on binary separation and system
multiplicity. The distribution of mass ratios as a function of orbital
separation, however, does not depend on whether a system is a binary or a
triple.
","[{""version"":""v1"",""created"":""Fri, 26 Jul 2013 18:41:31 GMT""}]","2015-06-16"
"1307.7125","Leo Rodriguez","Bradly K. Button, Leo Rodriguez and Sujeev Wickramasekara","Near-Extremal Black Hole Thermodynamics from AdS2/CFT1 Correspondence in
  The Low Energy Limit of 4D Heterotic String Theory","16 pages, references added, revised for clarity. To appear in JHEP","JHEP 2013 no. 10, (2013) 1-16","10.1007/JHEP10(2013)144",,"hep-th gr-qc","http://arxiv.org/licenses/nonexclusive-distrib/1.0/","  We compute the asymptotic symmetry group of the four dimensional
near-extremal Kerr-Sen black hole within an AdS2/CFT1 correspondence. We do
this by performing a Robinson-Wilczek two dimensional reduction and construct a
quantum theory of the remaining field content. The resulting energy momentum
tensor generates an asymptotic Virasoro algebra, to s-wave, with a calculable
central extension. This center in conjunction with the proper regularized
lowest Virasoro eigen-mode yields the near-extremal Kerr-Sen entropy via the
statistical Cardy formula. Finally we analyze quantum holomorphic fluxes of the
dual CFT giving rise to a finite Hawking temperature weighted by the central
charge of the near-extremal Kerr-Sen metric.
","[{""version"":""v1"",""created"":""Fri, 26 Jul 2013 18:55:04 GMT""},{""version"":""v2"",""created"":""Fri, 4 Oct 2013 19:22:52 GMT""}]","2013-10-25"
"1307.7126","Grigory Sokolov","Aleksey S. Polunchenko, Grigory Sokolov and Alexander G. Tartakovsky","Optimal Design and Analysis of the Exponentially Weighted Moving Average
  Chart for Exponential Data","28 pages, 5 figures, accepted for publication in the Sri Lankan
  Journal of Applied Statistics. arXiv admin note: text overlap with
  arXiv:1202.2849. text overlap with arXiv:1202.2849",,,,"stat.AP stat.CO stat.ME","http://arxiv.org/licenses/nonexclusive-distrib/1.0/","  We study optimal design of the Exponentially Weighted Moving Average (EWMA)
chart by a proper choice of the smoothing factor and the initial value
(headstart) of the decision statistic. The particular problem addressed is that
of quickest detection of an abrupt change in the parameter of a discrete-time
exponential model. Both pre- and post-change parameter values are assumed
known, but the change-point is not known. For this change-point detection
scenario, we examine the performance of the conventional one-sided EWMA chart
with respect to two optimality criteria: Pollak's minimax criterion associated
with the maximal conditional expected delay to detection and Shiryaev's
multi-cyclic setup associated with the stationary expected delay to detection.
Using the integral-equations approach, we derive the exact closed-form formulae
for all of the required performance measures. Based on these formulae we find
the optimal smoothing factor and headstart by solving the corresponding two
bivariate constraint optimization problems. Finally, the performance of the
optimized EWMA chart is compared against that of the Shiryaev--Roberts--$r$
procedure in the minimax setting, and against that of the original
Shiryaev--Roberts procedure in the multi-cyclic setting. The main conclusion is
that the EWMA chart, when fully optimized, turns out to be a very competitive
procedure, with performance nearly indistinguishable from that of the
known-to-be-best Shiryaev--Roberts--$r$ and Shiryaev--Roberts procedures.
","[{""version"":""v1"",""created"":""Fri, 26 Jul 2013 19:11:35 GMT""},{""version"":""v2"",""created"":""Mon, 3 Feb 2014 20:11:11 GMT""},{""version"":""v3"",""created"":""Thu, 6 Nov 2014 20:30:44 GMT""}]","2014-11-07"
"1307.7127","Piyush Ahuja","Piyush Ahuja","Man and Machine: Questions of Risk, Trust and Accountability in Today's
  AI Technology","Preprint",,,,"cs.CY cs.AI","http://arxiv.org/licenses/nonexclusive-distrib/1.0/","  Artificial Intelligence began as a field probing some of the most fundamental
questions of science - the nature of intelligence and the design of intelligent
artifacts. But it has grown into a discipline that is deeply entwined with
commerce and society. Today's AI technology, such as expert systems and
intelligent assistants, pose some difficult questions of risk, trust and
accountability. In this paper, we present these concerns, examining them in the
context of historical developments that have shaped the nature and direction of
AI research. We also suggest the exploration and further development of two
paradigms, human intelligence-machine cooperation, and a sociological view of
intelligence, which might help address some of these concerns.
","[{""version"":""v1"",""created"":""Fri, 26 Jul 2013 19:17:19 GMT""}]","2013-07-29"
"1307.7128","Yuri Mishin","Y. Mishin, J. A. Warren, R. F. Sekerka and W. J. Boettinger","Irreversible thermodynamics of creep in crystalline solids",,,"10.1103/PhysRevB.88.184303",,"cond-mat.mtrl-sci cond-mat.stat-mech","http://arxiv.org/licenses/nonexclusive-distrib/1.0/","  We develop an irreversible thermodynamics framework for the description of
creep deformation in crystalline solids by mechanisms that involve vacancy
diffusion and lattice site generation and annihilation. The material undergoing
the creep deformation is treated as a non-hydrostatically stressed
multi-component solid medium with non-conserved lattice sites and
inhomogeneities handled by employing gradient thermodynamics. Phase fields
describe microstructure evolution which gives rise to redistribution of vacancy
sinks and sources in the material during the creep process. We derive a general
expression for the entropy production rate and use it to identify of the
relevant fluxes and driving forces and to formulate phenomenological relations
among them taking into account symmetry properties of the material. As a simple
application, we analyze a one-dimensional model of a bicrystal in which the
grain boundary acts as a sink and source of vacancies. The kinetic equations of
the model describe a creep deformation process accompanied by grain boundary
migration and relative rigid translations of the grains. They also demonstrate
the effect of grain boundary migration induced by a vacancy concentration
gradient across the boundary.
","[{""version"":""v1"",""created"":""Fri, 26 Jul 2013 19:25:16 GMT""}]","2015-06-16"
"1307.7129","Naoyuki Nide","Megumi Fujita, Yuki Goto, Naoyuki Nide, Ken Satoh, Hiroshi Hosobe","An Architecture for Autonomously Controlling Robot with Embodiment in
  Real World","Submission for proc. of KRR-ICLP2013 (resubmitted using LLNCS style)",,,,"cs.RO cs.AI","http://arxiv.org/licenses/nonexclusive-distrib/1.0/","  In the real world, robots with embodiment face various issues such as dynamic
continuous changes of the environment and input/output disturbances. The key to
solving these issues can be found in daily life; people `do actions associated
with sensing' and `dynamically change their plans when necessary'. We propose
the use of a new concept, enabling robots to do these two things, for
autonomously controlling mobile robots. We implemented our concept to make two
experiments under static/dynamic environments. The results of these experiments
show that our idea provides a way to adapt to dynamic changes of the
environment in the real world.
","[{""version"":""v1"",""created"":""Fri, 26 Jul 2013 19:25:58 GMT""}]","2013-07-29"
"1307.7130","Valentin Perret","V. Perret, F. Renaud, B. Epinat, P. Amram, F. Bournaud, T. Contini, R.
  Teyssier and J.-C. Lambert","Evolution of the mass, size, and star formation rate in high-redshift
  merging galaxies MIRAGE - A new sample of simulations with detailed stellar
  feedback","18 pages, 12 figures. Accepted in A&A",,"10.1051/0004-6361/201322395",,"astro-ph.CO","http://arxiv.org/licenses/nonexclusive-distrib/1.0/","  We aim at addressing the questions related to galaxy mass assembly through
major and minor wet merging processes in the redshift range 1<z<2. A consequent
fraction of Milky Way like galaxies are thought to have undergone an unstable
clumpy phase at this early stage. Using the adaptive mesh refinement code
RAMSES, with a recent physically-motivated implementation of stellar feedback,
we build the Merging and Isolated high-Redshift Adaptive mesh refinement
Galaxies (MIRAGE) sample. It is composed of 20 mergers and 3 isolated idealized
disks simulations with global physical properties in accordance with the 1<z<2
mass complete sample MASSIV. The numerical hydrodynamical resolution reaches 7
parsecs in the smallest Eulerian cells. Our simulations include: star
formation, metal line cooling, metallicity advection, and a recent
implementation of stellar feedback which encompasses OB-type stars radiative
pressure, photo-ionization heating, and supernovae. The initial conditions are
set to match the z~2 observations, thanks to a new public code DICE. The
numerical resolution allows us to follow the formation and evolution of giant
clumps formed in-situ from Jeans instabilities triggered by high initial gas
fraction. The star formation history of isolated disks shows stochastic star
formation rate, which proceeds from the complex behavior of the giant clumps.
Our minor and major gas-rich merger simulations do not trigger starbursts,
suggesting a saturation of the star formation in a turbulent and clumpy
interstellar medium fed by substantial accretion from the circum-galactic
medium. Our simulations are close to the normal regime of the disk-like star
formation on a Schmidt-Kennicutt diagram. The mass-size relation and its rate
of evolution matches observations, suggesting that the inside-out growth
mechanisms of the stellar disk do not necessarily require to be achieved
through a cold accretion.
","[{""version"":""v1"",""created"":""Fri, 26 Jul 2013 19:28:52 GMT""},{""version"":""v2"",""created"":""Tue, 30 Jul 2013 11:11:55 GMT""},{""version"":""v3"",""created"":""Wed, 6 Nov 2013 13:34:03 GMT""}]","2015-06-16"
"1307.7131","Jeff Allen","Jeffrey Allen, Glennys Farrar","Testing models of new physics with UHE air shower observations","4 pages, 6 figures. 33rd International Cosmic Ray Conference, Rio de
  Janeiro, 2013. Paper Id 1182",,,,"astro-ph.HE","http://arxiv.org/licenses/nonexclusive-distrib/1.0/","  Several air shower observatories have established that the number of muons
produced in UHE air showers is significantly larger than that predicted by
models. We argue that the only solution to this muon deficit, compatible with
the observed Xmax distributions, is to reduce the transfer of energy from the
hadronic shower into the EM shower, by reducing the production or decay of
pi0s. We present four different models of new physics, each with a theoretical
rationale, which can accomplish this. One has a pure proton composition and
three have mixed composition. Two entail new particle physics and suppress pi0
production or decay above LHC energies. The other two are less radical but
nonetheless require significant modifications to existing hadron production
models -- in one the changes are only above LHC energies and in the other the
changes extend to much lower energies. We show that the models have
distinctively different predictions for the correlation between the number of
muons at ground and Xmax in hybrid events, so that with future hybrid data it
should be possible to discriminate between models of new physics and
disentangle the particle physics from composition.
","[{""version"":""v1"",""created"":""Fri, 26 Jul 2013 19:30:04 GMT""}]","2013-07-29"
"1307.7132","Geoffrey Grimmett","Geoffrey R. Grimmett, Alexander E. Holroyd, Yuval Peres","Extendable self-avoiding walks","Accepted version",,,,"math.CO math-ph math.MP","http://arxiv.org/licenses/nonexclusive-distrib/1.0/","  The connective constant mu of a graph is the exponential growth rate of the
number of n-step self-avoiding walks starting at a given vertex. A
self-avoiding walk is said to be forward (respectively, backward) extendable if
it may be extended forwards (respectively, backwards) to a singly infinite
self-avoiding walk. It is called doubly extendable if it may be extended in
both directions simultaneously to a doubly infinite self-avoiding walk. We
prove that the connective constants for forward, backward, and doubly
extendable self-avoiding walks, denoted respectively by mu^F, mu^B, mu^FB,
exist and satisfy mu = mu^F = mu^B = mu^FB for every infinite, locally finite,
strongly connected, quasi-transitive directed graph. The proofs rely on a 1967
result of Furstenberg on dimension, and involve two different arguments
depending on whether or not the graph is unimodular.
","[{""version"":""v1"",""created"":""Fri, 26 Jul 2013 19:33:32 GMT""},{""version"":""v2"",""created"":""Thu, 25 Oct 2018 15:56:08 GMT""}]","2018-10-26"
"1307.7133","Clare Dobbs","Clare Dobbs","Star formation in galaxies: the role of spiral arms","7 pages, 3 figures, invited review, to appear in Proceedings of the
  IAU Symposium No. 298, ""Setting the scene for Gaia and LAMOST""",,"10.1017/S1743921313006406",,"astro-ph.GA","http://arxiv.org/licenses/nonexclusive-distrib/1.0/","  Studying star formation in spiral arms tells us not only about the evolution
of star formation, and molecular clouds, but can also tell us about the nature
of spiral structure in galaxies. I will address both these topics using the
results of recent simulations and observations. Galactic scale simulations are
beginning to examine in detail the evolution of GMCs as they form in spiral
arms, and then disperse by stellar feedback or shear. The overall timescale for
this process appears comparable to the crossing time of the GMCs, a few Myrs
for $10^5$ M$_{\odot}$ clouds, 20 Myr or so for more massive GMCs. Both
simulations and observations show that the massive clouds are found in the
spiral arms, likely as a result of cloud-cloud collisions. Simulations
including stars should also tell us about the stellar age distribution in GMCs,
and across spiral arms. More generally, recent work on spiral galaxies suggests
that the dynamics of gas flows in spiral arms are different in longlived and
transient spiral arms, resulting in different age patterns in the stars. Such
results could be used to help establish the main driver of spiral structure in
the Milky Way (Toomre instabilities, the bar, or nearby companion galaxies) in
conjunction with future surveys.
","[{""version"":""v1"",""created"":""Fri, 26 Jul 2013 19:37:02 GMT""}]","2015-06-16"
"1307.7134","Michele Cirafici","Michele Cirafici","Line defects and (framed) BPS quivers","80 pages, 16 figures; v2: references added, note added, minor
  corrections, final version to be published in JHEP",,"10.1007/JHEP11(2013)141",,"hep-th math.QA","http://arxiv.org/licenses/nonexclusive-distrib/1.0/","  The BPS spectrum of certain N=2 supersymmetric field theories can be
determined algebraically by studying the representation theory of BPS quivers.
We introduce methods based on BPS quivers to study line defects. The presence
of a line defect opens up a new BPS sector: framed BPS states can be bound to
the defect. The defect can be geometrically described in terms of laminations
on a curve. To a lamination we associate certain elements of the Leavitt path
algebra of the BPS quiver and use them to compute the framed BPS spectrum. We
also provide an alternative characterization of line defects by introducing
framed BPS quivers. Using the theory of (quantum) cluster algebras, we derive
an algorithm to compute the framed BPS spectra of new defects from known ones.
Line defects are generated from a framed BPS quiver by applying certain
sequences of mutation operations. Framed BPS quivers also behave nicely under a
set of ""cut and join"" rules, which can be used to study how N=2 systems with
defects couple to produce more complicated ones. We illustrate our formalism
with several examples.
","[{""version"":""v1"",""created"":""Fri, 26 Jul 2013 19:39:08 GMT""},{""version"":""v2"",""created"":""Fri, 13 Dec 2013 16:19:55 GMT""}]","2015-06-16"
"1307.7135","Cms Collaboration","CMS Collaboration","Projected Performance of an Upgraded CMS Detector at the LHC and HL-LHC:
  Contribution to the Snowmass Process","Final version of the CMS contribution to the Snowmass 2013 report",,,"CMS-NOTE-13-002","hep-ex","http://arxiv.org/licenses/nonexclusive-distrib/1.0/","  The physics reach of the CMS detector achievable with 300(0) inverse
femtobarns of proton-proton collisions recorded at sqrt(s)=14 TeV is presented.
Ultimate precision on measurements of Higgs boson properties, top quark
physics, and electroweak processes are discussed, as well as the discovery
potential for new particles beyond the standard model. In addition, the
potential for future heavy ion physics is presented. This document has been
submitted as a white paper to the Snowmass process, an exercise initiated by
the American Physical Society's Division of Particles and Fields to assess the
long-term physics aspirations of the US high energy physics community.
","[{""version"":""v1"",""created"":""Fri, 26 Jul 2013 19:46:53 GMT""},{""version"":""v2"",""created"":""Fri, 27 Sep 2013 15:49:17 GMT""}]","2013-09-30"
"1307.7136","Frederic Bournaud","Frederic Bournaud, Valentin Perret, Florent Renaud, Avishai Dekel,
  Bruce G. Elmegreen, Debra M. Elmegreen, Romain Teyssier, Philippe Amram,
  Emanuele Daddi, Pierre-Alain Duc, David Elbaz, Benoit Epinat, Jared M. Gabor,
  Stephanie Juneau, Katarina Kraljic, Emeric Le Floch'","The long lives of giant clumps and the birth of outflows in gas-rich
  galaxies at high redshift","submitted to ApJ",,"10.1088/0004-637X/780/1/57",,"astro-ph.CO astro-ph.GA","http://arxiv.org/licenses/nonexclusive-distrib/1.0/","  Star-forming disk galaxies at high redshift are often subject to violent disk
instability, characterized by giant clumps whose fate is yet to be understood.
The main question is whether the clumps disrupt within their dynamical
timescale (<50Myr), like molecular clouds in today's galaxies, or whether they
survive stellar feedback for more than a disk orbital time (~300Myr) in which
case they can migrate inward and help building the central bulge. We present
3.5-7pc resolution AMR simulations of high-redshift disks including
photo-ionization, radiation pressure, and supernovae feedback (Renaud et al.
2013, and Perret et al., this astro-ph issue). Our modeling of radiation
pressure determines the mass loading and initial velocity of winds from basic
physical principles. We find that the giant clumps produce steady outflow rates
comparable to and sometimes somewhat larger than their star formation rate,
with velocities largely sufficient to escape galaxy. The clumps also lose mass,
especially old stars, by tidal stripping, and the stellar populations contained
in the clumps hence remain relatively young (<=200Myr), as observed. The clumps
survive gaseous outflows and stellar loss, because they are wandering in
gas-rich turbulent disks from which they can re-accrete gas at high rates
compensating for outflows and tidal stripping, overall keeping realistic and
self-regulated gaseous and stellar masses. Our simulations produce gaseous
outflows with velocities, densities and mass loading consistent with
observations, and at the same time suggest that the giant clumps survive for
hundreds of Myr and complete their migration to the center of high-redshift
galaxies, without rapid dispersion and reformation of clumps.
","[{""version"":""v1"",""created"":""Fri, 26 Jul 2013 19:47:34 GMT""}]","2015-06-16"
"1307.7137","Ben Morris","Ben Morris and Anastasia Raymer","The mixing time of the fifteen puzzle","30 pages, 9 figures",,,,"math.PR","http://arxiv.org/licenses/nonexclusive-distrib/1.0/","  We show that there are universal positive constants c and C such that the
mixing time T_{mix} for the fifteen puzzle in an n by n torus satisfies cn^4
log n < T_{mix} < Cn^4 log^2 n.
","[{""version"":""v1"",""created"":""Fri, 26 Jul 2013 19:52:33 GMT""}]","2013-07-29"
"1307.7138","Eirina Bourtsoulatze","Eirina Bourtsoulatze, Nikolaos Thomos and Pascal Frossard","Reconstruction of Network Coded Sources From Incomplete Datasets",,,,,"cs.IT math.IT","http://arxiv.org/licenses/nonexclusive-distrib/1.0/","  In this paper, we investigate the problem of recovering source information
from an incomplete set of network coded data. We first study the theoretical
performance of such systems under maximum a posteriori (MAP) decoding and
derive the upper bound on the probability of decoding error as a function of
the system parameters. We also establish the sufficient conditions on the
number of network coded symbols required to achieve decoding error probability
below a certain level. We then propose a low complexity iterative decoding
algorithm based on message passing for decoding the network coded data of a
particular class of statistically dependent sources that present pairwise
linear correlation. The algorithm operates on a graph that captures the network
coding constraints, while the knowledge about the source correlation is
directly incorporated in the messages exchanged over the graph. We test the
proposed method on both synthetic data and correlated image sequences and
demonstrate that the prior knowledge about the source correlation can be
effectively exploited at the decoder in order to provide a good reconstruction
of the transmitted data in cases where the network coded data available at the
decoder is not sufficient for exact decoding.
","[{""version"":""v1"",""created"":""Fri, 26 Jul 2013 19:53:44 GMT""},{""version"":""v2"",""created"":""Mon, 21 Apr 2014 12:11:33 GMT""},{""version"":""v3"",""created"":""Fri, 13 Mar 2015 17:03:17 GMT""}]","2015-03-16"
