"1307.7233","Arijit Banerjee","Arijit Banerjee, Dustin Maas, Maurizio Bocca, Neal Patwari, Sneha
  Kasera","Through Wall People Localization Exploiting Radio Windows",,,,,"cs.CR","http://arxiv.org/licenses/nonexclusive-distrib/1.0/","  We introduce and investigate the ability of an attacker to surreptitiously
use an otherwise secure wireless network to detect moving people through walls,
in an area in which people expect their location to be private. We call this
attack on location privacy of people an ""exploiting radio windows"" (ERW)
attack. We design and implement the ERW attack methodology for through wall
people localization that relies on reliably detecting when people cross the
link lines by using physical layer measurements between the legitimate
transmitters and the attack receivers. We also develop a method to estimate the
direction of movement of a person from the sequence of link lines crossed
during a short time interval. Additionally, we describe how an attacker may
estimate any artificial changes in transmit power (used as a countermeasure),
compensate for these power changes using measurements from sufficient number of
links, and still detect line crossings. We implement our methodology on WiFi
and ZigBee nodes and experimentally evaluate the ERW attack by monitoring
people movements through walls in two real-world settings. We find that our
methods achieve very high accuracy in detecting line crossings and determining
direction of motion.
","[{""version"":""v1"",""created"":""Sat, 27 Jul 2013 08:08:53 GMT""}]","2013-07-30"
"1307.7234","Valentina Kiritchenko","Valentina Kiritchenko","Divided difference operators on polytopes","20 pages, 5 figures","Adv. Studies in Pure Math., vol. 71 (2016), 161-184",,,"math.AG math.RT","http://arxiv.org/licenses/nonexclusive-distrib/1.0/","  We define convex-geometric counterparts of divided difference (or Demazure)
operators from the Schubert calculus and representation theory. These operators
are used to construct inductively polytopes that capture Demazure characters of
representations of reductive groups. In particular, Gelfand-Zetlin polytopes
and twisted cubes of Grossberg-Karshon are obtained in a uniform way.
","[{""version"":""v1"",""created"":""Sat, 27 Jul 2013 08:10:37 GMT""}]","2019-02-08"
"1307.7235","Francois Charette","Fran\c{c}ois Charette and Octav Cornea","Categorification of Seidel's representation","32 pages, 4 figures. Updated to agree with the published version. To
  appear in Israel Journal of Mathematics",,,,"math.SG","http://arxiv.org/licenses/nonexclusive-distrib/1.0/","  Two natural symplectic constructions, the Lagrangian suspension and Seidel's
quantum representation of the fundamental group of the group of Hamiltonian
diffeomorphisms, Ham(M), with (M,\omega) a monotone symplectic manifold, admit
categorifications as actions of the fundamental groupoid \Pi(Ham(M)) on a
cobordism category recently introduced in \cite{Bi-Co:cob2} and, respectively,
on a monotone variant of the derived Fukaya category. We show that the functor
constructed in \cite{Bi-Co:cob2} that maps the cobordism category to the
derived Fukaya category is equivariant with respect to these actions.
","[{""version"":""v1"",""created"":""Sat, 27 Jul 2013 08:20:53 GMT""},{""version"":""v2"",""created"":""Tue, 30 Jul 2013 07:16:06 GMT""},{""version"":""v3"",""created"":""Tue, 13 Jan 2015 11:05:09 GMT""}]","2015-01-14"
"1307.7236","Perrin Nicolas","Piotr Achinger and Nicolas Perrin","Spherical multiple flags","16 pages",,,,"math.AG","http://arxiv.org/licenses/nonexclusive-distrib/1.0/","  For a reductive group G, the products of projective rational varieties
homogeneous under G that are spherical for G have been classified by
Stembridge. We consider the B-orbit closures in these spherical varieties and
prove that under some mild restrictions they are normal, Cohen-Macaulay and
have a rational resolution.
","[{""version"":""v1"",""created"":""Sat, 27 Jul 2013 08:44:16 GMT""}]","2013-07-30"
"1307.7237","Guillaume Jeanmairet","Guillaume Jeanmairet, Maximilien Levesque and Daniel Borgis","Molecular Density Functional Theory of Water describing Hydrophobicity
  at Short and Long Length Scales","24 pages, 8 figures","J. Chem. Phys. 139, 154101 (2013)","10.1063/1.4824737",,"physics.chem-ph","http://arxiv.org/licenses/nonexclusive-distrib/1.0/","  We present an extension of our recently introduced molecular density
functional theory of water [G. Jeanmairet et al., J. Phys. Chem. Lett. 4, 619,
2013] to the solvation of hydrophobic solutes of various sizes, going from
angstroms to nanometers. The theory is based on the quadratic expansion of the
excess free energy in terms of two classical density fields, the particle
density and the multipolar polarization density. Its implementation requires as
input a molecular model of water and three measurable bulk properties, namely
the structure factor and the k-dependent longitudinal and transverse dielectric
susceptibilities. The fine three-dimensional water structure around small
hydrophobic molecules is found to be well reproduced. In contrast the computed
solvation free-energies appear overestimated and do not exhibit the correct
qualitative behavior when the hydrophobic solute is grown in size. These
shortcomings are corrected, in the spirit of the Lum-Chandler-Weeks theory, by
complementing the functional with a truncated hard-sphere functional acting
beyond quadratic order in density. It makes the resulting functional compatible
with the Van-der-Waals theory of liquid-vapor coexistence at long range.
Compared to available molecular simulations, the approach yields reasonable
solvation structure and free energy of hard or soft spheres of increasing size,
with a correct qualitative transition from a volume-driven to a surface-driven
regime at the nanometer scale.
","[{""version"":""v1"",""created"":""Sat, 27 Jul 2013 09:18:24 GMT""},{""version"":""v2"",""created"":""Fri, 18 Oct 2013 10:45:52 GMT""}]","2013-10-21"
"1307.7238","Dr. Nadeem Javaid","S. N. Mohammad, M. J. Ashraf, S. Wasiq, S. Iqbal, N. Javaid","Analysis and Modeling of Network Connectivity in Routing Protocols for
  MANETs and VANETs","IEEE 8th International Conference on Broadband and Wireless
  Computing, Communication and Applications (BWCCA'13), Compiegne, France",,"10.1109/BWCCA.2013.91",,"cs.NI","http://arxiv.org/licenses/nonexclusive-distrib/1.0/","  In this paper, a framework is presented for node distribution with respect to
density, network connectivity and communication time. According to modeled
framework we evaluate and compare the performance of three routing protocols;
Ad-hoc On-demand Distance Vector (AODV), Dynamic Source Routing (DSR) and
Fisheye State Routing (FSR) in MANETs and VANETs using two Mac-layer protocols;
802.11 and 802.11p. We have further modified these protocols by changing their
routing information exchange intervals; MOD AODV, MOD DSR and MOD FSR. A
comprehensive simulation work is performed in NS-2 for the comparison of these
routing protocols for varying mobilities and scalabilities of nodes. To
evaluate their efficiency; throughput, End-to-End Delay (E2ED) and Normalized
Routing Load (NRL) of these protocols are taken into account as performance
parameters. After extensive simulations, we observe that AODV outperforms both
with MANETs and VANETs.
","[{""version"":""v1"",""created"":""Sat, 27 Jul 2013 09:21:57 GMT""}]","2016-11-15"
"1307.7239","Jean Gutt","Jean Gutt","Generalized Conley-Zehnder index","arXiv admin note: substantial text overlap with arXiv:1201.3728",,,,"math.SG","http://arxiv.org/licenses/nonexclusive-distrib/1.0/","  The Conley-Zehnder index associates an integer to any continuous path of
symplectic matrices starting from the identity and ending at a matrix which
does not admit 1 as an eigenvalue. We give new ways to compute this index.
Robbin and Salamon define a generalization of the Conley-Zehnder index for any
continuous path of symplectic matrices; this generalization is half integer
valued. It is based on a Maslov-type index that they define for a continuous
path of Lagrangians in a symplectic vector space $(W,\bar{\Omega})$, having
chosen a given reference Lagrangian $V$. Paths of symplectic endomorphisms of
$(\R^{2n},\Omega_0)$ are viewed as paths of Lagrangians defined by their graphs
in $(W=\R^{2n}\oplus \R^{2n},\bar{\Omega}=\Omega_0\oplus -\Omega_0)$ and the
reference Lagrangian is the diagonal. Robbin and Salamon give properties of
this generalized Conley-Zehnder index and an explicit formula when the path has
only regular crossings. We give here an axiomatic characterization of this
generalized Conley-Zehnder index. We also give an explicit way to compute it
for any continuous path of symplectic matrices.
","[{""version"":""v1"",""created"":""Sat, 27 Jul 2013 09:23:41 GMT""}]","2013-07-30"
"1307.7240","Dr. Nadeem Javaid","S. N. Mohammad, S. Wasiq, W. Arshad, N. Javaid, S. Khattak, M. J.
  Ashraf","Modeling Probability of Path Loss for DSDV, OLSR and DYMO above 802.11
  and 802.11p","IEEE 8th International Conference on Broadband and Wireless
  Computing, Communication and Applications (BWCCA'13), Compiegne, France",,"10.1109/BWCCA.2013.92",,"cs.NI","http://arxiv.org/licenses/nonexclusive-distrib/1.0/","  This paper presents path loss model along with framework for probability
distribution function for VANETs. Furthermore, we simulate three routing
protocols Destination Sequenced Distance Vector (DSDV), Optimized Link State
Routing (OLSR) and Dynamic MANET On-demand (DYMO) in NS-2 to evaluate and
compare their performance using two Mac-layer Protocols 802.11 and 802.11p. A
novel approach of this work is modifications in existing parameters to achieve
high efficiency. After extensive simulations, we observe that DSDV out performs
with 802.11p while DYMO gives best performance with 802.11.
","[{""version"":""v1"",""created"":""Sat, 27 Jul 2013 09:27:02 GMT""}]","2016-11-15"
"1307.7241","Dr. Nadeem Javaid","A. Tauqir, S. Akram, A. H. Khan, N. Javaid, M. Akbar","Non-Invasive Induction Link Model for Implantable Biomedical
  Microsystems: Pacemaker to Monitor Arrhythmic Patients in Body Area Networks","IEEE 8th International Conference on Broadband and Wireless
  Computing, Communication and Applications (BWCCA'13), Compiegne, France",,"10.1109/BWCCA.2013.44",,"cs.NI","http://arxiv.org/licenses/nonexclusive-distrib/1.0/","  In this paper, a non-invasive inductive link model for an Implantable
Biomedical Microsystems (IBMs) such as, a pacemaker to monitor Arrhythmic
Patients (APs) in Body Area Networks (BANs) is proposed. The model acts as a
driving source to keep the batteries charged, inside a device called,
pacemaker. The device monitors any drift from natural human heart beats, a
condition of arrythmia and also in turn, produces electrical pulses that create
forced rhythms that, matches with the original normal heart rhythms. It
constantly sends a medical report to the health center to keep the medical
personnel aware of the patient's conditions and let them handle any critical
condition, before it actually happens. Two equivalent models are compared by
carrying the simulations, based on the parameters of voltage gain and link
efficiency. Results depict that the series tuned primary and parallel tuned
secondary circuit achieves the best results for both the parameters, keeping in
view the constraint of coupling co-efficient (k), which should be less than a
value \emph{0.45} as, desirable for the safety of body tissues.
","[{""version"":""v1"",""created"":""Sat, 27 Jul 2013 09:33:51 GMT""}]","2016-11-15"
"1307.7242","Dr. Nadeem Javaid","N. Javaid, S. Faisal, Z. A. Khan, D. Nayab, M. Zahid","Measuring Fatigue of Soldiers in Wireless Body Area Sensor Networks","IEEE 8th International Conference on Broadband and Wireless
  Computing, Communication and Applications (BWCCA'13), Compiegne, France",,"10.1109/BWCCA.2013.43",,"cs.NI","http://arxiv.org/licenses/nonexclusive-distrib/1.0/","  Wireless Body Area Sensor Networks (WBASNs) consist of on-body or in-body
sensors placed on human body for health monitoring. Energy conservation of
these sensors, while guaranteeing a required level of performance, is a
challenging task. Energy efficient routing schemes are designed for the
longevity of network lifetime. In this paper, we propose a routing protocol for
measuring fatigue of a soldier. Three sensors are attached to soldier's body
that monitor specific parameters. Our proposed protocol is an event driven
protocol and takes three scenarios for measuring the fatigue of a soldier. We
evaluate our proposed work in terms of network lifetime, throughput, remaining
energy of sensors and fatigue of a soldier.
","[{""version"":""v1"",""created"":""Sat, 27 Jul 2013 09:44:05 GMT""}]","2016-11-15"
"1307.7243","Natalia Kovaleva","N. N. Kovaleva, K. I. Kugel, A. V. Bazhenov, T. N. Fursova, W. Loeser,
  Y. Xu, G. Behr, and F. V. Kusmartsev","Formation of metallic magnetic clusters in a Kondo-lattice metal:
  Evidence from an optical study","30 pages, 6 Figures","Scientific Reports 27 November 2012: Vol. 2, Article number : 890","10.1038/srep00890",,"cond-mat.str-el","http://arxiv.org/licenses/nonexclusive-distrib/1.0/","  Magnetic materials are usually divided into two classes: those with localised
magnetic moments, and those with itinerant charge carriers. We present a
comprehensive experimental (spectroscopic ellipsomerty) and theoretical study
to demonstrate that these two types of magnetism do not only coexist but
complement each other in the Kondo-lattice metal, Tb2PdSi3. In this material
the itinerant charge carriers interact with large localised magnetic moments of
Tb(4f) states, forming complex magnetic lattices at low temperatures, which we
associate with self-organisation of magnetic clusters. The formation of
magnetic clusters results in low-energy optical spectral weight shifts, which
correspond to opening of the pseudogap in the conduction band of the itinerant
charge carriers and development of the low- and high-spin intersite electronic
transitions. This phenomenon, driven by self-trapping of electrons by magnetic
fluctuations, could be common in correlated metals, including besides
Kondo-lattice metals, Fe-based and cuprate superconductors.
","[{""version"":""v1"",""created"":""Sat, 27 Jul 2013 10:12:53 GMT""}]","2013-07-30"
"1307.7244","Lajos Gergely Gyurk\'o","Lajos Gergely Gyurk\'o, Terry Lyons, Mark Kontkowski, Jonathan Field","Extracting information from the signature of a financial data stream",,,,,"q-fin.ST","http://arxiv.org/licenses/nonexclusive-distrib/1.0/","  Market events such as order placement and order cancellation are examples of
the complex and substantial flow of data that surrounds a modern financial
engineer. New mathematical techniques, developed to describe the interactions
of complex oscillatory systems (known as the theory of rough paths) provides
new tools for analysing and describing these data streams and extracting the
vital information. In this paper we illustrate how a very small number of
coefficients obtained from the signature of financial data can be sufficient to
classify this data for subtle underlying features and make useful predictions.
  This paper presents financial examples in which we learn from data and then
proceed to classify fresh streams. The classification is based on features of
streams that are specified through the coordinates of the signature of the
path. At a mathematical level the signature is a faithful transform of a
multidimensional time series. (Ben Hambly and Terry Lyons \cite{uniqueSig}),
Hao Ni and Terry Lyons \cite{NiLyons} introduced the possibility of its use to
understand financial data and pointed to the potential this approach has for
machine learning and prediction.
  We evaluate and refine these theoretical suggestions against practical
examples of interest and present a few motivating experiments which demonstrate
information the signature can easily capture in a non-parametric way avoiding
traditional statistical modelling of the data. In the first experiment we
identify atypical market behaviour across standard 30-minute time buckets
sampled from the WTI crude oil future market (NYMEX). The second and third
experiments aim to characterise the market ""impact"" of and distinguish between
parent orders generated by two different trade execution algorithms on the FTSE
100 Index futures market listed on NYSE Liffe.
","[{""version"":""v1"",""created"":""Sat, 27 Jul 2013 10:13:04 GMT""},{""version"":""v2"",""created"":""Tue, 15 Jul 2014 09:44:41 GMT""}]","2014-07-16"
"1307.7245","Dr. Nadeem Javaid","A. Rao, M. Akbar, N. Javaid, S. N. Mohammad, S. Sarfraz","AM-DisCNT: Angular Multi-hop DIStance based Circular Network
  Transmission Protocol for WSNs","IEEE 8th International Conference on Broadband and Wireless
  Computing, Communication and Applications (BWCCA'13), Compiegne, France",,"10.1109/BWCCA.2013.14",,"cs.NI","http://arxiv.org/licenses/nonexclusive-distrib/1.0/","  The nodes in wireless sensor networks (WSNs) contain limited energy
resources, which are needed to transmit data to base station (BS). Routing
protocols are designed to reduce the energy consumption. Clustering algorithms
are best in this aspect. Such clustering algorithms increase the stability and
lifetime of the network. However, every routing protocol is not suitable for
heterogeneous environments. AM-DisCNT is proposed and evaluated as a new energy
efficient protocol for wireless sensor networks. AM-DisCNT uses circular
deployment for even consumption of energy in entire wireless sensor network.
Cluster-head selection is on the basis of energy. Highest energy node becomes
CH for that round. Energy is again compared in the next round to check the
highest energy node of that round. The simulation results show that AM-DisCNT
performs better than the existing heterogeneous protocols on the basis of
network lifetime, throughput and stability of the system.
","[{""version"":""v1"",""created"":""Sat, 27 Jul 2013 10:21:02 GMT""}]","2016-11-15"
"1307.7246","Abhijit Banerjee","Bijan Bagchi, Subhrajit Modak, Prasanta K. Panigrahi","Tracking down localized modes in PT-symmetric Hamiltonians under the
  influence of a competing nonlinearity","10pages, To be published in Acta Polytechnica",,,,"quant-ph math-ph math.MP nlin.SI","http://arxiv.org/licenses/nonexclusive-distrib/1.0/","  The relevance of parity and time reversal (PT)-symmetric structures in
optical systems is known for sometime with the correspondence existing between
the Schrodinger equation and the paraxial equation of diffraction where the
time parameter represents the propagating distance and the refractive index
acts as the complex potential. In this paper, we systematically analyze a
normalized form of the nonlinear Schrodinger system with two new families of
PT-symmetric potentials in the presence of competing nonlinearities. We
generate a class of localized eigenmodes and carry out a linear stability
analysis on the solutions. In particular, we find an interesting feature of
bifurcation charaterized by the parameter of perturbative growth rate passing
through zero where a transition to imaginary eigenvalues occurs.
","[{""version"":""v1"",""created"":""Sat, 27 Jul 2013 10:25:41 GMT""},{""version"":""v2"",""created"":""Sun, 19 Jan 2014 15:58:09 GMT""}]","2014-01-21"
"1307.7247","Dmitri Solovyev Dr.","T. Zalialiutdinov, Yu. Baukina, D. Solovyev and L. Labzowsky","Theory of the multiphoton cascade transitions with two photon links:
  comparison of Quantum Electrodynamical and Quantum Mechanical approaches","24 pages, 4 figures, 2 tables. arXiv admin note: substantial text
  overlap with arXiv:1204.2364",,"10.1088/0953-4075/47/11/115007",,"physics.atom-ph","http://arxiv.org/licenses/nonexclusive-distrib/1.0/","  QED theory of multiphoton cascade transitions in atoms and ions is developed.
In particular the $ 3s\rightarrow1s+2\gamma $, $ 4s\rightarrow1s+2\gamma $ and
$ 3p\rightarrow1s+3\gamma $ processes are considered. Two different approaches
(Quantum Electrodynamical and phenomenological Quantum Mechanical) are applied.
","[{""version"":""v1"",""created"":""Sat, 27 Jul 2013 10:32:09 GMT""}]","2015-06-16"
"1307.7248","Sajal Kumar Dhara","Sajal Kumar Dhara, B. Ravindra and Ravinder Kumar Banyal","Filament eruption in association with rotational motion near the
  filament footpoints","Accepted by New Astronomy 2013 July 01. 12 pages, 13 figures",,"10.1016/j.newast.2013.07.001",,"astro-ph.SR","http://arxiv.org/licenses/nonexclusive-distrib/1.0/","  The active region magnetic field surrounding the filament plays an important
role in filament formation, their evolution and disruption. We investigated a
filament eruption that occurred in southern hemisphere of the Sun on July 08,
2011 using AIA and HMI data. The filament was located in a region close to the
active region NOAA 11247 with its West-most footpoint anchored in the negative
polarity plage region and the East-most in the positive polarity plage region.
During observations, the magnetic flux was emerging in the active region and
also in the plage regions. The flux emergence was stopped in West-most
footpoint of the plage region about an hour before the filament eruption. A
converging motion was also observed for many hours in the Western footpoint of
the filament. The filament had left-handed twist and the net injected magnetic
helicity was positive in both footpoints. Both sign of magnetic helicity were
observed in the Western footpoint of the filament where the eruption has
initiated. Further, an anti-clockwise rotational motion was observed in both
the footpoints just after the onset of filament eruption which lasted for 6 min
during the eruption process. The emerging flux, converging motion and injection
of opposite magnetic helicity could be responsible for destabilizing of the
Western footpoint of the filament leading to eruption. The torque imbalance
between the expanded portion of the flux tube and the photosphere may have
caused the rotation in the footpoint region which changed the trend in the
injected magnetic helicity after the filament eruption.
","[{""version"":""v1"",""created"":""Sat, 27 Jul 2013 10:45:56 GMT""}]","2013-07-30"
"1307.7249","Stelios Stefanatos","Stelios Stefanatos and Angeliki Alexiou","Access Point Density and Bandwidth Partitioning in Ultra Dense Wireless
  Networks","To appear in IEEE Transactions on Communications",,,,"cs.IT math.IT","http://arxiv.org/licenses/nonexclusive-distrib/1.0/","  This paper examines the impact of system parameters such as access point
density and bandwidth partitioning on the performance of randomly deployed,
interference-limited, dense wireless networks. While much progress has been
achieved in analyzing randomly deployed networks via tools from stochastic
geometry, most existing works either assume a very large user density compared
to that of access points which does not hold in a dense network, and/or
consider only the user signal-to-interference-ratio as the system figure of
merit which provides only partial insight on user rate, as the effect of
multiple access is ignored. In this paper, the user rate distribution is
obtained analytically, taking into account the effects of multiple access as
well as the SIR outage. It is shown that user rate outage probability is
dependent on the number of bandwidth partitions (subchannels) and the way they
are utilized by the multiple access scheme. The optimal number of partitions is
lower bounded for the case of large access point density. In addition, an upper
bound of the minimum access point density required to provide an asymptotically
small rate outage probability is provided in closed form.
","[{""version"":""v1"",""created"":""Sat, 27 Jul 2013 11:11:33 GMT""},{""version"":""v2"",""created"":""Fri, 13 Dec 2013 11:56:46 GMT""},{""version"":""v3"",""created"":""Mon, 25 Aug 2014 13:38:04 GMT""}]","2014-08-26"
"1307.7250","Davide Proment Dr.","Davide Proment and Miguel Onorato and Carlo F. Barenghi","Torus quantum vortex knots in the Gross-Pitaevskii model for
  Bose-Einstein condensates","9 pages, 7 figures",,"10.1088/1742-6596/544/1/012022",,"cond-mat.quant-gas math.GT nlin.PS physics.flu-dyn","http://arxiv.org/licenses/nonexclusive-distrib/1.0/","  We examine on the static and dynamical properties of quantum knots in a
Bose-Einstein condensate. In particular, we consider the Gross-Pitaevskii model
and revise a technique to construct ab initio the condensate wave-function of a
generic torus knot. After analysing its excitation energy, we study its
dynamics relating the topological parameter to its translational velocity and
characteristic size. We also investigate the breaking mechanisms of non
shape-preserving torus knots confirming an evidence of universal decaying
behaviour previously observed.
","[{""version"":""v1"",""created"":""Sat, 27 Jul 2013 11:53:55 GMT""},{""version"":""v2"",""created"":""Tue, 13 May 2014 15:02:06 GMT""}]","2014-10-28"
