"1307.7083","Guillaume Dubus","Guillaume Dubus","Gamma-ray binaries and related systems","71 pages, 23 figures, minor updates to text, references, figures to
  reflect published version","Astronomy and Astrophysics Review, 21, 64 (2013)","10.1007/s00159-013-0064-5",,"astro-ph.HE","http://arxiv.org/licenses/nonexclusive-distrib/1.0/","  After initial claims and a long hiatus, it is now established that several
binary stars emit high (0.1-100 GeV) and very high energy (>100 GeV) gamma
rays. A new class has emerged called 'gamma-ray binaries', since most of their
radiated power is emitted beyond 1 MeV. Accreting X-ray binaries, novae and a
colliding wind binary (eta Car) have also been detected - 'related systems'
that confirm the ubiquity of particle acceleration in astrophysical sources. Do
these systems have anything in common ? What drives their high-energy emission
? How do the processes involved compare to those in other sources of gamma
rays: pulsars, active galactic nuclei, supernova remnants ? I review the wealth
of observational and theoretical work that have followed these detections, with
an emphasis on gamma-ray binaries. I present the current evidence that
gamma-ray binaries are driven by rotation-powered pulsars. Binaries are
laboratories giving access to different vantage points or physical conditions
on a regular timescale as the components revolve on their orbit. I explain the
basic ingredients that models of gamma-ray binaries use, the challenges that
they currently face, and how they can bring insights into the physics of
pulsars. I discuss how gamma-ray emission from microquasars provides a window
into the connection between accretion--ejection and acceleration, while eta Car
and novae raise new questions on the physics of these objects - or on the
theory of diffusive shock acceleration. Indeed, explaining the gamma-ray
emission from binaries strains our theories of high-energy astrophysical
processes, by testing them on scales and in environments that were generally
not foreseen, and this is how these detections are most valuable.
","[{""version"":""v1"",""created"":""Fri, 26 Jul 2013 16:09:15 GMT""},{""version"":""v2"",""created"":""Thu, 5 Sep 2013 12:43:08 GMT""}]","2013-09-06"
"1307.7084","Sayak Mukherjee","Sayak Mukherjee, Stephanie Rigaud, Sang-Cheol Seok, Guo Fu, Agnieszka
  Prochenka, Michael Dworkin, Nicholas R. J. Gascoigne, Veronica J. Vieland,
  Karsten Sauer and Jayajit Das","In silico Modeling of Itk Activation Kinetics in Thymocytes Suggests
  Competing Positive and Negative IP4 Mediated Feedbacks Increase Robustness",,"PLOS ONE, Vol 8, Issue 9, Page e73937, September 2013","10.1371/journal.pone.0073937",,"q-bio.CB q-bio.QM","http://arxiv.org/licenses/nonexclusive-distrib/1.0/","  The inositol-phosphate messenger inositol(1,3,4,5)tetrakisphosphate (IP4) is
essential for thymocyte positive selection by regulating plasma-membrane
association of the protein tyrosine kinase Itk downstream of the T cell
receptor (TCR). IP4 can act as a soluble analog of the phosphoinositide
3-kinase (PI3K) membrane lipid product phosphatidylinositol(3,4,5)trisphosphate
(PIP3). PIP3 recruits signaling proteins such as Itk to cellular membranes by
binding to PH and other domains. In thymocytes, low-dose IP4 binding to the Itk
PH domain surprisingly promoted and high-dose IP4 inhibited PIP3 binding of Itk
PH domains. However, the mechanisms that underlie the regulation of membrane
recruitment of Itk by IP4 and PIP3 remain unclear. The distinct Itk PH domain
ability to oligomerize is consistent with a cooperative-allosteric mode of IP4
action. However, other possibilities cannot be ruled out due to difficulties in
quantitatively measuring the interactions between Itk, IP4 and PIP3, and in
generating non-oligomerizing Itk PH domain mutants. This has hindered a full
mechanistic understanding of how IP4 controls Itk function. By combining
experimentally measured kinetics of PLC{\gamma}1 phosphorylation by Itk with in
silico modeling of multiple Itk signaling circuits and a maximum entropy
(MaxEnt) based computational approach, we show that those in silico models
which are most robust against variations of protein and lipid expression levels
and kinetic rates at the single cell level share a cooperative-allosteric mode
of Itk regulation by IP4 involving oligomeric Itk PH domains at the plasma
membrane. This identifies MaxEnt as an excellent tool for quantifying
robustness for complex TCR signaling circuits and provides testable predictions
to further elucidate a controversial mechanism of PIP3 signaling.
","[{""version"":""v1"",""created"":""Fri, 26 Jul 2013 16:13:57 GMT""}]","2014-03-05"
"1307.7085","Thomas Dreyfus","Thomas Dreyfus","Confluence of meromorphic solutions of q-difference equations",,"Annales de l'Institut Fourier, 65 no. 2 (2015), p. 431-507","10.5802/aif.2937",,"math.CA","http://arxiv.org/licenses/nonexclusive-distrib/1.0/","  In this paper, we consider a q-analogue of the Borel-Laplace summation where
q>1 is a real parameter. In particular, we show that the Borel-Laplace
summation of a divergent power series solution of a linear differential
equation can be uniformly approximated on a convenient sector, by a meromorphic
solution of a corresponding family of linear q-difference equations. We perform
the computations for the basic hypergeometric series. Following J. Sauloy, we
prove how a fundamental set of solutions of a linear differential equation can
be uniformly approximated on a convenient domain by a fundamental set of
solutions of a corresponding family of linear q-difference equations. This
leads us to the approximations of Stokes matrices and monodromy matrices of the
linear differential equation by matrices with entries that are invariants by
the multiplication by q.
","[{""version"":""v1"",""created"":""Fri, 26 Jul 2013 16:22:46 GMT""},{""version"":""v2"",""created"":""Wed, 15 Apr 2015 07:39:58 GMT""}]","2019-02-22"
"1307.7086","Federico Galli","V. Balasubramanian, A. Bernamonti, J. de Boer, B. Craps, L. Franti, F.
  Galli, E. Keski-Vakkuri, B. M\""uller, A. Sch\""afer","Inhomogeneous holographic thermalization","53 pages, 10 figures; v2: references added",,"10.1007/JHEP10(2013)082",,"hep-th hep-ph nucl-th","http://arxiv.org/licenses/nonexclusive-distrib/1.0/","  The sudden injection of energy in a strongly coupled conformal field theory
and its subsequent thermalization can be holographically modeled by a shell
falling into anti-de Sitter space and forming a black brane. For a homogeneous
shell, Bhattacharyya and Minwalla were able to study this process analytically
using a weak field approximation. Motivated by event-by-event fluctuations in
heavy ion collisions, we include inhomogeneities in this model, obtaining
analytic results in a long wavelength expansion. In the early-time window in
which our approximations can be trusted, the resulting evolution matches well
with that of a simple free streaming model. Near the end of this time window,
we find that the stress tensor approaches that of second-order viscous
hydrodynamics. We comment on possible lessons for heavy ion phenomenology.
","[{""version"":""v1"",""created"":""Fri, 26 Jul 2013 16:23:25 GMT""},{""version"":""v2"",""created"":""Mon, 5 Aug 2013 10:23:52 GMT""}]","2013-11-25"
"1307.7087","Ryan Gabrys","Ryan Gabrys, Eitan Yaakobi, Lara Dolecek","Correcting Grain-Errors in Magnetic Media",,,,,"cs.IT math.IT","http://arxiv.org/licenses/nonexclusive-distrib/1.0/","  This paper studies new bounds and constructions that are applicable to the
combinatorial granular channel model previously introduced by Sharov and Roth.
We derive new bounds on the maximum cardinality of a grain-error-correcting
code and propose constructions of codes that correct grain-errors. We
demonstrate that a permutation of the classical group codes (e.g.,
Constantin-Rao codes) can correct a single grain-error. In many cases of
interest, our results improve upon the currently best known bounds and
constructions. Some of the approaches adopted in the context of grain-errors
may have application to other channel models.
","[{""version"":""v1"",""created"":""Fri, 26 Jul 2013 16:32:36 GMT""},{""version"":""v2"",""created"":""Mon, 30 Apr 2018 20:35:04 GMT""}]","2018-05-02"
"1307.7088","John Ross","Matthew McGonagle and John Ross","The Hyperplane is the Only Stable, Smooth Solution to the Isoperimetric
  Problem in Gaussian Space","20 pages",,,,"math.DG","http://arxiv.org/licenses/nonexclusive-distrib/1.0/","  We study stable smooth solutions to the isoperimetric type problem for a
Gaussian weight on Euclidean Space. That is, we study hypersurfaces $\Sigma^n
\subset \mathbb R^{n+1}$ that are second order stable critical points of
compact variations that minimize Gaussian weighted area and preserve Gaussian
weighted volume. We show that such $\Sigma$ satisfy a curvature condition, and
derive the Jacobi operator $L$ for the second variation of such $\Sigma$.
  Our first main result is that for non-planar $\Sigma$, bounds on the index of
$L$, acting on volume preserving variations, gives us that $\Sigma$ splits off
a linear space. A corollary of this result is that hyperplanes are the only
stable smooth complete solutions to this Gaussian isoperimetric type problem,
and that there are no hypersurfaces of index one. Finally, we show that for the
case of $\Sigma^2 \subset \mathbb R^3$, there is a gradient decay estimate
depending on bounds for the curvature condition and an appropriate area growth
bound. This shows that, in the limit as $R \to \infty$, stable $(\Sigma,
\partial\Sigma) \subset (B_{2R}(0), \partial B_{2R}(0))$ with good area growth
bounds approach hyperplanes.
","[{""version"":""v1"",""created"":""Fri, 26 Jul 2013 16:45:24 GMT""},{""version"":""v2"",""created"":""Mon, 8 Dec 2014 23:37:14 GMT""}]","2014-12-10"
"1307.7089","Guohui Lin","Weitian Tong, Zhi-Zhong Chen, Lusheng Wang, Yinfeng Xu, Jiuping Xu,
  Randy Goebel, Guohui Lin","An approximation algorithm for the Bandpass-2 problem",,,,,"cs.DS","http://arxiv.org/licenses/nonexclusive-distrib/1.0/","  The general Bandpass-$B$ problem is NP-hard and can be approximated by a
reduction into the weighted $B$-set packing problem, with a worst case
performance ratio of $O(B^2)$. When $B = 2$, a maximum weight matching gives a
2-approximation to the problem. In this paper, we call the Bandpass-2 problem
simply the Bandpass problem. The Bandpass problem can be viewed as a variation
of the maximum traveling salesman problem, in which the edge weights are
dynamic rather than given at the front. We present a ${426}{227}$-approximation
algorithm for the problem. Such an improved approximation is built on an
intrinsic structural property proven for the optimal solution and several novel
schemes to partition a $b$-matching into desired matchings.
","[{""version"":""v1"",""created"":""Fri, 26 Jul 2013 16:46:04 GMT""}]","2013-07-29"
"1307.7090","Dong Li","Jean Bourgain and Dong Li","Strong Ill-posedness of the incompressible Euler equation in borderline
  Sobolev spaces","119 pages",,,,"math.AP math-ph math.MP physics.flu-dyn","http://arxiv.org/licenses/nonexclusive-distrib/1.0/","  For the $d$-dimensional incompressible Euler equation, the standard energy
method gives local wellposedness for initial velocity in Sobolev space
$H^s(\mathbb R^d)$, $s>s_c:=d/2+1$. The borderline case $s=s_c$ was a folklore
open problem. In this paper we consider the physical dimensions $d=2,3$ and
show that if we perturb any given smooth initial data in $H^{s_c}$ norm, then
the corresponding solution can have infinite $H^{s_c}$ norm instantaneously at
$t>0$. The constructed solutions are unique and even $C^{\infty}$-smooth in
some cases. To prove these results we introduce a new strategy: large
Lagrangian deformation induces critical norm inflation. As an application we
also settle several closely related open problems.
","[{""version"":""v1"",""created"":""Fri, 26 Jul 2013 16:47:54 GMT""}]","2013-07-29"
"1307.7091","Hynek Kovarik","Hynek Kovarik, Timo Weidl","Improved Berezin-Li-Yau inequalities with magnetic field",,,"10.1142/S0129055X16500021",,"math.SP math-ph math.MP","http://arxiv.org/licenses/nonexclusive-distrib/1.0/","  In this paper we study the eigenvalue sums of Dirichlet Laplacians on bounded
domains. Among our results we establish an improvement of the Li-Yau bound in
the presence of a constant magnetic field.
","[{""version"":""v1"",""created"":""Fri, 26 Jul 2013 16:48:57 GMT""}]","2016-04-18"
"1307.7092","Joseph Lipman","Srikanth B. Iyengar, Joseph Lipman and Amnon Neeman","Relation between two twisted inverse image pseudofunctors in duality
  theory","Final version, to appear in Compositio Math. A few misprints fixed.
  30 pages","Compositio Math. 151 (2015) 735-764","10.1112/S0010437X14007672",,"math.AG math.AC","http://arxiv.org/licenses/nonexclusive-distrib/1.0/","  Grothendieck duality theory assigns to essentially-finite-type maps f of
noetherian schemes a pseudofunctor f^\times right-adjoint to Rf_*, and a
pseudofunctor f^! agreeing with f^\times when f is proper, but equal to the
usual inverse image f^* when f is etale. We define and study a canonical map
from the first pseudofunctor to the second. This map behaves well with respect
to flat base change, and is taken to an isomorphism by ""compactly supported""
versions of standard derived functors. Concrete realizations are described, for
instance for maps of affine schemes. Applications include proofs of reduction
theorems for Hochschild homology and cohomology, and of a remarkable formula
for the fundamental class of a flat map of affine schemes.
","[{""version"":""v1"",""created"":""Fri, 26 Jul 2013 16:50:25 GMT""},{""version"":""v2"",""created"":""Wed, 9 Jul 2014 01:48:15 GMT""},{""version"":""v3"",""created"":""Fri, 17 Oct 2014 18:49:01 GMT""}]","2019-02-20"
"1307.7093","Adam Rycerz","Grzegorz Rut and Adam Rycerz","Pseudodiffusive conductance, quantum-limited shot noise, and
  Landau-level hierarchy in biased graphene bilayer","Minor revisions, refs. added; new Section V describing the possible
  effects of indirect hoppings between the layers. Figure files optimized for
  the faster download. RevTeX, 13 pages, 10 figures","Phys. Rev. B 89, 045421 (2014)","10.1103/PhysRevB.89.045421",,"cond-mat.mes-hall","http://arxiv.org/licenses/nonexclusive-distrib/1.0/","  We discuss, by means of mode-matching analysis for the Dirac equation, how
splittings of the Landau-level (LL) degeneracies associated with spin, valley,
and layer degrees of freedom affect the ballistic conductance of graphene
bilayer. The results show that for wide samples ($W\gg{}L$) the
Landauer-B\""{u}ttiker conductance reaches the maximum
$G\simeq{}se^2/(\pi{h})\times{}W/L$ at the resonance via each LL, with the
prefactor varying from $s=8$ if all three degeneracies are preserved, to $s=1$
if all the degeneracies are split. In the absence of bias between the layers,
the degeneracies associated with spin and layer degrees of freedom may be split
by manipulating the doping and magnetic field; the conductance at the zeroth LL
is twice as large, while the conductance at any other LL equals to the
corresponding conductance of graphene monolayer. The presence of bias potential
allows one also to split the valley degeneracy. Our results show that the
charge transfer at each LL has pseudodiffusive character, with the second and
third cumulant quantified by ${\cal F}=1/3$ and ${\cal R}=1/15$ (respectively).
In case the electrochemical potential is allowed to slowly fluctuate in a
finite vicinity of LL, the resulting charge-transfer characteristics are still
quantum-limited, with ${\cal F}\simeq{}0.7$ and ${\cal R}\simeq{}0.5$ in the
limit of large fluctuations. The above values of ${\cal F}$ and ${\cal R}$ are
also predicted to be approached in the limit of high source-drain voltage
difference applied. The possible effects of indirect interlayer hopping
integrals are also briefly discussed.
","[{""version"":""v1"",""created"":""Fri, 26 Jul 2013 16:50:51 GMT""},{""version"":""v2"",""created"":""Thu, 14 Nov 2013 15:19:41 GMT""}]","2014-01-23"
"1307.7094","Wenjia Liu","Wenjia Liu, Shivakumar Jolad, Beate Schmittmann, and R. K. P. Zia","Modeling interacting dynamic networks: I. Preferred degree networks and
  their characteristics","Accepted by JSTAT",,"10.1088/1742-5468/2013/00/P00000",,"physics.soc-ph cond-mat.stat-mech","http://arxiv.org/licenses/nonexclusive-distrib/1.0/","  We study a simple model of dynamic networks, characterized by a set preferred
degree, $\kappa$. Each node with degree $k$ attempts to maintain its $\kappa$
and will add (cut) a link with probability $w(k;\kappa)$ ($1-w(k;\kappa)$). As
a starting point, we consider a homogeneous population, where each node has the
same $\kappa$, and examine several forms of $w(k;\kappa)$, inspired by
Fermi-Dirac functions. Using Monte Carlo simulations, we find the degree
distribution in steady state. In contrast to the well-known Erd\H{o}s-R\'{e}nyi
network, our degree distribution is not a Poisson distribution; yet its
behavior can be understood by an approximate theory. Next, we introduce a
second preferred degree network and couple it to the first by establishing a
controllable fraction of inter-group links. For this model, we find both
understandable and puzzling features. Generalizing the prediction for the
homogeneous population, we are able to explain the total degree distributions
well, but not the intra- or inter-group degree distributions. When monitoring
the total number of inter-group links, $X$, we find very surprising behavior.
$X$ explores almost the full range between its maximum and minimum allowed
values, resulting in a flat steady-state distribution, reminiscent of a simple
random walk confined between two walls. Both simulation results and analytic
approaches will be discussed.
","[{""version"":""v1"",""created"":""Fri, 26 Jul 2013 16:52:17 GMT""}]","2013-07-29"
"1307.7095","Joseph Elliston","Joseph Elliston, David J. Mulryne, Reza Tavakol","What Planck does not tell us about inflation","13 pages, 5 colour figures","Phys.Rev. D88 (2013) 063533","10.1103/PhysRevD.88.063533",,"astro-ph.CO hep-th","http://arxiv.org/licenses/nonexclusive-distrib/1.0/","  Planck data has not found the 'smoking gun' of non-Gaussianity that would
have necessitated consideration of inflationary models beyond the simplest
canonical single field scenarios. This raises the important question of what
these results do imply for more general models, and in particular, multi-field
inflation. In this paper we revisit four ways in which two-field scenarios can
behave differently from single field models; two-field slow-roll dynamics,
curvaton-type behaviour, inflation ending on an inhomogeneous hypersurface and
modulated reheating. We study the constraints that Planck data puts on these
classes of behaviour, focusing on the latter two which have been least studied
in the recent literature. We show that these latter classes are almost
equivalent, and extend their previous analyses by accounting for arbitrary
evolution of the isocurvature mode which, in particular, places important
limits on the Gaussian curvature of the reheating hypersurface. In general,
however, we find that Planck bispectrum results only constrain certain regions
of parameter space, leading us to conclude that inflation sourced by more than
one scalar field remains an important possibility.
","[{""version"":""v1"",""created"":""Fri, 26 Jul 2013 16:52:24 GMT""}]","2014-03-10"
"1307.7096","Mahin Abbasipour","Mahin Abbasipour","Toward Recovering Complete SRS for Softbody Simulation System and a
  Sample Application -- a Team 9a SOEN6481 W13 Project Report","51 pages, 8 figures, 8 tables",,,,"cs.SE","http://arxiv.org/licenses/nonexclusive-distrib/1.0/","  This document aims at specifying the requirements and capturing the needs of
users for building a softbody simulation system. This system has different
applications ranging from computer games to surgery training which facilitates
the creation and visualization of a certain softbody object. It also allows
users to interact with created object at real time. A softbody or deformable
object is an object whose shape changes due to an external force. Deformation
type varies depending on the amount of object deformation. Each object can have
multiple layers and each layer can have its own properties. So layers can be
different in pressure, density and motion.
","[{""version"":""v1"",""created"":""Fri, 26 Jul 2013 16:53:13 GMT""}]","2013-07-29"
"1307.7097","William Louis","OscSNS Collaboration, R. Allen, F. T. Avignone, J. Boissevain, Y.
  Efremenko, M. Elnimr, T. Gabriel, F. G. Garcia, G. T. Garvey, T. Handler, W.
  Huelsnitz, R. Imlay, Y. Kamyshkov, J. M. Link, W. C. Louis, G. B. Mills, S.
  R. Mishra, B. Osmanov, Z. Pavlovic, H. Ray, B. P. Roe, C. Rosenfeld, I.
  Stancu, R. Svoboda, R. Tayloe, R. Van de Water, M. J. Wetstein, D. H. White,
  M. Yeh","The OscSNS White Paper","This white paper is submitted as part of the SNOWMASS planning
  process",,,,"physics.ins-det hep-ex hep-ph nucl-ex","http://arxiv.org/licenses/nonexclusive-distrib/1.0/","  There exists a need to address and resolve the growing evidence for
short-baseline neutrino oscillations and the possible existence of sterile
neutrinos. Such non-standard particles require a mass of $\sim 1$ eV/c$^2$, far
above the mass scale associated with active neutrinos, and were first invoked
to explain the LSND $\bar \nu_\mu \rightarrow \bar \nu_e$ appearance signal.
More recently, the MiniBooNE experiment has reported a $2.8 \sigma$ excess of
events in antineutrino mode consistent with neutrino oscillations and with the
LSND antineutrino appearance signal. MiniBooNE also observed a $3.4 \sigma$
excess of events in their neutrino mode data. Lower than expected
neutrino-induced event rates using calibrated radioactive sources and nuclear
reactors can also be explained by the existence of sterile neutrinos. Fits to
the world's neutrino and antineutrino data are consistent with sterile
neutrinos at this $\sim 1$ eV/c$^2$ mass scale, although there is some tension
between measurements from disappearance and appearance experiments. In addition
to resolving this potential major extension of the Standard Model, the
existence of sterile neutrinos will impact design and planning for all future
neutrino experiments. It should be an extremely high priority to conclusively
establish if such unexpected light sterile neutrinos exist. The Spallation
Neutron Source (SNS) at Oak Ridge National Laboratory, built to usher in a new
era in neutron research, provides a unique opportunity for US science to
perform a definitive world-class search for sterile neutrinos.
","[{""version"":""v1"",""created"":""Fri, 26 Jul 2013 16:58:20 GMT""},{""version"":""v2"",""created"":""Fri, 6 Sep 2013 21:28:25 GMT""},{""version"":""v3"",""created"":""Mon, 7 Oct 2013 17:44:50 GMT""}]","2013-10-08"
"1307.7098","Justin R. Smith","Justin R. Smith","$\mathfrak{S}$-coalgebras determine fundamental groups","17 pages. arXiv admin note: text overlap with arXiv:1304.6328",,,,"math.AT","http://arxiv.org/licenses/nonexclusive-distrib/1.0/","  In this paper, we extend earlier work by showing that if $X$ and $Y$ are
simplicial complexes (i.e. simplicial sets whose nondegenerate simplices are
determined by their vertices), an isomorphism
$\mathcal{C}(X)\cong\mathcal{C}(Y)$ of coalgebras over the Barratt-Eccles
operad implies that the 3-skeleton of $X$ is weakly equivalent to the
3-skeleton of $Y$, also implying that $\pi_{1}(X)=\pi_{1}(Y)$.
","[{""version"":""v1"",""created"":""Fri, 26 Jul 2013 16:59:56 GMT""},{""version"":""v2"",""created"":""Mon, 12 Aug 2013 16:38:08 GMT""}]","2013-08-13"
"1307.7099","Thomas Teubner","S.P. Jones, A.D. Martin, M.G. Ryskin and T. Teubner","Probes of the small x gluon via exclusive J/psi and Upsilon","17 pages, 7 figures, 3 tables",,,"IPPP/13/52, DCPT/13/104, LTH 980","hep-ph","http://arxiv.org/licenses/nonexclusive-distrib/1.0/","  New, more precise data on diffractive J/psi photoproduction and on exclusive
J/psi production in the process pp -> p + J/psi + p at the LHC allow a better
constraint on the low-x gluon distribution in the domain of relatively low
scales Q^2 ~ 2-6 GeV^2. We account for the `skewed' effect and for the real
part of the amplitude, as well as for the absorptive corrections in the case of
the exclusive process pp -> p + J/psi + p. The predictions for exclusive J/psi
production at \sqrt{s}=8 and 14 TeV and for exclusive Upsilon(1S) production at
7, 8 and 14 TeV are also given. We present results at leading and
next-to-leading order.
","[{""version"":""v1"",""created"":""Fri, 26 Jul 2013 17:03:40 GMT""}]","2013-07-29"
"1307.7100","Marina Nielsen","Jorgivan M. Dias, Xiang Liu and Marina Nielsen","Predicition for the decay width of a charged state near the
  $D_s\bar{D}^*/D^*_s\bar{D}$ threshold","9 pages, 6 figures","Phys. Rev. D 88, 096014 (2013)","10.1103/PhysRevD.88.096014",,"hep-ph","http://arxiv.org/licenses/nonexclusive-distrib/1.0/","  Very recently it was predicted the existence of a charged state near the
$D_s\bar{D}^*/D^*_s\bar{D}$ threshold. This state, that we call $Z_{cs}^+$,
would be the strange partner of the recently observed $Z_c^\pm(3900)$. Using
standard techniques of QCD sum rules, we evaluate the three-point function for
the vertices $Z_{cs}^+ \, J/\psi \, K^+$, $Z_{cs}^+ \, \eta_c \, K^{*+}$ and
$Z_{cs}^+ \, D_s^+\bar{D}^{*0}$ and we make predictions for the corresponding
decay widths in these channels.
","[{""version"":""v1"",""created"":""Fri, 26 Jul 2013 17:08:10 GMT""}]","2013-12-04"
