"1307.7809","Carlos Sarraute","Carlos Sarraute (1 and 2), Olivier Buffet (3), Joerg Hoffmann (3) ((1)
  Core Security Technologies, (2) ITBA (Instituto Tecnologico de Buenos Aires),
  (3) INRIA)","Les POMDP font de meilleurs hackers: Tenir compte de l'incertitude dans
  les tests de penetration","JFPDA 2012 (7\`emes Journ\'ees Francophones Planification,
  D\'ecision, et Apprentissage pour la conduite de syst\`emes), Nancy, France",,,,"cs.AI cs.CR","http://creativecommons.org/licenses/by-nc-sa/3.0/","  Penetration Testing is a methodology for assessing network security, by
generating and executing possible hacking attacks. Doing so automatically
allows for regular and systematic testing. A key question is how to generate
the attacks. This is naturally formulated as planning under uncertainty, i.e.,
under incomplete knowledge about the network configuration. Previous work uses
classical planning, and requires costly pre-processes reducing this uncertainty
by extensive application of scanning methods. By contrast, we herein model the
attack planning problem in terms of partially observable Markov decision
processes (POMDP). This allows to reason about the knowledge available, and to
intelligently employ scanning actions as part of the attack. As one would
expect, this accurate solution does not scale. We devise a method that relies
on POMDPs to find good attacks on individual machines, which are then composed
into an attack on the network as a whole. This decomposition exploits network
structure to the extent possible, making targeted approximations (only) where
needed. Evaluating this method on a suitably adapted industrial test suite, we
demonstrate its effectiveness in both runtime and solution quality.
","[{""version"":""v1"",""created"":""Tue, 30 Jul 2013 04:21:54 GMT""}]","2013-07-31"
"1307.7810","Aaron Darling","Denisa Duma, Mary Wootters, Anna C. Gilbert, Hung Q. Ngo, Atri Rudra,
  Matthew Alpert, Timothy J. Close, Gianfranco Ciardo, and Stefano Lonardi","Accurate Decoding of Pooled Sequenced Data Using Compressed Sensing","Peer-reviewed and presented as part of the 13th Workshop on
  Algorithms in Bioinformatics (WABI2013)",,,,"q-bio.QM cs.CE cs.IT math.IT q-bio.GN","http://arxiv.org/licenses/nonexclusive-distrib/1.0/","  In order to overcome the limitations imposed by DNA barcoding when
multiplexing a large number of samples in the current generation of
high-throughput sequencing instruments, we have recently proposed a new
protocol that leverages advances in combinatorial pooling design (group
testing) doi:10.1371/journal.pcbi.1003010. We have also demonstrated how this
new protocol would enable de novo selective sequencing and assembly of large,
highly-repetitive genomes. Here we address the problem of decoding pooled
sequenced data obtained from such a protocol. Our algorithm employs a
synergistic combination of ideas from compressed sensing and the decoding of
error-correcting codes. Experimental results on synthetic data for the rice
genome and real data for the barley genome show that our novel decoding
algorithm enables significantly higher quality assemblies than the previous
approach.
","[{""version"":""v1"",""created"":""Tue, 30 Jul 2013 04:34:34 GMT""}]","2013-08-02"
"1307.7811","Aaron Darling","Alexandru I. Tomescu, Anna Kuosmanen, Romeo Rizzi, and Veli M\""akinen","A Novel Combinatorial Method for Estimating Transcript Expression with
  RNA-Seq: Bounding the Number of Paths","Peer-reviewed and presented as part of the 13th Workshop on
  Algorithms in Bioinformatics (WABI2013)",,,,"q-bio.QM cs.CE cs.DS","http://arxiv.org/licenses/nonexclusive-distrib/1.0/","  RNA-Seq technology offers new high-throughput ways for transcript
identification and quantification based on short reads, and has recently
attracted great interest. The problem is usually modeled by a weighted splicing
graph whose nodes stand for exons and whose edges stand for split alignments to
the exons. The task consists of finding a number of paths, together with their
expression levels, which optimally explain the coverages of the graph under
various fitness functions, such least sum of squares. In (Tomescu et al.
RECOMB-seq 2013) we showed that under general fitness functions, if we allow a
polynomially bounded number of paths in an optimal solution, this problem can
be solved in polynomial time by a reduction to a min-cost flow program. In this
paper we further refine this problem by asking for a bounded number k of paths
that optimally explain the splicing graph. This problem becomes NP-hard in the
strong sense, but we give a fast combinatorial algorithm based on dynamic
programming for it. In order to obtain a practical tool, we implement three
optimizations and heuristics, which achieve better performance on real data,
and similar or better performance on simulated data, than state-of-the-art
tools Cufflinks, IsoLasso and SLIDE. Our tool, called Traph, is available at
http://www.cs.helsinki.fi/gsa/traph/
","[{""version"":""v1"",""created"":""Tue, 30 Jul 2013 04:42:47 GMT""}]","2013-08-02"
"1307.7812","David  Garofalo","David Garofalo","The jet-disc connection: evidence for a reinterpretation in radio loud
  and radio quiet active galactic nuclei",,,"10.1093/mnras/stt1237",,"astro-ph.HE","http://arxiv.org/licenses/nonexclusive-distrib/1.0/","  To constrain models of the jet-disc connection, we explore Eddington ratios
reported in Foschini (2011) and interpret them in relation to the values in
Sikora et al. across the active galactic nuclei population from radio loud
quasars, their flat spectrum radio quasar subclass, the recently discovered
gamma-ray loud narrow-line type 1 Seyfert galaxies, Fanaroff-Riley type I (FRI)
radio galaxies and radio quiet quasars of the Palomar Green survey. While
appeal to disc truncation in radiatively inefficient flow appears to explain
the observed inverse relation between radio loudness and Eddington ratio in
radio loud and radio quiet quasars, FR I objects, scale invariance and recent
data on powerful jets in narrow-line Seyfert 1 galaxies offer compelling
arguments in favour of a reinterpretaion of the jet-disc connection.
","[{""version"":""v1"",""created"":""Tue, 30 Jul 2013 04:44:47 GMT""}]","2013-07-31"
"1307.7813","Aaron Darling","Gustavo Sacomoto, Vincent Lacroix, and Marie-France Sagot","A polynomial delay algorithm for the enumeration of bubbles with length
  constraints in directed graphs and its application to the detection of
  alternative splicing in RNA-seq data","Peer-reviewed and presented as part of the 13th Workshop on
  Algorithms in Bioinformatics (WABI2013)",,,,"q-bio.QM cs.CE cs.DS","http://arxiv.org/licenses/nonexclusive-distrib/1.0/","  We present a new algorithm for enumerating bubbles with length constraints in
directed graphs. This problem arises in transcriptomics, where the question is
to identify all alternative splicing events present in a sample of mRNAs
sequenced by RNA-seq. This is the first polynomial-delay algorithm for this
problem and we show that in practice, it is faster than previous approaches.
This enables us to deal with larger instances and therefore to discover novel
alternative splicing events, especially long ones, that were previously
overseen using existing methods.
","[{""version"":""v1"",""created"":""Tue, 30 Jul 2013 04:48:08 GMT""}]","2013-08-02"
"1307.7814","Joseph Paul Cohen","Joseph Paul Cohen","Wireless Message Dissemination via Selective Relay over Bluetooth
  (MDSRoB)",,,,,"cs.NI","http://creativecommons.org/licenses/by-nc-sa/3.0/","  This paper presents a wireless message dissemination method designed with no
need to trust other users. This method utilizes modern wireless adaptors
ability to broadcast device name and identification information. Using the
scanning features built into Bluetooth and Wifi, messages can be exchanged via
their device names. This paper outlines a method of interchanging multiple
messages to discoverable and nondiscoverable devices using a user defined
scanning interval method along with a response based system. By selectively
relaying messages each user is in control of their involvement in the ad-hoc
network.
","[{""version"":""v1"",""created"":""Tue, 30 Jul 2013 04:50:32 GMT""}]","2013-07-31"
"1307.7815","C. Pallis","C. Pallis","Models of Non-Minimal Chaotic Inflation in Supergravity","Updated version taking into account the results of arXiv:1312.1155","PoS CORFU2012 (2013) 061",,,"hep-ph astro-ph.CO","http://arxiv.org/licenses/nonexclusive-distrib/1.0/","  We show how we can implement chaotic inflation in the context of supergravity
by conveniently selecting the functional form of a strong enough non-minimal
coupling between the inflaton and the Ricci scalar curvature. The procedure can
be applied when a gauge singlet or non-singlet inflaton is coupled to another
singlet superfield within linear-quadratic, trilinear or bilinear
superpotential terms. The tachyonic instability occurring along the direction
of the accompanying non-inflaton field can be cured by expanding the kinetic
part of the frame function up to the fourth order in powers of the various
fields. In the case of a gauge non-singlet inflaton, though, a conjugation
symmetry has to be imposed on these terms in order for the flatness of the
inflationary potential is maintained. On the other hand, some of these terms
assist us to precisely reconcile the resulting scalar spectral index with the
current PLANCK measurements while the other inflationary observables are in
agreement with data.
","[{""version"":""v1"",""created"":""Tue, 30 Jul 2013 04:51:18 GMT""},{""version"":""v2"",""created"":""Thu, 11 Dec 2014 18:59:56 GMT""}]","2014-12-12"
"1307.7816","Aaron Lauda","Alexander P. Ellis and Aaron D. Lauda","An odd categorification of quantum sl(2)","64 pages, tikz diagrams. v2 corrects typos","Quantum Topology, Volume 7, Issue 2, 2016, pages 329-433","10.4171/QT/78",,"math.QA","http://arxiv.org/licenses/nonexclusive-distrib/1.0/","  We define a 2-category that categorifies the covering Kac-Moody algebra for
sl(2) introduced by Clark and Wang. This categorification forms the structure
of a super-2-category as formulated by Kang, Kashiwara, and Oh. The
super-2-category structure introduces a (Z x Z_2)-grading giving its
Grothendieck group the structure of a free module over the group algebra of Z x
Z_2. By specializing the Z_2-action to +1 or to -1, the construction
specializes to an ""odd"" categorification of sl(2) and to a
supercategorification of osp(1|2), respectively.
","[{""version"":""v1"",""created"":""Tue, 30 Jul 2013 04:54:29 GMT""},{""version"":""v2"",""created"":""Fri, 28 Feb 2014 17:47:29 GMT""}]","2016-07-12"
"1307.7817","Aaron Darling","Rolf Backofen, Markus Fricke, Manja Marz, Jing Qin, and Peter F.
  Stadler","Distribution of graph-distances in Boltzmann ensembles of RNA secondary
  structures","Peer-reviewed and presented as part of the 13th Workshop on
  Algorithms in Bioinformatics (WABI2013)",,,,"q-bio.QM q-bio.BM","http://arxiv.org/licenses/nonexclusive-distrib/1.0/","  Large RNA molecules often carry multiple functional domains whose spatial
arrangement is an important determinant of their function. Pre-mRNA splicing,
furthermore, relies on the spatial proximity of the splice junctions that can
be separated by very long introns. Similar effects appear in the processing of
RNA virus genomes. Albeit a crude measure, the distribution of spatial
distances in thermodynamic equilibrium therefore provides useful information on
the overall shape of the molecule can provide insights into the interplay of
its functional domains. Spatial distance can be approximated by the
graph-distance in RNA secondary structure. We show here that the equilibrium
distribution of graph-distances between arbitrary nucleotides can be computed
in polynomial time by means of dynamic programming. A naive implementation
would yield recursions with a very high time complexity of O(n^11). Although we
were able to reduce this to O(n^6) for many practical applications a further
reduction seems difficult. We conclude, therefore, that sampling approaches,
which are much easier to implement, are also theoretically favorable for most
real-life applications, in particular since these primarily concern long-range
interactions in very large RNA molecules.
","[{""version"":""v1"",""created"":""Tue, 30 Jul 2013 05:03:11 GMT""}]","2013-07-31"
"1307.7818","Satyendra Das Dr","S.K. Das, R. Guin, D. Banerjee, P. Das, T. Butz, V. S. Amaral, J.G.
  Correia, M. B. Barbosa","PAC study of the static and dynamic aspects of metal atom inside C60
  cage","12 pages, 4 figures one table",,,,"cond-mat.mtrl-sci","http://arxiv.org/licenses/nonexclusive-distrib/1.0/","  30 keV 111mCd and 50 keV 199mHg beams from ISOLDE were used to implant on
preformed target of C60 with the thickness of 1 mg/cm2. Endofullerene
compounds, viz.,111mCd@C60 and 199mHg@C60 formed during implantation were
separated by filtration through micropore filter paper followed by solvent
extraction. Dried samples of the endofullerene compounds were counted for the
coincidence for the 151-245 keV cascade of 111mCd and 374-158 keV cascade for
199mHg for the TDPAC measurement on a six LaBr3 detector system coupled with
digital electronics. The results indicate a single site occupied by the Cd atom
in the fullerene cage with fast relaxation component which means that the Cd
atom does move inside the cage at room temperature. The quadrupole interaction
frequency and asymmetry parameter of the Cd atom occupying the site in C60 are
WQ=8.14(42) Mrad/s and eta= 0.42(9) respectively with a site population of 28%.
Fast relaxation constant is 0.003 ns-1 with a site contribution of 72%. On the
other hand, Hg atom has two static sites of quadrupole frequencies,
WQ1=281.60(16.9) Mrad/s and WQ2=202.30(22.7) Mrad/s. Respective asymmetry
parameters are eta1=0.1(1) and eta2=0.2(1). The static components have a
contribution of 40% with the rest 60% coming from the fast relaxing component.
","[{""version"":""v1"",""created"":""Tue, 30 Jul 2013 05:06:17 GMT""}]","2013-07-31"
"1307.7819","Yuan Xu","Yuan Xu","Complex versus real orthogonal polynomials of two variables",,,,,"math.CA","http://arxiv.org/licenses/nonexclusive-distrib/1.0/","  Orthogonal polynomials of two real variables can often be represented in
complex variables. We explore the connection between the two types of
representations and study the structural relations of complex orthogonal
polynomials. The complex Hermite orthogonal polynomials and the disk
polynomials are used as illustrating examples.
","[{""version"":""v1"",""created"":""Tue, 30 Jul 2013 05:09:49 GMT""}]","2013-07-31"
"1307.7820","Aaron Darling","Balaji Venkatachalam, Dan Gusfield, and Yelena Frid","Faster Algorithms for RNA-folding using the Four-Russians method","Peer-reviewed and presented as part of the 13th Workshop on
  Algorithms in Bioinformatics (WABI2013). Editor's note: abstract was
  shortened to comply with arxiv requirements. Full abstract in PDF",,,,"q-bio.QM cs.CE cs.DS","http://arxiv.org/licenses/nonexclusive-distrib/1.0/","  The secondary structure that maximizes the number of non-crossing matchings
between complimentary bases of an RNA sequence of length n can be computed in
O(n^3) time using Nussinov's dynamic programming algorithm. The Four-Russians
method is a technique that will reduce the running time for certain dynamic
programming algorithms by a multiplicative factor after a preprocessing step
where solutions to all smaller subproblems of a fixed size are exhaustively
enumerated and solved. Frid and Gusfield designed an O(\frac{n^3}{\log n})
algorithm for RNA folding using the Four-Russians technique. In their algorithm
the preprocessing is interleaved with the algorithm computation. (Algo. Mol.
Biol., 2010).
  We simplify the algorithm and the analysis by doing the preprocessing once
prior to the algorithm computation. We call this the two-vector method. We also
show variants where instead of exhaustive preprocessing, we only solve the
subproblems encountered in the main algorithm once and memoize the results. We
give a simple proof of correctness and explore the practical advantages over
the earlier method. The Nussinov algorithm admits an O(n^2) time parallel
algorithm. We show a parallel algorithm using the two-vector idea that improves
the time bound to O(\frac{n^2}{log n}).
  We discuss the organization of the data structures to exploit coalesced
memory access for fast running times. The ideas to organize the data structures
also help in improving the running time of the serial algorithms. For sequences
of length up to 6000 bases the parallel algorithm takes only about 2.5 seconds
and the two-vector serial method takes about 57 seconds on a desktop and 15
seconds on a server. Among the serial algorithms, the two-vector and memoized
versions are faster than the Frid-Gusfield algorithm by a factor of 3, and are
faster than Nussinov by up to a factor of 20.
","[{""version"":""v1"",""created"":""Tue, 30 Jul 2013 05:13:11 GMT""}]","2013-08-02"
"1307.7821","Aaron Darling","Jesper Jansson, Chuanqi Shen, and Wing-Kin Sung","Algorithms for the Majority Rule (+) Consensus Tree and the Frequency
  Difference Consensus Tree","Peer-reviewed and presented as part of the 13th Workshop on
  Algorithms in Bioinformatics (WABI2013)",,,,"cs.DS cs.CE q-bio.QM","http://arxiv.org/licenses/nonexclusive-distrib/1.0/","  This paper presents two new deterministic algorithms for constructing
consensus trees. Given an input of k phylogenetic trees with identical leaf
label sets and n leaves each, the first algorithm constructs the majority rule
(+) consensus tree in O(kn) time, which is optimal since the input size is
Omega(kn), and the second one constructs the frequency difference consensus
tree in min(O(kn^2), O(kn (k+log^2 n))) time.
","[{""version"":""v1"",""created"":""Tue, 30 Jul 2013 05:24:12 GMT""},{""version"":""v2"",""created"":""Tue, 6 Aug 2013 05:40:35 GMT""}]","2013-08-07"
"1307.7822","Rongqing Zhang","Jun Deng, Rongqing Zhang, Lingyang Song, Zhu Han, and Bingli Jiao","Truthful Mechanisms for Secure Communication in Wireless Cooperative
  System","To appear in IEEE Transactions on Wireless Communications",,"10.1109/TWC.2013.080113.120260",,"cs.CR cs.GT","http://creativecommons.org/licenses/by/3.0/","  To ensure security in data transmission is one of the most important issues
for wireless relay networks, and physical layer security is an attractive
alternative solution to address this issue. In this paper, we consider a
cooperative network, consisting of one source node, one destination node, one
eavesdropper node, and a number of relay nodes. Specifically, the source may
select several relays to help forward the signal to the corresponding
destination to achieve the best security performance. However, the relays may
have the incentive not to report their true private channel information in
order to get more chances to be selected and gain more payoff from the source.
We propose a Vickey-Clark-Grove (VCG) based mechanism and an
Arrow-d'Aspremont-Gerard-Varet (AGV) based mechanism into the investigated
relay network to solve this cheating problem. In these two different
mechanisms, we design different ""transfer payment"" functions to the payoff of
each selected relay and prove that each relay gets its maximum (expected)
payoff when it truthfully reveals its private channel information to the
source. And then, an optimal secrecy rate of the network can be achieved. After
discussing and comparing the VCG and AGV mechanisms, we prove that the AGV
mechanism can achieve all of the basic qualifications (incentive compatibility,
individual rationality and budget balance) for our system. Moreover, we discuss
the optimal quantity of relays that the source node should select. Simulation
results verify efficiency and fairness of the VCG and AGV mechanisms, and
consolidate these conclusions.
","[{""version"":""v1"",""created"":""Tue, 30 Jul 2013 05:25:01 GMT""}]","2016-11-18"
"1307.7823","Eugene Levin","Eugene Levin (Tel Aviv Un. and UTFSM) and Irina Potashnikova (UTFSM)","BFKL equation with running QCD coupling and HERA data","16pp,14 figures in eps.files",,"10.1007/JHEP02(2014)089","TAUP 2972/13","hep-ph","http://arxiv.org/licenses/nonexclusive-distrib/1.0/","  In this paper we developed approach based on the BFKL evolution in $\ln\Lb
Q^2\Rb$. We show that the simplest diffusion approximation with running QCD
coupling is able to describe the HERA experimental data on the deep inelastic
structure function with good $\chi^2/d.o.f. \approx 1.3$. From our description
of the experimental data we learned several lessons; (i) the non-perturbative
physics at long distances started to show up at $Q^2 = 0.25\,GeV^2$; (ii) the
scattering amplitude at $Q^2 = 0.25\,GeV^2$ cannot be written as sum of soft
Pomeron and the secondary Reggeon but the Pomeron interactions should be taken
into account; (iii) the Pomeron interactions can be reduced to the enhanced
diagrams and, therefore, we do not see any needs for the shadowing corrections
at HERA energies; and (iv) we demonstrated that the shadowing correction could
be sizable at higher than HERA energies without any contradiction with our
initial conditions.
","[{""version"":""v1"",""created"":""Tue, 30 Jul 2013 05:26:56 GMT""},{""version"":""v2"",""created"":""Wed, 7 Aug 2013 06:14:57 GMT""}]","2015-06-16"
"1307.7824","Aaron Darling","Sebastian B\""ocker, Stefan Canzar, and Gunnar W. Klau","The generalized Robinson-Foulds metric","Peer-reviewed and presented as part of the 13th Workshop on
  Algorithms in Bioinformatics (WABI2013)",,,,"cs.DS cs.CE q-bio.QM","http://arxiv.org/licenses/nonexclusive-distrib/1.0/","  The Robinson-Foulds (RF) metric is arguably the most widely used measure of
phylogenetic tree similarity, despite its well-known shortcomings: For example,
moving a single taxon in a tree can result in a tree that has maximum distance
to the original one; but the two trees are identical if we remove the single
taxon. To this end, we propose a natural extension of the RF metric that does
not simply count identical clades but instead, also takes similar clades into
consideration. In contrast to previous approaches, our model requires the
matching between clades to respect the structure of the two trees, a property
that the classical RF metric exhibits, too. We show that computing this
generalized RF metric is, unfortunately, NP-hard. We then present a simple
Integer Linear Program for its computation, and evaluate it by an
all-against-all comparison of 100 trees from a benchmark data set. We find that
matchings that respect the tree structure differ significantly from those that
do not, underlining the importance of this natural condition.
","[{""version"":""v1"",""created"":""Tue, 30 Jul 2013 05:29:55 GMT""}]","2013-08-02"
"1307.7825","Aaron Darling","Constantinos Tsirogiannis and Brody Sandel","Computing the Skewness of the Phylogenetic Mean Pairwise Distance in
  Linear Time","Peer-reviewed and presented as part of the 13th Workshop on
  Algorithms in Bioinformatics (WABI2013)",,,,"q-bio.QM cs.CE cs.DS","http://arxiv.org/licenses/nonexclusive-distrib/1.0/","  The phylogenetic Mean Pairwise Distance (MPD) is one of the most popular
measures for computing the phylogenetic distance between a given group of
species. More specifically, for a phylogenetic tree T and for a set of species
R represented by a subset of the leaf nodes of T, the MPD of R is equal to the
average cost of all possible simple paths in T that connect pairs of nodes in
R.
  Among other phylogenetic measures, the MPD is used as a tool for deciding if
the species of a given group R are closely related. To do this, it is important
to compute not only the value of the MPD for this group but also the
expectation, the variance, and the skewness of this metric. Although efficient
algorithms have been developed for computing the expectation and the variance
the MPD, there has been no approach so far for computing the skewness of this
measure.
  In the present work we describe how to compute the skewness of the MPD on a
tree T optimally, in Theta(n) time; here n is the size of the tree T. So far
this is the first result that leads to an exact, let alone efficient,
computation of the skewness for any popular phylogenetic distance measure.
Moreover, we show how we can compute in Theta(n) time several interesting
quantities in T that can be possibly used as building blocks for computing
efficiently the skewness of other phylogenetic measures.
","[{""version"":""v1"",""created"":""Tue, 30 Jul 2013 05:37:17 GMT""}]","2013-08-02"
"1307.7826","Serguei Molodtsov","S.V. Molodtsov and G.M. Zinovjev","Condensated fermion system in the model of four-quark interaction with
  large correlation length","8 pages, 11 figures, minor text improvements, references extended",,,,"hep-ph nucl-th","http://arxiv.org/licenses/nonexclusive-distrib/1.0/","  Studying a model of four-quark interaction with large correlation length we
find out both the features peculiar an unitary fermi gas and the specific
anomalous properties of the fermi systems with a fermion condensate. It is
argued that a possibility of phase transition originated by interface between
the Fermi sphere and fermion condensate appears in such quark systems. The
results obtained could be instrumental for phenomenological applications in
view of our conclusion about approximately the same behavior of the dynamical
characteristics of quark ensembles with different four-quark interaction forms
in a practical interval of coupling constant.
","[{""version"":""v1"",""created"":""Tue, 30 Jul 2013 05:37:34 GMT""},{""version"":""v2"",""created"":""Mon, 16 Dec 2013 07:35:22 GMT""},{""version"":""v3"",""created"":""Tue, 22 Jul 2014 04:52:44 GMT""}]","2014-07-23"
