"1307.7726","Nicholas Read","J. Dubail and N. Read","Tensor network trial states for chiral topological phases in two
  dimensions and a no-go theorem in any dimension","5 pages plus 4 pages supplementary material, inc 3 figures. v2:
  improved no-go theorem, additional references. v3: changed to regular article
  format; 16 pages, 3 figures, no supplemental material; main change is much
  extended proof of no-go theorem. v4: minor changes; as-published version","Phys. Rev. B 92, 205307 (2015)","10.1103/PhysRevB.92.205307",,"cond-mat.mes-hall cond-mat.str-el hep-th quant-ph","http://arxiv.org/licenses/nonexclusive-distrib/1.0/","  Trial wavefunctions that can be represented by summing over locally-coupled
degrees of freedom are called tensor network states (TNSs); they have seemed
difficult to construct for two-dimensional topological phases that possess
protected gapless edge excitations. We show it can be done for chiral states of
free fermions, using a Gaussian Grassmann integral, yielding $p_x \pm i p_y$
and Chern insulator states, in the sense that the fermionic excitations live in
a topologically non-trivial bundle of the required type. We prove that any
strictly short-range quadratic parent Hamiltonian for these states is gapless;
the proof holds for a class of systems in any dimension of space. The proof
also shows, quite generally, that sets of compactly-supported Wannier-type
functions do not exist for band structures in this class. We construct further
examples of TNSs that are analogs of fractional (including non-Abelian) quantum
Hall phases; it is not known whether parent Hamiltonians for these are also
gapless.
","[{""version"":""v1"",""created"":""Mon, 29 Jul 2013 20:07:44 GMT""},{""version"":""v2"",""created"":""Fri, 2 Aug 2013 19:24:40 GMT""},{""version"":""v3"",""created"":""Tue, 29 Sep 2015 17:22:52 GMT""},{""version"":""v4"",""created"":""Sun, 8 Nov 2015 20:24:20 GMT""}]","2015-11-25"
"1307.7727","Dirk Lennarz","D. Lennarz (for the H.E.S.S. collaboration)","Search for VHE Gamma-Ray Emission from Young SNe with H.E.S.S","In Proceedings of the 33rd International Cosmic Ray Conference
  (ICRC2013), Rio de Janeiro (Brazil)",,,,"astro-ph.HE","http://arxiv.org/licenses/nonexclusive-distrib/1.0/","  Supernova (SN) remnants are a well motivated candidate for the acceleration
sites of cosmic rays with energies up to the knee (10^15 eV). It has been
suggested that also young SNe (~<1 year after the explosion) may be able to
accelerate cosmic rays to even higher energies. A smoking gun for cosmic-ray
acceleration in young SNe would be the production of very-high-energy (VHE, >10
GeV) gamma-ray radiation. The H.E.S.S. imaging air Cherenkov telescope array is
an instrument sensitive to such radiation. In this contribution, the pointing
directions of the H.E.S.S. telescopes are compared to a recently published,
extragalactic SN catalogue to identify coincidental observations. The results
of the data analysis are discussed.
","[{""version"":""v1"",""created"":""Mon, 29 Jul 2013 20:07:58 GMT""}]","2019-08-14"
"1307.7728","Valery Gusynin Pavlovich","E.V. Gorbar, V.P. Gusynin, and O.O. Sobol","Supercritical instability in graphene with two charged impurities","12 pages, 1 figure, comments and references added, to match the
  published version","Physical Review B 88, 205116 (2013)","10.1103/PhysRevB.88.205116",,"cond-mat.mes-hall cond-mat.str-el hep-ph nucl-th","http://arxiv.org/licenses/nonexclusive-distrib/1.0/","  We study the supercritical instability in gapped graphene with two charged
impurities separated by distance R using the two-dimensional Dirac equation for
electron quasiparticles. Attention is paid to a situation when charges of
impurities are subcritical, whereas their total charge exceeds a critical one.
The critical distance R_{cr} in the system of two charged centers is defined as
that at which the electron bound state with the lowest energy reaches the
boundary of the lower continuum. A variational calculation of the critical
distance R_{cr} separating the supercritical (R<R_{cr}) and subcritical
(R>R_{cr}) regimes is carried out. It is shown that the critical distance
R_{cr} increases as the quasiparticle gap decreases. The energy and width of a
quasistationary state as functions of the distance between two impurities are
derived in the quasiclassical approximation.
","[{""version"":""v1"",""created"":""Mon, 29 Jul 2013 20:09:01 GMT""},{""version"":""v2"",""created"":""Tue, 3 Dec 2013 16:06:21 GMT""}]","2013-12-04"
"1307.7729","Mark Newman","M. E. J. Newman","Spectral methods for network community detection and graph partitioning","11 pages, 5 figures","Phys. Rev. E 88, 042822 (2013)","10.1103/PhysRevE.88.042822",,"physics.soc-ph cond-mat.stat-mech cs.SI physics.data-an","http://arxiv.org/licenses/nonexclusive-distrib/1.0/","  We consider three distinct and well studied problems concerning network
structure: community detection by modularity maximization, community detection
by statistical inference, and normalized-cut graph partitioning. Each of these
problems can be tackled using spectral algorithms that make use of the
eigenvectors of matrix representations of the network. We show that with
certain choices of the free parameters appearing in these spectral algorithms
the algorithms for all three problems are, in fact, identical, and hence that,
at least within the spectral approximations used here, there is no difference
between the modularity- and inference-based community detection methods, or
between either and graph partitioning.
","[{""version"":""v1"",""created"":""Mon, 29 Jul 2013 20:23:34 GMT""}]","2013-11-13"
"1307.7730","Xin Ma","Xin Ma, Xuefei Chen, Hailiang Chen, Pavel A. Denissenkov, Zhanwen Han","A Super-Eddington Wind Scenario for the Progenitors of Type Ia
  Supernovae","14 pages, 4 figures, 1 table. Accepted for publication in ApJL",,"10.1088/2041-8205/778/2/L32",,"astro-ph.SR","http://arxiv.org/licenses/nonexclusive-distrib/1.0/","  The accretion of hydrogen-rich material onto carbon-oxygen white dwarfs (CO
WDs) is crucial for understanding type Ia supernova (SN Ia) from the
single-degenerate model, but this process has not been well understood due to
the numerical difficulties in treating H and He flashes during the accretion.
For the CO WD masses from 0.5 to $1.378\,{M}_\odot$ and accretion rates in the
range from $10^{-8}$ to $10^{-5}\,{M}_\odot\,\mbox{yr}^{-1}$, we simulated the
accretion of solar-composition material onto CO WDs using the state-of-the-art
stellar evolution code of {\sc MESA}. For comparison with the steady-state
models (e.g \citet{nskh07}), we firstly ignored the contribution from nuclear
burning to the luminosity when determining the Eddington accretion rate and
found that the properties of H burning in our accreting CO WD models are
similar to those from the steady-state models, except that the critical
accretion rates at which the WDs turn into red giants or H-shell flashes occur
on their surfaces are slightly higher than those from the steady-state models.
However, the super-Eddington wind is triggered at much lower accretion rates,
than previously thought, when the contribution of nuclear burning to the total
luminosity is included. This super-Eddington wind naturally prevents the CO WDs
with high accretion rates from becoming red giants, thus presenting an
alternative to the optically thick wind proposed by \cite{hkn96}. Furthermore,
the super-Eddington wind works in low-metallicity environments, which may
explain SNe Ia observed at high redshifts.
","[{""version"":""v1"",""created"":""Mon, 29 Jul 2013 20:24:06 GMT""},{""version"":""v2"",""created"":""Fri, 25 Oct 2013 01:55:33 GMT""}]","2015-06-16"
"1307.7731","Rodrigo Angelo Muniz","Rodrigo A. Muniz, Yasuyuki Kato and Cristian D. Batista","Generalized spin-wave theory: application to the bilinear-biquadratic
  model","9 pages, 3 figures","Prog. Theor. Exp. Phys. (2014) 083I01","10.1093/ptep/ptu109",,"cond-mat.str-el cond-mat.mtrl-sci","http://arxiv.org/licenses/nonexclusive-distrib/1.0/","  We present a generalized spin-wave theory (GSWT) for treating spin
Hamiltonians of arbitrary spin $S$. The generalization consists of an extension
of the traditional spin-wave theory from SU(2) to SU($N$). Low energy
excitations are waves of the local order parameter that fluctuates in the
SU($N$) space of unitary transformations of the local spin states, instead of
the SU(2) space of local spin rotations. Since the generators of the SU($N$)
group can be represented as bilinear forms in $N$-flavored bosons, the
low-energy modes of the GSWT are described with $N-1$ different bosons. The
generalization allows treating quantum spin systems whose ground state exhibit
multipolar ordering as well as detecting instabilities of magnetically ordered
states (dipolar ordering) towards higher multipolar orderings. We illustrate
these advantages by applying the GSWT to a bilinear-biquadratic model of
arbitrary spin $S$ on hypercubic lattices.
","[{""version"":""v1"",""created"":""Mon, 29 Jul 2013 20:24:13 GMT""}]","2014-09-10"
"1307.7732","Mohammed Mia","Mohammed Mia","Thermodynamics of large N gauge theory from top down holography",,"Phys. Rev. D 89, 043010 (2014)","10.1103/PhysRevD.89.043010",,"hep-th hep-ph nucl-th","http://arxiv.org/licenses/nonexclusive-distrib/1.0/","  By considering fluxes on D7 branes and explicitly computing their
back-reaction on the geometry with and without a black hole, we show how the UV
divergence of Klebanov-Strassler model can be regulated. Using the form of the
metric and fluxes in the extremal and non-extremal limit, we compute the
on-shell gravity action including the localized sources up to linear order in
perturbation parameter g_sM^2/N, g_sN_f where N,M and N_f are units of D3,D5
and D7 charges in the dual gauge theory. Using the gravitational description,
we show how the gauge theory undergoes a first-order Hawking-Page like phase
transition and compute the critical temperature T_c. Finally, we obtain the
equation of state for the gauge theory by computing thermodynamic state
functions of the black hole and exhibit how black holes in deformed cone
geometry can lead to results that are qualitatively similar to lattice QCD
simulations.
","[{""version"":""v1"",""created"":""Mon, 29 Jul 2013 20:28:26 GMT""}]","2014-02-26"
"1307.7733","Eugene Lerman","Eugene Lerman","Invariant vector fields and groupoids","15 pages. Comments and corrections appreciated (v2): example added
  (v3): partially re-written in response to referees' comments. Accepted for
  publication in IMRN",,,,"math.DS","http://arxiv.org/licenses/nonexclusive-distrib/1.0/","  We use the notion of isomorphism between two invariant vector fields to shed
new light on the issue of linearization of an invariant vector field near a
relative equilibrium. We argue that the notion is useful in understanding the
passage from the space of invariant vector fields in a tube around a group
orbit to the space invariant vector fields on a slice to the orbit. The notion
comes from Hepworth's study of vector fields on stacks.
","[{""version"":""v1"",""created"":""Mon, 29 Jul 2013 20:33:21 GMT""},{""version"":""v2"",""created"":""Thu, 8 Aug 2013 21:07:52 GMT""},{""version"":""v3"",""created"":""Mon, 8 Sep 2014 23:24:13 GMT""}]","2014-09-10"
"1307.7734","Arthur Zakinyan","Levon Mkrtchyan, Arthur Zakinyan, Yuri Dikansky","Electrocapillary instability of magnetic fluid peak","22 pages, 7 figures","Langmuir 2013, Vol. 29. Iss. 29. P. 9098-9103","10.1021/la4014625",,"physics.flu-dyn cond-mat.soft","http://arxiv.org/licenses/nonexclusive-distrib/1.0/","  The paper presents an experimental study of the capillary electrostatic
instability occurring under effect of a constant electric field on a magnetic
fluid individual peak. The peaks under study occur at disintegration of a
magnetic fluid layer applied on a flat electrode surface under effect of a
perpendicular magnetic field. The electrocapillary instability shows itself as
an emission of charged drops jets from the peak point in direction of the
opposing electrode. The charged drops emission repeats periodically and results
in the peak shape pulsations. It is shown that a magnetic field affects the
electrocapillary instability occurrence regularities and can stimulate its
development. The critical electric and magnetic field strengths at which the
instability occurs have been measured; their dependence on the peak size is
shown. The hysteresis in the system has been studied; it consists in that the
charged drops emission stops at a lesser electric (or magnetic) field strength
than that of the initial occurrence. The peak pulsations frequency depending on
the magnetic and electric field strengths and on the peak size has been
measured.
","[{""version"":""v1"",""created"":""Mon, 29 Jul 2013 20:33:47 GMT""}]","2013-07-31"
"1307.7735","Michael Wood-Vasey","Christopher P. Ahn, Rachael Alexandroff, Carlos Allende Prieto,
  Friedrich Anders, Scott F. Anderson, Timothy Anderton, Brett H. Andrews,
  \'Eric Aubourg, Stephen Bailey, Fabienne A. Bastien, Julian E. Bautista,
  Timothy C. Beers, Alessandra Beifiori, Chad F. Bender, Andreas A. Berlind,
  Florian Beutler, Vaishali Bhardwaj, Jonathan C. Bird, Dmitry Bizyaev, Cullen
  H. Blake, Michael R. Blanton, Michael Blomqvist, John J. Bochanski, Adam S.
  Bolton, Arnaud Borde, Jo Bovy, Alaina Shelden Bradley, W. N. Brandt,
  Doroth\'ee Brauer, J. Brinkmann, Joel R. Brownstein, Nicol\'as G. Busca,
  William Carithers, Joleen K. Carlberg, Aurelio R. Carnero, Michael A. Carr,
  Cristina Chiappini, S. Drew Chojnowski, Chia-Hsun Chuang, Johan Comparat,
  Justin R. Crepp, Stefano Cristiani, Rupert A.C. Croft, Antonio J. Cuesta,
  Katia Cunha, Luiz N. da Costa, Kyle S. Dawson, Nathan De Lee, Janice D. R.
  Dean, Timoth\'ee Delubac, Rohit Deshpande, Saurav Dhital, Anne Ealet, Garrett
  L. Ebelke, Edward M. Edmondson, Daniel J. Eisenstein, Courtney R. Epstein,
  Stephanie Escoffier, Massimiliano Esposito, Michael L. Evans, D. Fabbian,
  Xiaohui Fan, Ginevra Favole, Bruno Femen\'ia Castell\'a, Emma Fern\'andez
  Alvar, Diane Feuillet, Nurten Filiz Ak, Hayley Finley, Scott W. Fleming,
  Andreu Font-Ribera, Peter M. Frinchaboy, J. G. Galbraith-Frew, D. A.
  Garc\'ia-Hern\'andez, Ana E. Garc\'ia P\'erez, Jian Ge, R. G\'enova-Santos,
  Bruce A. Gillespie, L\'eo Girardi, Jonay I. Gonz\'alez Hern\'andez, J.
  Richard Gott III, James E. Gunn, Hong Guo, Samuel Halverson, Paul Harding,
  David W. Harris, Sten Hasselquist, Suzanne L. Hawley, Michael Hayden,
  Frederick R. Hearty, Artemio Herrero Dav\'o, Shirley Ho, David W. Hogg, Jon
  A. Holtzman, Klaus Honscheid, Joseph Huehnerhoff, Inese I. Ivans, Kelly M.
  Jackson, Peng Jiang, Jennifer A. Johnson, David Kirkby, K. Kinemuchi, Mark A.
  Klaene, Jean-Paul Kneib, Lars Koesterke, Ting-Wen Lan, Dustin Lang, Jean-Marc
  Le Goff, Khee-Gan Lee, Young Sun Lee, Daniel C. Long, Craig P. Loomis, Sara
  Lucatello, Robert H. Lupton, Bo Ma, Claude E. Mack III, Suvrath Mahadevan,
  Marcio A. G. Maia, Steven R. Majewski, Elena Malanushenko, Viktor
  Malanushenko, A. Manchado, Marc Manera, Claudia Maraston, Daniel Margala,
  Sarah L. Martell, Karen L. Masters, Cameron K. McBride, Ian D. McGreer,
  Richard G. McMahon, Brice M\'enard, Sz. M\'esz\'aros, Jordi Miralda-Escud\'e,
  Hironao Miyatake, Antonio D. Montero-Dorta, Francesco Montesano, Surhud More,
  Heather L. Morrison, Demitri Muna, Jeffrey A. Munn, Adam D. Myers, Duy Cuong
  Nguyen, Robert C. Nichol, David L. Nidever, Pasquier Noterdaeme, Sebasti\'an
  E. Nuza, Julia E. O'Connell, Robert W. O'Connell, Ross O'Connell, Matthew D.
  Olmstead, Daniel J. Oravetz, Russell Owen, Nikhil Padmanabhan, Nathalie
  Palanque-Delabrouille, Kaike Pan, John K. Parejko, Isabelle P\^aris, Joshua
  Pepper, Will J. Percival, Ignasi P\'erez-R\`afols, H\'elio Dotto Perottoni,
  Patrick Petitjean, Matthew M. Pieri, M. H. Pinsonneault, Francisco Prada,
  Adrian M. Price-Whelan, M. Jordan Raddick, Mubdi Rahman, Rafael Rebolo, Beth
  A. Reid, Jonathan C. Richards, Rog\'erio Riffel, Annie C. Robin, H. J.
  Rocha-Pinto, Constance M. Rockosi, Natalie A. Roe, Ashley J. Ross, Nicholas
  P. Ross, Graziano Rossi, Arpita Roy, J. A. Rubi\~no-Martin, Cristiano G.
  Sabiu, Ariel G. S\'anchez, Bas\'ilio Santiago, Conor Sayres, Ricardo P.
  Schiavon, David J. Schlegel, Katharine J. Schlesinger, Sarah J. Schmidt,
  Donald P. Schneider, Mathias Schultheis, Kris Sellgren, Hee-Jong Seo, Yue
  Shen, Matthew Shetrone, Yiping Shu, Audrey E. Simmons, M. F. Skrutskie,
  An\v{z}e Slosar, Verne V. Smith, Stephanie A. Snedden, Jennifer S. Sobeck,
  Flavia Sobreira, Keivan G. Stassun, Matthias Steinmetz, Michael A. Strauss,
  Alina Streblyanska, Nao Suzuki, Molly E. C. Swanson, Ryan C. Terrien,
  Aniruddha R. Thakar, Daniel Thomas, Benjamin A. Thompson, Jeremy L. Tinker,
  Rita Tojeiro, Nicholas W. Troup, Jan Vandenberg, Mariana Vargas Maga\~na,
  Matteo Viel, Nicole P. Vogt, David A. Wake, Benjamin A. Weaver, David H.
  Weinberg, Benjamin J. Weiner, Martin White, Simon D.M. White, John C. Wilson,
  John P. Wisniewski, W. M. Wood-Vasey, Christophe Y\`eche, Donald G. York, O.
  Zamora, Gail Zasowski, Idit Zehavi, Zheng Zheng, Guangtun Zhu","The Tenth Data Release of the Sloan Digital Sky Survey: First
  Spectroscopic Data from the SDSS-III Apache Point Observatory Galactic
  Evolution Experiment","15 figures; 1 table. Accepted to ApJS. DR10 is available at
  http://www.sdss3.org/dr10 v3 fixed 3 diacritic markings in the arXiv HTML
  listing of the author names",,"10.1088/0067-0049/211/2/17",,"astro-ph.IM astro-ph.CO astro-ph.GA","http://arxiv.org/licenses/nonexclusive-distrib/1.0/","  The Sloan Digital Sky Survey (SDSS) has been in operation since 2000 April.
This paper presents the tenth public data release (DR10) from its current
incarnation, SDSS-III. This data release includes the first spectroscopic data
from the Apache Point Observatory Galaxy Evolution Experiment (APOGEE), along
with spectroscopic data from the Baryon Oscillation Spectroscopic Survey (BOSS)
taken through 2012 July. The APOGEE instrument is a near-infrared R~22,500
300-fiber spectrograph covering 1.514--1.696 microns. The APOGEE survey is
studying the chemical abundances and radial velocities of roughly 100,000 red
giant star candidates in the bulge, bar, disk, and halo of the Milky Way. DR10
includes 178,397 spectra of 57,454 stars, each typically observed three or more
times, from APOGEE. Derived quantities from these spectra (radial velocities,
effective temperatures, surface gravities, and metallicities) are also
included.DR10 also roughly doubles the number of BOSS spectra over those
included in the ninth data release. DR10 includes a total of 1,507,954 BOSS
spectra, comprising 927,844 galaxy spectra; 182,009 quasar spectra; and 159,327
stellar spectra, selected over 6373.2 square degrees.
","[{""version"":""v1"",""created"":""Mon, 29 Jul 2013 20:37:05 GMT""},{""version"":""v2"",""created"":""Thu, 16 Jan 2014 18:08:36 GMT""},{""version"":""v3"",""created"":""Fri, 17 Jan 2014 15:59:31 GMT""}]","2015-06-16"
"1307.7736","Karo Michaelian","K. Michaelian, I. Santamar\'ia-Holek, A. P\'erez-Madrid","Violation of Fundamental Thermodynamic Law or Invalid Microstate
  Densities?","11 pages, 1 figure",,,,"cond-mat.stat-mech physics.class-ph","http://arxiv.org/licenses/nonexclusive-distrib/1.0/","  It is often incorrectly assumed that the number of microstates \Omega
(E,V,N,...) available to an isolated system can have arbitrary dependence on
the extensive variables E,V,N, .... However, this is not the case for natural
systems which can reach thermodynamic equilibrium since restrictions exist
arising from the underlying equilibrium axioms of independence and \it{a
priori} equal probability of microstate, and the fundamental constants of
Nature. Here we derive a concise formula specifying the condition on \Omega
which must be met for real systems. Models which do not respect this condition
will present inconsistencies when treated under equilibrium thermodynamic
formalism. This has relevance to a number of recent models in which negative
heat capacity and violation of fundamental thermodynamic law have been
reported. Natural quantum systems obey the axioms and abide by the fundamental
constants, and thus natural systems, in the absence of infinite range forces,
can, in principle, attain thermodynamic equilibrium.
","[{""version"":""v1"",""created"":""Mon, 29 Jul 2013 20:38:04 GMT""}]","2013-07-31"
"1307.7737","Istvan Kiss Z","Istvan Z. Kiss, Charles G. Morris, Fanni S\'elley, P\'eter L. Simon
  and Robert R. Wilkinson","Exact deterministic representation of Markovian SIR epidemics on
  networks with and without loops","7 postscript figures and 3 tikz figures, 2 tables",,,,"math.PR math.DS q-bio.PE","http://arxiv.org/licenses/nonexclusive-distrib/1.0/","  In a previous paper Sharkey et al. [13] proved the exactness of closures at
the level of triples for Markovian SIR (susceptible-infected-removed) dynamics
on tree-like networks. This resulted in a deterministic representation of the
epidemic dynamics on the network that can be numerically evaluated. In this
paper, we extend this modelling framework to certain classes of networks
exhibiting loops. We show that closures where the loops are kept intact are
exact, and lead to a simplified and numerically solvable system of ODEs
(ordinary-differential-equations). The findings of the paper lead us to a
generalisation of closures that are based on partitioning the network around
nodes that are cut-vertices (i.e. the removal of such a node leads to the
network breaking down into at least two disjointed components or subnetworks).
Exploiting this structural property of the network yields some natural
closures, where the evolution of a particular state can typically be exactly
given in terms of the corresponding or projected sates on the subnetworks and
the cut-vertex. A byproduct of this analysis is an alternative probabilistic
proof of the exactness of the closures for tree-like networks presented in
Sharkey et al. [13]. In this paper we also elaborate on how the main result can
be applied to more realistic networks, for which we write down the ODEs
explicitly and compare output from these to results from simulation.
Furthermore, we give a general, recipe-like method of how to apply the
reduction by closures technique for arbitrary networks, and give an upper bound
on the maximum number of equations needed for an exact representation.
","[{""version"":""v1"",""created"":""Mon, 29 Jul 2013 20:49:15 GMT""}]","2013-07-31"
"1307.7738","Anton de la Fuente","Anton de la Fuente and Raman Sundrum","Holography of the BTZ Black Hole, Inside and Out","52 pages, 15 figures. v2: Clarifications made throughout paper.
  Derivation of (new) Section 8 corrected. Results and conclusions unchanged.
  References added","JHEP 09 (2014) 073","10.1007/JHEP09(2014)073",,"hep-th gr-qc","http://arxiv.org/licenses/nonexclusive-distrib/1.0/","  We propose a 1+1 dimensional CFT dual structure for quantum gravity and
matter on the extended 2+1 dimensional BTZ black hole, realized as a quotient
of the Poincare patch of AdS$_3$. The quotient spacetime includes regions
beyond the singularity, ""whiskers"", containing timelike and lightlike closed
curves, which at first sight seem unphysical. The spacetime includes the usual
AdS-asymptotic boundaries outside the horizons as well as boundary components
inside the whiskers. We show that local boundary correlators with some
endpoints in the whisker regions: (i) are a protected class of amplitudes,
dominated by effective field theory even when the associated Witten diagrams
appear to traverse the singularity, (ii) describe well-defined
diffeomorphism-invariant quantum gravity amplitudes in BTZ, (iii) sharply probe
some of the physics inside the horizon but outside the singularity, and (iv)
are equivalent to correlators of specific non-local CFT operators in the
standard thermofield entangled state of two CFTs. In this sense, the whisker
regions can be considered as purely auxiliary spacetimes in which these useful
non-local CFT correlators can be rendered as local boundary correlators, and
their diagnostic value more readily understood. Our results follow by first
performing a novel reanalysis of the Rindler view of standard AdS/CFT duality
on the Poincare patch of AdS, followed by exploiting the simple quotient
structure of BTZ which turns the Rindler horizon into the BTZ black hole
horizon. While most of our checks are within gravitational effective field
theory, we arrive at a fully non-perturbative CFT proposal to probe the
UV-sensitive approach to the singularity.
","[{""version"":""v1"",""created"":""Mon, 29 Jul 2013 20:55:08 GMT""},{""version"":""v2"",""created"":""Mon, 7 Jul 2014 00:54:13 GMT""}]","2014-09-16"
"1307.7739","Robert Kurinczuk","Robert Kurinczuk","l-modular representations of unramified p-adic U(2,1)","30 pages","Algebra Number Theory 8 (2014) 1801-1838","10.2140/ant.2014.8.1801",,"math.RT","http://arxiv.org/licenses/nonexclusive-distrib/1.0/","  We construct all cuspidal l-modular representations of a unitary group in
three variables attached to an unramified extension of local fields of odd
residual characteristic p with l\neq p. We describe the l-modular principal
series and show that the supercuspidal support of an irreducible l-modular
representation is unique up to conjugacy.
","[{""version"":""v1"",""created"":""Mon, 29 Jul 2013 20:57:08 GMT""}]","2016-01-20"
