"1307.7911","Anders Andersson","Anders Andersson, Borje Nilsson, Thomas Biro","Fourier Methods for Harmonic Scalar Waves in General Waveguides",,,"10.1007/s10665-015-9808-8",,"math-ph math.MP","http://arxiv.org/licenses/nonexclusive-distrib/1.0/","  A set of semi-analytical techniques based on Fourier analysis is used to
solve wave scattering problems in variously shaped waveguides with varying
normal admittance boundary conditions. Key components are newly developed
conformal mapping methods, wave splitting, Fourier series expansions in
eigen-functions to non-normal operators, the building block method or the
cascade technique, Dirichlet-to-Neumann operators, and reformulation in terms
of stable differential equations for reflection and transmission matrices. For
an example the results show good correspondence with a finite element method
solution to the same problem in the low and medium frequency domain. The
Fourier method complements finite element analysis as a waveguide simulation
tool. For inverse engineering involving tuning of straight waveguide parts
joining complicated waveguide elements, the Fourier method is an attractive
alternative including time aspects. The prime motivation for the Fourier method
is its added physical understanding primarily at low frequencies.
","[{""version"":""v1"",""created"":""Tue, 30 Jul 2013 11:16:38 GMT""},{""version"":""v2"",""created"":""Mon, 1 Jun 2015 13:42:22 GMT""}]","2015-06-02"
"1307.7912","Andr\'e Ritter","Andr\'e Ritter (1), Florian Bayer (1), J\""urgen Durst (1), Karl
  G\""odel (1), Wilhelm Haas (1 and 2), Thilo Michel (1), Jens Rieger (1),
  Thomas Weber (1), Lukas Wucherer (1), Gisela Anton (1) ((1) University of
  Erlangen, Erlangen Centre for Astroparticle Physics, Erlangen, Germany, (2)
  University of Erlangen, Pattern Recognition Lab, Erlangen, Germany)","Simultaneous maximum-likelihood reconstruction for x-ray grating based
  phase-contrast tomography avoiding intermediate phase retrieval",,,,,"physics.med-ph physics.comp-ph","http://arxiv.org/licenses/nonexclusive-distrib/1.0/","  Phase-wrapping artifacts, statistical image noise and the need for a minimum
amount of phase steps per projection limit the practicability of x-ray grating
based phase-contrast tomography, when using filtered back projection
reconstruction. For conventional x-ray computed tomography, the use of
statistical iterative reconstruction algorithms has successfully reduced
artifacts and statistical issues. In this work, an iterative reconstruction
method for grating based phase-contrast tomography is presented. The method
avoids the intermediate retrieval of absorption, differential phase and dark
field projections. It directly reconstructs tomographic cross sections from
phase stepping projections by the use of a forward projecting imaging model and
an appropriate likelihood function. The likelihood function is then maximized
with an iterative algorithm. The presented method is tested with tomographic
data obtained through a wave field simulation of grating based phase-contrast
tomography. The reconstruction results are in agreement with the expectations
and proof the validity of the concept.
","[{""version"":""v1"",""created"":""Tue, 30 Jul 2013 11:18:42 GMT""}]","2013-07-31"
"1307.7913","Dai Lian-Rong","Dai Lian-Rong, Zhong Wei-Wei, Cong Mei-Ling","The description of $^{150}$Nd Nucleus by a new alternative scheme","Submitted to Chinese Physics C",,,,"nucl-th","http://arxiv.org/licenses/nonexclusive-distrib/1.0/","  A new scheme was recently proposed in which the usual SU(3)
quadrupole-quadrupole interaction was replaced by an O(6) cubic interaction in
the Interacting Boson Model, and also successfully applied to the description
of $^{152}$Sm for the N = 90 rare earth isotones with X(5) symmetry. By using
this new scheme, in the present work, we further explore the properties of
another candidate of $^{150}$Nd for the N=90 with X(5) symmetry. The low-lying
energy levels and E2 transition rates are calculated and compared with the
experimental data. The results show that the new scheme can also reasonably
describe the experimental low-lying spectrum and the intraband and the
interband E2 transitions for $^{150}$Nd. However, for the low-lying spectrum,
the O(6) cubic interaction seems better in describing the energy levels,
especially in higher excited states and $\gamma$ band, yet the $0^{+}_{2}$
level within the $\beta$ band is lower than the corresponding experimental
value and, the U(5)-SU(3) scheme seems better to describe the low-lying levels
of $\beta$ band; and for the B(E2) transition, for the intraband transitions
within the ground band and some interband transitions between the $\beta$ band
and the ground band, the results from O(6) cubic interaction are better than
those from SU(3) quadrupole-quadrupole interaction, yet of which seems better
to describe the intraband E2 transitions within $\beta$ band. The present work
is very meaningful in helping us to deeply understand the new characteristics
of symmetry by the higher order O(6) cubic interaction.
","[{""version"":""v1"",""created"":""Tue, 30 Jul 2013 11:23:58 GMT""}]","2013-07-31"
"1307.7914","Nicolas Destainville","Sebastian Weitz (LPT) and Nicolas Destainville (LPT)","Attractive asymmetric inclusions in elastic membranes under tension:
  cluster phases and membrane invaginations",,"Soft Matter, 2013, 9 (32), 7804-7816","10.1039/C3SM50954K",,"cond-mat.soft","http://arxiv.org/licenses/nonexclusive-distrib/1.0/","  Up-down asymmetric inclusions impose a local, spontaneous curvature to an
elastic membrane. When several of them are inserted in a same membrane, they
feel effective forces mediated by the membrane, both of elastic and entropic
nature. Following an approach initiated by Dommersnes and Fournier in the
vanishing tension case [Eur. Phys. J. B 12, 9 (1999)], and also using a
pseudo-analytical micellization theory, we derive the statistical mechanics of
asymmetric inclusion assemblies when they are also subject to an additional
short-range, attractive interaction. Our main conclusion is that generically,
when the membrane is under tension, these inclusions live in small clusters at
equilibrium, leading to local membrane invaginations. We also propose a novel
curvature-induced demixing mechanism: when inclusions imposing local curvatures
of opposite sign coexist, they tend to demix in distinct clusters under
realistic conditions. This work has potential implications in the context of
the thermodynamics of proteins embedded in biological lipid bilayers.
","[{""version"":""v1"",""created"":""Tue, 30 Jul 2013 11:26:06 GMT""}]","2013-07-31"
"1307.7915","Jai Prakash Jaiswal","J. P. Jaiswal","Some Classes of third and Fourth-order iterative methods for solving
  nonlinear equations","arXiv admin note: substantial text overlap with arXiv:1307.7334",,,,"math.NA","http://arxiv.org/licenses/nonexclusive-distrib/1.0/","  The object of the present work is to present the new classes of third-order
and fourth-order iterative methods for solving nonlinear equations. Our
third-order method includes methods of Weerakoon \cite{Weerakoon}, Homeier
\cite{Homeier2}, Chun \cite{Chun} e.t.c. as particular cases. After that we
make this third-order method to fourth-order (optimal) by using a single weight
function rather than using two different weight functions in \cite{Soleymani}.
Finally some examples are given to illustrate the performance of the our method
by comparing with new existing third and fourth-order methods.
","[{""version"":""v1"",""created"":""Tue, 30 Jul 2013 11:26:50 GMT""}]","2013-07-31"
"1307.7916","Aaron Darling","Charalampos E. Tsourakakis","Modeling Intratumor Gene Copy Number Heterogeneity using Fluorescence in
  Situ Hybridization data","Peer-reviewed and presented as part of the 13th Workshop on
  Algorithms in Bioinformatics (WABI2013)",,,,"q-bio.QM","http://arxiv.org/licenses/nonexclusive-distrib/1.0/","  Tumorigenesis is an evolutionary process which involves a significant number
of genomic rearrangements typically coupled with changes in the gene copy
number profiles of numerous cells. Fluorescence in situ hybridization (FISH) is
a cytogenetic technique which allows counting copy numbers of genes in single
cells. The study of cancer progression using FISH data has received
considerably less attention compared to other types of cancer datasets.
  In this work we focus on inferring likely tumor progression pathways using
publicly available FISH data. We model the evolutionary process as a Markov
chain in the positive integer cone Z_+^g where g is the number of genes
examined with FISH. Compared to existing work which oversimplifies reality by
assuming independence of copy number changes, our model is able to capture
dependencies. We model the probability distribution of a dataset with
hierarchical log-linear models, a popular probabilistic model of count data.
Our choice provides an attractive trade-off between parsimony and good data
fit. We prove a theorem of independent interest which provides necessary and
sufficient conditions for reconstructing oncogenetic trees. Using this theorem
we are able to capitalize on the wealth of inter-tumor phylogenetic methods. We
show how to produce tumor phylogenetic trees which capture the dynamics of
cancer progression. We validate our proposed method on a breast tumor dataset.
","[{""version"":""v1"",""created"":""Tue, 30 Jul 2013 11:30:25 GMT""}]","2013-07-31"
"1307.7917","Peter Kevei","L\'aszl\'o Gy\""orfi, M\'arton Isp\'any, P\'eter Kevei and Gyula Pap","Asymptotic behavior of a multi-type nearly critical Galton--Watson
  processes with immigration","26 pages",,,,"math.PR","http://arxiv.org/licenses/nonexclusive-distrib/1.0/","  Multi-type inhomogeneous Galton--Watson process with immigration is
investigated, where the offspring mean matrix slowly converges to a critical
mean matrix. Under general conditions we obtain limit distribution for the
process, where the coordinates of the limit vector are not necessarily
independent.
","[{""version"":""v1"",""created"":""Tue, 30 Jul 2013 11:34:29 GMT""}]","2013-07-31"
"1307.7918","Ra\'ul de la Fuente Marcos","C. de la Fuente Marcos, R. de la Fuente Marcos","The Chelyabinsk superbolide: a fragment of asteroid 2011 EO40?","5 pages, 3 figures, 1 table, abstract abridged. Revised to reflect
  final version published in MNRAS: Letters","Monthly Notices of the Royal Astronomical Society: Letters,
  November 2013, Volume 436, Issue 1, pages L15-L19","10.1093/mnrasl/slt103",,"astro-ph.EP","http://arxiv.org/licenses/nonexclusive-distrib/1.0/","  Bright fireballs or bolides are caused by meteoroids entering the Earth's
atmosphere at high speed. On 2013 February 15, a superbolide was observed in
the skies near Chelyabinsk, Russia. Such a meteor could be the result of the
decay of an asteroid and here we explore this possibility applying a multistep
approach. First, we use available data and Monte Carlo optimization (validated
using 2008 TC3 as template) to obtain a robust solution for the pre-impact
orbit of the Chelyabinsk impactor (semimajor axis = 1.62 au, eccentricity =
0.53, inclination = 3.82 deg, longitude of the ascending node = 326.41 deg and
argument of perihelion = 109.44 deg). Then, we use this most probable orbit and
numerical analysis to single out candidates for membership in, what we call,
the Chelyabinsk asteroid family. Finally, we perform N-body simulations to
either confirm or reject any dynamical connection between candidates and
impactor. We find reliable statistical evidence on the existence of the
Chelyabinsk cluster. It appears to include multiple small asteroids and two
relatively large members: 2007 BD7 and 2011 EO40. The most probable parent body
for the Chelyabinsk superbolide is 2011 EO40. The orbits of these objects are
quite perturbed as they experience close encounters not only with the
Earth-Moon system but also with Venus, Mars and Ceres. Under such conditions,
the cluster cannot be older than about 20-40 kyr.
","[{""version"":""v1"",""created"":""Tue, 30 Jul 2013 11:38:57 GMT""},{""version"":""v2"",""created"":""Sat, 10 Aug 2013 17:30:13 GMT""}]","2013-12-17"
"1307.7919","Aaron Darling","Nishanth Ulhas Nair, Yu Lin, Philipp Bucher, and Bernard M.E. Moret","Phylogenetic Analysis of Cell Types using Histone Modifications","Peer-reviewed and presented as part of the 13th Workshop on
  Algorithms in Bioinformatics (WABI2013)",,,,"q-bio.QM","http://arxiv.org/licenses/nonexclusive-distrib/1.0/","  In cell differentiation, a cell of a less specialized type becomes one of a
more specialized type, even though all cells have the same genome.
Transcription factors and epigenetic marks like histone modifications can play
a significant role in the differentiation process. In this paper, we present a
simple analysis of cell types and differentiation paths using phylogenetic
inference based on ChIP-Seq histone modification data. We propose new data
representation techniques and new distance measures for ChIP-Seq data and use
these together with standard phylogenetic inference methods to build
biologically meaningful trees that indicate how diverse types of cells are
related. We demonstrate our approach on H3K4me3 and H3K27me3 data for 37 and 13
types of cells respectively, using the dataset to explore various issues
surrounding replicate data, variability between cells of the same type, and
robustness. The promising results we obtain point the way to a new approach to
the study of cell differentiation.
","[{""version"":""v1"",""created"":""Tue, 30 Jul 2013 11:39:03 GMT""}]","2013-07-31"
"1307.7920","Serger Khashin Dr","Sergey Khashin","Counterexamples for Frobenius primality test",,,,,"math.NT","http://arxiv.org/licenses/nonexclusive-distrib/1.0/","  At present one can not find a single counterexample to even a simplest
version of Frobenius primality test. The assessment of probability of the
mistake, presented in [I.B. Damgard and G.S.Frandsen, Journal of Cryptology,
2006] is strongly overestimated. In the present paper, the properties of simple
divisors of FPP-numbers are proved. The lower bound for FPP are given.
","[{""version"":""v1"",""created"":""Tue, 30 Jul 2013 11:41:15 GMT""}]","2013-07-31"
"1307.7921","Pit Vanhoefer","Pit Vanhoefer (the Belle Collaboration)","Results on \phi 2 from e+e- colliders","Presented at the 2013 Flavor Physics and CP Violation (FPCP-2013),
  Buzios, Rio de Janeiro, Brazil, May 19-24 2013, 12 pages, 8 figures",,,,"hep-ex hep-ph","http://arxiv.org/licenses/nonexclusive-distrib/1.0/","  We present a summary of measurements sensitive to the CKM angle \phi 2
(\alpha), performed by the BaBar and the Belle experiments which both collect
B\bar{B} pairs produced at the \Upsilon(4S) resonance in asymmetric e+e-
collisions. We discuss the decays B -> \pi \pi, \rho\rho, a_1\pi and
(\rho\pi)^0. The CP asymmetries, branching fractions and polarizations obtained
are used to constrain \phi 2.
","[{""version"":""v1"",""created"":""Tue, 30 Jul 2013 11:41:25 GMT""}]","2013-07-31"
"1307.7922","Yuichi Ota","Y. Ota, K. Okazaki, Y. Kotani, T. Shimojima, W. Malaeb, S. Watanabe,
  C. -T. Chen, K. Kihou, C. H. Lee, A. Iyo, H. Eisaki, T. Saito, H. Fukazawa,
  Y. Kohori, S. Shin","Evidence for exclusion of the possibility of $d$-wave
  superconducting-gap symmetry in Ba-doped KFe$_2$As$_2$",,"Phys. Rev. B 89, 081103 (2014)","10.1103/PhysRevB.89.081103",,"cond-mat.supr-con","http://arxiv.org/licenses/nonexclusive-distrib/1.0/","  We have investigated the superconducting(SC)-gap anisotropy for several
Ba-doped KFe$_2$As$_2$ samples using laser-based angle-resolved photoemission
spectroscopy. We show that the SC-gap anisotropy and node positions drastically
change with a small amount of Ba doping. Our results totally exclude a
possibility of $d$-wave symmetry and strongly suggest that both spin and
orbital fluctuations are important for the paring interaction in the Ba-doped
K122.
","[{""version"":""v1"",""created"":""Tue, 30 Jul 2013 11:41:30 GMT""},{""version"":""v2"",""created"":""Wed, 31 Jul 2013 05:05:46 GMT""},{""version"":""v3"",""created"":""Mon, 24 Feb 2014 05:42:53 GMT""}]","2014-02-25"
"1307.7923","Ulf-G. Mei{\ss}ner","Ulf-G. Mei{\ss}ner","Nuclear lattice simulations: Status and perspectives","Plenary talk sponsored by The European Physical Journal A -- Hadrons
  and Nuclei, INPC 2013, Florence, Italy, 8 pages, 3 figures, uses webofc.cls",,"10.1051/epjconf/20146601012",,"nucl-th hep-lat hep-ph nucl-ex","http://arxiv.org/licenses/nonexclusive-distrib/1.0/","  I review the present status of nuclear lattice simulations.
  This talk is dedicated to the memory of Gerald E. Brown.
","[{""version"":""v1"",""created"":""Tue, 30 Jul 2013 11:42:55 GMT""}]","2015-06-16"
"1307.7924","Zong-Gang Mou","Zong-Gang Mou, Paul M. Saffin, Anders Tranberg","Ensemble fermions for electroweak dynamics and the fermion preheating
  temperature","19 pages, 10 figures",,"10.1007/JHEP11(2013)097",,"hep-ph hep-lat hep-th","http://arxiv.org/licenses/nonexclusive-distrib/1.0/","  We refine the implementation of ensemble fermions for the electroweak sector
of the Standard Model, introduced previously. We consider the behavior of
different observables as the size of the ensemble is increased and show that
the dynamics converges for ensemble sizes small enough that simulations of the
entire electroweak sector become numerically tractable. We apply the method to
the computation of the effective preheating temperature during a fast
electroweak transition, relevant for Cold Electroweak Baryogenesis. We find
that this temperature is never below 20 GeV, and this in combination with the
early results convincingly rules out Standard Model CP-violation as the origin
of the baryon asymmetry of the Universe.
","[{""version"":""v1"",""created"":""Tue, 30 Jul 2013 11:44:16 GMT""},{""version"":""v2"",""created"":""Tue, 24 Sep 2013 10:40:13 GMT""}]","2015-06-16"
"1307.7925","Aaron Darling","Taku Onodera, Kunihiko Sadakane, and Tetsuo Shibuya","Detecting Superbubbles in Assembly Graphs","Peer-reviewed and presented as part of the 13th Workshop on
  Algorithms in Bioinformatics (WABI2013)",,,,"cs.DS cs.CE cs.DM q-bio.QM","http://arxiv.org/licenses/nonexclusive-distrib/1.0/","  We introduce a new concept of a subgraph class called a superbubble for
analyzing assembly graphs, and propose an efficient algorithm for detecting it.
Most assembly algorithms utilize assembly graphs like the de Bruijn graph or
the overlap graph constructed from reads. From these graphs, many assembly
algorithms first detect simple local graph structures (motifs), such as tips
and bubbles, mainly to find sequencing errors. These motifs are easy to detect,
but they are sometimes too simple to deal with more complex errors. The
superbubble is an extension of the bubble, which is also important for
analyzing assembly graphs. Though superbubbles are much more complex than
ordinary bubbles, we show that they can be efficiently enumerated. We propose
an average-case linear time algorithm (i.e., O(n+m) for a graph with n vertices
and m edges) for graphs with a reasonable model, though the worst-case time
complexity of our algorithm is quadratic (i.e., O(n(n+m))). Moreover, the
algorithm is practically very fast: Our experiments show that our algorithm
runs in reasonable time with a single CPU core even against a very large graph
of a whole human genome.
","[{""version"":""v1"",""created"":""Tue, 30 Jul 2013 11:44:34 GMT""}]","2013-08-02"
"1307.7926","Toshikaze Kariyado","Toshikaze Kariyado and Yasuhiro Hatsugai","Symmetry Protected Quantization and Bulk-Edge Correspondence of Massless
  Dirac Fermions: Application to Fermionic Shastry-Sutherland Model","5 pages","Phys. Rev. B 88 (2013) 245126","10.1103/PhysRevB.88.245126",,"cond-mat.str-el","http://arxiv.org/licenses/nonexclusive-distrib/1.0/","  The fermionic Shastry-Sutherland model has a rich phase diagram, including
phases with massless Dirac fermions, a quadratic band crossing point, and a
pseudospin-1 Weyl fermion. Berry phases defined by the one-dimensional momentum
as a parameter are quantized into 0 or pi due to the inversion symmetry
combined with the time reversal, or existence of the glide plane, which also
protects the massless Dirac cones with continuous parameters. This is the
symmetry protected Z2 quantization. We have further demonstrated the Z2 Berry
phases generically determine the existence of edge states in various phases and
with different types of the boundaries as the bulk-edge correspondence of the
massless Dirac fermion systems.
","[{""version"":""v1"",""created"":""Tue, 30 Jul 2013 11:47:06 GMT""}]","2015-01-30"
"1307.7927","Helen Ebbe","Helen Ebbe and Stefan Wolf","Multi-User Non-Locality Amplification","9 pages, 3 figures. arXiv admin note: substantial text overlap with
  arXiv:1301.5875","IEEE Transactions on Information Theory, 60(2):1159-1167, 2014","10.1109/TIT.2013.2292515",,"quant-ph","http://arxiv.org/licenses/nonexclusive-distrib/1.0/","  Non-local correlations are among the most fascinating features of quantum
theory from the point of view of information: Such correlations, although not
allowing for signaling, are unexplainable by pre-shared information. The
correlations have applications in cryptography, communication complexity, and
sit at the very heart of many attempts of understanding quantum theory -- and
its limits -- in terms of classical information. In these contexts, the
question is crucial whether such correlations can be amplified or distilled,
i.e., whether and how weak correlations can be used for generating (a smaller
amount of) stronger. Whereas the question has been studied quite extensively
for bipartite correlations (yielding both pessimistic and optimistic results),
only little is known in the multi-partite case. We introduce a general
framework of reductions between multi-party input-output systems. Within this
formalism, we show that a natural n-party generalization of the well-known
Popescu-Rohrlich box can be distilled, by an adaptive protocol, to the
algebraic maximum.We use this result further to show that a much broader class
of correlations, including all purely threepartite correlations, can be
distilled from arbitrarily weak to almost maximal strength with partial
communication, i.e., using only a subset of the channels required for the
creation of the same correlation from scratch. Alternatively, this means that
arbitrarily weak non-local correlations can have a ""communication value"" in the
context of the generation of maximal non-locality.
","[{""version"":""v1"",""created"":""Tue, 30 Jul 2013 11:49:30 GMT""}]","2014-01-21"
"1307.7928","Leandro Aurichi","Leandro F. Aurichi and Angelo Bella","Topological games and productively countably tight spaces",,,,,"math.GN","http://arxiv.org/licenses/nonexclusive-distrib/1.0/","  The two main results of this work are the following: if a space $X$ is such
that player II has a winning strategy in the game $\gone(\Omega_x, \Omega_x)$
for every $x \in X$, then $X$ is productively countably tight. On the other
hand, if a space is productively countably tight, then $\sone(\Omega_x,
\Omega_x)$ holds for every $x \in X$. With these results, several other results
follow, using some characterizations made by Uspenskii and Scheepers.
","[{""version"":""v1"",""created"":""Tue, 30 Jul 2013 11:56:40 GMT""},{""version"":""v2"",""created"":""Thu, 29 Aug 2013 18:27:31 GMT""},{""version"":""v3"",""created"":""Sun, 6 Apr 2014 20:43:50 GMT""}]","2014-04-08"
"1307.7929","Eduardo Martinez-Pedroza","Eduardo Mart\'inez-Pedroza and Daniel T. Wise","Coherence and Negative Sectional Curvature in Complexes of Groups","Version to appear in Michigan Mathematical Journal","Michigan Math. J. Volume 62, Issue 3 (2013), 507-536","10.1307/mmj/1378757886",,"math.GR math.GT","http://arxiv.org/licenses/nonexclusive-distrib/1.0/","  We examine a condition on a simply connected 2-complex X ensuring that groups
acting properly on X are coherent. This extends earlier work on 2-complexes
with negative sectional curvature which covers the case that G acts freely. Our
extension of these results involves a generalization of the notion of sectional
curvature, an extension of the combinatorial Gauss-Bonnet theorem to complexes
of groups, and surprisingly requires the use of L^2-Betti numbers. We also
prove local quasiconvexity of G under the additional assumption that X is
CAT(0) space.
","[{""version"":""v1"",""created"":""Tue, 30 Jul 2013 11:57:42 GMT""}]","2016-02-17"
"1307.7930","Laura Abatangelo","Laura Abatangelo, Veronica Felli, Susanna Terracini","On the sharp effect of attaching a thin handle on the spectral rate of
  convergence",,,,,"math.AP","http://arxiv.org/licenses/nonexclusive-distrib/1.0/","  Consider two domains connected by a thin tube: it can be shown that the
resolvent of the Dirichlet Laplacian is continuous with respect to the channel
section parameter. This in particular implies the continuity of isolated simple
eigenvalues and the corresponding eigenfunctions with respect to domain
perturbation. Under an explicit nondegeneracy condition, we improve this
information providing a sharp control of the rate of convergence of the
eigenvalues and eigenfunctions in the perturbed domain to the relative
eigenvalue and eigenfunction in the limit domain. As an application, we prove
that, again under an explicit nondegeneracy con- dition, the case of resonant
domains features polinomial splitting of the two eigenvalues and a clear
bifurcation of eigenfunctions.
","[{""version"":""v1"",""created"":""Tue, 30 Jul 2013 11:58:50 GMT""}]","2013-07-31"
