"1302.3301","Misael Avenda\~no","M. Avenda\~no Camacho Yu. Vorobiev","On the Global Structure of Normal Forms for Slow-Fast Hamiltonian
  Systems",,,,,"math-ph math.MP","http://arxiv.org/licenses/nonexclusive-distrib/1.0/","  In the framework of Lie transform and the global method of averaging, the
normal forms of a multidimensional slow-fast Hamiltonian system are studied in
the case when the flow of the unperturbed (fast) system is periodic and the
induced S^1-action is not necessarily free and trivial. An intrinsic splitting
of the second term in a S^1-invariant normal form of first order is derived in
terms of the Hannay-Berry connection associated with the periodic flow.
","[{""version"":""v1"",""created"":""Thu, 14 Feb 2013 03:35:44 GMT""}]","2013-02-15"
"1302.3302","Cheng Wang","Cheng Wang, Longbing Cao, and Baiqi Miao","Asymptotic power of likelihood ratio tests for high dimensional data","10 pages, 2 figures",,,,"math.ST stat.TH","http://arxiv.org/licenses/nonexclusive-distrib/1.0/","  This paper considers the asymptotic power of likelihood ratio test (LRT) for
the identity test when the dimension p is large compared to the sample size n.
The asymptotic distribution of LRT under alternatives is given and an explicit
expression of the power is derived. A simulation study is carried out to
compare LRT with other tests. All these studies show that LRT is a powerful
test to detect eigenvalues around zero.
  Key words and phrases: Covariance matrix, High dimensional data, Identity
test, Likelihood ratio test, Power
","[{""version"":""v1"",""created"":""Thu, 14 Feb 2013 03:39:37 GMT""}]","2013-02-15"
"1302.3303","??(Guojun) ?(Yang)","Guojun Yang","On a Class of Singular Projectively Flat Finsler Metrics with Constant
  Flag Curvature","14 pages",,,,"math.DG","http://arxiv.org/licenses/nonexclusive-distrib/1.0/","  Singular Finsler metrics, such as Kropina metrics and $m$-Kropina metrics,
have a lot of applications in the real world. In this paper, we classify a
class of singular $(\alpha,\beta)$-metrics which are locally projectively flat
with constant flag curvature in dimension $n= 2$ and $n \ge 3$ respectively.
Further, we determine the local structure of $m$-Kropina metrics and
particularly Kropina metrics which are projectively flat with constant flag
curvature and prove that such metrics must be locally Minkowskian but are not
necessarily flat-parallel.
","[{""version"":""v1"",""created"":""Thu, 14 Feb 2013 03:47:48 GMT""}]","2013-02-15"
"1302.3304","Shih Wei Su Shih Wei Su","Shih-Wei Su, Shih-Chuan Gou, Ashton Bradley, Oleksandr Fialko, and
  Joachim Brand","Kibble-Zurek scaling and its breakdown for spontaneous generation of
  Josephson vortices in Bose-Einstein condensates","5 pages, 4 figures","Phys. Rev. Lett. 110, 215302 (2013)","10.1103/PhysRevLett.110.215302",,"cond-mat.quant-gas","http://arxiv.org/licenses/nonexclusive-distrib/1.0/","  Atomic Bose-Einstein condensates confined to a dual-ring trap support
Josephson vortices as topologically stable defects in the relative phase. We
propose a test of the scaling laws for defect formation by quenching a Bose gas
to degeneracy in this geometry. Stochastic Gross-Pitaevskii simulations reveal
a -1/4 power-law scaling of defect number with quench time for fast quenches,
consistent with the Kibble-Zurek mechanism. Slow quenches show stronger
quench-time dependence that is explained by the stability properties of
Josephson vortices, revealing the boundary of the Kibble-Zurek regime.
Interference of the two atomic fields enables clear long-time measurement of
stable defects, and a direct test of the Kibble-Zurek mechanism in
Bose-Einstein condensation.
","[{""version"":""v1"",""created"":""Thu, 14 Feb 2013 04:06:41 GMT""},{""version"":""v2"",""created"":""Fri, 3 May 2013 02:45:56 GMT""}]","2013-05-27"
"1302.3305","Simon Berger","S. Berger, M. Pechal, A. A. Abdumalikov Jr., C. Eichler, L. Steffen,
  A. Fedorov, A. Wallraff, S. Filipp","Exploring the Effect of Noise on the Berry Phase","5 pages, 4 figures","Physical Review A, 060303(R) (2013)","10.1103/PhysRevA.87.060303",,"quant-ph cond-mat.supr-con","http://arxiv.org/licenses/nonexclusive-distrib/1.0/","  We make use of a superconducting qubit to study the effects of noise on
adiabatic geometric phases. The state of the system, an effective spin one-half
particle, is adiabatically guided along a closed path in parameter space and
thereby acquires a geometric phase. By introducing artificial fluctuations in
the control parameters, we measure the geometric contribution to dephasing for
a variety of noise powers and evolution times. Our results clearly show that
only fluctuations which distort the path lead to geometric dephasing. In a
direct comparison with the dynamic phase, which is path-independent, we observe
that the adiabatic geometric phase is less affected by noise-induced dephasing.
This observation directly points towards the potential of geometric phases for
quantum gates or metrological applications.
","[{""version"":""v1"",""created"":""Thu, 14 Feb 2013 04:12:04 GMT""},{""version"":""v2"",""created"":""Wed, 26 Jun 2013 16:21:44 GMT""}]","2013-06-27"
"1302.3306","Takashi Kato","Takashi Kato, Akihiko Takahashi, Toshihiro Yamada","An Asymptotic Expansion Formula for Up-and-Out Barrier Option Price
  under Stochastic Volatility Model","9 pages","JSIAM Letters Vol. 5 (2013) p.17-20","10.14495/jsiaml.5.17",,"q-fin.CP","http://arxiv.org/licenses/nonexclusive-distrib/1.0/","  This paper derives a new semi closed-form approximation formula for pricing
an up-and-out barrier option under a certain type of stochastic volatility
model including SABR model by applying a rigorous asymptotic expansion method
developed by Kato, Takahashi and Yamada (2012). We also demonstrate the
validity of our approximation method through numerical examples.
","[{""version"":""v1"",""created"":""Thu, 14 Feb 2013 04:15:35 GMT""}]","2014-06-16"
"1302.3307","Stefan Funk","The Fermi-LAT collaboration: M. Ackermann, M. Ajello, A. Allafort, L.
  Baldini, J. Ballet, G. Barbiellini, M. G. Baring, D. Bastieri, K. Bechtol, R.
  Bellazzini, R. D. Blandford, E. D. Bloom, E. Bonamente, A. W. Borgland, E.
  Bottacini, T. J. Brandt, J. Bregeon, M. Brigida, P. Bruel, R. Buehler, G.
  Busetto, S. Buson, G. A. Caliandro, R. A. Cameron, P. A. Caraveo, J. M.
  Casandjian, C. Cecchi, \""O. \c{C}elik, E. Charles, S. Chaty, R.C.G. Chaves,
  A. Chekhtman, C. C. Cheung, J. Chiang, G. Chiaro, A. N. Cillis, S. Ciprini,
  R. Claus, J. Cohen-Tanugi, L. R. Cominsky, J. Conrad, S. Corbel, S. Cutini,
  F. D'Ammando, A. de Angelis, F. de Palma, C. D. Dermer, E. do Couto e Silva,
  P. S. Drell, A. Drlica-Wagner, L. Falletti, C. Favuzzi, E. C. Ferrara, A.
  Franckowiak, Y. Fukazawa, S. Funk, P. Fusco, F. Gargano, S. Germani, N.
  Giglietto, P. Giommi, F. Giordano, M. Giroletti, T. Glanzman, G. Godfrey, I.
  A. Grenier, M.-H. Grondin, J. E. Grove, S. Guiriec, D. Hadasch, Y. Hanabata,
  A. K. Harding, M. Hayashida, K. Hayashi, E. Hays, J. Hewitt, A. B. Hill, R.
  E. Hughes, M. S. Jackson, T. Jogler, G. J\'ohannesson, A. S. Johnson, T.
  Kamae, J. Kataoka, J. Katsuta, J. Kn\""odlseder, M. Kuss, J. Lande, S.
  Larsson, L. Latronico, M. Lemoine-Goumard, F. Longo, F. Loparco, M. N.
  Lovellette, P. Lubrano, G. M. Madejski, F. Massaro, M. Mayer, M. N.
  Mazziotta, J. E. McEnery, J. Mehault, P. F. Michelson, R. P. Mignani, W.
  Mitthumsiri, T. Mizuno, A. A. Moiseev, M. E. Monzani, A. Morselli, I. V.
  Moskalenko, S. Murgia, T. Nakamori, R. Nemmen, E. Nuss, M. Ohno, T. Ohsugi,
  N. Omodei, M. Orienti, E. Orlando, J. F. Ormes, D. Paneque, J. S. Perkins, M.
  Pesce-Rollins, F. Piron, G. Pivato, S. Rain\`o, R. Rando, M. Razzano, S.
  Razzaque, A. Reimer, O. Reimer, S. Ritz, C. Romoli, M. S\'anchez-Conde, A.
  Schulz, C. Sgr\`o, P. E. Simeon, E. J. Siskind, D. A. Smith, G. Spandre, P.
  Spinelli, F. W. Stecker, A. W. Strong, D. J. Suson, H. Tajima, H. Takahashi,
  T. Takahashi, T. Tanaka, J. G. Thayer, J. B. Thayer, D. J. Thompson, S. E.
  Thorsett, L. Tibaldo, O. Tibolla, M. Tinivella, E. Troja, Y. Uchiyama, T. L.
  Usher, J. Vandenbroucke, V. Vasileiou, G. Vianello, V. Vitale, A. P. Waite,
  M. Werner, B. L. Winer, K. S. Wood, M. Wood, R. Yamazaki, Z. Yang, S. Zimmer","Detection of the Characteristic Pion-Decay Signature in Supernova
  Remnants","To appear in Science Magazine on February 15th; contact authors:
  Stefan Funk, Takaaki Tanaka, Yasunobu Uchiyama","Science Magazine 2013, volume 339, page 807","10.1126/science.1231160",,"astro-ph.HE astro-ph.GA","http://arxiv.org/licenses/nonexclusive-distrib/1.0/","  Cosmic rays are particles (mostly protons) accelerated to relativistic
speeds. Despite wide agreement that supernova remnants (SNRs) are the sources
of galactic cosmic rays, unequivocal evidence for the acceleration of protons
in these objects is still lacking. When accelerated protons encounter
interstellar material, they produce neutral pions, which in turn decay into
gamma rays. This offers a compelling way to detect the acceleration sites of
protons. The identification of pion-decay gamma rays has been difficult because
high-energy electrons also produce gamma rays via bremsstrahlung and inverse
Compton scattering. We detected the characteristic pion-decay feature in the
gamma-ray spectra of two SNRs, IC 443 and W44, with the Fermi Large Area
Telescope. This detection provides direct evidence that cosmic-ray protons are
accelerated in SNRs.
","[{""version"":""v1"",""created"":""Thu, 14 Feb 2013 04:20:17 GMT""}]","2013-03-18"
"1302.3308","Mrinal Kumar","Mrinal Kumar, Gaurav Maheshwari, Jayalal Sarma M.N","Arithmetic Circuit Lower Bounds via MaxRank","22 pages",,,,"cs.CC","http://arxiv.org/licenses/nonexclusive-distrib/1.0/","  We introduce the polynomial coefficient matrix and identify maximum rank of
this matrix under variable substitution as a complexity measure for
multivariate polynomials. We use our techniques to prove super-polynomial lower
bounds against several classes of non-multilinear arithmetic circuits. In
particular, we obtain the following results :
  As our main result, we prove that any homogeneous depth-3 circuit for
computing the product of $d$ matrices of dimension $n \times n$ requires
$\Omega(n^{d-1}/2^d)$ size. This improves the lower bounds by Nisan and
Wigderson(1995) when $d=\omega(1)$.
  There is an explicit polynomial on $n$ variables and degree at most
$\frac{n}{2}$ for which any depth-3 circuit $C$ of product dimension at most
$\frac{n}{10}$ (dimension of the space of affine forms feeding into each
product gate) requires size $2^{\Omega(n)}$. This generalizes the lower bounds
against diagonal circuits proved by Saxena(2007). Diagonal circuits are of
product dimension 1.
  We prove a $n^{\Omega(\log n)}$ lower bound on the size of product-sparse
formulas. By definition, any multilinear formula is a product-sparse formula.
Thus, our result extends the known super-polynomial lower bounds on the size of
multilinear formulas by Raz(2006).
  We prove a $2^{\Omega(n)}$ lower bound on the size of partitioned arithmetic
branching programs. This result extends the known exponential lower bound on
the size of ordered arithmetic branching programs given by Jansen(2008).
","[{""version"":""v1"",""created"":""Thu, 14 Feb 2013 04:25:56 GMT""}]","2013-02-15"
"1302.3309","Georgios Askalidis","Georgios Askalidis, Nicole Immorlica and Emmanouil Pountourakis","Socially Stable Matchings","12 pages",,,,"cs.GT","http://arxiv.org/licenses/nonexclusive-distrib/1.0/","  In two-sided matching markets, the agents are partitioned into two sets. Each
agent wishes to be matched to an agent in the other set and has a strict
preference over these potential matches. A matching is stable if there are no
blocking pairs, i.e., no pair of agents that prefer each other to their
assigned matches. In this paper we study a variant of stable matching motivated
by the fact that, in most centralized markets, many agents do not have direct
communication with each other. Hence even if some blocking pairs exist, the
agents involved in those pairs may not be able to coordinate a deviation. We
model communication channels with a bipartite graph between the two sets of
agents which we call the social graph, and we study socially stable matchings.
A matching is socially stable if there are no blocking pairs that are connected
by an edge in the social graph. Socially stable matchings vary in size and so
we look for a maximum socially stable matching. We prove that this problem is
NP-hard and, assuming the unique games conjecture, hard to approximate within a
factor of 3/2-{\epsilon}, for any constant {\epsilon}>0. We complement the
hardness results with a 3/2-approximation algorithm.
","[{""version"":""v1"",""created"":""Thu, 14 Feb 2013 04:37:06 GMT""},{""version"":""v2"",""created"":""Sat, 23 Feb 2013 21:03:05 GMT""}]","2013-02-26"
"1302.3310","Jens Kaad","Jens Kaad","A Serre-Swan theorem for bundles of bounded geometry","32 pages",,,,"math.OA math.DG","http://arxiv.org/licenses/nonexclusive-distrib/1.0/","  The Serre-Swan theorem in differential geometry establishes an equivalence
between the category of smooth vector bundles over a smooth compact manifold
and the category of finitely generated projective modules over the unital ring
of smooth functions. This theorem is here generalized to manifolds of bounded
geometry. In this context it states that the category of Hilbert bundles of
bounded geometry is equivalent to the category of operator *-modules over the
operator *-algebra of continuously differentiable functions which vanish at
infinity. Operator *-modules are generalizations of Hilbert C*-modules where
C*-algebras have been replaced by a more flexible class of involutive algebras
of bounded operators: Operator *-algebras. They play an important role in the
study of the unbounded Kasparov product.
","[{""version"":""v1"",""created"":""Thu, 14 Feb 2013 04:53:32 GMT""}]","2013-02-15"
"1302.3311","Ron Larham","Ron Larham","Demonic dominoes","13 pages, 8 figures. arXiv admin note: text overlap with
  arXiv:0803.2898",,,,"physics.pop-ph","http://arxiv.org/licenses/nonexclusive-distrib/1.0/","  In response to a challenge in a recent paper to measure the propagation speed
of the wave of collapse of an array of dominoes (the Domino Effect), a novel
method of measuring the speed of such waves has been developed using sound
recordings of the collapse and DEMON (Detection of Modulation on Noise)
analysis to extract the frequency of domino impacts and hence the speed of
propagation of the domino wave. This paper presents this method and a
discussion of the other published measurements and models and some comments on
the precess of mathematical modelling.
","[{""version"":""v1"",""created"":""Thu, 14 Feb 2013 05:01:45 GMT""}]","2013-02-15"
"1302.3312","Norberto Romanelli","Norberto Romanelli, Cesar Bertucci, Daniel Gomez, Christian Mazelle,
  Magda Delva","Proton Cyclotron Waves Upstream from Mars: Observations from Mars Global
  Surveyor",,,"10.1016/j.pss.2012.10.011",,"astro-ph.EP physics.space-ph","http://arxiv.org/licenses/nonexclusive-distrib/1.0/","  We present a study on the properties of electromagnetic plasma waves in the
region upstream of the Martian bow shock, detected by the magnetometer and
electron reflectometer (MAG / ER) onboard the Mars Global Surveyor (MGS)
spacecraft during the period known as Science Phasing Orbits (SPO). The
frequency of these waves, measured in the MGS reference frame (SC), is close to
the local proton cyclotron frequency. Minimum variance analysis (MVA) shows
that these 'proton cyclotron frequency' waves (PCWs) are characterized - in the
SC frame - by a left-hand, elliptical polarization and propagate almost
parallel to the background magnetic field. They also have a small degree of
compressibility and an amplitude that decreases with the increase of the
interplanetary magnetic field (IMF) cone angle and radial distance from the
planet. The latter result supports the idea that the source of these waves is
Mars. In addition, we find that these waves are not associated with the
foreshock . Empirical evidence and theoretical approaches suggest that most of
these observations correspond to the ion-ion right hand (RH) mode originating
from the pick-up of ionized exospheric hydrogen. The left-hand (LH) mode might
be present in cases where the IMF cone angle is high. PCWs occur in 62% of the
time during SPO1 subphase, whereas occurrence drops to 8% during SPO2. Also,
SPO1 PCWs preserve their characteristics for longer time periods and have
greater degree of polarization and coherence than those in SPO2. We discuss
these results in the context of possible changes in the pick-up conditions from
SPO1 to SPO2, or steady, spatial inhomogeneities in the wave distribution. The
lack of influence from the Solar Wind's convective electric field upon the
location of PCWs indicates that there is no clear relation between the spatial
distribution of PCWs and that of pick-up ions.
","[{""version"":""v1"",""created"":""Thu, 14 Feb 2013 05:14:59 GMT""}]","2015-06-15"
"1302.3313","Yoichi Takeda","Yoichi Takeda, Masahide Takada-Hidai","Carbon Abundances of Metal-Poor Star Determined from the C I 1.068-1.069
  micron Lines","16 pages, 8 figures, 3 tables and 2 electronic tables; accepted for
  publication in Publ. Astron. Soc. Japan (Vol.65, No. 4)",,"10.1093/pasj/65.3.65",,"astro-ph.SR","http://arxiv.org/licenses/nonexclusive-distrib/1.0/","  A non-LTE analysis of C I lines at 1.068-1.069 micron was carried out for
selected 46 halo/disk stars covering a wide metallicity range (-3.7 <[Fe/H]<
+0.3), based on the spectral data collected with IRCS+AO188 of the Subaru
Telescope, in order to examine whether and how these strong neutral carbon
lines of multiplet 1 can be exploited for establishing stellar carbon
abundances, especially for very metal-poor stars where CH molecular lines have
been commonly used. These C I lines were confirmed to be clearly visible for
all stars down to [Fe/H] ~ -3.7, from which C abundances could be successfully
determined. The resulting [C/Fe] vs. [Fe/H] diagram revealed almost the same
trend established from previous studies. When the results for individual stars
are compared with the published data collected from various literature, while a
reasonable agreement is seen as a whole, a tendency is observed that our
abundances are appreciably higher than those from CH lines especially for very
metal-poor giants of low gravity. Since the abundances of these C I lines are
subject to rather large non-LTE corrections (typically by several tenths dex)
whose importance progressively grows as the metallicity is lowered, attention
should be paid to how the collisional rates (especially due to neutral
hydrogen) are treated in non-LTE calculations.
","[{""version"":""v1"",""created"":""Thu, 14 Feb 2013 05:27:27 GMT""}]","2015-06-15"
"1302.3314","Ralph Gomez","Ralph R. Gomez","A Note on Smale Manifolds and Lorentzian Sasaki-Einstein Geometry",,,,,"math.DG","http://arxiv.org/licenses/nonexclusive-distrib/1.0/","  In this note, we construct new examples of Lorentzian Sasaki-Einstein (LSE)
metrics on Smale manifolds $M.$ It has already been established in \cite{Gmz2}
that such metrics exist on the so-called torsion free Smale manifolds, i.e. the
$k$-fold connected sum of $S^{2}\times S^{3}.$ Now, we show that LSE metrics
exist on Smale manifolds for which $H_{2}(M,\mathbb{Z})_{tor}$ is nontrivial.
In particular, we show that most simply-connected positive Sasakian rational
homology 5-spheres are also negative Sasakian (hence Lorentzian
Sasaki-Einstein). Moreover, we show that for each pair of positive integers
$(n,s)$ with $n,s >1$, there exists a Lorentzian Sasaki-Einstein Smale manifold
$M$ such that $H_{2}(M,{\mathbb{Z}})_{tors}=(\mathbb{Z}/n)^{2s}$. Finally, we
are able to construct so-called mixed Smale manifolds (connect sum of torsion
free Smale manifolds with rational homology spheres) which admit LSE metrics
and have arbitrary second Betti number. This gives infinitely many examples
which do not admit positive Sasakian structures. These results partially
address the open problems
","[{""version"":""v1"",""created"":""Thu, 14 Feb 2013 05:29:02 GMT""}]","2013-02-15"
"1302.3315","Paul Woon Yin Lee","Paul W.Y. Lee","Differential Harnack inequalities for a family of sub-elliptic diffusion
  equations on Sasakian manifolds","27 pages",,,,"math.DG math.AP","http://arxiv.org/licenses/nonexclusive-distrib/1.0/","  We prove a version of differential Harnack inequality for a family of
sub-elliptic diffusions on Sasakian manifolds under certain curvature
conditions.
","[{""version"":""v1"",""created"":""Thu, 14 Feb 2013 05:35:34 GMT""}]","2013-02-15"
"1302.3316","Masateru Ishiguro","Masateru Ishiguro, Hongu Yang, Fumihiko Usui, Jeonghyun Pyo, Munetaka
  Ueno, Takafumi Ootsubo, Suk Minn Kwon, Tadashi Mukai","High-resolution Imaging of the Gegenschein and the Geometric Albedo of
  Interplanetary Dust","34 pages, 14 Figures, 2 Tables, Accepted on February 11, 2013, for
  the publication of ApJ",,"10.1088/0004-637X/767/1/75",,"astro-ph.EP","http://arxiv.org/licenses/nonexclusive-distrib/1.0/","  We made optical observations of the Gegenschein using a
liquid-nitrogen-cooled wide-field camera, Wide-field Imager of Zodiacal light
with ARray Detector (WIZARD), between March 2003 and November 2006. We found a
narrow brightness enhancement superimposed on the smooth gradient of the
Gegenschein at the exact position of the antisolar point. Whereas the
Gegenschein morphology changed according to the orbital motion of the Earth,
the maximum brightness coincided with the antisolar direction throughout the
year. We compared the observed morphology of the Gegenschein with those of
models in which the spatial density of the interplanetary dust cloud was
considered and found that the volume scattering phase function had a narrow
backscattering enhancement. The morphology was reproducible with a spatial
distribution model for infrared zodiacal emission. It is likely that the
zero-phase peak (the so-called opposition effect) was caused by coherent
backscattering and/or shadow-hiding effects on the rough surfaces of individual
dust particles. These results suggest that big particles are responsible for
both zodiacal light and zodiacal emission. Finally, we derived the geometric
albedo of the smooth component of interplanetary dust, assuming big particles,
and obtained a geometric albedo of 0.06+-0.01. The derived albedo is in
accordance with collected dark micrometeorites and observed cometary dust
particles. We concluded that chondritic particles are dominant near Earth
space, supporting the recent theoretical study by dynamical simulation.
","[{""version"":""v1"",""created"":""Thu, 14 Feb 2013 05:40:52 GMT""}]","2015-06-15"
"1302.3317","Yongfeng Wu","Yongfeng Wu, Weike Xiao","Probing topological relation between high density and low density region
  of 2MASS with hexagon cells",,"ApJ, 781, 115,2014","10.1088/0004-637X/781/2/115",,"astro-ph.CO","http://arxiv.org/licenses/nonexclusive-distrib/1.0/","  We introduce a new 2-D hexagon technique to probe the topological structure
of the universe, in which we map regions of the sky with high and low galaxy
densities onto a 2-D lattice of hexagon unit cells, We define filled cells as
corresponding to high density regions and empty cells as corresponding to low
density region. The number of filled cells and empty cells are kept same by
controlling the size of the cells. By analyzing the six neighbors of each
hexagon we can get and compare statistical topological properties of the high
density and low density regions in the universe, in order to have a better
understanding of the evolution of the universe. We apply this hexagon method on
2MASS data and discover significant topological differences between the high
density and low density regions. Both regions have significant (>5 Sigma)
topological shifts from the binomial distribution or the random distribution.
","[{""version"":""v1"",""created"":""Thu, 14 Feb 2013 06:01:38 GMT""},{""version"":""v2"",""created"":""Mon, 15 Apr 2013 06:01:12 GMT""},{""version"":""v3"",""created"":""Thu, 6 Feb 2014 07:24:48 GMT""}]","2015-06-15"
"1302.3318","Alain Blondel P","Alain Blondel, Alex Chao, Weiren Chou, Jie Gao, Daniel Schulte and
  Kaoru Yokoya","Report of the ICFA Beam Dynamics Workshop 'Accelerators for a Higgs
  Factory: Linear vs. Circular' (HF2012)",,,,"FERMILAB-CONF-13-037-APC, IHEP-AC-2013-001, SLAC-PUB-15370,
  CERN-ATS-2013-032","physics.acc-ph hep-ex","http://arxiv.org/licenses/nonexclusive-distrib/1.0/","  This paper is a summary report of the ICFA Beam Dynamics Workshop
'Accelerators for a Higgs Factory: Linear vs. Circular' (HF2012). It discusses
four types of accelerators as possible candidates for a Higgs factory: linear
e+e- colliders, circular e+e- colliders, muon collider and photon colliders.
The comparison includes: physics reach, performance (energy and luminosity),
upgrade potential, technology maturity and readiness, and technical challenges
requiring further R&D.
","[{""version"":""v1"",""created"":""Thu, 14 Feb 2013 06:20:31 GMT""},{""version"":""v2"",""created"":""Fri, 15 Feb 2013 10:48:52 GMT""}]","2013-02-18"
