"1302.3149","Bruce Solomon","Nick Edelen and Bruce Solomon","Constant mean curvature, flux conservation, and symmetry",,"Pacific J. Math. 274 (2015) 53-72","10.2140/pjm.2015.274.53",,"math.DG","http://arxiv.org/licenses/nonexclusive-distrib/1.0/","  As first noted in Korevaar, Kusner and Solomon (""KKS""), constant mean
curvature implies a homological conservation law for hypersurfaces in ambient
spaces with Killing fields.In Theorem 3.5 here, we generalize that law by
relaxing the topological restrictions assumed in [KKS] and by allowing a
weighted mean curvature functional. We also prove a partial converse (Theorem
4.1) which roughly says that when flux is conserved along a Killing field, a
hypersurface splits into two regions: one with constant (weighted) mean
curvature, and one preserved by the Killing field. We demonstrate our theory by
using it to derive a first integral for helicoidal surfaces of constant mean
curvature in Euclidean 3-space, i.e., ""twizzlers.""
","[{""version"":""v1"",""created"":""Wed, 13 Feb 2013 16:05:09 GMT""},{""version"":""v2"",""created"":""Wed, 26 Mar 2014 16:49:40 GMT""},{""version"":""v3"",""created"":""Wed, 20 Aug 2014 15:55:34 GMT""},{""version"":""v4"",""created"":""Fri, 22 Aug 2014 21:14:12 GMT""}]","2016-01-20"
"1302.3150","??(Guojun) ?(Yang)","Guojun Yang","On a Class of Two-Dimensional Douglas and Projectively Flat Finsler
  Metrics","18 pages",,,,"math.DG","http://arxiv.org/licenses/nonexclusive-distrib/1.0/","  In this paper, we study a class of two-dimensional Finsler metrics defined by
a Riemannian metric $\alpha$ and a 1-form $\beta$. We characterize those
metrics which are Douglasian or locally projectively flat by some equations. In
particular, it shows that the known fact that $\beta$ is always closed for
those metrics in higher dimensions is no longer true in two dimensional case.
Further, we determine the local structures of two-dimensional
$(\alpha,\beta)$-metrics which are Douglassian, and some families of examples
are given for projectively flat classes with $\beta$ being not closed.
","[{""version"":""v1"",""created"":""Wed, 13 Feb 2013 16:07:35 GMT""}]","2013-02-14"
"1302.3151","Bandaliyev Rovshan Alifaga","Ilgar G. Mamedov","Non-local combined problem","in Russian",,,,"math.AP","http://arxiv.org/licenses/nonexclusive-distrib/1.0/","  In this paper we consider a problem of with conditions of Bitsadze-Samarski
and the Samarski-Ionkin type for system of pseudoparabolic equations of
fourth-order with discontinuous coefficients.
","[{""version"":""v1"",""created"":""Wed, 13 Feb 2013 16:11:52 GMT""},{""version"":""v2"",""created"":""Fri, 22 Feb 2013 12:07:14 GMT""}]","2013-02-25"
"1302.3152","Christoph Zechner","Christoph Zechner, Michael Unger, Serge Pelet, Matthias Peter and
  Heinz Koeppl","Pooling single-cell recordings: Scalable inference through heterogeneous
  kinetics","9 pages, 5 figures, peer-reviewed/edited journal version available at
  Nature Methods:
  http://www.nature.com/nmeth/journal/vaop/ncurrent/abs/nmeth.2794.html",,"10.1038/nmeth.2794",,"q-bio.QM","http://arxiv.org/licenses/nonexclusive-distrib/1.0/","  Mathematical methods together with measurements of single-cell dynamics
provide unprecedented means to reconstruct intracellular processes that are
only partly or indirectly accessible experimentally. To obtain reliable
reconstructions the pooling of measurements from several cells of a clonal
population is mandatory. The population's considerable cell-to-cell variability
originating from diverse sources poses novel computational challenges for
process reconstruction. We introduce an exact Bayesian inference framework that
properly accounts for the population heterogeneity but also retains scalability
with respect to the number of pooled cells. The key ingredient is a stochastic
process that captures the heterogeneous kinetics of a population. The method
allows to infer inaccessible molecular states, kinetic parameters, compute
Bayes factors and to dissect intrinsic, extrinsic and technical contributions
to the variability in the data. We also show how additional single-cell
readouts such as morphological features can be included into the analysis. We
then reconstruct the expression dynamics of a gene under an inducible GAL1
promoter in yeast from time-lapse microscopy data. Based on Bayesian model
selection the data yields no evidence of a refractory period for this promoter.
","[{""version"":""v1"",""created"":""Wed, 13 Feb 2013 16:12:08 GMT""},{""version"":""v2"",""created"":""Mon, 13 Jan 2014 11:10:13 GMT""}]","2014-01-14"
"1302.3153","Francesco Piscitelli","Francesco Piscitelli and Patrick Van Esch","Analytical modeling of thin film neutron converters and its application
  to thermal neutron gas detectors",,"2013 JINST 8 P04020","10.1088/1748-0221/8/04/P04020",,"physics.ins-det nucl-ex","http://arxiv.org/licenses/nonexclusive-distrib/1.0/","  A simple model is explored mainly analytically to calculate and understand
the PHS of single and multi-layer thermal neutron detectors and to help
optimize the design in different circumstances. Several theorems are deduced
that can help guide the design.
","[{""version"":""v1"",""created"":""Wed, 13 Feb 2013 16:14:00 GMT""}]","2013-04-22"
"1302.3154","Anal\'ia Smith Castelli","Juan C. Forte, Favio R. Faifer, E. Irene Vega, Lilia P. Bassino,
  Analia V. Smith Castelli, Sergio A. Cellone, Douglas Geisler","Multicolour-metallicity Relations from Globular Clusters in NGC 4486
  (M87)","12 pages, 21 figures, 8 tables. Accepted to be published in MNRAS",,"10.1093/mnras/stt263",,"astro-ph.CO","http://arxiv.org/licenses/nonexclusive-distrib/1.0/","  We present Gemini griz photometry for 521 globular cluster (GC) candidates in
a 5.5 x 5.5 arcmin field centered 3.8 arcmin to the south and 0.9 arcmin to the
west of the center of the giant elliptical galaxy NGC 4486. All these objects
have previously published (C-T1) photometry. We also present new (C-T1)
photometry for 338 globulars, within 1.7 arcmin in galactocentric radius, which
have (g-z) colors in the photometric system adopted by the Virgo Cluster Survey
of the Advanced Camera for Surveys of the Hubble Space Telescope. These
photometric data are used to define a self-consistent multicolor grid (avoiding
polynomial fits) and preliminary calibrated in terms of two chemical abundance
scales. The resulting multicolor color-chemical abundance relations are used to
test GC chemical abundance distributions. This is accomplished by modelling the
ten GC color histograms that can be defined in terms of the Cgriz bands. Our
results suggest that the best fit to the GC observed color histograms is
consistent with a genuinely bimodal chemical abundance distribution NGC(Z). On
the other side, each (blue and red) GC subpopulation follows a distinct
color-color relation.
","[{""version"":""v1"",""created"":""Wed, 13 Feb 2013 16:24:36 GMT""}]","2015-06-15"
"1302.3155","Anirban Mukhopadhyay","Anirban Mukhopadhyay, Zhen Qian, Suchendra M. Bhandarkar, Tianming
  Liu, Sarah Rinehart, Szilard Voros","Morphological Analusis Of The Left Ventricular Eendocardial Surface
  Using A Bag-Of-Features Descriptor","Submitted to Medical Image Analysis",,,,"cs.CV","http://arxiv.org/licenses/nonexclusive-distrib/1.0/","  The limitations of conventional imaging techniques have hitherto precluded a
thorough and formal investigation of the complex morphology of the left
ventricular (LV) endocardial surface and its relation to the severity of
Coronary Artery Disease (CAD). Recent developments in high-resolution
Multirow-Detector Computed Tomography (MDCT) scanner technology have enabled
the imaging of LV endocardial surface morphology in a single heart beat.
Analysis of high-resolution Computed Tomography (CT) images from a 320-MDCT
scanner allows the study of the relationship between percent Diameter Stenosis
(DS) of the major coronary arteries and localization of the cardiac segments
affected by coronary arterial stenosis. In this paper a novel approach for the
analysis using a combination of rigid transformation-invariant shape
descriptors and a more generalized isometry-invariant Bag-of-Features (BoF)
descriptor, is proposed and implemented. The proposed approach is shown to be
successful in identifying, localizing and quantifying the incidence and extent
of CAD and thus, is seen to have a potentially significant clinical impact.
Specifically, the association between the incidence and extent of CAD,
determined via the percent DS measurements of the major coronary arteries, and
the alterations in the endocardial surface morphology is formally quantified. A
multivariate regression test performed on a strict leave-one-out basis are
shown to exhibit a distinct pattern in terms of the correlation coefficient
within the cardiac segments where the incidence of coronary arterial stenosis
is localized.
","[{""version"":""v1"",""created"":""Wed, 13 Feb 2013 16:25:19 GMT""}]","2013-02-14"
"1302.3156","??(Guojun) ?(Yang)","Zhongmin Shen and Guojun Yang","On Square Metrics of Scalar Flag Curvature","17 pages",,,,"math.DG","http://arxiv.org/licenses/nonexclusive-distrib/1.0/","  We consider a special class of Finsler metrics --- square metrics which are
defined by a Riemannian metric and a 1-form on a manifold. We show that an
analogue of the Beltrami Theorem in Riemannian geometry is still true for
square metrics in dimension $n\ge 3$, namely, an $n(\ge 3)$-dimensional square
metric is locally projectively flat if and only if it is of scalar flag
curvature. Further, we determine the local structure of such metrics and
classify closed manifolds with a square metric of scalar flag curvature in
dimension $n\ge 3$.
","[{""version"":""v1"",""created"":""Wed, 13 Feb 2013 16:27:47 GMT""}]","2013-02-14"
"1302.3157","Benjamin Wyser","Benjamin J. Wyser","Some conjectures regarding certain Schubert structure constants in Lie
  types B and D","The details of these conjectures were previously contained in
  arXiv:1209.0739, but were removed from that paper on the advice of a referee.
  This was due to the fairly large amount of overhead (with respect to notation
  and definitions) required to state the conjectures in their precise form. I
  have broken the details off into this note, in order to make them available
  to the interested reader",,,,"math.CO math.AG math.RT","http://arxiv.org/licenses/nonexclusive-distrib/1.0/","  I give the details of some conjectures regarding Schubert calculus in Lie
types B and D. Specifically, I conjecture rules for Schubert structure
constants $c_{u,v}^w$ when $X_{w_0u}^v$ is a Richardson variety stable under
the spherical Levi subgroup $\C^* \times SO(n-2,\C)$ of $SO(n,\C)$.
","[{""version"":""v1"",""created"":""Wed, 13 Feb 2013 16:28:07 GMT""}]","2013-02-14"
"1302.3158","Alexander Russell","Alexander J. B. Russell and Andrew N. Wright","Production of Small-Scale Alfv\'en Waves by Ionospheric Depletion,
  Nonlinear Magnetosphere-Ionosphere Coupling and Phase Mixing","Accepted for publication in JGR, 10 pages, 7 figures","J. Geophys. Res. Space Physics 118 (2013) 1-12","10.1002/jgra.50168",,"physics.space-ph","http://arxiv.org/licenses/nonexclusive-distrib/1.0/","  Rockets and satellites have previously observed small-scale Alfv\'en waves
inside large-scale downward field-aligned currents and numerical simulations
have associated their formation with self-consistent magnetosphere-ionosphere
coupling. The origin of these waves was previously attributed to ionospheric
feedback instability, however we show that they arise in numerical experiments
in which the instability is excluded. A new interpretation is proposed in which
strong ionospheric depletion and associated current broadening (a nonlinear
steepening/wavebreaking process) form magnetosphere-ionosphere waves inside a
downward current region and these oscillations drive upgoing inertial Alfv\'en
waves in the overlying plasma. The resulting waves are governed by
characteristic periods, which are a good match to previously observed periods
for reasonable assumed conditions. Meanwhile, wavelengths perpendicular to the
magnetic field initially map to an ionospheric scale comparable to the electron
inertial length for the low-altitude magnetosphere, but become shorter with
time due to frequency-based phase mixing of boundary waves (a new manifestation
of phase mixing). Under suitable conditions, these could act as seeds for the
ionospheric feedback instability.
","[{""version"":""v1"",""created"":""Wed, 13 Feb 2013 16:35:16 GMT""}]","2013-04-05"
"1302.3159","Simon \v{C}opar","Simon \v{C}opar and Mark R. Dennis and Randall D. Kamien and Slobodan
  \v{Z}umer","Singular Values, Nematic Disclinations, and Emergent Biaxiality","5 pages, 1 figure, submitted to PRL","Phys. Rev. E 87 (2013) 050504(R)","10.1103/PhysRevE.87.050504",,"cond-mat.soft","http://arxiv.org/licenses/nonexclusive-distrib/1.0/","  Both uniaxial and biaxial nematic liquid crystals are defined by
orientational ordering of their building blocks. While uniaxial nematics only
orient the long molecular axis, biaxial order implies local order along three
axes. As the natural degree of biaxiality and the associated frame, that can be
extracted from the tensorial description of the nematic order, vanishes in the
uniaxial phase, we extend the nematic director to a full biaxial frame by
making use of a singular value decomposition of the gradient of the director
field instead. New defects and degrees of freedom are unveiled and the
similarities and differences between the uniaxial and biaxial phase are
analyzed by applying the algebraic rules of the quaternion group to the
uniaxial phase.
","[{""version"":""v1"",""created"":""Wed, 13 Feb 2013 16:35:25 GMT""},{""version"":""v2"",""created"":""Thu, 14 Feb 2013 15:32:54 GMT""}]","2015-06-15"
"1302.3160","Xiuli Wang","Xiuli Wang","A New Construction of Multi-receiver Authentication Codes from
  Pseudo-Symplectic Geometry over Finite Fields","9 pages",,,,"cs.IT math.IT","http://arxiv.org/licenses/nonexclusive-distrib/1.0/","  Multi-receiver authentication codes allow one sender to construct an
authenticated message for a group of receivers such that each receiver can
verify authenticity of the received message. In this paper, we constructed one
multi-receiver authentication codes from pseudo-symplectic geometry over finite
fields. The parameters and the probabilities of deceptions of this codes are
also computed.
","[{""version"":""v1"",""created"":""Wed, 13 Feb 2013 16:40:02 GMT""},{""version"":""v2"",""created"":""Fri, 15 Feb 2013 03:26:01 GMT""},{""version"":""v3"",""created"":""Mon, 18 Feb 2013 05:43:44 GMT""}]","2013-02-19"
"1302.3161","Mo\""ira Hocevar","Mo\""ira Hocevar, Le Thuy Thanh Giang, Rudeesun Songmuang, Martien den
  Hertog, Lucien Besombes, Jo\""el Bleuse, Yann-Michel Niquet and Nikos T.
  Pelekanos","Residual strain and piezoelectric effects in passivated GaAs/AlGaAs
  core-shell nanowires",,,"10.1063/1.4803685",,"cond-mat.mtrl-sci cond-mat.mes-hall physics.optics","http://arxiv.org/licenses/nonexclusive-distrib/1.0/","  We observe a systematic red shift of the band-edge of passivated
GaAs/Al0.35Ga0.65As core-shell nanowires with increasing shell thickness up to
100 nm. The shift is detected both in emission and absorption experiments,
reaching values up to 14 meV for the thickest shell nanowires. Part of this red
shift is accounted for by the small tensile strain imposed to the GaAs core by
the AlGaAs shell, in line with theoretical calculations. An additional
contribution to this red shift arises from axial piezoelectric fields which
develop inside the nanowire core due to Al fluctuations in the shell.
","[{""version"":""v1"",""created"":""Wed, 13 Feb 2013 16:45:33 GMT""}]","2013-05-15"
"1302.3162","Peter Albers","Peter Albers, Urs Frauenfelder","Exponential decay for sc-gradient flow lines","15 pages, v2: example added, v3: minor changes","Journal of Fixed Point Theory and Applications, (2013), 571 - 586","10.1007/s11784-013-0126-3",,"math.SG math.FA","http://arxiv.org/licenses/nonexclusive-distrib/1.0/","  In this paper we introduce the notion of sc-action functionals and their
sc-gradient flow lines. Our approach is inspired by Floer's unregularized
gradient flow. The main result of this paper is that under a Morse condition
sc-gradient flow lines have uniform exponential decay towards critical points.
The ultimate goal for the future is to construct a M-polyfold bundle over a
M-polyfold such that the space of broken sc-gradient flow lines is the zero set
of a appropriate sc-section. Here uniform exponential decay is essential. Of
independent interest is that we derive exponential decay estimates using
interpolation inequalities as opposed to Sobolev inequalities. An advantage is
that interpolation inequalities are independent of the dimension of the source
space.
","[{""version"":""v1"",""created"":""Wed, 13 Feb 2013 16:51:06 GMT""},{""version"":""v2"",""created"":""Wed, 22 May 2013 12:40:00 GMT""},{""version"":""v3"",""created"":""Wed, 24 Jul 2013 08:36:53 GMT""}]","2013-11-05"
"1302.3163","Alexander Zubarev","D.B. Volov","Modified Klein-Gordon-Fock equations based on one-dimensional chaotic
  dynamics and groups with broken symmetry","8 pages",,,,"math-ph math.MP nlin.CD","http://arxiv.org/licenses/nonexclusive-distrib/1.0/","  Modified Klein-Gordon-Fock equations were obtained on the basis of
one-dimensional chaotic dynamics. The original Lagrangians were found. The
concepts of \textit{m}-exponential map and groups with broken symmetry are
introduced. A system of bitrial orthogonal functions is considered.
","[{""version"":""v1"",""created"":""Wed, 13 Feb 2013 16:54:37 GMT""}]","2013-02-14"
"1302.3164","Jan Winter","Jan Winter, Peter Z. Skands, Bryan R. Webber","Monte Carlo event generators & the top quark forward--backward asymmetry","6 pages, 10 figures, contribution to the proceedings of the HCP
  symposium 2012 in Kyoto, Japan",,"10.1051/epjconf/20134917001","Cavendish-HEP-13/03, CERN-PH-TH/2013-026, MPP-2013-31","hep-ph hep-ex","http://arxiv.org/licenses/nonexclusive-distrib/1.0/","  The leading-order accurate description of top quark pair production, as
usually employed in standard Monte Carlo event generators, gives no rise to the
generation of a forward--backward asymmetry. Yet, non-negligible --
differential as well as inclusive -- asymmetries may be produced if coherent
parton showering is used in the hadroproduction of top quark pairs. In this
contribution we summarize the outcome of our study of this effect. We present a
short comparison of different parton shower implementations and briefly comment
on the phenomenology of the colour coherence effect at the Tevatron.
","[{""version"":""v1"",""created"":""Wed, 13 Feb 2013 16:59:44 GMT""}]","2015-06-15"
"1302.3165","Marco Cominotti","Marco Cominotti and Iacopo Carusotto","Berry curvature effects in the Bloch oscillations of a quantum particle
  under a strong (synthetic) magnetic field","6 pages, 5 figures","Europhysics Letters 103 (2013) 10001","10.1209/0295-5075/103/10001",,"cond-mat.quant-gas","http://arxiv.org/licenses/nonexclusive-distrib/1.0/","  We study the magnetic Bloch oscillations performed by a quantum particle
moving in a two-dimensional lattice in the presence of a strong (synthetic)
magnetic field and a uniform force. An elementary derivation of the Berry
curvature effect on the semiclassical trajectory is given as well as an
explicit connection to the classical Hall effect in the continuum limit.
Perspectives to observe these effects in optical systems using synthetic gauge
fields for photons are discussed.
","[{""version"":""v1"",""created"":""Wed, 13 Feb 2013 17:03:55 GMT""},{""version"":""v2"",""created"":""Wed, 24 Jul 2013 09:14:32 GMT""}]","2013-07-25"
"1302.3166","Paul de Kerret","Paul de Kerret and David Gesbert","CSI Sharing Strategies for Transmitter Cooperation in Wireless Networks","Accepted for publication in IEEE Wireless Communications Magazine,
  Feb. 2013",,,,"cs.IT math.IT","http://arxiv.org/licenses/nonexclusive-distrib/1.0/","  Multiple-antenna ""based"" transmitter (TX) cooperation has been established as
a promising tool towards avoiding, aligning, or shaping the interference
resulting from aggressive spectral reuse. The price paid in the form of
feedback and exchanging channel state information (CSI) between cooperating
devices in most existing methods is often underestimated however. In reality,
feedback and information overhead threatens the practicality and scalability of
TX cooperation approaches in dense networks. Hereby we addresses a ""Who needs
to know what?"" problem, when it comes to CSI at cooperating transmitters. A
comprehensive answer to this question remains beyond our reach and the scope of
this paper. Nevertheless, recent results in this area suggest that CSI overhead
can be contained for even large networks provided the allocation of feedback to
TXs is made non-uniform and to properly depend on the network's topology. This
paper provides a few hints toward solving the problem.
","[{""version"":""v1"",""created"":""Wed, 13 Feb 2013 17:08:46 GMT""}]","2013-02-14"
"1302.3167","Cholhui Yun","Chol-Rim Min, Won-Hak Ri, Hyong-Chol O","Equiaffine Structure and Conjugate Ricci-symmetry of a Statistical
  Manifold","7 pages",,,"KISU-MATH-2013-E-R-002","math.DS cs.IT math-ph math.DG math.IT math.MP","http://arxiv.org/licenses/nonexclusive-distrib/1.0/","  A condition for a statistical manifold to have an equiaffine structure is
studied. The facts that dual flatness and conjugate symmetry of a statistical
manifold are sufficient conditions for a statistical manifold to have an
equiaffine structure were obtained in [2] and [3]. In this paper, a fact that a
statistical manifold, which is conjugate Ricci-symmetric, has an equiaffine
structure is given, where conjugate Ricci-symmetry is weaker condition than
conjugate symmetry. A condition for conjugate symmetry and conjugate
Ricci-symmetry to coincide is also given.
","[{""version"":""v1"",""created"":""Wed, 13 Feb 2013 17:09:38 GMT""}]","2013-03-22"
