"1302.3225","Natalia Toro","Philip Schuster and Natalia Toro","A Gauge Field Theory of Continuous-Spin Particles","35 pages, 1 figure version published in JHEP -- introductory
  discussion of tensor fields for continuous-spin removed, some typos removed
  and a few clarifying remarks added","JHEP 1310 (2013) 061","10.1007/JHEP10(2013)061","pi-partphys-317","hep-th hep-ph","http://arxiv.org/licenses/nonexclusive-distrib/1.0/","  We propose and quantize a local, covariant gauge-field action that unifies
the description of all free helicity and continuous-spin degrees of freedom in
a simple manner. This is the first field-theory action of any kind for
continuous spin particles; it is consistent as a quantum theory and generalizes
to any number of dimensions. The fields live on the null cone of an internal
four-vector ""spin-space""; in D dimensions a linearized gauge invariance reduces
their physical content to a single function on a Euclidean (D-2)-plane, on
which the little group E(D-2) acts naturally. A projective version of the
action further reduces the physical content to S^{D-3}, enabling a new local
description of particles with any spin structure, and in particular a tower of
all integer-helicity particles for D=4. Gauge-invariant interactions with a
background current are added in a straightforward manner.
","[{""version"":""v1"",""created"":""Wed, 13 Feb 2013 21:00:02 GMT""},{""version"":""v2"",""created"":""Fri, 1 Nov 2013 23:42:53 GMT""}]","2013-11-05"
"1302.3226","T. Padmanabhan","Hamsa Padmanabhan, T. Padmanabhan","CosMIn: The Solution to the Cosmological Constant Problem","ver 2 (6 pages, 2 figures) received Honorable Mention in the Gravity
  Research Foundation Essay Contest, 2013; to appear in Int.Jour.Mod.Phys. D",,"10.1142/S0218271813420017",,"astro-ph.CO gr-qc hep-th","http://arxiv.org/licenses/nonexclusive-distrib/1.0/","  The current acceleration of the universe can be modeled in terms of a
cosmological constant. We show that the extremely small value of \Lambda L_P^2
~ 3.4 x 10^{-122}, the holy grail of theoretical physics, can be understood in
terms of a new, dimensionless, conserved number CosMIn (N), which counts the
number of modes crossing the Hubble radius during the three phases of evolution
of the universe. Theoretical considerations suggest that N ~ 4\pi. This single
postulate leads us to the correct, observed numerical value of the cosmological
constant! This approach also provides a unified picture of cosmic evolution
relating the early inflationary phase to the late-time accelerating phase.
","[{""version"":""v1"",""created"":""Wed, 13 Feb 2013 21:00:05 GMT""},{""version"":""v2"",""created"":""Wed, 10 Jul 2013 12:22:21 GMT""}]","2015-06-15"
"1302.3227","Yuan Luo","Yuan Luo, Meng-Chwan Tan","A Topological Chern-Simons Sigma Model and New Invariants of
  Three-Manifolds","45 pages. Further clarifications. To appear in JHEP","JHEP02(2014)067","10.1007/JHEP02(2014)067",,"hep-th math.GT math.QA","http://arxiv.org/licenses/nonexclusive-distrib/1.0/","  We construct a topological Chern-Simons sigma model on a Riemannian
three-manifold M with gauge group G whose hyperkahler target space X is
equipped with a G-action. Via a perturbative computation of its partition
function, we obtain new topological invariants of M that define new weight
systems which are characterized by both Lie algebra structure and hyperkahler
geometry. In canonically quantizing the sigma model, we find that the partition
function on certain M can be expressed in terms of Chern-Simons knot invariants
of M and the intersection number of certain G-equivariant cycles in the moduli
space of G-covariant maps from M to X. We also construct supersymmetric Wilson
loop operators, and via a perturbative computation of their expectation value,
we obtain new knot invariants of M that define new knot weight systems which
are also characterized by both Lie algebra structure and hyperkahler geometry.
","[{""version"":""v1"",""created"":""Wed, 13 Feb 2013 21:00:05 GMT""},{""version"":""v2"",""created"":""Thu, 23 Jan 2014 00:59:41 GMT""}]","2014-02-21"
"1302.3228","Michael Strickland","Najmul Haque, Munshi G. Mustafa, and Michael Strickland","Quark Number Susceptibilities from Two-Loop Hard Thermal Loop
  Perturbation Theory","14 pages, 2 figures; v3 - version accepted for publication in JHEP","Journal of High Energy Physics 07 (2013) 184","10.1007/JHEP07(2013)184",,"hep-ph nucl-th","http://arxiv.org/licenses/nonexclusive-distrib/1.0/","  We use the recently obtained two-loop hard thermal loop perturbation theory
thermodynamics functions of a plasma of quarks and gluons to compute the
diagonal second- and fourth-order quark number susceptibilities. The two-loop
hard thermal loop perturbation theory thermodynamic functions used are reliable
in the limit that the ratio of the quark chemical potential to temperature is
small. Using this result, we are able to obtain (semi-)analytic expressions for
the quark number susceptibilities at leading- and next-to-leading-order in hard
thermal loop perturbation theory. We compare the hard thermal loop perturbation
theory results with perturbative quantum chromodynamics calculations, a
Polyakov-loop Nambu-Jona-Lasinio model calculation, and lattice quantum
chromodynamics results.
","[{""version"":""v1"",""created"":""Wed, 13 Feb 2013 21:00:11 GMT""},{""version"":""v2"",""created"":""Sun, 24 Feb 2013 18:50:11 GMT""},{""version"":""v3"",""created"":""Tue, 25 Jun 2013 16:52:05 GMT""}]","2013-08-07"
"1302.3229","Yonit Hochberg","Avital Dery, Aielet Efrati, Yonit Hochberg and Yosef Nir","What if BR(h-->\mu\mu)/BR(h-->\tau\tau) does not equal m_\mu^2/m_\tau^2?","14 pages. v2: Minor corrections to Table 1 and Section 7; matches
  published version","JHEP 1305 (2013) 039","10.1007/JHEP05(2013)039",,"hep-ph","http://arxiv.org/licenses/nonexclusive-distrib/1.0/","  Measurements of the Yukawa couplings of the recently discovered boson h to
fermion pairs will provide a new arena for studying flavor physics. We analyze
the lessons that can be learned by measuring the h decay rates into the charged
lepton pairs, \tau\tau, \mu\mu, and \tau\mu. We demonstrate how this set of
measurements can distinguish in principle between various classes of flavor
models such as natural flavor conservation, minimal flavor violation, and
Froggatt-Nielsen symmetry.
","[{""version"":""v1"",""created"":""Wed, 13 Feb 2013 21:00:11 GMT""},{""version"":""v2"",""created"":""Wed, 19 Jun 2013 09:35:44 GMT""}]","2015-06-15"
"1302.3230","Alessia Garofalo","Alessia Garofalo, Felice Cusano, Gisella Clementini, Vincenzo Ripepi,
  Massimo Dall'Ora, Maria Ida Moretti, Giuseppina Coppola, Ilaria Musella,
  Marcella Marconi","Variable stars in the ultra-faint dwarf spheroidal galaxy Ursa Major I","Accepted for publication in ApJ",,"10.1088/0004-637X/767/1/62",,"astro-ph.GA astro-ph.CO","http://arxiv.org/licenses/nonexclusive-distrib/1.0/","  We have performed the first study of the variable star population of Ursa
Major I (UMa I), an ultra-faint dwarf satellite recently discovered around the
Milky Way by the Sloan Digital Sky Survey. Combining time series observations
in the B and V bands from four different telescopes, we have identified seven
RR Lyrae stars in UMa I, of which five are fundamental-mode (RRab) and two are
first-overtone pulsators (RRc). Our V, B-V color-magnitude diagram of UMa I
reaches V~23 mag (at a signal-to-noise ratio of ~ 6) and shows features typical
of a single old stellar population. The mean pulsation period of the RRab stars
<Pab> = 0.628, {\sigma} = 0.071 days (or <Pab> = 0.599, {\sigma} = 0.032 days,
if V4, the longest period and brightest variable, is discarded) and the
position on the period-amplitude diagram suggest an Oosterhoff-intermediate
classification for the galaxy. The RR Lyrae stars trace the galaxy horizontal
branch at an average apparent magnitude of <V(RR)> = 20.43 +/- 0.02 mag
(average on 6 stars and discarding V4), giving in turn a distance modulus for
UMa I of (m-M)0 = 19.94 +/- 0.13 mag, distance d= 97.3 +6.0/-5.7 kpc, in the
scale where the distance modulus of the Large Magellanic Cloud is 18.5 +/- 0.1
mag. Isodensity contours of UMa I red giants and horizontal branch stars
(including the RR Lyrae stars identified in this study) show that the galaxy
has an S-shaped structure, which is likely caused by the tidal interaction with
the Milky Way. Photometric metallicities were derived for six of the UMa I RR
Lyrae stars from the parameters of the Fourier decomposition of the V-band
light curves, leading to an average metal abundance of [Fe/H] = -2.29 dex
({\sigma} = 0.06 dex, average on 6 stars) on the Carretta et al. metallicity
scale.
","[{""version"":""v1"",""created"":""Wed, 13 Feb 2013 21:01:05 GMT""}]","2015-06-15"
"1302.3231","Kuver Sinha","Bhaskar Dutta, Teruki Kamon, Nikolay Kolev, Kuver Sinha, Kechen Wang,
  Sean Wu","Top Squark Searches Using Dilepton Invariant Mass Distributions and
  Bino-Higgsino Dark Matter at the LHC","6 pages, 3 figures. Version accepted in Phys. Rev. D",,"10.1103/PhysRevD.87.095007",,"hep-ph","http://arxiv.org/licenses/nonexclusive-distrib/1.0/","  Pair production of light top squarks at the 8-TeV LHC can be used to probe
the gaugino-Higgsino sector of the Minimal Supersymmetric Standard Model. The
case where the lightest neutralino is a mixture of Bino and Higgsino,
satisfying the thermal dark matter relic density, is investigated. In such a
scenario, the lightest top squark decays mostly into $(i)$ a top quark plus the
second or third lightest neutralino, and $(ii)$ a bottom quark plus the
lightest chargino, instead of a decay scenario of the lightest top squark into
a top quark and the lightest neutralino. Final states with $\geq 2$ jets,
dileptons, and missing energy are expected in a subsequent decay of the second
or third lightest neutralinos into the lightest neutralino via an intermediate
slepton (""light sleptons"" case) or $Z$ boson (""heavy sleptons"" case). The
opposite-sign same flavor dilepton mass distribution after subtracting the
opposite-sign different flavor distribution shows a clear edge in the case of
light sleptons. The significance for discovering such a scenario is calculated
with optimized cuts in both light and heavy sleptons cases.
","[{""version"":""v1"",""created"":""Wed, 13 Feb 2013 21:01:07 GMT""},{""version"":""v2"",""created"":""Thu, 2 May 2013 19:17:01 GMT""}]","2013-05-15"
"1302.3232","Hideki Maeda","Fabrizio Canfora and Hideki Maeda","Hedgehog ansatz and its generalization for self-gravitating Skyrmions","11 pages; v2, style changed, critical typos corrected, Taub-NUT- and
  Eguchi-Hanson-type solutions added, published in Physical Review D","Phys. Rev. D 87, 084049 (2013)","10.1103/PhysRevD.87.084049","CECS-PHY-13/02","gr-qc hep-th","http://arxiv.org/licenses/nonexclusive-distrib/1.0/","  The hedgehog ansatz for spherically symmetric spacetimes in self-gravitating
nonlinear sigma models and Skyrme models is revisited and its generalization
for non-spherically symmetric spacetimes is proposed. The key idea behind our
construction is that, even if the matter fields depend on the Killing
coordinates in a nontrivial way, the corresponding energy-momentum tensor can
still be compatible with spacetime symmetries. Our generalized hedgehog ansatz
reduces the Skyrme equations to coupled differential equations for two scalar
fields together with several constraint equations between them. Some particular
field configurations satisfying those constraints are presented in several
physically important spacetimes, including stationary and axisymmetric
spacetimes. Incidentally, several new exact solutions are obtained under the
standard hedgehog ansatz, one of which represents a global monopole inside a
black hole with the Skyrme effect.
","[{""version"":""v1"",""created"":""Wed, 13 Feb 2013 21:03:00 GMT""},{""version"":""v2"",""created"":""Mon, 22 Apr 2013 04:21:02 GMT""}]","2013-04-24"
"1302.3233","Hans Moritz G\""unther","H. M. G\""unther and P. C. Schneider and Z.-Y. Li","The evolution of the jet from Herbig Ae star HD 163296 from 1999 to 2011","14 pages, 8 figures, accepted by A&A",,"10.1051/0004-6361/201220772",,"astro-ph.SR","http://arxiv.org/licenses/nonexclusive-distrib/1.0/","  Young A and B stars, the so-called Herbig Ae/Be stars (HAeBe), are surrounded
by an active accretion disk and drive outflows. We study the jet HH 409, which
is launched from the HAeBe star HD 163296, using new and archival observations
from Chandra and HST/STIS. In X-rays we can show that the central source is not
significantly extended. The approaching jet, but not the counter-jet, is
detected in Ly alpha. In addition, there is red-shifted Ly alpha emission
extended in the same direction as the jet, that is also absent in the
counter-jet. We can rule out an accretion or disk-wind origin for this feature.
In the optical we find the knots B and B2 in the counter-jet. Knot B has been
observed previously, so we can derive its proper motion of 0.37+-0.01
arcsec/yr. Its electron density is 3000/cm^3, thus the cooling time scale is a
few months only, so the knot needs to be reheated continuously. The shock speed
derived from models of H alpha and forbidden emission lines (FELs) decreased
from 50 km/s in 1999 to 30 km/s in 2011 because the shock front loses energy as
it travels along the jet. Knot B2 is observed at a similar position in 2011 as
knot B was in 1999, but shows a lower ionization fraction and higher mass loss
rate, proving variations in the jet launching conditions.
","[{""version"":""v1"",""created"":""Wed, 13 Feb 2013 21:04:55 GMT""}]","2015-06-15"
"1302.3234","Peter Thomas Setsuda DeVore","Peter T. S. DeVore, David Borlaug, and Bahram Jalali","Enhancing the Electrooptic Effect Using Modulation Instability","5 page, 4 figures; Submitted for publication January 22, 2013",,,,"physics.optics","http://arxiv.org/licenses/nonexclusive-distrib/1.0/","  As electronic operating frequencies increase toward the terahertz regime, new
electrooptic modulators capable of low-voltage high-frequency operation must be
developed to provide the necessary optical interconnects. This letter presents
a new concept that exploits modulation instability to enhance the intrinsically
weak electrooptic effect, \chi^(2). Simulations demonstrate more than 50 times
enhancement of electrooptic effect at millimeter wave frequencies leading to a
substantial reduction in the required modulation voltage.
","[{""version"":""v1"",""created"":""Wed, 13 Feb 2013 21:05:12 GMT""}]","2013-02-15"
"1302.3235","Mircea Birsan","Patrizio Neff and Yuji Nakatsukasa and Andreas Fischle","A logarithmic minimization property of the unitary polar factor in the
  spectral norm and the Frobenius matrix norm","32 pages",,,,"math.CA","http://arxiv.org/licenses/nonexclusive-distrib/1.0/","  The unitary polar factor $Q=U$ in the polar decomposition of the matrix
$Z=UH$ is the minimizer for both $\| \mathrm{Log}(Q^* Z)\|^2$ and its Hermitian
part $\| \mathrm{sym Log}(Q^* Z)\|^2$ over both $\mathbb{R}$ and $\mathbb{C}$,
for any given invertible matrix $Z$ in $\mathbb{C}^{n\times n}$ and any matrix
logarithm $\mathrm{Log}$, not necessarily the principal logarithm
$\mathrm{log}$. We prove this for the spectral matrix norm in any dimension and
for the Frobenius matrix norm in two and three dimensions. The result shows
that the unitary polar factor is the nearest orthogonal matrix to $Z$ not only
in the normwise sense, but also in a geodesic distance. The derivation is based
on Bhatia's generalization of Bernstein's trace inequality for the matrix
exponential and a new sum of squared logarithms inequality.
","[{""version"":""v1"",""created"":""Wed, 13 Feb 2013 21:07:58 GMT""},{""version"":""v2"",""created"":""Mon, 18 Feb 2013 17:24:22 GMT""},{""version"":""v3"",""created"":""Mon, 30 Dec 2013 10:30:15 GMT""},{""version"":""v4"",""created"":""Thu, 2 Jan 2014 10:59:59 GMT""}]","2014-01-03"
"1302.3236","Elmar Schrohe","Lidia Maniccia and Elmar Schrohe and Joerg Seiler","Determinants of Classical SG-Pseudodifferential Operators","Slightly revised; accepted for publication in Math. Nachrichten","Math. Nachr. 287 (2014), no. 7, 782-802","10.1002/mana.201300040",,"math.AP math.FA","http://arxiv.org/licenses/nonexclusive-distrib/1.0/","  We introduce a generalized trace functional TR in the spirit of Kontsevich
and Vishik's canonical trace for classical SG-pseudodifferential operators on
R^n and suitable manifolds, using a finite-part integral regularization
technique. This allows us to define a zeta-regularized determinant det A for
classical parameter-elliptic SG-operators A of order (\mu,m), with \mu>0,
m\ge0. For m=0, the asymptotics of TR exp(-tA) as t\to 0 and of TR
(\lambda-A)^{-k}$ as |\lambda|\to\infty are derived. For suitable pairs (A,A_0)
we show that det A/det A_0 coincides with the so-called relative determinant
det(A,A_0).
","[{""version"":""v1"",""created"":""Wed, 13 Feb 2013 21:08:46 GMT""},{""version"":""v2"",""created"":""Thu, 18 Jul 2013 18:12:52 GMT""}]","2020-04-17"
"1302.3237","Anatoly Latyshev","A. V. Latyshev and A. A. Yushkanov","Transverse electric conductivity and dielectric permeability in quantum
  degenerate collisional plasma with variable collision frequency in Mermin's
  approach","22 pages, 8 figures",,,,"physics.plasm-ph","http://arxiv.org/licenses/nonexclusive-distrib/1.0/","  Formulas for transverse conductance and dielectric permeability in quantum
degenerate collisional plasma with arbitrary variable collision frequency in
Mermin's approach are deduced. Frequency of collisions of particles depends
arbitrarily on a wave vector. For this purpose the kinetic Shr\""{o}dinger -
Boltzmann equation with collision integral of relaxation type in momentum space
is applied. The case of degenerate Fermi plasma is allocated and investigated.
The special case of frequency of collisions proportional to the module of a
wave vector is considered. The graphic analysis of the real and imaginary parts
of dielectric function is made.
","[{""version"":""v1"",""created"":""Wed, 13 Feb 2013 21:09:15 GMT""}]","2013-02-15"
"1302.3238","Abram Kagan","Abram M. Kagan, Tinghui Yu, Andrew Barron, Mokshay Madiman","Contribution to the theory of Pitman estimators",,"Zapiski Nauchnykh Seminarov POMI, Special issue in honour of I. A.
  Ibragimov's 80th birthday, Vol. 408, pp. 245-267, 2012",,,"math.ST stat.TH","http://arxiv.org/licenses/nonexclusive-distrib/1.0/","  New inequalities are proved for the variance of the Pitman estimators
(minimum variance equivariant estimators) of \theta constructed from samples of
fixed size from populations F(x-\theta). The inequalities are closely related
to the classical Stam inequality for the Fisher information, its analog in
small samples, and a powerful variance drop inequality. The only condition
required is finite variance of F; even the absolute continuity of F is not
assumed. As corollaries of the main inequalities for small samples, one obtains
alternate proofs of known properties of the Fisher information, as well as
interesting new observations like the fact that the variance of the Pitman
estimator based on a sample of size n scaled by n monotonically decreases in n.
Extensions of the results to the polynomial versions of the Pitman estimators
and a multivariate location parameter are given. Also, the search for
characterization of equality conditions for one of the inequalities leads to a
Cauchy-type functional equation for independent random variables, and an
interesting new behavior of its solutions is described.
","[{""version"":""v1"",""created"":""Wed, 13 Feb 2013 21:09:17 GMT""}]","2013-07-11"
"1302.3239","Zhaohuan Zhu","Zhaohuan Zhu, James M. Stone, and Roman R. Rafikov","Low mass planets in protoplanetary disks with net vertical magnetic
  fields: the Planetary Wake and Gap Opening","Accepted by ApJ, 23 pages, 13 figures. Movie at
  http://www.astro.princeton.edu/~zhzhu/Site/Movies5.html",,"10.1088/0004-637X/768/2/143",,"astro-ph.SR astro-ph.EP","http://arxiv.org/licenses/nonexclusive-distrib/1.0/","  We study wakes and gap opening by low mass planets in gaseous protoplanetary
disks threaded by net vertical magnetic fields which drive
magnetohydrodynamical (MHD) turbulence through the magnetorotational instabilty
(MRI), using three dimensional simulations in the unstratified local shearing
box approximation. The wakes, which are excited by the planets, are damped by
shocks similar to the wake damping in inviscid hydrodynamic (HD) disks. Angular
momentum deposition by shock damping opens gaps in both MHD turbulent disks and
inviscid HD disks even for low mass planets, in contradiction to the ""thermal
criterion"" for gap opening. To test the ""viscous criterion"", we compared gap
properties in MRI-turbulent disks to those in viscous HD disks having the same
stress, and found that the same mass planet opens a significantly deeper and
wider gap in net vertical flux MHD disks than in viscous HD disks. This
difference arises due to the efficient magnetic field transport into the gap
region in MRI disks, leading to a larger effective \alpha within the gap. Thus,
across the gap, the Maxwell stress profile is smoother than the gap density
profile, and a deeper gap is needed for the Maxwell stress gradient to balance
the planetary torque density. We also confirmed the large excess torque close
to the planet in MHD disks, and found that long-lived density features (termed
zonal flows) produced by the MRI can affect planet migration. The comparison
with previous results from net toroidal flux/zero flux MHD simulations
indicates that the magnetic field geometry plays an important role in the gap
opening process. Overall, our results suggest that gaps can be commonly
produced by low mass planets in realistic protoplanetary disks, and caution the
use of a constant \alpha-viscosity to model gaps in protoplanetary disks.
","[{""version"":""v1"",""created"":""Wed, 13 Feb 2013 21:10:00 GMT""}]","2015-06-15"
"1302.3240","Andrew J. Landahl","Andrew J. Landahl and Chris Cesare","Complex instruction set computing architecture for performing accurate
  quantum $Z$ rotations with less magic","13 pages, 4 figures. Resource metric now non-Clifford states.
  Comparison now to Meier-Eastin-Knill distillation and (optimal) Selinger
  compiling. Minor tweaks made to concatenated teleportation analysis",,,,"quant-ph","http://arxiv.org/licenses/nonexclusive-distrib/1.0/","  We present quantum protocols for executing arbitrarily accurate $\pi/2^k$
rotations of a qubit about its $Z$ axis. Reduced instruction set computing
(\textsc{risc}) architectures typically restrict the instruction set to
stabilizer operations and a single non-stabilizer operation, such as
preparation of a ""magic"" state from which $T = Z(\pi/4)$ gates can be
teleported. Although the overhead required to distill high-fidelity copies of
this magic state is high, the subsequent quantum compiling overhead to realize
$Z$ rotations in a \textsc{risc} architecture can be much greater. We develop a
complex instruction set computing (\textsc{cisc}) architecture whose
instruction set includes stabilizer operations and preparation of magic states
from which $Z(\pi/2^k)$ gates can be teleported, for $2 \leq k \leq
k_{\text{max}}$. This results in a substantial overall reduction in the number
of gates required to achieve a desired gate accuracy for $Z$ rotations. The key
to our construction is a family of shortened quantum Reed-Muller codes of
length $2^{k+2}-1$, whose magic-state distillation threshold shrinks with $k$
but is greater than 0.85% for $k \leq 6$.
","[{""version"":""v1"",""created"":""Wed, 13 Feb 2013 21:11:48 GMT""},{""version"":""v2"",""created"":""Tue, 15 Oct 2013 06:33:36 GMT""}]","2013-10-16"
"1302.3241","Evgeny Epelbaum","Evgeny Epelbaum","Nuclear Physics with Chiral Effective Field Theory: State of the Art and
  Open Challenges","15 pages, 7 figures",,,,"nucl-th hep-ph","http://arxiv.org/licenses/nonexclusive-distrib/1.0/","  Understanding the properties of atomic nuclei and nuclear dynamics from QCD
remains a major challenge. Complementary to first attempts along these lines
based on lattice QCD, an effective field theory approach has been developed in
the past two decades and applied to a variety of nuclear bound states and
reactions. I outline the foundations of this method, review selected
applications and address some open challenges in this field.
","[{""version"":""v1"",""created"":""Wed, 13 Feb 2013 21:12:38 GMT""}]","2013-02-15"
