"1302.3357","Pavel A. Andreev","Pavel A. Andreev","Non-integral form of the Gross-Pitaevskii equation for polarized
  molecules","7 pages. arXiv admin note: text overlap with arXiv:1107.2029","Modern Physics Letters B, Volume 27, Issue 13, id. 1350096 (2013)","10.1142/S0217984913500966",,"cond-mat.quant-gas","http://arxiv.org/licenses/nonexclusive-distrib/1.0/","  The Gross-Pitaevskii equation for polarized molecules is an
integro-differential equation, consequently it is complicated for solving. We
find a possibility to represent it as a non-integral nonlinear Schrodinger
equation, but this equation should be coupled with two linear equations
describing electric field. These two equations are the Maxwell equations. We
recapture the dispersion of collective excitations in the three dimensional
electrically polarized BEC with no evolution of the electric dipole moment
directions. We trace the contribution of the electric dipole moment. We
explicitly consider the contribution of the electric dipole moment in the
interaction constant for the short-range interaction. We show that the spectrum
of dipolar BEC reveals no instability at repulsive short-range interaction.
Nonlinear excitations are also considered. We present dependence of the bright
soliton characteristics on the electric dipole moment.
","[{""version"":""v1"",""created"":""Thu, 14 Feb 2013 10:26:44 GMT""},{""version"":""v2"",""created"":""Fri, 29 Mar 2013 11:43:29 GMT""}]","2015-06-15"
"1302.3358","Philippe Goldner","Marko Lovri\'c, Alban Ferrier, Dieter Suter and Philippe Goldner","Faithful Solid State Optical Memory with Dynamically Decoupled Spin Wave
  Storage","5 pages, 4 figures",,"10.1103/PhysRevLett.111.020503",,"quant-ph","http://arxiv.org/licenses/nonexclusive-distrib/1.0/","  We report an optical memory in a rare earth doped crystal with long storage
times, up to 20 ms, together with an optical bandwidth of 1.5 MHz. This is
obtained by transferring optical coherences to nuclear spin coherences, which
were then protected against environmental noise by dynamical decoupling. With
this approach, we achieved a 33 fold increase in spin wave storage time over
the intrinsic spin coherence lifetime. Comparison between different decoupling
sequences indicates that sequences insensitive to initial spin coherence
increase retrieval efficiency. Finally, an interference experiment shows that
relative phases of input pulses are preserved through the whole storage process
with a visibility close to 1, demonstrating the usefulness of dynamical
decoupling for extending the storage time of quantum memories.
","[{""version"":""v1"",""created"":""Thu, 14 Feb 2013 10:27:09 GMT""}]","2016-07-14"
"1302.3359","Christophe De Beule","Christophe De Beule and Bart Partoens","Gapless interface states at the junction between two topological
  insulators",,,"10.1103/PhysRevB.87.115113",,"cond-mat.mes-hall","http://arxiv.org/licenses/nonexclusive-distrib/1.0/","  We consider a junction between two topological insulators, and calculate the
properties of the interface states with an effective low energy Hamiltonian for
topological insulators with a single cone on the surface. This system bears a
close resemblance to bilayer graphene, as both result from the hybridization of
Dirac cones. We find gapless interface states not only when the helicity
direction of the topological surface states are oppositely oriented, but they
can also exist if they are equally oriented. Furthermore, we find that the
existence of the interface states can be understood from the closing of the
bulk gap when the helicity changes orientation. Recently, superluminal
tachyonic excitations were also claimed to exist at the interface between
topological insulators. However, here we show that these interface states do
not exist.
","[{""version"":""v1"",""created"":""Thu, 14 Feb 2013 10:29:41 GMT""}]","2013-03-14"
"1302.3360","HongVan Le","H\^ong V\^an L\^e","Lower bounds for the circuit size of partially homogeneous polynomials","25 pages, final version, accepted to Journal of Fundamental and
  Applied Mathematics. Some missing definitions and coefficients in the last
  version have been added and corrected now","Journal of Mathematical Sciences, 225(2017), 639-647 (translated
  from Journal of Fundamental and Applied Mathematics 20 (2015), 153-179)","10.1007/s10958-017-3483-4",,"cs.CC math.AC math.LO","http://arxiv.org/licenses/nonexclusive-distrib/1.0/","  In this paper we associate to each multivariate polynomial $f$ that is
homogeneous relative to a subset of its variables a series of polynomial
families $P_\lambda (f)$ of $m$-tuples of homogeneous polynomials of equal
degree such that the circuit size of any member in $P_\lambda (f)$ is bounded
from above by the circuit size of $f$. This provides a method for obtaining
lower bounds for the circuit size of $f$ by proving $(s,r)$-(weak) elusiveness
of the polynomial mapping associated with $P_\lambda (f)$. We discuss some
algebraic methods for proving the $(s,r)$-(weak) elusiveness. We also improve
estimates in the normal homogeneous-form of an arithmetic circuit obtained by
Raz in \cite{Raz2009} which results in better lower bounds for circuit size
(Lemma \ref{lem:cor38}, Remark \ref{rem:cor38}).
  Our methods yield non-trivial lower bound for the circuit size of several
classes of multivariate homogeneous polynomials (Corollary \ref{cor:412},
Example \ref{ex:bi}).
","[{""version"":""v1"",""created"":""Thu, 14 Feb 2013 10:37:50 GMT""},{""version"":""v2"",""created"":""Fri, 3 May 2013 14:27:13 GMT""},{""version"":""v3"",""created"":""Mon, 22 Jul 2013 10:03:40 GMT""},{""version"":""v4"",""created"":""Thu, 10 Jul 2014 17:54:33 GMT""},{""version"":""v5"",""created"":""Sun, 28 Sep 2014 22:15:04 GMT""},{""version"":""v6"",""created"":""Mon, 16 Mar 2015 21:56:54 GMT""}]","2017-08-03"
"1302.3361","Nadezhda Kurazhkovskaya","A. Yu. Kurazhkovskii, N. A. Kurazhkovskaya, B.I. Klain","Variations of paleointensity in the Paleogene","13 pages, 6 figures",,"10.1016/j.pepi.2014.01.007",,"physics.geo-ph","http://arxiv.org/licenses/nonexclusive-distrib/1.0/","  Behavior of the geomagnetic field intensity in the Paleogene from sedimentary
rocks of the Russian Plate was investigated. It is revealed that in the
beginning of the Paleogene alternating of paleointensity variations of little
amplitude (about 0.5 Ho, where Ho is the value of modern geomagnetic field
taken as 40 mkT) and bursts of large amplitude (up to 5 Ho) took place. At the
end of the Paleogene paleointensity variations occur only with a little
amplitude.
","[{""version"":""v1"",""created"":""Thu, 14 Feb 2013 10:41:41 GMT""}]","2015-06-15"
"1302.3362","Thomas Niehaus","A. Dom\'inguez, B. Aradi, T. Frauenheim, V. Lutsker and T. A. Niehaus","Extensions of the time-dependent density functional based tight-binding
  approach",,,,,"cond-mat.mtrl-sci physics.chem-ph","http://arxiv.org/licenses/nonexclusive-distrib/1.0/","  The time-dependent density functional based tight-binding (TD-DFTB) approach
is generalized to account for fractional occupations. In addition, an on-site
correction leads to marked qualitative and quantitative improvements over the
original method. Especially, the known failure of TD-DFTB for the description
of \sigma -> \pi* and n -> \pi* excitations is overcome. Benchmark calculations
on a large set of organic molecules also indicate a better description of
triplet states. The accuracy of the revised TD-DFTB method is found to be
similar to first principles TD-DFT calculations at a highly reduced
computational cost. As a side issue, we also discuss the generalization of the
TD-DFTB method to spin-polarized systems. In contrast to an earlier study
[Trani et al., JCTC 7 3304 (2011)], we obtain a formalism that is fully
consistent with the use of local exchange-correlation functionals in the ground
state DFTB method.
","[{""version"":""v1"",""created"":""Thu, 14 Feb 2013 10:42:26 GMT""}]","2013-02-15"
"1302.3363","Lo\""ic Paulev\'e","Lo\""ic Paulev\'e, Gheorghe Craciun, Heinz Koeppl","Dynamical Properties of Discrete Reaction Networks",,,"10.1007/s00285-013-0686-2",,"cs.DM math.DS","http://arxiv.org/licenses/nonexclusive-distrib/1.0/","  Reaction networks are commonly used to model the evolution of populations of
species subject to transformations following an imposed stoichiometry. This
paper focuses on the efficient characterisation of dynamical properties of
Discrete Reaction Networks (DRNs). DRNs can be seen as modelling the underlying
discrete nondeterministic transitions of stochastic models of reactions
networks. In that sense, any proof of non-reachability in DRNs directly applies
to any concrete stochastic models, independently of kinetics laws and
constants. Moreover, if stochastic kinetic rates never vanish, reachability
properties are equivalent in the two settings. The analysis of two global
dynamical properties of DRNs is addressed: irreducibility, i.e., the ability to
reach any discrete state from any other state; and recurrence, i.e., the
ability to return to any initial state. Our results consider both the
verification of such properties when species are present in a large copy
number, and in the general case. The obtained necessary and sufficient
conditions involve algebraic conditions on the network reactions which in most
cases can be verified using linear programming. Finally, the relationship of
DRN irreducibility and recurrence with dynamical properties of stochastic and
continuous models of reaction networks is discussed.
","[{""version"":""v1"",""created"":""Thu, 14 Feb 2013 10:46:52 GMT""}]","2013-07-15"
"1302.3364","Andrzej K\k{a}dzielawa","Andrzej P. K\k{a}dzielawa, Jozef Spa{\l}ek, Jan Kurzyk, W{\l}odzimierz
  W\'ojcik","Extended Hubbard model with renormalized Wannier wave functions in the
  correlated state III: Statistically consistent Gutzwiller approximation and
  the metallization of atomic solid hydrogen","9 pages, 12 figures, 1 table","Eur. Phys. J. B 86, 252 (2013)","10.1140/epjb/e2013-40127-y",,"cond-mat.str-el","http://arxiv.org/licenses/nonexclusive-distrib/1.0/","  We extend our previous approach (Eur. Phys. J. B, \textbf{74}, 63(2010)) to
modeling correlated electronic states and the metal-insulator transition by
applying the so-called \emph{statistically consistent Gutzwiller approximation}
(SGA) to carry out self-consistent calculations of the renormalized
single-particle Wannier functions in the correlated state. The transition to
the Mott-Hubbard insulating state at temperature T=0 is of weak first order
even if antiferromagnetism is disregarded. The magnitude of the introduced
self-consistent magnetic correlation field is calculated and shown to lead to a
small magnetic moment in the magnetically uniform state. Realistic value of the
applied magnetic field has a minor influence on the metallic-state
characteristics near the Mott-Hubbard lcalization threshold. The whole analysis
has been carried out for an extended Hubbard model on a simple cubic (SC)
lattice and the evolution of physical properties is analyzed as a function of
the lattice parameter for the renormalized 1s-type Wannier functions. Quantum
critical scaling of the selected physical properties is analyzed as a function
of the lattice constant $R\rightarrow R_c=4.1 a_0$, where $R_c$ is the critical
value for metal-insulator transition and $a_0=0.53 \AA$ is the Bohr radius. A
critical pressure for metallization of solid atomic hydrogen is estimated and
is $\sim 10^2 GPa$.
","[{""version"":""v1"",""created"":""Thu, 14 Feb 2013 10:48:12 GMT""},{""version"":""v2"",""created"":""Mon, 10 Jun 2013 12:57:09 GMT""},{""version"":""v3"",""created"":""Thu, 3 Jul 2014 12:11:21 GMT""}]","2014-07-04"
"1302.3365","Lo\""ic Paulev\'e","Lo\""ic Paulev\'e, Geoffroy Andrieux, Heinz Koeppl","Under-approximating Cut Sets for Reachability in Large Scale Automata
  Networks",,,"10.1007/978-3-642-39799-8_4",,"cs.SY","http://arxiv.org/licenses/nonexclusive-distrib/1.0/","  In the scope of discrete finite-state models of interacting components, we
present a novel algorithm for identifying sets of local states of components
whose activity is necessary for the reachability of a given local state. If all
the local states from such a set are disabled in the model, the concerned
reachability is impossible. Those sets are referred to as cut sets and are
computed from a particular abstract causality structure, so-called Graph of
Local Causality, inspired from previous work and generalised here to finite
automata networks. The extracted sets of local states form an
under-approximation of the complete minimal cut sets of the dynamics: there may
exist smaller or additional cut sets for the given reachability. Applied to
qualitative models of biological systems, such cut sets provide potential
therapeutic targets that are proven to prevent molecules of interest to become
active, up to the correctness of the model. Our new method makes tractable the
formal analysis of very large scale networks, as illustrated by the computation
of cut sets within a Boolean model of biological pathways interactions
gathering more than 9000 components.
","[{""version"":""v1"",""created"":""Thu, 14 Feb 2013 10:53:29 GMT""}]","2013-07-15"
"1302.3366","Rafael S\'anchez","Andrew N. Jordan, Bj\""orn Sothmann, Rafael S\'anchez, Markus
  B\""uttiker","Powerful and efficient energy harvester with resonant-tunneling quantum
  dots","7 pages, 7 figures","Phys. Rev. B 87, 075312 (2013)","10.1103/PhysRevB.87.075312",,"cond-mat.mes-hall","http://arxiv.org/licenses/nonexclusive-distrib/1.0/","  We propose a nanoscale heat engine that utilizes the physics of resonant
tunneling in quantum dots in order to transfer electrons only at specific
energies. The nanoengine converts heat into electrical current in a
multiterminal geometry which permits one to separate current and heat flows. By
putting two quantum dots in series with a hot cavity, electrons that enter one
lead are forced to gain a prescribed energy in order to exit the opposite lead,
transporting a single electron charge. This condition yields an ideally
efficient heat engine. The energy gain is a property of the composite system
rather than of the individual dots. It is therefore tunable to optimize the
power while keeping a much larger level spacing for the individual quantum
dots. Despite the simplicity of the physical model, the optimized rectified
current and power is larger than any other candidate nano-engine. The ability
to scale the power by putting many such engines into a two-dimensional layered
structure gives a paradigmatic system for harvesting thermal energy at the
nanoscale. We demonstrate that the high power and efficiency of the layered
structure persists even if the quantum dots exhibit some randomness.
","[{""version"":""v1"",""created"":""Thu, 14 Feb 2013 10:58:21 GMT""}]","2013-02-15"
"1302.3367","Shouhei Ma","Shouhei Ma","Rationality of some tetragonal loci","to appear in Algebraic Geometry",,,,"math.AG","http://arxiv.org/licenses/nonexclusive-distrib/1.0/","  We prove that the moduli space of tetragonal curves of genus g>6 is rational
when g is congruent to 1, 2, 5, 6, 9, 10 modulo 12 and not equal to 9, 45.
","[{""version"":""v1"",""created"":""Thu, 14 Feb 2013 11:06:25 GMT""},{""version"":""v2"",""created"":""Tue, 11 Feb 2014 03:37:38 GMT""}]","2014-02-12"
"1302.3368","Volker Beckmann","V. Beckmann, S. de Jong, F. Mattana, D. Saez, S. Soldi (FACe / APC
  Paris)","Gamma-ray emitting radio galaxies at hard X-rays: Seyfert core or jet
  emission?","6 pages, 1 figure, accepted for the proceedings of ""An INTEGRAL view
  of the high-energy sky (the first 10 years)"", 9th INTEGRAL Workshop and
  celebration of the 10th anniversary of the launch, October 15-19, 2012,
  Paris, France",,,,"astro-ph.HE astro-ph.CO","http://arxiv.org/licenses/nonexclusive-distrib/1.0/","  A number of radio galaxies has been detected by Fermi/LAT in the gamma-ray
domain. In some cases, like Cen A and M 87, these objects have been seen even
in the TeV range by Cherenkov telescopes. Whereas the gamma-ray emission is
likely to be connected with the non-thermal jet emission, dominating also the
radio band, the situation is less clear at hard X-rays. While the smoothly
curved continuum emission and the overall spectral energy distribution indicate
a non-thermal emission, other features such as the iron line emission and the
low variability appear to be rather of Seyfert type, i.e. created in the
accretion disk and corona around the central black hole.
  We investigate several prominent cases using combined X-ray and gamma-ray
data in order to constrain the possible contributions of the jet and the
accretion disk to the overall spectral energy distribution in radio galaxies.
Among the three sources we study, three different origins of the hard X-ray
flux can be identified. The emission can be purely non-thermal and caused by
the jet, as in the case of M 87, or thermal inverse Compton emission from the
Seyfert type core (Cen A), or appears to be a superposition of non-thermal and
thermal inverse Compton emission, as we observe in 3C 111. Gamma-ray bright
radio galaxies host all kinds of AGN cores, Seyfert 1 and 2, BL Lac objects,
and also LINER.
","[{""version"":""v1"",""created"":""Thu, 14 Feb 2013 11:06:40 GMT""},{""version"":""v2"",""created"":""Tue, 19 Feb 2013 14:46:25 GMT""}]","2013-02-20"
"1302.3369","Konstanze Zwintz","K. Zwintz, L. Fossati, D. B. Guenther, T. Ryabchikova, A. Baglin, N.
  Themessl, T. G. Barnes, J. M. Matthews, M. Auvergne, D. Bohlender, S.
  Chaintreuil, R. Kuschnig, A. F. J. Moffat, J. F. Rowe, S. M. Rucinski, D.
  Sasselov, and W. W. Weiss","Regular frequency patterns in the young delta Scuti star HD 261711
  observed by the CoRoT and MOST satellites","12 pages, 13 figures, A&A accepted",,"10.1051/0004-6361/201220934",,"astro-ph.SR","http://arxiv.org/licenses/nonexclusive-distrib/1.0/","  We concentrate on an asteroseismological study of HD 261711, a rather hot
delta Scuti type pulsating member of the young open cluster NGC 2264 located at
the blue border of the instability region. HD 261711 was discovered to be a
pre-main sequence delta Scuti star using the time series photometry obtained by
the MOST satellite in 2006. High-precision, time-series photometry of HD 261711
was obtained by the MOST and CoRoT satellites in 4 separate new observing runs
that are put into context with the star's fundamental atmospheric parameters
obtained from spectroscopy. With the new MOST data set from 2011/12 and the two
CoRoT light curves from 2008 and 2011/12, the delta Scuti variability was
confirmed and regular groups of frequencies were discovered. The two pulsation
frequencies identified in the data from the first MOST observing run in 2006
are confirmed and 23 new delta Scuti-type frequencies were discovered using the
CoRoT data. Weighted average frequencies for each group are related to l=0 and
l=1 p-modes. Evidence for amplitude modulation of the frequencies in two groups
is seen. The effective temperature was derived to be 8600$\pm$200 K, log g is
4.1$\pm$0.2, and the projected rotational velocity is 53$\pm$1km/s. Using our
Teff value and the radius of 1.8$\pm$0.5 Rsun derived from SED fitting, we get
a log L/Lsun of 1.20$\pm$0.14 which agrees well to the seismologically
determined values of 1.65 Rsun and, hence, a log L/Lsun of 1.13. The radial
velocity of 14$\pm$2 km/s we derived for HD 261711, confirms the star's
membership to NGC 2264. Our asteroseismic models suggest that HD 261711 is a
delta Scuti-type star close to the zero-age main sequence (ZAMS) with a mass of
1.8 to 1.9Msun. HD 261711 is either a young ZAMS star or a late PMS star just
before the onset of hydrogen-core burning.
","[{""version"":""v1"",""created"":""Thu, 14 Feb 2013 11:08:08 GMT""}]","2015-06-15"
"1302.3370","Andrea Malagoli","A Malagoli, P J Lee, A K Ghosh, C Scheuerlein, M Di Michiel, J Jiang,
  U P Trociewitz, E E Hellstrom and D C Larbalestier","Evidence for length-dependent wire expansion, filament dedensification
  and consequent degradation of critical current density in Ag-alloy sheathed
  Bi-2212 wires",,,"10.1088/0953-2048/26/5/055018",,"cond-mat.supr-con","http://arxiv.org/licenses/nonexclusive-distrib/1.0/","  It is well known that longer Bi-2212 conductors have significantly lower
critical current density (Jc) than shorter ones, and recently it has become
clear that a major cause of this reduction is internal gas pressure generated
during heat treatment, which expands the wire diameter and dedensifies the
Bi-2212 filaments. Here we report on the length-dependent expansion of 5 to 240
cm lengths of state-of-the-art, commercial Ag alloy-sheathed Bi-2212 wire after
full and some partial heat treatments. Detailed image analysis along the wire
length shows that the wire diameter increases with distance from the ends,
longer samples often showing evident damage and leaks provoked by the internal
gas pressure. Comparison of heat treatments carried out just below the melting
point and with the usual melt process makes it clear that melting is crucial to
developing high internal pressure. The decay of Jc away from the ends is
directly correlated to the local wire diameter increase, which decreases the
local Bi-2212 filament mass density and lowers Jc, often by well over 50%. It
is clear that control of the internal gas pressure is crucial to attaining the
full Jc of these very promising round wires and that the very variable
properties of Bi-2212 wires are due to the fact that this internal gas pressure
has so far not been well controlled.
","[{""version"":""v1"",""created"":""Thu, 14 Feb 2013 11:10:23 GMT""}]","2015-06-15"
"1302.3371","Yasuomi Kamiya","Ken'ichi Nomoto, Yasuomi Kamiya, Naohito Nakasato","Type Ia Supernova Models and Progenitor Scenarios","Published in the Proceedings of the IAU Symposium No. 281 ""Binary
  Paths to Type Ia Supernova Explosions"" held in Padova (July 4-8, 2011)","IAU Symposium No. 281 ""Binary Paths to Type Ia Supernova
  Explosions"" (2013), eds. R. Di Stefano, M. Orio, and M. More (Cambridge
  University Press), pp. 253-260","10.1017/S1743921312015165",,"astro-ph.SR astro-ph.HE","http://arxiv.org/licenses/nonexclusive-distrib/1.0/","  We review some recent developments in theoretical studies on the connection
between the progenitor systems of Type Ia supernovae (SNe Ia) and the explosion
mechanisms. (1) DD-subCh: In the merging of double C+O white dwarfs (DD
scenario), if the carbon detonation is induced near the white dwarf (WD)
surface in the early dynamical phase, it could result in the (effectively)
sub-Chandrasekhar mass explosion. (2) DD-Ch: If no surface C-detonation is
ignited, the WD could grow until the Chandrasekhar mass is reached, but the
outcome depends on whether the quiescent carbon shell burning is ignited and
burns C+O into O+Ne+Mg. (3) SD-subCh: In the single degenerate (SD) scenario,
if the He shell-flashes grow strong to induce a He detonation, it leads to the
sub-Chandra explosion. (4) SD-Ch: If the He-shell flashes are not strong
enough, they still produce interesting amount of Si and S near the surface of
C+O WD before the explosion. In the Chandra mass explosion, the central density
is high enough to produce electron capture elements, e.g., stable Ni-58.
Observations of the emission lines of Ni in the nebular spectra provides useful
diagnostics of the sub-Chandra vs. Chandra issue. The recent observations of
relatively low velocity carbon near the surface of SNe Ia provide also
interesting constraint on the explosion models.
","[{""version"":""v1"",""created"":""Thu, 14 Feb 2013 11:16:45 GMT""},{""version"":""v2"",""created"":""Fri, 15 Feb 2013 21:54:57 GMT""}]","2013-02-19"
"1302.3372","Daniel Alpay A","Daniel Alpay and Guy Salomon","On algebras which are inductive limits of Banach spaces","References have been updated",,,,"math.FA","http://arxiv.org/licenses/nonexclusive-distrib/1.0/","  We introduce algebras which are inductive limits of Banach spaces and carry
inequalities which are counterparts of the inequality for the norm in a Banach
algebra. We then define an associated Wiener algebra, and prove the
corresponding version of the well-known Wiener theorem. Finally, we consider
factorization theory in these algebra, and in particular, in the associated
Wiener algebra.
","[{""version"":""v1"",""created"":""Thu, 14 Feb 2013 11:23:12 GMT""},{""version"":""v2"",""created"":""Sun, 28 Apr 2013 11:58:00 GMT""}]","2013-04-30"
"1302.3373","Mikel Palmero","M. Palmero, E. Torrontegui, M. Modugno, J. G. Muga","Detecting quantum backflow by the density of a Bose-Einstein Condensate","5 pages, 4 figures","Physical Review A 87, 053618 (2013)","10.1103/PhysRevA.87.053618",,"quant-ph cond-mat.quant-gas","http://arxiv.org/licenses/nonexclusive-distrib/1.0/","  Quantum backflow is a classically forbidden effect consisting in a negative
flux for states with negligible negative momentum components. It has never been
observed experimentally so far. We derive a general relation that connects
backflow with a critical value of the particle density, paving the way for the
detection of backflow by a density measurement. To this end, we propose an
explicit scheme with Bose-Einstein condensates, at reach with current
experimental technologies. Remarkably, the application of a positive momentum
kick, via a Bragg pulse, to a condensate with a positive velocity may cause a
current flow in the negative direction.
","[{""version"":""v1"",""created"":""Thu, 14 Feb 2013 11:23:49 GMT""},{""version"":""v2"",""created"":""Mon, 13 May 2013 09:31:10 GMT""}]","2014-11-21"
