"1304.5171","Sho Iwamoto","Sho Iwamoto","LHC SUSY searches after the Higgs discovery: respecting the muon g-2","6 pages, 2 figures; Proceeding for HPNP 2013, Toyama, Feb. 2013;
  based on arXiv:1303.4256. References added for v2/v3",,,,"hep-ph","http://arxiv.org/licenses/nonexclusive-distrib/1.0/","  SUSY searches at the LHC as well as the 126 GeV Higgs boson indicate that
superparticles, especially squarks and gluinos, are not so light as we
expected. It is important to investigate SUSY searches which do not rely on the
colored superparticles.
  As a clue for the investigation, we focus on the muon g-2 anomaly, which can
be explained by the SUSY contributions if some of neutralinos, charginos, and
sleptons are as light as of order 100 GeV. We propose the muon-(g-2)-motivated
MSSM as a benchmark model, where squarks are decoupled but the superparticles
corresponding to the muon g-2 are light enough to explain the anomaly. We also
interpret the up-to-date results of LHC SUSY searches, and obtain experimental
constraints on the model.
  We show searches for direct production of charginos and neutralinos work very
well against the scenario, but several regions are not only remain uncovered
but even found challenging to be searched for at the LHC. It is ascertained
that, in order to draw out latent potential of the LHC, strategies to attack
these regions should be developed.
","[{""version"":""v1"",""created"":""Thu, 18 Apr 2013 16:01:44 GMT""},{""version"":""v2"",""created"":""Mon, 22 Apr 2013 10:38:35 GMT""},{""version"":""v3"",""created"":""Fri, 3 May 2013 12:00:56 GMT""}]","2013-05-06"
"1304.5172","Michal P. Heller","Michal P. Heller, David Mateos, Wilke van der Schee and Miquel Triana","Holographic isotropization linearized","30 pages, 14 figures; v2: minor changes in the text, matches the
  published version","JHEP 1309:026, 2013","10.1007/JHEP09(2013)026",,"hep-th gr-qc","http://arxiv.org/licenses/nonexclusive-distrib/1.0/","  The holographic isotropization of a highly anisotropic, homogeneous, strongly
coupled, non-Abelian plasma was simplified in arXiv:1202.0981 by linearizing
Einstein's equations around the final, equilibrium state. This approximation
reproduces the expectation value of the boundary stress tensor with a 20%
accuracy. Here we elaborate on these results and extend them to observables
that are directly sensitive to the bulk interior, focusing for simplicity on
the entropy production on the event horizon. We also consider
next-to-leading-order corrections and show that the leading terms alone provide
a better description of the isotropization process for the states that are
furthest from equilibrium.
","[{""version"":""v1"",""created"":""Thu, 18 Apr 2013 16:04:09 GMT""},{""version"":""v2"",""created"":""Tue, 10 Sep 2013 08:01:46 GMT""}]","2013-09-11"
"1304.5173","Ben Barber","Ben Barber, Imre Leader","Partition regularity with congruence conditions","5 pages","J. Comb. 4 (2013), no. 3, 293-297","10.4310/JOC.2013.v4.n3.a1",,"math.CO","http://arxiv.org/licenses/nonexclusive-distrib/1.0/","  An infinite integer matrix A is called image partition regular if, whenever
the natural numbers are finitely coloured, there is an integer vector x such
that Ax is monochromatic. Given an image partition regular matrix A, can we
also insist that each variable x_i is a multiple of some given d_i? This is a
question of Hindman, Leader and Strauss.
  Our aim in this short note is to show that the answer is negative. As an
application, we disprove a conjectured equivalence between the two main forms
of partition regularity, namely image partition regularity and kernel partition
regularity.
","[{""version"":""v1"",""created"":""Thu, 18 Apr 2013 16:04:49 GMT""},{""version"":""v2"",""created"":""Thu, 19 Dec 2013 16:58:32 GMT""}]","2013-12-20"
"1304.5174","David Lloyd","David T. Lloyd, Kevin O'Keeffe and Simon M. Hooker","Complete spatial characterization of an optical wavefront using a
  variable-separation pinhole pair","4 pages, 3 figures, 1 table","Optics Letters, Vol. 38, Issue 7, pp. 1173-1175 (2013)","10.1364/OL.38.001173",,"physics.optics","http://arxiv.org/licenses/nonexclusive-distrib/1.0/","  We present a technique for measuring the transverse spatial properties of an
optical wavefront. Intensity and phase profiles are recovered by analysis of a
series of interference patterns produced by the combination of a scanning
X-shaped slit and a static horizontal slit; the spatial coherence may be found
from the same data. We demonstrate the technique by characterizing high
harmonic radiation generated in a gas cell, however the method could be
extended to a wide variety of light sources.
","[{""version"":""v1"",""created"":""Thu, 18 Apr 2013 16:10:12 GMT""}]","2015-06-15"
"1304.5175","Richard Plackett","Kazuyoshi Akiba, Per Arne Ronning, Martin van Beuzekom, Vincent van
  Beveren, Silvia Borghi, Henk Boterenbrood, Jan Buytaert, Paula Collins,
  Alvaro Dosil Suarez, Raphael Dumps, Lars Eklund, Daniel Esperante, Abraham
  Gallas, Hamish Gordon, Bas van der Heijden, Christoph Hombach, Daniel Hynds,
  Malcolm John, Alexander Leflat, Yi Ming Li, Ian Longstaff, Alexander Morton,
  Noritsugu Nakatsuka, Andre Nomerotski, Chris Parkes, Eliseo Perez Trigo,
  Richard Plackett, Matthew M. Reid, Pablo Rodriguez Perez, Heinrich Schindler,
  Tomasz Szumlak, Panagiotis Tsopelas, Carlos Vazquez Sierra, Jaap Velthuis and
  Michal Wysokinski","The Timepix Telescope for High Performance Particle Tracking","14 pages, 9 figures",,"10.1016/j.nima.2013.04.060",,"physics.ins-det hep-ex","http://arxiv.org/licenses/nonexclusive-distrib/1.0/","  The Timepix particle tracking telescope has been developed as part of the
LHCb VELO Upgrade project, supported by the Medipix Collaboration and the AIDA
framework. It is a primary piece of infrastructure for the VELO Upgrade project
and is being used for the development of new sensors and front end technologies
for several upcoming LHC trackers and vertexing systems. The telescope is
designed around the dual capability of the Timepix ASICs to provide information
about either the deposited charge or the timing information from tracks
traversing the 14 x 14mm matrix of 55 x 55 um pixels. The rate of reconstructed
tracks available is optimised by taking advantage of the shutter driven readout
architecture of the Timepix chip, operated with existing readout systems.
Results of tests conducted in the SPS North Area beam facility at CERN show
that the telescope typically provides reconstructed track rates during the beam
spills of between 3.5 and 7.5 kHz, depending on beam conditions. The tracks are
time stamped with 1 ns resolution with an efficiency of above 98% and provide a
pointing resolution at the centre of the telescope of 1.6 um . By dropping the
time stamping requirement the rate can be increased to 15 kHz, at the expense
of a small increase in background. The telescope infrastructure provides CO2
cooling and a flexible mechanical interface to the device under test, and has
been used for a wide range of measurements during the 2011-2012 data taking
campaigns.
","[{""version"":""v1"",""created"":""Thu, 18 Apr 2013 16:15:44 GMT""}]","2015-06-15"
"1304.5176","Xijie Wang","Pengfei Zhu, H. Berger, J. Cao, J. Geck, Y. Hidaka, R. Kraus, S.
  Pjerov, Y. Shen, R.I Tobey, Y. Zhu, J.P. Hill and X.J. Wang","Femtosecond Time-resolved MeV Electron Diffraction",,,,,"physics.ins-det cond-mat.str-el physics.acc-ph","http://arxiv.org/licenses/nonexclusive-distrib/1.0/","  We report the experimental demonstration of femtosecond electron diffraction
using high-brightness MeV electron beams. High-quality, single-shot electron
diffraction patterns for both polycrystalline aluminum and single-crystal
1T-TaS2 are obtained utilizing a 5 femto-Coulomb (~3x10^4 electrons) pulse of
electrons at 2.8 MeV. The high quality of the electron diffraction patterns
confirm that electron beam has a normalized emittance of ~50 nm-rad. The
corresponding transverse and longitudinal coherence length are ~11 nm and ~2.5
nm, respectively. The timing jitter between the pump laser and probe electron
beam was found to be ~ 100 fs (rms). The temporal resolution is demonstrated by
observing the evolution of Bragg and superlattice peaks of 1T-TaS2 following an
800 nm optical pump and was found to be 130 fs. Our results demonstrate the
advantages of MeV electron diffraction: such as longer coherent lengths, large
scattering cross-section and larger signal-to-noise ratio, and the feasibility
of ultimately realizing 10 fs time-resolved electron diffraction.
","[{""version"":""v1"",""created"":""Thu, 18 Apr 2013 16:20:46 GMT""},{""version"":""v2"",""created"":""Tue, 28 May 2013 03:36:25 GMT""},{""version"":""v3"",""created"":""Mon, 20 Jan 2014 04:11:36 GMT""}]","2014-01-21"
"1304.5177","Vitor Hugo Patricio Louzada","V. H. P. Louzada, N. A. M. Ara\'ujo, J. S. Andrade Jr, H. J. Herrmann","Breathing synchronization in interconnected networks","7 pages, 3 figures + 3 pages of Supplemental Material","Louzada, V.H.P., Ara\'ujo, N.A.M., Andrade, J.S. & Herrmann, H.J.
  Breathing synchronization in interconnected networks. Sci. Rep. 3, 3289
  (2013)","10.1038/srep03289",,"nlin.AO cond-mat.stat-mech physics.soc-ph","http://arxiv.org/licenses/nonexclusive-distrib/1.0/","  Global synchronization in a complex network of oscillators emerges from the
interplay between its topology and the dynamics of the pairwise interactions
among its numerous components. When oscillators are spatially separated,
however, a time delay appears in the interaction which might obstruct
synchronization. Here we study the synchronization properties of interconnected
networks of oscillators with a time delay between networks and analyze the
dynamics as a function of the couplings and communication lag. We discover a
new breathing synchronization regime, where two groups appear in each network
synchronized at different frequencies. Each group has a counterpart in the
opposite network, one group is in phase and the other in anti-phase with their
counterpart. For strong couplings, instead, networks are internally
synchronized but a phase shift between them might occur. The implications of
our findings on several socio-technical and biological systems are discussed.
","[{""version"":""v1"",""created"":""Thu, 18 Apr 2013 16:24:42 GMT""},{""version"":""v2"",""created"":""Wed, 27 Nov 2013 10:42:54 GMT""}]","2013-11-28"
"1304.5178","Marco Baldi","Marco Baldi","Cosmological models with multiple dark matter species and long-range
  scalar interactions","15 pages, 4 figures. To appear in the proceedings volume of the Corfu
  Summer Institute 2012 ""School and Workshops on Elementary Particle Physics
  and Gravity""",,,,"astro-ph.CO","http://arxiv.org/licenses/nonexclusive-distrib/1.0/","  In this talk, I have discussed the implications of a multi-component nature
of cosmic Dark Matter for the observational bounds on possible long-range
fifth-forces mediated by a Dark Energy scalar field. By assuming a simple
internal symmetry of the Dark Matter component associated to opposite coupling
""charges"" of two different particle species, the effects of Dark Energy
interactions on both the background and linear perturbations evolution are
strongly suppressed during the whole matter dominated phase, thereby relaxing
present bounds on the coupling strength. The associated attractive and
repulsive fifth-forces, however, might still have a very significant impact on
the nonlinear dynamics of collapsed structures. I have also described how some
of these nonlinear effects are identified through dedicated cosmological N-body
simulations as i) a possible fragmentation of bound Dark Matter halos into
smaller objects, and ii) a consequent suppression of the nonlinear matter power
at small scales. Both effects are potentially observable and might allow to
further constrain the model.
","[{""version"":""v1"",""created"":""Thu, 18 Apr 2013 16:25:33 GMT""}]","2013-04-19"
"1304.5179","Nikolay Chuprikov L","N. L. Chuprikov","Scattering a quantum particle on the potential step: Characteristic
  times for transmission and reflection","16 paqes, text improved, few misprints corrected",,,,"quant-ph cond-mat.mes-hall","http://arxiv.org/licenses/nonexclusive-distrib/1.0/","  We present a new model of scattering a quantum particle on the potential
step, which reconstructs the prehistory of the subensembles of transmitted and
reflected particles by their final states. Unlike the conventional one this
model predicts the existence of a transitional spatial region behind the
potential step where the probability to find reflected particles is nonzero and
the average velocity of transmitted particles monotonously varies between
asymptotic values. For both subprocesses we define the dwell and asymptotic
group times.
","[{""version"":""v1"",""created"":""Thu, 18 Apr 2013 16:36:47 GMT""},{""version"":""v2"",""created"":""Fri, 31 May 2013 12:22:51 GMT""},{""version"":""v3"",""created"":""Sat, 30 Nov 2013 12:08:51 GMT""},{""version"":""v4"",""created"":""Thu, 5 Dec 2013 10:32:23 GMT""}]","2013-12-06"
"1304.5180","Lei Tian","Lei Tian, Jonathan C. Petruccelli, Qin Miao, Haris Kudrolli, Vivek
  Nagarkar and George Barbastathis","Compressive X-ray phase tomography based on the transport of intensity
  equation",,"Optics Letters, Vol. 38, Issue 17, pp. 3418-3421 (2013)","10.1364/OL.38.003418",,"physics.optics","http://arxiv.org/licenses/nonexclusive-distrib/1.0/","  We develop and implement a compressive reconstruction method for tomographic
recovery of refractive index distribution for weakly attenuating objects in a
microfocus X-ray system. This is achieved through the development of a
discretized operator modeling both the transport of intensity equation and
X-ray transform that is suitable for iterative reconstruction techniques.
","[{""version"":""v1"",""created"":""Thu, 18 Apr 2013 16:43:27 GMT""},{""version"":""v2"",""created"":""Sun, 23 Jun 2013 17:51:40 GMT""}]","2015-06-16"
"1304.5181","Vaishali Khairnar mrs","Vaishali D. Khairnar, S. N. Pradhan","Comparative Study of Simulation for Vehicular Ad-hoc Network","4 pages, International Journal of Computer Applications",,"10.5120/7196-9967",,"cs.NI","http://arxiv.org/licenses/nonexclusive-distrib/1.0/","  In this paper we have discussed about the number of automobiles that has been
increased on the road in the past few years. Due to high density of vehicles,
the potential threats and road accident is increasing. Wireless technology is
aiming to equip technology in vehicles to reduce these factors by sending
messages to each other. The vehicular safety application should be thoroughly
tested before it is deployed in a real world to use. Simulator tool has been
preferred over out door experiment because it simple, easy and cheap. VANET
requires that a traffic and network simulator should be used together to
perform this test. Many tools exist for this purpose but most of them have the
problem with the proper interaction. Simulating vehicular networks with
external stimulus to analyze its effect on wireless communication but to do
this job a good simulator is also needed.
","[{""version"":""v1"",""created"":""Thu, 18 Apr 2013 16:46:54 GMT""}]","2013-04-19"
"1304.5182","Siyuan Ji","S. Ji, V. Sanghai, C. Ates, and I. Lesanovsky","Inhomogeneities and impurities in a dense one-dimensional Rydberg
  lattice gas","5 pages and 4 figures","Phys. Rev. A 89, 021404 (2014)","10.1103/PhysRevA.89.021404",,"cond-mat.quant-gas physics.atom-ph quant-ph","http://arxiv.org/licenses/nonexclusive-distrib/1.0/","  We consider a dense one-dimensional laser-driven Rydberg lattice gas with
perfect nearest-neighbor blockade. The ground state of this system can be found
analytically in certain parameter regimes even when the applied fields are
inhomogeneous in space. We will use this unique feature to investigate the
effect of an impurity - introduced by the local variation of the laser
parameters - on the correlations of the many-body ground state. Moreover, we
explore the role of a staggered laser field which alternates from site to site
thereby breaking the sublattice symmetry. We demonstrate that this technique,
which can be applied experimentally, reveals insights into the role of
long-range interactions on the critical properties of a Rydberg gas. Our work
highlight novel possibilities for the exploration of many-body physics in
Rydberg lattice gases based on locally tuneable laser fields.
","[{""version"":""v1"",""created"":""Thu, 18 Apr 2013 16:48:11 GMT""}]","2014-02-19"
"1304.5183","Vlada Limic","Vlada Limic, Anna Talarczyk","Second-order asymptotics for the block counting process in a class of
  regularly varying $\Lambda$-coalescents","Published at http://dx.doi.org/10.1214/13-AOP902 in the Annals of
  Probability (http://www.imstat.org/aop/) by the Institute of Mathematical
  Statistics (http://www.imstat.org)","Annals of Probability 2015, Vol. 43, No. 3, 1419-1455","10.1214/13-AOP902","IMS-AOP-AOP902","math.PR","http://arxiv.org/licenses/nonexclusive-distrib/1.0/","  Consider a standard ${\Lambda }$-coalescent that comes down from infinity.
Such a coalescent starts from a configuration consisting of infinitely many
blocks at time $0$, but its number of blocks $N_t$ is a finite random variable
at each positive time $t$. Berestycki et al. [Ann. Probab. 38 (2010) 207-233]
found the first-order approximation $v$ for the process $N$ at small times.
This is a deterministic function satisfying $N_t/v_t\to1$ as $t\to0$. The
present paper reports on the first progress in the study of the second-order
asymptotics for $N$ at small times. We show that, if the driving measure
$\Lambda$ has a density near zero which behaves as $x^{-\beta}$ with
$\beta\in(0,1)$, then the process $(\varepsilon^{-1/(1+\beta)}(N_{\varepsilon
t}/v_{\varepsilon t}-1))_{t\ge0}$ converges in law as $\varepsilon\to0$ in the
Skorokhod space to a totally skewed $(1+\beta)$-stable process. Moreover, this
process is a unique solution of a related stochastic differential equation of
Ornstein-Uhlenbeck type, with a completely asymmetric stable L\'{e}vy noise.
","[{""version"":""v1"",""created"":""Thu, 18 Apr 2013 16:48:54 GMT""},{""version"":""v2"",""created"":""Wed, 4 Dec 2013 11:34:08 GMT""},{""version"":""v3"",""created"":""Thu, 4 Jun 2015 12:23:22 GMT""}]","2015-06-05"
"1304.5184","Sara Madariaga","Sara Madariaga","Gr\""obner-Shirshov bases for the non-symmetric operads of dendriform
  algebras and quadri-algebras (unabridged version)","28 pages",,,,"math.RA","http://arxiv.org/licenses/nonexclusive-distrib/1.0/","  In this paper we use the operadic framework to find Gr\""obner-Shirshov bases
for the free quadri-algebra. We perform computations using the representation
of the nonsymmetric operad by planar rooted trees in a very intuitive way.
Gr\""obner-Shirshov bases for the free dendriform algebra are also found with
this technique, simplifying the work by Chen and Wang in 2010.
","[{""version"":""v1"",""created"":""Thu, 18 Apr 2013 16:50:01 GMT""},{""version"":""v2"",""created"":""Tue, 8 Oct 2013 14:08:00 GMT""}]","2013-10-09"
"1304.5185","Roman Kontchakov","Alessandro Artale and Roman Kontchakov and Frank Wolter and Michael
  Zakharyaschev","Temporal Description Logic for Ontology-Based Data Access (Extended
  Version)","Full version of the IJCAI 2013 paper",,,,"cs.LO cs.AI","http://arxiv.org/licenses/nonexclusive-distrib/1.0/","  Our aim is to investigate ontology-based data access over temporal data with
validity time and ontologies capable of temporal conceptual modelling. To this
end, we design a temporal description logic, TQL, that extends the standard
ontology language OWL 2 QL, provides basic means for temporal conceptual
modelling and ensures first-order rewritability of conjunctive queries for
suitably defined data instances with validity time.
","[{""version"":""v1"",""created"":""Thu, 18 Apr 2013 16:50:16 GMT""},{""version"":""v2"",""created"":""Tue, 30 Apr 2013 18:27:41 GMT""}]","2013-05-01"
"1304.5186","Abdufarrukh Abdumalikov","A. A. Abdumalikov, J. M. Fink, K. Juliusson, M. Pechal, S. Berger, A.
  Wallraff and S. Filipp","Experimental Realization of Non-Abelian Geometric Gates","In press in Nature. Published online on April 17, 2013","Nature 496 (2013) 482-485","10.1038/nature12010",,"quant-ph","http://arxiv.org/licenses/nonexclusive-distrib/1.0/","  The geometric aspects of quantum mechanics are underlined most prominently by
the concept of geometric phases, which are acquired whenever a quantum system
evolves along a closed path in Hilbert space. The geometric phase is determined
only by the shape of this path and is -- in its simplest form -- a real number.
However, if the system contains degenerate energy levels, matrix-valued
geometric phases, termed non-abelian holonomies, can emerge. They play an
important role for the creation of synthetic gauge fields in cold atomic gases
and the description of non-abelian anyon statistics. Moreover, it has been
proposed to exploit non-abelian holonomic gates for robust quantum computation.
In contrast to abelian geometric phases, non-abelian ones have been observed
only in nuclear quadrupole resonance experiments with a large number of spins
and without fully characterizing the geometric process and its non-commutative
nature. Here, we realize non-abelian holonomic quantum operations on a single
superconducting artificial three-level atom by applying a well controlled
two-tone microwave drive. Using quantum process tomography, we determine
fidelities of the resulting non-commuting gates exceeding 95 %. We show that a
sequence of two paths in Hilbert space traversed in different order yields
inequivalent transformations, which is an evidence for the non-abelian
character of the implemented holonomic quantum gates. In combination with
two-qubit operations, they form a universal set of gates for holonomic quantum
computation.
","[{""version"":""v1"",""created"":""Thu, 18 Apr 2013 16:54:33 GMT""}]","2019-08-19"
"1304.5187","Stefan Vandoren","Kiril Hristov, Chiara Toldo and Stefan Vandoren","Phase transitions of magnetic AdS4 black holes with scalar hair","5 pages, v2: misprints corrected and references added, published
  version",,"10.1103/PhysRevD.88.026019",,"hep-th","http://arxiv.org/licenses/nonexclusive-distrib/1.0/","  We determine the thermodynamic properties of a class of spherically symmetric
and static black holes in AdS4 with magnetic charges and scalar hair. These
black holes are solutions in 4d N=2 gauged supergravity that can arise from
eleven-dimensional supergravity compactified on S^7. At zero temperature, they
preserve supersymmetry and hence are stable. At non-zero temperatures, we
explore in detail the canonical ensemble and stability of solutions and find a
first order phase transition between small and large hairy black holes. The
transition emerges as a liquid-gas phase transition in the dual
three-dimensional field theory on R x S^2 with magnetic flux through S^2.
","[{""version"":""v1"",""created"":""Thu, 18 Apr 2013 16:54:42 GMT""},{""version"":""v2"",""created"":""Wed, 14 Aug 2013 10:20:34 GMT""}]","2013-08-15"
"1304.5188","Michael Presho","Yalchin Efendiev, Juan Galvis, Guanglian Li, Michael Presho","Generalized Multiscale Finite Element Methods. Nonlinear Elliptic
  Equations","25 pages, 7 figures",,"10.4208/cicp.020313.041013a",,"math.AP math.NA","http://arxiv.org/licenses/nonexclusive-distrib/1.0/","  In this paper we use the GeneralizedMultiscale Finite ElementMethod (GMsFEM)
framework, introduced in [20], in order to solve nonlinear elliptic equations
with high-contrast coefficients. The proposed solution method involves
linearizing the equation so that coarse-grid quantities of previous solution
iterates can be regarded as auxiliary parameters within the problem
formulation. With this convention, we systematically construct respective
coarse solution spaces that lend themselves to either continuous Galerkin (CG)
or discontinuous Galerkin (DG) global formulations. Here, we use Symmetric
Interior Penalty Discontinuous Galerkin approach. Both methods yield a
predictable error decline that depends on the respective coarse space
dimension, and we illustrate the effectiveness of the CG and DG formulations by
offering a variety of numerical examples.
","[{""version"":""v1"",""created"":""Thu, 18 Apr 2013 16:56:58 GMT""}]","2016-08-24"
