"1304.5383","Matthieu Davy","Matthieu Davy, Zhou Shi, Jing Wang, and Azriel Z. Genack","Transmission statistics and focusing in single disordered samples","9 pages, 4 figures",,"10.1364/OE.21.010367",,"physics.optics cond-mat.dis-nn cond-mat.stat-mech","http://arxiv.org/licenses/nonexclusive-distrib/1.0/","  We show in microwave experiments and random matrix calculations that in
samples with a large number of channels the statistics of transmission for
different incident channels relative to the average transmission is determined
by a single parameter, the participation number of the eigenvalues of the
transmission matrix, M. Its inverse, M-1, is equal to the variance of relative
total transmission of the sample, while the contrast in maximal focusing is
equal to M. The distribution of relative total transmission changes from
Gaussian to negative exponential over the range in which M-1 changes from 0 to
1. This provides a framework for transmission and imaging in single samples.
","[{""version"":""v1"",""created"":""Fri, 19 Apr 2013 11:57:21 GMT""}]","2015-06-15"
"1304.5384","Ian Petersen","Ian R. Petersen","Quantum Popov robust stability analysis of an optical cavity containing
  a saturated Kerr medium","A shortened version will appear in the Proceedings of the 2013
  European Control Conference",,,,"quant-ph cs.SY math.OC","http://arxiv.org/licenses/nonexclusive-distrib/1.0/","  This paper applies results on the robust stability of nonlinear quantum
systems to a system consisting an optical cavity containing a saturated Kerr
medium. The system is characterized by a Hamiltonian operator which contains a
non-quadratic term involving a quartic function of the annihilation and
creation operators. A saturated version of the Kerr nonlinearity leads to a
sector bounded nonlinearity which enables a quantum small gain theorem to be
applied to this system in order to analyze its stability. Also, a non-quadratic
version of a quantum Popov stability criterion is presented and applied to
analyze the stability of this system.
","[{""version"":""v1"",""created"":""Fri, 19 Apr 2013 11:57:59 GMT""}]","2013-04-22"
"1304.5385","Stuart Barry Cooper","S. Barry Cooper","The Mathematician's Bias - and the Return to Embodied Computation",,"In ""A Computable Universe - Understanding and Exploring Nature as
  Computation"" (Ed. Hector Zenil), World Scientific, 2013, pp. 125-142",,,"math.LO cs.GL","http://arxiv.org/licenses/nonexclusive-distrib/1.0/","  There are growing uncertainties surrounding the classical model of
computation established by G\""odel, Church, Kleene, Turing and others in the
1930s onwards. The mismatch between the Turing machine conception, and the
experiences of those more practically engaged in computing, has parallels with
the wider one between science and those working creatively or intuitively out
in the 'real' world. The scientific outlook is more flexible and basic than
some understand or want to admit. The science is subject to limitations which
threaten careers. We look at embodiment and disembodiment of computation as the
key to the mismatch, and find Turing had the right idea all along - amongst a
productive confusion of ideas about computation in the real and the abstract
worlds.
","[{""version"":""v1"",""created"":""Fri, 19 Apr 2013 12:01:24 GMT""}]","2013-04-22"
"1304.5386","Hristu Culetu","Hristu Culetu","On a de Sitter-like spacetime with cylindrical symmetry","6 pages, no figures",,,,"gr-qc hep-th","http://arxiv.org/licenses/nonexclusive-distrib/1.0/","  A curved static de Sitter-like metric is analyzed. The source of curvature is
rooted from a constant stress tensor with positive energy density and negative
pressures. All the curvature invariants are constant everywhere and the
geometry is conformally flat. The horizon surface gravity equals the parameter
$\omega$ from the metric that is also interpreted as an angular velocity. The
Tolman-Komar gravitational energy is investigated. One finds that the horizon
entropy satisfies the relation $S = A_{H}/4$, as for the black hole horizon.
","[{""version"":""v1"",""created"":""Fri, 19 Apr 2013 12:04:37 GMT""}]","2013-04-22"
"1304.5387","Dani\""el Boer","Daniel Boer","TMD evolution of the Sivers asymmetry","10 pages, 5 figures",,"10.1016/j.nuclphysb.2013.05.021",,"hep-ph","http://arxiv.org/licenses/nonexclusive-distrib/1.0/","  The energy scale dependence of the Sivers asymmetry in semi-inclusive deep
inelastic scattering is studied numerically within the framework of TMD
factorization that was put forward in 2011. The comparison to previous results
in the literature shows that the treatment of next-to-leading logarithmic
effects is important for the fall-off of the Sivers asymmetry with energy in
the measurable regime. The TMD factorization based approach indicates that the
peak of the Sivers asymmetry falls off with energy scale Q to good
approximation as 1/Q^{0.7}, somewhat faster than found previously based on the
first TMD factorization expressions by Collins and Soper in 1981. It is found
that the peak of the asymmetry moves rather slowly towards higher transverse
momentum values as $Q$ increases, which may be due to the absence of
perturbative tails of the TMDs in the presented treatments. We conclude that
the behavior of the peak of the asymmetry as a function of energy {\it and}
transverse momentum allows for valuable tests of the TMD formalism and the
considered approximations. To confront the TMD approach with experiment, high
energy experimental data from an Electron-Ion Collider is required.
","[{""version"":""v1"",""created"":""Fri, 19 Apr 2013 12:10:30 GMT""}]","2015-06-15"
"1304.5388","Johannes Schmidt","Nadia Creignou, Uwe Egly and Johannes Schmidt","Complexity Classifications for logic-based Argumentation",,,,,"cs.CC","http://arxiv.org/licenses/nonexclusive-distrib/1.0/","  We consider logic-based argumentation in which an argument is a pair (Fi,al),
where the support Fi is a minimal consistent set of formulae taken from a given
knowledge base (usually denoted by De) that entails the claim al (a formula).
We study the complexity of three central problems in argumentation: the
existence of a support Fi ss De, the validity of a support and the relevance
problem (given psi is there a support Fi such that psi ss Fi?). When arguments
are given in the full language of propositional logic these problems are
computationally costly tasks, the validity problem is DP-complete, the others
are SigP2-complete. We study these problems in Schaefer's famous framework
where the considered propositional formulae are in generalized conjunctive
normal form. This means that formulae are conjunctions of constraints build
upon a fixed finite set of Boolean relations Ga (the constraint language). We
show that according to the properties of this language Ga, deciding whether
there exists a support for a claim in a given knowledge base is either
polynomial, NP-complete, coNP-complete or SigP2-complete. We present a
dichotomous classification, P or DP-complete, for the verification problem and
a trichotomous classification for the relevance problem into either polynomial,
NP-complete, or SigP2-complete. These last two classifications are obtained by
means of algebraic tools.
","[{""version"":""v1"",""created"":""Fri, 19 Apr 2013 12:10:51 GMT""},{""version"":""v2"",""created"":""Thu, 27 Feb 2014 09:53:27 GMT""}]","2014-02-28"
"1304.5389","Aziza Sabri","Sabri Aziza, Kjiri Laila","Patterns to analyze requirements of a Decisional Information System","paper accepted alson in SEDEXS'2012: International Conference On
  Software Engineering, Databases and EXpert Systems, Settat, Maroc, 14-16 Juin
  2012, International Journal of Computer Application (IJCA), Special Issue On
  Software Engineering Databases and EXpert Systems (SEDEXS), Number 2, ISBN:
  973-93-80870-26-8, 17 Septembre 2012",,,,"cs.OH","http://arxiv.org/licenses/nonexclusive-distrib/1.0/","  The domain of analysis and conception of Decisional Information System (DIS)
is, highly, applying new techniques and methods to succeed the process of the
decision and minimizing the time of conception. Our objective in this paper is
to define a group of patterns to ensure a systematic reuse of our approach to
analyse a DIS s business requirements. We seek, through this work, to guide the
discovery of an organizations business requirements, expressed as goals by
introducing the notion of context, to promote good processes design for a DIS,
to capitalize the process and models proposed in our approach and systematize
reuse steps of this approach to analyze similar projects or adapt them as
needed. The patterns are at the same time the process s patterns and product s
patterns as they capitalize models and their associated processes. These
patterns are represented according to the PSIGMA formalism.
","[{""version"":""v1"",""created"":""Fri, 19 Apr 2013 12:13:00 GMT""}]","2013-04-22"
"1304.5390","Micha{\l} Laso\'n","Micha{\l} Laso\'n","Obstacles for splitting multidimensional necklaces","final version, 14 pages","Proceedings of the American Mathematical Society 143 (2015), no.
  11, 4655-4668","10.1090/proc/12611",,"math.CO math.GN math.MG","http://arxiv.org/licenses/nonexclusive-distrib/1.0/","  The well-known ""necklace splitting theorem"" of Alon asserts that every
$k$-colored necklace can be fairly split into $q$ parts using at most $t$ cuts,
provided $k(q-1)\leq t$. In a joint paper with Alon et al. we studied a kind of
opposite question. Namely, for which values of $k$ and $t$ there is a
measurable $k$-coloring of the real line such that no interval has a fair
splitting into $2$ parts with at most $t$ cuts? We proved that $k>t+2$ is a
sufficient condition (while $k>t$ is necessary). We generalize this result to
Euclidean spaces of arbitrary dimension $d$, and to arbitrary number of parts
$q$. We prove that if $k(q-1)>t+d+q-1$, then there is a measurable $k$-coloring
of $\mathbb{R}^d$ such that no axis-aligned cube has a fair $q$-splitting using
at most $t$ axis-aligned hyperplane cuts. Our bound is of the same order as a
necessary condition $k(q-1)>t$ implied by a theorem of Alon. Moreover for
$d=1,q=2$ we get exactly the result of of Alon et al. Additionally, we prove
that if a stronger inequality $k(q-1)>dt+d+q-1$ is satisfied, then there is a
measurable $k$-coloring of $\mathbb{R}^d$ with no axis-aligned cube having a
fair $q$-splitting using at most $t$ arbitrary hyperplane cuts. The proofs are
based on the topological Baire category theorem and use algebraic independence
over suitably chosen fields.
","[{""version"":""v1"",""created"":""Fri, 19 Apr 2013 12:21:05 GMT""},{""version"":""v2"",""created"":""Wed, 13 Nov 2013 11:56:29 GMT""},{""version"":""v3"",""created"":""Sun, 23 Nov 2014 22:33:52 GMT""}]","2016-01-29"
"1304.5391","Pascal Ruello","M. Lejman, V. Shalagatsky, A. Kovalenko, T. Pezeril, V. V. Temnov, and
  P. Ruello","Coherent acoustic phonons emission in copper driven by super-diffusive
  hot electrons","8 pages, 4 figures","JOSA B, Vol. 31, Issue 2, pp. 282-290 (2014)",,,"cond-mat.mtrl-sci","http://arxiv.org/licenses/nonexclusive-distrib/1.0/","  Ultrafast laser excited hot electrons can transport energy supersonically far
from the region where they are initially produced. We show that this ultrafast
energy transport is responsible of the emission of coherent acoustic phonons
deeply beneath the free surface of a copper metal sample. In particular we
demonstrate that enough energy carried by these hot electrons over a distance
as large as 220nm at room temperature in copper can be converted into coherent
acoustic phonons. In order to demonstrate this effect, several configurations
of time-resolved optical experiments of time of flight of coherent acoustic
phonons and of hot electrons have been performed.
","[{""version"":""v1"",""created"":""Fri, 19 Apr 2013 12:21:38 GMT""}]","2015-01-29"
"1304.5392","Zhen-Hang Yang","Zhen-Hang Yang","Some sharp Wilker type inequalities and their applications","15 pages",,,,"math.CA","http://arxiv.org/licenses/nonexclusive-distrib/1.0/","  In this paper, we prove that for fixed $k\geq 1$, the Wilker type inequality
{equation*} \frac{2}{k+2}(\frac{\sin x}{x}) ^{kp}+\frac{k}{k+2}(\frac{% \tan
x}{x})^{p}>1 {equation*}% holds for $x\in (0,\pi /2) $ if and only if $p>0$ or
$p\leq -% \frac{\ln (k+2) -\ln 2}{k(\ln \pi -\ln 2)}$. It is reversed if and
only if $-\frac{12}{5(k+2)}\leq p<0$. Its hyperbolic version holds for $x\in
(0,\infty) $ if and only if $% p>0$ or $p\leq -\frac{12}{5(k+2)}$. And, for
fixed $k<-2$, the hyperbolic version is reversed if and only if $p<0$ or $p\geq
-\frac{12}{% 5(k+2)}$. Our results unify and generalize some known ones.
","[{""version"":""v1"",""created"":""Fri, 19 Apr 2013 12:23:38 GMT""}]","2013-04-22"
"1304.5393","Maciej Woloszyn","Maciej Woloszyn, Janusz Adamowski, Pawel Wojcik and Bartlomiej J.
  Spisak","Periodicity of resonant tunneling current induced by the Stark
  resonances in semiconductor nanowire","9 pages, 8 figures","J. Appl. Phys. 114 (2013) 164301","10.1063/1.4826614",,"cond-mat.mes-hall","http://arxiv.org/licenses/nonexclusive-distrib/1.0/","  The modification of the electronic current resulting from Stark resonances
has been studied for the semiconductor nanowire with the double-barrier
structure. Based on the calculated current-voltage characteristics we have
shown that the resonant tunneling current is a periodic function of the width
of the spacer layer. We have also demonstrated that the simultaneous change of
the source-drain voltage and the voltage applied to the gate located near the
nanowire leads to almost periodic changes of the resonant tunneling current as
a function of the source-drain and gate voltages. The periodic properties of
the resonant tunneling current result from the formation of the Stark resonance
states. If we change the electric field acting in the nanowire, the Stark
states periodically acquire the energies from the transport window and enhance
the tunneling current in a periodic manner. We have found that the separations
between the resonant current peaks on the source-drain voltage scale can be
described by a slowly increasing linear function of the Stark state quantum
number. This allows us to identify the quantum states that are responsible for
the enhancement of the resonant tunneling. We have proposed a method of the
experimental observation of the Stark resonances in semiconductor
double-barrier heterostructures.
","[{""version"":""v1"",""created"":""Fri, 19 Apr 2013 12:27:25 GMT""},{""version"":""v2"",""created"":""Fri, 10 May 2013 08:55:28 GMT""}]","2013-12-02"
"1304.5394","Morgan Trassin","M. Trassin, J. D. Clarkson, S. R. Bowden, Jian Liu, J. T. Heron, R. J.
  Paull, E. Arenholz, D. T. Pierce, and J. Unguris","Interfacial Coupling in Multiferroic-Ferromagnet Heterostructures",,"Physical Review B 87, 134426 (2013)","10.1103/PhysRevB.87.134426",,"cond-mat.mtrl-sci","http://arxiv.org/licenses/nonexclusive-distrib/1.0/","  We report local probe investigations of the magnetic interaction between
BiFeO3 films and a ferromagnetic Co0.9Fe0.1 layer. Within the constraints of
intralayer exchange coupling in the Co0.9Fe0.1, the multiferroic imprint in the
ferromagnet results in a collinear arrangement of the local magnetization and
the in-plane BiFeO3 ferroelectric polarization. The magnetic anisotropy is
uniaxial, and an in-plane effective coupling field of order 10 mT is derived.
Measurements as a function of multiferroic layer thickness show that the
influence of the multiferroic layer on the magnetic layer becomes negligible
for 3 nm thick BiFeO3 films. We ascribe this breakdown in the exchange coupling
to a weakening of the antiferromagnetic order in the ultrathin BiFeO3 film
based on our X-ray linear dichroism measurements. These observations are
consistent with an interfacial exchange coupling between the CoFe moments and a
canted antiferromagnetic moment in the BiFeO3.
","[{""version"":""v1"",""created"":""Fri, 19 Apr 2013 12:29:43 GMT""}]","2013-05-01"
"1304.5395","Tabaa Mohamed","Mohamed Taba\^a","Sur le produit tensoriel d'alg\`ebres","11 pages, in French with an abstract in English. This is a developped
  version with more additional results",,,,"math.AC","http://arxiv.org/licenses/nonexclusive-distrib/1.0/","  Let $\sigma:A\rightarrow B$ and $\rho:A\rightarrow C$\ be two homomorphisms
of noetherian rings such that $B\otimes_{A}C$ is a noetherian ring. we show
that if $\sigma$ is a regular (resp. complete intersection, resp. Gorenstein,
resp. Cohen-Macaulay, resp. $(S_{n}$), resp. almost Cohen-Macaulay)
homomorphism, so is $\sigma\otimes I_{C}$ and the converse is true if $\rho$ is
faithfully flat.
  We deduce the transfert of the previous properties of $B$ and $C$ for
$B\otimes_{A}C$, and then for the completed tensor product
$B\hat{\otimes}_{A}C$. If $B\otimes_{A}B$ is noetherian and $\sigma$ is flat,
we give a necessary and sufficient condition to $B\otimes_{A}B$ be a regular
ring.
","[{""version"":""v1"",""created"":""Fri, 19 Apr 2013 12:37:23 GMT""},{""version"":""v2"",""created"":""Thu, 4 Jul 2013 12:02:21 GMT""},{""version"":""v3"",""created"":""Thu, 3 Oct 2013 12:12:18 GMT""}]","2013-10-04"
"1304.5396","Rados{\l}aw Chrapkiewicz","Radoslaw Chrapkiewicz, Wojciech Wasilewski, Czeslaw Radzewicz","How to measure diffusional decoherence in multimode rubidium vapor
  memories?",,"Optics Communications 317 2014","10.1016/j.optcom.2013.12.020",,"physics.atom-ph physics.optics quant-ph","http://arxiv.org/licenses/nonexclusive-distrib/1.0/","  Diffusion is the main limitation of storage time in spatially multimode
applications of warm atomic vapors. Precise knowledge of diffusional
decoherence in the system is desired for designing most of vapor memory setups.
Here we present a novel, efficient and direct method of measuring unbiased
diffusional decoherence, clearly distinguished from all other decoherence
sources. We found the normalized diffusion coefficients of rubidium atoms in
noble gases to be as follows: neon 0.20 cm$^{2}$/s, krypton 0.068 cm$^{2}$/s
and we are the first to give an experimental result for rubidium in xenon:
0.057 cm$^{2}$/s. Our method consists in creating, storing and retrieving
spatially-varying atomic coherence. Raman scattering provides a necessary
interface to the atoms that allows for probing many spatial periodicities of
atomic coherence concurrently. As opposed to previous experiments the method
can be used for any single sealed glass cell and it does not require any setup
alterations during the measurements and therefore it is robust and repeatable.
","[{""version"":""v1"",""created"":""Fri, 19 Apr 2013 12:41:39 GMT""},{""version"":""v2"",""created"":""Sat, 17 May 2014 14:32:30 GMT""}]","2015-08-04"
"1304.5397","Alexander Figotin","Alexander Figotin and Guillermo Reyes","Multi-transmission-line-beam interactive system",,,"10.1063/1.4832486",,"math-ph math.MP","http://arxiv.org/licenses/nonexclusive-distrib/1.0/","  We construct here a Lagrangian field formulation for a system consisting of
an electron beam interacting with a slow-wave structure modeled by a possibly
non-uniform multiple transmission line (MTL). In the case of a single line we
recover the linear model of a traveling wave tube (TWT) due to J.R. Pierce.
Since a properly chosen MTL can approximate a real waveguide structure with any
desired accuracy, the proposed model can be used in particular for design
optimization. Furthermore, the Lagrangian formulation provides for: (i) a clear
identification of the mathematical source of amplification, (ii) exact
expressions for the conserved energy and its flux distributions obtained from
the Noether theorem. In the case of uniform MTLs we carry out an exhaustive
analysis of eigenmodes and find sharp conditions on the parameters of the
system to provide for amplifying regimes.
","[{""version"":""v1"",""created"":""Fri, 19 Apr 2013 12:45:24 GMT""},{""version"":""v2"",""created"":""Wed, 4 Sep 2013 18:01:03 GMT""}]","2015-06-15"
"1304.5398","Yuriy Petrovich Lyakhno","Yu.M.Arkatov, P.I.Vatset, V.I.Voloshchuk, V.A.Zolenko,
  A.F.Khodyachikh, I.M.Prokhorets, V.L.Marchenko, E.A.Vinokurov, Yu.P.Lyakhno,
  S.I.Nagorny, Yu.A.Kasatkin, I.K.Kirichenko, A.A.Zayats, V.N.Gur'ev","Differential cross sections $^4$He({$\gamma$,p})$^3$H and
  $^4$He({$\gamma$,n})$^3$He reactions in the range of the photon energies up
  to the threshold of the meson production",,,,"25Anisi","nucl-ex","http://arxiv.org/licenses/nonexclusive-distrib/1.0/","  Differential cross sections two-body ($\gamma,p$) and ($\gamma,n$) reactions
of the $^4$He nucleus disintegration were measured using the bremsstrahlung
beam of photons at the KIPT linac LEA-300 at the maximum energy ${\rm
E}_{\gamma}^{max}$ = 150 MeV. The reaction products were detected in a
diffusion chamber placed in the magnetic field. The differential cross sections
were measured with a 1 MeV step up to a photon energy of 45 MeV, and with a
greater step at higher energies. The step in the measurements of the polar
angle of nucleon emission was ${10}^{\circ}$ in the c.m.s.
","[{""version"":""v1"",""created"":""Fri, 19 Apr 2013 12:45:59 GMT""}]","2013-04-22"
"1304.5399","Timo Laitinen","T. Laitinen, S. Dalla, J. Kelly, and M. Marsh","Energetic Particle Diffusion In Critically Balanced Turbulence",,"ApJ, 764:168, 2013","10.1088/0004-637X/764/2/168",,"astro-ph.SR physics.space-ph","http://arxiv.org/licenses/nonexclusive-distrib/1.0/","  Observations and modelling suggest that the fluctuations in magnetised
plasmas exhibit scale-dependent anisotropy, with more energy in the
fluctuations perpendicular to the mean magnetic field than in the parallel
fluctuations and the anisotropy increasing at smaller scales. The
scale-dependence of the anisotropy has not been studied in full-orbit
simulations of particle transport in turbulent plasmas so far. In this paper,
we construct a model of critically balanced turbulence, as suggested by
\cite{GoSr1995}, and calculate energetic particle spatial diffusion
coefficients using full-orbit simulations. The model uses an enveloped
turbulence approach, where each 2-dimensional wave mode with wavenumber
$k_\perp$ is packed into envelopes of length $L$ following the critical balance
condition, $L\propto k_\perp^{-2/3}$, with the wave mode parameters changing
between envelopes. Using full-orbit particle simulations, we find that both the
parallel and perpendicular diffusion coefficients increase by a factor 2,
compared to previous models with scale-independent anisotropy.
","[{""version"":""v1"",""created"":""Fri, 19 Apr 2013 12:51:01 GMT""}]","2013-04-22"
"1304.5400","Miloslav Svec","Miloslav Svec","Study of piN->pipiN processes on polarized targets II.: The prediction
  of rho^0(770)-f_0(980) spin mixing","40 pages, 8 figures. Subsections III.C & V.C deleted. Subsections
  III.B, VII.D, Section VIII, Conclusions revised. New Sections IX,X,XI. Old
  ref.17,18,21,30,31,35,36 deleted, new ref.11,12,13,18,23,35-39 added",,,,"hep-ph hep-ex","http://arxiv.org/licenses/nonexclusive-distrib/1.0/","  In Part I. of this work we have presented evidence that the measured relative
phases of transversity amplitudes in piN->pipiN processes differ from those
predicted by the unitary evolution law. We ascribed this difference to a
non-unitary interaction of the produced final state rho_f(S) with a universal
quantum environment in the Universe. This new kind of interaction must be a
pure dephasing interaction. If the quantum environment is to be an integral
part of the Nature then its dephasing interactions must be fully consistent
with the Standard Model. In this work we impose on the dephasing interaction
the requirements of the conservation of the identities and four-momenta of the
final state particles, Lorentz symmetry, P-parity and the conservation of total
angular momentum and isospin. From this consistency alone we find that in
piN->pipiN the dephasing interaction must be a dipion spin mixing interaction.
The theory predicts rho^0(770)-f_0(980) mixing in the S- and P-wave amplitudes
in pi(-)p->pi(-)pi(+)n. The predicted moduli and relative phases are in
agreement with experimental results. The spin mixing of S-matrix amplitudes to
form new observable amplitudes is a new phenomenon beyond the Standard Model.
It is our conjecture that the pure dephasing interaction describes the
non-standard interaction of baryonic matter with dark matter and dark energy
which we identify with the quantum environment.
","[{""version"":""v1"",""created"":""Fri, 19 Apr 2013 12:51:49 GMT""},{""version"":""v2"",""created"":""Fri, 28 Nov 2014 12:57:13 GMT""}]","2014-12-01"
