"1304.5250","Alvaro Pelayo","\'Alvaro Pelayo and San V\~u Ngoc","Sharp symplectic embeddings of cylinders","Originally part of version 2 of arXiv:1210.1537",,,,"math.SG","http://arxiv.org/licenses/nonexclusive-distrib/1.0/","  We show that the cylinder Z^{2n}(1):= B^2(1)\times \mathbb{R}^{2(n-1)} embeds
symplectically into B^4(R) \times \mathbb{R}^{2(n-2)} if R \geq \sqrt{3}.
","[{""version"":""v1"",""created"":""Thu, 18 Apr 2013 20:53:43 GMT""}]","2013-04-22"
"1304.5251","Yousuf Ibrahim Khan","Yousuf Ibrahim Khan","Applications of Dynamical Systems in Engineering","32 Pages",,,,"cs.SY","http://arxiv.org/licenses/nonexclusive-distrib/1.0/","  This paper presents the current possible applications of Dynamical Systems in
Engineering. The applications of chaos, fractals have proven to be an exciting
and fruitful endeavor. These applications are highly diverse ranging over such
fields as Electrical, Electronics and Computer Engineering. Dynamical Systems
theory describes general patterns found in the solution of systems of nonlinear
equations. The theory focuses upon those equations representing the change of
processes in time. This paper offers the issue of applying dynamical systems
methods to a wider circle of Engineering problems. There are three components
to our approach: ongoing and possible applications of Fractals, Chaos Theory
and Dynamical Systems. Some basic and useful computer simulation of Dynamical
System related problems have been shown also.
","[{""version"":""v1"",""created"":""Thu, 18 Apr 2013 20:54:14 GMT""}]","2013-04-22"
"1304.5252","Yan Levin","Renato Pakter and Yan Levin","Topology of Collisionless Relaxation",,"Phys. Rev. Lett. 110, 140601 (2013)","10.1103/PhysRevLett.110.140601",,"cond-mat.stat-mech","http://arxiv.org/licenses/nonexclusive-distrib/1.0/","  Using extensive molecular dynamics simulations we explore the fine-grained
phase space structure of systems with long-range interactions. We find that if
the initial phase space particle distribution has no holes, the final
stationary distribution will also contain a compact simply connected region.
The microscopic holes created by the filamentation of the initial distribution
function are always restricted to the outer regions of the phase space. In
general, for complex multilevel distributions it is very difficult to a priori
predict the final stationary state without solving the full dynamical
evolution. However, we show that for multilevel initial distributions
satisfying a generalized virial condition, it is possible to predict the
particle distribution in the final stationary state using Casimir invariants of
the Vlasov dynamics.
","[{""version"":""v1"",""created"":""Thu, 18 Apr 2013 21:00:13 GMT""}]","2013-04-22"
"1304.5253","Marcelo M. Guzzo","M. M. Guzzo, P. C. de Holanda, O. L. G. Peres, E. M. Zavanin","Stochastic Neutrino Mixing Mechanism","5 pages, 2 figures",,"10.1103/PhysRevD.87.093003",,"hep-ph","http://arxiv.org/licenses/nonexclusive-distrib/1.0/","  We propose a mechanism which provides an explanation of the Gallium and
antineutrino reactor anomalies. Differently from original Pontecorvo's
hypothesis, this mechanism is based on the phenomenological assumption in which
the admixture of neutrino mass eigenstates in the moments of neutrino creation
and detection can assume different configurations around the admixture
parametrized by the usual values of the mixing angles $\theta_{12}$,
$\theta_{23}$ and $\theta_{13}$. For simplicity, we assume a Gaussian
distribution for the mixing angles in such a way that the average value of this
distribution is given by the usual values of the mixing angles and the width of
the Gaussian is denoted by $\alpha$. We show that the proposed mechanism
provides a possible explanation for very short-baseline neutrino disappearance,
necessary to accommodate Gallium and antineutrino reactor anomalies, which is
not allowed in usual neutrino oscillations based on Pontecorvo's original
hypotheses. We also can describe high-energy oscillation experiments, like
LSND, Fermi and NuTeV, assuming a weakly energy dependent width parameter,
$\alpha(E)$, that nicely fits all experimental results.
","[{""version"":""v1"",""created"":""Thu, 18 Apr 2013 21:01:29 GMT""}]","2015-06-15"
"1304.5254","Menachem Shlossberg","Michael Megrelishvili, Menachem Shlossberg","Free non-archimedean topological groups","Fixing some inacuracies in the published version","Comment.Math.Univ.Carolin. 54,2 (2013) 273-312",,,"math.GN math.GR","http://arxiv.org/licenses/nonexclusive-distrib/1.0/","  We study free topological groups defined over uniform spaces in some
subclasses of the class NA of non-archimedean groups. Our descriptions of the
corresponding topologies show that for metrizable uniformities the
corresponding free balanced, free abelian and free Boolean NA groups are also
metrizable. Graev type ultra-metrics determine the corresponding free
topologies. Such results are in a striking contrast with free balanced and free
abelian topological groups cases (in standard varieties).
  Another contrasting advantage is that the induced topological group actions
on free abelian NA groups frequently remain continuous. One of the main
applications is: any epimorphism in the category NA must be dense. Moreover,
the same methods improve the following result of T.H. Fay : the inclusion of a
proper open subgroup H into G is not an epimorphism in the category of all
Hausdorff topological groups. A key tool in the proofs is Pestov's test of
epimorphisms.
  Our results provide a convenient way to produce surjectively universal NA
abelian and balanced groups. In particular, we unify and strengthen some recent
results of Gao and Gao-Xuan as well as classical results about profinite groups
which go back to Iwasawa and Gildenhuys-Lim.
","[{""version"":""v1"",""created"":""Thu, 18 Apr 2013 21:02:00 GMT""},{""version"":""v2"",""created"":""Mon, 13 May 2013 18:35:14 GMT""}]","2013-05-14"
"1304.5255","Krzysztof He{\l}miniak","K. G. He{\l}miniak, J. Devor, D. Minniti, P. Sybilski","Tracing the structure of the Milky Way with detached eclipsing binaries
  from the VVV survey - I. The method and initial results","15 pages, 4+2 figures, 5 tables, accepted by MNRAS",,"10.1093/mnras/stt675",,"astro-ph.GA astro-ph.SR","http://arxiv.org/licenses/nonexclusive-distrib/1.0/","  We present the first results of a project aiming to trace the spatial
structure of the Milky Way using detached eclipsing binaries (DEBs) as distance
indicators. A sample of DEBs from the OGLE-II catalogue was selected and their
near infrared photometry was taken from the Vista Variables in the Via Lactea
(VVV) survey. The I band OGLE-II light curves are used to create models of the
DEBs, which together with the VVV photometry are compared with a set of
theoretical isochrones. After correcting for stellar reddening, we find a set
of absolute physical parameters of components of a given binary, including
absolute magnitudes and distances.
  With this approach we can calculate the distances with the precision better
than 5 per cent. Even though we have a few systems, the distribution is not
homogeneous along the line of sight, and appears to follow the overall
structure of the Galaxy - several spiral arms and the Bulge are
distinguishable. A number of systems can be seen behind the Bulge, reaching
even the distance to the Sagittarius dwarf galaxy.
","[{""version"":""v1"",""created"":""Thu, 18 Apr 2013 21:06:09 GMT""}]","2015-06-15"
"1304.5256","Eduardo Fradkin","Ariel Dobry, Akbar Jaefari and Eduardo Fradkin","Inhomogeneous superconducting phases in the frustrated Kondo-Heisenberg
  chain","16 pages, 1 figure, 39 references; v2 with a new paragraph. Published
  version","Physical Review B 87, 245102 (2013)","10.1103/PhysRevB.87.245102",,"cond-mat.str-el","http://arxiv.org/licenses/nonexclusive-distrib/1.0/","  We use bosonization and renormalization group methods to determine the ground
state phase diagram of a one-dimensional frustrated Kondo-Heisenberg system
consisting of a one-dimensional spin-1/2 Luttinger liquid coupled by a Kondo
exchange interaction $J_K$ to a frustrated quantum antiferromagnetic Heisenberg
chain, with a nearest-neighbor exchange coupling $J_1$ and a
next-nearest-neighbor (frustrating) exchange interaction $J_2$. We analyze the
interplay of quantum frustration in the antiferromagnetic chain with the Kondo
exchange coupling $J_K$ with the Luttinger liquid. We discuss the structure of
the phase diagram of this system as a function of the ratios $J_K/J_1$,
$J_2/J_1$ and of the parameters of the Luttinger liquid. In particular we
discuss in detail the regimes in which a pair-density-wave state may be
realized and its relation with the spin correlations in the frustrated
antiferromagnetic chain.
","[{""version"":""v1"",""created"":""Thu, 18 Apr 2013 21:08:26 GMT""},{""version"":""v2"",""created"":""Fri, 7 Jun 2013 15:04:48 GMT""}]","2013-06-10"
"1304.5257","Michael Hansen","Michael Hansen, Robert L. Goldstone, Andrew Lumsdaine","What Makes Code Hard to Understand?","19 pages, 2 figures",,,,"cs.SE","http://arxiv.org/licenses/nonexclusive-distrib/1.0/","  What factors impact the comprehensibility of code? Previous research suggests
that expectation-congruent programs should take less time to understand and be
less prone to errors. We present an experiment in which participants with
programming experience predict the exact output of ten small Python programs.
We use subtle differences between program versions to demonstrate that
seemingly insignificant notational changes can have profound effects on
correctness and response times. Our results show that experience increases
performance in most cases, but may hurt performance significantly when
underlying assumptions about related code statements are violated.
","[{""version"":""v1"",""created"":""Thu, 18 Apr 2013 21:12:06 GMT""},{""version"":""v2"",""created"":""Fri, 26 Apr 2013 16:35:15 GMT""}]","2013-04-29"
"1304.5258","Hyoungsu Baek","Hyoungsu Baek, Henri Calandra, and Laurent Demanet","Velocity estimation via registration-guided least-squares inversion","20 pages, 13 figures, 1 table",,,,"math.OC physics.geo-ph","http://arxiv.org/licenses/nonexclusive-distrib/1.0/","  This paper introduces an iterative scheme for acoustic model inversion where
the notion of proximity of two traces is not the usual least-squares distance,
but instead involves registration as in image processing. Observed data are
matched to predicted waveforms via piecewise-polynomial warpings, obtained by
solving a nonconvex optimization problem in a multiscale fashion from low to
high frequencies. This multiscale process requires defining low-frequency
augmented signals in order to seed the frequency sweep at zero frequency.
Custom adjoint sources are then defined from the warped waveforms. The proposed
velocity updates are obtained as the migration of these adjoint sources, and
cannot be interpreted as the negative gradient of any given objective function.
The new method, referred to as RGLS, is successfully applied to a few scenarios
of model velocity estimation in the transmission setting. We show that the new
method can converge to the correct model in situations where conventional
least-squares inversion suffers from cycle-skipping and converges to a spurious
model.
","[{""version"":""v1"",""created"":""Thu, 18 Apr 2013 21:15:20 GMT""}]","2013-04-22"
"1304.5259","Michael Wemyss","Osamu Iyama and Michael Wemyss","Reduction of triangulated categories and Maximal Modification Algebras
  for cA_n singularities","Some new material added to Section 5. 38 pages",,,,"math.RT math.AC math.AG","http://arxiv.org/licenses/nonexclusive-distrib/1.0/","  In this paper we define and study triangulated categories in which the
Hom-spaces have Krull dimension at most one over some base ring (hence they
have a natural 2-step filtration), and each factor of the filtration satisfies
some Calabi-Yau type property. If C is such a category, we say that C is
Calabi-Yau with dimension at most one. We extend the notion of Calabi-Yau
reduction to this setting, and prove general results which are an analogue of
known results in cluster theory.
  Such categories appear naturally in the setting of Gorenstein singularities
in dimension three as the stable categories of Cohen-Macaulay modules. We
explain the connection between Calabi-Yau reduction of $\underline{\rm CM} R$
and both partial crepant resolutions and Q-factorial terminalizations of Spec
R, and we show under quite general assumptions that Calabi-Yau reductions
exist.
  In the remainder of the paper we focus on complete local cA_n singularities
R. By using a purely algebraic argument based on Calabi-Yau reduction of
$\underline{\rm CM} R$, we give a complete classification of maximal modifying
modules in terms of the symmetric group, generalizing and strengthening results
in [BIKR] and [DH], where we do not need any restriction on the ground field.
We also describe the mutation of modifying modules at an arbitrary (not
necessarily indecomposable) direct summand. As a corollary when the field is
the complex numbers, we obtain many autoequivalences of the derived category of
the Q-factorial terminalizations of Spec R.
","[{""version"":""v1"",""created"":""Thu, 18 Apr 2013 21:27:17 GMT""},{""version"":""v2"",""created"":""Wed, 6 Nov 2013 01:30:13 GMT""}]","2013-11-07"
"1304.5260","Andrei R. Akhmetzhanov","Andrei R. Akhmetzhanov, Lee Worden, Jonathan Dushoff","Effects of mixing in threshold models of social behavior","8 pages, 6 figures",,,,"physics.soc-ph cs.SI","http://creativecommons.org/licenses/by/3.0/","  We consider the dynamics of an extension of the influential Granovetter model
of social behavior, where individuals are affected by their personal
preferences and observation of the neighbors' behavior. Individuals are
arranged in a network (usually, the square lattice) and each has a state and a
fixed threshold for behavior changes. We simulate the system asynchronously
either by picking a random individual and either update its state or exchange
it with another randomly chosen individual (mixing). We describe the dynamics
analytically in the fast-mixing limit by using the mean-field approximation and
investigate it mainly numerically in case of a finite mixing. We show that the
dynamics converge to a manifold in state space, which determines the possible
equilibria, and show how to estimate the projection of manifold by using
simulated trajectories, emitted from different initial points.
  We show that the effects of considering the network can be decomposed into
finite-neighborhood effects, and finite-mixing-rate effects, which have
qualitatively similar effects. Both of these effects increase the tendency of
the system to move from a less-desired equilibrium to the ""ground state"". Our
findings can be used to probe shifts in behavioral norms and have implications
for the role of information flow in determining when social norms that have
become unpopular (such as foot binding or female genital cutting) persist or
vanish.
","[{""version"":""v1"",""created"":""Thu, 18 Apr 2013 21:40:41 GMT""},{""version"":""v2"",""created"":""Mon, 1 Jul 2013 23:22:29 GMT""}]","2013-07-03"
"1304.5261","Yuichiro Kitajima","Yuichiro Kitajima","EPR states and Bell correlated states in algebraic quantum field theory","11 pages, to be published in Foundations of Physics",,"10.1007/s10701-013-9739-z",,"quant-ph","http://arxiv.org/licenses/nonexclusive-distrib/1.0/","  A mathematical rigorous definition of EPR states has been introduced by Arens
and Varadarajan for finite dimensional systems, and extended by Werner to
general systems. In the present paper we follow a definition of EPR states due
to Werner. Then we show that an EPR state for incommensurable pairs is Bell
correlated, and that the set of EPR states for incommensurable pairs is norm
dense between two strictly space-like separated regions.
","[{""version"":""v1"",""created"":""Thu, 18 Apr 2013 21:41:44 GMT""},{""version"":""v2"",""created"":""Wed, 8 May 2013 21:27:51 GMT""}]","2015-06-15"
"1304.5262","Jonas  Castillo Toloza","Jonas Castillo Toloza","New conjectures in number theory - The distribution of prime numbers","Este articulo pretende abrir una nueva linea de ataque al problema de
  la distribucion de los numeros primos",,,,"math.GM","http://arxiv.org/licenses/nonexclusive-distrib/1.0/","  Since the mathematicians of ancient Greece until Fermat, since Gauss until
today; the way how the primes along the numerical straight line are distributed
has become perhaps the most difficult math problem; many people believe that
their distribution is chaotic, governed only by the laws of chance. In this
article the author tries to resolve satisfactorily all matter related to the
distance between primes, based on the determination of a lower bound for the
primes counting function, the estimate of Legendre's conjecture, and the
iterative method for solving equations.
","[{""version"":""v1"",""created"":""Thu, 18 Apr 2013 21:43:04 GMT""},{""version"":""v2"",""created"":""Tue, 28 May 2013 21:13:54 GMT""}]","2013-05-30"
"1304.5263","Nikolay Tzvetkov","Mei Ming, Frederic Rousset, Nikolay Tzvetkov","Multi-solitons and related solutions for the water-waves system",,,,,"math.AP","http://arxiv.org/licenses/nonexclusive-distrib/1.0/","  The main result of this work is the construction of multi-solitons solutions
that is to say solutions that are time asymptotics to a sum of decoupling
solitary waves for the full water waves system with surface tension.
","[{""version"":""v1"",""created"":""Thu, 18 Apr 2013 21:44:53 GMT""}]","2013-04-22"
"1304.5264","C. Seshadhri","Deeparnab Chakrabarty, C. Seshadhri","An optimal lower bound for monotonicity testing over hypergrids",,,,,"cs.DS cs.DM","http://arxiv.org/licenses/nonexclusive-distrib/1.0/","  For positive integers $n, d$, consider the hypergrid $[n]^d$ with the
coordinate-wise product partial ordering denoted by $\prec$. A function $f:
[n]^d \mapsto \mathbb{N}$ is monotone if $\forall x \prec y$, $f(x) \leq f(y)$.
A function $f$ is $\eps$-far from monotone if at least an $\eps$-fraction of
values must be changed to make $f$ monotone. Given a parameter $\eps$, a
\emph{monotonicity tester} must distinguish with high probability a monotone
function from one that is $\eps$-far.
  We prove that any (adaptive, two-sided) monotonicity tester for functions
$f:[n]^d \mapsto \mathbb{N}$ must make $\Omega(\eps^{-1}d\log n - \eps^{-1}\log
\eps^{-1})$ queries. Recent upper bounds show the existence of $O(\eps^{-1}d
\log n)$ query monotonicity testers for hypergrids. This closes the question of
monotonicity testing for hypergrids over arbitrary ranges. The previous best
lower bound for general hypergrids was a non-adaptive bound of $\Omega(d \log
n)$.
","[{""version"":""v1"",""created"":""Thu, 18 Apr 2013 21:48:43 GMT""}]","2013-04-22"
"1304.5265","Doerte Blume","X. Y. Yin and D. Blume","Small two-component Fermi gases in a cubic box with periodic boundary
  conditions","11 pages, 4 figures","Phys. Rev. A 87, 063609 (2013)","10.1103/PhysRevA.87.063609",,"cond-mat.quant-gas","http://arxiv.org/licenses/nonexclusive-distrib/1.0/","  The properties of two-component Fermi gases become universal if the
interspecies s-wave scattering length $a_s$ and the average interparticle
spacing are much larger than the range of the underlying two-body potential.
Using an explicitly correlated Gaussian basis set expansion approach, we
determine the eigen energies of two-component Fermi gases in a cubic box with
periodic boundary conditions as functions of the interspecies s-wave scattering
length and the effective range of the two-body potential. The universal
properties of systems consisting of up to four particles are determined by
extrapolating the finite-range energies to the zero-range limit. We determine
the eigen energies of states with vanishing and finite momentum. In the
weakly-attractive BCS regime, we analyze the energy spectra and degeneracies
using first-order degenerate perturbation theory. Excellent agreement between
the perturbative energy shifts and the numerically determined energies is
obtained. For the infinitely large scattering length case, we compare our
results - where available - with those presented in the literature.
","[{""version"":""v1"",""created"":""Thu, 18 Apr 2013 21:49:07 GMT""}]","2015-06-15"
"1304.5266","Nami Mowlavi","N. Mowlavi, F. Barblan, S. Saesen, L. Eyer","Stellar variability in open clusters. I. A new class of variable stars
  in NGC 3766","Accepted for publication in A&A. Size of pdf file ~7Mo. Figures 12,
  13, 14 and in the Appendix are of lower quality. Full quality images
  published in A&A",,"10.1051/0004-6361/201321065",,"astro-ph.SR","http://arxiv.org/licenses/nonexclusive-distrib/1.0/","  Aims. We analyze the population of periodic variable stars in the open
cluster NGC 3766 based on a 7-year multi-band monitoring campaign conducted on
the 1.2 m Swiss Euler telescope at La Silla, Chili.
  Methods. The data reduction, light curve cleaning and period search
procedures, combined with the long observation time line, allow us to detect
variability amplitudes down to the milli-magnitude level. The variability
properties are complemented with the positions in the color-magnitude and
color-color diagrams to classify periodic variable stars into distinct
variability types.
  Results. We find a large population (36 stars) of new variable stars between
the red edge of slowly pulsating B (SPB) stars and the blue edge of delta Sct
stars, a region in the Hertzsprung-Russell (HR) diagram where no pulsation is
predicted to occur based on standard stellar models. The bulk of their periods
ranges from 0.1 to 0.7 d, with amplitudes between 1 and 4 mmag for the majority
of them. About 20% of stars in that region of the HR diagram are found to be
variable, but the number of members of this new group is expected to be higher,
with amplitudes below our milli-magnitude detection limit.
  The properties of this new group of variable stars are summarized, and
arguments set forth in favor of a pulsation origin of the variability, with
g-modes sustained by stellar rotation. Potential members of this new class of
low-amplitude periodic (most probably pulsating) A and late-B variables in the
literature are discussed.
  We additionally identify 16 eclipsing binary, 13 SPB, 14 delta Sct and 12
gamma Dor candidates, as well as 72 fainter periodic variables. All are new
discoveries.
  Conclusions. We encourage to search for the existence of this new class of
variables in other young open clusters, especially in those hosting a rich
population of Be stars.
","[{""version"":""v1"",""created"":""Thu, 18 Apr 2013 21:54:11 GMT""},{""version"":""v2"",""created"":""Wed, 1 May 2013 19:51:21 GMT""}]","2015-06-15"
"1304.5267","Anton Souslov","Anton Souslov, D. Zeb Rocklin, and Paul M. Goldbart","Organization of strongly interacting directed polymer liquids in the
  presence of stringent constraints","5 pages, 2 figures","Phys. Rev. Lett. 111, 096401 (2013)","10.1103/PhysRevLett.111.096401",,"cond-mat.soft cond-mat.stat-mech","http://arxiv.org/licenses/nonexclusive-distrib/1.0/","  The impact of impenetrable obstacles on the energetics and equilibrium
structure of strongly repulsive directed polymers is investigated. As a result
of the strong interactions, regions of severe polymer depletion and excess are
found in the vicinity of the obstacle, and the associated free-energy cost is
found to scale quadratically with the average polymer density. The
polymer-polymer interactions are accounted for via a sequence of
transformations: from the 3D line liquid to a 2D fluid of Bose particles to a
2D composite fermion fluid and, finally, to a 2D one-component plasma. The
results presented here are applicable to a range of systems consisting of
noncrossing directed lines.
","[{""version"":""v1"",""created"":""Thu, 18 Apr 2013 21:54:50 GMT""},{""version"":""v2"",""created"":""Wed, 28 Aug 2013 20:38:05 GMT""}]","2013-08-30"
"1304.5268","Greg\'orio Silva Neto","Hil\'ario Alencar, Greg\'orio Silva Neto, Detang Zhou","Eigenvalue estimates for a class of elliptic differential operators on
  compact manifolds","31 pages. To appear in Bulletin of the Brazilian Mathematical
  Society, New Series. Final version attending the suggestions of referee","Bull. Brazilian Math. Soc., New Series, Volume 46 (2015), Issue 3,
  pp 491-514","10.1007/s00574-015-0102-1",,"math.DG","http://arxiv.org/licenses/nonexclusive-distrib/1.0/","  The motivation of this paper is to study a second order elliptic operator
which appears naturally in Riemannian geometry, for instance in the study of
hypersurfaces with constant $r$-mean curvature. We prove a generalized
Bochner-type formula for such a kind of operators and as applications we obtain
some sharp estimates for the first nonzero eigenvalues in two special cases.
These results can be considered as generalizations of the Lichnerowicz-Obata
Theorem.
","[{""version"":""v1"",""created"":""Thu, 18 Apr 2013 22:00:22 GMT""},{""version"":""v2"",""created"":""Sun, 29 Mar 2015 04:15:36 GMT""}]","2017-04-13"
