"1304.5325","Teppei Katori Dr.","Teppei Katori (MiniBooNE and SciBooNE Collaborations)","Cross section analyses in MiniBooNE and SciBooNE experiments","6 pages, 6 figures, proceedings of the 8th International Workshop on
  Neutrino-Nucleus Interactions in the Few-GeV Region (NuInt12), Rio de
  Janeiro, Brazil, 22-27 October 2012",,,,"hep-ex","http://arxiv.org/licenses/nonexclusive-distrib/1.0/","  The MiniBooNE experiment (2002-2012) and the SciBooNE experiment (2007-2008)
are modern high statistics neutrino experiments, and they developed many new
ideas in neutrino cross section analyses. In this note, I discuss selected
topics of these analyses.
","[{""version"":""v1"",""created"":""Fri, 19 Apr 2013 06:46:46 GMT""}]","2013-04-22"
"1304.5326","Kumiko Kotera","Kumiko Kotera, E. Sterl Phinney, Angela V. Olinto","Signatures of pulsars in the light curves of newly formed supernova
  remnants","10 pages, 9 figures, accepted by MNRAS",,"10.1093/mnras/stt680",,"astro-ph.HE","http://arxiv.org/licenses/nonexclusive-distrib/1.0/","  We explore the effect of pulsars, in particular those born with millisecond
periods, on their surrounding supernova ejectas. While they spin down,
fast-spinning pulsars release their tremendous rotational energy in the form of
a relativistic magnetized wind that can affect the dynamics and luminosity of
the supernova. We estimate the thermal and non thermal radiations expected from
these specific objects, concentrating at times a few years after the onset of
the explosion. We find that the bolometric light curves present a high
luminosity plateau (that can reach $10^{43-44}\,$erg/s) over a few years. An
equally bright TeV gamma-ray emission, and a milder X-ray peak (of order
$10^{40-42}\,$erg/s) could also appear a few months to a few years after the
explosion, as the pulsar wind nebula emerges, depending on the injection
parameters. The observations of these signatures by following the emission of a
large number of supernovae could have important implications for the
understanding of core-collapse supernovae and reveal the nature of the remnant
compact object.
","[{""version"":""v1"",""created"":""Fri, 19 Apr 2013 06:49:52 GMT""}]","2015-06-15"
"1304.5327","Jessy Jose","Jessy Jose, A.K. Pandey, M.R. Samal, D.K. Ojha, K. Ogura, J.S. Kim, N.
  Kobayashi, A. Goyal, N. Chauhan and C. Eswaraiah","Young stellar population and ongoing star formation in the HII complex
  Sh2-252","19 pages, 13 figures, Accepted for publication in MNRAS",,"10.1093/mnras/stt700",,"astro-ph.SR","http://arxiv.org/licenses/nonexclusive-distrib/1.0/","  In this paper an extensive survey of the star forming complex Sh2-252 has
been undertaken with an aim to explore its hidden young stellar population as
well as to understand the structure and star formation history. This complex is
composed of five embedded clusters associated with the sub-regions A, C, E, NGC
2175s and Teu 136. Using 2MASS-NIR and Spitzer-IRAC, MIPS photometry we
identified 577 young stellar objects (YSOs), of which, 163 are Class I, 400 are
Class II and 14 are transition disk YSOs. Spatial distribution of the candidate
YSOs shows that they are mostly clustered around the sub-regions in the western
half of the complex, suggesting enhanced star formation activity towards its
west. Using the spectral energy distribution and optical colour-magnitude
diagram based age analyses, we derived probable evolutionary status of the
sub-regions of Sh2-252. Our analysis shows that the region A is the youngest (~
0.5 Myr), the regions B, C and E are of similar evolutionary stage (~ 1-2 Myr)
and the clusters NGC 2175s and Teu 136 are slightly evolved (~ 2-3 Myr).
Morphology of the region in the 1.1 mm map shows a semi-circular shaped
molecular shell composed of several clumps and YSOs bordering the western
ionization front of Sh2-252. Our analyses suggest that next generation star
formation is currently under way along this border and that possibly
fragmentation of the matter collected during the expansion of the HII region as
one of the major processes responsible for such stars. We observed the densest
concentration of YSOs (mostly Class I, ~ 0.5 Myr) at the western outskirts of
the complex, within a molecular clump associated with water and methanol masers
and we suggest that it is indeed a site of cluster formation at a very early
evolutionary stage, sandwiched between the two relatively evolved CHII regions
A and B.
","[{""version"":""v1"",""created"":""Fri, 19 Apr 2013 06:59:57 GMT""}]","2015-06-15"
"1304.5328","Leonid Bedratyuk P.","Leonid Bedratyuk and Nadia Ilash","The degree of the algebra of covariants of a binary form","9 pages","Journal of Commutative Algebra, Vol.7, Number 4, 2015, 459-472",,,"math.RA math.AC math.AG","http://arxiv.org/licenses/nonexclusive-distrib/1.0/","  We calculate the degree of the algebra of covariants $\mathcal{C}_d$ for
binary $d$-form. Also, for the degree we obtain its integral representation and
asymptotic behavior.
","[{""version"":""v1"",""created"":""Fri, 19 Apr 2013 07:03:12 GMT""}]","2019-08-27"
"1304.5329","Ardavan Oskooi","Ardavan Oskooi, Yoshinori Tanaka, Susumu Noda","Tandem Photonic-Crystal Thin Films Surpassing Lambertian Light-Trapping
  Limit over Broad Bandwidth and Angular Range",,"Appl. Phys. Lett. 104, 091121 (2014)","10.1063/1.4867892",,"physics.optics","http://arxiv.org/licenses/nonexclusive-distrib/1.0/","  Random surface texturing of an optically-thick film to increase the path
length of scattered light rays, first proposed nearly thirty years ago, has
thus far remained the most effective approach for photon absorption over the
widest set of conditions. Here using recent advances in computational
electrodynamics we describe a general strategy for the design of a silicon thin
film applicable to photovoltaic cells based on a quasi-resonant approach to
light trapping where two partially-disordered photonic-crystal slabs, stacked
vertically on top of each other, have large absorption that surpasses the
Lambertian limit over a broad bandwidth and angular range.
","[{""version"":""v1"",""created"":""Fri, 19 Apr 2013 07:07:33 GMT""},{""version"":""v2"",""created"":""Mon, 20 May 2013 09:29:22 GMT""},{""version"":""v3"",""created"":""Wed, 11 Dec 2013 04:07:46 GMT""}]","2014-03-06"
"1304.5330","Li-Zhao You","Lizhao You, Zimu Yuan, Bin Tang, Guihai Chen","Minimum Latency Broadcast Scheduling in Single-Radio Multi-Channel
  Wireless Ad-Hoc Networks","6 pages, 2 figures",,,,"cs.NI","http://creativecommons.org/licenses/by-nc-sa/3.0/","  We study the minimum latency broadcast scheduling (MLBS) problem in
Single-Radio Multi-Channel (SR-MC) wireless ad-hoc networks (WANETs), which are
modeled by Unit Disk Graphs. Nodes with this capability have their fixed
reception channels, but can switch their transmission channels to communicate
with their neighbors. The single-radio and multi-channel model prevents
existing algorithms for single-channel networks achieving good performance.
First, the common assumption that one transmission reaches all the neighboring
nodes does not hold naturally. Second, the multi-channel dimension provides new
opportunities to schedule the broadcast transmissions in parallel. We show MLBS
problem in SR-MC WANETs is NP-hard, and present a benchmark algorithm: Basic
Transmission Scheduling (BTS), which has approximation ratio of 4k + 12. Here k
is the number of orthogonal channels in SR-MC WANETs. Then we propose an
Enhanced Transmission Scheduling (ETS) algorithm, improving the approximation
ratio to k + 23. Simulation results show that ETS achieves better performance
over BTS, and the performance of ETS approaches the lower bound.
","[{""version"":""v1"",""created"":""Fri, 19 Apr 2013 07:15:05 GMT""}]","2013-04-22"
"1304.5331","Omar Mustafa","Omar Mustafa","On the nonlinear dynamics of a position-dependent mass-driven
  Duffing-type oscillator: Lagrange and Newton equations' equivalence","4 pages","Journal of Physics A-Mathematical and Theoretical,:46
  (2013):368001","10.1088/1751-8113/46/36/368001",,"physics.class-ph","http://arxiv.org/licenses/nonexclusive-distrib/1.0/","  Using a generalized coordinate along with a proper invertible coordinate
transformation, we show that the Euler-Lagrange equation used by Bagchi et al.
16 is in clear violation of the Hamilton's principle. We also show that
Newton's equation of motion they have used is not in a form that satisfies the
dynamics of position-dependent mass (PDM) settings.. The equivalence between
Euler-Lagrange's and Newton's equations is now proved and documented through
the proper invertible coordinate transformation and the introduction of a new
PDM byproducted reaction-type force. The total mechanical energy for the PDM is
shown to be conservative (i.e., dE/dt=0, unlike Bagchi et al.'s 16
observation).
","[{""version"":""v1"",""created"":""Fri, 19 Apr 2013 07:24:36 GMT""}]","2013-09-17"
"1304.5332","Angela White","Angela C. White, Brian P. Anderson and Vanderlei S. Bagnato","Vortices and turbulence in trapped atomic condensates",,,"10.1073/pnas.1312737110",,"cond-mat.quant-gas physics.flu-dyn","http://arxiv.org/licenses/nonexclusive-distrib/1.0/","  After over a decade of experiments generating and studying the physics of
quantized vortices in atomic gas Bose-Einstein condensates, research is
beginning to focus on the roles of vortices in quantum turbulence, as well as
other measures of quantum turbulence in atomic condensates. Such research
directions have the potential to uncover new insights into quantum turbulence,
vortices and superfluidity, and also explore the similarities and differences
between quantum and classical turbulence in entirely new settings. Here we
present a critical assessment of theoretical and experimental studies in this
emerging field of quantum turbulence in atomic condensates.
","[{""version"":""v1"",""created"":""Fri, 19 Apr 2013 07:38:57 GMT""},{""version"":""v2"",""created"":""Mon, 28 Oct 2013 19:25:38 GMT""}]","2015-06-15"
"1304.5333","Etienne Memin","Etienne M\'emin","Fluid flow dynamics under location uncertainty",,,"10.1080/03091929.2013.836190",,"physics.flu-dyn","http://arxiv.org/licenses/nonexclusive-distrib/1.0/","  We present a derivation of a stochastic model of Navier Stokes equations that
relies on a decomposition of the velocity fields into a differentiable drift
component and a time uncorrelated uncertainty random term. This type of
decomposition is reminiscent in spirit to the classical Reynolds decomposition.
However, the random velocity fluctuations considered here are not
differentiable with respect to time, and they must be handled through
stochastic calculus. The dynamics associated with the differentiable drift
component is derived from a stochastic version of the Reynolds transport
theorem. It includes in its general form an uncertainty dependent ""subgrid""
bulk formula that cannot be immediately related to the usual Boussinesq eddy
viscosity assumption constructed from thermal molecular agitation analogy. This
formulation, emerging from uncertainties on the fluid parcels location,
explains with another viewpoint some subgrid eddy diffusion models currently
used in computational fluid dynamics or in geophysical sciences and paves the
way for new large-scales flow modelling. We finally describe an applications of
our formalism to the derivation of stochastic versions of the Shallow water
equations or to the definition of reduced order dynamical systems.
","[{""version"":""v1"",""created"":""Fri, 19 Apr 2013 07:45:38 GMT""},{""version"":""v2"",""created"":""Wed, 21 Aug 2013 12:18:16 GMT""}]","2015-06-15"
"1304.5334","Seung Min Yu","Seung Min Yu and Seong-Lyun Kim","Optimization of Spectrum Allocation and Subsidization in Mobile
  Communication Services","This paper has been withdrawn by the author due to some errors in the
  proof",,,,"cs.GT cs.NI","http://arxiv.org/licenses/nonexclusive-distrib/1.0/","  Mobile traffic explosion causes spectrum shortage and polarization of data
usage among users, which will eventually decrease user welfare in mobile
communication services. Governments around the world are planning to make more
spectrum available for mobile broadband use, and the key policy issue is to
find an efficient spectrum allocation method that will improve user welfare. In
this paper, we propose a data subsidy scheme where the regulator offers a
spectrum price discount to mobile network operators (MNOs) in return for
imposing the responsibility of providing a predefined data amount to users free
of charge. To analyze the subsidy effect, we adopt the two-stage approach of
Cournot and Bertrand competition, and find a Nash equilibrium of the
competition. An interesting observation is that the increase in user welfare
does not involve MNO profit loss and the increasing amount is higher than the
regulator's expenses for implementing the data subsidy scheme. The most of the
paper is for the duopoly competition, which is extended to the general case,
finally.
","[{""version"":""v1"",""created"":""Fri, 19 Apr 2013 08:08:17 GMT""},{""version"":""v2"",""created"":""Fri, 26 Jul 2013 08:25:35 GMT""},{""version"":""v3"",""created"":""Sun, 3 Aug 2014 07:44:47 GMT""}]","2014-08-05"
"1304.5335","Ivan Vartaniants","Ivan A. Vartanyants and Oleksandr M. Yefanov","Coherent X-ray Diffraction Imaging of Nanostructures","51 pages, 14 figures, 99 references, this is a review Chapter for a
  book: X-Ray Diffraction: Modern Experimental Techniques, edited by O.H. Seeck
  and B.M. Murphy",,,,"cond-mat.mes-hall cond-mat.mtrl-sci","http://arxiv.org/licenses/nonexclusive-distrib/1.0/","  We present here an overview of Coherent X-ray Diffraction Imaging (CXDI) with
its application to nanostructures. This imaging approach has become especially
important recently due to advent of X-ray Free-Electron Lasers (XFEL) and its
applications to the fast developing technique of serial X-ray crystallography.
We start with the basic description of coherent scattering on the finite size
crystals. The difference between conventional crystallography applied to large
samples and coherent scattering on the finite size samples is outlined. The
formalism of coherent scattering from a finite size crystal with a strain field
is considered. Partially coherent illumination of a crystalline sample is
developed. Recent experimental examples demonstrating applications of CXDI to
the study of crystalline structures on the nanoscale, including experiments at
FELs, are also presented.
","[{""version"":""v1"",""created"":""Fri, 19 Apr 2013 08:23:55 GMT""}]","2013-04-22"
"1304.5336","Thomas Dover","Thomas P. Dover","Legacy Forensics: An Emerging Challenge",,,,,"cs.CR","http://arxiv.org/licenses/nonexclusive-distrib/1.0/","  With the passage of time and as new types of storage devices are introduced
into the marketplace, contemporary devices will slowly lose their compatibility
with current operating systems and PC hardware. As a result, such legacy
devices will pose an analytical challenge to the field of digital forensics.
Dated technology, while still fully functional, is becoming increasingly
incompatible with most contemporary computing hardware and software and thus
cannot be properly examined in present-day digital forensic environments. This
fact will not be lost on those who utilize legacy hardware to commit criminal
acts. This paper describes the technical challenge of accessing legacy devices
by describing an effort to resuscitate a Bernoulli Drive, a portable storage
device manufactured in 1983 by Iomega Corporation. A number of lessons-learned
are provided and the implication of legacy devices to digital forensic science
is discussed.
","[{""version"":""v1"",""created"":""Fri, 19 Apr 2013 08:26:01 GMT""}]","2013-04-22"
"1304.5337","Hsuan-Ku Liu","Hsuan-Ku Liu","The Convexity of the Free Boundary for the American put option",,,,,"q-fin.CP q-fin.GN","http://arxiv.org/licenses/nonexclusive-distrib/1.0/","  This paper studies the parabolic free boundary problem arising from pricing
American-style put options on an asset whose index follows a geometric Brownian
motion process. The contribution is to propose a condition for that the early
exercise boundary is a convex function.
","[{""version"":""v1"",""created"":""Fri, 19 Apr 2013 08:27:21 GMT""},{""version"":""v2"",""created"":""Mon, 23 Jun 2014 02:58:23 GMT""},{""version"":""v3"",""created"":""Thu, 25 Sep 2014 15:37:58 GMT""},{""version"":""v4"",""created"":""Thu, 16 Oct 2014 19:51:05 GMT""},{""version"":""v5"",""created"":""Sat, 1 Nov 2014 17:35:12 GMT""},{""version"":""v6"",""created"":""Sat, 6 Dec 2014 03:32:58 GMT""},{""version"":""v7"",""created"":""Sun, 9 Apr 2017 18:25:12 GMT""}]","2017-04-11"
"1304.5338","Robert Wilson","Robert A. Wilson","Classification of subgroups isomorphic to PSL_2(27) in the Monster","12 pages","LMS J. Comput. Math. 17 (2014) 33-46","10.1112/S1461157013000247",,"math.GR","http://arxiv.org/licenses/nonexclusive-distrib/1.0/","  We prove that the Monster does not contain any subgroup isomorphic to
PSL_2(27).
","[{""version"":""v1"",""created"":""Fri, 19 Apr 2013 08:28:11 GMT""}]","2019-02-20"
"1304.5339","Ulf-G. Mei{\ss}ner","J. Haidenbauer, S. Petschauer, N. Kaiser, U.-G. Mei{\ss}ner, A. Nogga,
  W. Weise","Hyperon-nucleon interaction at next-to-leading order in chiral effective
  field theory","29 pages, 14 figures, uses elsarticle.cls and elsart3p.cls","Nucl. Phys. A 915 (2013) 24-58","10.1016/j.nuclphysa.2013.06.008",,"nucl-th hep-ex hep-lat hep-ph","http://arxiv.org/licenses/nonexclusive-distrib/1.0/","  Results for the Lambda N and Sigma N interactions obtained at next-to-leading
order in chiral effective field theory are reported. At the order considered
there are contributions from one- and two-pseudoscalar-meson exchange diagrams
and from four-baryon contact terms without and with two derivatives. SU(3)
flavor symmetry is imposed for constructing the hyperon-nucleon interaction
while the explicit SU(3) symmetry breaking by the physical masses of the
pseudoscalar mesons (pi, K, eta) is taken into account. An excellent
description of the hyperon-nucleon system can be achieved at next-to-leading
order. It is on the same level of quality as the one obtained by the most
advanced phenomenological hyperon-nucleon interaction models.
","[{""version"":""v1"",""created"":""Fri, 19 Apr 2013 08:42:53 GMT""}]","2013-07-10"
"1304.5340","Lars Bonnes","Lars Bonnes and Hannes Pichler and Andreas M. L\""auchli","An entropy perspective on the thermal crossover in a fermionic Hubbard
  chain","8 pages, 6 figures","Phys. Rev. B 88, 155103 (2013)","10.1103/PhysRevB.88.155103",,"cond-mat.str-el cond-mat.quant-gas","http://arxiv.org/licenses/nonexclusive-distrib/1.0/","  We study the Renyi entropy in the finite temperature crossover regime of a
Hubbard chain using quantum Monte Carlo. The ground state entropy has
characteristic features such as a logarithmic divergence with block size and
$2\kF$ oscillations that are a hallmark of its Luttinger liquid nature. The
interplay between the (extensive) thermal entropy and the ground state features
is studied and we analyze the temperature induced decay of the amplitude of the
oscillations as well as the scaling of the purity. Furthermore, we show how the
spin and charge velocities can be extracted from the temperature dependence of
the Renyi entropy, bridging our findings to recent experimental proposals on
how to implement the measurement of Renyi entropies in cold atom system.
Studying the Renyi mutual information, we also demonstrate how constraints such
as particle number conservation can induce persistent correlations visible in
the mutual information even at high temperature.
","[{""version"":""v1"",""created"":""Fri, 19 Apr 2013 08:43:08 GMT""}]","2014-03-19"
"1304.5341","Robert Georgii Dr.","T. Weber, G. Brandl, R. Georgii, W. H\""au{\ss}ler, S. Weichselbaumer
  and P. B\""oni","Monte-Carlo Simulations for the optimisation of a TOF-MIEZE Instrument",,"Nuclear instruments and Methods in Physics Research A713 (2013)
  71-7","10.1016/j.nima.2013.03.010",,"physics.ins-det","http://arxiv.org/licenses/nonexclusive-distrib/1.0/","  The MIEZE (Modulation of Intensity with Zero Effort) technique is a variant
of neutron resonance spin echo (NRSE), which has proven to be a unique neutron
scattering technique for measuring with high energy resolution in magnetic
fields. Its limitations in terms of flight path differences have already been
investigated analytically for neutron beams with vanishing divergence. In the
present work Monte-Carlo simulations for quasi-elastic MIEZE experiments taking
into account beam divergence as well as the sample dimensions are presented.
One application of the MIEZE technique could be a dedicated NRSE-MIEZE
instrument at the European Spallation Source (ESS) in Sweden. The optimisation
of a particular design based on Montel mirror optics with the help of Monte
Carlo simulations will be discussed here in detail.
","[{""version"":""v1"",""created"":""Fri, 19 Apr 2013 08:47:36 GMT""}]","2013-04-22"
"1304.5342","Oliver Schnetz","Francis Brown and Oliver Schnetz","Modular forms in Quantum Field Theory","27 pages",,,,"math.AG hep-th","http://arxiv.org/licenses/nonexclusive-distrib/1.0/","  The amplitude of a Feynman graph in Quantum Field Theory is related to the
point-count over finite fields of the corresponding graph hypersurface. This
article reports on an experimental study of point counts over F_q modulo q^3,
for graphs up to loop order 10. It is found that many of them are given by
Fourier coefficients of modular forms of weights <=8 and levels <=17.
","[{""version"":""v1"",""created"":""Fri, 19 Apr 2013 08:47:39 GMT""},{""version"":""v2"",""created"":""Thu, 27 Jun 2013 09:36:11 GMT""}]","2013-06-28"
"1304.5343","Prasad Subramanian Dr","Arun Babu, H. M. Antia, S. R. Dugad, S. K. Gupta, Y. Hayashi, S.
  Kawakami, P. K. Mohanty, T. Nonaka, A. Oshima, P. Subramanian","High rigidity Forbush decreases: due to CMEs or shocks?","Accepted for publication in Astronomy and Astrophysics","A&A 555, A139 (2013)","10.1051/0004-6361/201220830",,"astro-ph.SR astro-ph.EP astro-ph.HE","http://arxiv.org/licenses/nonexclusive-distrib/1.0/","  We seek to identify the primary agents causing Forbush decreases (FDs)
observed at the Earth in high rigidity cosmic rays. In particular, we ask if
such FDs are caused mainly by coronal mass ejections (CMEs) from the Sun that
are directed towards the Earth, or by their associated shocks. We use the muon
data at cutoff rigidities ranging from 14 to 24 GV from the GRAPES-3 tracking
muon telescope to identify FD events. We select those FD events that have a
reasonably clean profile, and can be reasonably well associated with an
Earth-directed CME and its associated shock. We employ two models: one that
considers the CME as the sole cause of the FD (the CME-only model) and one that
considers the shock as the only agent causing the FD (the shock-only model). We
use an extensive set of observationally determined parameters for both these
models. The only free parameter in these models is the level of MHD turbulence
in the sheath region, which mediates cosmic ray diffusion (into the CME, for
the CME-only model and across the shock sheath, for the shock-only model).
  We find that good fits to the GRAPES-3 multi-rigidity data using the CME-only
model require turbulence levels in the CME sheath region that are only slightly
higher than those estimated for the quiet solar wind. On the other hand,
reasonable model fits with the shock-only model require turbulence levels in
the sheath region that are an order of magnitude higher than those in the quiet
solar wind.
  This observation naturally leads to the conclusion that the Earth-directed
CMEs are the primary contributors to FDs observed in high rigidity cosmic rays.
","[{""version"":""v1"",""created"":""Fri, 19 Apr 2013 08:48:09 GMT""}]","2016-11-03"
"1304.5344","Pablo San-Jose","Pablo San-Jose and Elsa Prada","Helical networks in twisted bilayer graphene under interlayer bias","Published version, including new results on the manipulation of the
  helical network. 7 pages, 5 figures","Phys. Rev. B 88, 121408(R) (2013)","10.1103/PhysRevB.88.121408",,"cond-mat.mes-hall cond-mat.mtrl-sci","http://arxiv.org/licenses/nonexclusive-distrib/1.0/","  A twisted graphene bilayer exhibits a triangular Moir\'e pattern in the local
stacking, that smoothly alternates between the three basic types AA', AB' and
BA'. Under an interlayer bias U, the latter two types develop a spectral gap,
characterised by opposite valley Chern numbers. We show that for large enough
Moir\'e periods and bias, these regions become depleted electronically, and
topologically protected helical modes appear at their boundaries. This gives
rise to a delocalised topological network of the Chalker-Coddington type,
composed of valley current vortices. This network can be tailored by controlled
deposition of valley-mixing adsorbates, which block transmission in selected
links, thus opening the possibility of custom topological nanoelectronics.
","[{""version"":""v1"",""created"":""Fri, 19 Apr 2013 08:58:33 GMT""},{""version"":""v2"",""created"":""Thu, 18 Jul 2013 14:21:24 GMT""},{""version"":""v3"",""created"":""Wed, 25 Sep 2013 13:09:29 GMT""}]","2013-09-26"
