"1304.7597","Sandipan Sengupta","Sandipan Sengupta","Gravity Asymptotics with Topological Parameters","References added; Published version","Phys. Rev. D 88, 024031 (2013)","10.1103/PhysRevD.88.024031",,"gr-qc hep-th","http://arxiv.org/licenses/nonexclusive-distrib/1.0/","  In four dimensional gravity theory, the Barbero-Immirzi parameter has a
topological origin, and can be identified as the coefficient multiplying the
Nieh-Yan topological density in the gravity Lagrangian, as proposed by Date et
al.[1]. Based on this fact, a first order action formulation for spacetimes
with boundaries is introduced. The bulk Lagrangian, containing the Nieh-Yan
density, needs to be supplemented with suitable boundary terms so that it leads
to a well-defined variational principle. Within this general framework, we
analyse spacetimes with and without a cosmological constant.
  For locally Anti de Sitter (or de Sitter) asymptotia, the action principle
has non-trivial implications. It admits an extremum for all such solutions
provided the SO(3,1) Pontryagin and Euler topological densities are added to it
with fixed coefficients. The resulting Lagrangian, while containing all three
topological densities, has only one independent topological coupling constant,
namely, the Barbero-Immirzi parameter. In the final analysis, it emerges as a
coefficient of the SO(3,2) (or SO(4,1)) Pontryagin density, and is present in
the action only for manifolds for which the corresponding topological index is
non-zero.
","[{""version"":""v1"",""created"":""Mon, 29 Apr 2013 09:06:52 GMT""},{""version"":""v2"",""created"":""Fri, 26 Jul 2013 06:20:00 GMT""}]","2013-07-29"
"1304.7598","Thorsten Renk","Thorsten Renk","Photon Emission from a Medium-Modified Shower Evolution","5 pages, 3 figures",,"10.1103/PhysRevC.88.034902",,"hep-ph","http://arxiv.org/licenses/nonexclusive-distrib/1.0/","  Photons from the interaction of a highly energetic jet with a thermal medium
are an important contribution to the total photon yield measured in
ultrarelativistic heavy-ion collisions and also an important probe to study the
medium degrees of freedom. Previously this contribution has often been computed
in the context of a leading parton energy loss approximation. In this work,
jet-medium interaction photons are instead estimated using a medium-modified
shower evolution model, where the energy degradation due to vacuum radiation
prior to medium formation, the virtuality evolution of intermediate states and
the photon emission from subleading shower partons is taken into account
consistently. The results indicate that the leading parton energy loss
approximation does not appear to work well for photon emission from jet-medium
interaction.
","[{""version"":""v1"",""created"":""Mon, 29 Apr 2013 09:17:06 GMT""}]","2013-09-18"
"1304.7599","Giuseppe Mussardo","Giuseppe Mussardo","Expectation Values of Local Fields in an Integrable Theory after a
  Quantum Quench","The paper has been substituted by a complete new version (in terms of
  title, arguments presented, figures, references, etc) and it would misleading
  to replace the previous one or to have such two different versions",,,,"cond-mat.stat-mech hep-th","http://arxiv.org/licenses/nonexclusive-distrib/1.0/","  The expectation values of local fields of any interacting quantum theory
after a quench process are key quantities for matching theoretical and
experimental results. For quantum integrable field theories, we argue that they
can be obtained by a generalization of the Leclair-Mussardo formula and a Bethe
Ansatz result of Caux and Konik. Specializing to the Sinh-Gordon model and
taking the non-relativistic limit, one can recover the results of Kormos et al.
for the Lieb-Liniger model.
","[{""version"":""v1"",""created"":""Mon, 29 Apr 2013 09:19:33 GMT""},{""version"":""v2"",""created"":""Wed, 21 Aug 2013 09:18:27 GMT""}]","2013-08-22"
"1304.7600","Piotr Beling","Piotr Beling","C++11 - okre\'slanie typ\'ow","6 pages, in Polish",,,,"cs.PL","http://arxiv.org/licenses/nonexclusive-distrib/1.0/","  This paper presents a review of some new futures introduced to C++ language
by ISO/IEC 14882:2011 standard (known as C++11). It describes new language
elements which allow to easier expressed of types of variables: auto and
decltype keywords, new function declaration syntax, and tools which are
included in type_traits header.
  -----
  Niniejszy artyku{\l} jest jednym z serii artyku{\l}\'ow w kt\'orych zawarto
przegl{\ka}d nowych element\'ow j{\ke}zyka C++ wprowadzonych przez standard
ISO/IEC 14882:2011, znany pod nazw{\ka} C++11. W artykule przedstawiono nowe
mo\.zliwo\'sci zwi{\ka}zane ze wskazywaniem typ\'ow zmiennych. Opisano s{\l}owa
kluczowe auto i decltype, now{\ka} sk{\l}adnie deklarowania funkcji/metod oraz
narz{\ke}dzia zawarte w pliku nag{\l}\'owkowym <type_traits>.
","[{""version"":""v1"",""created"":""Mon, 29 Apr 2013 09:30:33 GMT""}]","2013-04-30"
"1304.7601","Gang Liao","Gang Liao","Uniform tail entropy for real analytic maps",,,,,"math.DS","http://arxiv.org/licenses/nonexclusive-distrib/1.0/","  Let $M$ be a compact real analytic manifold of finite dimension. There is a
function $a: (0,+\infty)\to [0,+\infty)$ with $\lim_{t\to0}a(t)=0$ such that,
the tail entropy $h^{*}(f,\varepsilon)$ of any real analytic map $f$ on $M$ is
uniformly bounded above by the scale $a(\varepsilon)$.
","[{""version"":""v1"",""created"":""Mon, 29 Apr 2013 09:41:33 GMT""},{""version"":""v2"",""created"":""Thu, 3 Sep 2020 05:21:00 GMT""}]","2020-09-04"
"1304.7602","Eric Ragoucy","Samuel Belliard, Stanislav Pakuliak, Eric Ragoucy and Nikita A.
  Slavnov","Bethe Vectors of Quantum Integrable Models with GL(3) Trigonometric
  $R$-Matrix",,"SIGMA 9 (2013), 058, 23 pages","10.3842/SIGMA.2013.058","LAPTh-20/13","math-ph cond-mat.str-el hep-th math.MP","http://creativecommons.org/licenses/by-nc-sa/3.0/","  We study quantum integrable models with GL(3) trigonometric $R$-matrix and
solvable by the nested algebraic Bethe ansatz. Using the presentation of the
universal Bethe vectors in terms of projections of products of the currents of
the quantum affine algebra $U_q(\hat{\mathfrak{gl}}_3)$ onto intersections of
different types of Borel subalgebras, we prove that the set of the nested Bethe
vectors is closed under the action of the elements of the monodromy matrix.
","[{""version"":""v1"",""created"":""Mon, 29 Apr 2013 09:45:13 GMT""},{""version"":""v2"",""created"":""Mon, 7 Oct 2013 04:24:08 GMT""}]","2013-10-08"
"1304.7603","Matthew England Dr","Russell Bradford, James H. Davenport, Matthew England, Scott McCallum
  and David Wilson","Cylindrical Algebraic Decompositions for Boolean Combinations","To appear in the proceedings of the 38th International Symposium on
  Symbolic and Algebraic Computation (ISSAC '13)","In: Proceedings of the 38th International Symposium on Symbolic
  and Algebraic Computation, (ISSAC '13), pp 125-132, 2013","10.1145/2465506.2465516",,"cs.SC","http://arxiv.org/licenses/nonexclusive-distrib/1.0/","  This article makes the key observation that when using cylindrical algebraic
decomposition (CAD) to solve a problem with respect to a set of polynomials, it
is not always the signs of those polynomials that are of paramount importance
but rather the truth values of certain quantifier free formulae involving them.
This motivates our definition of a Truth Table Invariant CAD (TTICAD). We
generalise the theory of equational constraints to design an algorithm which
will efficiently construct a TTICAD for a wide class of problems, producing
stronger results than when using equational constraints alone. The algorithm is
implemented fully in Maple and we present promising results from
experimentation.
","[{""version"":""v1"",""created"":""Mon, 29 Apr 2013 09:46:40 GMT""}]","2013-07-10"
"1304.7604","\""Ozg\""ur  \""Ozkan","Erik D. Demaine and John Iacono and Stefan Langerman and \""Ozg\""ur
  \""Ozkan","Combining Binary Search Trees","12 pages, 2 figures, ICALP 2013",,,,"cs.DS","http://arxiv.org/licenses/nonexclusive-distrib/1.0/","  We present a general transformation for combining a constant number of binary
search tree data structures (BSTs) into a single BST whose running time is
within a constant factor of the minimum of any ""well-behaved"" bound on the
running time of the given BSTs, for any online access sequence.
  (A BST has a well behaved bound with $f(n)$ overhead if it spends at most
\bigoh{f(n)} time per access and its bound satisfies a weak sense of closure
under subsequences.) In particular, we obtain a BST data structure that is
\bigoh{\log\log n} competitive, satisfies the working set bound (and thus
satisfies the static finger bound and the static optimality bound), satisfies
the dynamic finger bound, satisfies the unified bound with an additive
\bigoh{\log\log n} factor, and performs each access in worst-case \bigoh{\log
n} time.
","[{""version"":""v1"",""created"":""Mon, 29 Apr 2013 09:52:14 GMT""}]","2013-04-30"
"1304.7605","Latanya Sweeney","Latanya Sweeney, Akua Abu and Julia Winn","Identifying Participants in the Personal Genome Project by Name (A
  Re-identification Experiment)","4 pages",,,"Harvard University, Data Privacy Lab 1021-1","cs.CY","http://arxiv.org/licenses/nonexclusive-distrib/1.0/","  We linked names and contact information to publicly available profiles in the
Personal Genome Project. These profiles contain medical and genomic
information, including details about medications, procedures and diseases, and
demographic information, such as date of birth, gender, and postal code. By
linking demographics to public records such as voter lists, and mining for
names hidden in attached documents, we correctly identified 84 to 97 percent of
the profiles for which we provided names. Our ability to learn their names is
based on their demographics, not their DNA, thereby revisiting an old
vulnerability that could be easily thwarted with minimal loss of research
value. So, we propose technical remedies for people to learn about their
demographics to make better decisions.
","[{""version"":""v1"",""created"":""Mon, 29 Apr 2013 09:59:08 GMT""}]","2013-04-30"
"1304.7606","Zhi-zhong Xing","Zhi-zhong Xing","Leptonic commutators and clean T violation in neutrino oscillations","LaTeX 7 pages. More discussions added. Accepted for publication in
  PRD",,"10.1103/PhysRevD.88.017301",,"hep-ph hep-ex","http://arxiv.org/licenses/nonexclusive-distrib/1.0/","  A realistic medium- or long-baseline neutrino experiment may suffer from
terrestrial matter effects which are likely to contaminate the genuine
T-violating asymmetry between \nu_\alpha \to \nu_\beta and \nu_\beta \to
\nu_\alpha oscillations. With the help of the commutators of lepton mass
matrices in matter, we show that this kind of contamination is negligible for a
variety of experiments provided the neutrino beam energy E and the baseline
length L satisfy the condition 10^{-7} (L/km)^2 (GeV/E) << 1. The same
observation is true for the CP-violating term of the asymmetry between
\nu_\alpha \to \nu_\beta and \bar{\nu}_\alpha \to \bar{\nu}_\beta oscillations
in matter.
","[{""version"":""v1"",""created"":""Mon, 29 Apr 2013 10:02:40 GMT""},{""version"":""v2"",""created"":""Tue, 30 Apr 2013 12:39:47 GMT""},{""version"":""v3"",""created"":""Thu, 27 Jun 2013 00:10:21 GMT""}]","2015-06-15"
"1304.7607","Xiaojun Zhou","Xiaolin Tang, Chunhua Yang, Xiaojun Zhou, Weihua Gui","A Discrete State Transition Algorithm for Generalized Traveling Salesman
  Problem","8 pages, 1 figure","Advances in Global Optimization, 2015, 95:137-145","10.1007/978-3-319-08377-3__15",,"math.OC cs.AI cs.NE","http://arxiv.org/licenses/nonexclusive-distrib/1.0/","  Generalized traveling salesman problem (GTSP) is an extension of classical
traveling salesman problem (TSP), which is a combinatorial optimization problem
and an NP-hard problem. In this paper, an efficient discrete state transition
algorithm (DSTA) for GTSP is proposed, where a new local search operator named
\textit{K-circle}, directed by neighborhood information in space, has been
introduced to DSTA to shrink search space and strengthen search ability. A
novel robust update mechanism, restore in probability and risk in probability
(Double R-Probability), is used in our work to escape from local minima. The
proposed algorithm is tested on a set of GTSP instances. Compared with other
heuristics, experimental results have demonstrated the effectiveness and strong
adaptability of DSTA and also show that DSTA has better search ability than its
competitors.
","[{""version"":""v1"",""created"":""Mon, 29 Apr 2013 10:03:29 GMT""}]","2015-09-22"
"1304.7608","Patrik Wahlberg","Ren\'e Schulz and Patrik Wahlberg","The equality of the homogeneous and the Gabor wave front set","26 pages, 1 figure",,,,"math.AP math.FA","http://arxiv.org/licenses/nonexclusive-distrib/1.0/","  We prove that H\""ormander's global wave front set and Nakamura's homogeneous
wave front set of a tempered distribution coincide. In addition we construct a
tempered distribution with a given wave front set, and we develop a
pseudodifferential calculus adapted to Nakamura's homogeneous wave front set.
","[{""version"":""v1"",""created"":""Mon, 29 Apr 2013 10:05:25 GMT""},{""version"":""v2"",""created"":""Fri, 6 Sep 2013 07:35:26 GMT""},{""version"":""v3"",""created"":""Mon, 25 Jul 2016 13:57:17 GMT""}]","2016-07-26"
"1304.7609","Lorenzo Maccone","Lorenzo Maccone","Quantum metrology: why entanglement?","5 pages, 3 figures","Phys. Rev. A 88, 042109 (2013)","10.1103/PhysRevA.88.042109",,"quant-ph","http://arxiv.org/licenses/nonexclusive-distrib/1.0/","  We show why and when entanglement is needed for quantum-enhanced precision
measurements, and which type of entanglement is useful. We give a simple,
intuitive construction that shows how entanglement transforms parallel
estimation strategies into sequential ones of same precision. We employ this
argument to generalize conventional quantum metrology, to identify a class of
noise whose effects can be easily managed, and to treat the case of
indistinguishable probes (such as interferometry with light).
","[{""version"":""v1"",""created"":""Mon, 29 Apr 2013 10:10:08 GMT""}]","2013-10-16"
"1304.7610","Luciano Piersanti","A. Tornamb\'e and L. Piersanti","Pre-Explosive Observational Properties of Type Ia Supernovae","12 pages, 8 figures, 3 tables. Published on MNRAS","Tornambe', A. & Piersanti, L., 2013, MNRAS, 431, 1812","10.1093/mnras/stt295",,"astro-ph.GA astro-ph.SR","http://arxiv.org/licenses/nonexclusive-distrib/1.0/","  The evolutionary path of rotating CO WDs directly accreting CO-rich matter is
followed up to few seconds before the explosive breakout in the framework of
the Double Degenerate rotationally-driven accretion scenario.
  We find that the evolutionary properties depend only on the actual mass of
the accreting WD and not on the previous history. We determine the expected
frequency and amplitude of the gravitational wave emission, which occurs during
the mass transfer process and acts as a self-tuning mechanism of the accretion
process itself. The gravitational signal related to Galactic sources can be
easily detected with the next generation of space-born interferometers and can
provide notable constraints to the progenitor model. The expected statistical
distribution of pre-explosive objects in the Galaxy is provided also in the
effective temperature-apparent bolometric magnitude diagrams which can be used
to identify merged DD systems via UV surveys.
  We emphasize that the thermonuclear explosion occurs owing to the decay of
physical conditions keeping over-stable the structure above the classical
Chandrasekhar limit and not by a steady increase of the WD mass up to this
limit. This conclusion is independent of the evolutionary scenario for the
progenitors, but it is a direct consequence of the stabilizing effect of
rotation. Such an occurrence is epistemological change of the perspective in
defining the ignition process in accreting WDs. Moreover, this requires a long
evolutionary period (several million years) to attain the explosion after the
above mentioned conditions cease to keep stable the WD. Therefore it is
practically impossible to detect the trace of the exploding WD companion in
recent pre-explosion frames of even very near SN Ia.
","[{""version"":""v1"",""created"":""Mon, 29 Apr 2013 10:14:17 GMT""}]","2013-04-30"
"1304.7611","Liu Zhao","Dong Wang, Zhao Liu, Junpeng Cao, and Heng Fan","Tunable Band Topology Reflected by Fractional Quantum Hall States in
  Two-Dimensional Lattices","published version (6 pages, 6 figures, including a supplemental
  material)","Phys. Rev. Lett. 111, 186804 (2013)","10.1103/PhysRevLett.111.186804",,"cond-mat.str-el cond-mat.quant-gas quant-ph","http://arxiv.org/licenses/nonexclusive-distrib/1.0/","  Two-dimensional lattice models subjected to an external effective magnetic
field can form nontrivial band topologies characterized by nonzero integer band
Chern numbers. In this Letter, we investigate such a lattice model originating
from the Hofstadter model and demonstrate that the band topology transitions
can be realized by simply introducing tunable longer-range hopping. The rich
phase diagram of band Chern numbers is obtained for the simple rational flux
density and a classification of phases is presented. In the presence of
interactions, the existence of fractional quantum Hall states in both |C|=1 and
|C|>1 bands is confirmed, which can reflect the band topologies in different
phases. In contrast, when our model reduces to a one-dimensional lattice, the
ground states are crucially different from fractional quantum Hall states. Our
results may provide insights into the study of new fractional quantum Hall
states and experimental realizations of various topological phases in optical
lattices.
","[{""version"":""v1"",""created"":""Mon, 29 Apr 2013 10:14:44 GMT""},{""version"":""v2"",""created"":""Thu, 31 Oct 2013 17:23:10 GMT""}]","2013-11-01"
"1304.7612","George Lukes Gerakopoulos","Georgios Lukes-Gerakopoulos and George Contopoulos","Mind the Resonances: Final stages of accretion into bumpy black holes","10 pages, 7 figures, To appear in the proceedings of the conference,
  NEB 15 - Recent Developments in Gravity - 20-23 June 2012, Chania, Greece",,"10.1088/1742-6596/453/1/012005",,"gr-qc astro-ph.SR nlin.CD","http://arxiv.org/licenses/nonexclusive-distrib/1.0/","  In this article we discuss a possible way of testing the Kerr black hole
hypothesis by taking advantage of phenomena correlated with chaotic motion in
the final stages of an accretion disk around a bumpy black hole. We anticipate
that these phenomena should have an imprint in the electromagnetic spectrum
coming from the accretion disk.
","[{""version"":""v1"",""created"":""Mon, 29 Apr 2013 10:19:07 GMT""}]","2013-08-26"
"1304.7613","Roberto Monetti","Roberto Monetti, Wolfram Bunk, Thomas Aschenbrenner, Stephan Springer,
  and Jose Maria Amigo","Information directionality in coupled time series using transcripts","24 pages, 9 figures",,"10.1103/PhysRevE.88.022911",,"physics.data-an","http://arxiv.org/licenses/nonexclusive-distrib/1.0/","  In ordinal symbolic dynamics, transcripts describe the algebraic relationship
between ordinal patterns. Using the concept of transcript, we exploit the
mathematical structure of the group of permutations to derive properties and
relations among information measures of the symbolic representations of time
series. These theoretical results are then applied for the assessment of
coupling directionality in dynamical systems, where suitable coupling
directionality measures are introduced depending only on transcripts. These
novel measures estimate information flow in lower space dimension and reduce to
well-established coupling directionality quantifiers when some general
conditions are satisfied. Furthermore, by generalizing the definition of
transcript to ordinal patterns of different lengths, several of the commonly
used information directionality measures can be encompassed within the same
framework.
","[{""version"":""v1"",""created"":""Mon, 29 Apr 2013 10:29:15 GMT""}]","2015-06-15"
"1304.7614","Guoxin Su Mr","Guoxin Su and David S.Rosenblum","Asymptotic Bounds for Quantitative Verification of Perturbed
  Probabilistic Systems","This paper is a long version of the paper Asymptotic Bounds for
  Quantitative Verification of Perturbed Probabilistic Systems in the
  proceedings of 15th International Conference on Formal Engineering Methods",,,,"cs.SE cs.LO","http://arxiv.org/licenses/nonexclusive-distrib/1.0/","  The majority of existing probabilistic model checking case studies are based
on well understood theoretical models and distributions. However, real-life
probabilistic systems usually involve distribution parameters whose values are
obtained by empirical measurements and thus are subject to small perturbations.
In this paper, we consider perturbation analysis of reachability in the
parametric models of these systems (i.e., parametric Markov chains) equipped
with the norm of absolute distance. Our main contribution is a method to
compute the asymptotic bounds in the form of condition numbers for constrained
reachability probabilities against perturbations of the distribution parameters
of the system. The adequacy of the method is demonstrated through experiments
with the Zeroconf protocol and the hopping frog problem.
","[{""version"":""v1"",""created"":""Mon, 29 Apr 2013 10:30:42 GMT""},{""version"":""v2"",""created"":""Fri, 3 May 2013 08:57:54 GMT""},{""version"":""v3"",""created"":""Sun, 14 Jul 2013 11:29:36 GMT""},{""version"":""v4"",""created"":""Wed, 28 Aug 2013 02:29:33 GMT""}]","2013-08-29"
"1304.7615","Adrian Jackson","Adrian Jackson, Par Strand","MDMP: Managed Data Message Passing","Submitted to SC13, 10 pages, 5 figures",,,,"cs.DC cs.PL","http://arxiv.org/licenses/nonexclusive-distrib/1.0/","  MDMP is a new parallel programming approach that aims to provide users with
an easy way to add parallelism to programs, optimise the message passing costs
of traditional scientific simulation algorithms, and enable existing MPI-based
parallel programs to be optimised and extended without requiring the whole code
to be re-written from scratch. MDMP utilises a directives based approach to
enable users to specify what communications should take place in the code, and
then implements those communications for the user in an optimal manner using
both the information provided by the user and data collected from instrumenting
the code and gathering information on the data to be communicated. This work
will present the basic concepts and functionality of MDMP and discuss the
performance that can be achieved using our prototype implementation of MDMP on
some model scientific simulation applications.
","[{""version"":""v1"",""created"":""Mon, 29 Apr 2013 10:35:48 GMT""}]","2013-04-30"
"1304.7616","Partha Sarathi Chakraborty","Partha Sarathi Chakraborty and Satyajit Guin","Equivalence of Two Approaches to Yang-Mills on Non-commutative Torus",,,,,"math.OA math-ph math.MP","http://arxiv.org/licenses/nonexclusive-distrib/1.0/","  There are two notions of Yang-Mills action functional in noncommutative
geometry. We show that for noncommutative n-torus both these notions agree. We
also prove a structure theorem on the Hermitian structure of a finitely
generated projective modules over spectrally invariant subalgebras of
$C^*$-algebras.
","[{""version"":""v1"",""created"":""Mon, 29 Apr 2013 10:48:15 GMT""}]","2013-04-30"
"1304.7617","Partha Sarathi Chakraborty","Partha Sarathi Chakraborty and Satyajit Guin","Yang- Mills on Quantum Heisenberg Manifolds",,,,,"math.OA math-ph math.MP math.QA","http://arxiv.org/licenses/nonexclusive-distrib/1.0/","  In the noncommutative geometry program of Connes there are two variations of
the concept of Yang-Mills action functional. We show that for the quantum
Heisenberg manifolds they agree.
","[{""version"":""v1"",""created"":""Mon, 29 Apr 2013 10:53:24 GMT""}]","2013-04-30"
"1304.7618","Filippo Troiani","Filippo Troiani and Paolo Zanardi","On the size of linear superpositions in molecular nanomagnets",,"Phys. Rev. B 88, 094413 (2013)","10.1103/PhysRevB.88.094413",,"quant-ph cond-mat.mes-hall","http://arxiv.org/licenses/nonexclusive-distrib/1.0/","  Molecular nanomagnets are zero-dimensional spin systems, that exhibit quantum
mechanical behavior at low temperatures. Exploiting quantum-information
theoretic measures, we quantify here the size of linear superpositions that can
be generated within the ground multiplet of high- and low-spin nanomagnets.
Amongst the former class of systems, we mainly focus on Mn12 and Fe8. General
criteria for further increasing such sizes are also outlined, and illustrated
in the case of spin rings. The actual character (micro or macroscopic) of
linear superpositions in low-spin systems is inherently ill-defined. Here, this
issue is addressed with specific reference to the Cr7Ni and V15 molecules,
characterized by an S=1/2 ground state. In both cases, the measures we obtain
are larger than those of a single s=1/2 spin, but not proportionate to the
number and value of the constituent spins.
","[{""version"":""v1"",""created"":""Mon, 29 Apr 2013 11:07:44 GMT""},{""version"":""v2"",""created"":""Wed, 4 Sep 2013 14:34:37 GMT""}]","2013-09-18"
