"1304.7541","Sarah  Mayes","Sarah Mayes","The Symbolic Generic Initial System of Almost Linear Point
  Configurations in P2","11 pages; 2 figures",,,,"math.AC","http://arxiv.org/licenses/nonexclusive-distrib/1.0/","  Consider an ideal I in K[x,y,z] corresponding to a point configuration in P2
where all but one of the points lies on a single line. In this paper we study
the symbolic generic initial system obtained by taking the reverse
lexicographic generic initial ideals of the corresponding uniform fat point
ideals. We describe the limiting shape of this system of ideals and, in proving
this result, demonstrate that infinitely many of the uniform fat point ideals
are componentwise linear.
","[{""version"":""v1"",""created"":""Mon, 29 Apr 2013 00:16:38 GMT""}]","2013-04-30"
"1304.7542","Sarah  Mayes","Sarah Mayes","The Symbolic Generic Initial System of Points on an Irreducible Conic","6 pages, 1 figure",,,,"math.AC","http://arxiv.org/licenses/nonexclusive-distrib/1.0/","  In this note we study the limiting behaviour of the symbolic generic initial
system of an ideal I in K[x,y,z] corresponding to an arrangement of r points of
P2 lying on an irreducible conic. In particular, we show that the limiting
shape of this system is the subset of R2 such consisting of all points above
the line through (2,0) and (0, r/2) when r is greater than or equal to four.
","[{""version"":""v1"",""created"":""Mon, 29 Apr 2013 00:21:22 GMT""}]","2013-04-30"
"1304.7543","Joon Yop Lee","Hyun Kwang Kim, Joon Yop Lee","Criteria of valid line sum arrays for multidimensional matrices",,,,,"math.CO","http://arxiv.org/licenses/nonexclusive-distrib/1.0/","  Gale and Ryser found a criterion for existence of a binary matrix with given
row and column sums. Mirsky extended the theorem of Gale and Ryser to $q$-ary
matrices. In this paper, we are interested in higher dimensional extension of
these theorems. We first introduce multidimensional matrices as a higher
dimensional generalization of matrices. We next replace the concept of row and
columns in matrices by lines in multidimensional matrices. We finally find a
criterion for existence of a $q$-ary multidimensional matrices with given line
sums.
","[{""version"":""v1"",""created"":""Mon, 29 Apr 2013 00:29:51 GMT""}]","2013-04-30"
"1304.7544","Jimmy Lin","Jimmy Lin","Monoidify! Monoids as a Design Principle for Efficient MapReduce
  Algorithms",,,,,"cs.DC cs.DB cs.PL","http://arxiv.org/licenses/nonexclusive-distrib/1.0/","  It is well known that since the sort/shuffle stage in MapReduce is costly,
local aggregation is one important principle to designing efficient algorithms.
This short paper represents an attempt to more clearly articulate this design
principle in terms of monoids, which generalizes the use of combiners and the
in-mapper combining pattern.
","[{""version"":""v1"",""created"":""Mon, 29 Apr 2013 00:30:36 GMT""}]","2013-04-30"
"1304.7545","Greg van Anders","Greg van Anders, N. Khalid Ahmed, Ross Smith, Michael Engel, and
  Sharon C. Glotzer","Entropically Patchy Particles: Engineering Valence through Shape Entropy","v1: revtex, 6 pages, 5 figures. v2: completely rewritten, revtex, 11
  pages, 7 figures. Figures are higher resolution than journal version","ACS Nano 8, 931-940 (2014)","10.1021/nn4057353",,"cond-mat.soft cond-mat.mtrl-sci cond-mat.stat-mech physics.chem-ph","http://arxiv.org/licenses/nonexclusive-distrib/1.0/","  Patchy particles are a popular paradigm for the design and synthesis of
nanoparticles and colloids for self-assembly. In ""traditional"" patchy
particles, anisotropic interactions arising from patterned coatings,
functionalized molecules, DNA, and other enthalpic means create the possibility
for directional binding of particles into higher-ordered structures. Although
the anisotropic geometry of non-spherical particles contributes to the
interaction patchiness through van der Waals, electrostatic, and other
interactions, how particle shape contributes entropically to self-assembly is
only now beginning to be understood. It has been recently demonstrated that,
for hard shapes, entropic forces are directional. A newly proposed theoretical
framework that defines and quantifies directional entropic forces demonstrates
the anisotropic--that is, patchy--nature of these emergent, attractive forces.
Here we introduce the notion of entropically patchy particles as the entropic
counterpart to enthalpically patchy particles. Using three example ""families""
of shapes, we judiciously modify entropic patchiness by introducing geometric
features to the particles so as to target specific crystal structures, which
then assembled with Monte Carlo simulations. We quantify the emergent entropic
valence via a potential of mean force and torque. We generalize these shape
operations to shape anisotropy dimensions, in analogy with the anisotropy
dimensions introduced for enthalpically patchy particles. Our findings
demonstrate that entropic patchiness and emergent valence provide a way of
engineering directional bonding into nanoparticle systems, whether in the
presence or absence of additional, non-entropic forces.
","[{""version"":""v1"",""created"":""Mon, 29 Apr 2013 00:55:30 GMT""},{""version"":""v2"",""created"":""Thu, 13 Feb 2014 21:29:37 GMT""}]","2014-02-18"
"1304.7546","Bo Zhou","Xuli Qi, Bo Zhou, Zhibin Du","The Kirchhoff indices and the matching numbers of unicyclic graphs",,"Appl. Math. Comput. 289, p. 464--480 (2016)",,,"math.CO","http://arxiv.org/licenses/nonexclusive-distrib/1.0/","  The Kirchhoff index of a connected graph is the sum of resistance distances
between all unordered pairs of vertices in the graph. It found considerable
applications in a variety of fields. In this paper, we determine the minimum
Kirchhoff index among the unicyclic graphs with fixed number of vertices and
matching number, and characterize the extremal graphs.
","[{""version"":""v1"",""created"":""Mon, 29 Apr 2013 01:17:46 GMT""}]","2017-02-10"
"1304.7547","Esha Sahai","Ritu Khare, Esha Sahai, and Ira Pramanick","Remote Mentoring Young Females in STEM through MAGIC",,,,,"cs.CY physics.ed-ph","http://arxiv.org/licenses/nonexclusive-distrib/1.0/","  The limited representation of women in STEM workforce is a concerning
national issue. It has been found that the gender stratification is not due to
the lack of talent amongst young females, but due to the lack of access to
female role models. To this end, ""remote mentoring"" is an effective way to
offer nation-wide personalized STEM mentoring to young females from all
segments of the society. In this paper, we introduce MAGIC, an organization
dedicated to mentoring young females in STEM through remote methods. We conduct
a retrospective study of MAGIC's formative years and present our experience in
remotely establishing 23 highly tailored mentor-mentee pairs. We provide
several key findings on STEM remote mentoring, such as popular communication
tools, frequently sought STEM skills among girls, and projects that could be
accomplished through remote mentoring. Furthermore, we present key challenges
faced by mentors and mentees, notable outcomes, and lessons learnt about remote
mentoring.
","[{""version"":""v1"",""created"":""Mon, 29 Apr 2013 01:18:41 GMT""}]","2013-04-30"
"1304.7548","Rodrigo de Lamare","Rodrigo C. de Lamare and Raimundo Sampaio-Neto","Adaptive Reduced-Rank RLS Algorithms based on Joint Iterative
  Optimization of Filters for Space-Time Interference Suppression","3 figures. arXiv admin note: substantial text overlap with
  arXiv:1205.4390, arXiv:1301.2696","ICASSP 2010",,,"cs.IT math.IT","http://arxiv.org/licenses/nonexclusive-distrib/1.0/","  This paper presents novel adaptive reduced-rank filtering algorithms based on
joint iterative optimization of adaptive filters. The novel scheme consists of
a joint iterative optimization of a bank of full-rank adaptive filters that
constitute the projection matrix and an adaptive reduced-rank filter that
operates at the output of the bank of filters. We describe least squares (LS)
expressions for the design of the projection matrix and the reduced-rank filter
and recursive least squares (RLS) adaptive algorithms for its computationally
efficient implementation. Simulations for a space-time interference suppression
in a CDMA system application show that the proposed scheme outperforms in
convergence and tracking the state-of-the-art reduced-rank schemes at about the
same complexity.
","[{""version"":""v1"",""created"":""Mon, 29 Apr 2013 01:41:53 GMT""}]","2013-04-30"
"1304.7549","Jonathan Alden","Jonathan S. Alden, Adam W. Tsen, Pinshane Y. Huang, Robert Hovden,
  Lola Brown, Jiwoong Park, David A. Muller, and Paul L. McEuen","Strain Solitons and Topological Defects in Bilayer Graphene",,,"10.1073/pnas.1309394110",,"cond-mat.mes-hall","http://arxiv.org/licenses/nonexclusive-distrib/1.0/","  Spontaneous symmetry-breaking, where the ground state of a system has lower
symmetry than the underlying Hamiltonian, is ubiquitous in physics. It leads to
multiply-degenerate ground states, each with a different ""broken"" symmetry
labeled by an order parameter. The variation of this order parameter in space
leads to soliton-like features at the boundaries of different broken-symmetry
regions and also to topological point defects. Bilayer graphene is a
fascinating realization of this physics, with an order parameter given by its
interlayer stacking coordinate. Bilayer graphene has been a subject of intense
study because in the presence of a perpendicular electric field, a band gap
appears in its electronic spectrum [1-3] through a mechanism that is intimately
tied to its broken symmetry. Theorists have further proposed that novel
electronic states exist at the boundaries between broken-symmetry stacking
domains [4-5]. However, very little is known about the structural properties of
these boundaries. Here we use electron microscopy to measure with nanoscale and
atomic resolution the widths, motion, and topological structure of soliton
boundaries and topological defects in bilayer graphene. We find that each
soliton consists of an atomic-scale registry shift between the two graphene
layers occurring over 6-11 nm. We infer the minimal energy barrier to
interlayer translation and observe soliton motion during in-situ heating above
1000 {\deg}C. The abundance of these structures across a variety samples, as
well as their unusual properties, suggests that they will have substantial
effects on the electronic and mechanical properties of bilayer graphene.
","[{""version"":""v1"",""created"":""Mon, 29 Apr 2013 01:42:29 GMT""}]","2015-06-15"
"1304.7550","Rafael Sorkin","Rafael D. Sorkin","Does a Quantum Particle Know its Own Energy?","plainTeX, 15 pages, 2 figures. To appear in Journal of Physics: Conf.
  Ser. Most current version is available at
  http://www.perimeterinstitute.ca/personal/rsorkin/some.papers/ (or wherever
  my home-page may be, such as http://www.physics.syr.edu/~sorkin/some.papers/)",,"10.1088/1742-6596/442/1/012014",,"quant-ph gr-qc math-ph math.MP","http://arxiv.org/licenses/nonexclusive-distrib/1.0/","  If a wave function does not describe microscopic reality then what does?
Reformulating quantum mechanics in path-integral terms leads to a notion of
""precluded event"" and thence to the proposal that quantal reality differs from
classical reality in the same way as a set of worldlines differs from a single
worldline. One can then ask, for example, which sets of electron trajectories
correspond to a Hydrogen atom in its ground state and how they differ from
those of an excited state. We address the analogous questions for simple model
that replaces the electron by a particle hopping (in discrete time) on a
circular lattice.
","[{""version"":""v1"",""created"":""Mon, 29 Apr 2013 01:49:18 GMT""}]","2015-06-15"
"1304.7551","Daniel Beller","Marcello Cavallaro Jr., Mohamed A. Gharbi, Daniel A. Beller, Simon
  \v{C}opar, Zheng Shi, Randall D. Kamien, Shu Yang, Tobias Baumgart, and
  Kathleen J. Stebe","Ring around the colloid","5 pages, 4 figures, accepted for publication in Soft Matter","Soft Matter 9 (2013) 9099",,,"cond-mat.soft","http://arxiv.org/licenses/nonexclusive-distrib/1.0/","  In this work, we show that Janus washers, genus-one colloids with hybrid
anchoring conditions, form topologically required defects in nematic liquid
crystals. Experiments under crossed polarizers reveal the defect structure to
be a rigid disclination loop confined within the colloid, with an accompanying
defect in the liquid crystal. When confined to a homeotropic cell, the
resulting colloid-defect ring pair tilts relative to the far field director, in
contrast to the behavior of toroidal colloids with purely homeotropic
anchoring. We show that this tilting behavior can be reversibly suppressed by
the introduction of a spherical colloid into the center of the toroid, creating
a new kind of multi-shape colloidal assemblage.
","[{""version"":""v1"",""created"":""Mon, 29 Apr 2013 02:03:52 GMT""},{""version"":""v2"",""created"":""Sat, 8 Jun 2013 14:53:39 GMT""}]","2013-09-13"
"1304.7552","Rodrigo de Lamare","Rodrigo C. de Lamare, Are Hjorungnes and Raimundo Sampaio-Neto","Adaptive Decision Feedback Reduced-Rank Equalization Based on Joint
  Iterative Optimization of Adaptive Estimation Algorithms for Multi-Antenna
  Systems","6 figures. arXiv admin note: substantial text overlap with
  arXiv:1301.2697","JWCNC 2010",,,"cs.IT math.IT","http://arxiv.org/licenses/nonexclusive-distrib/1.0/","  This paper presents a novel adaptive reduced-rank multi-input-multi-output
(MIMO) decision feedback equalization structure based on joint iterative
optimization of adaptive estimators. The novel reduced-rank equalization
structure consists of a joint iterative optimization of two equalization
stages, namely, a projection matrix that performs dimensionality reduction and
a reduced-rank estimator that retrieves the desired transmitted symbol. The
proposed reduced-rank structure is followed by a decision feedback scheme that
is responsible for cancelling the inter-antenna interference caused by the
associated data streams. We describe least squares (LS) expressions for the
design of the projection matrix and the reduced-rank estimator along with
computationally efficient recursive least squares (RLS) adaptive estimation
algorithms. Simulations for a MIMO equalization application show that the
proposed scheme outperforms the state-of-the-art reduced-rank and the
conventional estimation algorithms at about the same complexity.
","[{""version"":""v1"",""created"":""Mon, 29 Apr 2013 02:11:05 GMT""}]","2013-04-30"
"1304.7553","Yinghai Wu","Ying-Hai Wu and Jainendra K. Jain","Quantum Hall Effect of Two-Component Bosons at Fractional and Integral
  Fillings","15 pages, 11 figures; v2: two figures updated; minor change","Phys. Rev. B 87, 245123 (2013)","10.1103/PhysRevB.87.245123",,"cond-mat.str-el cond-mat.quant-gas","http://arxiv.org/licenses/nonexclusive-distrib/1.0/","  We investigate the feasibility of many candidate quantum Hall states for
two-component bosons in the lowest Landau level. We identify interactions for
which spin-singlet incompressible states occur at filling factors $\nu=2/3$,
4/5 and 4/3, and spin-partially-polarized states at filling factors 3/4 and
3/2, where ""spin"" serves as a generic label for the two components. We study
ground states, excitations, edge states and entanglement spectrum for systems
with up to 16 bosons, and construct explicit trial wave functions to clarify
the underlying physics. The composite fermion theory very accurately describes
the ground states as well as excitations at $\nu=2/3$, 4/5 and 3/4, although it
is less satisfactory for the $\nu=3/2$ state. For $\nu=4/3$ a ""non-Abelian
spin-singlet"" state has been proposed to occur for a 2-body contact
interaction; we find that it is more likely that the actual state here is a
spin-singlet state of reverse-flux-attached composite fermions at filling
$\nu^*=4$. We also consider incompressible states at integral filling factors
$\nu=1$ and 2. The incompressible state at $\nu=1$ is shown to be well
described by the parton-based Jain spin-singlet wave function, and the
incompressible state at $\nu=2$ as the spin-singlet state of
reverse-flux-attached composite fermions at $\nu^*=2$.
","[{""version"":""v1"",""created"":""Mon, 29 Apr 2013 02:25:23 GMT""},{""version"":""v2"",""created"":""Mon, 24 Jun 2013 18:46:00 GMT""}]","2013-06-25"
"1304.7554","Toshiaki Shoji","Toshiaki Shoji and Karine Sorlin","Exotic symmetric space over a finite field, III","Final version, to appear in Transformation Groups. Sections 4 - 6
  were revised. Corrections for previous papers I, II were added",,,,"math.RT","http://arxiv.org/licenses/nonexclusive-distrib/1.0/","  Let X be an exotic symmetric space G/H \times V, where G= GL(V) and H = Sp(V)
for a symplectic vector space V over an algebraically closed field of odd
characteristic. In our previous papers, character sheaves on X were constructed
based on the explicit data. In this paper, we give a conceptual definition of
character sheaves on X based on the idea of Ginzburg in the case of symmetric
spaces, which we call Ginzburg type character sheaves. We prove that Ginzburg
type character sheaves on X actually coincide with those defined in our papers.
This gives a classification of Ginzburg type character sheaves on X.
","[{""version"":""v1"",""created"":""Mon, 29 Apr 2013 02:53:54 GMT""},{""version"":""v2"",""created"":""Sat, 18 Jan 2014 02:16:46 GMT""},{""version"":""v3"",""created"":""Thu, 31 Jul 2014 02:39:45 GMT""}]","2014-08-01"
"1304.7555","Hantao Lu","Hantao Lu and Janez Bonca and Takami Tohyama","Double-Pulse Deexcitations in a One-Dimensional Strongly Correlated
  System","5 pages, 4 figures; published version","EPL 103, 57005 (2013)","10.1209/0295-5075/103/57005",,"cond-mat.str-el","http://arxiv.org/licenses/nonexclusive-distrib/1.0/","  We investigate the ultrafast optical response of the one-dimensional
half-filled extended Hubbard model exposed to two successive laser pulses. By
using the time-dependent Lanczos method, we find that following the first
pulse, the excitation and deexcitation process between the ground state and
excitonic states can be precisely controlled by the relative temporal
displacement of the pulses. The underlying physics can be understood in terms
of a modified Rabi model. Our simulations clearly demonstrate the
controllability of ultrafast transition between excited and deexcited phases in
strongly correlated electron systems.
","[{""version"":""v1"",""created"":""Mon, 29 Apr 2013 02:58:54 GMT""},{""version"":""v2"",""created"":""Mon, 23 Sep 2013 04:29:53 GMT""}]","2013-09-24"
"1304.7556","Yi-Zhi Huang","Yi-Zhi Huang and James Lepowsky","Tensor categories and the mathematics of rational and logarithmic
  conformal field theory","In response to the referees' helpful comments, further discussion of
  several issues is added, including in particular rigidity. Much of the paper
  is devoted to explaining what has been mathematically proved and where people
  can find these proofs. Several references added. 27 pages. Invited review
  article for publication in a special issue of J. Phys. A on logarithmic
  conformal field theory",,"10.1088/1751-8113/46/49/494009",,"hep-th math-ph math.MP math.QA math.RT","http://arxiv.org/licenses/nonexclusive-distrib/1.0/","  We review the construction of braided tensor categories and modular tensor
categories from representations of vertex operator algebras, which correspond
to chiral algebras in physics. The extensive and general theory underlying this
construction also establishes the operator product expansion for intertwining
operators, which correspond to chiral vertex operators, and more generally, it
establishes the logarithmic operator product expansion for logarithmic
intertwining operators. We review the main ideas in the construction of the
tensor product bifunctors and the associativity isomorphisms. For rational and
logarithmic conformal field theories, we review the precise results that yield
braided tensor categories, and in the rational case, modular tensor categories
as well. In the case of rational conformal field theory, we also briefly
discuss the construction of the modular tensor categories for the
Wess-Zumino-Novikov-Witten models and, especially, a recent discovery
concerning the proof of the fundamental rigidity property of the modular tensor
categories for this important special case. In the case of logarithmic
conformal field theory, we mention suitable categories of modules for the
triplet \mathcal{W}-algebras as an example of the applications of our general
construction of the braided tensor category structure.
","[{""version"":""v1"",""created"":""Mon, 29 Apr 2013 03:03:26 GMT""},{""version"":""v2"",""created"":""Sun, 29 Sep 2013 17:37:54 GMT""},{""version"":""v3"",""created"":""Tue, 1 Oct 2013 15:48:15 GMT""}]","2015-06-15"
"1304.7557","Lee Peng Teo","L. P. Teo","Electromagnetic Casimir effect on the boundary of a D-dimensional cavity
  and the high temperature asymptotics","10 pages",,"10.1063/1.4812560",,"math-ph math.MP","http://arxiv.org/licenses/nonexclusive-distrib/1.0/","  We consider the finite temperature Casimir stress acting on the boundary of a
D>=3 dimensional cavity due to the vacuum fluctuations of electromagnetic
fields. Both perfectly conducting and infinitely permeable boundary conditions
are considered, and it is proved that they correspond mathematically to the
relative and absolute boundary conditions. The divergence terms of the Casimir
free energy are related to the heat kernel coefficients of the Laplace
operator. It is shown that the Casimir stress is free of divergence if and only
if D is exactly three. The high temperature asymptotics of the regularized
Casimir free energy are also found to depend on the heat kernel coefficients.
When D>3, renormalization is required to remove terms of order higher than or
equal to T^2.
","[{""version"":""v1"",""created"":""Mon, 29 Apr 2013 03:13:04 GMT""}]","2015-06-15"
"1304.7558","Amir Abboud","Amir Abboud and Kevin Lewi","Exact Weight Subgraphs and the k-Sum Conjecture",,,,,"cs.DS cs.CC","http://arxiv.org/licenses/nonexclusive-distrib/1.0/","  We consider the Exact-Weight-H problem of finding a (not necessarily induced)
subgraph H of weight 0 in an edge-weighted graph G. We show that for every H,
the complexity of this problem is strongly related to that of the infamous
k-Sum problem. In particular, we show that under the k-Sum Conjecture, we can
achieve tight upper and lower bounds for the Exact-Weight-H problem for various
subgraphs H such as matching, star, path, and cycle. One interesting
consequence is that improving on the O(n^3) upper bound for Exact-Weight-4-Path
or Exact-Weight-5-Path will imply improved algorithms for 3-Sum, 5-Sum,
All-Pairs Shortest Paths and other fundamental problems. This is in sharp
contrast to the minimum-weight and (unweighted) detection versions, which can
be solved easily in time O(n^2). We also show that a faster algorithm for any
of the following three problems would yield faster algorithms for the others:
3-Sum, Exact-Weight-3-Matching, and Exact-Weight-3-Star.
","[{""version"":""v1"",""created"":""Mon, 29 Apr 2013 03:38:47 GMT""}]","2013-04-30"
"1304.7559","Jong Soo Kim","M. Drees, M. Hanussek, J. S. Kim","Light stop phenomenology",,,,,"hep-ph","http://arxiv.org/licenses/nonexclusive-distrib/1.0/","  We consider the discovery potential of light stops in the MSSM at the LHC.
Here, we assume that the lightest neutralino is the LSP and that the lighter
stop is the NLSP. Direct stop pair production is difficult to probe in
scenarios with a small mass splitting between the stop and a neutralino. We
discuss two different search channels: the monojet and the two $b$--flavoured
jets and large missing transverse energy signature. We present the discovery
reach in the stop--neutralino mass plane for both channels. The latter process
is sensitive to the stop--higgsino--$b$ quark coupling. This allows us to test
a supersymmetry relation involving superpotential couplings. We briefly comment
on the possible precision with which the coupling can be measured.
","[{""version"":""v1"",""created"":""Mon, 29 Apr 2013 03:39:59 GMT""}]","2013-04-30"
