"1304.7482","Peter B. Gilkey","Peter Gilkey and Stana Nikcevic","Affine projective Osserman structures",,,"10.1088/0264-9381/30/15/155015",,"math.DG","http://arxiv.org/licenses/nonexclusive-distrib/1.0/","  By considering the projectivized spectrum of the Jacobi operator, we
introduce the concept of projective Osserman manifold in both the affine and in
the pseudo-Riemannian settings. If M is an affine projective Osserman manifold,
then the modified Riemannian extension metric on the cotangent bundle is both
spacelike and timelike projective Osserman. Since any rank 1 symmetric space is
affine projective Osserman, this provides additional information concerning the
cotangent bundle of a rank 1 Riemannian symmetric space with the modified
Riemannian extension metric. We construct other examples of affine projective
Osserman manifolds where the Ricci tensor is not symmetric and thus the
connection is not the Levi-Civita connection of any metric. If M is an affine
projective Osserman manifold of odd dimension, we use methods of algebraic
topology to show the Jacobi operator has only one non-zero eigenvalue and that
eigenvalue is real.
","[{""version"":""v1"",""created"":""Sun, 28 Apr 2013 16:02:30 GMT""}]","2015-06-15"
"1304.7483","David Bugg","D.V. Bugg (Queen Mary, University of London)","A new perspective on MOND","16 pages, 3 figures, substantial overlap with arXiv:1211.1625; one
  arithmetic correction made, subsection 4.1 rewritten; accepted for
  publication by the Canadian Journal of Physics","Canadian Journal of Physics, 91(8) 668-675, (2013)","10.1139/cjp-2013-0163","qmW32","physics.gen-ph astro-ph.GA hep-ph","http://arxiv.org/licenses/nonexclusive-distrib/1.0/","  A novel interpretation of MOND is presented. For galactic data, in addition
to Newtonian acceleration, there is an attractive acceleration peaking at
Milgrom's parameter a_0. The peak lies within experimental error where a_0 =
cH_0/2\pi; H_0 is the present-time value of the Hubble constant and c the
velocity of light. The physical interpretation of this relation and its
connection to Dark Energy are discussed.
","[{""version"":""v1"",""created"":""Sun, 28 Apr 2013 16:10:11 GMT""},{""version"":""v2"",""created"":""Fri, 17 May 2013 18:43:03 GMT""},{""version"":""v3"",""created"":""Fri, 28 Jun 2013 10:01:25 GMT""}]","2015-06-15"
"1304.7484","Ovidiu Munteanu","Ovidiu Munteanu and Jiaping Wang","Holomorphic functions on certain K\""{a}hler manifolds","19 pages, submitted",,"10.1112/jlms/jdt078",,"math.DG math.AP","http://arxiv.org/licenses/nonexclusive-distrib/1.0/","  We investigate Liouville theorems and dimension estimates for the space of
exponentially growing holomorphic functions on complete K\""{a}hler manifolds.
While our work is motivated by the study of gradient Ricci solitons in the
theory of Ricci flow, the most general results we prove here do not require any
knowledge of curvature.
","[{""version"":""v1"",""created"":""Sun, 28 Apr 2013 16:35:58 GMT""}]","2017-05-17"
"1304.7485","Oleg Misochko","O.V Misochko","Optical control of coherent and squeezed phonons: major differences and
  similarities","3 pages, talk on The International Conference on Coherent and
  Nonlinear Optics (ICONO) 2013",,,,"cond-mat.mes-hall physics.optics quant-ph","http://arxiv.org/licenses/nonexclusive-distrib/1.0/","  Coherent and squeezed phonon oscillations can be excited in solids
impulsively by a single femtosecond pulse whose duration is shorter that a
phonon period. By applying the second ultrafast pump pulse these oscillations
can be significantly, but differently modified.
","[{""version"":""v1"",""created"":""Sun, 28 Apr 2013 16:37:06 GMT""}]","2013-04-30"
"1304.7486","Wenhu Xu","Wenhu Xu, Kristjan Haule and Gabriel Kotliar","Hidden Fermi Liquid, Scattering Rate Saturation and Nernst Effect: a
  DMFT Perspective","5 pages, 3 figures and Supplementary Material","Phys.Rev.Lett. 111, 036401 (2013)","10.1103/PhysRevLett.111.036401",,"cond-mat.str-el","http://arxiv.org/licenses/nonexclusive-distrib/1.0/","  We investigate the transport properties of a correlated metal within
dynamical mean field theory. Canonical Fermi liquid behavior emerges only below
a very low temperature scale $T_{FL}$. Surprisingly the quasiparticle
scattering rate follows a quadratic temperature dependence up to much higher
temperatures and crosses over to saturated behavior around a temperature scale
$T_{sat}$. We identify these quasiparticles as constituents of the hidden Fermi
liquid. The non-Fermi liquid transport above $T_{FL}$, in particular the
linear-in-$T$ resistivity, is shown to be a result of a strongly temperature
dependent band dispersion. We derive simple expressions for resistivity, Hall
angle, thermoelectric power and Nernst coefficient in terms of a temperature
dependent renormalized band structure and the quasiparticle scattering rate. We
discuss possible tests of the DMFT picture of transport using ac measurements.
","[{""version"":""v1"",""created"":""Sun, 28 Apr 2013 16:48:11 GMT""}]","2013-11-25"
"1304.7487","Alex Bazarsky","Alex Bazarsky, Noam Presman, Simon Litsyn","Design of Non-Binary Quasi-Cyclic LDPC Codes by ACE Optimization","Accepted to 2013 IEEE Information Theory Workshop",,"10.1109/ITW.2013.6691250",,"cs.IT math.IT","http://arxiv.org/licenses/nonexclusive-distrib/1.0/","  An algorithm for constructing Tanner graphs of non-binary irregular
quasi-cyclic LDPC codes is introduced. It employs a new method for selection of
edge labels allowing control over the code's non-binary ACE spectrum and
resulting in low error-floor. The efficiency of the algorithm is demonstrated
by generating good codes of short to moderate length over small fields,
outperforming codes generated by the known methods.
","[{""version"":""v1"",""created"":""Sun, 28 Apr 2013 17:00:56 GMT""},{""version"":""v2"",""created"":""Thu, 25 Jul 2013 14:37:27 GMT""}]","2016-11-17"
"1304.7488","Shoichi Kawamoto","Shoichi Kawamoto and Toshihiro Matsuo","Emission spectrum of soft massless states from heavy superstring","28 pages; ver. 3, typos corrected",,"10.1103/PhysRevD.87.124001",,"hep-th","http://arxiv.org/licenses/nonexclusive-distrib/1.0/","  We calculate emission rates of various bosonic/fermionic soft massless states
of open/closed superstring from an ensemble of a highly excited open/closed
superstring in the flat background. The resulting spectrum shows thermal
distributions at the Hagedorn temperature. We find greybody factors for each
process and observe their relation to the ones from blackholes.
","[{""version"":""v1"",""created"":""Sun, 28 Apr 2013 17:02:11 GMT""},{""version"":""v2"",""created"":""Wed, 8 May 2013 11:27:05 GMT""},{""version"":""v3"",""created"":""Wed, 5 Jun 2013 12:16:22 GMT""}]","2013-06-12"
"1304.7489","George Gratzer","G. Gr\""atzer and E. T. Schmidt","An extension theorem for planar semimodular lattices",,,,,"math.RA","http://arxiv.org/licenses/nonexclusive-distrib/1.0/","  We prove that every finite distributive lattice $D$ can be represented as the
congruence lattice of a rectangular lattice $K$ in which all congruences are
principal. We verify this result in a stronger form as an extension theorem.
","[{""version"":""v1"",""created"":""Sun, 28 Apr 2013 17:17:18 GMT""},{""version"":""v2"",""created"":""Tue, 21 May 2013 15:45:48 GMT""},{""version"":""v3"",""created"":""Sun, 26 May 2013 17:27:14 GMT""},{""version"":""v4"",""created"":""Mon, 12 Aug 2013 17:51:33 GMT""},{""version"":""v5"",""created"":""Wed, 14 Aug 2013 18:36:55 GMT""},{""version"":""v6"",""created"":""Mon, 26 Aug 2013 00:08:19 GMT""}]","2019-08-13"
"1304.7490","Inder Kaur","Inder Kaur","A note on the structure theory of groups acting on the Bruhat Tits tree
  associated to $\mathrm{PGL}_{2}(F)$","14 pages",,,,"math.RT","http://arxiv.org/licenses/nonexclusive-distrib/1.0/","  In this note we prove the classical decomposition theorems for certain
subgroups of the automorphism group of the Bruhat-Tits tree associated to
$\mathrm{PGL}_{2}(F)$, where $F$ is a local field. The results can be used to
understand the representation theory of these subgroups. Moreover, we can also
use the results to obtain similar decompositions for \textit{any} closed
transitive subgroup of the automorphism group of \textit{any} Bruhat-Tits tree.
","[{""version"":""v1"",""created"":""Sun, 28 Apr 2013 17:18:22 GMT""}]","2013-04-30"
"1304.7491","Michael Zimmer","Michael F. Zimmer","A row space method for solving a system of linear equations",,,,,"math.RA","http://arxiv.org/licenses/nonexclusive-distrib/1.0/","  A new algorithm is presented for computing a direct solution to a system of
consistent linear equations. It produces a minimum norm particular solution, a
generalized inverse (of type {124}), and a null space projection operator. In
addition, the algorithm permits an online formulation so that computations may
proceed as the data become available. The algorithm does not require the
solution of a triangular system of equations, nor does it rely on block
partitioned matrices.
","[{""version"":""v1"",""created"":""Sun, 28 Apr 2013 17:46:53 GMT""}]","2013-04-30"
"1304.7492","Kang Zhao-Feng","Lei Feng and Zhaofeng Kang","Decaying Asymmetric Dark Matter Relaxes the AMS-Fermi Tension","The JCAP version; References and comments added; Improved fitting
  using MCMC",,"10.1088/1475-7516/2013/10/008",,"hep-ph astro-ph.CO","http://arxiv.org/licenses/nonexclusive-distrib/1.0/","  The first result of AMS-02 confirms the positron fraction excess observed by
PAMELA, but the spectrum is somewhat softer than that of PAMELA. In the dark
matter (DM) interpretation it brings a tension between AMS-02 and Fermi-LAT,
which reported an excess of the electron plus positron flux. In this work we
point out that the asymmetric cosmic ray from asymmetric dark matter (ADM)
decay relaxes the tension. It is found that in the case of two-body decay a
bosonic ADM around 2.4 TeV and decaying into $\mu^-\tau^+$ can significantly
improve the fits. Based on the $R-$parity-violating supersymmetry with
operators $LLE^c$, we propose a minimal model to realize that ADM. The model
introduces only a pair of singlets $(X,\bar X)$ with a tiny coupling $LH_uX$,
which makes the ADM share the lepton asymmetry and decay into $\mu^-\tau^+$
along the operator $LLE^c$.
","[{""version"":""v1"",""created"":""Sun, 28 Apr 2013 18:09:51 GMT""},{""version"":""v2"",""created"":""Wed, 22 Jan 2014 10:19:15 GMT""}]","2015-06-15"
"1304.7493","Enrico Le Donne","Enrico Le Donne","A metric characterization of Carnot groups",,,,,"math.MG","http://arxiv.org/licenses/nonexclusive-distrib/1.0/","  We give a short axiomatic introduction to Carnot groups and their
subRiemannian and subFinsler geometry. We explain how such spaces can be
metrically described as exactly those proper geodesic spaces that admit
dilations and are isometrically homogeneous.
","[{""version"":""v1"",""created"":""Sun, 28 Apr 2013 18:22:39 GMT""},{""version"":""v2"",""created"":""Mon, 25 Aug 2014 15:18:01 GMT""}]","2014-08-26"
"1304.7494","Roman Matsyuk","Roman Matsyuk","Third-order relativistic dynamics: classical spinning particle
  travelling in a plane","10 pages. Minor misprints corrected.
  http://www.icmp.lviv.ua/journal/zbirnyk.15/004/art04.pdf","Condensed Matter Physics, 1998, vol. 1, no. 3(15), p. 453-462",,,"math-ph math.DG math.MP","http://arxiv.org/licenses/nonexclusive-distrib/1.0/","  Mathisson's 'new mechanics' of a relativistic spinning particle is shown to
follow, in the case of planar motion, from only general requirements of
relativistic invariance and of the dependence on third order derivatives along
with the 'variationality' feature. The Hamiltonian counterpart ultimately
recovers the Dixon system of equations for this case with the Mathisson-Pirani
supplementary condition.
","[{""version"":""v1"",""created"":""Sun, 28 Apr 2013 18:26:09 GMT""}]","2013-04-30"
"1304.7495","Cms Collaboration","CMS Collaboration","Measurement of the Lambda(b)0 lifetime in pp collisions at sqrt(s) = 7
  TeV","Replaced with published version. Added journal reference and DOI","JHEP 07 (2013) 163","10.1007/JHEP07(2013)163","CMS-BPH-11-013, CERN-PH-EP-2013-065","hep-ex","http://arxiv.org/licenses/nonexclusive-distrib/1.0/","  A measurement of the Lambda(b)0 lifetime using the decay Lambda(b)0 to J/Psi
Lambda in proton-proton collisions at sqrt(s) = 7 TeV is presented. The data
set, corresponding to an integrated luminosity of about 5 inverse femtobarns,
was recorded with the CMS experiment at the Large Hadron Collider using
triggers that selected dimuon events in the J/Psi mass region. The Lambda(b)0
lifetime is measured to be 1.503 +/- 0.052 (stat.) +/- 0.031 (syst.) ps.
","[{""version"":""v1"",""created"":""Sun, 28 Apr 2013 18:44:41 GMT""},{""version"":""v2"",""created"":""Wed, 21 Aug 2013 19:29:39 GMT""}]","2013-08-22"
"1304.7496","Nabanita Dasgupta-Schubert","Omar S. Castillo Baltasar, Nabanita Dasgupta-Schubert, Christian
  Schubert","A Systems Model of the Eco-physiological Response of Plants to
  Environmental Heavy Metal Concentrations","33 pages, 12 figures. 1 table","Published in JOURNAL OF ENVIRONMENTAL STATISTICS, volume 4, issue
  10, page 1, April 2013",,,"q-bio.TO","http://arxiv.org/licenses/nonexclusive-distrib/1.0/","  The ecophysiological response of plants to environmental heavy metal stress
is indicated by the profile of its tissue HM concentrations (Cp) versus the
concentration of the HM in the substrate (Cs). We report a systems biology
approach to the modelling of the Cp- Cs profile using as loose analogy, the
Verhulst model of population dynamics but formulated in the concentration
domain. The HM is conceptualized as an ecological organism that `colonizes' the
resource zone of the plant cells driven by the potential supplied by the higher
HM concentration in the substrate. The infinite occupation by the HM is limited
by the eventual saturation of the cellular binding sites. The solution of the
differential equation results in the logistic equation, the r-K model. The
model is tested for 3 metalophillic plants T.erecta, S. vulgaris and E.
splendens growing in different types of substrates, contaminated to varying
extents by different copper compounds. The model fitted the experimental Cp- Cs
profiles well. The r, K parameter values and secondary quantities derived from
them, allowed a quantification of the number of Cu binding sites per cell at
saturation, the sensitivities (affinities) of these sites for Cu in the 3
experimental systems as well as the extraction of information related to the
substrate phyto-availability of the Cu. Thus even though the model operates at
the systems level it permits useful insights into underlying processes that
ultimately derive from the cumulative molecular processes of HM homeostasis.
The chief advantages of the model are its simplicity, fewer arbitrary
parameters, and the non-specification of constraints on substrate and plant
type.
","[{""version"":""v1"",""created"":""Sun, 28 Apr 2013 18:45:45 GMT""}]","2013-04-30"
"1304.7497","Jay Gopalakrishnan","Jay Gopalakrishnan, Ignacio Muga, Nicole Olivares","Dispersive and dissipative errors in the DPG method with scaled norms
  for Helmholtz equation",,,"10.1137/130918186",,"math.NA","http://arxiv.org/licenses/nonexclusive-distrib/1.0/","  We consider the discontinuous Petrov-Galerkin (DPG) method, wher the test
space is normed by a modified graph norm. The modificatio scales one of the
terms in the graph norm by an arbitrary positive scaling parameter. Studying
the application of the method to the Helmholtz equation, we find that better
results are obtained, under some circumstances, as the scaling parameter
approaches a limiting value. We perform a dispersion analysis on the multiple
interacting stencils that form the DPG method. The analysis shows that the
discrete wavenumbers of the method are complex, explaining the numerically
observed artificial dissipation in the computed wave approximations. Since the
DPG method is a nonstandard least-squares Galerkin method, we compare its
performance with a standard least-squares method.
","[{""version"":""v1"",""created"":""Sun, 28 Apr 2013 18:51:58 GMT""}]","2015-06-16"
"1304.7498","Cms Collaboration","CMS Collaboration","Measurement of the ratio of the inclusive 3-jet cross section to the
  inclusive 2-jet cross section in pp collisions at sqrt(s) = 7 TeV and first
  determination of the strong coupling constant in the TeV range","Replaced with published version. Added journal reference and DOI","Eur. Phys. J. C 73 (2013) 2604","10.1140/epjc/s10052-013-2604-6","CMS-QCD-11-003, CERN-PH-EP-2013-057","hep-ex","http://arxiv.org/licenses/nonexclusive-distrib/1.0/","  A measurement is presented of the ratio of the inclusive 3-jet cross section
to the inclusive 2-jet cross section as a function of the average transverse
momentum, <pT[1,2]>, of the two leading jets in the event. The data sample was
collected during 2011 at a proton-proton centre-of-mass energy of 7 TeV with
the CMS detector at the LHC, corresponding to an integrated luminosity of 5.0
inverse femtobarns. The strong coupling constant at the scale of the Z boson
mass is determined to be alphaS[MZ] = 0.1148 +/- 0.0014 (exp.) +/- 0.0018 (PDF)
+/- 0.0050 (theory), by comparing the ratio in the range 0.42 < <pT[1,2]> <
1.39 TeV to the predictions of perturbative QCD at next-to-leading order. This
is the first determination of alphaS[MZ] from measurements at momentum scales
beyond 0.6 TeV. The predicted ratio depends only indirectly on the evolution of
the parton distribution functions of the proton such that this measurement also
serves as a test of the evolution of the strong coupling constant. No deviation
from the expected behaviour is observed.
","[{""version"":""v1"",""created"":""Sun, 28 Apr 2013 18:54:47 GMT""},{""version"":""v2"",""created"":""Sat, 30 Nov 2013 19:59:18 GMT""}]","2013-12-03"
"1304.7499","Andrei Mironov","A.Mironov, A.Morozov and A.Sleptsov","On genus expansion of knot polynomials and hidden structure of Hurwitz
  tau-functions","8 pages","The European Physical Journal C 73 (2013) 2492","10.1140/epjc/s10052-013-2492-9","FIAN/TD-07/13; ITEP/TH-11/13","hep-th math.GT","http://arxiv.org/licenses/nonexclusive-distrib/1.0/","  In the genus expansion of the HOMFLY polynomials their representation
dependence is naturally captured by symmetric group characters. This
immediately implies that the Ooguri-Vafa partition function (OVPF) is a Hurwitz
tau-function. In the planar limit involving factorizable special polynomials,
it is actually a trivial exponential tau-function. In fact, in the double
scaling Kashaev limit (the one associated with the volume conjecture) dominant
in the genus expansion are terms associated with the symmetric representations
and with the integrability preserving Casimir operators, though we stop one
step from converting this fact into a clear statement about the OVPF behavior
in the vicinity of q=1. Instead, we explain that the genus expansion provides a
hierarchical decomposition of the Hurwitz tau-function, similar to the
Takasaki-Takebe expansion of the KP tau-functions. This analogy can be helpful
to develop a substitute for the universal Grassmannian description in the
Hurwitz tau-functions.
","[{""version"":""v1"",""created"":""Sun, 28 Apr 2013 19:00:57 GMT""}]","2013-10-14"
"1304.7500","Albert Schwarz","M.V. Movshev, A. Schwarz","Generalized Chern-Simons action and maximally supersymmetric gauge
  theories","The talk for the workshop String-Math 2012, Bonn. 22 pages",,,,"hep-th math-ph math.MP","http://arxiv.org/licenses/nonexclusive-distrib/1.0/","  We study observables and deformations of generalized Chern-Simons action and
show how to apply these results to maximally supersymmetric gauge theories. We
describe a construction of large class of deformations based on some results on
the cohomology of super Lie algebras proved in the Appendix.
","[{""version"":""v1"",""created"":""Sun, 28 Apr 2013 19:12:29 GMT""}]","2013-04-30"
"1304.7501","Jose Pelaez Jose Angel Pelaez Marquez","Olivia Constantin and Jos\'e \'Angel Pel\'aez","Integral operators, embedding theorems and a Littlewood-Paley formula on
  weighted Fock spaces",,,,,"math.FA math.CV","http://arxiv.org/licenses/nonexclusive-distrib/1.0/","  We obtain a complete characterization of the entire functions $g$ such that
the integral operator $(T_ g f)(z)=\int_{0}^{z}f(\zeta)\,g'(\zeta)\,d\zeta$ is
bounded or compact, on a large class of Fock spaces $\mathcal{F}^\phi_p$,
induced by smooth radial weights that decay faster than the classical Gaussian
one. In some respects, these spaces turn out to be significantly different than
the classical Fock spaces. Descriptions of Schatten class integral operators
are also provided. En route, we prove a Littlewood-Paley formula for
$||\cdot||_{\mathcal{F}^\phi_p}$ and we characterize the positive Borel
measures for which $\mathcal{F}^\phi_p\subset L^q(\mu)$, $0<p,q<\infty$. In
addition, we also address the question of describing the subspaces of
$\mathcal{F}^\phi_p$ that are invariant under the classical Volterra integral
operator.
","[{""version"":""v1"",""created"":""Sun, 28 Apr 2013 19:14:43 GMT""},{""version"":""v2"",""created"":""Thu, 19 Dec 2013 10:07:29 GMT""}]","2013-12-20"
"1304.7502","Yunping Jiang","Frederick. P. Gardiner and Yunping Jiang","Guiding Isotopies and Holomorphic Motions","19 pages",,,,"math.CV","http://arxiv.org/licenses/nonexclusive-distrib/1.0/","  We develop an isotopy principle for holomorphic motions. Our main result
concerns the extendability of a holomorphic motion of a finite subset $E$ of a
Riemann surface $Y$ parameterized by a point $t$ in a pointed hyperbolic
surface $(X, t_{0})$. If a holomorphic motion from $E$ to $E_{t}$ in $Y$ has a
guiding quasiconformal isotopy, then there is a holomorphic extension to any
new point $p$ in $Y-E$ that follows the guiding isotopy. The proof gives a
canonical way to replace a quasiconformal motion of the $(n+1)^{th}$ point by a
holomorphic motion while leaving unchanged the given holomorphic motion of the
first $n$ points. In particular, our main result gives a new proof of
Slodkowski's theorem which concerns the special case when the parameter space
is the open unit disk with base point $0$ and the dynamical space $Y$ is the
Riemann sphere.
","[{""version"":""v1"",""created"":""Sun, 28 Apr 2013 19:15:03 GMT""},{""version"":""v2"",""created"":""Fri, 17 Jan 2014 21:51:41 GMT""}]","2014-01-21"
"1304.7503","Sumin Tang","Sumin Tang, Dimitar Sasselov, Jonathan Grindlay, Edward Los, Mathieu
  Servillat","100-year DASCH Light Curves of Kepler Planet-Candidate Host Stars","7 pages, 3 figures. Accepted for publication in PASP",,"10.1086/671759",,"astro-ph.EP astro-ph.SR","http://arxiv.org/licenses/nonexclusive-distrib/1.0/","  We present 100 year light curves of Kepler planet-candidate host stars from
the Digital Access to a Sky Century at Harvard (DASCH) project. 261 out of 997
host stars have at least 10 good measurements on DASCH scans of the Harvard
plates. 109 of them have at least 100 good measurements, including 70% (73 out
of 104) of all host stars with g<=13 mag, and 44% (100 out of 228) of all host
stars with g<=14 mag. Our typical photometric uncertainty is ~0.1-0.15 mag. No
variation is found at 3-sigma level for these host stars, including 21
confirmed or candidate hot Jupiter systems which might be expected to show
enhanced flares from magnetic interactions between dwarf primaries and their
close and relatively massive planet companions.
","[{""version"":""v1"",""created"":""Sun, 28 Apr 2013 19:20:52 GMT""},{""version"":""v2"",""created"":""Tue, 4 Jun 2013 04:47:47 GMT""}]","2015-06-15"
"1304.7504","Sumin Tang","Sumin Tang, Jonathan Grindlay, Edward Los, Mathieu Servillat","Improved Photometry for the DASCH Pipeline","11 pages, 9 figures, and 2 tables. Accepted for publication in PASP",,"10.1086/671760",,"astro-ph.IM astro-ph.SR","http://arxiv.org/licenses/nonexclusive-distrib/1.0/","  The Digital Access to a Sky Century@Harvard (DASCH) project is digitizing the
~500,000 glass plate images obtained (full sky) by the Harvard College
Observatory from 1885-1992. Astrometry and photometry for each resolved object
are derived with photometric rms values of ~0.15mag for the initial photometry
analysis pipeline. Here we describe new developments for DASCH photometry,
applied to the Kepler field, that has yielded further improvements, including
better identification of image blends and plate defects by measuring image
profiles and astrometric deviations. A local calibration procedure using nearby
stars in a similar magnitude range as the program star (similar to what has
been done for visual photometry from the plates) yields additional improvement
for a net photometric rms ~0.1mag. We also describe statistical measures of
light curves that are now used in the DASCH pipeline processing to autonomously
identify new variables. The DASCH photometry methods described here are used in
the pipeline processing for the Data Releases of DASCH data (Grindlay et al.
2012; http://dasch.rc.fas.harvard.edu), as well as for the long-term variables
discovered by DASCH in the Kepler field (Tang et al, in preparation).
","[{""version"":""v1"",""created"":""Sun, 28 Apr 2013 19:23:13 GMT""},{""version"":""v2"",""created"":""Tue, 30 Apr 2013 02:18:35 GMT""},{""version"":""v3"",""created"":""Tue, 4 Jun 2013 04:51:23 GMT""}]","2015-06-15"
