"1304.7639","Simone Secchi","Silvia Cingolani and Simone Secchi","Multiple $\mathbb{S}^{1}$-orbits for the Schr\""odinger-Newton system","Accepted for publication by Differential and Integral Equations",,,,"math.AP","http://arxiv.org/licenses/nonexclusive-distrib/1.0/","  We prove existence and multiplicity of symmetric solutions for the
\emph{Schr\""odinger-Newton system} in three dimensional space using equivariant
Morse theory.
","[{""version"":""v1"",""created"":""Mon, 29 Apr 2013 12:25:39 GMT""}]","2013-04-30"
"1304.7640","Lydia Nemec","Lydia Nemec and Volker Blum and Patrick Rinke and Matthias Scheffler","Thermodynamic equilibrium conditions of graphene films on SiC",,"Phys. Rev. Lett. 111, 065502 (2013)","10.1103/PhysRevLett.111.065502",,"cond-mat.mtrl-sci","http://arxiv.org/licenses/nonexclusive-distrib/1.0/","  First-principles surface phase diagrams reveal that epitaxial monolayer
graphene films on the Si side of 3C-SiC(111) can exist as thermodynamically
stable phases in a narrow range of experimentally controllable conditions,
defining a path to the highest-quality graphene films. Our calculations are
based on a van der Waals corrected density functional. The full, experimentally
observed (6 sqrt(3)x 6 sqrt(3))-R30 supercells for zero- to trilayer graphene
are essential to describe the correct interface geometries and the relative
stability of surface phases and possible defects.
","[{""version"":""v1"",""created"":""Mon, 29 Apr 2013 12:26:41 GMT""}]","2014-11-21"
"1304.7641","Juan J. Alonso","J. F. Fern\'andez (1,2), J. J. Alonso (2,3) ((1) Universidad de
  Zaragoza, (2) Instituto Carlos I, Universidad de Granada, (3) Universidad de
  M\'alaga)","Numerical results for the Edwards-Anderson spin-glass model at low
  temperature","9 LaTeX pages, 12 pdf figures, 1 table","Phys. Rev. B 87, 134205 (2013)","10.1103/PhysRevB.87.134205",,"cond-mat.dis-nn cond-mat.stat-mech","http://arxiv.org/licenses/nonexclusive-distrib/1.0/","  We have simulated Edwards-Anderson (EA) as well as Sherrington-Kirkpatrick
systems of L^3 spins. After averaging over large sets of EA system samples of 3
=< L =< 10, we obtain accurate numbers for distributions p(q) of the overlap
parameter q at very low temperature T. We find p(0)/T --> 0.233(4) as T --> 0.
This is in contrast with the droplet scenario of spin glasses. We also study
the number of mismatched links --between replica pairs-- that come with large
scale excitations. Contributions from small scale excitations are discarded. We
thus obtain for the fractal dimension of outer surfaces of q~0 excitations in
the EA model d_s --> 2.59(3) as T tends to 0. This is in contrast with d_s -->
3 as T --> 0 that is predicted by mean field theory for the macroscopic limit.
","[{""version"":""v1"",""created"":""Mon, 29 Apr 2013 12:26:42 GMT""}]","2013-04-30"
"1304.7642","Ian Kash","Ben Roberts, Dinan Gunawardena, Ian A. Kash, Peter Key","Ranking and Tradeoffs in Sponsored Search Auctions","To appear in Proceedings of the 14th ACM Conference on Electronic
  Commerce (EC '13)",,,,"cs.GT","http://arxiv.org/licenses/nonexclusive-distrib/1.0/","  In a sponsored search auction, decisions about how to rank ads impose
tradeoffs between objectives such as revenue and welfare. In this paper, we
examine how these tradeoffs should be made. We begin by arguing that the most
natural solution concept to evaluate these tradeoffs is the lowest symmetric
Nash equilibrium (SNE). As part of this argument, we generalise the well known
connection between the lowest SNE and the VCG outcome. We then propose a new
ranking algorithm, loosely based on the revenue-optimal auction, that uses a
reserve price to order the ads (not just to filter them) and give conditions
under which it raises more revenue than simply applying that reserve price.
Finally, we conduct extensive simulations examining the tradeoffs enabled by
different ranking algorithms and show that our proposed algorithm enables
superior operating points by a variety of metrics.
","[{""version"":""v1"",""created"":""Mon, 29 Apr 2013 12:29:30 GMT""}]","2013-04-30"
"1304.7643","Marcin Szamotulski","Marcin Szamotulski","Galois theory for H-extensions","This is author's Ph.D. thesis",,,,"math.QA","http://arxiv.org/licenses/nonexclusive-distrib/1.0/","  We show that there exists a Galois correspondence between subalgebras of an
H-comodule algebra A over a base ring R and generalised quotients of a Hopf
algebra H if both A and H are flat Mittag--Leffler modules. We also provide new
criteria for subalgebras and generalised quotients to be closed elements of the
Galois connection constructed. We generalise the Schauenburg theory of
admissible objects to this more general context. Then we consider coextensions
of H-module coalgebras. We construct a Galois connection for them and we prove
that H-Galois coextensions are closed. We apply the results obtained to the
Hopf algebra itself and we give a simple proof that there is a bijective
correspondence between right ideal coideals of H and its left coideal
subalgebras when H is finite dimensional. Furthermore, we formulate a necessary
and sufficient condition for a bijective Galois correspondence for A=H. We also
consider crossed product algebras.
","[{""version"":""v1"",""created"":""Mon, 29 Apr 2013 12:32:57 GMT""}]","2013-04-30"
"1304.7644","Daniel Brito de Freitas","D. B. de Freitas and J. R. De Medeiros","A nonextensive approach to the stellar rotational evolution I. F and G
  type stars","8 pages, 3 figures, MNRAS accepted",,"10.1093/mnras/stt734",,"astro-ph.SR","http://arxiv.org/licenses/nonexclusive-distrib/1.0/","  The pioneering study by Skumanich (1972) showed that the rotational velocity
of G-type Main-Sequence (MS) stars decreases with stellar age according to $<v
\sin i>$ $\propto$ $t^{-1/2}$. This relationship is consistent with simple
theories of angular momentum loss from rotating stars, where an ionized wind is
coupled to the star by a magnetic field. The present study introduces a new
approach to the study of stellar rotational braking in unsaturated F and G type
stars limited in age and mass, connecting angular momentum loss by magnetic
stellar wind with Tsallis nonextensive statistical mechanics. As a result, we
show that the rotation-age relationship can be well reproduced using a
nonextensive approach from Tsallis nonextensive models. Here, the index $q$,
which is related to the degree of nonextensivity, can be associated to the
dynamo process and to magnetic field geometry, offering relevant information on
the level of stellar magnetic braking for F- and G-type Main-Sequence stars.
","[{""version"":""v1"",""created"":""Mon, 29 Apr 2013 12:34:11 GMT""}]","2015-06-15"
"1304.7645","Franck Sabati\'e","C. Mezrag, H. Moutarde and F. Sabati\'e","Test of two new parameterizations of the Generalized Parton Distribution
  $H$","38 pages, 12 figures",,"10.1103/PhysRevD.88.014001","IRFU-13-94","hep-ph","http://arxiv.org/licenses/nonexclusive-distrib/1.0/","  In 2011 Radyushkin outlined the practical implementation of the One-Component
Double Distribution formalism in realistic Generalized Parton Distribution
models. We compare the One-Component Double Distribution framework to the
standard one and compute Deeply Virtual Compton Scattering observables for
both. In particular the new implementation is more flexible, offering a greater
range of variation of the real and imaginary parts of the associated Compton
Form Factor while still allowing to recover results similar to the classical
approach. Moreover the polynomiality property is satisfied up to the highest
order. Although the comparison to experimental data may be improved, the
One-Component Double Distribution modeling is thus an attractive alternative.
","[{""version"":""v1"",""created"":""Mon, 29 Apr 2013 12:34:59 GMT""}]","2013-08-09"
"1304.7646","Daniel Brito de Freitas","D. B. de Freitas, G. S. Fran\c{c}a, T. M. Scheerer, C. S. Vilar and R.
  Silva","Nonextensive triplet in geological faults system","5 pages, 6 figures, EPL accepted",,"10.1209/0295-5075/102/39001",,"physics.geo-ph","http://arxiv.org/licenses/nonexclusive-distrib/1.0/","  The San Andreas fault (SAF) in the USA is one of the most investigated
self-organizing systems in nature. In this paper, we studied some geophysical
properties of the SAF system in order to analyze the behavior of earthquakes in
the context of Tsallis's $q$--Triplet. To that end, we considered 134,573
earthquake events in magnitude interval $2\leq m<8$, taken from the Southern
Earthquake Data Center (SCEDC, 1932 - 2012). The values obtained
(""$q$--Triplet""$\equiv$$\{$$q$$_{stat}$,$q$$_{sen}$,$q$$_{rel}$$\}$) reveal
that the $q_{stat}$--Gaussian behavior of the aforementioned data exhibit
long-range temporal correlations. Moreover, $q_{sen}$ exhibits
quasi-monofractal behavior with a Hurst exponent of 0.87.
","[{""version"":""v1"",""created"":""Mon, 29 Apr 2013 12:45:45 GMT""}]","2015-06-15"
"1304.7647","Peihong Gu","Pei-Hong Gu","Parity: from strong CP problem to dark matter, neutrino masses and
  baryon asymmetry","6 pages",,,,"hep-ph","http://arxiv.org/licenses/nonexclusive-distrib/1.0/","  We show that in an SU(3)_c\times [SU(2)_L\times U(1)_Y]\times [SU(2)'_R\times
U(1)'_Y] framework, the parity symmetry motivated by solving the strong CP
problem without resorting to an axion can predict a dark matter particle with a
mass around 302 GeV. This dark matter candidate can be directly detected in the
presence of a U(1)_Y\times U(1)'_Y kinetic mixing. Furthermore, our model can
accommodate a natural way to simultaneously realize an inverse-linear seesaw
for neutrino masses and a resonant leptogenesis for baryon asymmetry.
","[{""version"":""v1"",""created"":""Mon, 29 Apr 2013 12:47:59 GMT""}]","2013-04-30"
"1304.7648","Stefan Muff","Stefan Muff, Fabian von Rohr, Gabriel Landolt, Bartosz Slomski,
  Andreas Schilling, Robert J. Cava, J\""urg Osterwalder, and J. Hugo Dil","Separating the bulk and surface n- to p-type transition in the
  topological insulator GeBi(4-x)SbxTe7","6 pages, 4 figures","Phys. Rev. B 88, 035407 (2013)","10.1103/PhysRevB.88.035407",,"cond-mat.mtrl-sci","http://arxiv.org/licenses/nonexclusive-distrib/1.0/","  We identify the multi-layered compound GeBi4Te7 to be a topological insulator
with a freestanding Dirac point, slightly above the valence band maximum, using
angle-resolved photoemission spectroscopy (ARPES) measurements. The spin
polarization satisffies the time reversal symmetry of the surface states,
visible in spin-resolved ARPES. For increasing Sb content in GeBi(4-x)SbxTe7 we
observe a transition from n- to p-type in bulk sensitive Seebeck coefficient
measurements at a doping of x = 0.6. In surface sensitive ARPES measurements a
rigid band shift is observed with Sb doping, accompanied by a movement of the
Dirac point towards the Fermi level. Between x = 0.8 and x = 1 the Fermi level
crosses the band gap, changing the surface transport regime. This difference of
the n- to p-type transition between the surface region and the bulk is caused
by band bending effects which are also responsible for a non-coexistence of
insulating phases in the bulk and in the near surface region.
","[{""version"":""v1"",""created"":""Mon, 29 Apr 2013 12:51:10 GMT""},{""version"":""v2"",""created"":""Fri, 15 Nov 2013 12:27:05 GMT""}]","2013-11-18"
"1304.7649","Fred Diamond","Fred Diamond and David Savitt","Serre weights for locally reducible two-dimensional Galois
  representations","30 pages, to appear in Journal of the Institute of Mathematics of
  Jussieu","Journal of the Institute of Mathematics of Jussieu 14 (2014)
  639-672","10.1017/S1474748014000164",,"math.NT","http://arxiv.org/licenses/nonexclusive-distrib/1.0/","  Let F be a totally real field, and v a place of F dividing an odd prime p. We
study the weight part of Serre's conjecture for continuous, totally odd,
two-dimensional mod p representations rhobar of the absolute Galois group of F
that are reducible locally at v. Let W be the set of predicted Serre weights
for the semisimplification of rhobar restricted to the decomposition group at
v. We prove that when the local representation is generic, the Serre weights in
W for which rhobar is modular are exactly the ones that are predicted (assuming
that rhobar is modular). We also determine precisely which subsets of W arise
as predicted weights when the local representation varies with fixed generic
semisimplification.
","[{""version"":""v1"",""created"":""Mon, 29 Apr 2013 12:53:49 GMT""},{""version"":""v2"",""created"":""Thu, 24 Apr 2014 17:28:27 GMT""}]","2015-06-10"
"1304.7650","Jose Maria Madiedo","J.M. Madiedo, J.M. Trigo-Rodriguez, N. Konovalova, I.P. Williams, A.J.
  Castro-Tirado, J.L. Ortiz and J. Cabrera-Ca\~no","The 2011 October Draconids Outburst. II. Meteoroid Chemical Abundances
  from Fireball Spectroscopy","Manuscript in press in Monthly Notices of the Royal Astronomical
  Society. Accepted for publication in MNRAS on April 28th, 2013 Manuscript
  Pages: 28 Tables: 5 Figures: 12. Manuscript associated: ""The 2011 October
  Draconids outburst. I. Orbital elements, meteoroid fluxes and
  21P/Giacobini-Zinner delivered mass to Earth"" by Trigo-Rodriguez et al. is
  also in press in the same journal","Madiedo J.M. et al. (2013), Monthly Notices of the Royal
  Astronomical Society (MNRAS) et al. (2013), Monthly Notices of the Royal","10.1093/mnras/stt748","MNRAS: MN-12-2856-MJ.R2","astro-ph.EP","http://arxiv.org/licenses/nonexclusive-distrib/1.0/","  On October 8, 2011 the Earth crossed dust trails ejected from comet
21P/Giacobini-Zinner in the late 19th and early 20th Century. This gave rise to
an outburst in the activity of the October Draconid meteor shower, and an
international team was organized to analyze this event. The SPanish Meteor
Network (SPMN) joined this initiative and recorded the October Draconids by
means of low light level CCD cameras. In addition, spectroscopic observations
were carried out. Tens of multi-station meteor trails were recorded, including
an extraordinarily bright October Draconid fireball (absolute mag. -10.5) that
was simultaneously imaged from three SPMN meteor ob-serving stations located in
Andalusia. Its spectrum was obtained, showing a clear evolution in the relative
intensity of emission lines as the fireball penetrated deeper into the
atmosphere. Here we focus on the analysis of this remarkable spectrum, but also
discuss the atmospheric trajectory, atmospheric penetration, and orbital data
computed for this bolide which was probably released during
21P/Giacobini-Zinner return to perihelion in 1907. The spectrum is discussed
together with the tensile strength for the October Draconid meteoroids. The
chemical profile evolution of the main rocky elements for this extremely bright
bolide is compared with the elemental abundances obtained for 5 October
Draconid fireballs also recorded during our spectroscopic campaign but observed
only at a single station. Significant chemical heterogeneity between the small
meteoroids is found as we should expect for cometary aggregates being formed by
diverse dust components.
","[{""version"":""v1"",""created"":""Mon, 29 Apr 2013 12:57:29 GMT""}]","2015-06-15"
"1304.7651","Damian Osajda","Damian Osajda and Jacek Swiatkowski","On asymptotically hereditarily aspherical groups","36 pages, minor modifications to v1",,"10.1112/plms/pdv021",,"math.GR","http://arxiv.org/licenses/nonexclusive-distrib/1.0/","  We undertake a systematic study of asymptotically hereditarily aspherical
(AHA) groups - the class of groups introduced by Tadeusz Januszkiewicz and the
second author as a tool for exhibiting exotic properties of systolic groups. We
provide many new examples of AHA groups, also in high dimensions. We relate AHA
property with the topology at infinity of a group, and deduce in this way some
new properties of (weakly) systolic groups. We also exhibit an interesting
property of boundary at infinity for few classes of AHA groups.
","[{""version"":""v1"",""created"":""Mon, 29 Apr 2013 13:00:10 GMT""},{""version"":""v2"",""created"":""Fri, 17 Apr 2015 10:47:01 GMT""}]","2015-06-12"
"1304.7652","Jordi Isern","J. Isern (CSIC-IEEC), S. Catalan (University of Hertfordshire), E.
  Garcia--Berro (Universitat Politecnica Catalunya - IEEC), M. Salaris
  (Liverpool John Moores University), S. Torres (Universitat Politecnica
  Catalunya - IEEC)","Axion cooling of white dwarfs","Proceedings of the 8th Patras Workshop on Axions, WIMPs and WISPs",,,,"astro-ph.SR","http://arxiv.org/licenses/nonexclusive-distrib/1.0/","  The evolution of white dwarfs is a simple gravothermal process. This process
can be tested in two ways, through the luminosity function of these stars and
through the secular variation of the period of pulsation of those stars that
are variable. Here we show how the mass of the axion can be constrained using
the white dwarf luminosity function.
","[{""version"":""v1"",""created"":""Mon, 29 Apr 2013 13:09:09 GMT""}]","2013-04-30"
"1304.7653","Xianwen Wang","Xianwen Wang, Wenli Mao, Shenmeng Xu, Chunbo Zhang","Usage History of Scientific Literature: Nature Metrics and Metrics of
  Nature Publications","11 pages, 5 figures and 4 tables","Scientometrics, 2014, 98(3), 1923-1933","10.1007/s11192-013-1167-5",,"cs.DL","http://arxiv.org/licenses/nonexclusive-distrib/1.0/","  In this study, we analyze the dynamic usage history of Nature publications
over time using Nature metrics data. We conduct analysis from two perspectives.
On the one hand, we examine how long it takes before the articles' downloads
reach 50%/80% of the total; on the other hand, we compare the percentage of
total downloads in 7 days, 30 days, and 100 days after publication. In general,
papers are downloaded most frequently within a short time period right after
their publication. And we find that compared with Non-Open Access papers,
readers' attention on Open Access publications are more enduring. Based on the
usage data of a newly published paper, regression analysis could predict the
future expected total usage counts.
","[{""version"":""v1"",""created"":""Mon, 29 Apr 2013 13:15:46 GMT""},{""version"":""v2"",""created"":""Wed, 23 Oct 2013 13:18:28 GMT""},{""version"":""v3"",""created"":""Mon, 23 Jun 2014 12:44:05 GMT""}]","2014-06-24"
"1304.7654","Adrian Jackson","Adrian Jackson and M. Sergio Campobasso","Optimised hybrid parallelisation of a CFD code on Many Core
  architectures","Submitted to the SC13 conference, 10 pages with 8 figures",,,,"cs.DC","http://arxiv.org/licenses/nonexclusive-distrib/1.0/","  COSA is a novel CFD system based on the compressible Navier-Stokes model for
unsteady aerodynamics and aeroelasticity of fixed structures, rotary wings and
turbomachinery blades. It includes a steady, time domain, and harmonic balance
flow solver.
  COSA has primarily been parallelised using MPI, but there is also a hybrid
parallelisation that adds OpenMP functionality to the MPI parallelisation to
enable larger number of cores to be utilised for a given simulation as the MPI
parallelisation is limited to the number of geometric partitions (or blocks) in
the simulation, or to exploit multi-threaded hardware where appropriate. This
paper outlines the work undertaken to optimise these two parallelisation
strategies, improving the efficiency of both and therefore reducing the
computational time required to compute simulations. We also analyse the power
consumption of the code on a range of leading HPC systems to further understand
the performance of the code.
","[{""version"":""v1"",""created"":""Mon, 29 Apr 2013 13:22:38 GMT""}]","2013-04-30"
"1304.7655","Erhan G\""uler","Erhan G\""uler and Yusuf Yayl{\i}","Isometric Surfaces and the Third Laplace-Beltrami","7 pages, 2 figures This paper has been withdrawn by the author due to
  a crucial error in some equations",,,,"math.DG","http://arxiv.org/licenses/nonexclusive-distrib/1.0/","  In this paper, classical isometric helicoidal and rotational surfaces are
studied, and generalized by Bour's theorem in three dimensional Euclidean
space. Moreover, the third Laplace-Beltrami operators of two classical surfaces
are obtained.
","[{""version"":""v1"",""created"":""Mon, 29 Apr 2013 13:24:08 GMT""},{""version"":""v2"",""created"":""Fri, 18 Nov 2016 06:51:09 GMT""}]","2016-11-21"
"1304.7656","Ben Rozitis Ph.D.","Ben Rozitis, Simon F. Green","The Influence of Global Self-Heating on the Yarkovsky and YORP Effects","39 pages, 12 figures, 3 tables. Accepted by MNRAS",,"10.1093/mnras/stt750",,"astro-ph.EP","http://arxiv.org/licenses/nonexclusive-distrib/1.0/","  We present an adaptation of the ATPM to simultaneously predict the Yarkovsky
and YORP effects in the presence of global self-heating that occurs within the
large concavities of irregularly shaped asteroids, which has been neglected or
dismissed in all previous models. It is also combined with rough surface
thermal-infrared beaming effects, which have been previously shown to enhance
the Yarkovsky-orbital-drift and dampen on average the
YORP-rotational-acceleration by orders of several tens of per cent. Tests on
all published concave shape models of near-Earth asteroids, and also on one
hundred Gaussian-random-spheres, show that the Yarkovsky effect is sensitive to
shadowing and global self-heating effects at the few per cent level or less.
For simplicity, Yarkovsky models can neglect these effects if the level of
accuracy desired is of this order. Unlike the Yarkovsky effect, the YORP effect
can be very sensitive to shadowing and global self-heating effects. Its
sensitivity increases with decreasing relative strength of the
YORP-rotational-acceleration, and doesn't appear to depend greatly on the
degree of asteroid concavity. Global self-heating tends to produce a vertical
offset in an asteroid's YORP-rotational-acceleration versus obliquity curve
which is in opposite direction to that produced by shadowing effects. It also
ensures that at least one critical obliquity angle exists at which zero
YORP-rotational-acceleration occurs. Global self-heating must be included for
accurate predictions of the YORP effect if an asteroid exhibits a large
shadowing effect. If global self-heating effects are not included then it is
found in ~75 per cent of cases that better predictions are produced when
shadowing is also not included. Furthermore, global self-heating has
implications for reducing the sensitivity of the YORP effect predictions to
detailed variations in an asteroid's shape model.
","[{""version"":""v1"",""created"":""Mon, 29 Apr 2013 13:25:09 GMT""}]","2015-06-15"
"1304.7657","Erhan G\""uler","Erhan Guler, Semra Saracoglu Celik, and Yusuf Yayl{\i}","(T,L)-type rotational surface in three dimensional Lorentz-Minkowski
  space","7 pages, 1 figures This paper has been withdrawn by the author due to
  a crucial error in some equations",,,,"math.DG","http://arxiv.org/licenses/nonexclusive-distrib/1.0/","  We study the third Laplace-Beltrami operator of timelike rotational surface
of (T,L)-type in three dimensional Lorentz-Minkowski space.
","[{""version"":""v1"",""created"":""Mon, 29 Apr 2013 13:31:38 GMT""},{""version"":""v2"",""created"":""Fri, 17 Apr 2015 15:44:15 GMT""},{""version"":""v3"",""created"":""Fri, 18 Nov 2016 06:50:35 GMT""}]","2016-11-21"
"1304.7658","Giada Valle","G. Valle, M. Dell'Omodarme, P.G. Prada Moroni, S. Degl'Innocenti","Cumulative physical uncertainty in modern stellar models. II. The
  dependence on the chemical composition","Accepted for publication in A&A","A&A, 554, A68 (2013)","10.1051/0004-6361/201321142",,"astro-ph.SR","http://arxiv.org/licenses/nonexclusive-distrib/1.0/","  We extend our work on the effects of the uncertainties on the main input
physics for the evolution of low-mass stars. We analyse the dependence of the
cumulative physical uncertainty affecting stellar tracks on the chemical
composition. We calculated more than 6000 stellar tracks and isochrones, with
metallicity ranging from Z = 0.0001 to 0.02, by changing the following physical
inputs within their current range of uncertainty: 1H(p,nu e+)2H,
14N(p,gamma)15O and triple-alpha reaction rates, radiative and conductive
opacities, neutrino energy losses, and microscopic diffusion velocities. The
analysis was performed using a latin hypercube sampling design. We examine in a
statistical way the dependence on the variation of the physical inputs of the
turn-off (TO) luminosity, the central hydrogen exhaustion time (t_H), the
luminosity and the helium core mass at the red-giant branch (RGB) tip, and the
zero age horizontal branch (ZAHB) luminosity in the RR Lyrae region. For the
stellar tracks, an increase from Z = 0.0001 to Z = 0.02 produces a cumulative
physical uncertainty in TO luminosity from 0.028 dex to 0.017 dex, while the
global uncertainty on t_H increases from 0.42 Gyr to 1.08 Gyr. For the RGB tip,
the cumulative uncertainty on the luminosity is almost constant at 0.03 dex,
whereas the one the helium core mass decreases from 0.0055 M_sun to 0.0035
M_sun. The dependence of the ZAHB luminosity error is not monotonic with Z, and
it varies from a minimum of 0.036 dex at Z = 0.0005 to a maximum of 0.047 dex
at Z = 0.0001. Regarding stellar isochrones of 12 Gyr, the cumulative physical
uncertainty on the predicted TO luminosity and mass increases respectively from
0.012 dex to 0.014 dex and from 0.0136 M_sun to 0.0186 M_sun. Consequently, for
ages typical of galactic globular clusters, the uncertainty on the age inferred
from the TO luminosity increases from 325 Myr to 415 Myr.
","[{""version"":""v1"",""created"":""Mon, 29 Apr 2013 13:38:00 GMT""}]","2013-06-06"
