"1304.7862","EPTCS","Bernard van Gastel (Open University of the Netherlands), Julien
  Schmaltz (Open University of the Netherlands)","A formalisation of XMAS","In Proceedings ACL2 2013, arXiv:1304.7123","EPTCS 114, 2013, pp. 111-126","10.4204/EPTCS.114.9",,"cs.AR cs.LO","http://arxiv.org/licenses/nonexclusive-distrib/1.0/","  Communication fabrics play a key role in the correctness and performance of
modern multi-core processors and systems-on-chip. To enable formal
verification, a recent trend is to use high-level micro-architectural models to
capture designers' intent about the communication and processing of messages.
Intel proposed the xMAS language to support the formal definition of executable
specifications of micro-architectures. We formalise the semantics of xMAS in
ACL2. Our formalisation represents the computation of the values of all wires
of a design. Our main function computes a set of possible routing targets for
each message and whether a message can make progress according to the current
network state. We prove several properties on the semantics, including
termination, non-emptiness of routing, and correctness of progress conditions.
Our current effort focuses on a basic subset of the entire xMAS language, which
includes queues, functions, and switches.
","[{""version"":""v1"",""created"":""Tue, 30 Apr 2013 04:14:53 GMT""}]","2013-05-01"
"1304.7863","EPTCS","David S. Hardin (Rockwell Collins), Samuel S. Hardin (Iowa State
  University)","ACL2 Meets the GPU: Formalizing a CUDA-based Parallelizable All-Pairs
  Shortest Path Algorithm in ACL2","In Proceedings ACL2 2013, arXiv:1304.7123","EPTCS 114, 2013, pp. 127-142","10.4204/EPTCS.114.10",,"cs.LO cs.DS","http://arxiv.org/licenses/nonexclusive-distrib/1.0/","  As Graphics Processing Units (GPUs) have gained in capability and GPU
development environments have matured, developers are increasingly turning to
the GPU to off-load the main host CPU of numerically-intensive, parallelizable
computations. Modern GPUs feature hundreds of cores, and offer programming
niceties such as double-precision floating point, and even limited recursion.
This shift from CPU to GPU, however, raises the question: how do we know that
these new GPU-based algorithms are correct?
  In order to explore this new verification frontier, we formalized a
parallelizable all-pairs shortest path (APSP) algorithm for weighted graphs,
originally coded in NVIDIA's CUDA language, in ACL2. The ACL2 specification is
written using a single-threaded object (stobj) and tail recursion, as the
stobj/tail recursion combination yields the most straightforward translation
from imperative programming languages, as well as efficient, scalable
executable specifications within ACL2 itself. The ACL2 version of the APSP
algorithm can process millions of vertices and edges with little to no garbage
generation, and executes at one-sixth the speed of a host-based version of APSP
coded in C- a very respectable result for a theorem prover.
  In addition to formalizing the APSP algorithm (which uses Dijkstra's shortest
path algorithm at its core), we have also provided capability that the original
APSP code lacked, namely shortest path recovery. Path recovery is accomplished
using a secondary ACL2 stobj implementing a LIFO stack, which is proven
correct. To conclude the experiment, we ported the ACL2 version of the APSP
kernels back to C, resulting in a less than 5% slowdown, and also performed a
partial back-port to CUDA, which, surprisingly, yielded a slight performance
increase.
","[{""version"":""v1"",""created"":""Tue, 30 Apr 2013 04:15:02 GMT""}]","2013-05-01"
"1304.7864","Gobithaasan Rudrusamy","Gobithasan Rudrusamy, Azrudin Ahmad, Rahmat Budiarto, Azman Samsudin,
  Sureswaran Ramadass","Fuzzy Based Diagnostics System for Identifying Network Traffic Flow
  Anomalies",,"2003 Proceedings of the International Conference of Robotics,
  Vision, Information and Signal Processing ROVISP, Penang, IEEE, Pg.190-195",,,"cs.NI","http://arxiv.org/licenses/nonexclusive-distrib/1.0/","  This paper discusses the usage of network traffic properties in passive
network monitoring which are used in recognizing and identifying anomaly.
","[{""version"":""v1"",""created"":""Tue, 30 Apr 2013 04:23:11 GMT""}]","2013-05-01"
"1304.7865","Olga Shut A.","S.A.Firstov, T.R.Rogul, O.A.Shut","Critical grain sizes and generalized flow stress - grain size dependence","7 pages",,,,"cond-mat.mtrl-sci","http://arxiv.org/licenses/nonexclusive-distrib/1.0/","  The generalized eguation that describes the yield stress dependence upon the
grain size in the wide range of grain sizes has been obtained. There are two
critical grain sizes that corresponds to the changes in strengthening
mechanism. The equation includes Hall - Petch relation in the range of d>dcr1.
For dcr1>d>dcr2, the power in the Hall - Petch relation varies from -1/2 to -1.
In a nanometer (nm) range (d<dcr2) there are posibileties of softerning (in
case of ""weak"" boundaries) as well as significant strengthening (in case of
""srtong"" boundaries).
","[{""version"":""v1"",""created"":""Tue, 30 Apr 2013 04:23:22 GMT""}]","2013-05-01"
"1304.7866","BingRan He","Bing-Ran He and Masayasu Harada","Parity doubling structure of nucleon at non-zero density in the
  holographic mean field theory","9 pages, 7 figures","Phys. Rev. D 88, 095007 (2013)","10.1103/PhysRevD.88.095007",,"hep-ph hep-th nucl-th","http://arxiv.org/licenses/nonexclusive-distrib/1.0/","  We develope the holographic mean field theory approach in a bottom-up
holographic QCD model including baryons and scalar mesons in addition to vector
mesons and pions. We study the effect of parity doubling structure of baryons
at non-zero density to the equation of state between the chemical potential and
the baryon number density. We first show that we can adjust the amount of
nucleon mass coming from the chiral symmetry breaking by changing the boundary
value of the five-dimensional baryon fields. Then, introducing the mean field
for the baryon fields, we calculate the equation of state between the baryon
number density and its corresponding chemical potential. Then, comparing the
predicted equation of state with the one obtained in a Walecka type model, we
extract the density dependence of the effective nucleon mass. The result shows
that the effective mass decreases with increasing density, and that the rate of
decreasing is more rapid for the larger percentage of the mass coming from the
chiral symmetry breaking.
","[{""version"":""v1"",""created"":""Tue, 30 Apr 2013 04:24:00 GMT""},{""version"":""v2"",""created"":""Tue, 11 Jun 2013 07:14:05 GMT""}]","2013-11-20"
"1304.7867","Akifumi Notsu","Akifumi Notsu, Osamu Komori, Shinto Eguchi","Spontaneous Clustering via Minimum \gamma-divergence",,,,,"stat.ME","http://arxiv.org/licenses/nonexclusive-distrib/1.0/","  We propose a new method for clustering based on the local minimization of the
\gamma-divergence, which we call the spontaneous clustering. The greatest
advantage of the proposed method is that it automatically detects the number of
clusters that adequately reflect the data structure. In contrast, exiting
methods such as K-means, fuzzy c-means, and model based clustering need to
prescribe the number of clusters. We detect all the local minimum points of the
\gamma-divergence, which are defined as the centers of clusters. A necessary
and sufficient condition for the \gamma-divergence to have the local minimum
points is also derived in a simple setting. A simulation study and a real data
analysis are performed to compare our proposal with existing methods.
","[{""version"":""v1"",""created"":""Tue, 30 Apr 2013 04:26:24 GMT""}]","2013-05-01"
"1304.7868","Gobithaasan Rudrusamy","Rozaimi Zakaria, Abd. Fatah Wahab, R.U. Gobithaasan","Normal type-2 Fuzzy Rational B-Spline Curve",,"2013 Int. Journal of Math. Analysis, 7(16), Pg.789-806",,,"cs.GR","http://arxiv.org/licenses/nonexclusive-distrib/1.0/","  In this paper, we proposed a new form of type-2 fuzzy data points(T2FDPs)
that is normal type-2 data points(NT2FDPs). These brand-new forms of data were
defined by using the definition of normal type-2 triangular fuzzy
number(NT2TFN). Then, we applied fuzzification(alpha-cut) and type-reduction
processes towards NT2FDPs after they had been redefined based on the situation
of NT2FDPs. Furthermore, we redefine the defuzzification definition along with
the new definitions of fuzzification process and type-reduction method to
obtain crisp type-2 fuzzy solution data points. For all these processes from
the defining the NT2FDPs to defuzzification of NT2FDPs, we demonstrate through
curve representation by using the rational B-spline curve function as the
example form modeling these NT2FDPs.
","[{""version"":""v1"",""created"":""Tue, 30 Apr 2013 04:27:35 GMT""}]","2013-05-01"
"1304.7869","Vinicius Placco","Vinicius M. Placco, Anna Frebel, Timothy C. Beers, Amanda I. Karakas,
  Catherine R. Kennedy, Silvia Rossi, Norbert Christlieb and Richard J.
  Stancliffe","Metal-Poor Stars Observed with the Magellan Telescope I. Constraints on
  Progenitor Mass and Metallicity of AGB Stars Undergoing s-Process
  Nucleosynthesis","Accepted for publication in ApJ",,"10.1088/0004-637X/770/2/104",,"astro-ph.GA astro-ph.SR","http://arxiv.org/licenses/nonexclusive-distrib/1.0/","  We present a comprehensive abundance analysis of two newly-discovered
carbon-enhanced metal-poor (CEMP) stars. HE2138-3336 is a s-process-rich star
with [Fe/H] = -2.79, and has the highest [Pb/Fe] abundance ratio measured thus
far, if NLTE corrections are included ([Pb/Fe] = +3.84). HE2258-6358, with
[Fe/H] = -2.67, exhibits enrichments in both s- and r-process elements. These
stars were selected from a sample of candidate metal-poor stars from the
Hamburg/ESO objective-prism survey, and followed up with medium-resolution (R ~
2,000) spectroscopy with GEMINI/GMOS. We report here on derived abundances (or
limits) for a total of 34 elements in each star, based on high-resolution (R ~
30,000) spectroscopy obtained with Magellan-Clay/MIKE. Our results are compared
to predictions from new theoretical AGB nucleosynthesis models of 1.3 Mo with
[Fe/H] = -2.5 and -2.8, as well as to a set of AGB models of 1.0 to 6.0 Mo at
[Fe/H] = -2.3. The agreement with the model predictions suggests that the
neutron-capture material in HE2138-3336 originated from mass transfer from a
binary companion star that previously went through the AGB phase, whereas for
HE2258-6358, an additional process has to be taken into account to explain its
abundance pattern. We find that a narrow range of progenitor masses (1.0 <
M(Mo) < 1.3) and metallicities (-2.8 < [Fe/H] < -2.5) yield the best agreement
with our observed elemental abundance patterns.
","[{""version"":""v1"",""created"":""Tue, 30 Apr 2013 04:27:48 GMT""}]","2015-06-15"
"1304.7870","Brendan Pawlowski","Sara Billey, Brendan Pawlowski","Permutation patterns, Stanley symmetric functions and generalized Specht
  modules","29 pages; corrected typos in section 3, fixed arguments and improved
  results in section 6",,,,"math.CO","http://arxiv.org/licenses/nonexclusive-distrib/1.0/","  Generalizing the notion of a vexillary permutation, we introduce a filtration
of S_infinity by the number of Schur function terms in the Stanley symmetric
function, with the kth filtration level called the k-vexillary permutations. We
show that for each k, the k-vexillary permutations are characterized by
avoiding a finite set of patterns. A key step is the construction of a Specht
series, in the sense of James and Peel, for the Specht module associated to the
diagram of a permutation. As a corollary, we prove a conjecture of Liu on
diagram varieties for certain classes of permutation diagrams. We apply similar
techniques to characterize multiplicity-free Stanley symmetric functions, as
well as permutations whose diagram is equivalent to a forest in the sense of
Liu.
","[{""version"":""v1"",""created"":""Tue, 30 Apr 2013 04:30:19 GMT""},{""version"":""v2"",""created"":""Fri, 12 Jul 2013 08:05:38 GMT""}]","2013-07-15"
"1304.7871","Qiang Zhang","Guo-Liang Shentu, Jason S. Pelc, Xiao-Dong Wang, Qi-Chao Sun,
  Ming-Yang Zheng, M. M. Fejer, Qiang Zhang, Jian-Wei Pan","Ultralow noise up-conversion detector and spectrometer at telecom band","6 pages, 3 figures","Optics Express, 21, 13986, (2013)","10.1364/OE.21.013986",,"quant-ph physics.ins-det physics.optics","http://arxiv.org/licenses/nonexclusive-distrib/1.0/","  We demonstrate upconversion single-photon detection for the 1550-nm band
using a PPLN waveguide, long-wavelength pump, and narrowband filtering using a
volume Bragg grating. We achieve total-system detection efficiency of around
30% with noise at the dark-count level of a silicon APD. Based on the new
detector, a single-pixel up-conversion infrared spectrometer with a noise
equivalent power of -142 dBm was demonstrated, which was better than liquid
nitrogen cooled InGaAs arrary.
","[{""version"":""v1"",""created"":""Tue, 30 Apr 2013 04:32:58 GMT""}]","2016-12-21"
"1304.7872","Atul Dixit","Tewodros Amdeberhan, Atul Dixit, Xiao Guan, Lin Jiu and Victor H. Moll","The unimodality of a polynomial coming from a rational integral. Back to
  the original proof","12 pages, Submitted for publication",,,,"math.CA math.NT","http://arxiv.org/licenses/nonexclusive-distrib/1.0/","  A sequence of coefficients that appeared in the evaluation of a rational
integral has been shown to be unimodal. An alternative proof is presented.
","[{""version"":""v1"",""created"":""Tue, 30 Apr 2013 04:38:00 GMT""}]","2013-05-01"
"1304.7873","Daniel Krefl","Daniel Krefl and Albert Schwarz","Refined Chern-Simons versus Vogel universality","18 pages; v2: Some clarifications and corrections","Journal of Geometry and Physics, Vol. 74, Dec. 2013, p.119-129","10.1016/j.geomphys.2013.08.002","UCB-PTH-13/04","hep-th","http://arxiv.org/licenses/nonexclusive-distrib/1.0/","  We study the relation between the partition function of refined SU(N) and
SO(2N) Chern-Simons on the 3-sphere and the universal Chern-Simons partition
function in the sense of Mkrtchyan and Veselov. We find a four-parameter
generalization of the integral representation of universal Chern-Simons that
includes refined SU(N) and SO(2N) Chern-Simons for special values of
parameters. The large N expansion of the integral representation of refined
SU(N) Chern-Simons explicitly shows the replacement of the virtual Euler
characteristic of the moduli space of complex curves with a refined Euler
characteristic related to the radius deformed c=1 string free energy.
","[{""version"":""v1"",""created"":""Tue, 30 Apr 2013 04:40:53 GMT""},{""version"":""v2"",""created"":""Tue, 14 May 2013 04:54:13 GMT""}]","2013-09-06"
"1304.7874","Tian Yang","Ran Li, Hui Yi, Xiao Hu, Leng Chen, Guangsha Shi, Weimin Wang and Tian
  Yang","Generation of Diffraction-Free Optical Beams Using Wrinkled Membranes","6 pages, 5 figures",,"10.1038/srep02775",,"physics.optics cond-mat.soft","http://arxiv.org/licenses/nonexclusive-distrib/1.0/","  We report the first demonstration of wrinkled membranes as a kind of optical
focusing devices, which are low cost, light weight and flexible. Our device
consists of concentric wrinkle rings on a gold-PDMS bilayer membrane, which
converts collimated illuminations to diffraction-free focused beams. Beam
diameters of 300-400 {\mu}m have been observed in the visible range. By
comparing the theoretically calculated and experimentally measured focal spot
profiles, we predict a focal spot size as small as around 50 {\mu}m if
fabrication eccentricity can be eliminated.
","[{""version"":""v1"",""created"":""Tue, 30 Apr 2013 04:43:18 GMT""}]","2015-12-04"
"1304.7875","EPTCS","Sebastiaan J. C. Joosten, Bernard van Gastel, Julien Schmaltz","A Macro for Reusing Abstract Functions and Theorems","In Proceedings ACL2 2013, arXiv:1304.7123","EPTCS 114, 2013, pp. 29-41","10.4204/EPTCS.114.3",,"cs.LO cs.PL","http://arxiv.org/licenses/nonexclusive-distrib/1.0/","  Even though the ACL2 logic is first order, the ACL2 system offers several
mechanisms providing users with some operations akin to higher order logic
ones. In this paper, we propose a macro, named instance-of-defspec, to ease the
reuse of abstract functions and facts proven about them. Defspec is an ACL2
book allowing users to define constrained functions and their associated
properties. It contains macros facilitating the definition of such abstract
specifications and instances thereof. Currently, lemmas and theorems derived
from these abstract functions are not automatically instantiated. This is
exactly the purpose of our new macro. instance-of-defspec will not only
instantiate functions and theorems within a specification but also many more
functions and theorems built on top of the specification. As a working example,
we describe various fold functions over monoids, which we gradually built from
arbitrary functions.
","[{""version"":""v1"",""created"":""Tue, 30 Apr 2013 04:43:47 GMT""}]","2013-05-01"
"1304.7876","Alina Bucur","Alina Bucur, Chantal David, Brooke Feigon, Matilde Lalin","Statistics for ordinary Artin-Schreier covers and other $p$-rank strata","34 pages",,,,"math.NT","http://arxiv.org/licenses/nonexclusive-distrib/1.0/","  We study the distribution of the number of points and of the zeroes of the
zeta function in different $p$-rank strata of Artin-Schreier covers over $\F_q$
when $q$ is fixed and the genus goes to infinity. The $p$-rank strata
considered include the ordinary family, the whole family, and the family of
curves with $p$-rank equal to $p-1.$ While the zeta zeroes always approach the
standard Gaussian distribution, the number of points over $\F_q$ has a
distribution that varies with the specific family.
","[{""version"":""v1"",""created"":""Tue, 30 Apr 2013 04:54:20 GMT""}]","2013-05-01"
"1304.7877","Nathan Hall","N. L. Hall, P. G. Blunden, W. Melnitchouk, A. W. Thomas, and R. D.
  Young","Constrained gamma-Z interference corrections to parity-violating
  electron scattering","38 pages, 16 figures, to appear in Phys. Rev. D",,"10.1103/PhysRevD.88.013011","ADP-12-19/T786, JLAB-THY-13-1698","nucl-th hep-ph nucl-ex","http://arxiv.org/licenses/nonexclusive-distrib/1.0/","  We present a comprehensive analysis of gamma-Z interference corrections to
the weak charge of the proton measured in parity-violating electron scattering,
including a survey of existing models and a critical analysis of their
uncertainties. Constraints from parton distributions in the deep-inelastic
region, together with new data on parity-violating electron scattering in the
resonance region, result in significantly smaller uncertainties on the
corrections compared to previous estimates. At the kinematics of the Qweak
experiment, we determine the gamma-Z box correction to be ReBox^V_{gamma-Z} =
(5.57 +- 0.36) x 10^{-3}. The new constraints also allow precise predictions to
be made for parity-violating deep-inelastic asymmetries on the deuteron.
","[{""version"":""v1"",""created"":""Tue, 30 Apr 2013 05:01:53 GMT""},{""version"":""v2"",""created"":""Thu, 18 Jul 2013 23:13:27 GMT""}]","2013-08-09"
"1304.7878","Qian Zhao","Qian Zhao, Jiaqin Wei, Rongming Wang","On the Dividend Strategies with Non-Exponential Discounting","2 figures",,,,"q-fin.PM","http://arxiv.org/licenses/nonexclusive-distrib/1.0/","  In this paper, we study the dividend strategies for a shareholder with
non-constant discount rate in a diffusion risk model. We assume that the
dividends can only be paid at a bounded rate and restrict ourselves to the
Markov strategies. This is a time inconsistent control problem. The extended
HJB equation is given and the verification theorem is proved for a general
discount function. Considering the pseudo-exponential discount functions (Type
I and Type II), we get the equilibrium dividend strategies and the equilibrium
value functions by solving the extended HJB equations.
","[{""version"":""v1"",""created"":""Tue, 30 Apr 2013 05:12:05 GMT""},{""version"":""v2"",""created"":""Tue, 5 Nov 2013 01:15:23 GMT""}]","2013-11-06"
"1304.7879","Nikola Veselinovic","A.Dragi\'c, N. Veselinovi\'c, D. Maleti\'c, D. Jokovi\'c, R Banjanac,
  V. Udovi\v{c}i\'c, I. Ani\v{c}in","Further investigations into the connection between cosmic rays and
  climate","9 pages, 3 figures",,,,"physics.ao-ph","http://arxiv.org/licenses/nonexclusive-distrib/1.0/","  Our previous results on the connection between the Forbush decreases (FD) of
cosmic-ray intensity and the deviations from the expected values of the diurnal
temperature range (DTR) are briefly revisited. The same type of analysis is
then extended to the cases of sudden increases of cosmic-ray intensity (GLE),
as well as to the search for lattitude effects in the observed correlations. We
find that all the investigated correlations appear to manifest both the
expected signs and the plausible phase relations, though each one only at the
modest confidence level. Moreover, it appears that there is some
proportionality between the magnitude of a cosmic-ray intensity change and a
corresponding DTR deviation, both in the case of FD and GLE events. Eventual
increase of the confidence levels at which these correlations are established
would have to wait for the significant increase of the number of well defined
and sufficiently intense recorded departures of cosmic-ray intensity from its
stationary mean value. On the other hand, the probability of such an accidental
multiple coincidence of independent pieces of evidence is certainly very low.
","[{""version"":""v1"",""created"":""Tue, 30 Apr 2013 05:14:09 GMT""}]","2013-05-01"
"1304.7880","Simone Melchionna","Umberto Marini Bettolo Marconi and Simone Melchionna","Weighted density Lattice Boltzmann approach to fluids under confinement","Molecular Physics 2013",,"10.1080/00268976.2013.771801",,"cond-mat.stat-mech cond-mat.soft","http://arxiv.org/licenses/nonexclusive-distrib/1.0/","  The Enskog-like kinetic approach, recently introduced by us to study strongly
inhomogeneous flu- ids, is reconsidered in order to improve the description of
the transport coefficients. The approach is based on a separation of the
interaction between hydrodynamic and non-hydrodynamic parts. The latter is
treated within a simple relaxation approximation. We show that, by considering
the non-hydrodynamic part via a weighted density approximation, we obtain a
better prediction of the transport coefficients. By virtue of the simplicity of
the kinetic equation we are able to solve numer- ically the phase space
distribution in the presence of inhomogeneities, such as confining surfaces,
via a Lattice Boltzmann method. Analytical estimates of the importance of these
corrections to the transport coefficients in bulk conditions is provided.
Poiseuille flow of the hard-sphere fluid confined between two parallel smooth
walls is studied and their pore-averaged properties are determined.
","[{""version"":""v1"",""created"":""Tue, 30 Apr 2013 05:22:26 GMT""}]","2013-05-01"
"1304.7881","Gobithaasan Rudrusamy","R.U. Gobithaasan","Various Types of Aesthetic Curves",,"2011 The Proceedings of Seminar Bidang Kepakaran Jabatan Matematik
  2010, Cherating, Pahang. Disember 27th- 30th 2010, Pg.9-22",,,"cs.GR","http://arxiv.org/licenses/nonexclusive-distrib/1.0/","  The research on developing planar curves to produce visually pleasing
products (ranges from electric appliances to car body design) and
indentifying/modifying planar curves for special purposes namely for railway
design, highway design and robot trajectories have been progressing since
1970s. The pattern of research in this field of study has branched to five
major groups namely curve synthesis, fairing process, improvement in control of
natural spiral, construction of new type of planar curves and, natural spiral
fitting & approximation techniques. The purpose of is this paper is to briefly
review recent progresses in Computer Aided Geometric Design (CAGD) focusing on
the topics states above.
","[{""version"":""v1"",""created"":""Tue, 30 Apr 2013 05:25:31 GMT""}]","2013-05-01"
"1304.7882","Qian Zhao","Qian Zhao, Jiaqin Wei, Rongming Wang","Mean-Variance Asset-Liability Management with State-Dependent Risk
  Aversion","12 figures",,,,"q-fin.RM","http://arxiv.org/licenses/nonexclusive-distrib/1.0/","  In this paper, we consider the asset-liability management under the
mean-variance criterion. The financial market consists of a risk-free bond and
a stock whose price process is modeled by a geometric Brownian motion. The
liability of the investor is uncontrollable and is modeled by another geometric
Brownian motion. We consider a specific state-dependent risk aversion which
depends on a power function of the liability. By solving a flow of FBSDEs with
bivariate state process, we obtain the equilibrium strategy among all the
open-loop controls for this time-inconsistent control problem. It shows that
the equilibrium strategy is a feedback control of the liability.
","[{""version"":""v1"",""created"":""Tue, 30 Apr 2013 05:27:44 GMT""}]","2013-05-01"
"1304.7883","Gobithaasan Rudrusamy","R.U. Gobithaasan, Jamaludin Md. Ali and Kenjiro T. Miura","An Improvised Algorithm to Identify The Beauty of A Planar Curve",,"2008 The Proceedings of Simposium Kebangsaan Sains Matematik ke-16
  (SKSM16), Kota Bharu, Kelantan. June 3rd-5th 2008, Pg.223-228",,,"cs.GR","http://arxiv.org/licenses/nonexclusive-distrib/1.0/","  An improvised algorithm is proposed based on the work of Yoshimoto and
Harada. The improvised algorithm results a graph which is called LDGC or
Logarithmic Distribution Graph of Curvature. This graph has the capability to
identify the beauty of monotonic planar curves with less effort as compared to
LDDC by Yoshimoto and Harada.
","[{""version"":""v1"",""created"":""Tue, 30 Apr 2013 05:30:00 GMT""}]","2013-05-01"
