"1304.7961","Chang-Seong Moon","CDF Collaboration","Measurement of the top-quark pair production cross-section in events
  with two leptons and bottom-quark jets using the full CDF data set","Submitted to Phys. Rev. D (R)","Phys. Rev. D 88, 091103 (2013)","10.1103/PhysRevD.88.091103","FERMILAB-PUB-13-122-E","hep-ex","http://creativecommons.org/licenses/publicdomain/","  We present a measurement of the top-quark pair production cross-section in
proton-antiproton collisions at $\sqrt{s}$=1.96 TeV. The data were collected at
the Fermilab Tevatron by the CDF II detector and correspond to an integrated
luminosity of 8.8 fb$^{-1}$, representing the complete CDF Run II data set. We
select events consistent with the production of top-quark pairs by requiring
the presence of two reconstructed leptons, an imbalance in the total event
transverse momentum, and jets. At least one jet is required to be identified as
consistent with the fragmentation of a bottom quark using a
secondary-vertex-finding algorithm. The 246 candidate events are estimated to
have a signal purity of 91%. We measure a cross section of $\sigma_{\ttbar}$ =
7.09 $\pm$ 0.84 pb, assuming a top-quark mass of 172.5 GeV/$c^{2}$. The results
are consistent with the standard model as predicted by next-to-leading-order
calculations.
","[{""version"":""v1"",""created"":""Tue, 30 Apr 2013 11:46:16 GMT""},{""version"":""v2"",""created"":""Wed, 7 Aug 2013 22:19:01 GMT""},{""version"":""v3"",""created"":""Sun, 6 Oct 2013 19:57:06 GMT""}]","2013-11-20"
"1304.7962","Andrei Maimistov","Elena V. Kazantseva and Andrey I. Maimistov","Nonlinear waves in a positive-negative coupled waveguide zigzag array","8 pages, 12 figs",,,,"physics.optics","http://arxiv.org/licenses/nonexclusive-distrib/1.0/","  We consider the coupled electromagnetic waves propagating in a waveguide
array, which consists of alternating waveguides of positive and negative
refraction indexes. Due to zigzag configuration there are interactions between
both nearest and next nearest neighboring waveguides exist. It is shown that
there is a stop band in the spectrum of linear waves. The system of evolution
equations for coupled waves has the steady state solution describing the
electromagnetic pulse running in the array. Numerical simulation demonstrates
robustness of these solitary waves.
","[{""version"":""v1"",""created"":""Tue, 30 Apr 2013 11:47:10 GMT""}]","2013-05-01"
"1304.7963","Ye Luo","Ye Luo","Tropical Convexity and Canonical Projections","29 pages, 2 figures",,,,"math.CO","http://arxiv.org/licenses/nonexclusive-distrib/1.0/","  Using a potential theory on metric graphs ""Gamma"", we introduce the notion of
tropical convexity to the space ""RDiv^d(Gamma)"" of effective R-divisors of
degree d on ""Gamma"" and show that a natural metric can be defined on
""RDiv^d(Gamma)"". In addition, we extend the notion of reduced divisors which is
conventionally defined in a complete linear system |D| with respect to a single
point in ""Gamma"". In our general setting, a reduced divisor is defined uniquely
as an R-divisor in a compact tropical convex subset ""T"" of ""RDiv^d(Gamma)"" with
respect to a certain R-divisor ""E"" of the same degree d. In this sense, we
consider reduced divisors as canonical projections onto ""T"". We also
investigate some basic properties of tropical convex sets using techniques
developed from general reduced divisors.
","[{""version"":""v1"",""created"":""Tue, 30 Apr 2013 11:47:38 GMT""}]","2013-05-01"
"1304.7964","J\'anos T\'oth PhD","J. T\'oth and A. L. Nagy and I. Zs\'ely","Structural Analysis of Combustion Mechanisms","35 pages, 11 figures, based on a lecture presented at Mathematics in
  Chemical Kinetics and Engineering, Feb. 4-6, 2013, Chennai, India. Electronic
  supplements: http://www.math.bme.hu/~jtoth/CES2013",,,,"physics.chem-ph","http://arxiv.org/licenses/nonexclusive-distrib/1.0/","  39 detailed mechanisms for combustion of hydrogen, carbon monoxide and
methanol are investigated using ReactionKinetics, a Mathematica based package.
The obtained results in most cases do not depend on the choice of reaction rate
coefficients, the methods only use the underlying sets of reaction steps, thus
the results are robust and general in a certain sense. These investigations can
be used before or in parallel with usual numerical investigations, such as
pathway analysis, sensitivity analysis, parameter estimation or simulation.
  The considered hydrogen mechanisms shared 90% of common reaction steps. The
CO combustion mechanisms show a larger variety both in species and in reaction
steps. There exist only a few methanol combustion mechanisms; the big
differences between them shows that the modelling community is only at the very
beginning of exploring this process.
  The package and the methods may be useful for automatic mechanism
generations, testing, comparing and reduction of mechanisms as well, especially
in the case of large systems.
","[{""version"":""v1"",""created"":""Tue, 30 Apr 2013 11:51:25 GMT""},{""version"":""v2"",""created"":""Fri, 3 May 2013 08:51:05 GMT""},{""version"":""v3"",""created"":""Mon, 5 Aug 2013 12:44:38 GMT""}]","2013-08-06"
"1304.7965","Liangjin Yao","Jonathan M. Borwein, Guoyin Li, and Liangjin Yao","Analysis of the convergence rate for the cyclic projection algorithm
  applied to basic semi-algebraic convex sets","35 pages, revision incorporating referees' comments",,,,"math.FA math.OC","http://arxiv.org/licenses/nonexclusive-distrib/1.0/","  In this paper, we study the rate of convergence of the cyclic projection
algorithm applied to finitely many basic semi-algebraic convex sets. We
establish an explicit convergence rate estimate which relies on the maximum
degree of the polynomials that generate the basic semi-algebraic convex sets
and the dimension of the underlying space. We achieve our results by exploiting
the algebraic structure of the basic semi-algebraic convex sets.
","[{""version"":""v1"",""created"":""Tue, 30 Apr 2013 11:53:39 GMT""},{""version"":""v2"",""created"":""Tue, 19 Nov 2013 04:40:26 GMT""}]","2013-11-20"
"1304.7966","Yi Fang","Yi Fang, Lin Wang, and Guanrong Chen","Performance of a Multiple-Access DCSK-CC System over Nakagami-$m$ Fading
  Channels","4 pages, 5 figures, accepted, IEEE ISCAS, 2013",,"10.1109/ISCAS.2013.6571836",,"cs.IT cs.PF math.IT","http://arxiv.org/licenses/nonexclusive-distrib/1.0/","  In this paper, we propose a novel cooperative scheme to enhance the
performance of multiple-access (MA) differential-chaos-shift-keying (DCSK)
systems. We provide the bit-error-rate (BER) performance and throughput
analyses for the new system with a decode-and-forward (DF) protocol over
Nakagami-$m$ fading channels. Our simulated results not only show that this
system significantly improves the BER performance as compared to the existing
DCSK non-cooperative (DCSK-NC) system and the multiple-input multiple-output
DCSK (MIMO-DCSK) system, but also verify the theoretical analyses. Furthermore,
we show that the throughput of this system approximately equals that of the
DCSK-NC system, both of which have prominent improvements over the MIMO-DCSK
system. We thus believe that the proposed system can be a good framework for
chaos-modulation-based wireless communications.
","[{""version"":""v1"",""created"":""Tue, 30 Apr 2013 11:57:20 GMT""}]","2016-11-15"
"1304.7967","Roberto La Scala","Vladimir P. Gerdt and Roberto La Scala","Noetherian quotients of the algebra of partial difference polynomials
  and Grobner bases of symmetric ideals","26 pages, to appear in Journal of Algebra",,,,"math.AC math.AP","http://arxiv.org/licenses/nonexclusive-distrib/1.0/","  In this paper we develop a Grobner bases theory for ideals of partial
difference polynomials with constant or non-constant coefficients. In
particular, we introduce a criterion providing the finiteness of such bases
when a difference ideal contains elements with suitable linear leading
monomials. This can be explained in terms of Noetherianity of the corresponding
quotient algebra. Among these Noetherian quotients we find finitely generated
polynomial algebras where the action of suitable finite dimensional commutative
algebras and in particular finite abelian groups is defined. We obtain
therefore a consistent Grobner bases theory for ideals that possess such
symmetries.
","[{""version"":""v1"",""created"":""Tue, 30 Apr 2013 12:03:25 GMT""},{""version"":""v2"",""created"":""Wed, 28 May 2014 15:12:55 GMT""},{""version"":""v3"",""created"":""Mon, 22 Sep 2014 08:15:20 GMT""},{""version"":""v4"",""created"":""Mon, 27 Oct 2014 08:42:30 GMT""}]","2014-10-28"
"1304.7968","Tihomir Tenev","Tihomir G. Tenev and Nikolay V. Vitanov","Can electrostatic field lift spin degeneracy?",,,,,"quant-ph","http://arxiv.org/licenses/nonexclusive-distrib/1.0/","  There are two well known mechanisms which lead to lifting of energy spin
degeneracy of single electron systems - magnetic field and spin-orbit coupling.
We investigate the possibility for existence of a third mechanism in which
electrostatic field can lead to lifting of spin-degeneracy directly without the
mediation of spin-orbit coupling. A novel argument is provided for the need of
spin-orbit coupling different from the usual relativistic considerations. It is
shown that due to preserved translational invariance spin splitting purely by
electrostatic field is not possible for Bloch states. A possible lifting of
spin degeneracy by electrostatic field characterized by broken inversion and
translational invariance is considered.
","[{""version"":""v1"",""created"":""Tue, 30 Apr 2013 12:07:54 GMT""},{""version"":""v2"",""created"":""Thu, 7 Aug 2014 14:46:16 GMT""}]","2014-08-08"
"1304.7969","Shmuel Balberg","Shmuel Balberg (1), Re'em Sari (1), Abraham Loeb (2) ((1) Hebrew
  University,(2) Harvard ITC)","A new rare type of supernovae: hypervelocity stellar collisions at
  galactic centers","accepted to MNRAS letters (a few minor revisions, results and
  conclusions unchanged)",,,,"astro-ph.SR","http://arxiv.org/licenses/nonexclusive-distrib/1.0/","  When a binary star system is tidally disrupted by a supermassive black hole
at a galactic nucleus, one star is ejected at a high speed while the other
remains in a tightly bound orbit around the black hole. The cluster of tightly
bound stars builds over time, eventually creating a steady state in which the
rate of collisions between these stars is similar to the rate of capturing new
stars. A large fraction of the collisions occur near the periapsis of the
orbits around the black hole, where the kinetic energies are sufficient to
generate an explosive disruption of the two stars involved. The typical flare
brightens for several days, with a peak luminosity that is comparable to the
lower-luminosity end of known supernovae. The explosion lightcurve is followed
by a longer flare due to accretion of ejected matter onto the black hole.
Dedicated searches in the near universe could observe several such
""collisional-supernovae"" per year.
","[{""version"":""v1"",""created"":""Tue, 30 Apr 2013 12:11:48 GMT""},{""version"":""v2"",""created"":""Thu, 23 May 2013 18:02:25 GMT""}]","2013-05-24"
"1304.7970","Olivier Pages","Olivier Pages, Rami Hajj Hussein and Vitor J.B. Torres","SiGe Raman spectra vs. local clustering/anticlustering : Percolation
  scheme and ab initio calculations","20 pages, 6 figures","Journal of Applied Physics 114, 033513 (2013)","10.1063/1.4813513",,"cond-mat.mtrl-sci","http://arxiv.org/licenses/nonexclusive-distrib/1.0/","  We formalize within the percolation scheme, that operates along the linear
chain approximation, namely at one dimension (1D), an intrinsic ability behind
Raman scattering to achieve a quantitative insight into local clustering or
anticlustering in an alloy, using SiGe as a case study. For doing so, we derive
general expressions of the individual fractions of the six SiGe
percolation-type oscillators [1(Ge-Ge), 3(Si-Ge), 2(Si-Si)], which monitor
directly the Raman intensities, via a relevant order parameter k. This is
introduced by adapting to the 1D oscillators of the SiGe diamond version of the
1D percolation scheme, namely along a fully consistent 1D treatment, the
approach originally used by Verleur and Barker for the three-dimensional (3D)
oscillators of their 1D cluster scheme applying to zincblende alloys [H.W.
Verleur and A.S. Barker, Phys. Rev. 149, 715 (1966)], a somehow problematic one
in fact, due to its 3D vs. 1D ambivalence. Predictive k-dependent intensity
interplays between the SiGe (50 at.%Si) Raman lines are confronted with
existing experimental data and with ab initio Raman spectra obtained by using
large (32 atom) disordered supercells matching the required k values, with
special attention to the Si-Ge triplet and to the Si-Si doublet, respectively.
","[{""version"":""v1"",""created"":""Tue, 30 Apr 2013 12:16:39 GMT""}]","2013-07-29"
"1304.7971","Vahid Jamali","Vahid Jamali, Nikola Zlatanov, Aissa Ikhlef, and Robert Schober","Adaptive Mode Selection and Power Allocation in Bidirectional
  Buffer-aided Relay Networks","arXiv admin note: substantial text overlap with arXiv:1303.3732",,,,"cs.IT math.IT","http://arxiv.org/licenses/nonexclusive-distrib/1.0/","  In this paper, we consider the problem of sum rate maximization in a
bidirectional relay network with fading. Hereby, user 1 and user 2 communicate
with each other only through a relay, i.e., a direct link between user 1 and
user 2 is not present. In this network, there exist six possible transmission
modes: four point-to-point modes (user 1-to-relay, user 2-to-relay,
relay-to-user 1, relay-to-user 2), a multiple access mode (both users to the
relay), and a broadcast mode (the relay to both users). Most existing protocols
assume a fixed schedule of using a subset of the aforementioned transmission
modes, as a result, the sum rate is limited by the capacity of the weakest link
associated with the relay in each time slot. Motivated by this limitation, we
develop a protocol which is not restricted to adhere to a predefined schedule
for using the transmission modes. Therefore, all transmission modes of the
bidirectional relay network can be used adaptively based on the instantaneous
channel state information (CSI) of the involved links. To this end, the relay
has to be equipped with two buffers for the storage of the information received
from users 1 and 2, respectively. For the considered network, given a total
average power budget for all nodes, we jointly optimize the transmission mode
selection and power allocation based on the instantaneous CSI in each time slot
for sum rate maximization. Simulation results show that the proposed protocol
outperforms existing protocols for all signal-to-noise ratios (SNRs).
Specifically, we obtain a considerable gain at low SNRs due to the adaptive
power allocation and at high SNRs due to the adaptive mode selection.
","[{""version"":""v1"",""created"":""Tue, 30 Apr 2013 12:18:54 GMT""},{""version"":""v2"",""created"":""Tue, 11 Jun 2013 08:27:30 GMT""}]","2013-06-12"
"1304.7972","Gyula Bene","N. Fenyvesi and G. Bene","Collision of water wave solitons",,,"10.2478/s11534-013-0329-7",,"nlin.PS physics.flu-dyn","http://arxiv.org/licenses/nonexclusive-distrib/1.0/","  A classification of the time evolution of the two-soliton solutions of the
Boussinesq equation is given, based on the number of extrema of the wave. For
solitons moving in the same directions, three different scenarios are found,
while it is shown that only one of these scenarios exists in case of oppositely
moving solitons.
","[{""version"":""v1"",""created"":""Tue, 30 Apr 2013 12:21:42 GMT""}]","2018-02-14"
"1304.7973","Tomonari Sei","Tomonari Sei and Alfred Kume","Calculating the normalising constant of the Bingham distribution on the
  sphere using the holonomic gradient method",,,,,"stat.CO","http://arxiv.org/licenses/nonexclusive-distrib/1.0/","  In this paper we implement the holonomic gradient method to exactly compute
the normalising constant of Bingham distributions. This idea is originally
applied for general Fisher-Bingham distributions in Nakayama et al. (2011). In
this paper we explicitly apply this algorithm to show the exact calculation of
the normalising constant; derive explicitly the Pfaffian system for this
parametric case; implement the general approach for the maximum likelihood
solution search and finally adjust the method for degenerate cases, namely when
the parameter values have multiplicities.
","[{""version"":""v1"",""created"":""Tue, 30 Apr 2013 12:22:17 GMT""}]","2013-05-01"
"1304.7974","Martin Kalinowski","Martin Kalinowski, Marc Wagner","Masses of mesons with charm valence quarks from 2+1+1 flavor twisted
  mass lattice QCD",,"Acta Physica Polonica B Proceedings Supplement vol. 6 (2013) page
  991",,,"hep-lat","http://arxiv.org/licenses/nonexclusive-distrib/1.0/","  We present preliminary results of an ongoing lattice QCD computation of the
spectrum of $D$ mesons and $D_s$ mesons and of charmonium using 2+1+1 flavors
of twisted mass sea and valence quarks.
","[{""version"":""v1"",""created"":""Tue, 30 Apr 2013 12:25:06 GMT""}]","2013-09-12"
"1304.7975","Angels Ramos","A. Ramos and E. Oset","The role of vector-baryon channels and resonances in the $\gamma p \to
  K^0 \Sigma^+$ and $\gamma n \to K^0 \Sigma^0$ reactions near the $K^*
  \Lambda$ threshold","12 pages, 5 figures, version to appear in Phys. Lett. B",,"10.1016/j.physletb.2013.10.012",,"nucl-th","http://arxiv.org/licenses/nonexclusive-distrib/1.0/","  We have studied the $\gamma p \to K^0 \Sigma^+$ reaction in the energy region
around the $K^* \Lambda$ and $K^* \Sigma$ thresholds, where the CBELSA/TAPS
cross section shows a sudden drop and the differential cross section
experiences a transition from a forward-peaked distribution to a flat one. Our
coupled channel model incorporates the dynamics of the vector meson-baryon
interaction which is obtained from the hidden gauge formalism. We find that the
cross section in this energy region results from a delicate interference
between amplitudes having $K^* \Lambda$ and $K^*\Sigma$ intermediate states.
The sharp downfall is dictated by the presence of a nearby $N^*$ resonance
produced by our model, a feature that we have employed to predict its
properties. We also show results for the complementary $\gamma n \to K^0
\Sigma^0$ reaction, the measurement of which would test the mechanism proposed
in this work.
","[{""version"":""v1"",""created"":""Tue, 30 Apr 2013 12:44:30 GMT""},{""version"":""v2"",""created"":""Wed, 6 Nov 2013 15:52:28 GMT""}]","2015-06-15"
"1304.7976","Stefan L\""offler","Peter Schattschneider, Stefan L\""offler, Michael St\""oger-Pollach,
  Johan Verbeeck","Is magnetic chiral dichroism feasible with electron vortices?",,"Ultramicroscopy 136 (2014) 81","10.1016/j.ultramic.2013.07.012",,"quant-ph cond-mat.mtrl-sci physics.optics","http://arxiv.org/licenses/nonexclusive-distrib/1.0/","  We discuss the feasibility of detecting magnetic transitions with focused
electron vortex probes, suggested by selection rules for the magnetic quantum
number. We theoretically estimate the dichroic signal strength in the L$_{2,3}$
edge of the ferromagnetic d metals. It is shown that under realistic
conditions, the dichroic signal is undetectable for nanoparticles larger than
~1 nm. This is confirmed by a key experiment with nanometer sized vortices.
","[{""version"":""v1"",""created"":""Tue, 30 Apr 2013 12:45:51 GMT""},{""version"":""v2"",""created"":""Fri, 3 May 2013 14:15:11 GMT""},{""version"":""v3"",""created"":""Wed, 29 May 2013 11:24:14 GMT""}]","2017-02-16"
"1304.7977","Juan Echevarria","R. Michel, J. Echevarria, J.V. Hernandez-Santisteban","Photometry of the eclipsing cataclysmic variable SDSS
  J152419.33+220920.0",,,"10.1051/0004-6361/201220370",,"astro-ph.SR astro-ph.HE","http://arxiv.org/licenses/nonexclusive-distrib/1.0/","  Aims. We present new photometry of the faint and poorly studied cataclysmic
variable SDSS J152419.33+220920.0, analyze its light curve and provide an
accurate ephemeris for this system. Methods. Time-resolved CCD differential
photometry was carried out using the 1.5m and 0.84m telescopes at the
Observatorio Astronomico Nacional at San Pedro Martir. Results. From
time-resolved photometry of the system obtained during six nights (covering
more than twenty primary eclipse cycles in more than three years), we show that
this binary presents a strong primary and a weak secondary modulation. Our
light curve analysis shows that only two fundamental frequencies are present,
corresponding to the orbital period and a modulation with twice this frequency.
We determine the accurate ephemeris of the system to be HJD(eclipse)=
2454967.6750(1) + 0.06531866661(1) E. A double-hump orbital period modulation,
a standing feature in several bounce-back systems at quiescence, is present at
several epochs. However, we found no other evidence to support the hypothesis
that this system belongs to the post-minimum orbital-period systems.
","[{""version"":""v1"",""created"":""Tue, 30 Apr 2013 12:47:15 GMT""}]","2015-06-15"
"1304.7978","Rafael I. Nepomechie","Rafael I. Nepomechie and Chunguang Wang","Algebraic Bethe ansatz for singular solutions","10 pages; v2: refs added; v3: new section on general singular
  solutions, and more references",,,"UMTG-275","hep-th math-ph math.MP nlin.SI","http://arxiv.org/licenses/nonexclusive-distrib/1.0/","  The Bethe equations for the isotropic periodic spin-1/2 Heisenberg chain with
N sites have solutions containing i/2, -i/2 that are singular: both the
corresponding energy and the algebraic Bethe ansatz vector are divergent. Such
solutions must be carefully regularized. We consider a regularization involving
a parameter that can be determined using a generalization of the Bethe
equations. These generalized Bethe equations provide a practical way of
determining which singular solutions correspond to eigenvectors of the model.
","[{""version"":""v1"",""created"":""Tue, 30 Apr 2013 12:52:49 GMT""},{""version"":""v2"",""created"":""Thu, 2 May 2013 19:57:42 GMT""},{""version"":""v3"",""created"":""Tue, 9 Jul 2013 13:48:25 GMT""}]","2013-07-10"
"1304.7979","Doron Puder","Doron Puder and Conan Wu","Growth of Primitive Elements in Free Groups","20 pages, 2 figures. A few minor improvements of the introduction of
  ideas","J. London Math. Soc. (2014) 90 (1): 89-104","10.1112/jlms/jdu009",,"math.GR math.CO","http://arxiv.org/licenses/nonexclusive-distrib/1.0/","  In the free group $F_k$, an element is said to be primitive if it belongs to
a free generating set. In this paper, we describe what a generic primitive
element looks like. We prove that up to conjugation, a random primitive word of
length $N$ contains one of the letters exactly once asymptotically almost
surely (as $N \to \infty$).
  This also solves a question from the list `Open problems in combinatorial
group theory' [Baumslag-Myasnikov-Shpilrain 02']. Let $p_{k,N}$ be the number
of primitive words of length $N$ in $F_k$. We show that for $k \ge 3$, the
exponential growth rate of $p_{k,N}$ is $2k-3$. Our proof also works for giving
the exact growth rate of the larger class of elements belonging to a proper
free factor.
","[{""version"":""v1"",""created"":""Tue, 30 Apr 2013 13:02:07 GMT""},{""version"":""v2"",""created"":""Fri, 10 May 2013 08:30:41 GMT""},{""version"":""v3"",""created"":""Thu, 23 Oct 2014 15:00:13 GMT""}]","2014-10-24"
"1304.7980","Nathan Cooper","Nathan Cooper and Tim Freegarde","Trapping of 85Rb atoms by optical pumping between metastable hyperfine
  states","11 pages, 6 figures. Update 1 corrected typing error, update 2 added
  additional data and update 3 added journal reference after publication, as
  well as minor changes to manuscript","J. Phys. B: At. Mol. Opt. Phys. 46 215003 (2013)","10.1088/0953-4075/46/21/215003",,"physics.atom-ph","http://arxiv.org/licenses/nonexclusive-distrib/1.0/","  We describe an atom trapping mechanism based upon differential optical
pumping between metastable hyperfine states by partially-displaced laser beams
in the absence of a magnetic field. With realistic laser powers, trap spring
constants should match or exceed those typical of magneto-optical traps, and
highly flexible tailored trap shapes should be achievable. In a
proof-of-principle experiment, we have combined a 1D implementation with
magneto-optical trapping in the orthogonal directions, capturing ~10000 85Rb
atoms.
  This is an author-created, un-copyedited version of an article published in
J. Phys. B: At. Mol. Opt. Phys. IOP Publishing Ltd is not responsible for any
errors or omissions in this version of the manuscript or any version derived
from it. The Version of Record is available online at
http://iopscience.iop.org/0953-4075/46/21/215003/article.
","[{""version"":""v1"",""created"":""Tue, 30 Apr 2013 13:05:50 GMT""},{""version"":""v2"",""created"":""Tue, 14 May 2013 11:40:32 GMT""},{""version"":""v3"",""created"":""Fri, 4 Oct 2013 15:22:52 GMT""},{""version"":""v4"",""created"":""Mon, 4 Nov 2013 17:30:40 GMT""}]","2015-06-15"
