"1304.7696","Pavel Exner","Pavel Exner and Michal Jex","Spectral asymptotics of a strong $\delta'$ interaction on a planar loop",,"J. Phys. A: Math. Theor. 46 (2013), 345201 (12pp)","10.1088/1751-8113/46/34/345201",,"math-ph math.MP math.SP quant-ph","http://arxiv.org/licenses/nonexclusive-distrib/1.0/","  We consider a generalized Schr\""odinger operator in $L^2(\R^2)$ with an
attractive strongly singular interaction of $\delta'$ type characterized by the
coupling parameter $\beta>0$ and supported by a $C^4$-smooth closed curve
$\Gamma$ of length $L$ without self-intersections. It is shown that in the
strong coupling limit, $\beta\to 0_+$, the number of eigenvalues behaves as
$\frac{2L}{\pi\beta} + \OO(|\ln\beta|)$, and furthermore, that the asymptotic
behaviour of the $j$-th eigenvalue in the same limit is $-\frac{4}{\beta^2}
+\mu_j+\OO(\beta|\ln\beta|)$, where $\mu_j$ is the $j$-th eigenvalue of the
Schr\""odinger operator on $L^2(0,L)$ with periodic boundary conditions and the
potential $-\frac14 \gamma^2$ where $\gamma$ is the signed curvature of
$\Gamma$.
","[{""version"":""v1"",""created"":""Mon, 29 Apr 2013 16:00:34 GMT""}]","2019-12-10"
"1304.7697","Joanna Rankin M","Joanna M. Rankin, Geoffrey A.E. Wright, and Andrew M. Brown","Drifting, moding, and nulling: another look at pulsar B1918+19",,,"10.1093/mnras/stt739",,"astro-ph.SR","http://arxiv.org/licenses/nonexclusive-distrib/1.0/","  Arecibo observations of the conal triple pulsar B1918+19 at 0.327- and
1.4-GHz are used to analyse its subpulse behaviour in detail. We confirm the
presence of three distinct drift modes (A,B,C) plus a disordered mode (N) and
show that they follow one another in specific cycles. Interpreting the pulsar's
profile as resulting from a sightline traverse which cuts across an outer cone
and tangentially grazes an inner cone, we demonstrate that the phase modulation
of the inner cone is locked to the amplitude modulation of the outer cone in
all the drift modes. The 9% nulls are found to be largely confined to the
dominant B and N modes, and, in the N mode, create alternating bunches of nulls
and emission in a quasi-periodic manner with an averaged fluctuation rate of
about 12 rotation periods ($P_1$). We explore the assumption that the apparent
drift is the first alias of a faster drift of subbeams equally spaced around
the cones. This is shown to imply that all modes A, B and C have a common
circulation time of 12 $P_1$ and differ only in the number of subbeams. This
timescale is on the same order as predicted by the classic {\bf E}$\times${\bf
B} drift and also coincides with the N-mode modulation. We therefore arrive at
a picture where the circulation speed remains roughly invariant while the
subbeams progressively diminish in number from modes A to B to C, and are then
re-established during the N mode. We suggest that aliasing combined with
subbeam loss may be responsible for apparently dramatic changes in drift rates
in other pulsars.
","[{""version"":""v1"",""created"":""Mon, 29 Apr 2013 16:05:55 GMT""}]","2015-06-15"
"1304.7698","Miguel Albaladejo","Miguel Albaladejo and Eulogio Oset","Constraints on a possible dibaryon from combined analysis of the $pn \to
  d \pi^+ \pi^-$ and $pn \to pn \pi^+ \pi^-$ cross sections",,,"10.1103/PhysRevC.88.014006",,"nucl-th hep-ph","http://arxiv.org/licenses/nonexclusive-distrib/1.0/","  We use recent data that show a narrow peak around $\sqrt{s}=2.37\ \text{GeV}$
in the $pn \to d \pi^+ \pi^-$ cross section, with about double strength at the
peak than in the analogous $pn \to d \pi^0 \pi^0$ reaction, and, assuming that
it is due to the excitation of a dibaryon resonance, we evaluate the cross
section for the $pn \to pn \pi^+ \pi^-$ reaction, with the final $pn$ unbound
but with the same quantum numbers as the deuteron. We use accurate techniques
to determine the final state interaction in the case of the $pn$ forming a
deuteron or a positive energy state, which allow us to get the $pn \to pn \pi^+
\pi^-$ cross section with $pn$ in I=0 and S=1, that turns out to be quite close
or saturates the experimental $pn \to pn \pi^+ \pi^-$ total cross section
around $\sqrt{s} = 2.37\ \text{GeV}$, depending on the angular momentum
assumed. We then parametrize a background with different methods, and the sum
of the resonant and background contributions is fitted to present data. The
resulting cross section exceeds the experimental results in the region of the
resonant peak, showing a problem in the dibaryon hypothesis. Yet, in view of
the dispersion of present experimental data, and the scarce information around
$\sqrt{s} = 2.37\ \text{GeV}$, a call is made for precise measurements of the
$pn \to pn\pi^+\pi^-$ reaction around this energy, to further clarify this
issue.
","[{""version"":""v1"",""created"":""Mon, 29 Apr 2013 16:13:46 GMT""}]","2013-08-09"
"1304.7699","Pedro D. Prieto-Mart\'inez","Leonardo Colombo, Pedro D. Prieto-Mart\'inez","Unified formalism for higher-order variational problems and its
  applications in optimal control","28 pp. Revised version: Minor corrections done","Int. J. Geom. Methods Mod. Phys. 11(4) (2014) 1450034","10.1142/S0219887814500340",,"math-ph math.MP","http://arxiv.org/licenses/nonexclusive-distrib/1.0/","  In this paper we consider an intrinsic point of view to describe the
equations of motion for higher-order variational problems with constraints on
higher-order trivial principal bundles. Our techniques are an adaptation of the
classical Skinner-Rusk approach for the case of Lagrangian dynamics with
higher-order constraints. We study a regular case where it is possible to
establish a symplectic framework and, as a consequence, to obtain a unique
vector field determining the dynamics. As an interesting application we deduce
the equations of motion for optimal control of underactuated mechanical systems
defined on principal bundles.
","[{""version"":""v1"",""created"":""Mon, 29 Apr 2013 16:20:29 GMT""},{""version"":""v2"",""created"":""Mon, 19 May 2014 09:44:35 GMT""}]","2014-05-20"
"1304.7700","Petr Plechac","Markos A. Katsoulakis and Petr Plechac","Information-theoretic tools for parametrized coarse-graining of
  non-equilibrium extended systems","14 pages, 6 figures, expanded version v2 with additional benchmark",,"10.1063/1.4818534",,"physics.comp-ph cs.IT math.IT physics.data-an","http://arxiv.org/licenses/nonexclusive-distrib/1.0/","  In this paper we focus on the development of new methods suitable for
efficient and reliable coarse-graining of {\it non-equilibrium} molecular
systems. In this context, we propose error estimation and controlled-fidelity
model reduction methods based on Path-Space Information Theory, and combine it
with statistical parametric estimation of rates for non-equilibrium stationary
processes. The approach we propose extends the applicability of existing
information-based methods for deriving parametrized coarse-grained models to
Non-Equilibrium systems with Stationary States (NESS). In the context of
coarse-graining it allows for constructing optimal parametrized Markovian
coarse-grained dynamics, by minimizing information loss (due to
coarse-graining) on the path space. Furthermore, the associated path-space
Fisher Information Matrix can provide confidence intervals for the
corresponding parameter estimators. We demonstrate the proposed coarse-graining
method in a non-equilibrium system with diffusing interacting particles, driven
by out-of-equilibrium boundary conditions.
","[{""version"":""v1"",""created"":""Mon, 29 Apr 2013 16:22:02 GMT""},{""version"":""v2"",""created"":""Tue, 30 Apr 2013 16:07:45 GMT""},{""version"":""v3"",""created"":""Tue, 30 Jul 2013 22:44:52 GMT""}]","2015-06-15"
"1304.7701","Wenxiang Cong","Fenglin Liu, Ge Wang, Wenxiang Cong, Scott Hsieh, Norbert Pelc","Dynamic Bowtie for Fan-beam CT",,,,,"physics.med-ph physics.optics","http://arxiv.org/licenses/nonexclusive-distrib/1.0/","  A bowtie is a filter used to shape an x-ray beam and equalize its flux
reaching different detector channels. For development of spectral CT with
energy-discriminative photon-counting (EDPC) detectors, here we propose and
evaluate a dynamic bowtie for performance optimization based on a patient model
or a scout scan. Our dynamic bowtie modifies an x-ray beam intensity profile by
mechanical rotation and adaptive adjustment of the x-ray source flux. First, a
mathematical model for dynamic bowtie filtering is established for an
elliptical section in fan-beam geometry, and the contour of the optimal bowtie
is derived. Then, numerical simulation is performed to compare the performance
of the dynamic bowtie in the cases of an ideal phantom and a realistic
cross-section relative to the counterparts without any bowtie and with a fixed
bowtie respectively. Our dynamic bowtie can equalize the expected numbers of
photons in the case of an ideal phantom. In practical cases, our dynamic bowtie
can effectively reduce the dynamic range of detected signals inside the field
of view. Although our design is optimized for an elliptical phantom, the
resultant dynamic bowtie can be applied to a real fan-beam scan if the
underlying cross-section can be approximated as an ellipse. Furthermore, our
design methodology can be applied to specify an optimized dynamic bowtie for
any cross-section of a patient, preferably using rapid prototyping technology.
This fan-beam dynamic bowtie work could be extended to the cone-beam geometry
in a follow-up study.
","[{""version"":""v1"",""created"":""Mon, 29 Apr 2013 16:26:28 GMT""}]","2013-04-30"
"1304.7702","Alexander V. Savin","Alexander V. Savin and Yuri S. Kivshar","Localized defect modes in graphene","6 pages, 6 figures",,"10.1103/PhysRevB.88.125417",,"cond-mat.mes-hall","http://arxiv.org/licenses/nonexclusive-distrib/1.0/","  We study the properties of localized vibrational modes associated with
structural defects in a sheet of graphene. For the example of the Stone-Wales
defects, one- and two-atom vacancies, many-atom linear vacancies, and adatoms
in a honeycomb lattice, we demonstrate that the local defect modes are
characterized by stable oscillations with the frequencies lying outside the
linear frequency bands of an ideal graphene. In the frequency spectral density
of thermal oscillations, such localized defect modes lead to the additional
peaks from the right side of the frequency band of the ideal sheet of graphene.
Thus, the general structure of the frequency spectral density can provide a
fingerprint of its quality and the type of quantity of the structural defect a
graphene sheet may contain.
","[{""version"":""v1"",""created"":""Mon, 29 Apr 2013 16:27:03 GMT""}]","2013-09-18"
"1304.7703","Adam Kochanski","Adam K. Kochanski, Jonathan D. Beezley, Jan Mandel, and Craig B.
  Clements","Air pollution forecasting by coupled atmosphere-fire model WRF and SFIRE
  with WRF-Chem","Proceedings of 4th Fire Behavior and Fuels Conference, February
  18-22, 2013, Raleigh, North Carolina, USA","Proceedings of 4th Fire Behavior and Fuels Conference 2013, Wade,
  D. D. and Fox, R. L., eds., pp. 143-155, International Association of
  Wildland Fire, 2014",,,"physics.ao-ph physics.flu-dyn physics.geo-ph","http://arxiv.org/licenses/nonexclusive-distrib/1.0/","  Atmospheric pollution regulations have emerged as a dominant obstacle to
prescribed burns. Thus, forecasting the pollution caused by wildland fires has
acquired high importance. WRF and SFIRE model wildland fire spread in a two-way
interaction with the atmosphere. The surface heat flux from the fire causes
strong updrafts, which in turn change the winds and affect the fire spread.
Fire emissions, estimated from the burning organic matter, are inserted in
every time step into WRF-Chem tracers at the lowest atmospheric layer. The
buoyancy caused by the fire then naturally simulates plume dynamics, and the
chemical transport in WRF-Chem provides a forecast of the pollution spread. We
discuss the choice of wood burning models and compatible chemical transport
models in WRF-Chem, and demonstrate the results on case studies.
","[{""version"":""v1"",""created"":""Mon, 29 Apr 2013 16:31:02 GMT""}]","2014-11-05"
"1304.7704","Malcolm Boshier","A. A. Blinova, M. G. Boshier, and Eddy Timmermans","Single impurities in a Bose-Einstein condensate can make two polaron
  flavors",,,,"LA-UR-13-22548","cond-mat.quant-gas quant-ph","http://arxiv.org/licenses/nonexclusive-distrib/1.0/","  Polarons, self-localized composite objects formed by the interaction of a
single impurity particle with a host medium, are a paradigm of strong
interaction many-body physics. We show that dilute gas Bose-Einstein
condensates (BEC's) are the first medium known to self-localize the same
impurity particles both in a Landau-Pekar polaron state akin to that of
self-localized electrons in a dielectric lattice, and in a bubble state akin to
that of electron bubbles in helium. We also show that the BEC-impurity system
is fully characterized by just two dimensionless coupling constants, and that
it can be adiabatically steered from the Landau-Pekar regime to the bubble
regime in a smooth crossover trajectory.
","[{""version"":""v1"",""created"":""Mon, 29 Apr 2013 16:33:32 GMT""}]","2013-04-30"
"1304.7705","Ji\v{r}\'i Matou\v{s}ek","Jiri Matousek","Computing higher homotopy groups is W[1]-hard",,,,,"cs.CC cs.CG","http://arxiv.org/licenses/nonexclusive-distrib/1.0/","  Recently it was shown that, for every fixed k>1, given a finite simply
connected simplicial complex X, the kth homotopy group \pi_k(X) can be computed
in time polynomial in the number n of simplices of X. We prove that this
problem is W[1]-hard w.r.t. the parameter k even for X of dimension 4, and thus
very unlikely to admit an algorithm with running time bound f(k)n^C for an
absolute constant C. We also simplify, by about 20 pages, a 1989 proof by Anick
that, with k part of input, the computation of the rank of \pi_k(X) is #P-hard.
","[{""version"":""v1"",""created"":""Mon, 29 Apr 2013 16:37:12 GMT""}]","2013-04-30"
"1304.7706","Jean Alexandre","Jean Alexandre, Julio Leite and Nick E. Mavromatos","Lorentz-Violating Regulator Gauge Fields as the Origin of Dynamical
  Flavour Oscillations","32 pages",,"10.1103/PhysRevD.87.125029",,"hep-ph hep-th","http://arxiv.org/licenses/nonexclusive-distrib/1.0/","  We show how a mass mixing matrix can be generated dynamically, for two
massless fermion flavours coupled to a Lorentz invariance violating (LIV) gauge
field. The LIV features play the role of a regulator for the gap equations, and
the non-analytic dependence of the dynamical masses, as functions of the gauge
coupling, allows to consider the limit where the LIV gauge field eventually
decouples from the fermions. Lorentz invariance is then recovered, to describe
the oscillation between two free fermion flavours, and we check that the finite
dynamical masses are the only effects of the original LIV theory. We also
discuss briefly a connection of our results with the case of Majorana neutrinos
in both, the standard model, where only left-handed (active) neutrinos are
considered, and extensions thereof, with sterile right-handed neutrinos.
","[{""version"":""v1"",""created"":""Mon, 29 Apr 2013 16:38:16 GMT""},{""version"":""v2"",""created"":""Fri, 14 Jun 2013 09:08:09 GMT""}]","2013-06-26"
"1304.7707","Furuzan Ozbek","Furuzan Ozbek","Precovering and preenveloping ideals","16 pages",,,,"math.RA math.RT","http://arxiv.org/licenses/nonexclusive-distrib/1.0/","  L. Salce introduced the notion of a cotorsion pair (F,C) in the category of
abelian groups. But his definitions and basic results carry over to more
general abelian categories and have proven useful in a variety of settings. A
significant result of cotorsion theory proven by Eklof and Trlifaj is that if a
pair (F,C) of classes of R-modules is cogenerated by a set, then it is
complete. Recently Herzog, Fu, Asensio and Torrecillas developed the ideal
approximation theory. In this article we look at a result motivated by the
Eklof-Trlifaj argument for an ideal I when it is generated by a set of
homomorphisms.
","[{""version"":""v1"",""created"":""Mon, 29 Apr 2013 16:39:04 GMT""}]","2013-04-30"
"1304.7708","Athena Sefat S.","Athena S. Sefat","Bulk Synthesis of Iron-based Superconductors","Accepted as an invited manuscript for publication in Current Opinion
  in Solid State & Materials Science","Current Opinion in Solid State & Materials Science, 17 (2013) 59","10.1016/j.cossms.2013.04.001",,"cond-mat.supr-con cond-mat.mtrl-sci","http://arxiv.org/licenses/nonexclusive-distrib/1.0/","  Exploratory synthesis efforts for iron-based superconductors (FeSC) have been
driven by hopes of improving superconducting critical temperatures (TCs),
providing high-quality samples for in-depth studies of intrinsic properties,
and exploring potential superconductivity in similar families of materials.
This manuscript summarizes the synthesis routes that are used for producing
FeSC and their undoped parents, in single crystal and polycrystalline forms. A
few of the materials challenges are summarized.
","[{""version"":""v1"",""created"":""Mon, 29 Apr 2013 16:41:33 GMT""}]","2017-08-02"
"1304.7709","Romanos Malikiosis","Romanos-Diogenes Malikiosis","A note on Gabor frames in finite dimensions","10 pages","Applied and Computational Harmonic Analysis, Vol. 38 (2), 318-330,
  2015","10.1016/j.acha.2014.06.004",,"math.RA","http://arxiv.org/licenses/nonexclusive-distrib/1.0/","  The purpose of this note is to present a proof of the existence of Gabor
frames in general linear position in all finite dimensions. The tools developed
in this note are also helpful towards an explicit construction of such a frame,
which is carried out in the last section. This result has applications in
signal recovery through erasure channels, operator identification, and
time-frequency analysis.
","[{""version"":""v1"",""created"":""Mon, 29 Apr 2013 16:45:49 GMT""}]","2020-05-04"
"1304.7710","Yun Wei","Yun Wei and Chuanyi Ji and Floyd Galvan and Stephen Couvillon and
  George Orellana and James Momoh","Learning Geo-Temporal Non-Stationary Failure and Recovery of Power
  Distribution","12 pages, 12 figures, Accepted with minor revisions by TNNLS, Special
  Issue on Learning in Nonstationary and Evolving Environments. arXiv admin
  note: text overlap with arXiv:1202.4720",,,,"cs.SY cs.LG physics.soc-ph","http://arxiv.org/licenses/nonexclusive-distrib/1.0/","  Smart energy grid is an emerging area for new applications of machine
learning in a non-stationary environment. Such a non-stationary environment
emerges when large-scale failures occur at power distribution networks due to
external disturbances such as hurricanes and severe storms. Power distribution
networks lie at the edge of the grid, and are especially vulnerable to external
disruptions. Quantifiable approaches are lacking and needed to learn
non-stationary behaviors of large-scale failure and recovery of power
distribution. This work studies such non-stationary behaviors in three aspects.
First, a novel formulation is derived for an entire life cycle of large-scale
failure and recovery of power distribution. Second, spatial-temporal models of
failure and recovery of power distribution are developed as geo-location based
multivariate non-stationary GI(t)/G(t)/Infinity queues. Third, the
non-stationary spatial-temporal models identify a small number of parameters to
be learned. Learning is applied to two real-life examples of large-scale
disruptions. One is from Hurricane Ike, where data from an operational network
is exact on failures and recoveries. The other is from Hurricane Sandy, where
aggregated data is used for inferring failure and recovery processes at one of
the impacted areas. Model parameters are learned using real data. Two findings
emerge as results of learning: (a) Failure rates behave similarly at the two
different provider networks for two different hurricanes but differently at the
geographical regions. (b) Both rapid- and slow-recovery are present for
Hurricane Ike but only slow recovery is shown for a regional distribution
network from Hurricane Sandy.
","[{""version"":""v1"",""created"":""Mon, 29 Apr 2013 16:48:02 GMT""}]","2013-04-30"
"1304.7711","Eef van Beveren","Eef van Beveren, Susana Coito and George Rupp","Substructures from weak interactions in light of possible threshold
  signals at LEP and LHC","plain LaTeX, 17 pages, 11 figures",,,,"hep-ph","http://arxiv.org/licenses/nonexclusive-distrib/1.0/","  We present indications of possible substructures from weak interactions, by
inspecting LEP and LHC date and inferring threshold effects due to the
production of pairs of composite heavy gauge bosons W+-, Z and their
hypothetical partners with different spin. Thus, we find possible evidence of
scalar or pseudoscalar partners of the W+- and the Z, viz. at 53 and 57 GeV,
respectively. Additionally, data may indicate excited states of the Z at 210
and 240 GeV.
","[{""version"":""v1"",""created"":""Mon, 29 Apr 2013 16:48:34 GMT""},{""version"":""v2"",""created"":""Tue, 30 Apr 2013 05:08:31 GMT""}]","2013-05-01"
"1304.7712","Satyendra Tomar","Stefan K. Kleiss, Satyendra K. Tomar","Guaranteed and Sharp a Posteriori Error Estimates in Isogeometric
  Analysis","28 pages, 18 figures, 18 tables, 1 algorithm",,,"RICAM report 2013-06","math.NA","http://arxiv.org/licenses/nonexclusive-distrib/1.0/","  We present functional-type a posteriori error estimates in isogeometric
analysis. These estimates, derived on functional grounds, provide guaranteed
and sharp upper bounds of the exact error in the energy norm. {Moreover, since
these estimates do not contain any unknown/generic constants, they are fully
computable, and thus provide quantitative information on the error.} By
exploiting the properties of non-uniform rational B-splines, we present
efficient computation of these error estimates. The numerical realization and
the quality of the computed error distribution are addressed. The potential and
the limitations of the proposed approach are illustrated using several
computational examples.
","[{""version"":""v1"",""created"":""Mon, 29 Apr 2013 16:56:35 GMT""},{""version"":""v2"",""created"":""Tue, 21 May 2013 08:31:31 GMT""},{""version"":""v3"",""created"":""Sun, 6 Oct 2013 08:26:27 GMT""},{""version"":""v4"",""created"":""Thu, 28 Nov 2013 15:21:00 GMT""},{""version"":""v5"",""created"":""Sat, 20 Sep 2014 14:20:34 GMT""}]","2014-09-23"
"1304.7713","Ana Georgina Flesia MS","Ana Georgina Flesia, Javier Gimenez, Elena Rufeil Fiori","Markovian models for one dimensional structure estimation on heavily
  noisy imagery",,,,,"cs.CV stat.AP","http://arxiv.org/licenses/nonexclusive-distrib/1.0/","  Radar (SAR) images often exhibit profound appearance variations due to a
variety of factors including clutter noise produced by the coherent nature of
the illumination. Ultrasound images and infrared images have similar cluttered
appearance, that make 1 dimensional structures, as edges and object boundaries
difficult to locate. Structure information is usually extracted in two steps:
first, building and edge strength mask classifying pixels as edge points by
hypothesis testing, and secondly estimating from that mask, pixel wide
connected edges. With constant false alarm rate (CFAR) edge strength detectors
for speckle clutter, the image needs to be scanned by a sliding window composed
of several differently oriented splitting sub-windows. The accuracy of edge
location for these ratio detectors depends strongly on the orientation of the
sub-windows. In this work we propose to transform the edge strength detection
problem into a binary segmentation problem in the undecimated wavelet domain,
solvable using parallel 1d Hidden Markov Models. For general dependency models,
exact estimation of the state map becomes computationally complex, but in our
model, exact MAP is feasible. The effectiveness of our approach is demonstrated
on simulated noisy real-life natural images with available ground truth, while
the strength of our output edge map is measured with Pratt's, Baddeley an Kappa
proficiency measures. Finally, analysis and experiments on three different
types of SAR images, with different polarizations, resolutions and textures,
illustrate that the proposed method can detect structure on SAR images
effectively, providing a very good start point for active contour methods.
","[{""version"":""v1"",""created"":""Mon, 29 Apr 2013 16:57:47 GMT""}]","2013-04-30"
"1304.7714","Milos Kurilic","Milos Kurilic","Forcing With Copies of Countable Ordinals","15 pages","Proc. Amer. Math. Soc., 143,4 (2015) 1771-1784",,,"math.LO","http://arxiv.org/licenses/nonexclusive-distrib/1.0/","  Let \alpha be a countable ordinal and \P(\alpha) the collection of its
subsets isomorphic to \alpha. We show that the separative quotient of the set
\P (\alpha) ordered by the inclusion is isomorphic to a forcing product of
iterated reduced products of Boolean algebras of the form P(\omega
^\gamma)/I(\omega ^\gamma), where \gamma is a limit ordinal or 1 and I(\omega
^\gamma) the corresponding ordinal ideal. Moreover, the poset \P(\alpha) is
forcing equivalent to a two-step iteration P(\omega)/Fin * \pi, where \pi is an
\omega_1-closed separative pre-order in each extension by P(\omega)/Fin and, if
the distributivity number is equal to\omega_1, to P(\omega)/Fin. Also we
analyze the quotients over ordinal ideals P(\omega ^\delta)/I(\omega ^\delta)
and their distributivity and tower numbers.
","[{""version"":""v1"",""created"":""Mon, 29 Apr 2013 17:00:54 GMT""}]","2017-09-26"
