"1304.7771","Berta Stefano","S. Berta, D. Lutz, R. Nordon, R. Genzel, B. Magnelli, P. Popesso, D.
  Rosario, A. Saintonge, S. Wuyts, L. J. Tacconi","Molecular gas mass functions of normal star forming galaxies since z~3","Accepted for publication on A&A; v.2 updated to match accepted
  manuscript",,"10.1051/0004-6361/201321776",,"astro-ph.CO","http://arxiv.org/licenses/nonexclusive-distrib/1.0/","  We use deep far-infrared data from the PEP/GOODS-Herschel surveys and rest
frame ultraviolet photometry to study the evolution of the molecular gas mass
function of normal star forming galaxies. Computing the molecular gas mass,
M(mol), by scaling star formation rates (SFR) through depletion timescales, or
combining IR luminosity and obscuration properties as in Nordon et al., we
obtain M(mol) for roughly 700, z=0.2-3.0 galaxies near the star forming ""main
sequence"". The number density of galaxies follows a Schechter function of
M(mol). The characteristic mass M* is found to strongly evolve up to z~1, and
then to flatten at earlier epochs, resembling the infrared luminosity evolution
of similar objects. At z~1, our result is supported by an estimate based on the
stellar mass function of star forming galaxies and gas fraction scalings from
the PHIBSS survey. We compare our measurements to results from current models,
finding better agreement with those that are treating star formation laws
directly rather than in post-processing. Integrating the mass function, we
study the evolution of the M(mol) density and its density parameter Omega(mol).
","[{""version"":""v1"",""created"":""Mon, 29 Apr 2013 20:00:00 GMT""},{""version"":""v2"",""created"":""Thu, 13 Jun 2013 13:37:22 GMT""}]","2015-06-15"
"1304.7772","Maciej Dunajski","Maciej Dunajski, Paul Tod","Self-Dual Conformal Gravity","22 pages. Sections about local twistor transport, and LeBrun metrics
  on connected sums partially rewritten. To appear in Communications in
  Mathematical Physics",,"10.1007/s00220-014-2046-5","DAMTP-2013-24","hep-th gr-qc math.DG","http://arxiv.org/licenses/nonexclusive-distrib/1.0/","  We find necessary and sufficient conditions for a Riemannian four-dimensional
manifold $(M, g)$ with anti-self-dual Weyl tensor to be locally conformal to a
Ricci--flat manifold. These conditions are expressed as the vanishing of scalar
and tensor conformal invariants. The invariants obstruct the existence of
parallel sections of a certain connection on a complex rank-four vector bundle
over $M$. They provide a natural generalisation of the Bach tensor which
vanishes identically for anti-self-dual conformal structures. We use the
obstructions to demonstrate that LeBrun's anti-self-dual metrics on connected
sums of $\CP^2$s are not conformally Ricci-flat on any open set.
  We analyze both Riemannian and neutral signature metrics. In the latter case
we find all anti-self-dual metrics with a parallel real spinor which are
locally conformal to Einstein metrics with non-zero cosmological constant.
These metrics admit a hyper-surface orthogonal null Killing vector and thus
give rise to projective structures on the space of $\beta$-surfaces.
","[{""version"":""v1"",""created"":""Mon, 29 Apr 2013 20:00:01 GMT""},{""version"":""v2"",""created"":""Tue, 26 Nov 2013 21:00:48 GMT""}]","2015-06-15"
"1304.7773","Jay Armas","Jay Armas","How Fluids Bend: the Elastic Expansion for Higher-Dimensional Black
  Holes","v3: 50pp; minor corrections in Sec. 3.2; typos fixed; published in
  JHEP","JHEP 1309 (2013) 073","10.1007/JHEP09(2013)073",,"hep-th cond-mat.soft gr-qc","http://arxiv.org/licenses/nonexclusive-distrib/1.0/","  Hydrodynamics can be consistently formulated on surfaces of arbitrary
co-dimension in a background space-time, providing the effective theory
describing long-wavelength perturbations of black branes. When the co-dimension
is non-zero, the system acquires fluid-elastic properties and constitutes what
is called a fluid brane. Applying an effective action approach, the most
general form of the free energy quadratic in the extrinsic curvature and
extrinsic twist potential of stationary fluid brane configurations is
constructed to second order in a derivative expansion. This construction
generalizes the Helfrich-Canham bending energy for fluid membranes studied in
theoretical biology to the case in which the fluid is rotating. It is found
that stationary fluid brane configurations are characterized by a set of 3
elastic response coefficients, 3 hydrodynamic response coefficients and 1 spin
response coefficient for co-dimension greater than one. Moreover, the elastic
degrees of freedom present in the system are coupled to the hydrodynamic
degrees of freedom. For co-dimension-1 surfaces we find a 8 independent
parameter family of stationary fluid branes. It is further shown that elastic
and spin corrections to (non)-extremal brane effective actions can be accounted
for by a multipole expansion of the stress-energy tensor, therefore
establishing a relation between the different formalisms of Carter,
Capovilla-Guven and Vasilic-Vojinovic and between gravity and the effective
description of stationary fluid branes. Finally, it is shown that the Young
modulus found in the literature for black branes falls into the class predicted
by this approach - a relation which is then used to make a proposal for the
second order effective action of stationary blackfolds and to find the
corrected horizon angular velocity of thin black rings.
","[{""version"":""v1"",""created"":""Mon, 29 Apr 2013 20:00:02 GMT""},{""version"":""v2"",""created"":""Sun, 16 Jun 2013 15:21:57 GMT""},{""version"":""v3"",""created"":""Thu, 5 Dec 2013 19:07:32 GMT""}]","2014-12-23"
"1304.7774","Julian Sonner","Julian Sonner","On universality of charge transport in AdS/CFT","25 pages, 1 figure, 1 appendix; v2: typo fixed in (4.2), footnote 8)
  added, acknowledgement added",,"10.1007/JHEP07(2013)145","MIT/CTP 4455","hep-th cond-mat.str-el","http://arxiv.org/licenses/nonexclusive-distrib/1.0/","  We develop the holographic formulation of transport in strongly coupled
two-layer systems. We identify a dc conductivity, sigma^dc, that is finite even
in a translationally invariant setup, and universal for CFTs with a gravity
dual. The thermoelectric conductivity and heat conductivity are fully
determined by the electrical conductivity matrix, as a consequence of Ward
identities. We use the memory-matrix approach for double-layer systems,
together with Ward identities, to show that sigma^dc - extended to finite
frequency - has no Drude peak and, similarly, that its universal value is
unaffected if translation invariance is softly broken.
","[{""version"":""v1"",""created"":""Mon, 29 Apr 2013 20:00:03 GMT""},{""version"":""v2"",""created"":""Fri, 17 May 2013 14:39:04 GMT""}]","2015-06-15"
"1304.7775","Nikolaos Kidonakis","Nikolaos Kidonakis","Theoretical results for top quark production","7 pages, 4 figures; contribution to Snowmass 2013 based on invited
  talk at the April Snowmass Energy Frontier Workshop at Brookhaven",,,,"hep-ph","http://arxiv.org/licenses/nonexclusive-distrib/1.0/","  I discuss and compare several approaches to higher-order calculations of top
quark production. I study the relative effectiveness of the approaches in
approximating the exact NNLO results for the top-pair total cross section and
highlight the theoretical and numerical differences between them. I show that
the results from my soft-gluon resummation method are nearly identical to the
exact NNLO cross section at all LHC and Tevatron energies. This agreement has
important consequences for the validity of existing approximate NNLO
differential distributions, for further refinements of the predictions, and for
applications to other processes such as single-top production. I also compare
approximate NNLO top quark transverse momentum and rapidity distributions with
recent LHC measurements.
","[{""version"":""v1"",""created"":""Mon, 29 Apr 2013 20:00:05 GMT""}]","2013-05-01"
"1304.7776","Yegor Korovin","Yegor Korovin, Kostas Skenderis, Marika Taylor","Lifshitz as a deformation of Anti-de Sitter","70 pages; v2: references added and minor improvements",,"10.1007/JHEP08(2013)026",,"hep-th cond-mat.str-el","http://arxiv.org/licenses/nonexclusive-distrib/1.0/","  We consider holography for Lifshitz spacetimes with dynamical exponent
z=1+epsilon^2, where epsilon is small. We show that the holographically dual
field theory is a specific deformation of the relativistic CFT, corresponding
to the z=1 theory. Treating epsilon as a small expansion parameter we set up
the holographic dictionary for Einstein-Proca models up to order epsilon^2 in
three and four bulk dimensions. We explain how renormalization turns the
relativistic conformal invariance into non-relativistic Lifshitz invariance
with dynamical exponent z=1+epsilon^2. We compute the two-point function of the
conserved spin two current for the dual two-dimensional field theory and verify
that it is Lifshitz invariant. Using only QFT arguments, we show that a
particular class of deformations of CFTs generically leads to Lifshitz scaling
invariance and we construct examples of such deformations.
","[{""version"":""v1"",""created"":""Mon, 29 Apr 2013 20:00:06 GMT""},{""version"":""v2"",""created"":""Tue, 11 Jun 2013 12:58:19 GMT""}]","2015-06-15"
"1304.7777","Min Fang","Min Fang, Jinyoung Serena Kim, Roy van Boekel, Aurora Sicilia-Aguilar,
  Thomas Henning, Kevin Flaherty","Young Stellar Objects in Lynds 1641: Disks, Accretion, and Star
  Formation History","112 pages, 46 figures, 6 tables, accepted by ApJs",,"10.1088/0067-0049/207/1/5",,"astro-ph.SR","http://arxiv.org/licenses/nonexclusive-distrib/1.0/","  We investigate the young stellar objects (YSOs) in the Lynds~1641 (L1641)
cloud using multi-wavelength data including Spitzer, WISE, 2MASS, and XMM
covering ~1390 YSOs across a range of evolutionary stages. In addition, we
targeted a sub-sample of YSOs for optical spectroscopy. We use this data, along
with archival photometric data, to derive spectral types, extinction values,
masses, ages, as well as accretion rates. We obtain a disk fraction of ~50% in
L1641. The disk frequency is almost constant as a function of stellar mass with
a slight peak at log(M_*/M_sun)\approx-0.25. The analysis of multi-epoch
spectroscopic data indicates that the accretion variability of YSOs cannot
explain the two orders of magnitude of scatter for YSOs with similar masses.
Forty-six new transition disk (TD) objects are confirmed in this work, and we
find that the fraction of accreting TDs is lower than for optically thick disks
(40--45% vs. 77--79% respectively). We confirm our previous result that the
accreting TDs have a similar median accretion rate to normal optically thick
disks. We confirm that two star formation modes (isolated vs. clustered) exist
in L1641. We find that the diskless YSOs are statistically older than the YSOs
with optically-thick disks and the transition disk objects have a median age
which is intermediate between the two populations. We tentatively study the
star formation history in L1641 based on the age distribution and find that
star formation started to be active 2--3 Myr ago.
","[{""version"":""v1"",""created"":""Mon, 29 Apr 2013 20:00:10 GMT""}]","2015-06-15"
"1304.7778","Mariangela Bernardi","M. Bernardi, A. Meert, R. K. Sheth, V. Vikram, M. Huertas-Company, S.
  Mei and F. Shankar","The massive end of the luminosity and stellar mass functions: Dependence
  on the fit to the light profile","8 pages, 6 figures; accepted for publication in MNRAS. Electronic
  versions of Tables 2 and 3, which list the binned counts, are provided as
  ""ancillary"" files",,"10.1093/mnras/stt1607",,"astro-ph.CO","http://arxiv.org/licenses/nonexclusive-distrib/1.0/","  In addition to the large systematic differences arising from assumptions
about the stellar mass-to-light ratio, the massive end of the stellar mass
function is rather sensitive to how one fits the light profiles of the most
luminous galaxies. We quantify this by comparing the luminosity and stellar
mass functions based on SDSS cmodel magnitudes, and PyMorph single-Sersic and
Sersic-Exponential fits to the surface brightness profiles of galaxies in the
SDSS. The PyMorph fits return more light, so that the predicted masses are
larger than when cmodel magnitudes are used. As a result, the total stellar
mass density at z~0.1 is about 1.2x larger than in our previous analysis of the
SDSS. The differences are most pronounced at the massive end, where the
measured number density of objects having M* > 6 x 10^{11} Msun is ~5x larger.
Alternatively, at number densities of 10^{-6} Mpc^{-3}, the limiting stellar
mass is 2x larger. The differences with respect to fits by other authors,
typically based on Petrosian-like magnitudes, are even more dramatic, although
some of these differences are due to sky-subtraction problems, and are
sometimes masked by large differences in the assumed $M_*/L$ (even after
scaling to the same IMF). Our results impact studies of the growth and assembly
of stellar mass in galaxies, and of the relation between stellar and halo mass,
so we provide simple analytic fits to these new luminosity and stellar mass
functions and quantify how they depend on morphology, as well as the binned
counts in electronic format.
","[{""version"":""v1"",""created"":""Mon, 29 Apr 2013 20:00:11 GMT""},{""version"":""v2"",""created"":""Mon, 9 Sep 2013 16:57:38 GMT""}]","2015-06-15"
"1304.7779","Kuver Sinha","Andres G. Delannoy, Bhaskar Dutta, Alfredo Gurrola, Will Johns, Teruki
  Kamon, Eduardo Luiggi, Andrew Melo, Paul Sheldon, Kuver Sinha, Kechen Wang,
  Sean Wu","Probing Dark Matter at the LHC using Vector Boson Fusion Processes","4 pages, 5 figures",,"10.1103/PhysRevLett.111.061801",,"hep-ph","http://arxiv.org/licenses/nonexclusive-distrib/1.0/","  Vector boson fusion (VBF) processes at the Large Hadron Collider (LHC)
provide a unique opportunity to search for new physics with electroweak
couplings. A feasibility study for the search of supersymmetric dark matter in
the final state of two VBF jets and large missing transverse energy is
presented at 14 TeV. Prospects for determining the dark matter relic density
are studied for the cases of Wino and Bino-Higgsino dark matter. The LHC could
probe Wino dark matter with mass up to approximately 600 GeV with a luminosity
of 1000 fb$^{-1}$.
","[{""version"":""v1"",""created"":""Mon, 29 Apr 2013 20:00:11 GMT""}]","2013-08-14"
"1304.7780","Robin Barnard","R. Barnard, M. R. Garcia, and S. S. Murray","Chandra identification of 26 new black hole candidates in the central
  region of M31","Accepted for publication in ApJ, 22 pages, 17 figures, 4 pages.
  Figures 3 and 5 have multiple pages (6 figures each), and are continued after
  the references",,"10.1088/0004-637X/770/2/148",,"astro-ph.HE","http://arxiv.org/licenses/nonexclusive-distrib/1.0/","  We have previously identified 10 M31 black hole candidates (BHCs) in M31,
from their X-ray properties alone. They exhibit ""hard state"" emission spectra
that are seen at luminosities < ~10% Eddington in X-ray binaries (XBs)
containing a neutron star (NS) or black hole (BH), at luminosities that
significantly exceed the NS threshold. Nine of these are associated with
globular clusters (GCs); hence, these are most likely low mass X-ray binaries
(LMXBs); eight are included in this survey. We have recently discovered that
analysis of the long term 0.5--4.5 keV variability of XBs via structure
functions allows us to separate XBs from AGN, even though the emission spectra
are often similar; this has enabled us to search for BHCs outside of GCs. We
have identified 26 new BHCs (12 strong, 14 plausible) within 20' of the M31
nucleus (M31*), using 152 Chandra observations spaced over ~13 years; some of
our classifications were enhanced with XMM-Newton observations. Of these, 7
appear within 100"" of M31*; this supports the theory suggesting that this
region experiences enhanced XB production via dynamical processes similar to
those seen in GCs. We have found a parameter space where our black hole
candidates are separated from Galactic neutron star binaries: we show that
modelling a simulated hard state spectrum with a disk blackbody + blackbody
model yields parameters that lie outside the space occupied by neutron star
binaries that are modeled this way. The probability that our BHCs all lie
within the NS parameter space is ~3E-29.
","[{""version"":""v1"",""created"":""Mon, 29 Apr 2013 20:01:16 GMT""}]","2015-06-15"
"1304.7781","Justin Spring","Justin B. Spring, Patrick S. Salter, Benjamin J. Metcalf, Peter C.
  Humphreys, Merritt Moore, Nicholas Thomas-Peter, Marco Barbieri, Xian-Min
  Jin, Nathan K. Langford, W. Steven Kolthammer, Martin J. Booth, and Ian A.
  Walmsley","On-chip low loss heralded source of pure single photons","11 pages, 5 figures","Optics Express, Vol. 21, Issue 11, pp. 13522-13532 (2013)","10.1364/OE.21.013522",,"quant-ph physics.optics","http://arxiv.org/licenses/nonexclusive-distrib/1.0/","  A key obstacle to the experimental realization of many photonic
quantum-enhanced technologies is the lack of low-loss sources of single photons
in pure quantum states. We demonstrate a promising solution: generation of
heralded single photons in a silica photonic chip by spontaneous four-wave
mixing. A heralding efficiency of 40%, corresponding to a preparation
efficiency of 80% accounting for detector performance, is achieved due to
efficient coupling of the low-loss source to optical fibers. A single photon
purity of 0.86 is measured from the source number statistics without filtering,
and confirmed by direct measurement of the joint spectral intensity. We
calculate that similar high-heralded-purity output can be obtained from visible
to telecom spectral regions using this approach. On-chip silica sources can
have immediate application in a wide range of single-photon quantum optics
applications which employ silica photonics.
","[{""version"":""v1"",""created"":""Mon, 29 Apr 2013 20:02:03 GMT""}]","2013-06-11"
"1304.7782","Geir Halnes","Geir Halnes, Ivar {\O}stby, Klas H. Pettersen, Stig W. Omholt, Gaute
  T. Einevoll","Electrodiffusive model for astrocytic and neuronal ion concentration
  dynamics","19 pages, 5 figures, 1 table (Equations 37 & 38 and the two first
  equations in Figure 2 were corrected May 30th 2013)",,"10.1371/journal.pcbi.1003386",,"q-bio.CB q-bio.SC","http://arxiv.org/licenses/nonexclusive-distrib/1.0/","  Electrical neural signalling typically takes place at the time-scale of
milliseconds, and is typically modeled using the cable equation. This is a good
approximation for processes when ionic concentrations vary little during the
time course of a simulation. During periods of intense neural signalling,
however, the local extracellular K+ concentration may increase by several
millimolars. Clearance of excess K+ likely depends partly on diffusion in the
extracellular space, partly on local uptake by- and intracellular transport
within astrocytes. This process takes place at the time scale of seconds, and
can not be modeled accurately without accounting for the spatiotemporal
variations in ion concentrations. The work presented here consists of two main
parts: First, we developed a general electrodiffusive formalism for modeling
ion concentration dynamics in a one-dimensional geometry, including both an
intra- and extracellular domain. The formalism was based on the Nernst-Planck
equations. It ensures (i) consistency between the membrane potential and ion
concentrations, (ii) global particle/charge conservation, and (iii) accounts
for diffusion and concentration dependent variations in resistivities. Second,
we applied the formalism to model how astrocytes exchange ions with the ECS,
and identified the key astrocytic mechanisms involved in K+ removal from high
concentration regions. We found that a local increase in extracellular
K\textsuperscript{+} evoked a local depolarization of the astrocyte membrane,
which at the same time (i) increased the local astrocytic uptake of
K\textsuperscript{+}, (ii) suppressed extracellular transport of K+, (iii)
increased transport of K+ within astrocytes, and (iv) facilitated astrocytic
relase of K+ in extracellular low concentration regions. In summary, these
mechanisms seem optimal for shielding the extracellular space from excess K+.
","[{""version"":""v1"",""created"":""Mon, 29 Apr 2013 20:02:20 GMT""},{""version"":""v2"",""created"":""Thu, 30 May 2013 12:56:08 GMT""}]","2014-03-05"
"1304.7783","Lee Townsend","L. J. Townsend (Southampton), S. P. Drave (Southampton), A. B. Hill
  (SLAC), M. J. Coe (Southampton), R. H. D. Corbet (UMBC/NASA GSFC) and A. J.
  Bird (Southampton)","Contrasting behaviour from two Be/X-ray binary pulsars: insights into
  differing neutron star accretion modes","13 pages, 16 figures, accepted for publication in MNRAS",,"10.1093/mnras/stt646",,"astro-ph.HE","http://arxiv.org/licenses/nonexclusive-distrib/1.0/","  In this paper we present the identification of two periodic X-ray signals
coming from the direction of the Small Magellanic Cloud (SMC). On detection
with the Rossi X-ray Timing Explorer (RXTE), the 175.4s and 85.4s pulsations
were considered to originate from new Be/X-ray binary (BeXRB) pulsars with
unknown locations. Using rapid follow-up INTEGRAL and XMM-Newton observations,
we show the first pulsar (designated SXP175) to be coincident with a candidate
high-mass X-ray binary (HMXB) in the northern bar region of the SMC undergoing
a small Type II outburst. The orbital period (87d) and spectral class
(B0-B0.5IIIe) of this system are determined and presented here for the first
time. The second pulsar is shown not to be new at all, but is consistent with
being SXP91.1 - a pulsar discovered at the very beginning of the 13 year long
RXTE key monitoring programme of the SMC. Whilst it is theoretically possible
for accreting neutron stars to change spin period so dramatically over such a
short time, the X-ray and optical data available for this source suggest this
spin-up is continuous during long phases of X-ray quiescence, where accretion
driven spin-up of the neutron star should be minimal.
","[{""version"":""v1"",""created"":""Mon, 29 Apr 2013 20:02:28 GMT""}]","2015-06-15"
"1304.7784","Min-Kai Lin","Min-Kai Lin","Instabilities at planetary gap edges in 3D self-gravitating disks","Proceeding for `Instabilities and Structures in Proto-Planetary
  Disks' workshop. Includes additional results analysis of Lin (2012,
  arXiv:1205.4034) and an additional simulation. Talk pdf available at
  http://cita.utoronto.ca/~mklin924/talks.html","EPJ Web of Conferences, Volume 46, 2013","10.1051/epjconf/20134607001",,"astro-ph.EP","http://arxiv.org/licenses/nonexclusive-distrib/1.0/","  Numerical simulations are presented to study the stability of gaps opened by
giant planets in 3D self-gravitating disks. In weakly self-gravitating disks, a
few vortices develop at the gap edge and merge on orbital time-scales. The
result is one large but weak vortex with Rossby number -0.01. In moderately
self-gravitating disks, more vortices develop and their merging is resisted on
dynamical time-scales. Self-gravity can sustain multi-vortex configurations,
with Rossby number -0.2 to -0.1, over a time-scale of order 100 orbits.
Self-gravity also enhances the vortex vertical density stratification, even in
disks with initial Toomre parameter of order 10. However, vortex formation is
suppressed in strongly self-gravitating disks and replaced by a global spiral
instability associated with the gap edge which develops during gap formation.
","[{""version"":""v1"",""created"":""Mon, 29 Apr 2013 20:03:03 GMT""}]","2013-05-01"
"1304.7785","Hideki Perrier M.","Matteo Biagetti, Alex Kehagias, Enrico Morgante, Hideki Perrier and
  Antonio Riotto","Symmetries of Vector Perturbations during the de Sitter Epoch","v2: References added, last paragraph of section 4 clarified.
  Submitted to JCAP",,"10.1088/1475-7516/2013/07/030",,"astro-ph.CO gr-qc hep-ph hep-th","http://arxiv.org/licenses/nonexclusive-distrib/1.0/","  We analyze the class of models where a suitable coupling between the inflaton
field and the vector field gives rise to scale-invariant vector perturbations.
We exploit the fact that the de Sitter isometry group acts as conformal group
on the three-dimensional Euclidean space for the super-Hubble fluctuations in
order to characterize the correlators involving the inflaton and the vector
fields.
","[{""version"":""v1"",""created"":""Mon, 29 Apr 2013 20:03:40 GMT""},{""version"":""v2"",""created"":""Mon, 3 Jun 2013 21:39:11 GMT""}]","2015-06-15"
