"1303.4920","Bahattin Yildiz","Steven T Dougherty, Suat Karadeniz and Bahattin Yildiz","The automorphism group of the doubly-even [72,36,16] code can only be of
  order 1, 3 or 5","This paper has been withdrawn by the author due to a crucial error in
  Lemma 2.2 that affects all the results",,,,"math.CO cs.IT math.IT","http://arxiv.org/licenses/nonexclusive-distrib/1.0/","  We prove that a putative $[72,36,16]$ code is not the image of linear code
over $\ZZ_4$, $\FF_2 + u \FF_2$ or $\FF_2+v\FF_2$, thus proving that the
extremal doubly even $[72,36,16]$-binary code cannot have an automorphism group
containing a fixed point-free involution. Combining this with the previously
proved result by Bouyuklieva that such a code cannot have an automorphism group
containing an involution with fixed points, we conclude that the automorphism
group of the $[72,36,16]$-code cannot be of even order, leaving 3 and 5 as the
only possibilities.
","[{""version"":""v1"",""created"":""Wed, 20 Mar 2013 12:28:55 GMT""},{""version"":""v2"",""created"":""Mon, 25 Mar 2013 05:51:40 GMT""}]","2013-03-26"
"1303.4921","Antonio Gonz\'alez-Arroyo","Antonio Gonz\'alez-Arroyo and Masanori Okawa","Confinement in large N gauge theories","latex 8 pages, 2 figures. Contribution to Xth Conference on Quark
  Confinement and the Hadron Spectrum (2012)",,,"IFT-UAM/CSIC-13-030, HUPD-1210, FTUAM-13-5","hep-lat hep-th","http://arxiv.org/licenses/nonexclusive-distrib/1.0/","  We report some recent results obtained for large N gauge theories which
support the idea of volume reduction. Results for the string tension of the
Twisted Eguchi-Kawai model match with those obtained from extrapolation from
finite N. Determination of other observables is currently under way.
Application of the twisted reduction idea to the case of 1 or 2 flavours of
quarks in the adjoint representation of the group offers promising results.
Preliminary results for the string tension point towards a very different
behaviour for 1 and 2 flavours. While the string tension remains finite for 1
flavour at the critical massless quark limit, it seems to vanish with a large
anomalous dimension for the $N_f=2$ case. This is consistent with the predicted
Infrared fixed point expected in the latter case.
","[{""version"":""v1"",""created"":""Wed, 20 Mar 2013 12:36:20 GMT""}]","2013-03-21"
"1303.4922","Andr\'e Kapelrud","Andr\'e Kapelrud and Arne Brataas","Spin-pumping and Enhanced Gilbert Damping in Thin Magnetic Insulator
  Films",,,"10.1103/PhysRevLett.111.097602",,"cond-mat.mes-hall","http://arxiv.org/licenses/nonexclusive-distrib/1.0/","  Precessing magnetization in a thin film magnetic insulator pumps spins into
adjacent metals; however, this phenomenon is not quantitatively understood. We
present a theory for the dependence of spin-pumping on the transverse mode
number and in-plane wave vector. For long-wavelength spin waves, the enhanced
Gilbert damping for the transverse mode volume waves is twice that of the
macrospin mode, and for surface modes, the enhancement can be ten or more times
stronger. Spin-pumping is negligible for short-wavelength exchange spin waves.
We corroborate our analytical theory with numerical calculations in agreement
with recent experimental results.
","[{""version"":""v1"",""created"":""Wed, 20 Mar 2013 12:46:12 GMT""}]","2013-08-29"
"1303.4923","Roman Drnov\v{s}ek","Roman Drnov\v{s}ek and Heydar Radjavi","On semigroups of nonnegative functions and positive operators","12 pages","J. Math. Anal. Appl. 404 (2013), no. 1, 29-35","10.1016/j.jmaa.2013.03.003",,"math.FA","http://arxiv.org/licenses/nonexclusive-distrib/1.0/","  We give extensions of results on nonnegative matrix semigroups which deduce
finiteness or boundedness of such semigroups from the corresponding local
properties, e.g., from finiteness or boundedness of values of certain linear
functionals applied to them. We also consider more general semigroups of
functions.
","[{""version"":""v1"",""created"":""Wed, 20 Mar 2013 12:46:24 GMT""}]","2013-07-01"
"1303.4924","Lei Shi","Lei Shi, Evanny Obregon, Ki Won Sung, Jens Zander and Jan Bostrom","CellTV - on the Benefit of TV Distribution over Cellular Networks A Case
  Study","To appear on Trans. Broadcasting 2014",,,,"cs.NI","http://arxiv.org/licenses/nonexclusive-distrib/1.0/","  As mobile IP-access is becoming the dominant technology for providing
wireless services, the demand for more spectrum for this type of access is
increasing rapidly. Since IP-access can be used for all types of services,
instead of a plethora of dedicated, single-service systems, there is a
significant potential to make spectrum use more efficient. In this paper, the
feasibility and potential benefit of replacing the current terrestrial UHF TV
broadcasting system with a mobile, cellular data (IP-) network is analyzed. In
the cellular network, TV content would be provided as {one} of the services,
here referred to as CellTV. In the investigation we consider typical Swedish
rural and urban environments. We use different models for TV viewing patterns
and cellular technologies as expected in the year 2020. Results of the
quantitative analysis indicate that CellTV distribution can be beneficial if
the TV consumption trend goes towards more specialized programming, more local
contents, and more on-demand requests. Mobile cellular systems, with their
flexible unicast capabilities, will be an ideal platform to provide these
services. However, the results also demonstrate that CellTV is not a
spectrum-efficient replacement for terrestrial TV broadcasting with current
viewing patterns (i.e. a moderate number of channels with each a high numbers
of viewers). In this case, it is doubtful whether the expected spectrum savings
can motivate the necessary investments in upgrading cellular sites and
developing advanced TV receiver required for the success of CellTV
distribution.
","[{""version"":""v1"",""created"":""Wed, 20 Mar 2013 12:54:55 GMT""},{""version"":""v2"",""created"":""Tue, 17 Dec 2013 22:40:57 GMT""}]","2013-12-19"
"1303.4925","Aura Mimosa Nugrowati","A. M. Nugrowati and J. P. Woerdman","Non-integer OAM beam shifts of Hermite-Laguerre-Gaussian beams","10 pages, 4 figures",,"10.1016/j.optcom.2013.07.051",,"physics.optics","http://arxiv.org/licenses/nonexclusive-distrib/1.0/","  We have studied the effect of non-integer Orbital Angular Momentum (OAM) on
OAM enhanced beam shifts, for in-plane (Goos-Hanchen) and out-of-plane
(Imbert-Fedorov) shifts, using Hermite-Laguerre-Gaussian beams. Contrary to
naive expectation we find, theoretically and experimentally, that the
noninteger OAM beam shifts do not interpolate linearly between the integer OAM
beam shifts.
","[{""version"":""v1"",""created"":""Wed, 20 Mar 2013 12:54:58 GMT""},{""version"":""v2"",""created"":""Thu, 21 Mar 2013 15:33:16 GMT""},{""version"":""v3"",""created"":""Wed, 24 Jul 2013 09:59:03 GMT""}]","2013-08-08"
"1303.4926","Ciira wa Maina","Ciira wa Maina, Antti Honkela, Filomena Matarese, Korbinian Grote,
  Hendrik G. Stunnenberg, George Reid, Neil D. Lawrence, Magnus Rattray","Inference of RNA Polymerase II Transcription Dynamics from Chromatin
  Immunoprecipitation Time Course Data","40 pages: 21 pages Main text, 19 pages supplementary material",,,,"q-bio.QM q-bio.MN","http://creativecommons.org/licenses/by/3.0/","  Gene transcription mediated by RNA polymerase II (pol-II) is a key step in
gene expression. The dynamics of pol-II moving along the transcribed region
influence the rate and timing of gene expression. In this work we present a
probabilistic model of transcription dynamics which is fitted to pol-II
occupancy time course data measured using ChIP-Seq. The model can be used to
estimate transcription speed and to infer the temporal pol-II activity profile
at the gene promoter. Model parameters are estimated using either maximum
likelihood estimation or via Bayesian inference using Markov chain Monte Carlo
sampling. The Bayesian approach provides confidence intervals for parameter
estimates and allows the use of priors that capture domain knowledge, e.g. the
expected range of transcription speeds, based on previous experiments. The
model describes the movement of pol-II down the gene body and can be used to
identify the time of induction for transcriptionally engaged genes. By
clustering the inferred promoter activity time profiles, we are able to
determine which genes respond quickly to stimuli and group genes that share
activity profiles and may therefore be co-regulated. We apply our methodology
to biological data obtained using ChIP-seq to measure pol-II occupancy
genome-wide when MCF-7 human breast cancer cells are treated with estradiol
(E2). The transcription speeds we obtain agree with those obtained previously
for smaller numbers of genes with the advantage that our approach can be
applied genome-wide. We validate the biological significance of the pol-II
promoter activity clusters by investigating cluster-specific transcription
factor binding patterns and determining canonical pathway enrichment. We find
that rapidly induced genes are enriched for both estrogen receptor alpha
(ER$\alpha$) and FOXA1 binding in their proximal promoter regions.
","[{""version"":""v1"",""created"":""Wed, 20 Mar 2013 13:00:20 GMT""},{""version"":""v2"",""created"":""Wed, 5 Mar 2014 10:59:36 GMT""}]","2014-03-06"
"1303.4927","Philippe Grangier","Jovica Stanojevic, Valentina Parigi, Erwan Bimbard, Alexei Ourjoumtsev
  and Philippe Grangier","Dispersive optical nonlinearities in an EIT-Rydberg medium","9 pages, 4 figures","Phys. Rev. A 88, 053845 (2013)","10.1103/PhysRevA.88.053845",,"quant-ph physics.atom-ph","http://arxiv.org/licenses/nonexclusive-distrib/1.0/","  We investigate dispersive optical nonlinearities that arise from Rydberg
excitation blockade in cold Rydberg gases. We consider a two-photon transition
scheme and study the non-linear response to a weak optical probe in presence of
a strong control beam. For very low probe fields, the dominant nonlinearities
are of the third order and they can be exactly evaluated in a steady state
regime. In a more general case, the change in average atomic populations and
coherences due to Rydberg interactions can be characterized by properly defined
scaling parameters, which are generally complex numbers but in certain
situations take the usual meaning of the number of atoms in a blockade sphere.
They can be used in a simple ""universal scaling"" formula to determine the
dispersive optical nonlinearity of the medium. We also develop a novel
technique to account for the Rydberg interaction effects, by simplifying the
treatment of nonlocal interaction terms, the so-called collisional integrals.
We find algebraic relations that only involve two-body correlations, which can
be solved numerically. All average populations and coherences are then obtained
straightforwardly.
","[{""version"":""v1"",""created"":""Wed, 20 Mar 2013 13:04:46 GMT""}]","2013-12-04"
"1303.4928","Thomas Dierkes","Thomas Dierkes, Susanna R\""oblitz, Moritz Wade, and Peter Deuflhard","Parameter identification in large kinetic networks with BioPARKIN","20 pages, 7 figures, 4 tables; added 1 figure, and revised section 4",,,,"cs.MS cs.CE q-bio.QM","http://arxiv.org/licenses/nonexclusive-distrib/1.0/","  Modelling, parameter identification, and simulation play an important role in
systems biology. Usually, the goal is to determine parameter values that
minimise the difference between experimental measurement values and model
predictions in a least-squares sense. Large-scale biological networks, however,
often suffer from missing data for parameter identification. Thus, the
least-squares problems are rank-deficient and solutions are not unique. Many
common optimisation methods ignore this detail because they do not take into
account the structure of the underlying inverse problem. These algorithms
simply return a ""solution"" without additional information on identifiability or
uniqueness. This can yield misleading results, especially if parameters are
co-regulated and data are noisy.
","[{""version"":""v1"",""created"":""Wed, 20 Mar 2013 13:05:33 GMT""},{""version"":""v2"",""created"":""Tue, 9 Apr 2013 08:08:31 GMT""}]","2013-04-10"
"1303.4929","Dmitry Chicherin","D. Chicherin, S. Derkachov, and A. P. Isaev","Spinorial R-matrix","18 pages, 6 figures",,"10.1088/1751-8113/46/48/485201",,"math-ph hep-th math.MP","http://arxiv.org/licenses/nonexclusive-distrib/1.0/","  R-matrix acting in the tensor product of two spinor representation spaces of
Lie algebra so(d) is considered thoroughly. Corresponding Yang-Baxter equation
is proved. The relation to the local Yang-Baxter relation is established.
","[{""version"":""v1"",""created"":""Wed, 20 Mar 2013 13:10:20 GMT""}]","2015-06-15"
"1303.4930","Tomasz Klimsiak","Tomasz Klimsiak","Semilinear elliptic systems with measure data",,"Ann. Mat. Pura Appl. (4), (2015) 194, 55-76",,,"math.AP","http://arxiv.org/licenses/nonexclusive-distrib/1.0/","  We study the Dirichlet problem for systems of the form -\Delta
u^k=f^k(x,u)+\mu^k, x\in\Omega, k=1,...,n, where \Omega\subset R^d$ is an open
(possibly nonregular) bounded set, \mu^1,...,\mu^n are bounded diffuse measures
on \Omega, f=(f^1,...,f^n) satisfies some mild integrability condition and the
so-called angle condition. Using the methods of probabilistic Dirichlet forms
theory we show that the system has a unique solution in the generalized Sobolev
space i.e. space of functions having fine gradient. We provide also a
stochastic representation of the solution.
","[{""version"":""v1"",""created"":""Wed, 20 Mar 2013 13:14:06 GMT""}]","2015-03-24"
"1303.4931","Radoslav Bucik","R. Bucik, U. Mall, A. Korth, G. M. Mason","STEREO observations of the energetic ions in tilted corotating
  interaction regions","accepted for publication in Journal of Geophysical Research","Journal of Geophysical Research: Space Physics, June 2011, Volume
  116, Issue A6, A06103","10.1029/2010JA016311",,"physics.space-ph","http://arxiv.org/licenses/nonexclusive-distrib/1.0/","  In this paper we examine suprathermal He ions measured by the SIT
(Suprathermal Ion Telescope) instrument associated with tilted corotating
interaction regions (CIRs). We use observations of the two STEREO spacecraft
(s/c) for the first 2.7 years of the mission, along with ground-based
measurements of the solar magnetic field during the unusually long minimum of
Solar Cycle 23. Due to the unique configuration of the STEREO s/c orbits we are
able to investigate spatial variations in the intensity of the corotating ions
on time scales of less than one solar rotation. The observations reveal that
the occurrence of the strong CIR events was the most frequent at the beginning
of the period. The inclination of the heliospheric current sheet relative to
the heliographic equator (the tilt angle) was quite high in the first stage of
the mission and gradually flattened with the time, followed by a decrease in
the CIR activity. By examining the differences between measurements on the two
STEREO s/c we discuss how the changes in the position of the s/c relative to
the CIRs affect the energetic particle observations. We combine STEREO
observations with observations from the ULEIS instrument on the ACE s/c and
argue that the main factor which controls the differences in the ion
intensities is the latitudinal separation between the two STEREO s/c relative
to the tilted CIRs. The position of the s/c is less important when the tilt
angle is high. In this case we found that the CIR ion intensity positively
correlates with the tilt angle.
","[{""version"":""v1"",""created"":""Wed, 20 Mar 2013 13:23:33 GMT""}]","2013-03-21"
"1303.4932","Andre Saraiva","Lijun Zhang, Jun-Wei Luo, A. L. Saraiva, Belita Koiller, Alex Zunger","Genetic Design of Enhanced Valley Splitting towards a Spin Qubit in
  Silicon","Supplementary Material posted as a separate arXiv file",,"10.1038/ncomms3396",,"cond-mat.mes-hall cond-mat.mtrl-sci","http://arxiv.org/licenses/nonexclusive-distrib/1.0/","  Electronic spins in Silicon (Si) are rising contenders for qubits -- the
logical unit of quantum computation-- owing to its outstanding spin coherence
properties and compatibility to standard electronics. A remarkable limitation
for spin quantum computing in Si hosts is the orbital degeneracy of this
material's conduction band, preventing the spin-1/2 states from being an
isolated two-level system. So far available samples of Si quantum wells cladded
by Ge-Si alloy barriers provide relatively small valley splitting (VS), with
the order of 1 meV or less, degrading the fidelity of qubits encoded in spin
""up"" and ""down"" states in Si. Here, based on an atomically resolved
pseudopotential theory, we demonstrate that ordered Ge-Si layered barriers
confining a Si slab can be harnessed to enhance the VS in the active Si region
by up to one order of magnitude compared to the random alloy barriers adopted
so far. A biologically inspired genetic-algorithm search is employed to
identify magic Ge/Si layer sequences of the superlattice barriers that isolate
the electron ground state in a single valley composition with VS as large as ~9
meV. The enhanced VS is preserved with the reasonable inter-layer mixing
between different species, and is interestingly ""protected"" even if some larger
mixing occurs. Implementation of the optimized layer sequences of barriers,
within reach of modern superlattice growth techniques, overcomes in a practical
systematic way the main current limitations related to the orbital degeneracy,
thus providing a roadmap for reliable spin-only quantum computing in Si.
","[{""version"":""v1"",""created"":""Wed, 20 Mar 2013 13:27:03 GMT""}]","2015-06-15"
"1303.4933","Joel F. Campbell","Joel F. Campbell","Non-linear swept frequency technique for CO2 measurements using a CW
  laser system","22 pages, 11 figures. Submitted to Applied Optics on 03/06/2013","Applied Optics, Vol. 52, No. 13, 30 April 2013","10.1364/AO.52.003100","NASA NF 1676L ID: 16214, LAR-18326-1","physics.ao-ph astro-ph.IM","http://arxiv.org/licenses/nonexclusive-distrib/1.0/","  A system using a non-linear multi-swept sine wave system is described which
employs a multi-channel, multi-swept orthogonal waves, to separate channels and
make multiple, simultaneous online/offline CO2 measurements. An analytic
expression and systematic method for determining the orthogonal frequencies for
the unswept, linear swept and non-linear swept cases is presented. It is shown
that one may reduce sidelobes of the autocorrelation function while preserving
cross channel orthogonality, for thin cloud rejection.
","[{""version"":""v1"",""created"":""Wed, 20 Mar 2013 13:41:36 GMT""}]","2013-04-30"
"1303.4934","Tomaso Belloni","Tomaso M. Belloni (1), Diego Altamirano (2) - ((1) INAF-Osservatorio
  Astronomico di Brera, Italy (2) University of Amsterdam, the Netherlands)","Discovery of a 34 Hz Quasi-Periodic Oscillation in the X-ray emission of
  GRS 1915+105","5 pages, 3 figures, Accepted for publication in MNRAS",,"10.1093/mnras/stt285",,"astro-ph.HE","http://arxiv.org/licenses/nonexclusive-distrib/1.0/","  We report the discovery in the Rossi X-Ray Timing Explorer data of GRS
1915+105 of a second quasi-periodic oscillation at 34 Hz, simultaneous with
that observed at 68 Hz in the same observation. The data corresponded to those
observations from 2003 where the 68-Hz oscillation was very strong. The
significance of the detection is 4.2 sigma. These observations correspond to a
very specific position in the colour-colour diagram for GRS 1915+105,
corresponding to a harder spectrum compared to those where a 41 Hz oscillation
was discovered. We discuss the possible implications of the new pair of
frequencies comparing them with the existing theoretical models.
","[{""version"":""v1"",""created"":""Wed, 20 Mar 2013 13:43:16 GMT""}]","2015-06-15"
"1303.4935","Bertrand Patureau-Mirand","Nathan Geer and Bertrand Patureau-Mirand","G-links invariants, Markov traces and the semi-cyclic Uqsl2-modules","22 pages",,,,"math.QA math-ph math.GT math.MP","http://arxiv.org/licenses/nonexclusive-distrib/1.0/","  Kashaev and Reshetikhin proposed a generalization of the Reshetikhin-Turaev
link invariant construction to tangles with a flat connection in a principal
G-bundle over the complement of the tangle. The purpose of this paper is to
adapt and renormalize their construction to define invariants of G-links using
the semi-cyclic representations of the non-restricted quantum group associated
to sl2, defined by De Concini and Kac. Our construction uses a modified Markov
trace. In our main example, the semi-cyclic invariants are a natural extension
of the generalized Alexander polynomial invariants defined by Akutsu, Deguchi,
and Ohtsuki. Surprisingly, direct computations suggest that these invariants
are actually equal.
","[{""version"":""v1"",""created"":""Wed, 20 Mar 2013 13:46:34 GMT""},{""version"":""v2"",""created"":""Thu, 19 Sep 2013 09:16:52 GMT""}]","2013-09-20"
"1303.4937","Fernando C. Lombardo","Fernando C. Lombardo and Paula I. Villar","Nonunitary geometric phases: a qubit coupled to an environment with
  random noise","8 pages, 8 figures. To appear in Phys. Rev. A",,"10.1103/PhysRevA.87.032338",,"quant-ph cond-mat.other","http://arxiv.org/licenses/nonexclusive-distrib/1.0/","  We describe the decoherence process induced on a two-level quantum system in
direct interaction with a non-equilibrium environment. The non-equilibrium
feature is represented by a non-stationary random function corresponding to the
fluctuating transition frequency between two quantum states coupled to the
surroundings. In this framework, we compute the decoherence factors which have
a characteristic ""dip"" related to the initial phases of the bath modes. We
therefore study different types of environments, namely ohmic and supra-ohmic.
These environments present different decoherence time-scales than the thermal
environment we used to study. As a consequence, we compute analytically and
numerically the non-unitary geometric phase for the qubit in a quasi-cyclic
evolution under the presence of these particular non-equilibrium environments.
We show in which cases decoherence effects could, in principle, be controlled
in order to perform a measurement of the geometric phase using standard
procedures.
","[{""version"":""v1"",""created"":""Wed, 20 Mar 2013 13:52:15 GMT""}]","2015-06-15"
"1303.4938","Jorge Pineiro","Jorge Pineiro","A note on the projection of the diagonal subvariety",,,,,"math.NT","http://arxiv.org/licenses/nonexclusive-distrib/1.0/","  The diagonal subvariety on a product of two CM elliptic curves, is presented
as an example of a dimension one subvariety, that is pre-periodic only if the
respective projection on the product of two projective lines is also
pre-periodic.
","[{""version"":""v1"",""created"":""Wed, 20 Mar 2013 13:52:53 GMT""}]","2013-03-21"
"1303.4939","Joachim Sch\""afer","Joachim Sch\""afer, Evgueni Karpov, Ra\'ul Garc\'ia-Patr\'on, Oleg V.
  Pilyavets, Nicolas J. Cerf","Equivalence Relations for the Classical Capacity of Single-Mode Gaussian
  Quantum channels","4+10 pages, typos corrected","Phys. Rev. Lett. 111, 030503 (2013)","10.1103/PhysRevLett.111.030503",,"quant-ph","http://arxiv.org/licenses/nonexclusive-distrib/1.0/","  We prove the equivalence of an arbitrary single-mode Gaussian quantum channel
and a newly defined fiducial channel preceded by a phase shift and followed by
a Gaussian unitary operation. This equivalence implies that the
energy-constrained classical capacity of any single-mode Gaussian channel can
be calculated based on this fiducial channel, which is furthermore simply
realizable with a beam splitter, two identical single-mode squeezers, and a
two-mode squeezer. In a large domain of parameters, we also provide an
analytical expression for the Gaussian classical capacity, exploiting its
additivity, and prove that the classical capacity cannot exceed it by more than
1/ln2 bits.
","[{""version"":""v1"",""created"":""Wed, 20 Mar 2013 13:53:02 GMT""},{""version"":""v2"",""created"":""Thu, 25 Jul 2013 08:46:59 GMT""}]","2013-07-26"
"1303.4940","Jorge Pineiro","Jorge Pineiro","Geometry of four-folds with three non-commuting involutions",,,,,"math.NT math.AG","http://arxiv.org/licenses/nonexclusive-distrib/1.0/","  In this paper we adapt some techniques developed for K3 surfaces, to study
the geometry of a family of projective varieties in $\Pl_K^2 \times \Pl_K^2
\times \Pl_K^2$ defined as the intersection of a form of degree $(2,2,2)$ and a
form of degree $(1,1,1)$. Members of the family will be equipped with dominant
rational self-maps and we will study the actions of those maps on divisors and
compute the first dynamical degrees of the composition of any pair.
","[{""version"":""v1"",""created"":""Wed, 20 Mar 2013 13:54:28 GMT""}]","2013-03-21"
"1303.4941","Benzeghli Brahim","Brahim Benzeghli","Un sch\'ema simplicial de Grothendieck-Pridham",,,,,"math.AG math.CT","http://arxiv.org/licenses/nonexclusive-distrib/1.0/","  Pridham has shown that any Artin $n$-stack $M$ has a presentation as a
simplicial scheme $X$ satisfying certain smoothness properties originally
introduced by Grothendieck. In the previous paper we introduced an Artin
$n$-stack $M$ of Maurer-Cartan elements of a dg-category and constructed a
chart, and have already proven the first conditions of smoothness of
$X_1\rightarrow X_0$ explicitly. In this paper, we will construct explicitly
the full simplicial scheme and show the Grothendieck-Pridham smoothness
conditions, implying that $M$ is a geometric $n$-stack.
","[{""version"":""v1"",""created"":""Wed, 20 Mar 2013 13:55:33 GMT""}]","2013-03-21"
