"1303.4733","Daniel Reem","Daniel Reem","Topological properties of sets represented by an inequality involving
  distances","13 pages; 4 figures; the font was enlarged; the introduction was
  extended; the figures and auxiliary results were improved; added remarks and
  references",,,,"math.FA cs.CG math.GT","http://arxiv.org/licenses/nonexclusive-distrib/1.0/","  Consider a set represented by an inequality. An interesting phenomenon which
occurs in various settings in mathematics is that the interior of this set is
the subset where strict inequality holds, the boundary is the subset where
equality holds, and the closure of the set is the closure of its interior. This
paper discusses this phenomenon assuming the set is a Voronoi cell induced by
given sites (subsets), a geometric object which appears in many fields of
science and technology and has diverse applications. Simple counterexamples
show that the discussed phenomenon does not hold in general, but it is
established in a wide class of cases. More precisely, the setting is a
(possibly infinite dimensional) uniformly convex normed space with arbitrary
positively separated sites. An important ingredient in the proof is a strong
version of the triangle inequality due to Clarkson (1936), an interesting
inequality which has been almost totally forgotten.
","[{""version"":""v1"",""created"":""Tue, 19 Mar 2013 23:44:57 GMT""},{""version"":""v2"",""created"":""Mon, 29 Apr 2013 04:11:26 GMT""}]","2013-04-30"
"1303.4734","Jacob Bourjaily","Jacob L. Bourjaily, Simon Caron-Huot, and Jaroslav Trnka","Dual-Conformal Regularization of Infrared Loop Divergences and the
  Chiral Box Expansion","42 pages, 43 figures, and 4 tables. Included with the submission is a
  Mathematica package ""loop_amplitudes"" which implements our results",,,,"hep-th","http://arxiv.org/licenses/nonexclusive-distrib/1.0/","  We revisit the familiar construction of one-loop scattering amplitudes via
generalized unitarity in light of the recently understood properties of loop
integrands prior to their integration. We show how in any four-dimensional
quantum field theory, the integrand-level factorization of infrared divergences
leads to twice as many constraints on integral coefficients than are visible
from the integrated expressions. In the case of planar, maximally
supersymmetric Yang-Mills amplitudes, we demonstrate that these constraints are
both sufficient and necessary to imply the finiteness and dual-conformal
invariance of the ratios of scattering amplitudes. We present a novel
regularization of the scalar box integrals which makes dual-conformal
invariance of finite observables manifest term by term, and describe how this
procedure can be generalized to higher loop-orders. Finally, we describe how
the familiar scalar boxes at one-loop can be upgraded to `chiral boxes'
resulting in a manifestly infrared-factorized, box-like expansion for all
one-loop integrands in planar, N=4 super Yang-Mills. Accompanying this note is
a Mathematica package which implements our results, and allows for the
efficient numerical evaluation of any one-loop amplitude or ratio function.
","[{""version"":""v1"",""created"":""Tue, 19 Mar 2013 20:00:01 GMT""}]","2013-03-21"
"1303.4735","Stephen Kane","Gregory W. Henry, Stephen R. Kane, Sharon X. Wang, Jason T. Wright,
  Tabetha S. Boyajian, Kaspar von Braun, David R. Ciardi, Diana Dragomir, Chris
  Farrington, Debra A. Fischer, Natalie R. Hinkel, Andrew W. Howard, Eric
  Jensen, Gregory Laughlin, Suvrath Mahadevan, Genady Pilyavsky","Host Star Properties and Transit Exclusion for the HD 38529 Planetary
  System","10 pages, 6 figures, 4 tables, accepted for publication in ApJ",,"10.1088/0004-637X/768/2/155",,"astro-ph.EP","http://arxiv.org/licenses/nonexclusive-distrib/1.0/","  The transit signature of exoplanets provides an avenue through which
characterization of exoplanetary properties may be undertaken, such as studies
of mean density, structure, and atmospheric composition. The Transit Ephemeris
Refinement and Monitoring Survey (TERMS) is a program to expand the catalog of
transiting planets around bright host stars by refining the orbits of known
planets discovered with the radial velocity technique. Here we present results
for the HD 38529 system. We determine fundamental properties of the host star
through direct interferometric measurements of the radius and through
spectroscopic analysis. We provide new radial velocity measurements that are
used to improve the Keplerian solution for the two known planets, and we find
no evidence for a previously postulated third planet. We also present 12 years
of precision robotic photometry of HD 38529 that demonstrate the inner planet
does not transit and the host star exhibits cyclic variations in seasonal mean
brightness with a timescale of approximately six years.
","[{""version"":""v1"",""created"":""Tue, 19 Mar 2013 20:00:02 GMT""}]","2015-06-15"
"1303.4736","Denija Crnojevi\'c","D. Crnojevi\'c (1), A. M. N. Ferguson (1), M. J. Irwin (2), E. J.
  Bernard (1), N. Arimoto (3,4), P. Jablonka (5,6), C. Kobayashi (7,8) ((1)
  Institute for Astronomy, University of Edinburgh, Royal Observatory, UK, (2)
  Institute of Astronomy, Cambridge, UK, (3) Subaru Telescope, National
  Astronomical Observatory of Japan, Hawaii, USA, (4) Department of
  Astronomical Science, Graduate University for Advanced Studies, Tokyo, Japan,
  (5) Laboratoire d'Astrophysique, Ecole Polytechnique F\'ed\'erale de
  Lausanne, Switzerland, (6) GEPI, Observatoire de Paris, France, (7) School of
  Physics, Astronomy and Mathematics, University of Hertfordshire, UK, (8)
  Research School of Astronomy and Astrophysics, The Australian National
  University, Australia)","The Outer Halo of the Nearest Giant Elliptical: A VLT/VIMOS Survey of
  the Resolved Stellar Populations in Centaurus A to 85 kpc","17 pages, 12 figures; MNRAS accepted",,"10.1093/mnras/stt494",,"astro-ph.CO","http://arxiv.org/licenses/nonexclusive-distrib/1.0/","  We present the first deep survey of resolved stellar populations in the
remote outer halo of our nearest giant elliptical (gE), Centaurus A (D=3.8
Mpc). Using the VIMOS/VLT optical camera, we obtained deep photometry for four
fields along the major and minor axes at projected elliptical radii of ~30-85
kpc (corresponding to ~5-14 R_{eff}). We use resolved star counts to map the
spatial and colour distribution of red giant branch (RGB) stars down to ~2
magnitudes below the RGB tip. We detect an extended halo out to the furthermost
elliptical radius probed (~85 kpc or ~14 R_{eff}), demonstrating the vast
extent of this system. We detect a localised substructure in these parts,
visible in both (old) RGB and (intermediate-age) luminous asymptotic giant
branch stars, and there is some evidence that the outer halo becomes more
elliptical and has a shallower surface brightness profile. We derive
photometric metallicity distribution functions for halo RGB stars and find
relatively high median metallicity values ([Fe/H]_{med} -0.9 to -1.0 dex) that
change very little with radius over the extent of our survey. Radial
metallicity gradients are measured to be ~-0.002 to -0.004 dex/kpc and the
fraction of metal-poor stars (defined as [Fe/H]<-1.0) is ~40-50% at all radii.
We discuss these findings in the context of galaxy formation models for the
buildup of gE haloes.
","[{""version"":""v1"",""created"":""Tue, 19 Mar 2013 20:00:02 GMT""}]","2015-06-15"
"1303.4737","Sherry C. C. Yeh","Silvia Verdolini (Leiden), Sherry C. C. Yeh (U of Toronto), Mark R.
  Krumholz (UCSC), Christopher D. Matzner (U of Toronto), and Alexander G. G.
  M. Tielens (Leiden)","Line Emission from Radiation-Pressurized HII Region II: Dynamics and
  Population Synthesis","12 pages, 11 figures, accepted for publication in ApJ",,"10.1088/0004-637X/769/1/12",,"astro-ph.CO astro-ph.GA","http://arxiv.org/licenses/nonexclusive-distrib/1.0/","  Optical and infrared emission lines from HII regions are an important
diagnostic used to study galaxies, but interpretation of these lines requires
significant modeling of both the internal structure and dynamical evolution of
the emitting regions. Most of the models in common use today assume that HII
region dynamics are dominated by the expansion of stellar wind bubbles, and
have neglected the contribution of radiation pressure to the dynamics, and in
some cases also to the internal structure. However, recent observations of
nearby galaxies suggest that neither assumption is justified, motivating us to
revisit the question of how HII region line emission depends on the physics of
winds and radiation pressure. In a companion paper we construct models of
single HII regions including and excluding radiation pressure and winds, and in
this paper we describe a population synthesis code that uses these models to
simulate galactic collections of HII regions with varying physical parameters.
We show that the choice of physical parameters has significant effects on
galactic emission line ratios, and that in some cases the line ratios can
exceed previously claimed theoretical limits. Our results suggest that the
recently-reported offset in line ratio values between high-redshift
star-forming galaxies and those in the local universe may be partially
explained by the presence of large numbers of radiation pressured-dominated HII
regions within them.
","[{""version"":""v1"",""created"":""Tue, 19 Mar 2013 20:00:03 GMT""}]","2015-06-15"
"1303.4738","\'Alvaro Ribas","\'A. Ribas, B. Mer\'in, H. Bouy, C. Alves de Oliveira, D. R. Ardila,
  E. Puga, \'A. K\'osp\'al, L. Spezzi, N. L. J. Cox, T. Prusti, G. L. Pilbratt,
  Ph. Andr\'e, L. Matr\`a, and R. Vavrek","Identification of transitional disks in Chamaeleon with Herschel","Accepted for publication in A&A: 11 March 2013 11 pages, 15 figures",,"10.1051/0004-6361/201220960",,"astro-ph.EP astro-ph.SR","http://arxiv.org/licenses/nonexclusive-distrib/1.0/","  Transitional disks are circumstellar disks with inner holes that in some
cases are produced by planets and/or substellar companions in these systems.
For this reason, these disks are extremely important for the study of planetary
system formation. The Herschel Space Observatory provides an unique opportunity
for studying the outer regions of protoplanetary disks. In this work we update
previous knowledge on the transitional disks in the Chamaeleon I and II regions
with data from the Herschel Gould Belt Survey. We propose a new method for
transitional disk classification based on the WISE 12 micron-PACS 70 micron
color, together with inspection of the Herschel images. We applied this method
to the population of Class II sources in the Chamaeleon region and studied the
spectral energy distributions of the transitional disks in the sample. We also
built the median spectral energy distribution of Class II objects in these
regions for comparison with transitional disks. The proposed method allows a
clear separation of the known transitional disks from the Class II sources. We
find 6 transitional disks, all previously known, and identify 5 objects
previously thought to be transitional as possibly non-transitional. We find
higher fluxes at the PACS wavelengths in the sample of transitional disks than
those of Class II objects. We show the Herschel 70 micron band to be an
efficient tool for transitional disk identification. The sensitivity and
spatial resolution of Herschel reveals a significant contamination level among
the previously identified transitional disk candidates for the two regions,
which calls for a revision of previous samples of transitional disks in other
regions. The systematic excess found at the PACS bands could be a result of the
mechanism that produces the transitional phase, or an indication of different
evolutionary paths for transitional disks and Class II sources.
","[{""version"":""v1"",""created"":""Tue, 19 Mar 2013 20:00:04 GMT""}]","2013-12-03"
"1303.4739","Adam Amara","Alexandre Refregier and Adam Amara (ETH Zurich)","A Way Forward for Cosmic Shear: Monte-Carlo Control Loops","6 pages, including 1 figure. Accepted to the Physics of the Dark
  Universe Journal",,,,"astro-ph.CO","http://arxiv.org/licenses/nonexclusive-distrib/1.0/","  Weak lensing by large scale structure or 'cosmic shear' is a potentially
powerful cosmological probe to shed new light on Dark Matter, Dark Energy and
Modified Gravity. It is based on the weak distortions induced by large-scale
structures on the observed shapes of distant galaxies through gravitational
lensing. While the potentials of this purely gravitational effect are great,
results from this technique have been hampered because the measurement of this
weak effect is difficult and limited by systematics effects. In particular, a
demanding step is the measurement of the weak lensing shear from wide field CCD
images of galaxies. We describe the origin of the problem and propose a way
forward for cosmic shear. Our proposed approach is based on Monte-Carlo Control
Loops and draws upon methods widely used in particle physics and engineering.
We describe the control loop scheme and show how it provides a calibration
method based on fast image simulations tuned to reproduce the statistical
properties of a specific cosmic shear data set. Through a series of iterative
loops and diagnostic tests, the Monte Carlo image simulations are made robust
to perturbations on modeling input parameters and thus to systematic effects.
We discuss how this approach can make the problem tractable and unleash to full
potential of cosmic shear for cosmology.
","[{""version"":""v1"",""created"":""Tue, 19 Mar 2013 20:00:04 GMT""},{""version"":""v2"",""created"":""Mon, 10 Mar 2014 11:30:30 GMT""}]","2014-03-11"
"1303.4740","Eugenio Carretta","Eugenio Carretta (1), Raffaele Gratton (2), Angela Bragaglia (1),
  Valentina D'Orazi (3,4) Sara Lucatello (2), Antonio Sollima (1), Chris Sneden
  (5) ((1) INAF-Osservatorio Astronomico di Bologna, (2) INAF-Osservatorio
  Astronomico di Padova, (3) Dept. of Physics and Astronomy, Macquarie
  University, (4) Monash Centre for Astrophysics, (5) University of Texas at
  Austin)","Potassium in globular cluster stars: comparing normal clusters to the
  peculiar cluster NGC 2419","5 pages, 8 figures, 3 tables, uses emulateapj, accepted for
  publication on the Astrophysical Journal",,"10.1088/0004-637X/769/1/40",,"astro-ph.GA","http://arxiv.org/licenses/nonexclusive-distrib/1.0/","  Two independent studies recently uncovered two distinct populations among
giants in the distant, massive globular cluster (GC) NGC 2419. One of these
populations has normal magnesium (Mg) and potassium (K) abundances for halo
stars: enhanced Mg and roughly solar K. The other population has extremely
depleted Mg and very enhanced K. To better anchor the peculiar NGC 2419
chemical composition, we have investigated the behavior of K in a few red giant
branch stars in NGC 6752, NGC 6121, NGC 1904, and omega Cen. To verify that the
high K abundances are intrinsic and not due to some atmospheric features in
giants, we also derived K abundances in less evolved turn-off and subgiant
stars of clusters 47 Tuc, NGC 6752, NGC 6397, and NGC 7099. We normalized the K
abundance as a function of the cluster metallicity using 21 field stars
analyzed in a homogeneous manner. For all GCs of our sample, the stars lie in
the K-Mg abundance plane on the same locus occupied by the Mg-normal population
in NGC 2419 and by field stars. This holds both for giants and less evolved
stars. At present, NGC 2419 seems unique among GCs.
","[{""version"":""v1"",""created"":""Tue, 19 Mar 2013 20:00:05 GMT""}]","2015-06-15"
"1303.4741","Glenn E. Ciolek","Glenn E. Ciolek and Wayne G. Roberge","Molecular Line Emission from Multifluid Shock Waves. I. Numerical
  Methods and Benchmark Tests","To appear in The Astrophysical Journal. 70 pages including 14
  figures. New update corrects some typos found when going over galley proofs",,"10.1088/0004-637X/768/1/78",,"astro-ph.SR","http://arxiv.org/licenses/nonexclusive-distrib/1.0/","  We describe a numerical scheme for studying time-dependent, multifluid,
magnetohydrodynamic shock waves in weakly ionized interstellar clouds and
cores. Shocks are modeled as propagating perpendicular to the magnetic field
and consist of a neutral molecular fluid plus a fluid of ions and electrons.
The scheme is based on operator splitting, wherein time integration of the
governing equations is split into separate parts. In one part independent
homogeneous Riemann problems for the two fluids are solved using Godunov's
method. In the other equations containing the source terms for transfer of
mass, momentum, and energy between the fluids are integrated using standard
numerical techniques. We show that, for the frequent case where the thermal
pressures of the ions and electrons are << magnetic pressure, the Riemann
problems for the neutral and ion-electron fluids have a similar mathematical
structure which facilitates numerical coding. Implementation of the scheme is
discussed and several benchmark tests confirming its accuracy are presented,
including (i) MHD wave packets ranging over orders of magnitude in length and
time scales; (ii) early evolution of mulitfluid shocks caused by two colliding
clouds; and (iii) a multifluid shock with mass transfer between the fluids by
cosmic-ray ionization and ion-electron recombination, demonstrating the effect
of ion mass loading on magnetic precursors of MHD shocks. An exact solution to
a MHD Riemann problem forming the basis for an approximate numerical solver
used in the homogeneous part of our scheme is presented, along with derivations
of the analytic benchmark solutions and tests showing the convergence of the
numerical algorithm.
","[{""version"":""v1"",""created"":""Tue, 19 Mar 2013 20:00:05 GMT""},{""version"":""v2"",""created"":""Thu, 4 Apr 2013 19:11:57 GMT""},{""version"":""v3"",""created"":""Wed, 10 Apr 2013 15:07:07 GMT""}]","2015-06-15"
"1303.4742","Sherry C. C. Yeh","Sherry C. C. Yeh (U of Toronto), Silvia Verdolini (Leiden), Mark R.
  Krumholz (UCSC), Christopher D. Matzner (U of Toronto), and Alexander G. G.
  M. Tielens (Leiden)","Line Emission from Radiation-Pressurized HII Regions I: Internal
  Structure and Line Ratios","8 pages, 4 figures, accepted for publication in ApJ",,"10.1088/0004-637X/769/1/11",,"astro-ph.CO astro-ph.GA","http://arxiv.org/licenses/nonexclusive-distrib/1.0/","  The emission line ratios [OIII]5007/H-beta and [NII]6584/H-alpha have been
adopted as an empirical way to distinguish between the fundamentally different
mechanisms of ionization in emission-line galaxies. However, detailed
interpretation of these diagnostics requires calculations of the internal
structure of the emitting HII regions, and these calculations depend on the
assumptions one makes about the relative importance of radiation pressure and
stellar winds. In this paper we construct a grid of quasi-static HII region
models to explore how choices about these parameters alter HII regions'
emission line ratios. We find that, when radiation pressure is included in our
models, HII regions reach a saturation point beyond which further increases in
the luminosity of the driving stars does not produce any further increase in
effective ionization parameter, and thus does not yield any further alteration
in an HII region's line ratio. We also show that, if stellar winds are assumed
to be strong, the maximum possible ionization parameter is quite low. As a
result of this effect, it is inconsistent to simultaneously assume that HII
regions are wind-blown bubbles and that they have high ionization parameters;
some popular HII region models suffer from this inconsistency. Our work in this
paper provides a foundation for a companion paper in which we embed the model
grids we compute here within a population synthesis code that enables us to
compute the integrated line emission from galactic populations of HII regions.
","[{""version"":""v1"",""created"":""Tue, 19 Mar 2013 20:00:06 GMT""}]","2015-06-15"
"1303.4743","Stefano Covino","S. Covino, A. Melandri, R. Salvaterra, S. Campana, S. D. Vergani, M.G.
  Bernardini, P. D'Avanzo, V. D'Elia, D. Fugazza, G. Ghirlanda, G. Ghisellini,
  A. Gomboc, Z.P. Jin, T. Kruehler, D. Malesani, L. Nava, B. Sbarufatti and G.
  Tagliaferri","Dust extinction for an unbiased sample of GRB afterglows","18 pages, 7 figures, 10 tables, MNRAS, in press",,"10.1093/mnras/stt540",,"astro-ph.HE","http://arxiv.org/licenses/nonexclusive-distrib/1.0/","  In this paper we compute rest-frame extinctions for the afterglows of a
sample of gamma-ray bursts complete in redshift. The selection criteria of the
sample are based on observational high-energy parameters of the prompt emission
and therefore our sample should not be biased against dusty sight-lines. It is
therefore expected that our inferences hold for the general population of
gamma-ray bursts. Our main result is that the optical/near-infrared extinction
of gamma-ray burst afterglows in our sample does not follow a single
distribution. 87% of the events are absorbed by less than 2 mag, and 50% suffer
from less than 0.3-0.4 mag extinction. The remaining 13% of the afterglows are
highly absorbed. The true percentage of gamma-ray burst afterglows showing high
absorption could be even higher since a fair fraction of the events without
reliable redshift measurement are probably part of this class. These events may
be due to highly dusty molecular clouds/star forming regions associated with
the gamma-ray burst progenitor or along the afterglow line of sight, and/or to
massive dusty host galaxies. No clear evolution in the dust extinction
properties is evident within the redshift range of our sample, although the
largest extinctions are at z~1.5-2, close to the expected peak of the star
formation rate. Those events classified as dark are characterized, on average,
by a higher extinction than typical events in the sample. A correlation between
optical/near-infrared extinction and hydrogen-equivalent column density based
on X-ray studies is shown although the observed NH appears to be well in excess
compared to those observed in the Local Group. Dust extinction does not seem to
correlate with GRB energetics or luminosity.
","[{""version"":""v1"",""created"":""Tue, 19 Mar 2013 20:00:09 GMT""},{""version"":""v2"",""created"":""Fri, 29 Mar 2013 11:05:43 GMT""}]","2015-06-15"
"1303.4744","Angelo Lucia","Toby S. Cubitt, Angelo Lucia, Spyridon Michalakis and David
  Perez-Garcia","Stability of local quantum dissipative systems","38 pages, 3 figures. Final version","Communications in Mathematical Physics: Volume 337, Issue 3
  (2015), Page 1275-1315","10.1007/s00220-015-2355-3",,"quant-ph math-ph math.MP","http://arxiv.org/licenses/nonexclusive-distrib/1.0/","  Open quantum systems weakly coupled to the environment are modeled by
completely positive, trace preserving semigroups of linear maps. The generators
of such evolutions are called Lindbladians. In the setting of quantum many-body
systems on a lattice it is natural to consider Lindbladians that decompose into
a sum of local interactions with decreasing strength with respect to the size
of their support. For both practical and theoretical reasons, it is crucial to
estimate the impact that perturbations in the generating Lindbladian, arising
as noise or errors, can have on the evolution. These local perturbations are
potentially unbounded, but constrained to respect the underlying lattice
structure. We show that even for polynomially decaying errors in the
Lindbladian, local observables and correlation functions are stable if the
unperturbed Lindbladian has a unique fixed point and a mixing time which scales
logarithmically with the system size. The proof relies on Lieb-Robinson bounds,
which describe a finite group velocity for propagation of information in local
systems. As a main example, we prove that classical Glauber dynamics is stable
under local perturbations, including perturbations in the transition rates
which may not preserve detailed balance.
","[{""version"":""v1"",""created"":""Tue, 19 Mar 2013 20:00:13 GMT""},{""version"":""v2"",""created"":""Mon, 14 Oct 2013 18:46:57 GMT""},{""version"":""v3"",""created"":""Mon, 29 Sep 2014 14:22:21 GMT""},{""version"":""v4"",""created"":""Tue, 28 Apr 2015 12:37:35 GMT""}]","2015-04-29"
"1303.4745","Gareth Conduit","G.J. Conduit, C.J. Pedder, A.G. Green","Fluctuation-induced pair density wave in itinerant ferromagnets","Accepted for publication in Phys Rev B Rapid Communications",,"10.1103/PhysRevB.87.121112",,"cond-mat.str-el","http://arxiv.org/licenses/nonexclusive-distrib/1.0/","  Magnetic fluctuations near to quantum criticality can have profound effects.
They lead to characteristic scaling at high temperature which may ultimately
give way to a reconstruction of the phase diagram and the formation of new
phases at low temperatures. The ferromagnet UGe2 is unstable to p-wave
superconducting order -- an effect presaged by the superfluidity in He3 --
whereas in CeFePO fluctuations drive the formation of spiral magnetic order.
Here we develop a general quantum order-by-disorder description of these
systems that encompasses both of these instabilities within a unified
framework. This allows us to demonstrate that in fact these instabilities
intertwine to form a new phase, a pair density wave.
","[{""version"":""v1"",""created"":""Tue, 19 Mar 2013 20:02:27 GMT""}]","2015-06-15"
