"1303.5512","Erik Carlsson","Erik Carlsson","A projection formula for the ind-Grassmannian","21 pages, no figures",,,,"math.RT","http://arxiv.org/licenses/nonexclusive-distrib/1.0/","  Let $X = \bigcup_k X_k$ be the ind-Grassmannian of codimension $n$ subspaces
of an infinite-dimensional torus representation. If $\cE$ is a bundle on $X$,
we expect that $\sum_j (-1)^j \Lambda^j(\cE)$ represents the $K$-theoretic
fundamental class $[\cO_Y]$ of a subvariety $Y \subset X$ dual to $\cE^*$. It
is desirable to lift a $K$-theoretic ""projection formula"" from the
finite-dimensional subvarieties $X_k$, but such a statement requires switching
the order of the limits in $j$ and $k$. We find conditions in which this may be
done, and consider examples in which $Y$ is the Hilbert scheme of points in the
plane, the Hilbert scheme of an irreducible curve singularity, and the affine
Grassmannian of $SL(2,\C)$. In the last example, the projection formula becomes
an instance of the Weyl-Ka\c{c} character formula, which has long been
recognized as the result of formally extending Borel-Weil theory and
localization to $Y$ \cite{S}. See also \cite{C3} for a proof of the MacDonald
inner product formula of type $A_n$ along these lines.
","[{""version"":""v1"",""created"":""Fri, 22 Mar 2013 04:15:56 GMT""},{""version"":""v2"",""created"":""Mon, 29 Jul 2013 19:17:39 GMT""}]","2013-07-30"
"1303.5513","Urmila Shrawankar Ms","Urmila Shrawankar, Vilas Thakare","Parameters Optimization for Improving ASR Performance in Adverse Real
  World Noisy Environmental Conditions","13 pages, 3 figures, 5 tables","International Journal of Human Computer Interaction (IJHCI) 3(3),
  58-70, 2012",,,"cs.CL cs.SD","http://arxiv.org/licenses/nonexclusive-distrib/1.0/","  From the existing research it has been observed that many techniques and
methodologies are available for performing every step of Automatic Speech
Recognition (ASR) system, but the performance (Minimization of Word Error
Recognition-WER and Maximization of Word Accuracy Rate- WAR) of the methodology
is not dependent on the only technique applied in that method. The research
work indicates that, performance mainly depends on the category of the noise,
the level of the noise and the variable size of the window, frame, frame
overlap etc is considered in the existing methods. The main aim of the work
presented in this paper is to use variable size of parameters like window size,
frame size and frame overlap percentage to observe the performance of
algorithms for various categories of noise with different levels and also train
the system for all size of parameters and category of real world noisy
environment to improve the performance of the speech recognition system. This
paper presents the results of Signal-to-Noise Ratio (SNR) and Accuracy test by
applying variable size of parameters. It is observed that, it is really very
hard to evaluate test results and decide parameter size for ASR performance
improvement for its resultant optimization. Hence, this study further suggests
the feasible and optimum parameter size using Fuzzy Inference System (FIS) for
enhancing resultant accuracy in adverse real world noisy environmental
conditions. This work will be helpful to give discriminative training of
ubiquitous ASR system for better Human Computer Interaction (HCI).
","[{""version"":""v1"",""created"":""Fri, 22 Mar 2013 04:20:16 GMT""}]","2013-03-25"
"1303.5514","Myungseok Eune","Myungseok Eune, Yongwan Gim, Wontae Kim","Superradiance and statistical entropy of hairy black hole in three
  dimensions","8 pages, no figure, version to appear in PRD","Phys. Rev. D 88 (2013) 047501","10.1103/PhysRevD.88.047501",,"gr-qc hep-th","http://arxiv.org/licenses/nonexclusive-distrib/1.0/","  We calculate the statistical entropy of a rotating hairy black hole by taking
into account superradiant modes in the brick wall method. The UV cutoff is
independent of the gravitational hair, which gives the well-defined area law of
the entropy. It can be shown that the angular momentum and the energy of matter
field depend on the gravitational hair. For the vanishing gravitational hair,
it turns out that the energy for matter is related to both the black hole mass
and the black hole angular momentum whereas the angular momentum for matter
field is directly proportional to the angular momentum of the black hole.
","[{""version"":""v1"",""created"":""Fri, 22 Mar 2013 04:30:30 GMT""},{""version"":""v2"",""created"":""Wed, 7 Aug 2013 13:31:57 GMT""}]","2013-08-23"
"1303.5515","Urmila Shrawankar Ms","Urmila Shrawankar, VM Thakare","Adverse Conditions and ASR Techniques for Robust Speech User Interface","10 pages 2 Tables","International Journal of Computer Science Issues (IJCSI), 8(5),
  440-449, 2011",,,"cs.CL cs.SD","http://arxiv.org/licenses/nonexclusive-distrib/1.0/","  The main motivation for Automatic Speech Recognition (ASR) is efficient
interfaces to computers, and for the interfaces to be natural and truly useful,
it should provide coverage for a large group of users. The purpose of these
tasks is to further improve man-machine communication. ASR systems exhibit
unacceptable degradations in performance when the acoustical environments used
for training and testing the system are not the same. The goal of this research
is to increase the robustness of the speech recognition systems with respect to
changes in the environment. A system can be labeled as environment-independent
if the recognition accuracy for a new environment is the same or higher than
that obtained when the system is retrained for that environment. Attaining such
performance is the dream of the researchers. This paper elaborates some of the
difficulties with Automatic Speech Recognition (ASR). These difficulties are
classified into Speakers characteristics and environmental conditions, and
tried to suggest some techniques to compensate variations in speech signal.
This paper focuses on the robustness with respect to speakers variations and
changes in the acoustical environment. We discussed several different external
factors that change the environment and physiological differences that affect
the performance of a speech recognition system followed by techniques that are
helpful to design a robust ASR system.
","[{""version"":""v1"",""created"":""Fri, 22 Mar 2013 04:44:37 GMT""}]","2013-03-25"
"1303.5516","Holger F. Hofmann","Akihiro Yamaguchi and Holger F. Hofmann","Quantum effects in the interaction of off-resonant coherent light with a
  single atom","8 pages, including one figure, added details on possible experiments,
  as illustrated by the figure","Phys. Rev. A 88, 013809 (2013)","10.1103/PhysRevA.88.013809",,"quant-ph","http://arxiv.org/licenses/nonexclusive-distrib/1.0/","  Well controlled nonlinear interactions between light field pulses and single
atoms could be used to implement optical quantum information technologies based
on qubits encoded in superpositions of coherent states of light. Here, we
investigate the transformation of a coherent light field input at a single atom
sufficiently far from resonance to limit the decoherence effects associated
with random excitations of the atom. The conditions for suppressing
multi-photon scattering to implement arbitrarily large shifts of the coherent
light amplitude without decoherence are studied. It is shown that quantum
controlled coherent shifts can be achieved by sufficiently long coherent
pulses, indicating the possibility of generating superpositions of coherent
states with large amplitude differences. The dominant multi-photon scattering
effect associated with four wave mixing is also identified, and the spectral
and temporal characteristics of the entangled photon pairs generated by this
process are discussed.
","[{""version"":""v1"",""created"":""Fri, 22 Mar 2013 04:49:16 GMT""},{""version"":""v2"",""created"":""Wed, 22 May 2013 06:50:06 GMT""}]","2014-07-28"
"1303.5517","Muhammad Ajaz","Muhammad Ajaz, Mais K. Suleymanov, Kamal Hussain Khan and Ali Zaman","Nuclear transparency effect of $\pi^{-}$-mesons in p+$^{12}$C- and
  d+$^{12}$C- interactions at 4.2A GeV/c","10 pages, 2 figures","J. Phys. G: Nucl. Part. Phys. 40 (2013) 055101","10.1088/0954-3899/40/5/055101",,"nucl-ex","http://arxiv.org/licenses/nonexclusive-distrib/1.0/","  The use of nuclear transparency effect of \pi^{-}-mesons in proton, and
deuteron induced interactions with carbon nuclei at 4.2A GeV/c, to get
information about the properties of nuclear matter, is presented in this work.
Half angle (\theta_{1/2}) technique is used to extract information on nuclear
transparency effect. The \theta_{1/2} divides the multiplicity of charged
particles into two equal parts depending on their polar angle in the lab. frame
in pp interactions. Particles with angle smaller than (incone particles) and
greater than (outcone particles) \theta_{1/2} are considered separate. The
average values of multiplicity, momentum and transverse momentum of the
\pi^{-}-mesons are analyzed as a function of a number of identified protons in
an event. We observed evidences in the data which could be considered as
transparency effect. For quantitative analysis, the results are compared with
cascade model. The observed effects are categorized into leading effect
transparency and medium effect transparency. The transparency in the latter
case could be the reason of collective interactions of grouped nucleons with
the incident particles.
","[{""version"":""v1"",""created"":""Fri, 22 Mar 2013 05:09:21 GMT""}]","2013-03-25"
"1303.5518","Junichi Harada","Junichi Harada","Blow-up behavior of solutions to the heat equation with nonlinear
  boundary conditions","48 page",,,,"math.AP","http://arxiv.org/licenses/nonexclusive-distrib/1.0/","  We study the asymptotic behavior of blow-up solutions of the heat equation
with nonlinear boundary conditions. In particular, we classify the asymptotic
behavior of blow-up solutions and investigate the spacial singularity of their
blow-up profiles.
","[{""version"":""v1"",""created"":""Fri, 22 Mar 2013 05:22:42 GMT""}]","2013-03-25"
"1303.5519","Alberto Boretti","Alberto Boretti","Reply to Hunter and Brown Discussion of Is there any support in the long
  term tide gauge data to the claims that parts of Sydney will be swamped by
  rising sea levels?, Coastal Engineering 2012;64:161-167, Coastal Engineering
  2013;75:1-3","reply to a comment to one original research paper of mine published
  on Coastal Engineering",,,,"physics.ao-ph","http://arxiv.org/licenses/nonexclusive-distrib/1.0/","  Hunter and Brown try to demonstrate in their discussion of the long term tide
gauge data published in my previous paper that the sea levels are accelerating
when they are not. The sea levels are mostly oscillating and certainly not
positively accelerating at the present time. As shown in the graphs proposed
here after, having an understanding of the oscillatory behaviour of sea levels
and by using linear and parabolic fittings but not being selective in the time
window to consider, the tide gauge of Sydney exhibits clear multi decadal and
inter-annual periodicities but no detectable component of acceleration,
similarly to the many others tide gauges of the Pacific or the rest of the
world having enough quality and length. If all the long term tide gauges do not
exhibit any present accelerating pattern, possibly some simulations and
reconstructions may be wrong similarly to the selective assessment of the sea
level rise by fitting only the few years of data useful to support the positive
acceleration claim.
","[{""version"":""v1"",""created"":""Fri, 22 Mar 2013 05:27:05 GMT""}]","2013-03-25"
"1303.5520","Yasusada Nambu","Ken-ichiro Kanai and Yasusada Nambu","Viewing Black Holes by Waves","24 pages, final version to appear in Class. Quantum Grav",,"10.1088/0264-9381/30/17/175002",,"gr-qc astro-ph.HE physics.optics","http://arxiv.org/licenses/nonexclusive-distrib/1.0/","  We study scattering of waves by black holes. Solving a massless scalar field
with a point source in the Schwarzschild spacetime, waves scattered by the
black hole is obtained numerically. We then reconstruct images of the black
hole from scattered wave data for specified scattering angles. For the forward
and the backward directions, obtained wave optical images of black holes show
rings that correspond to the black hole glories associated with existence of
the unstable circular photon orbit in the Schwarzschild spacetime.
","[{""version"":""v1"",""created"":""Fri, 22 Mar 2013 05:31:39 GMT""},{""version"":""v2"",""created"":""Fri, 19 Jul 2013 07:23:59 GMT""}]","2015-06-15"
"1303.5521","Junichi Harada","Junichi Harada","Non self-similar blow-up solutions to the heat equation with nonlinear
  boundary conditions","59 page",,,,"math.AP","http://arxiv.org/licenses/nonexclusive-distrib/1.0/","  This paper is concerned with finite blow-up solutions of the heat equation
with nonlinear boundary conditions. It is known that a rate of blow-up
solutions is the same as the self-similar rate for a Sobolev subcritical case.
A goal of this paper is to construct a blow-up solution whose blow-up rate is
different from the self-similar rate for a Sobolev supercritical case.
","[{""version"":""v1"",""created"":""Fri, 22 Mar 2013 05:33:24 GMT""}]","2013-03-25"
"1303.5522","Jens Erler","Jens Erler and Shufang Su","The Weak Neutral Current","43 pages, 10 figures",,"10.1016/j.ppnp.2013.03.004",,"hep-ph hep-ex nucl-ex nucl-th","http://arxiv.org/licenses/nonexclusive-distrib/1.0/","  This is a review of electroweak precision physics with particular emphasis on
low-energy precision measurements in the neutral current sector of the
electroweak theory and includes future experimental prospects and the
theoretical challenges one faces to interpret these observables. Within the
minimal Standard Model they serve as determinations of the weak mixing angle
which are competitive with and complementary to those obtained near the
Z-resonance. In the context of new physics beyond the Standard Model these
measurements are crucial to discriminate between models and to reduce the
allowed parameter space within a given model. We illustrate this for the
minimal supersymmetric Standard Model with or without R-parity.
","[{""version"":""v1"",""created"":""Fri, 22 Mar 2013 05:51:18 GMT""}]","2015-06-15"
"1303.5523","Chitra Shukla","Chitra Shukla, Anindita Banerjee and Anirban Pathak","Bidirectional controlled teleportation by using 5-qubit states: A
  generalized view","4 tables and 5 pages",,"10.1007/s10773-013-1684-2",,"quant-ph","http://arxiv.org/licenses/nonexclusive-distrib/1.0/","  Recently bidirectional controlled perfect teleportation using 5-qubit states
are reported in (Int. J. Theor. Phys. (2013) DOI 10.1007/s10773-013-1484-8 and
ibid, (2013) DOI 10.1007/s10773-012-1208-5). In this paper we have shown that
there exists a class of 5-qubit quantum states that can be used for
bidirectional controlled teleportation. Two out of the three reported cases are
the special cases of the proposed class of 5-qubit quantum states and one of
them is not strictly a case of controlled bidirectional quantum teleportation.
Further, we have shown that one can in principle, construct infinitely many
5-qubit quantum states for this purpose. We have also shown that the idea can
be extended to bidirectional controlled probabilistic teleportation. Some
potential applications of the proposed scheme and its modified versions are
also discussed in relation with the implementation of quantum remote control
and quantum cryptography.
","[{""version"":""v1"",""created"":""Fri, 22 Mar 2013 06:02:09 GMT""}]","2015-06-15"
"1303.5524","Szymon Pustelny","S. Pustelny, D. F. Jackson Kimball, C. Pankow, M. P. Ledbetter, P.
  Wlodarczyk, P. Wcislo, M. Pospelov, J. Smith, J. Read, W. Gawlik, and D.
  Budker","Global Network of Optical Magnetometers for Exotic (GNOME): Physics
  Novel scheme for exotic physics searches","Submitted to Annalen der Physik","Annalen der Physik 525, 659 (2013)","10.1002/andp.201300061",,"physics.atom-ph","http://arxiv.org/licenses/nonexclusive-distrib/1.0/","  A novel experimental scheme enabling investigation of transient exotic spin
couplings is discussed. The scheme is based on synchronous measurements of
optical-magnetometer signals of several devices operating in magnetically
shielded environments in distant locations ($\gtrsim100$ km). Although
signatures of such exotic couplings may be present in the signal from a single
magnetometer, it would be challenging to distinguish them from noise. By
analyzing the correlation between signals from multiple, geographically
separated magnetometers, it is not only possible to identify the exotic
transient but also to investigate its nature. The ability of the network to
probe presently unconstrained physics beyond the Standard Model is examined by
considering the spin coupling to stable topological defects (e.g., domain
walls) of axion-like fields. In the spirit of this research, a brief ($\sim 2$
hours) demonstration experiment involving two magnetometers located in Krak\'ow
and Berkeley ($\sim 9000$ km separation) is presented and discussion of the
data-analysis approaches that may allow for the transient signal identification
is provided. The prospects of the network are outlined in the last part of the
paper.
","[{""version"":""v1"",""created"":""Fri, 22 Mar 2013 06:11:50 GMT""},{""version"":""v2"",""created"":""Sun, 16 Jun 2013 07:25:55 GMT""}]","2021-09-13"
"1303.5525","Saeid Rezakhah","N. Alemohammad, S. Rezakhah, S. H. Alizadeh","Markov Switching Component ARCH Model: Stability and Forecasting","17 pages",,,,"stat.ME","http://arxiv.org/licenses/nonexclusive-distrib/1.0/","  This paper introduces an extension of the Markov switching GARCH model where
the volatility in each state is a convex combination of two different GARCH
components with time varying weights. This model has the dynamic behavior to
capture the variants of shocks. The asymptotic behavior of the second moment is
investigated and an appropriate upper bound for it is evaluated. The estimation
of the parameters by using the Bayesian method via Gibbs sampling algorithm is
studied. Finally we illustrate the efficiency of the model by simulation and
empirical analysis. We show that this model provides a much better forecast of
the volatility than the Markov switching GARCH model.
","[{""version"":""v1"",""created"":""Fri, 22 Mar 2013 06:21:42 GMT""},{""version"":""v2"",""created"":""Wed, 19 Feb 2014 10:35:51 GMT""}]","2014-02-20"
"1303.5526","Oliver Obst","Oliver Obst, Joschka Boedecker, Benedikt Schmidt, Minoru Asada","On active information storage in input-driven systems",,,,,"cs.IT math.IT","http://arxiv.org/licenses/nonexclusive-distrib/1.0/","  Information theory and the framework of information dynamics have been used
to provide tools to characterise complex systems. In particular, we are
interested in quantifying information storage, information modification and
information transfer as characteristic elements of computation. Although these
quantities are defined for autonomous dynamical systems, information dynamics
can also help to get a ""wholistic"" understanding of input-driven systems such
as neural networks. In this case, we do not distinguish between the system
itself, and the effects the input has to the system. This may be desired in
some cases, but it will change the questions we are able to answer, and is
consequently an important consideration, for example, for biological systems
which perform non-trivial computations and also retain a short-term memory of
past inputs. Many other real world systems like cortical networks are also
heavily input-driven, and application of tools designed for autonomous dynamic
systems may not necessarily lead to intuitively interpretable results.
  The aim of our work is to extend the measurements used in the information
dynamics framework for input-driven systems. Using the proposed input-corrected
information storage we hope to better quantify system behaviour, which will be
important for heavily input-driven systems like artificial neural networks to
abstract from specific benchmarks, or for brain networks, where intervention is
difficult, individual components cannot be tested in isolation or with
arbitrary input data.
","[{""version"":""v1"",""created"":""Fri, 22 Mar 2013 06:40:30 GMT""}]","2013-03-25"
"1303.5527","Bo Zhou","Jianping Li, B. Zhou","Signless laplacian characteristic polynomials of regular graph
  transformations",,,,,"math.CO","http://arxiv.org/licenses/nonexclusive-distrib/1.0/","  Let $G$ be a simple $r$-regular graph with $n$ vertices and $m$ vertices. We
give the signless Laplacian characteristic polynomials of $xyz$-transformations
$G^{xyz}$ of $G$ in terms of $n$, $m$, $r$ and the signless Laplacian spectrum
of $G$.
","[{""version"":""v1"",""created"":""Fri, 22 Mar 2013 06:43:41 GMT""}]","2013-03-25"
"1303.5528","Ryosuke Asano","Ryosuke S. Asano, Tsutomu T. Takeuchi, Hiroyuki Hirashita, and Takaya
  Nozawa","What determines the grain size distribution in galaxies?","20 pages, 11 figures, accepted for publication in MNRAS",,"10.1093/mnras/stt506",,"astro-ph.GA","http://arxiv.org/licenses/nonexclusive-distrib/1.0/","  We construct a dust evolution model taking into account the grain size
distribution, and investigate what kind of dust processes determine the grain
size distribution at each stage of galaxy evolution. In addition to the dust
production by type II supernovae (SNeII) and asymptotic giant branch (AGB)
stars, we consider three processes in the ISM: (i) dust destruction by SN
shocks, (ii) metal accretion onto the surface of preexisting grains in the cold
neutral medium (CNM) (called grain growth), and (iii) grain-grain collisions
(shattering and coagulation) in the warm neutral medium (WNM) and CNM. We found
that the grain size distribution in galaxies is controlled by stellar sources
in the early stage of galaxy evolution, and that afterwards the main processes
that govern the size distribution changes to those in the ISM. Since shattering
produces a large abundance of small grains (consequently, the surface-to-volume
ratio of grains increases), it enhances the efficiency of grain growth,
contributing to the significant increase of the total dust mass. Grain growth
creates a large bump in the grain size distribution around a ~ 0.01 \mu m.
Coagulation occurs effectively after the number of small grains is enhanced by
shattering, and the grain size distribution is deformed to have a bump at a ~
0.03 - 0.05 \mu m at t ~ 10 Gyr. We conclude that the evolutions of the total
dust mass and the grain size distribution in galaxies are closely related to
each other, and the grain size distribution changes considerably through the
galaxy evolution because the dominant dust processes which regulate the grain
size distribution change.
","[{""version"":""v1"",""created"":""Fri, 22 Mar 2013 06:44:52 GMT""}]","2015-06-15"
"1303.5529","Edouard B. Sonin","E.B. Sonin","Transverse force on a vortex in lattice models of superfluids","8 pages, 1 figure","Phys. Rev. B 88, 214513 (2013)","10.1103/PhysRevB.88.214513",,"cond-mat.other","http://arxiv.org/licenses/nonexclusive-distrib/1.0/","  The paper derives the transverse forces (the Magnus and the Lorentz forces)
in the lattice models of superfluids in the continuous approximation. The
continuous approximation restores translational invariance absent in the
original lattice model, but the theory is not Galilean invariant. As a result,
calculation of the two transverse forces on the vortex, Magnus force and
Lorentz force, requires the analysis of two balances, for the true momentum of
particles in the lattice (Magnus force) and for the quasimomentum (Lorentz
force) known from the Bloch theory of particles in the periodic potential.
While the developed theory yields the same Lorentz force, which was well known
before, a new general expression for the Magnus force was obtained. The theory
demonstrates how a small Magnus force emerges in the Josephson-junction array
if the particle-hole symmetry is broken. The continuous approximation for the
Bose--Hubbard model close to the superfluid-insulator transition was developed,
which was used for calculation of the Magnus force. The theory shows that there
is an area in the phase diagram for the Bose--Hubbard model, where the Magnus
force has an inverse sign with respect to that which is expected from the sign
of velocity circulation.
","[{""version"":""v1"",""created"":""Fri, 22 Mar 2013 07:04:13 GMT""},{""version"":""v2"",""created"":""Tue, 24 Dec 2013 09:35:47 GMT""}]","2013-12-25"
"1303.5530","Teiko Heinosaari","Teiko Heinosaari, Takayuki Miyadera","Qualitative Noise-Disturbance Relation for Quantum Measurements","update to match published version","Phys. Rev. A 88, 042117 (2013)","10.1103/PhysRevA.88.042117",,"quant-ph","http://arxiv.org/licenses/nonexclusive-distrib/1.0/","  The inherent connection between noise and disturbance is one of the most
fundamental features of quantum measurements. In the two well-known extreme
cases a measurement either makes no disturbance but then has to be totally
noisy or is as accurate as possible but then has to disturb so much that all
subsequent measurements become redundant.Most of the measurements are, however,
something between these two extremes.We derive a structural relation between
observables and channels that properly explains the trade-off between noise and
disturbance.
","[{""version"":""v1"",""created"":""Fri, 22 Mar 2013 07:04:16 GMT""},{""version"":""v2"",""created"":""Tue, 7 Jan 2014 11:59:46 GMT""}]","2014-01-08"
