"1303.5572","Khalid Akhlil Dr.","Khalid Akhlil","The Laplacian with Robin Boundary Conditions involving signed measures",,,,,"math.FA","http://arxiv.org/licenses/nonexclusive-distrib/1.0/","  In this work we propose to study the general Robin boundary value problem
involving signed smooth measures on an arbitrary domain $\Omega$ of $\mathbb
R^d$. A Kato class of measures is defined to insure the closability of the
associated form $(\mem,\mfm)$. Moreover, the associated operator $\Delta_{\mu}$
is a realization of the Laplacian on $L^2(\Omega)$. In particular, when $|\mu|$
is locally infinite everywhere on $\po$, $\Delta_{\mu}$ is the laplacian with
Dirichlet boundary conditions. On the other hand, we will prove that he
semigroup $(\emu)_{t\geq 0}$ is sandwitched between $(\emup)_{t\geq 0}$ and
$(\emun)_{t\geq 0}$ and we will see that the converse is also true.
","[{""version"":""v1"",""created"":""Fri, 22 Mar 2013 10:22:39 GMT""}]","2013-03-25"
"1303.5573","Alexander Silenko","Alexander J. Silenko","Validation of the Eriksen Method of the Exact Foldy-Wouthuysen
  Representation","7 pages","Physics of Particles and Nuclei Letters 10 (2013) 198","10.1134/S154747711303014X",,"math-ph math.MP","http://arxiv.org/licenses/nonexclusive-distrib/1.0/","  The Eriksen method is proven to yield a correct and exact result when a
sufficient condition of exact transformation to the Foldy-Wouthuysen (FW)
representation is satisfied. Therefore, the Eriksen method is confirmed as
valid. This makes it possible to establish the limits within which the
approximate ""step-by-step"" methods are applicable. The latter is done by
comparing the relativistic formulas for a Hamiltonian operator in the FW
representation (obtained using those methods) and the known expression for the
first terms of a series, which defines the expansion of this operator in powers
of v/c as found by applying the Eriksen method.
","[{""version"":""v1"",""created"":""Fri, 22 Mar 2013 10:26:14 GMT""}]","2013-03-25"
"1303.5574","Alejandro Melle Hernandez","S.M. Gusein-Zade, I. Luengo, A. Melle-Hern\'andez","Higher order generalized Euler characteristics and generating series",,,,,"math.AG","http://arxiv.org/licenses/nonexclusive-distrib/1.0/","  For a complex quasi-projective manifold with a finite group action, we define
higher order generalized Euler characteristics with values in the Grothendieck
ring of complex quasi-projective varieties extended by the rational powers of
the class of the affine line. We compute the generating series of generalized
Euler characteristics of a fixed order of the Cartesian products of the
manifold with the wreath product actions on them.
","[{""version"":""v1"",""created"":""Fri, 22 Mar 2013 10:31:33 GMT""}]","2013-03-25"
"1303.5575","Robert Fleischer","Guennadi Borissov, Robert Fleischer, Marie-H\'el\`ene Schune","Rare Decays and CP Violation in the $B_s$ System","40 pages, 10 figures, Invited contribution to Annual Review of
  Nuclear and Particle Science, Vol. 63 (2013)",,"10.1146/annurev-nucl-102912-144527","Nikhef-2013-009, LAL 13-72","hep-ph hep-ex","http://arxiv.org/licenses/nonexclusive-distrib/1.0/","  CP violating phenomena and rare decays of $B_s$ mesons offer interesting
probes to test the quark-flavor sector of the Standard Model. In view of plenty
of data reported in particular from the Large Hadron Collider, this topic has
received a lot of attention in 2012. We give an overview of the the most recent
experimental results, new theoretical developments, and discuss the prospects
for the future exploration of the $B_s$-meson system.
","[{""version"":""v1"",""created"":""Fri, 22 Mar 2013 10:40:23 GMT""}]","2015-06-15"
"1303.5576","Laura Valore","Pierre Auger Collaboration","Techniques for Measuring Aerosol Attenuation using the Central Laser
  Facility at the Pierre Auger Observatory","28 pages, 13 figures","JINST 8 (2013) P04009","10.1088/1748-0221/8/04/P04009",,"astro-ph.IM astro-ph.HE","http://arxiv.org/licenses/nonexclusive-distrib/1.0/","  The Pierre Auger Observatory in Malarg\""ue, Argentina, is designed to study
the properties of ultra-high energy cosmic rays with energies above 1018 eV. It
is a hybrid facility that employs a Fluorescence Detector to perform nearly
calorimetric measurements of Extensive Air Shower energies. To obtain reliable
calorimetric information from the FD, the atmospheric conditions at the
observatory need to be continuously monitored during data acquisition. In
particular, light attenuation due to aerosols is an important atmospheric
correction. The aerosol concentration is highly variable, so that the aerosol
attenuation needs to be evaluated hourly. We use light from the Central Laser
Facility, located near the center of the observatory site, having an optical
signature comparable to that of the highest energy showers detected by the FD.
This paper presents two procedures developed to retrieve the aerosol
attenuation of fluorescence light from CLF laser shots. Cross checks between
the two methods demonstrate that results from both analyses are compatible, and
that the uncertainties are well understood. The measurements of the aerosol
attenuation provided by the two procedures are currently used at the Pierre
Auger Observatory to reconstruct air shower data.
","[{""version"":""v1"",""created"":""Fri, 22 Mar 2013 10:43:13 GMT""}]","2014-07-03"
"1303.5577","Ilaria Ermolli","I. Ermolli, K. Matthes, T. Dudok de Wit, N. A. Krivova, K. Tourpali,
  M. Weber, Y. C. Unruh, L. Gray, U. Langematz, P. Pilewskie, E. Rozanov, W.
  Schmutz, A. Shapiro, S. K. Solanki, and T. N. Woods","Recent variability of the solar spectral irradiance and its impact on
  climate modelling","34 pages, 12 figures, accepted for publication in ACP",,"10.5194/acp-13-3945-2013",,"astro-ph.SR physics.ao-ph","http://arxiv.org/licenses/nonexclusive-distrib/1.0/","  The lack of long and reliable time series of solar spectral irradiance (SSI)
measurements makes an accurate quantification of solar contributions to recent
climate change difficult. Whereas earlier SSI observations and models provided
a qualitatively consistent picture of the SSI variability, recent measurements
by the SORCE satellite suggest a significantly stronger variability in the
ultraviolet (UV) spectral range and changes in the visible and near-infrared
(NIR) bands in anti-phase with the solar cycle. A number of recent
chemistry-climate model (CCM) simulations have shown that this might have
significant implications on the Earth's atmosphere. Motivated by these results,
we summarize here our current knowledge of SSI variability and its impact on
Earth's climate. We present a detailed overview of existing SSI measurements
and provide thorough comparison of models available to date. SSI changes
influence the Earth's atmosphere, both directly, through changes in shortwave
(SW) heating and therefore, temperature and ozone distributions in the
stratosphere, and indirectly, through dynamical feedbacks. We investigate these
direct and indirect effects using several state-of-the art CCM simulations
forced with measured and modeled SSI changes. A unique asset of this study is
the use of a common comprehensive approach for an issue that is usually
addressed separately by different communities. Omissis. Finally, we discuss the
reliability of the available data and we propose additional coordinated work,
first to build composite SSI datasets out of scattered observations and to
refine current SSI models, and second, to run coordinated CCM experiments.
","[{""version"":""v1"",""created"":""Fri, 22 Mar 2013 10:51:01 GMT""}]","2015-06-15"
"1303.5578","Yunxia Chen","Yunxia Chen and Naichung Conan Leung","Affine ADE bundles over complex surfaces with p_g=0","22pages",,,,"math.AG","http://creativecommons.org/licenses/by-nc-sa/3.0/","  We study simply-laced simple affine Lie algebra bundles over complex surfaces
X. Given any Kodaira curve C in X, we construct such a bundle over X. After
deformations, it becomes trivial on every irreducible component of C provided
that p_g(X)=0. When X is a blowup of P^2 at nine points, there is a canonical
E_8-bundle E over X. We show that the geometry of X can be reflected by the
deformability of E.
","[{""version"":""v1"",""created"":""Fri, 22 Mar 2013 10:56:02 GMT""}]","2013-03-25"
"1303.5579","Nanda Rea","N. Rea, G. L. Israel, J. A. Pons, R. Turolla, D. Vigano, S. Zane, P.
  Esposito, R. Perna, A. Papitto, G. Terreran, A. Tiengo, D. Salvetti, J. M.
  Girart, Aina Palau, A. Possenti, M. Burgay, E. Gogus, A. Caliandro, C.
  Kouveliotou, D. Gotz, R. P. Mignani, E. Ratti, L. Stella","The outburst decay of the low magnetic field magnetar SGR 0418+5729","ApJ in press (15 pages, 11 figures)","The Astrophysical Journal, Volume 770, Issue 1, article id. 65, 14
  pp. (2013)","10.1088/0004-637X/770/1/65",,"astro-ph.GA astro-ph.HE","http://arxiv.org/licenses/nonexclusive-distrib/1.0/","  We report on the long term X-ray monitoring of the outburst decay of the low
magnetic field magnetar SGR 0418+5729, using all the available X-ray data
obtained with RXTE, SWIFT, Chandra, and XMM-Newton observations, from the
discovery of the source in June 2009, up to August 2012. The timing analysis
allowed us to obtain the first measurement of the period derivative of SGR
0418+5729: \dot{P}=4(1)x10^{-15} s/s, significant at ~3.5 sigma confidence
level. This leads to a surface dipolar magnetic field of B_dip ~6x 10^{12} G.
This measurement confirms SGR 0418+5729 as the lowest magnetic field magnetar.
Following the flux and spectral evolution from the beginning of the outburst up
to ~1200 days, we observe a gradual cooling of the tiny hot spot responsible
for the X-ray emission, from a temperature of ~0.9 to 0.3 keV. Simultaneously,
the X-ray flux decreased by about 3 orders of magnitude: from about
1.4x10^{-11} to 1.2x10^{-14} erg/s/cm^2 . Deep radio, millimeter, optical and
gamma-ray observations did not detect the source counterpart, implying
stringent limits on its multi-band emission, as well as constraints on the
presence of a fossil disk. By modeling the magneto-thermal secular evolution of
SGR 0418+5729, we infer a realistic age of ~550 kyr, and a dipolar magnetic
field at birth of ~10^{14} G. The outburst characteristics suggest the presence
of a thin twisted bundle with a small heated spot at its base. The bundle
untwisted in the first few months following the outburst, while the hot spot
decreases in temperature and size. We estimate the outburst rate of low
magnetic field magnetars to be about one per year per galaxy, and we briefly
discuss the consequences of such result in several other astrophysical
contexts.
","[{""version"":""v1"",""created"":""Fri, 22 Mar 2013 11:00:38 GMT""},{""version"":""v2"",""created"":""Wed, 17 Apr 2013 13:27:52 GMT""}]","2013-06-11"
"1303.5580","Q. Shao","Q. Y. Shao, G. W. Wang, J. Zhang, K. G. Zhu","First principles calculation of lithium-phosphorus co-doped diamond","14 pages, 11 figures","Condens. Matter Phys., 2013, vol. 16, No. 1, 13702:1-14","10.5488/CMP.16.13702",,"cond-mat.mtrl-sci","http://arxiv.org/licenses/nonexclusive-distrib/1.0/","  We calculate the density of states (DOS) and the Mulliken population of the
diamond and the co-doped diamonds with different concentrations of lithium (Li)
and phosphorus (P) by the method of the density functional theory, and analyze
the bonding situations of the Li-P co-doped diamond thin films and the impacts
of the Li-P co-doping on the diamond conductivities. The results show that the
Li-P atoms can promote the split of the diamond energy band near the Fermi
level, and improve the electron conductivities of the Li-P co-doped diamond
thin films, or even make the Li-P co-doped diamond from semiconductor to
conductor. The effect of Li-P co-doping concentration on the orbital charge
distributions, bond lengths and bond populations is analyzed. The Li atom may
promote the split of the energy band near the Fermi level as well as may
favorably regulate the diamond lattice distortion and expansion caused by the P
atom.
","[{""version"":""v1"",""created"":""Fri, 22 Mar 2013 11:08:14 GMT""}]","2013-03-25"
"1303.5581","Ivonne Zavala","Danielle Wills, Konstantinos Dimopoulos, Ivonne Zavala","D-branes and cosmic structure","Prepared for the proceedings of the Barcelona Postgraduate Encounters
  in Fundamental Physics. 13 Pages, 2 figures",,,,"hep-th astro-ph.CO gr-qc","http://arxiv.org/licenses/nonexclusive-distrib/1.0/","  We outline the embedding of the vector curvaton scenario as a promising
mechanism to generate statistical anisotropy within Type IIB string theory,
where the vector field on a single D-brane plays the role of the vector
curvaton. We first consider a toy model in the context of open string
inflation, and then begin to construct a concrete model in the context of
closed string inflation.
","[{""version"":""v1"",""created"":""Fri, 22 Mar 2013 11:08:18 GMT""}]","2013-04-02"
"1303.5582","Mykola Korynevsky","M. A. Korynevskii, V. B. Solovyan","Dipole glass parameter behaviour for ferro-antiferroelectric solid
  mixtures","8 pages, 3 figures","Condens. Matter Phys., 2013, vol. 16, No. 1, 13703:1-8","10.5488/CMP.16.13703",,"cond-mat.mtrl-sci","http://arxiv.org/licenses/nonexclusive-distrib/1.0/","  A new definition of a dipole glass parameter for ferro-antiferroelectric
solid mixtures is suggested. It is constructed on the nearest neighbours pair
correlation functions for interacting dipole momenta. The behaviour of the
dipole glass parameter is calculated and discussed.
","[{""version"":""v1"",""created"":""Fri, 22 Mar 2013 11:14:10 GMT""}]","2013-03-25"
"1303.5583","Marta Strani","Corrado Mascia and Marta Strani","Slow motion for compressible isentropic Navier--Stokes equations","18 pages",,,,"math.AP","http://arxiv.org/licenses/nonexclusive-distrib/1.0/","  We consider the compressible Navier-Stokes equations for isentropic dynamics
with real viscosity on a bounded interval. In the case of boundary data
defining an admissible shock wave for the corresponding unviscous hyperbolic
system, we determine a scalar differential equation describing the motion of
the internal transition layer. In particular, for small viscosity, the velocity
of the motion is exponentially small. The approach is based on the construction
of a one-parameter manifold of approximate solutions and on an appropriate
projection of the evolution of the complete Navier-Stokes system towards such
manifold.
","[{""version"":""v1"",""created"":""Fri, 22 Mar 2013 11:17:09 GMT""}]","2013-03-25"
"1303.5584","Jong-Hyun Baek","Jong-Hyun Baek","Genus one correction to Seiberg-Witten prepotential from \beta-deformed
  matrix model","32 pages, minor corrections, v3: small corrections, references added","JHEP 1304:120,2013","10.1007/JHEP04(2013)120",,"hep-th","http://arxiv.org/licenses/nonexclusive-distrib/1.0/","  We study \beta-deformed matrix models with Penner type potentials, which
correspond to N=2 SU(2) supersymmetric gauge theories with N_F=2,3, and 4
flavors. We compute explicitly the genus one corrections to the free energy of
the matrix model and show that they match the corresponding results obtained
from the Nekrasov partition function.
","[{""version"":""v1"",""created"":""Fri, 22 Mar 2013 11:18:00 GMT""},{""version"":""v2"",""created"":""Mon, 25 Mar 2013 17:27:23 GMT""},{""version"":""v3"",""created"":""Fri, 3 May 2013 07:08:32 GMT""}]","2013-05-06"
"1303.5585","Jozef Sznajd","J. Sznajd","Linear perturbation renormalization group method for Ising-like spin
  systems","8 pages, 7 figures","Condens. Matter Phys., 2013, vol. 16, No. 1, 13704:1-8","10.5488/CMP.16.13704",,"cond-mat.stat-mech","http://arxiv.org/licenses/nonexclusive-distrib/1.0/","  The linear perturbation group transformation (LPRG) is used to study the
thermodynamics of the axial next-nearest-neighbor Ising model with four spin
interactions (extended ANNNI) in a field. The LPRG for weakly interacting Ising
chains is presented. The method is used to study finite field
para-ferrimagnetic phase transitions observed in layered uranium compounds,
UAs_{1-x}Se_x, UPd_2Si_2 or UNi_2Si_2. The above-mentioned systems are made of
ferromagnetic layers and the spins from the nearest-neighbor and
next-nearest-neighbor layers are coupled by the antiferromagnetic interactions
J_1<0 and J_2<0, respectively. Each of these systems exhibits a triple point in
which two ordered phases (ferrimagnetic and incommensurate) meet the
paramagnetic one, and all undergo the high field phase transition from para- to
ferrimagnetic (++-) phase. However, if in UAs_{1-x}Se_x the para-ferri phase
transition is of the first order as expected from the symmetry reason, in
UT_2Si_2 (T=Pd,Ni) this transition seems to be a continuous one, at least in
the vicinity of the multicritical point. Within the MFA, the critical character
of the finite field para-ferrimagnetic transition at least at one isolated
point can be described by the ANNNI model supplemented by an additional, e.g.,
four-spin interaction. However, in LPRG approximation for the ratio
\kappa=J_2/J_1 around 0.5 there is a critical value of the field for which an
isolated critical point also exists in the original ANNNI model. The positive
four-spin interaction shifts the critical point towards higher fields and
changes the shape of the specific heat curve. In the latter case for the fields
small enough, the specific heat exhibits two-peak structure in the paramagnetic
phase.
","[{""version"":""v1"",""created"":""Fri, 22 Mar 2013 11:21:45 GMT""}]","2013-03-25"
"1303.5586","Ji\=an F \`u","Jian Fu, Guinevere Kauffmann, Meiling Huang, Robert M. Yates, Sean
  Moran, Timothy M. Heckman, Romeel Dav\'e, Qi Guo, Bruno M. B. Henriques","Star Formation and Metallicity Gradients in Semi-analytic Models of Disk
  Galaxy Formation","20 pages, 13 figures, accepted for publication in MNRAS. Newer
  version rephrases the descriptions on the physical recipes and model results
  according to the refree's report","2013MNRAS.434.1531F","10.1093/mnras/stt1117",,"astro-ph.CO astro-ph.GA","http://arxiv.org/licenses/nonexclusive-distrib/1.0/","  We have updated our radially-resolved SAMs of galaxy formation, which track
both the atomic and molecular gas phases of the ISM. The models are adapted
from those of Guo et al. using similar methodology as in Fu et al. and are run
on halo merger trees from the MS and MS II with the following main changes: (1)
We adopt a simple star formation law where \Sigma_SFR \propto \Sigma_H2 (2) We
inject the heavy elements produced by supernovae directly into the halo hot
gas, instead of first mixing them with the cold gas in the disk. (3) We include
radial gas inflows in disks using a model of the form v_inflow = \alpha r. The
models are used to study the radial profiles of star formation rate and
gas-phase metallicity in present-day galaxies. The \Sigma_H2 profiles in L*
galaxies place strong constraints on inflow velocities, favouring models where
v_inflow~7km/s at a galactocentric radius of 10kpc. Radial gas inflow has
little influence on gas-phase and stellar metallicity gradients, which are
affected much more strongly by the fraction of metals that are directly
injected into the halo gas, rather than mixed with the cold gas. Metals ejected
out of the galaxy in early epochs result in late infall of pre-enriched gas and
flatter present-day gas-phase metallicity gradients. A prescription in which
80% of the metals are injected into the halo gas results in good fits to the
flat observed metallicity gradients in galaxies with stellar masses greater
than 10^10 M_sun, as well as the relations between gas-phase metallicity and
sSFR in the outer parts of galactic disks. We examine the correlation between
gas-phase metallicity gradient and global galaxy properties, finding that it is
most strongly correlated with the bulge-to-total ratio of the galaxy. This is
because gas is consumed when the bulge forms during galaxy mergers, and the
gas-phase metallicity gradient is then set by newly-accreted gas.
","[{""version"":""v1"",""created"":""Fri, 22 Mar 2013 11:24:03 GMT""},{""version"":""v2"",""created"":""Tue, 18 Jun 2013 08:02:22 GMT""}]","2022-12-29"
"1303.5587","Roberto Bondesan","Roberto Bondesan and Thomas Quella","Topological and symmetry broken phases of Z_N parafermions in one
  dimension","16 pages; v2: improved exposition and additional references","J. Stat. Mech. (2013) P10024","10.1088/1742-5468/2013/10/P10024",,"cond-mat.str-el math-ph math.MP","http://arxiv.org/licenses/nonexclusive-distrib/1.0/","  We classify the gapped phases of Z_N parafermions in one dimension and
construct a representative of each phase. Even in the absence of additional
symmetries besides parafermionic parity, parafermions may be realized in a
variety of phases, one for each divisor n of N. The phases can be characterized
by spontaneous symmetry breaking, topology, or a mixture of the two. Purely
topological phases arise if n is a unitary divisor, i.e. if n and N/n are
co-prime. Our analysis is based on the explicit realization of all symmetry
broken gapped phases in the dual Z_N-invariant quantum spin chains.
","[{""version"":""v1"",""created"":""Fri, 22 Mar 2013 11:29:55 GMT""},{""version"":""v2"",""created"":""Thu, 31 Oct 2013 21:31:18 GMT""}]","2020-09-11"
"1303.5588","Aleksandr Aravkin","Aleksandr Y. Aravkin, James V. Burke, and Gianluigi Pillonetto","Robust and Trend Following Student's t Kalman Smoothers","23 pages, 7 figures",,,,"math.OC math.NA stat.AP stat.ML","http://arxiv.org/licenses/nonexclusive-distrib/1.0/","  We present a Kalman smoothing framework based on modeling errors using the
heavy tailed Student's t distribution, along with algorithms, convergence
theory, open-source general implementation, and several important applications.
The computational effort per iteration grows linearly with the length of the
time series, and all smoothers allow nonlinear process and measurement models.
  Robust smoothers form an important subclass of smoothers within this
framework. These smoothers work in situations where measurements are highly
contaminated by noise or include data unexplained by the forward model. Highly
robust smoothers are developed by modeling measurement errors using the
Student's t distribution, and outperform the recently proposed L1-Laplace
smoother in extreme situations with data containing 20% or more outliers.
  A second special application we consider in detail allows tracking sudden
changes in the state. It is developed by modeling process noise using the
Student's t distribution, and the resulting smoother can track sudden changes
in the state.
  These features can be used separately or in tandem, and we present a general
smoother algorithm and open source implementation, together with convergence
analysis that covers a wide range of smoothers. A key ingredient of our
approach is a technique to deal with the non-convexity of the Student's t loss
function. Numerical results for linear and nonlinear models illustrate the
performance of the new smoothers for robust and tracking applications, as well
as for mixed problems that have both types of features.
","[{""version"":""v1"",""created"":""Fri, 22 Mar 2013 11:36:19 GMT""}]","2013-03-25"
"1303.5589","Swarupananda Pradhan Dr.","S. Pradhan, S. Mishra, and A.K. Das","A non-scanning atomic magnetometer based on coherent population trapping",,,,,"physics.atom-ph","http://arxiv.org/licenses/nonexclusive-distrib/1.0/","  The method of operation of an atomic magnetometer based on coherent
population trapping (CPT) without any requirement of radio frequency scanning
is demonstrated. Using a hybrid approach comprising of polarization rotation
and tailored transmission due to CPT states, the simultaneous operation of the
device as atomic frequency standard as well as atomic magnetometer is
investigated. The magnetometer sensitivity can be further improved by utilizing
the inherent option of magnetic field assisted synchronized radio frequency
scanning.
","[{""version"":""v1"",""created"":""Fri, 22 Mar 2013 11:44:15 GMT""}]","2013-03-25"
"1303.5590","Sudarshan Kumar Kenettinkara","Kumar K. Sudarshan, C. Praveen and G. D. Veerappa Gowda","Multicomponent polymer flooding in two dimensional oil reservoir
  simulation",,,,,"math.AP","http://arxiv.org/licenses/nonexclusive-distrib/1.0/","  We propose a high resolution finite volume scheme for a (m+1)x(m+1) system of
non strictly hyperbolic conservation laws which models multicomponent polymer
flooding in enhanced oil-recovery process in two dimensions. In the presence of
gravity the flux functions need not be monotone and hence the exact Riemann
problem is complicated and computationally expensive. To overcome this
difficulty, we use the idea of discontinuous flux to reduce the coupled system
into uncoupled system of scalar conservation laws with discontinuous
coefficients. High order accurate scheme is constructed by introducing slope
limiter in space variable and a strong stability preserving Runge-Kutta scheme
in the time variable. The performance of the numerical scheme is presented in
various situations by choosing a heavily heterogeneous hard rock type medium.
Also the significance of dissolving multiple polymers in aqueous phase is
presented
","[{""version"":""v1"",""created"":""Fri, 22 Mar 2013 11:51:45 GMT""},{""version"":""v2"",""created"":""Thu, 26 Feb 2015 20:51:23 GMT""}]","2015-02-27"
