"1303.5388","Quentin Merigot","Quentin M\'erigot (LJK)","Lower bounds for k-distance approximation",,"ACM Symposium on Computational Geometry, Rio de Janeiro : France
  (2013)","10.1145/2462356.2462367",,"cs.CG","http://arxiv.org/licenses/nonexclusive-distrib/1.0/","  Consider a set P of N random points on the unit sphere of dimension $d-1$,
and the symmetrized set S = P union (-P). The halving polyhedron of S is
defined as the convex hull of the set of centroids of N distinct points in S.
We prove that after appropriate rescaling this halving polyhedron is Hausdorff
close to the unit ball with high probability, as soon as the number of points
grows like $Omega(d log(d))$. From this result, we deduce probabilistic lower
bounds on the complexity of approximations of the distance to the empirical
measure on the point set by distance-like functions.
","[{""version"":""v1"",""created"":""Thu, 21 Mar 2013 19:57:34 GMT""}]","2014-04-25"
"1303.5389","Anne-Claire Egloffe","Anne-Claire Egloffe (INRIA Paris-Rocquencourt)","Lipschitz stability estimate in the inverse Robin problem for the Stokes
  system",,"Comptes Rendus de l Acad\'emie des Sciences - Series I -
  Mathematics (2013)",,,"math.AP","http://arxiv.org/licenses/nonexclusive-distrib/1.0/","  We are interested in the inverse problem of recovering a Robin coefficient
defined on some non accessible part of the boundary from available data on
another part of the boundary in the nonstationary Stokes system. We prove a
Lipschitz stability estimate under the \textit{a priori} assumption that the
Robin coefficient lives in some compact and convex subset of a finite
dimensional vectorial subspace of the set of continuous functions. To do so, we
use a theorem proved by L. Bourgeois which establishes Lipschitz stability
estimates for a class of inverse problems in an abstract framework.
","[{""version"":""v1"",""created"":""Thu, 21 Mar 2013 19:58:14 GMT""}]","2013-09-11"
"1303.5443","Christoph Pfrommer","Christoph Pfrommer (Heidelberg Institute for Theoretical Studies)","Toward a comprehensive model for feedback by active galactic nuclei: new
  insights from M87 observations by LOFAR, Fermi and H.E.S.S","18 pages, 9 figures, ApJ in print, final version that matches the one
  to be published, improved predictions for the radio emission, discussion
  added about the impact of a variable Alfven speed on the global and local
  thermal stability, all conclusions unchanged",,"10.1088/0004-637X/779/1/10",,"astro-ph.CO astro-ph.HE","http://arxiv.org/licenses/nonexclusive-distrib/1.0/","  Feedback by active galactic nuclei (AGNs) appears to be critical in balancing
radiative cooling of the low-entropy gas at the centers of galaxy clusters and
in mitigating the star formation of elliptical galaxies. New observations of
M87 enable us to put forward a comprehensive model for the physical heating
mechanism. Low-frequency radio observations by LOFAR revealed the absence of
fossil cosmic-ray (CR) electrons in the radio halo surrounding M87. This puzzle
can be resolved by accounting for the CR release from the radio cocoons and the
subsequent mixing of CRs with the dense ambient intracluster gas, which
thermalizes the electrons on a timescale similar to the radio halo age of 40
Myr. Hadronic interactions of similarly injected CR protons with the ambient
gas should produce an observable gamma-ray signal in accordance with the steady
emission of the low state of M87 detected by Fermi and H.E.S.S. Hence, we
normalize the CR population to the gamma-ray emission, which shows the same
spectral slope as the CR injection spectrum probed by LOFAR, thereby supporting
a common origin. We show that CRs, which stream at the Alfven velocity with
respect to the plasma rest frame, heat the surrounding thermal plasma at a rate
that balances that of radiative cooling on average at each radius. However, the
resulting global thermal equilibrium is locally unstable and allows for the
formation of the observed cooling multi-phase medium through thermal
instability. Provided that CR heating balances cooling during the emerging
""cooling flow,"" the collapse of the majority of the gas is halted around 1 keV
- in accordance with X-ray data. We show that both the existence of a
temperature floor and the similar radial scaling of the heating and cooling
rates are generic predictions of the CR heating model.
","[{""version"":""v1"",""created"":""Thu, 21 Mar 2013 20:00:01 GMT""},{""version"":""v2"",""created"":""Thu, 24 Oct 2013 20:15:12 GMT""}]","2015-06-15"
"1303.5444","Christian Veenstra","C.N.Veenstra, Z.-H.Zhu, M.Raichle, B.M.Ludbrook, A.Nicolaou,
  B.Slomski, G.Landolt, S.Kittaka, Y.Maeno, J.H.Dil, I.S.Elfimov, M.W.Haverkort
  and A.Damascelli","Breakdown of singlets and triplets in Sr2RuO4 revealed by spin-resolved
  ARPES","Accepted for publication in PRL. A high-resolution version with
  supplementary material can be found at
  http://www.phas.ubc.ca/~quantmat/ARPES/PUBLICATIONS/Articles/SpinOrbitInSr214.pdf","PRL 112, 127002 (2014)",,,"cond-mat.supr-con","http://arxiv.org/licenses/nonexclusive-distrib/1.0/","  Spin-orbit coupling has been conjectured to play a key role in the low-energy
electronic structure of Sr2RuO4. Using circularly polarized light combined with
spin- and angle-resolved photoemission spectroscopy, we directly measure the
value of the effective spin-orbit coupling to be 130 +/- 30 meV. This is even
larger than theoretically predicted and comparable to the energy splitting of
the dxy and dxz,yz orbitals around the Fermi surface, resulting in a strongly
momentum-dependent entanglement of spin and orbital character. As demonstrated
by the spin expectation value obtained for a pair of electrons with zero total
momentum, the classification of the Cooper pairs in terms of pure singlets or
triplets fundamentally breaks down, necessitating a description of the
unconventional superconducting state of Sr2RuO4 in terms of these newly found
spin-orbital entangled eigenstates.
","[{""version"":""v1"",""created"":""Thu, 21 Mar 2013 20:00:02 GMT""},{""version"":""v2"",""created"":""Sat, 15 Feb 2014 16:56:08 GMT""}]","2014-03-31"
"1303.5445","Marcello Cacciato","Marcello Cacciato, Edo van Uitert, Henk Hoekstra","Describing galaxy weak lensing measurements from tenths to tens of Mpc
  and up to z~0.6 with a single model","15 pages, 8 figures, submitted to MNRAS",,"10.1093/mnras/stt1887",,"astro-ph.CO","http://arxiv.org/licenses/nonexclusive-distrib/1.0/","  The clustering of galaxies and the matter distribution around them can be
described using the halo model complemented with a realistic description of the
way galaxies populate dark matter haloes. This has been used successfully to
describe statistical properties of samples of galaxies at z<0.2. Without
adjusting any model parameters, we compare the predicted weak lensing signal
induced by Luminous Red Galaxies to measurements from SDSS DR7 on much larger
scales (up to ~90 h_{70}^{-1} Mpc) and at higher redshift (z~0.4). We find
excellent agreement, suggesting that the model captures the main properties of
the galaxy-dark matter connection. To extend the comparison to lenses at even
higher redshifts we complement the SDSS data with shape measurements from the
deeper RCS2, resulting in precise lensing measurements for lenses up to z~0.6.
These measurements are also well described using the same model. Considering
solely these weak lensing measurements, we robustly assess that, up to z~0.6,
the number of central galaxies as a function of halo mass is well described by
a log-normal distribution with scatter $\sigma_{\log L_{\rm c}}=0.146\pm0.011$,
in agreement with previous independent studies at lower redshift. Our results
demonstrate the value of complementing the information about the properties of
the (lens) galaxies provided by SDSS with deeper, high-quality imaging data.
","[{""version"":""v1"",""created"":""Thu, 21 Mar 2013 20:00:04 GMT""}]","2015-06-15"
"1303.5446","Stefano Camera","Stefano Camera and Atsushi Nishizawa","Beyond Concordance Cosmology with Magnification of Gravitational-Wave
  Standard Sirens","5 pages, 2 figures, 1 table; accepted for publication in Physical
  Review Letters","PRL 110, 151103 (2013)","10.1103/PhysRevLett.110.151103",,"astro-ph.CO astro-ph.HE","http://arxiv.org/licenses/nonexclusive-distrib/1.0/","  We show how future gravitational-wave detectors would be able of
discriminating between the concordance LCDM cosmological model and up-to-date
competing alternatives, e.g. dynamical dark energy models (DE) or modified
gravity theories (MG). Our method consists in using the weak-lensing
magnification effect that affects a standard-siren signal because of its
travelling trough the Universe's large-scale structure. As a demonstration, we
present constraints on DE and MG from proposed gravitational-wave detectors,
namely ET and DECIGO/BBO.
","[{""version"":""v1"",""created"":""Thu, 21 Mar 2013 20:00:04 GMT""}]","2013-04-09"
"1303.5447","Giulia Zanderighi","John M. Campbell, R. Keith Ellis, Paolo Nason and Giulia Zanderighi","W and Z bosons in association with two jets using the POWHEG method","35 pages, 43 figures",,"10.1007/JHEP08(2013)005",,"hep-ph hep-ex","http://arxiv.org/licenses/nonexclusive-distrib/1.0/","  In this work we present the implementation of generators for W and Z bosons
in association with two jets interfaced to parton showers using the POWHEG BOX.
We incorporate matrix elements from the parton-level Monte Carlo program MCFM
in the POWHEG BOX, allowing for a considerable improvement in speed compared to
previous implementations. We address certain problems that arise when processes
that are singular at the Born level are implemented in a shower framework using
either a generation cut or a Born suppression factor to yield weighted events.
In such a case, events with very large weights can be generated after the
shower through a number of mechanisms. Events with very small transverse
momentum at the Born level can develop large transverse momentum either after
the hardest emission, after the shower, or after the inclusion of multi-parton
interactions. We present a solution to this problem that can be easily
implemented in the POWHEG BOX. We also show that a full solution to this
problem can only be achieved if the generator maintains physical validity also
when the transverse momentum of the emitted partons becomes unresolved. One
such scheme is the recently-proposed MiNLO method for the choice of scale and
the exponentiation of Sudakov form factors in NLO computations. We present a
validation study of our generators, by comparing their output to available LHC
data.
","[{""version"":""v1"",""created"":""Thu, 21 Mar 2013 20:00:05 GMT""},{""version"":""v2"",""created"":""Thu, 28 Mar 2013 15:27:18 GMT""}]","2015-06-15"
"1303.5448","Bludov Yuliy","Nuno M. R. Peres and Yuliy V. Bludov","Enhancing the absorption of graphene in the terahertz range","5 pages, 4 figures","Europhysics Letters 101, 58002 (2013)","10.1209/0295-5075/101/58002",,"cond-mat.mes-hall physics.optics","http://arxiv.org/licenses/nonexclusive-distrib/1.0/","  We study graphene on a photonic crystal operating in the terahertz (THz)
spectral range. We show that the absorption of graphene becomes a modulated
function of frequency and can be enhanced by more than three times at specific
frequency values, depending on the parameters of the system. The problem of a
semi-infinite photonic crystal is also solved.
","[{""version"":""v1"",""created"":""Thu, 21 Mar 2013 20:00:10 GMT""}]","2013-03-25"
"1303.5449","Benjamin Niehoff","Benjamin E. Niehoff, Nicholas P. Warner","Doubly-Fluctuating BPS Solutions in Six Dimensions","24 pages",,"10.1007/JHEP10(2013)137",,"hep-th","http://arxiv.org/licenses/nonexclusive-distrib/1.0/","  We analyze the BPS solutions of minimal supergravity coupled to an
anti-self-dual tensor multiplet in six dimensions and find solutions that
fluctuate non-trivially as a function of two variables. We consider families of
solutions coming from KKM monopoles fibered over Gibbons-Hawking metrics or,
equivalently, non-trivial T^2 fibrations over an R3 base. We find smooth
microstate geometries that depend upon many functions of one variable, but each
such function depends upon a different direction inside the T^2 so that the
complete solution depends non-trivially upon the whole T^2 . We comment on the
implications of our results for the construction of a general superstratum.
","[{""version"":""v1"",""created"":""Thu, 21 Mar 2013 20:09:26 GMT""},{""version"":""v2"",""created"":""Wed, 1 May 2013 21:27:34 GMT""},{""version"":""v3"",""created"":""Fri, 3 May 2013 20:13:25 GMT""}]","2015-06-15"
"1303.5450","Hana Kogan","Hana Kogan","On Critical Points for Gaussian Vectors with Infinitely Divisible
  Squares",,,,,"math.PR","http://arxiv.org/licenses/nonexclusive-distrib/1.0/","  Investigates the size of the perturbation to the zero mean three dimensional
Gaussian vector with infinitely divisible squares so that the infinite
divisibility is retained.
","[{""version"":""v1"",""created"":""Thu, 21 Mar 2013 20:10:18 GMT""}]","2013-03-25"
"1303.5451","Kirill Sokolovsky","Kirill V. Sokolovsky (for the RadioAstron AGN Early Science Working
  Group)","RadioAstron Early Science Program Space-VLBI AGN survey: strategy and
  first results","6 pages, 3 figures, 1 table. Proceedings of the 11th EVN Symposium.
  Bordeaux (France), October 2012",,,,"astro-ph.CO astro-ph.HE astro-ph.IM","http://arxiv.org/licenses/nonexclusive-distrib/1.0/","  RadioAstron is a project to use the 10m antenna on board the dedicated
SPEKTR-R spacecraft, launched on 2011 July 18, to perform Very Long Baseline
Interferometry from space - Space-VLBI. We describe the strategy and highlight
the first results of a 92/18/6/1.35cm fringe survey of some of the brighter
radio-loud Active Galactic Nuclei (AGN) at baselines up to 25 Earth diameters
(D_E). The survey goals include a search for extreme brightness temperatures to
resolve the Doppler factor crisis and to constrain possible mechanisms of AGN
radio emission, studying the observed size distribution of the most compact
features in AGN radio jets (with implications for their intrinsic structure and
the properties of the scattering interstellar medium in our Galaxy) and
selecting promising objects for detailed follow-up observations, including
Space-VLBI imaging. Our survey target selection is based on the results of
correlated visibility measurements at the longest ground-ground baselines from
previous VLBI surveys. The current long-baseline fringe detections with
RadioAstron include OJ 287 at 10 D_E (18cm), BL Lac at 10 D_E (6cm) and
B0748+126 at 4.3 D_E (1.3 cm). The 18 and 6cm-band fringe detections at 10 D_E
imply brightness temperatures of T_b ~ 10^13 K, about two orders of magnitude
above the equipartition inverse Compton limit. These high values of T_b might
indicate that the jet flow speed is often higher than the jet pattern speed.
","[{""version"":""v1"",""created"":""Thu, 21 Mar 2013 20:14:03 GMT""},{""version"":""v2"",""created"":""Fri, 9 Aug 2013 15:21:06 GMT""}]","2019-08-14"
"1303.5452","Utkarsh R. Patel","Utkarsh R. Patel, Bjorn Gustavsen and Piero Triverio","Fast Computation of the Series Impedance of Power Cables with Inclusion
  of Skin and Proximity Effects","Submitted for publication to IEEE Transactions on Power Delivery.
  Update: Published in IEEE Transactions on Power Delivery with the revised
  title of ""An Equivalent Surface Current Approach for the Computation of the
  Series Impedance of Power Cables with Inclusion of Skin and Proximity
  Effects""","IEEE Trans. on Power Delivery, vol. 28, pp. 2474-2482, Oct. 2013","10.1109/TPWRD.2013.2267098",,"cs.CE","http://arxiv.org/licenses/nonexclusive-distrib/1.0/","  We present an efficient numerical technique for calculating the series
impedance matrix of systems with round conductors. The method is based on a
surface admittance operator in combination with the method of moments and it
accurately predicts both skin and proximity effects. Application to a
three-phase armored cable with wire screens demonstrates a speed-up by a factor
of about 100 compared to a finite elements computation. The inclusion of
proximity effect in combination with the high efficiency makes the new method
very attractive for cable modeling within EMTP-type simulation tools.
Currently, these tools can only take skin effect into account.
","[{""version"":""v1"",""created"":""Thu, 21 Mar 2013 20:18:16 GMT""},{""version"":""v2"",""created"":""Mon, 5 May 2014 16:34:01 GMT""}]","2016-06-29"
"1303.5453","Marek A. Abramowicz","M.A. Abramowicz, G.F.R. Ellis J. Horak, M. Wielgus","The perihelion of Mercury advance and the light bending calculated in
  (enhanced) Newton's theory","arXiv admin note: text overlap with arXiv:1212.0264","General Relativity and Gravitation 46:1630 (2013)","10.1007/s10714-013-1630-x",,"gr-qc astro-ph.HE","http://arxiv.org/licenses/nonexclusive-distrib/1.0/","  We show that results of a simple dynamical gedanken experiment interpreted
according to standard Newton's gravitational theory, may reveal that
three-dimensional space is curved. The experiment may be used to reconstruct
the curved geometry of space, i.e. its non-Euclidean metric. The perihelion of
Mercury advance and the light bending calculated from the Poisson equation and
the equation of motion in the curved geometry have the correct (observed)
values. Independently, we also show that Newtonian gravity theory may be
enhanced to incorporate the curvature of three dimensional space by adding an
extra equation which links the Ricci scalar with the density of matter. Like in
Einstein's general relativity, matter is the source of curvature. In the
spherically symmetric (vacuum) case, the metric of space 3gik that follows from
this extra equation agrees, to the expected accuracy, with the metric measured
by the Newtonian gedanken experiment mentioned above.
","[{""version"":""v1"",""created"":""Thu, 21 Mar 2013 20:20:04 GMT""}]","2014-12-16"
"1303.5454","Augustin Skopal","Augustin Skopal","Multiwavelength modeling the SED of very slow novae PU Vul and V723 Cas","4 pages, 1 figure, in Stella Novae: Future and Past Decades, P. A.
  Woudt & V. A. R. M. Ribeiro (eds), ASPCS (2013)",,,,"astro-ph.SR","http://arxiv.org/licenses/nonexclusive-distrib/1.0/","  Evolution in the spectrum of very slow novae PU Vul and V723 Cas during their
transition from the optical maximum to the nebular phase is investigated using
the method of disentangling the composite UV/optical spectra. Model SEDs
suggested that a transient decrease in the WD luminosity, during the decline
from the maximum, was caused by a negative beaming effect, when a neutral disk
around the WD was formed. When the disk disappeared, the luminosity increased
again to values from the beginning of the outburst (in the case of V723 Cas,
at/above the Eddington limit). This suggests the presence of a mechanism
maintaining a high energy output for a much longer time than it is predicted by
the current theories. Similarity of light curves, but enormous difference of
the separation between the components of PU Vul and V723 Cas binaries suggest
that the mechanism is basically powered by the accretor.
","[{""version"":""v1"",""created"":""Thu, 21 Mar 2013 20:20:41 GMT""}]","2013-03-25"
"1303.5455","Mathias Dietzel","Mathias Dietzel and Steffen Hardt","Flow and streaming potential of an electrolyte in a channel with an
  axial temperature gradient","48 pages, 7 figures",,,,"physics.flu-dyn","http://arxiv.org/licenses/nonexclusive-distrib/1.0/","  The effect of an axial temperature gradient on the flow profile and the
induced streaming potential of a pressure-driven symmetric electrolyte in a
slit channel is investigated. Based on the non-isothermal Nernst-Planck
equations as well as the Poisson equation in the lubrication approximation,
expressions for the ion distribution in the electric double layer (EDL) are
derived. It is found that thermophoretic ion motion and a temperature-dependent
electrophoretic ion mobility increase the local EDL thickness with temperature,
whereas a temperature-dependent permittivity shrinks the EDL. Within the
Debye-H\""uckel approximation, the Navier-Stokes equation with the corresponding
electric body force terms is solved. Analytical expressions for the flow
profile and the induced (streaming) field under non-isothermal conditions are
derived. It is shown that for such a situation the induced electric field is
the linear superposition of at least seven individual contributions. For very
wide channels, only the thermoelectric field typically present in bulk
electrolytes when subjected to a temperature gradient (Soret equilibrium) as
well as the conventional pressure-induced streaming field are of importance.
Under extreme confinement, selective thermo-electro-migration driven by the
interplay between the temperature-dependent electrophoretic ion mobility and
the interaction of the ions with the surface wall charge causes a
thermoelectric field of non-advective origin. For wider channels and besides
the well-known thermoosmosis due to the temperature dependence of the
dielectric permittivity, it is demonstrated that a temperature gradient renders
the ion cloud in the EDL out of mechanical equilibrium. This leads to a
thermoosmotic flow, and the ion advection affiliated with it may induce a
thermoelectric field of similar order of magnitude as the one caused by more
conventional thermal effects.
","[{""version"":""v1"",""created"":""Thu, 21 Mar 2013 20:30:42 GMT""},{""version"":""v2"",""created"":""Wed, 24 Jun 2020 23:14:17 GMT""}]","2020-06-26"
"1303.5456","Avraham Goldstein","Yonah Cherniavsky, Avraham Goldstein and Vadim E. Levit","Balanced Abelian group valued functions on directed graphs","9 pages",,,,"math.CO","http://arxiv.org/licenses/nonexclusive-distrib/1.0/","  We discuss functions from the edges and vertices of a directed graph to an
Abelian group. Such functions, when the sum of their values along any cycle is
zero, are called balanced and form an Abelian group. We study this group in two
cases: when we allowed to walk against the direction of an edge taking the
opposite value of the function and when we are not allowed to walk against the
direction.
","[{""version"":""v1"",""created"":""Thu, 21 Mar 2013 20:31:03 GMT""},{""version"":""v2"",""created"":""Mon, 25 Mar 2013 09:55:33 GMT""}]","2013-03-26"
"1303.5457","Nikolai Krivulin","Nikolai Krivulin","Explicit solution of a tropical optimization problem with application to
  project scheduling","Mathematical Methods and Optimization Techniques in Engineering:
  Proc. 1st Intern. Conf. on Optimization Techniques in Engineering (OTENG
  '13), Antalya, Turkey, October 8-10, 2013, WSEAS Press, 2013, pp. 39-45. ISBN
  978-960-474-339-1",,,,"math.OC cs.SY","http://arxiv.org/licenses/nonexclusive-distrib/1.0/","  A new multidimensional optimization problem is considered in the tropical
mathematics setting. The problem is to minimize a nonlinear function defined on
a finite-dimensional semimodule over an idempotent semifield and given by a
conjugate transposition operator. A special case of the problem, which arises
in just-in-time scheduling, serves as a motivation for the study. To solve the
general problem, we derive a sharp lower bound for the objective function and
then find vectors that yield the bound. Under general conditions, an explicit
solution is obtained in a compact vector form. This result is applied to
provide new solutions for scheduling problems under consideration. To
illustrate, numerical examples are also presented.
","[{""version"":""v1"",""created"":""Thu, 21 Mar 2013 20:37:57 GMT""},{""version"":""v2"",""created"":""Sun, 10 Nov 2013 22:46:20 GMT""}]","2013-11-12"
"1303.5458","Saumitra Mehrotra","Saumitra Mehrotra, SungGeun Kim, Tillmann Kubis, Michael Povolotskyi,
  Mark Lundstrom and Gerhard Klimeck","Engineering Nanowire n-MOSFETs at Lg < 8 nm","6 pages, 7 figures, journal",,"10.1109/TED.2013.2263806",,"cond-mat.mes-hall","http://arxiv.org/licenses/nonexclusive-distrib/1.0/","  As metal-oxide-semiconductor field-effect transistors (MOSFET) channel
lengths (Lg) are scaled to lengths shorter than Lg<8 nm source-drain tunneling
starts to become a major performance limiting factor. In this scenario a
heavier transport mass can be used to limit source-drain (S-D) tunneling.
Taking InAs and Si as examples, it is shown that different heavier transport
masses can be engineered using strain and crystal orientation engineering.
Full-band extended device atomistic quantum transport simulations are performed
for nanowire MOSFETs at Lg<8 nm in both ballistic and incoherent scattering
regimes. In conclusion, a heavier transport mass can indeed be advantageous in
improving ON state currents in ultra scaled nanowire MOSFETs.
","[{""version"":""v1"",""created"":""Thu, 21 Mar 2013 20:50:53 GMT""}]","2015-06-15"
