"1304.0158","Marianna Safronova","M. S. Safronova and U. I. Safronova","Relativistic many-body calculation of energies, oscillator strengths,
  transition rates, lifetimes, polarizabilities, and quadrupole moment of
  Fr-like Th IV ion","11 pages",,"10.1103/PhysRevA.87.062509",,"physics.atom-ph quant-ph","http://arxiv.org/licenses/nonexclusive-distrib/1.0/","  Atomic properties of the 24 low-lying ns, np, nd, nf, and ng states in Th IV
ion are calculated using the high-precision relativistic all-order method where
all single, double, and partial triple excitations of the Dirac-Fock wave
functions are included to all orders of perturbation theory. Recommended values
are provided for a large number of electric-dipole matrix elements, oscillator
strengths, transition rates, and lifetimes. Scalar polarizabilities of the
ground and six excited states (5f_j, 6d_j, 7p_j, and 7s), and tensor
polarizabilities of the 5f_j, 6d_j, 7p_{3/2} states of Th IV are evaluated. The
uncertainties of the recommended values are estimated. These calculations
provide recommended values critically evaluated for their accuracy for a number
of Th IV atomic properties for use in theoretical modeling as well as planning
and analysis of various experiments including development of ultra precise
nuclear clock and RESIS studies of actinide ions
","[{""version"":""v1"",""created"":""Sun, 31 Mar 2013 06:21:14 GMT""}]","2015-06-15"
"1304.0159","Mohammad Sal Moslehian","A. Morassaei, F. Mirzapour and M. S. Moslehian","Operator Entropy Inequalities","11 pages; to appear in Colloq. Math","Colloq. Math. 130 (2013), no. 2, 159-168",,,"math.FA math.OA","http://arxiv.org/licenses/nonexclusive-distrib/1.0/","  In this paper we investigate a notion of relative operator entropy, which
develops the theory started by J.I. Fujii and E. Kamei [Math. Japonica 34
(1989), 341--348]. For two finite sequences $\mathbf{A}=(A_1,...,A_n)$ and
$\mathbf{B}=(B_1,...,B_n)$ of positive operators acting on a Hilbert space, a
real number $q$ and an operator monotone function $f$ we extend the concept of
entropy by $$
S_q^f(\mathbf{A}|\mathbf{B}):=\sum_{j=1}^nA_j^{1/2}(A_j^{-1/2}B_jA_j^{-1/2})^qf(A_j^{-1/2}B_jA_j^{-1/2})A_j^{1/2}\,,
$$ and then give upper and lower bounds for $S_q^f(\mathbf{A}|\mathbf{B})$ as
an extension of an inequality due to T. Furuta [Linear Algebra Appl. 381
(2004), 219--235] under certain conditions. Afterwards, some inequalities
concerning the classical Shannon entropy are drawn from it.
","[{""version"":""v1"",""created"":""Sun, 31 Mar 2013 06:22:32 GMT""}]","2014-11-04"
"1304.0160","Nabarun Mondal Mr","Nabarun Mondal and Partha P. Ghosh","Parallel Computation Is ESS","Submitted to Theoretical Computer Science - Elsevier",,,,"cs.LG cs.AI cs.GT","http://arxiv.org/licenses/nonexclusive-distrib/1.0/","  There are enormous amount of examples of Computation in nature, exemplified
across multiple species in biology. One crucial aim for these computations
across all life forms their ability to learn and thereby increase the chance of
their survival. In the current paper a formal definition of autonomous learning
is proposed. From that definition we establish a Turing Machine model for
learning, where rule tables can be added or deleted, but can not be modified.
Sequential and parallel implementations of this model are discussed. It is
found that for general purpose learning based on this model, the
implementations capable of parallel execution would be evolutionarily stable.
This is proposed to be of the reasons why in Nature parallelism in computation
is found in abundance.
","[{""version"":""v1"",""created"":""Sun, 31 Mar 2013 06:45:47 GMT""},{""version"":""v2"",""created"":""Sun, 7 Apr 2013 19:54:16 GMT""},{""version"":""v3"",""created"":""Thu, 11 Apr 2013 16:41:02 GMT""},{""version"":""v4"",""created"":""Sun, 14 Apr 2013 16:03:07 GMT""},{""version"":""v5"",""created"":""Thu, 18 Apr 2013 17:37:38 GMT""},{""version"":""v6"",""created"":""Sun, 24 Nov 2013 16:37:10 GMT""},{""version"":""v7"",""created"":""Sun, 1 Dec 2013 11:16:28 GMT""},{""version"":""v8"",""created"":""Wed, 25 Dec 2013 16:18:54 GMT""}]","2013-12-30"
"1304.0161","Nikolaj Glazunov","Nikolaj M. Glazunov","Stochastic Properties of Dynamical Systems Arising from (quantum) Spaces
  and Actions of Groups","10 pages",,,,"math.DS math.AG math.NT","http://arxiv.org/licenses/nonexclusive-distrib/1.0/","  We review novel results and investigate actions and transformations of groups
and semigroups on (quantum) spaces, present dynamical systems and zeta
functions arising from these spaces, actions and transformations, discuss their
stochastic properties.
","[{""version"":""v1"",""created"":""Sun, 31 Mar 2013 08:18:45 GMT""}]","2013-04-02"
"1304.0162","Hans Havlicek","Andrea Blunck, Hans Havlicek","Projective Representations II. Generalized chain geometries",,"Abh. Math. Sem. Univ. Hamburg 70 (2000), 301-313",,,"math.AG math.RA","http://arxiv.org/licenses/nonexclusive-distrib/1.0/","  In this paper, projective representations of generalized chain geometries are
investigated, using the concepts and results of part I. In particular, we study
under which conditions such a projective representation maps the chains of a
generalized chain geometry $\Sigma(F,R)$ to reguli; this mainly depends on how
the field $F$ is embedded in the ring $R$. Moreover, we determine all bijective
morphisms of a certain class of generalized chain geometries with the help of
projective representations.
","[{""version"":""v1"",""created"":""Sun, 31 Mar 2013 08:52:02 GMT""}]","2013-04-02"
"1304.0163","Akira Mizuta","Akira Mizuta, Kunihito Ioka","Opening Angles of Collapsar Jets","20 pages, 16 figures","The Astrophysical Journal, 777, 162 (2013)","10.1088/0004-637X/777/2/162","KEK-TH-1615, KEK-Cosmo-119","astro-ph.HE","http://arxiv.org/licenses/nonexclusive-distrib/1.0/","  We investigate the jet propagation and breakout from the stellar progenitor
for gamma-ray burst (GRB) collapsars by performing two-dimensional relativistic
hydrodynamic simulations and analytical modeling. We find that the jet opening
angle is given by $\theta_j \sim 1/5 \Gamma_{0}$, and infer the initial Lorentz
factor of the jet at the central engine, $\Gamma_0$, is a few for existing
observations of $\theta_j$. The jet keeps the Lorentz factor low inside the
star by converging cylindrically via collimation shocks under the cocoon
pressure, and accelerates at jet breakout before the free expansion to a
hollow-cone structure. In this new picture the GRB duration is determined by
the sound crossing time of the cocoon, after which the opening angle widens,
reducing the apparent luminosity. Some bursts violating the maximum opening
angle $\theta_{j,\max}\sim 1/5 \sim 12^{\circ}$ imply the existence of a
baryon-rich sheath or a long-acting jet. We can explain the slopes in both
Amati and Yonetoku spectral relations using an off-centered photosphere model,
if we make only one assumption that the total jet luminosity is proportional to
the initial Lorentz factor of the jet. We also numerically calibrate the
pre-breakout model (Bromberg et al.) for later use.
","[{""version"":""v1"",""created"":""Sun, 31 Mar 2013 08:53:06 GMT""},{""version"":""v2"",""created"":""Tue, 2 Apr 2013 01:36:37 GMT""},{""version"":""v3"",""created"":""Mon, 19 Aug 2013 15:41:45 GMT""},{""version"":""v4"",""created"":""Tue, 17 Sep 2013 08:31:21 GMT""},{""version"":""v5"",""created"":""Fri, 8 Nov 2013 05:02:13 GMT""}]","2015-06-15"
"1304.0164","Mrinal Kumar Das","Manikanta Borah, Debasish Borah, Mrinal Kumar Das","Radiative Generation of Non-zero $\theta_{13}$ in MSSM with broken $A_4$
  Flavor Symmetry","Version 2: 30 pages, 20 figures, Major Revision, to appear in Nucl.
  Phys. B","Nucl. Phys. B885, 76-96 (2014)","10.1016/j.nuclphysb.2014.05.023",,"hep-ph","http://arxiv.org/licenses/nonexclusive-distrib/1.0/","  We study the renormalization group effects on neutrino masses and mixing in
Minimal Supersymmetric Standard Model (MSSM) by considering a $\mu-\tau$
symmetric mass matrix at high energy scale giving rise to Tri-Bi-Maximal (TBM)
type mixing. We outline a flavor symmetry model based on $A_4$ symmetry giving
rise to the desired neutrino mass matrix at high energy scale. We take the
three neutrino mass eigenvalues at high energy scale as input parameters and
compute the neutrino parameters at low energy by taking into account of
renormalization group effects. We observe that the correct output values of
neutrino parameters at low energy are obtained only when the input mass
eigenvalues are large $|m_{1,2,3}| = 0.08-0.12$ eV with a very mild hierarchy
of either inverted or normal type. A large inverted or normal hierarchical
pattern of neutrino masses is disfavored within our framework. We also find a
preference towards higher values of $\tan{\beta}$, the ratio of vacuum
expectation values (vev) of two Higgs doublets in MSSM in order to arrive at
the correct low energy output. Such a model predicting large neutrino mass
eigenvalues with very mild hierarchy and large $\tan{\beta}$ could have
tantalizing signatures at oscillation, neutrino-less double beta decay as well
as collider experiments.
","[{""version"":""v1"",""created"":""Sun, 31 Mar 2013 08:55:06 GMT""},{""version"":""v2"",""created"":""Tue, 20 May 2014 13:26:02 GMT""}]","2014-07-10"
"1304.0165","Pankaj Kumar","Pankaj Kumar, P.K. Manoharan","Eruption of a plasma blob, associated M-class flare, and large-scale EUV
  wave observed by SDO","A&A (in press), 22 pages, 13 figures",,"10.1051/0004-6361/201220283",,"astro-ph.SR","http://arxiv.org/licenses/nonexclusive-distrib/1.0/","  We present a multiwavelength study of the formation and ejection of a plasma
blob and associated EUV waves in AR NOAA 11176, observed by SDO/AIA and STEREO
on 25 March 2011. SDO/AIA images clearly show the formation and ejection of a
plasma blob from the lower solar atmosphere at ~9 min prior to the onset of the
M1.0 flare. This onset of the M-class flare happened at the site of the blob
formation, while the blob was rising in a parabolic path with an average speed
of ~300 km/s. The blob also showed twisting and de-twisting motion in the lower
corona, and the blob speed varied from ~10-540 km/s. The faster and slower EUV
wavefronts were observed in front of the plasma blob during its impulsive
acceleration phase. The faster EUV wave propagated with a speed of ~785 to 1020
km/s, whereas the slower wavefront speed varied in between ~245 and 465 km/s.
The timing and speed of the faster wave match the shock speed estimated from
the drift rate of the associated type II radio burst. The faster wave
experiences a reflection by the nearby AR NOAA 11177. In addition, secondary
waves were observed (only in the 171 \AA channel), when the primary fast wave
and plasma blob impacted the funnel-shaped coronal loops. The HMI magnetograms
revealed the continuous emergence of new magnetic flux along with shear flows
at the site of the blob formation. It is inferred that the emergence of twisted
magnetic fields in the form of arch-filaments/""anemone-type"" loops is the
likely cause for the plasma blob formation and associated eruption along with
the triggering of M-class flare. Furthermore, the faster EUV wave formed ahead
of the blob shows the signature of fast-mode MHD wave, whereas the slower wave
seems to be generated by the field line compression by the plasma blob. The
secondary wave trains originated from the funnel-shaped loops are probably the
fast magnetoacoustic waves.
","[{""version"":""v1"",""created"":""Sun, 31 Mar 2013 08:55:38 GMT""}]","2015-06-15"
"1304.0166","Eric Sopena","Cl\'ement Charpentier (LaBRI), Eric Sopena (LaBRI)","Incidence coloring game and arboricity of graphs","10 pages","International Workshop on Combinatorial Algorithms, Rouen : France
  (2013)",,,"cs.DM math.CO","http://arxiv.org/licenses/nonexclusive-distrib/1.0/","  An incidence of a graph $G$ is a pair $(v,e)$ where $v$ is a vertex of $G$
and $e$ an edge incident to $v$. Two incidences $(v,e)$ and $(w,f)$ are
adjacent whenever $v = w$, or $e = f$, or $vw = e$ or $f$. The incidence
coloring game [S.D. Andres, The incidence game chromatic number, Discrete Appl.
Math. 157 (2009), 1980-1987] is a variation of the ordinary coloring game where
the two players, Alice and Bob, alternately color the incidences of a graph,
using a given number of colors, in such a way that adjacent incidences get
distinct colors. If the whole graph is colored then Alice wins the game
otherwise Bob wins the game. The incidence game chromatic number $i_g(G)$ of a
graph $G$ is the minimum number of colors for which Alice has a winning
strategy when playing the incidence coloring game on $G$. Andres proved that
%$\lceil 3/2 \Delta(G)\rceil \le $i_g(G) \le 2\Delta(G) + 4k - 2$ for every
$k$-degenerate graph $G$. %The arboricity $a(G)$ of a graph $G$ is the minimum
number of forests into which its set of edges can be partitioned. %If $G$ is
$k$-degenerate, then $a(G) \le k \le 2a(G) - 1$. We show in this paper that
$i_g(G) \le \lfloor\frac{3\Delta(G) - a(G)}{2}\rfloor + 8a(G) - 2$ for every
graph $G$, where $a(G)$ stands for the arboricity of $G$, thus improving the
bound given by Andres since $a(G) \le k$ for every $k$-degenerate graph $G$.
Since there exists graphs with $i_g(G) \ge \lceil\frac{3\Delta(G)}{2}\rceil$,
the multiplicative constant of our bound is best possible.
","[{""version"":""v1"",""created"":""Sun, 31 Mar 2013 08:56:24 GMT""}]","2013-06-04"
"1304.0167","Hans Havlicek","Andrea Blunck, Hans Havlicek","The Connected Components of the Projective Line over a Ring",,"Adv. Geom. 1 (2001), 107-117",,,"math.AG math.RA","http://arxiv.org/licenses/nonexclusive-distrib/1.0/","  The main result of the present paper is that the projective line over a ring
$R$ is connected with respect to the relation ""distant"" if, and only if, $R$ is
a $GE_2$-ring.
","[{""version"":""v1"",""created"":""Sun, 31 Mar 2013 08:56:34 GMT""}]","2013-04-02"
"1304.0168","Pascal Auscher","Pascal Auscher (LM-Orsay), Alan McIntosh (CMA), Andrew Morris (MI)","Calderon Reproducing Formulas and Applications to Hardy Spaces","Submitted. 31 pages",,,,"math.CA math.AP math.DG math.FA","http://arxiv.org/licenses/nonexclusive-distrib/1.0/","  We establish new Calder\'{o}n reproducing formulas for self-adjoint operators
$D$ that generate strongly continuous groups with finite propagation speed.
These formulas allow the analysing function to interact with $D$ through
holomorphic functional calculus whilst the synthesising function interacts with
$D$ through functional calculus based on the Fourier transform. We apply these
to prove the embedding $H^p_D(\wedge T^*M) \subseteq L^p(\wedge T^*M)$, $1\leq
p\leq 2$, for the Hardy spaces of differential forms introduced by Auscher,
McIntosh and Russ, where $D=d+d^*$ is the Hodge--Dirac operator on a complete
Riemannian manifold $M$ that has polynomial volume growth. This fills a gap in
that work. The new reproducing formulas also allow us to obtain an atomic
characterisation of $H^1_D(\wedge T^*M)$. The embedding $H^p_L \subseteq L^p$,
$1\leq p\leq 2$, where $L$ is either a divergence form elliptic operator on
$\R^n$, or a nonnegative self-adjoint operator that satisfies Davies--Gaffney
estimates on a doubling metric measure space, is also established in the case
when the semigroup generated by the adjoint $-L^*$ is ultracontractive.
","[{""version"":""v1"",""created"":""Sun, 31 Mar 2013 08:58:04 GMT""}]","2013-04-02"
"1304.0169","Georgios Giavaras","G. Giavaras, Neill Lambert, Franco Nori","Electrical current and coupled electron-nuclear spin dynamics in double
  quantum dots","13 pages, 7 figs","Physical Review B 87, 115416 (2013)","10.1103/PhysRevB.87.115416",,"cond-mat.mes-hall","http://arxiv.org/licenses/nonexclusive-distrib/1.0/","  We examine electronic transport in a spin-blockaded double quantum dot. We
show that by tuning the strength of the spin-orbit interaction the current
flowing through the double dot exhibits a dip at zero magnetic field or a peak
at a magnetic field for which the two-electron energy levels anticross. This
behaviour is due to the dependence of the singlet-triplet mixing on the field
and spin-orbit amplitude. We derive approximate expressions for the current as
a function of the amplitudes of the states involved in the transport. We also
consider an alternative model that takes into account a finite number of
nuclear spins and study the resulting coupled dynamics between electron and
nuclear spins. We show that if the spin ensemble is in a thermal state there
are regular oscillations in the transient current followed by quasi-chaotic
revivals akin to those seen in a thermal Jaynes-Cummings model.
","[{""version"":""v1"",""created"":""Sun, 31 Mar 2013 09:00:12 GMT""}]","2015-06-15"
"1304.0170","Pierre Calka","Pierre Calka (LMRS), Nicolas Chenavier (LMRS)","Extreme values for characteristic radii of a Poisson-Voronoi
  tessellation",,,,,"math.PR","http://arxiv.org/licenses/nonexclusive-distrib/1.0/","  A homogeneous Poisson-Voronoi tessellation of intensity $\gamma$ is observed
in a convex body $W$. We associate to each cell of the tessellation two
characteristic radii: the inradius, i.e. the radius of the largest ball
centered at the nucleus and included in the cell, and the circumscribed radius,
i.e. the radius of the smallest ball centered at the nucleus and containing the
cell. We investigate the maximum and minimum of these two radii over all cells
with nucleus in $W$. We prove that when $\gamma\rightarrow\infty$, these four
quantities converge to Gumbel or Weibull distributions up to a rescaling.
Moreover, the contribution of boundary cells is shown to be negligible. Such
approach is motivated by the analysis of the global regularity of the
tessellation. In particular, consequences of our study include the convergence
to the simplex shape of the cell with smallest circumscribed radius and an
upper-bound for the Hausdorff distance between $W$ and its so-called
Poisson-Voronoi approximation.
","[{""version"":""v1"",""created"":""Sun, 31 Mar 2013 09:02:12 GMT""}]","2013-04-02"
"1304.0171","David Carpentier","Thibaut Capron (NEEL), Guillaume Forestier (NEEL), Angela
  Perrat-Mabilon (IPNL), Christophe Peaucelle (IPNL), Tristan Meunier (NEEL),
  Christopher B\""auerle (NEEL), Laurent P. L\'evy (NEEL), David Carpentier
  (Phys-ENS), Laurent Saminadayar (NEEL)","Magnetic dephasing in mesoscopic spin glasses",,,"10.1103/PhysRevLett.111.187203",,"cond-mat.mes-hall","http://arxiv.org/licenses/nonexclusive-distrib/1.0/","  We have measured Universal Conductance Fluctuations in the metallic spin
glass Ag:Mn as a function of temperature and magnetic field. From this
measurement, we can access the phase coherence time of the electrons in the
spin glass. We show that this phase coherence time increases with both the
inverse of the temperature and the magnetic field. From this we deduce that
decoherence mechanisms are still active even deep in the spin glass phase.
","[{""version"":""v1"",""created"":""Sun, 31 Mar 2013 09:04:50 GMT""}]","2015-06-15"
"1304.0172","Hans Havlicek","Hans Havlicek","Veronese Varieties over Fields with non-zero Characteristic: A Survey",,"Discrete Math., 267 (2003), 159-173",,,"math.AG math.CO","http://arxiv.org/licenses/nonexclusive-distrib/1.0/","  In the present survey we collect some recent results on nuclei of Veronese
varieties and invariant subspaces of normal rational curves. We must assume,
however, that the ground field is not ""too small"", since otherwise a Veronese
variety is like dust: ""few points"" in some ""high-dimensional"" space.
","[{""version"":""v1"",""created"":""Sun, 31 Mar 2013 09:05:03 GMT""}]","2013-04-02"
"1304.0173","Jeremie Dudouet","J. Dudouet (LPCC), D. Juliani (IPHC), M. Labalme (LPCC), J.C.
  Ang\'elique (LPCC), B. Braunn (IRFU), J. Colin (LPCC), D. Cussol (LPCC), Ch.
  Finck (IPHC), J.M. Fontbonne (LPCC), H. Gu\'erin, P. Henriquet (IPNL), J.
  Krimmer (IPNL), M. Rousseau, M.G. Saint-Laurent (GANIL)","Comparison of two analysis methods for nuclear reaction measurements of
  12C +12C interactions at 95 MeV/u for hadrontherapy",,"Nuclear Instruments and Methods in Physics Research Section A:
  Accelerators, Spectrometers, Detectors and Associated Equipment 715 (2013)
  98-104","10.1016/j.nima.2013.03.038",,"physics.med-ph nucl-ex physics.ins-det","http://arxiv.org/licenses/nonexclusive-distrib/1.0/","  During therapeutic treatment with heavier ions like carbon, the beam
undergoes nuclear fragmentation and secondary light charged particles, in
particular protons and alpha particles, are produced. To estimate the dose
deposited into the tumors and the surrounding healthy tissues, the accuracy
must be higher than ($\pm$3% and$\pm$1 mm). Therefore, measurements are
performed to determine the double differential cross section for different
reactions. In this paper, the analysis of data from 12C +12C reactions at 95
MeV/u are presented. The emitted particles are detected with
\DeltaEthin-\DeltaEthick-E telescopes made of a stack of two silicon detectors
and a CsI crystal. Two different methods are used to identify the particles.
One is based on graphical cuts onto the \DeltaE-E maps, the second is based on
the so-called KaliVeda method using a functional description of \DeltaE versus
E. The results of the two methods will be presented in this paper as well as
the comparison between both.
","[{""version"":""v1"",""created"":""Sun, 31 Mar 2013 09:11:34 GMT""}]","2013-05-01"
"1304.0174","Hans Havlicek","Hans Havlicek, Klaus List, Corrado Zanella","On automorphisms of flag spaces",,"Linear Multilinear Algebra 50 (2002), 241-251",,,"math.AG math.RT","http://arxiv.org/licenses/nonexclusive-distrib/1.0/","  We show that the automorphisms of the flag space associated with a
3-dimensional projective space can be characterized as bijections preserving a
certain binary relation on the set of flags in both directions. From this we
derive that there are no other automorphisms of the flag space than those
coming from collineations and dualities of the underlying projective space.
Further, for a commutative ground field, we discuss the corresponding flag
variety and characterize its group of automorphic collineations.
","[{""version"":""v1"",""created"":""Sun, 31 Mar 2013 09:11:59 GMT""}]","2013-04-02"
"1304.0175","Olivier Wintenberger","Thomas Mikosch, Olivier Wintenberger (LFA, CEREMADE)","The cluster index of regularly varying sequences with applications to
  limit theory for functions of multivariate Markov chains",,,,,"math.PR math.ST stat.TH","http://arxiv.org/licenses/nonexclusive-distrib/1.0/","  We introduce the cluster index of a multivariate regularly varying stationary
sequence and characterize the index in terms of the spectral tail process. This
index plays a major role in limit theory for partial sums of regularly varying
sequences. We illustrate the use of the cluster index by characterizing
infinite variance stable limit distributions and precise large deviation
results for sums of multivariate functions acting on a stationary Markov chain
under a drift condition.
","[{""version"":""v1"",""created"":""Sun, 31 Mar 2013 09:12:43 GMT""}]","2013-04-02"
"1304.0176","Frederic Bayart","Fr\'ed\'eric Bayart, George Costakis","Hypercyclic operators and rotated orbits with polynomial phases",,,"10.1112/jlms/jdu005",,"math.FA","http://arxiv.org/licenses/nonexclusive-distrib/1.0/","  An important result of Le\'on-Saavedra and M\""uller says that the rotations
of hypercyclic operators remain hypercyclic. We provide extensions of this
result for orbits of operators which are rotated by unimodular complex numbers
with polynomial phases. On the other hand, we show that this fails for
unimodular complex numbers whose phases grow to infinity too quickly, say at a
geometric rate. A further consequence of our work is a notable strengthening of
a result due to Shkarin which concerns variants of Le\'on-Saavedra and
M\""uller's result in a non-linear setting.
","[{""version"":""v1"",""created"":""Sun, 31 Mar 2013 09:13:25 GMT""}]","2017-05-17"
"1304.0177","Hans Havlicek","Andrea Blunck, Hans Havlicek","The Dual of a Chain Geometry",,"J. Geom. 72 (2001), 27-36",,,"math.AG math.RA","http://arxiv.org/licenses/nonexclusive-distrib/1.0/","  We introduce and discuss the dual of a chain geometry. Each chain geometry is
canonically isomorphic to its dual. This allows us to show that there are
isomorphisms of chain geometries that arise from antiisomorphisms of the
underlying rings.
","[{""version"":""v1"",""created"":""Sun, 31 Mar 2013 09:18:45 GMT""}]","2013-04-02"
"1304.0178","Hans Havlicek","Andrea Blunck, Hans Havlicek","Jordan homomorphisms and harmonic mappings",,"Monatsh. Math. 139 (2003), 111-127",,,"math.AG math.RA","http://arxiv.org/licenses/nonexclusive-distrib/1.0/","  We show that each Jordan homomorphism $R\to R'$ of rings gives rise to a
harmonic mapping of one connected component of the projective line over $R$
into the projective line over $R'$. If there is more than one connected
component then this mapping can be extended in various ways to a harmonic
mapping which is defined on the entire projective line over $R$.
","[{""version"":""v1"",""created"":""Sun, 31 Mar 2013 09:23:38 GMT""}]","2013-04-02"
