"1304.0138","Jinwei Yang","Jinwei Yang","Differential equations and logarithmic intertwining operators for
  strongly graded vertex algebras","26 pages. For the sake of readability, I quote certain necessary
  technical definitions from earlier work of Y.-Z. Huang, J. Lepowsky and L.
  Zhang [arXiv:0710.2687, arXiv:1012.4193, arXiv:math/0609833]","Comm. Contemp. Math. (2016) 1650009",,,"math.QA math.AP math.CT","http://creativecommons.org/licenses/by/4.0/","  We derive certain systems of differential equations for matrix elements of
products and iterates of logarithmic intertwining operators among strongly
graded generalized modules for a strongly graded conformal vertex algebra under
suitable assumptions. Using these systems of differential equations, we verify
the convergence and extension property needed in the logarithmic tensor
category theory for such strongly graded generalized modules developed by
Huang, Lepowsky and Zhang.
","[{""version"":""v1"",""created"":""Sat, 30 Mar 2013 21:17:25 GMT""},{""version"":""v2"",""created"":""Mon, 23 May 2016 22:01:52 GMT""}]","2016-05-25"
"1304.0139","Ira M. Gessel","Andrew Gainer-Dewar and Ira M. Gessel","Enumeration of bipartite graphs and bipartite blocks",,"The Electronic Journal of Combinatorics 21.2 (2014): P2-40",,,"math.CO","http://arxiv.org/licenses/nonexclusive-distrib/1.0/","  Using the theory of combinatorial species, we compute the cycle index for
bipartite graphs, which we use to count unlabeled bipartite graphs and
bipartite blocks.
","[{""version"":""v1"",""created"":""Sat, 30 Mar 2013 21:29:37 GMT""},{""version"":""v2"",""created"":""Sat, 29 Mar 2014 17:36:24 GMT""}]","2015-09-14"
"1304.0140","Fotis Foukalas","F. Foukalas, T.Khattab, H.V. Poor","Packet Relaying Control in Sensing-based Spectrum Sharing Systems",,,,,"cs.NI cs.IT math.IT math.OC","http://arxiv.org/licenses/nonexclusive-distrib/1.0/","  Cognitive relaying has been introduced for opportunistic spectrum access
systems by which a secondary node forwards primary packets whenever the primary
link faces an outage condition. For spectrum sharing systems, cognitive
relaying is parametrized by an interference power constraint level imposed on
the transmit power of the secondary user. For sensing-based spectrum sharing,
the probability of detection is also involved in packet relaying control. This
paper considers the choice of these two parameters so as to maximize the
secondary nodes' throughput under certain constraints. The analysis leads to a
Markov decision process using dynamic programming approach. The problem is
solved using value iteration. Finally, the structural properties of the
resulting optimal control are highlighted.
","[{""version"":""v1"",""created"":""Sat, 30 Mar 2013 21:30:18 GMT""}]","2013-04-02"
"1304.0141","Vincenzo De Leo PhD","Vincenzo De Leo, Giovanni Santoboni, Federica Cerina, Mario Mureddu,
  Luca Secchi, Alessandro Chessa","Community core detection in transportation networks","8 pages, 13 figures",,"10.1103/PhysRevE.88.042810",,"physics.soc-ph cs.SI","http://arxiv.org/licenses/nonexclusive-distrib/1.0/","  This work analyses methods for the identification and the stability under
perturbation of a territorial community structure with specific reference to
transportation networks. We considered networks of commuters for a city and an
insular region. In both cases, we have studied the distribution of commuters'
trips (i.e., home-to-work trips and viceversa). The identification and
stability of the communities' cores are linked to the land-use distribution
within the zone system, and therefore their proper definition may be useful to
transport planners.
","[{""version"":""v1"",""created"":""Sat, 30 Mar 2013 21:49:42 GMT""},{""version"":""v2"",""created"":""Thu, 19 Sep 2013 09:25:57 GMT""}]","2015-06-15"
"1304.0142","Maxim  Smirnov","Vassily Gorbounov, Maxim Smirnov","Some remarks on Landau-Ginzburg potentials for odd-dimensional quadrics","Some typos are fixed. The appendix has minor corrections. A remark
  has been added to the introduction",,,,"math.AG","http://arxiv.org/licenses/nonexclusive-distrib/1.0/","  We study the possibility of constructing a Frobenius manifold for the
standard Landau-Ginzburg model of odd-dimensional quadrics $Q_{2n+1}$ and
matching it with the Frobenius manifold attached to the quantum cohomology of
these quadrics. Namely, we show that the initial conditions of the quantum
cohomology Frobenius manifold of the quadric can be obtained from the suitably
modified standard Landau-Ginzburg model.
","[{""version"":""v1"",""created"":""Sat, 30 Mar 2013 22:02:23 GMT""},{""version"":""v2"",""created"":""Thu, 8 Aug 2013 13:46:30 GMT""}]","2013-08-09"
"1304.0143","Christopher Davis","Christopher Davis and Tommy Occhipinti","Which alternating and symmetric groups are unit groups?","10 pages",,,"CPH-SYM-DNRF92","math.RA math.GR math.RT","http://arxiv.org/licenses/nonexclusive-distrib/1.0/","  We prove there is no ring with unit group isomorphic to S_n for n \geq 5 and
that there is no ring with unit group isomorphic to A_n for n \geq 5, n \neq 8.
We give examples of rings with unit groups isomorphic to S_1, S_2, S_3, S_4,
A_1, A_2, A_3, A_4, and A_8. We expect our methods to work similarly for other
groups with trivial center; in particular, we plan to consider other simple
groups in later work.
","[{""version"":""v1"",""created"":""Sat, 30 Mar 2013 22:21:15 GMT""}]","2015-02-02"
"1304.0144","Timofey Frolov","T. Frolov and Y. Mishin","Thermodynamics of coherent interfaces under mechanical stresses. I.
  Theory","45 pages, 4 figures","PhysRevB.85.224106 2012","10.1103/PhysRevB.85.224106",,"cond-mat.mtrl-sci","http://arxiv.org/licenses/nonexclusive-distrib/1.0/","  We present a thermodynamic theory of plane coherent solid-solid interfaces in
multicomponent systems subject to nonhydrostatic mechanical stresses. The
interstitial and substitutional chemical components are treated separately
using chemical potentials and diffusion potentials, respectively. All interface
excess quantities are derived using Cahns (1979) generalized excess method
without resorting to geometric dividing surfaces. We present expressions for
the interface free energy as an excess quantity and derive a generalized
adsorption equation and an interface Gibbs-Helmholtz equation that does not
contain the interface entropy. The interface stress tensor emerges naturally
from the generalized adsorption equation as an appropriate excess over bulk
stresses and is shown to be generally nonunique. Another interface property
emerging from the generalized adsorption equation is the interface excess
shear. This property is specific to coherent interfaces and represents the
thermodynamic variable conjugate to the shear stress applied parallel to the
interface. The theory reveals a number of Maxwell relations describing cross
effects between thermal, chemical, and mechanical responses of coherent
interfaces. In Part II of this work, this theory will be applied to atomistic
computer simulations of grain boundaries.
","[{""version"":""v1"",""created"":""Sat, 30 Mar 2013 23:20:11 GMT""}]","2013-04-02"
"1304.0145","Soumya  Kambhampati","Soumya C. Kambhampati, Thomas Liu","Phase Transition and Network Structure in Realistic SAT Problems",,"Published as student abstract in Proceedings of AAAI 2013
  (National Conference on Artificial Intelligence)",,,"cs.AI","http://arxiv.org/licenses/nonexclusive-distrib/1.0/","  A fundamental question in Computer Science is understanding when a specific
class of problems go from being computationally easy to hard. Because of its
generality and applications, the problem of Boolean Satisfiability (aka SAT) is
often used as a vehicle for investigating this question. A signal result from
these studies is that the hardness of SAT problems exhibits a dramatic
easy-to-hard phase transition with respect to the problem constrainedness. Past
studies have however focused mostly on SAT instances generated using uniform
random distributions, where all constraints are independently generated, and
the problem variables are all considered of equal importance. These assumptions
are unfortunately not satisfied by most real problems. Our project aims for a
deeper understanding of hardness of SAT problems that arise in practice. We
study two key questions: (i) How does easy-to-hard transition change with more
realistic distributions that capture neighborhood sensitivity and
rich-get-richer aspects of real problems and (ii) Can these changes be
explained in terms of the network properties (such as node centrality and
small-worldness) of the clausal networks of the SAT problems. Our results,
based on extensive empirical studies and network analyses, provide important
structural and computational insights into realistic SAT problems. Our
extensive empirical studies show that SAT instances from realistic
distributions do exhibit phase transition, but the transition occurs sooner (at
lower values of constrainedness) than the instances from uniform random
distribution. We show that this behavior can be explained in terms of their
clausal network properties such as eigenvector centrality and small-worldness
(measured indirectly in terms of the clustering coefficients and average node
distance).
","[{""version"":""v1"",""created"":""Sat, 30 Mar 2013 23:21:56 GMT""}]","2013-04-02"
"1304.0146","Qi Lu","Qi L\""u","Exact Controllability for Stochastic Transport Equations",,,,,"math.OC math.AP","http://arxiv.org/licenses/nonexclusive-distrib/1.0/","  This paper is addressed to studying the exact controllability for stochastic
transport equations by two controls: one is a boundary control imposed on the
drift term and the other is an internal control imposed on the diffusion term.
By means of the duality argument, this controllability problem can be reduced
to an observability problem for backward stochastic transport equations, and
the desired observability estimate is obtained by a new global Carleman
estimate. Also, we present some results about the lack of exact
controllability, which show that the action of two controls is necessary. To
some extent, this indicates that the controllability problems for stochastic
PDEs differ from their deterministic counterpart.
","[{""version"":""v1"",""created"":""Sat, 30 Mar 2013 23:40:13 GMT""},{""version"":""v2"",""created"":""Thu, 17 Oct 2013 19:54:52 GMT""},{""version"":""v3"",""created"":""Mon, 21 Oct 2013 12:11:14 GMT""}]","2013-10-22"
"1304.0147","Thierry Corbard","T. Corbard, R. Ikhlef, F. Morand, M. Meftah, C. Renaud","On the importance of astronomical refraction for modern Solar
  astrometric measurements","14 pages, 13 Figures. MNRAS accepted 12 Dec 2018",,"10.1093/mnras/sty3391",,"astro-ph.SR","http://arxiv.org/licenses/nonexclusive-distrib/1.0/","  In this work we study in details the influence of pure astronomical
refraction on solar metrologic measurements made from ground-based full disk
imagery and provide the tools for correcting the measurements and estimating
the associated uncertainties.For a given standard atmospheric model, we first
use both analytical and numerical methods in order to test the validity of the
commonly or historically used approximations of the differential effect of
refraction as a function of zenith distance. For a given refraction model, we
provide the exact formulae for correcting solar radius measurements at any
heliographic angle and for any zenith distance. Then, using solar images
recorded in the near infrared between 2011 and 2016, we show that these
corrections can be applied up to $70\deg$ using the usual approximate formulae
and can be extended up to $80\deg$ of zenith distance provided that a standard
atmospheric model and a full numerical integration of the refraction integral
are used. We also provide estimates of the absolute uncertainties associated
with the differential refraction corrections and show that approximate formulae
can be used up to $80\deg$ of zenith distance for computing these
uncertainties. For a given instrumental setup and the knowledge of the
uncertainties associated with local weather records, this can be used to fix
the maximum zenith distance one can observe depending on the required
astrometric accuracy.
","[{""version"":""v1"",""created"":""Sun, 31 Mar 2013 00:39:48 GMT""},{""version"":""v2"",""created"":""Tue, 16 Dec 2014 11:36:03 GMT""},{""version"":""v3"",""created"":""Thu, 20 Dec 2018 09:20:20 GMT""}]","2018-12-21"
"1304.0148","Maria Rosaria Russo","Paolo Novati, Maria Rosaria Russo","A GCV based Arnoldi-Tikhonov regularization method",,,,,"math.NA","http://arxiv.org/licenses/nonexclusive-distrib/1.0/","  For the solution of linear discrete ill-posed problems, in this paper we
consider the Arnoldi-Tikhonov method coupled with the Generalized Cross
Validation for the computation of the regularization parameter at each
iteration. We study the convergence behavior of the Arnoldi method and its
properties for the approximation of the (generalized) singular values, under
the hypothesis that Picard condition is satisfied. Numerical experiments on
classical test problems and on image restoration are presented.
","[{""version"":""v1"",""created"":""Sun, 31 Mar 2013 00:56:28 GMT""}]","2013-04-02"
"1304.0149","Thomas Ihle","Thomas Ihle","Invasion-wave induced first-order phase transition in systems of active
  particles",,"Phys. Rev. E 88, 040303 (2013)","10.1103/PhysRevE.88.040303",,"physics.bio-ph cond-mat.stat-mech nlin.PS","http://arxiv.org/licenses/nonexclusive-distrib/1.0/","  An Enskog-like kinetic equation for self-propelled particles is solved
numerically. I study a density instability near the transition to collective
motion and find that while hydrodynamics breaks down, the kinetic approach
leads to soliton-like supersonic waves with steep leading kinks and Knudsen
numbers of order one. These waves show hysteresis, modify the transition
threshold and lead to an abrupt jump of the global order parameter if the noise
level is changed. Thus they provide a mechanism to change the second-order
character of the phase transition to first order.
","[{""version"":""v1"",""created"":""Sun, 31 Mar 2013 01:02:29 GMT""}]","2013-11-05"
"1304.0150","Antonio Punzo","Salvatore Ingrassia and Antonio Punzo","Fitting Bivariate Mixed-Type Data via the Generalized Linear Exponential
  Cluster-Weighted Model","the paper has been withdrawn by the authors because they are working
  on a quite extended version of the paper",,,,"stat.ME stat.CO","http://arxiv.org/licenses/nonexclusive-distrib/1.0/","  The cluster-weighted model (CWM) is a mixture model with random covariates
which allows for flexible clustering and density estimation of a random vector
composed by a response variable and by a set of covariates. In this class of
models, the generalized linear exponential CWM is here introduced especially
for modeling bivariate data of mixed-type. Its natural counterpart, in the
family of latent class models, is also defined. Maximum likelihood parameter
estimates are derived using the EM algorithm and model selection is carried out
using the Bayesian information criterion (BIC). Artificial and real data are
finally considered to exemplify and appreciate the proposed model.
","[{""version"":""v1"",""created"":""Sun, 31 Mar 2013 01:41:26 GMT""},{""version"":""v2"",""created"":""Mon, 5 Aug 2013 08:07:22 GMT""}]","2013-08-06"
"1304.0151","Ajay Jasra","Ajay Jasra, Anthony Lee, Christopher Yau, Xiaole Zhang","The Alive Particle Filter",,,,,"stat.CO","http://arxiv.org/licenses/nonexclusive-distrib/1.0/","  In the following article we develop a particle filter for approximating
Feynman-Kac models with indicator potentials. Examples of such models include
approximate Bayesian computation (ABC) posteriors associated with hidden Markov
models (HMMs) or rare-event problems. Such models require the use of advanced
particle filter or Markov chain Monte Carlo (MCMC) algorithms e.g. Jasra et al.
(2012), to perform estimation. One of the drawbacks of existing particle
filters, is that they may 'collapse', in that the algorithm may terminate
early, due to the indicator potentials. In this article, using a special case
of the locally adaptive particle filter in Lee et al. (2013), which is closely
related to Le Gland & Oudjane (2004), we use an algorithm which can deal with
this latter problem, whilst introducing a random cost per-time step. This
algorithm is investigated from a theoretical perspective and several results
are given which help to validate the algorithms and to provide guidelines for
their implementation. In addition, we show how this algorithm can be used
within MCMC, using particle MCMC (Andrieu et al. 2010). Numerical examples are
presented for ABC approximations of HMMs.
","[{""version"":""v1"",""created"":""Sun, 31 Mar 2013 02:51:44 GMT""}]","2013-04-02"
"1304.0152","Ayato Mitsuishi","Ayato Mitsuishi","The coincidence of the homologies of integral currents and of integral
  singular chains, via cosheaves","Results and proofs are refined to be more readable. Along with those,
  the title is changed",,,,"math.AT math.MG","http://arxiv.org/licenses/nonexclusive-distrib/1.0/","  We consider the notion of metric spaces being locally Lipschitz contractible
introduced by Yamaguchi, and a category of metric spaces satisfying this
condition. Many objects in metric geometry including CAT-spaces and Alexandrov
spaces, belong to this category. We consider the homology of integral currents
with compact support in a metric space, introduced by Ambrosio and Kirchheim,
and prove that it and the usual integral singular homology are isomorphic on
the category. The proof of it is based on the theory of cosheaves. A method to
compare the homologies associated to cosheaves is also proved in this paper.
","[{""version"":""v1"",""created"":""Sun, 31 Mar 2013 03:53:36 GMT""},{""version"":""v2"",""created"":""Wed, 21 Oct 2015 16:12:56 GMT""}]","2015-10-22"
"1304.0153","Dr. Nadeem Javaid","N. Javaid, U. Qasim, Z. A. Khan, M. A. Khan, K. Latif, A. Javaid","On Energy Efficiency and Delay Minimization in Reactive Protocols in
  Wireless Multi-hop Networks",,"2nd IEEE Saudi International Electronics, Communications and
  Photonics Conference (SIECPC 13), 2013, Riyadh, Saudi Arabia","10.1109/SIECPC.2013.6550801",,"cs.NI","http://arxiv.org/licenses/nonexclusive-distrib/1.0/","  In Wireless Multi-hop Networks (WMhNs), routing protocols with energy
efficient and delay reduction techniques are needed to fulfill users demands.
In this paper, we present Linear Programming models (LP_models) to assess and
enhance reactive routing protocols. To practically examine constraints of
respective LP_models over reactive protocols, we select AODV, DSR and DYMO. It
is deduced from analytical simulations of LP_models in MATLAB that quick route
repair reduces routing latency and optimizations of retransmission attempts
results efficient energy utilization. To provide quick repair, we enhance AODV
and DSR. To practically examine the efficiency of enhanced protocols in
different scenarios of WMhNs, we conduct simulations using NS- 2. From
simulation results, enhanced DSR and AODV achieve efficient output by
optimizing routing latencies and routing load in terms of retransmission
attempts.
","[{""version"":""v1"",""created"":""Sun, 31 Mar 2013 04:33:53 GMT""}]","2016-11-15"
"1304.0154","Dr. Nadeem Javaid","N. Javaid, Z. A. Khan, U. Qasim, M. A. Khan, K. Latif, A. Javaid","Towards LP Modeling for Maximizing Throughput and Minimizing Routing
  Delay in Proactive Protocols in Wireless Multi-hop Networks",,"2nd IEEE Saudi International Electronics, Communications and
  Photonics Conference (SIECPC 13), 2013, Riyadh, Saudi Arabia","10.1109/SIECPC.2013.6550800",,"cs.NI","http://arxiv.org/licenses/nonexclusive-distrib/1.0/","  Wireless Multi-hop Networks (WMhNs) provide users with the facility to
communicate while moving with whatever the node speed, the node density and the
number of traffic flows they want, without any unwanted delay and/or
disruption. This paper contributes Linear Programming models (LP_models) for
WMhNs. In WMhNs, different routing protocols are used to facilitate users
demand(s). To practically examine constraints of respective LP_models over
different routing techniques, we select three proactive routing protocols;
Destination Sequence Distance Vector (DSDV), Fish-eye State Routing (FSR) and
Optimized Link State Routing (OLSR). These protocols are simulated in two
important scenarios regarding to user demands; mobilities and different network
flows. To evaluate the performance, we further relate the protocols strategy
effects on respective constraints in selected network scenarios.
","[{""version"":""v1"",""created"":""Sun, 31 Mar 2013 04:39:06 GMT""}]","2016-11-15"
"1304.0155","Akitaka Kishimoto Mr","Akitaka Kishimoto","A mathematical model for measurement","Introduction revised",,,,"quant-ph","http://arxiv.org/licenses/nonexclusive-distrib/1.0/","  We will give a new model for measurements of a quantum system such that the
measuring apparatuses are described by a unital separable non-type I nuclear
simple C$^*$-algebra equipped with certain unital endomorphisms and pure
states. An interaction between the quantum system and the apparatus is
specified by a unitary associated with the combined system as before.
Magnifying to the classical level some aspects of the quantum system so
captured in the apparatus is explicitly done by applying the endomorphism; then
the resulting state is the superposition of {\em phases} with weights. Nature
will then choose each phase according to the probability prescribed by the
weights just as does one when multiple phases appear as in phase transition.
Thus in our model state-reduction (or collapse of the wave function) is a
primary event; whether this corresponds to the measurement of an observable or
which one if it does is another matter.
","[{""version"":""v1"",""created"":""Sun, 31 Mar 2013 05:12:17 GMT""},{""version"":""v2"",""created"":""Thu, 30 Oct 2014 00:53:33 GMT""},{""version"":""v3"",""created"":""Mon, 15 Jun 2015 01:50:00 GMT""},{""version"":""v4"",""created"":""Sat, 23 Jan 2016 04:12:26 GMT""}]","2016-01-26"
"1304.0156","M.M.A. Hashem","Mohammad Ashekur Rahman, Atanu Barai, Md. Asadul Islam and M.M.A
  Hashem","Development of a Device for Remote Monitoring of Heart Rate and Body
  Temperature",,"Procs. of the IEEE 2012 15th International Conference on Computer
  & Information Technology (ICCIT 2012), pp.411-416, Chittagong, Bangladesh,
  December 22-24, (2012)","10.1109/ICCITechn.2012.6509783",,"cs.OH","http://arxiv.org/licenses/nonexclusive-distrib/1.0/","  We present a new integrated, portable device to provide a convenient solution
for remote monitoring heart rate at the fingertip and body temperature using
Ethernet technology and widely spreading internet. Now a days, heart related
disease is rising. Most of the times in these cases, patients may not realize
their actual conditions and even it is a common fact that there are no doctors
by their side, especially in rural areas, but now a days most of the diseases
are curable if detected in time.
  We have tried to make a system which may give information about one's
physical condition and help him or her to detect these deadly but curable
diseases. The system gives information of heart rate and body temperature
simultaneously acquired on the portable side in real time and transmits results
to web. In this system, the condition of heart and body temperature can be
monitored from remote places. Eventually, this device provides a low cost,
easily accessible human health monitor solution bridging the gaps between
patients and doctors.
","[{""version"":""v1"",""created"":""Sun, 31 Mar 2013 05:44:47 GMT""}]","2016-11-15"
"1304.0157","Mohammad Sal Moslehian","M. S. Moslehian, J. Micic and M. Kian","Operator inequalities of Jensen type","17 pages, to appear in Topological Algebra and its Applications (a
  newly established journal by Versita Ltd.))","Top. Algebra Appl. 1 (2013), 9-21",,,"math.FA math.OA","http://arxiv.org/licenses/nonexclusive-distrib/1.0/","  We present some generalized Jensen type operator inequalities involving
sequences of self-adjoint operators. Among other things, we prove that if
$f:[0,\infty) \to \mathbb{R}$ is a continuous convex function with $f(0)\leq
0$, then {equation*} \sum_{i=1}^{n} f(C_i) \leq
f(\sum_{i=1}^{n}C_i)-\delta_f\sum_{i=1}^{n}\widetilde{C}_i\leq
f(\sum_{i=1}^{n}C_i) {equation*} for all operators $C_i$ such that $0 \leq
C_i\leq M \leq \sum_{i=1}^{n} C_i $ \ $(i=1,...,n)$ for some scalar $M\geq0$,
where $ \widetilde{C_i} = 1/2 - |\frac{C_i}{M}- 1/2 |$ and $\delta_f =
f(0)+f(M) - 2 f(\frac{M}{2})$.
","[{""version"":""v1"",""created"":""Sun, 31 Mar 2013 05:54:14 GMT""}]","2014-11-04"
