"1304.0200","Franz-Viktor Kuhlmann","Franz-Viktor Kuhlmann and Izabela Vlahu","The relative approximation degree in valued function fields",,,,,"math.AC","http://arxiv.org/licenses/nonexclusive-distrib/1.0/","  We continue the work of Kaplansky on immediate valued field extensions and
determine special properties of elements in such extensions. In particular, we
are interested in the question when an immediate valued function field of
transcendence degree 1 is henselian rational (i.e., generated, modulo
henselization, by one element). If so, then wild ramification can be eliminated
in this valued function field. The results presented in this paper are crucial
for the first author's proof of henselian rationality over tame fields, which
in turn is used in his work on local uniformization.
","[{""version"":""v1"",""created"":""Sun, 31 Mar 2013 12:57:36 GMT""}]","2013-04-02"
"1304.0201","Franz-Viktor Kuhlmann","Franz-Viktor Kuhlmann and Katarzyna Kuhlmann","Embedding theorems for spaces of $\R$-places of rational function fields
  and their products",,"Fundamenta Math. 218 (2012), 121-149",,,"math.AC","http://arxiv.org/licenses/nonexclusive-distrib/1.0/","  We study spaces $M(R(y))$ of $\R$-places of rational function fields $R(y)$
in one variable. For extensions $F|R$ of formally real fields, with $R$ real
closed and satisfying a natural condition, we find embeddings of $M(R(y))$ in
$M(F(y))$ and prove uniqueness results. Further, we study embeddings of
products of spaces of the form $M(F(y))$ in spaces of $\R$-places of rational
function fields in several variables. Our results uncover rather unexpected
obstacles to a positive solution of the open question whether the torus can be
realized as a space of $\R$-places.
","[{""version"":""v1"",""created"":""Sun, 31 Mar 2013 13:05:06 GMT""}]","2013-04-02"
"1304.0202","Mikko Laine","M. Laine","Thermal 2-loop master spectral function at finite momentum","29 pages. v2: numerics improved; to appear in JHEP",,"10.1007/JHEP05(2013)083",,"hep-ph","http://arxiv.org/licenses/nonexclusive-distrib/1.0/","  When considering NLO corrections to thermal particle production in the
""relativistic"" regime, in which the invariant mass squared of the produced
particle is K^2 ~ (pi T)^2, then the production rate can be expressed as a sum
of a few universal ""master"" spectral functions. Taking the most complicated
2-loop master as an example, a general strategy for obtaining a convergent
2-dimensional integral representation is suggested. The analysis applies both
to bosonic and fermionic statistics, and shows that for this master the
non-relativistic approximation is only accurate for K^2 > (8 pi T)^2, whereas
the zero-momentum approximation works surprisingly well. Once the simpler
masters have been similarly resolved, NLO results for quantities such as the
right-handed neutrino production rate from a Standard Model plasma or the
dilepton production rate from a QCD plasma can be assembled for K^2 ~ (pi T)^2.
","[{""version"":""v1"",""created"":""Sun, 31 Mar 2013 13:07:19 GMT""},{""version"":""v2"",""created"":""Thu, 2 May 2013 07:03:41 GMT""}]","2015-06-15"
"1304.0203","Zane Li","Zane Kun Li and Alexander W. Walker","Arithmetic Properties of Picard-Fuchs Equations and Holonomic
  Recurrences","21 pages, to appear in the Journal of Number Theory",,,,"math.NT","http://arxiv.org/licenses/nonexclusive-distrib/1.0/","  The coefficient series of the holomorphic Picard-Fuchs differential equation
associated with the periods of elliptic curves often have surprising
number-theoretic properties. These have been widely studied in the case of the
torsion-free, genus zero congruence subgroups of index 6 and 12 (e.g. the
Beauville families). Here, we consider arithmetic properties of the
Picard-Fuchs solutions associated to general elliptic families, with a
particular focus on the index 24 congruence subgroups. We prove that elliptic
families with rational parameters admit linear reparametrizations such that
their associated Picard-Fuchs solutions lie in Z[[t]]. A sufficient condition
is given such that the same holds for holomorphic solutions at infinity. An
Atkin-Swinnerton-Dyer congruence is proven for the coefficient series attached
to \Gamma_1(7). We conclude with a consideration of asymptotics, wherein it is
proved that many coefficient series satisfy asymptotic expressions of the form
u_n \sim \ell \lambda^n/n. Certain arithmetic results extend to the study of
general holonomic recurrences.
","[{""version"":""v1"",""created"":""Sun, 31 Mar 2013 13:36:23 GMT""}]","2013-04-02"
"1304.0204","Chihiro H. Nakajima","Chihiro H. Nakajima","Statistical Mechanical Formulation and Simulation of Prime Factorization
  of Integers","5 pages, 5figures, Proceedings of 4th YSM-SPIP (Sendai, 14-16
  December 2012)","Interdisciplinary Information Science, 19, 51-56 (2013)","10.4036/iis.2013.51",,"cond-mat.dis-nn","http://arxiv.org/licenses/nonexclusive-distrib/1.0/","  We propose a new formulation of the problem of prime factorization of
integers. With replica exchange Monte Carlo simulation, the behavior which is
seemed to indicate exponential computational hardness is observed. But this
formulation is expected to give a new insight into the computational complexity
of this problem from a statistical mechanical point of view.
","[{""version"":""v1"",""created"":""Sun, 31 Mar 2013 13:42:22 GMT""},{""version"":""v2"",""created"":""Thu, 18 Jul 2013 02:17:22 GMT""}]","2013-11-18"
"1304.0205","Abraham Ungar","Abraham Albert Ungar","An Introduction to Hyperbolic Barycentric Coordinates and their
  Applications","66 pages, 3 figures",,,,"math-ph math.MP","http://arxiv.org/licenses/nonexclusive-distrib/1.0/","  Barycentric coordinates are commonly used in Euclidean geometry. The
adaptation of barycentric coordinates for use in hyperbolic geometry gives rise
to hyperbolic barycentric coordinates, known as gyrobarycentric coordinates.
The aim of this article is to present the road from Einstein's velocity
addition law of relativistically admissible velocities to hyperbolic
barycentric coordinates along with applications.
","[{""version"":""v1"",""created"":""Sun, 31 Mar 2013 13:46:33 GMT""}]","2013-04-02"
"1304.0206","Gennaro Infante","Gennaro Infante and Paolamaria Pietramala","Positive solutions of some nonlocal impulsive boundary value problem",,"University of Glasgow, Department of Mathematics, Departmental Pre
  print Series, (2008)",,,"math.CA","http://arxiv.org/licenses/nonexclusive-distrib/1.0/","  We prove new results on the existence of positive solutions for some
impulsive differential equation subject to nonlocal boundary conditions. Our
boundary conditions involve an affine functional given by a Stieltjes integral.
These cover the well known multi-point boundary conditions that are studied by
various authors.
","[{""version"":""v1"",""created"":""Sun, 31 Mar 2013 13:53:08 GMT""}]","2013-04-02"
"1304.0207","Ahmed Anwar","Ahmed H. Anwar, Karim G. Seddik, Tamer ElBatt and Ahmed H. Zahran","Effective Capacity of Delay Constrained Cognitive Radio Links Exploiting
  Primary Feedback","8 pages, 7 figures, wiopt 2013. arXiv admin note: text overlap with
  arXiv:0906.3888, arXiv:1004.0907 by other authors",,,,"cs.IT math.IT","http://arxiv.org/licenses/nonexclusive-distrib/1.0/","  In this paper, we analyze the performance of a secondary link in a cognitive
radio (CR) system operating under statistical quality of service (QoS) delay
constraints. In particular, we quantify analytically the performance
improvement for the secondary user (SU) when applying a feedback based sensing
scheme under the ""SINR Interference"" model. We leverage the concept of
effective capacity (EC) introduced earlier in the literature to quantify the
wireless link performance under delay constraints, in an attempt to
opportunistically support real-time applications. Towards this objective, we
study a two-link network, a single secondary link and a primary network
abstracted to a single primary link, with and without primary feedback
exploitation. We analytically prove that exploiting primary feedback at the
secondary transmitter improves the EC of the secondary user and decreases the
secondary user average transmitted power. Finally, we present numerical results
that support our analytical results.
","[{""version"":""v1"",""created"":""Sun, 31 Mar 2013 14:06:32 GMT""}]","2013-04-02"
"1304.0208","Michael Cuffaro","Michael E. Cuffaro","On the Physical Explanation for Quantum Computational Speedup","Ph.D. Thesis submitted Winter Term 2013 at the University of Western
  Ontario. NOTE: because it has been compiled from source on the arXiv, this
  version has some very slight pagination differences as compared with the
  published version (http://ir.lib.uwo.ca/etd/1142/). However there are no
  differences in content whatsoever",,,,"physics.hist-ph quant-ph","http://arxiv.org/licenses/nonexclusive-distrib/1.0/","  The aim of this dissertation is to clarify the debate over the explanation of
quantum speedup and to submit a tentative resolution to it. In particular, I
argue that the physical explanation for quantum speedup is precisely the fact
that the phenomenon of quantum entanglement enables a quantum computer to fully
exploit the representational capacity of Hilbert space. This is impossible for
classical systems, joint states of which must always be representable as
product states.
  Chapter 2 begins with a discussion of the most popular of the candidate
physical explanations for quantum speedup: the many worlds explanation. I argue
that unlike the neo-Everettian interpretation of quantum mechanics it does not
have the conceptual resources required to overcome the `preferred basis
objection'. I further argue that the many worlds explanation, at best, can
serve as a good description of the physical process which takes place in
so-called network-based computation, but that it is incompatible with other
models of computation such as cluster state quantum computing. I next consider,
in Chapter 3, a common component of most other candidate explanations of
quantum speedup: quantum entanglement. I investigate whether entanglement can
be said to be a necessary component of any explanation for quantum speedup, and
I consider two major purported counter-examples to this claim. I argue that
neither of these, in fact, show that entanglement is unnecessary for speedup,
and that, on the contrary, we should conclude that it is. In Chapters 4 and 5 I
then ask whether entanglement can be said to be sufficient as well. In Chapter
4 I argue that despite a result that seems to indicate the contrary,
entanglement, considered as a resource, can be seen as sufficient to enable
quantum speedup. Finally, in Chapter 5 I argue that entanglement is sufficient
to explain quantum speedup as well.
","[{""version"":""v1"",""created"":""Sun, 31 Mar 2013 14:14:25 GMT""}]","2013-04-02"
"1304.0209","Yongge Ma","Yu Han, Yongge Ma, Xiangdong Zhang","Connection Dynamics for Higher Dimensional Scalar-Tensor Theories of
  Gravity","13 pages","Mod. Phys. Lett. A, Vol. 29, No. 28 (2014) 1450134","10.1142/S021773231450134X",,"gr-qc hep-th","http://arxiv.org/licenses/nonexclusive-distrib/1.0/","  The scalar-tensor theories of gravity in spacetime dimensions $D+1>2$ are
studied. By doing Hamiltonian analysis, we obtain the geometrical dynamics of
the theories from their Lagrangian. The Hamiltonian formalism indicates that
the theories are naturally divided into two sectors by the coupling parameter
$\omega$. The Hamiltonian structure in both sectors are similar to the
corresponding structure of 4-dimensional cases. It turns out that there is a
symplectic reduction from the canonical structure of $so(D+1)$ Yang-Mills
theories coupled to the scalar field to the canonical structure of the
geometrical scalar-tensor theories. Therefore the non-perturbative loop quantum
gravity techniques can also be applied to the scalar-tensor theories in $D+1$
dimensions based on their connection-dynamical formalism.
","[{""version"":""v1"",""created"":""Sun, 31 Mar 2013 14:27:38 GMT""},{""version"":""v2"",""created"":""Tue, 11 Feb 2014 16:53:00 GMT""}]","2015-06-15"
"1304.0210","Patrick Sutton","Patrick J. Sutton","A Rule of Thumb for the Detectability of Gravitational-Wave Bursts","8 pages, 1 figure",,,"LIGO-P1000041-v3","gr-qc","http://arxiv.org/licenses/nonexclusive-distrib/1.0/","  We derive a simple relationship between the energy emitted in gravitational
waves for a narrowband source and the distance to which that emission can be
detected by a single detector. We consider linearly polarized, elliptically
polarized, and unpolarized gravitational waves, and emission patterns
appropriate for each of these cases. We ignore cosmological effects.
","[{""version"":""v1"",""created"":""Sun, 31 Mar 2013 14:28:40 GMT""}]","2013-04-02"
"1304.0211","Yen Chin Ong","Keisuke Izumi, Yen Chin Ong","An Analysis of Characteristics in Non-Linear Massive Gravity","Version accepted by CQG Focus Issue on Massive Gravity, 16 pages","Class.Quant.Grav.30(2013)184008","10.1088/0264-9381/30/18/184008",,"hep-th gr-qc","http://arxiv.org/licenses/nonexclusive-distrib/1.0/","  We study the Cauchy problem in a special case of non-linear massive gravity:
the two-tensor ""f-g"" theory. Despite being ghost-free, it has recently been
argued that the theory is inherently problematic due to the existence of
superluminal shock waves. Furthermore it is claimed that acausal characteristic
can arise for any choice of background. In order to further understand the
causal structure of the theory, we carefully perform a detailed analysis of the
characteristic equations and show that the theory does admit a well-posed
Cauchy problem, i.e., there exist hypersurfaces that are not characteristic
hypersurface. Puzzles remain regarding the existence of a superluminal
propagating mode in both the f-g theory, as well as in the full non-linear
massive gravity. That is, our result should not be taken as any indication of
the healthiness of the theory. We also give a detailed review of
Cauchy-Kovalevskaya theorem and its application in the Appendix, which should
be useful for investigating causal structures of other theories of gravity.
","[{""version"":""v1"",""created"":""Sun, 31 Mar 2013 14:42:56 GMT""},{""version"":""v2"",""created"":""Sat, 14 Sep 2013 14:56:35 GMT""}]","2013-09-17"
"1304.0212","Michal Brzezinski","Michal Brzezinski","Do wealth distributions follow power laws? Evidence from ""rich lists""","17 pages, 6 figures, 1 table, 1 appendix",,"10.1016/j.physa.2014.03.052",,"q-fin.ST physics.soc-ph stat.AP","http://arxiv.org/licenses/nonexclusive-distrib/1.0/","  We use data on wealth of the richest persons taken from the ""rich lists""
provided by business magazines like Forbes to verify if upper tails of wealth
distributions follow, as often claimed, a power-law behaviour. The data sets
used cover the world's richest persons over 1996-2012, the richest Americans
over 1988-2012, the richest Chinese over 2006-2012 and the richest Russians
over 2004-2011. Using a recently introduced comprehensive empirical methodology
for detecting power laws, which allows for testing goodness of fit as well as
for comparing the power-law model with rival distributions, we find that a
power-law model is consistent with data only in 35% of the analysed data sets.
Moreover, even if wealth data are consistent with the power-law model, usually
they are also consistent with some rivals like the log-normal or stretched
exponential distributions.
","[{""version"":""v1"",""created"":""Sun, 31 Mar 2013 14:45:56 GMT""}]","2015-06-15"
"1304.0213","Cms Collaboration","CMS Collaboration","Search for a standard-model-like Higgs boson with a mass in the range
  145 to 1000 GeV at the LHC","Replaced with published version. Added journal reference and DOI","Eur. Phys. J. C 73 (2013) 2469","10.1140/epjc/s10052-013-2469-8","CMS-HIG-12-034, CERN-PH-EP-2013-050","hep-ex","http://arxiv.org/licenses/nonexclusive-distrib/1.0/","  A search for a standard-model-like Higgs boson in the H to WW and H to ZZ
decay channels is reported, for Higgs boson masses in the range 145 < m[H] <
1000 GeV. The search is based upon proton-proton collision data samples
corresponding to an integrated luminosity of up to 5.1 inverse femtobarns at
sqrt(s) = 7 TeV and up to 5.3 inverse femtobarns at sqrt(s) = 8 TeV, recorded
by the CMS experiment at the LHC. The combined upper limits at 95% confidence
level on products of the cross section and branching fractions exclude a
standard-model-like Higgs boson in the range 145 < m[H] < 710 GeV, thus
extending the mass region excluded by CMS from 127-600 GeV up to 710 GeV.
","[{""version"":""v1"",""created"":""Sun, 31 Mar 2013 14:52:10 GMT""},{""version"":""v2"",""created"":""Thu, 20 Jun 2013 08:36:25 GMT""}]","2013-06-21"
"1304.0214","Francesco Cellarosi","Francesco Cellarosi, Ilya Vinogradov","Ergodic Properties of $k$-Free Integers in Number Fields","31 pages, 3 figures. To appear in the Jounal of Modern Dynamics.
  Improvement of http://arxiv.org/abs/1304.0214v3",,,,"math.DS math.NT","http://arxiv.org/licenses/nonexclusive-distrib/1.0/","  Let $K/\mathbf Q$ be a degree $d$ extension. Inside the ring of integers
$\mathcal O_K$ we define the set of $k$-free integers $\mathcal F_k$ and a
natural $\mathcal O_K$-action on the space of binary $\mathcal O_K$-indexed
sequences, equipped with an $\mathcal O_K$-invariant probability measure
associated to $\mathcal F_k$. We prove that this action is ergodic, has pure
point spectrum and is isomorphic to a $\mathbf Z^d$-action on a compact abelian
group. In particular, it is not weakly mixing and has zero measure-theoretical
entropy. This work generalizes the paper by the first author and Sinai
arXiv:1112.4691 [math.DS] where $K=\mathbf Q$ and $k=2$.
","[{""version"":""v1"",""created"":""Sun, 31 Mar 2013 15:02:24 GMT""},{""version"":""v2"",""created"":""Fri, 5 Apr 2013 14:14:38 GMT""},{""version"":""v3"",""created"":""Wed, 24 Apr 2013 14:51:08 GMT""},{""version"":""v4"",""created"":""Fri, 4 Oct 2013 14:57:16 GMT""}]","2013-10-07"
"1304.0215","Osvanny Ramos","Osvanny Ramos, Pierre-Philippe Cortet, Sergio Ciliberto, and Lo\""ic
  Vanel","Experimental study of the effect of disorder on subcritical crack growth
  dynamics","4 pages, 5 figures, accepted in Physical Review Letters
  (http://prl.aps.org)","Physical Review Letters, 110, 165506 (2013)","10.1103/PhysRevLett.110.165506",,"cond-mat.dis-nn cond-mat.mtrl-sci","http://arxiv.org/licenses/nonexclusive-distrib/1.0/","  The growth dynamics of a single crack in a heterogeneous material under
subcritical loading is an intermittent process; and many features of this
dynamics have been shown to agree with simple models of thermally activated
rupture. In order to better understand the role of material heterogeneities in
this process, we study the subcritical propagation of a crack in a sheet of
paper in the presence of a distribution of small defects such as holes. The
experimental data obtained for two different distributions of holes are
discussed in the light of models that predict the slowing down of crack growth
when the disorder in the material is increased; however, in contradiction with
these theoretical predictions, the experiments result in longer lasting cracks
in a more ordered scenario. We argue that this effect is specific to
subcritical crack dynamics and that the weakest zones between holes at close
distance to each other are responsible both for the acceleration of the crack
dynamics and the slightly different roughness of the crack path.
","[{""version"":""v1"",""created"":""Sun, 31 Mar 2013 15:10:14 GMT""}]","2013-10-15"
"1304.0216","Pavel Levashov","V. S. Filinov","Analytical contradictions of the 'fixed - node' density matrices",,,,,"physics.plasm-ph","http://arxiv.org/licenses/nonexclusive-distrib/1.0/","  Over the last decades the 'fixed-node method' has been used for a numerical
treatment of thermodynamic properties of strongly correlated Fermi systems. In
this work correctness of the 'fixed -node method' for ideal Fermi systems has
been analytically analyzed. It is shown that the 'fixed-node' prescription of
calculation of the density matrix leads to contradictions even for two ideal
fermions. The main conclusion of this work is that the 'fixed-node method' can
not reproduce the fermion density matrices and should be considered as
uncontrolled empirical approach in treatment of thermodynamics of Fermi
systems.
","[{""version"":""v1"",""created"":""Sun, 31 Mar 2013 15:21:16 GMT""},{""version"":""v2"",""created"":""Tue, 23 Apr 2013 19:42:35 GMT""},{""version"":""v3"",""created"":""Wed, 31 Jul 2013 14:41:40 GMT""}]","2013-08-01"
"1304.0217","Alexander Sokol","Alexander Sokol, Niels Richard Hansen","Causal interpretation of stochastic differential equations",,"Electronic Journal of Probability, Vol. 19 (100) (2014)","10.1214/EJP.v19-2891",,"math.PR math.ST stat.TH","http://arxiv.org/licenses/nonexclusive-distrib/1.0/","  We give a causal interpretation of stochastic differential equations (SDEs)
by defining the postintervention SDE resulting from an intervention in an SDE.
We show that under Lipschitz conditions, the solution to the postintervention
SDE is equal to a uniform limit in probability of postintervention structural
equation models based on the Euler scheme of the original SDE, thus relating
our definition to mainstream causal concepts. We prove that when the driving
noise in the SDE is a L\'evy process, the postintervention distribution is
identifiable from the generator of the SDE.
","[{""version"":""v1"",""created"":""Sun, 31 Mar 2013 15:38:03 GMT""},{""version"":""v2"",""created"":""Sat, 8 Jun 2013 10:41:45 GMT""},{""version"":""v3"",""created"":""Mon, 27 Oct 2014 17:00:44 GMT""}]","2014-10-28"
"1304.0218","Jaekwang Kim","Donghoon Hyeon, Jaekwang Kim","A State Polytope Decomposition Formula",,,,,"math.AG","http://arxiv.org/licenses/nonexclusive-distrib/1.0/","  We give a decomposition formula for computing the state polytope of a
reducible variety in terms of the state polytopes of its components.
","[{""version"":""v1"",""created"":""Sun, 31 Mar 2013 15:43:14 GMT""},{""version"":""v2"",""created"":""Wed, 19 Jun 2013 04:20:58 GMT""},{""version"":""v3"",""created"":""Sat, 15 Mar 2014 16:02:14 GMT""}]","2014-03-18"
"1304.0219","Christopher Walker","Christopher Walker","A Categorification of Hall Algebras",,,,,"math.CT","http://arxiv.org/licenses/nonexclusive-distrib/1.0/","  In recent years, there has been great interest in the study of
categorification, specifically as it applies to the theory of quantum groups.
In this thesis, we would like to provide a new approach to this problem by
looking at Hall algebras. It is know, due to Ringel, that a Hall algebra is
isomorphic to a certain quantum group. It is our goal to describe a
categorification of Hall algebras as a way of doing so for their related
quantum groups. To do this, we will take the following steps. First, we
describe a new perspective on the structure theory of Hall algebras. This view
solves, in a unique way, the classic problem of the multiplication and
comultiplication not being compatible. Our solution is to switch to a different
underlying category $\Vect^K$ of vector spaces graded by a group $K$ called the
Grothendieck group. We equip this category with a nontrivial braiding which
depends on the $K$-grading. With this braiding and a given antipode, we find
that the Hall algebra does become a Hopf algebra object in $\Vect^K$. Second,
we will describe a categorification process, call `groupoidification', which
replaces vector spaces with groupoids and linear operators with `spans' of
groupoids. We will use this process to construct a braided monoidal bicategory
which categorifies $\Vect^K$ via the groupoidification program. Specifically,
graded vector spaces will be replaced with groupoids `over' a fixed groupoid
related to the Grothendieck group $K$. The braiding structure will come from an
interesting groupoid $\EXT(M,N)$ which will behave like the Euler
characteristic for the Grothendieck group $K$. We will finish with a
description of our plan to, in future work, apply the same concept to the
structure maps of the Hall algebra, which will eventually give us a Hopf
2-algebra object in our braided monoidal bicategory.
","[{""version"":""v1"",""created"":""Sun, 31 Mar 2013 15:47:19 GMT""},{""version"":""v2"",""created"":""Tue, 2 Apr 2013 00:55:01 GMT""}]","2013-04-03"
"1304.0220","Wen-Jian Pan","Yi Ling and Wen-Jian Pan","Note on the emergence of cosmic space in modified gravities","10pages, no figures, typos corrected, refs added, some refs updated,
  a footnote added, discussion improved, published in PRD","Phys. Rev. D 88,043518 (2013)","10.1103/PhysRevD.88.043518",,"hep-th gr-qc","http://arxiv.org/licenses/nonexclusive-distrib/1.0/","  Intrigued by the holographic principle, Padmanabhan recently proposed a novel
idea, saying that our cosmic space is emergent as cosmic time progresses. In
particular, the expansion rate of the Universe is related to the difference
between the surface degrees of freedom on the holographic horizon and the bulk
degrees of freedom inside. In this note, we generalize this interesting
paradigm to brane world, scalar-tensor gravity, and f(R) theory, respectively,
and find that in the cosmological setting the Friedmann equations can be
successfully derived.
","[{""version"":""v1"",""created"":""Sun, 31 Mar 2013 15:49:06 GMT""},{""version"":""v2"",""created"":""Wed, 11 Sep 2013 13:05:53 GMT""}]","2013-09-12"
