"1311.0255","Elmar Biernat P","Elmar P. Biernat, Franz Gross, M. T. Pe\~na, Alfred Stadler","Quark mass functions and pion structure in Minkowski space","4 pages, 2 figures, talk given at the The 22nd European Conference on
  Few-Body Problems in Physics, version published in Few-Body Systems",,"10.1007/s00601-014-0863-x",,"hep-ph nucl-th","http://arxiv.org/licenses/nonexclusive-distrib/1.0/","  We present a study of the dressed quark mass function and the pion structure
in Minkowski space using the Covariant Spectator Theory. The quark propagators
are dressed with the same kernel that describes the interaction between
different quarks. We use an interaction kernel in momentum space that is a
relativistic generalization of the linear confining q-qbar potential and a
constant potential shift that defines the energy scale. The confining
interaction has a Lorentz scalar part that is not chirally invariant by itself
but decouples from the equations in the chiral limit and therefore allows the
Nambu-Jona-Lasinio mechanism to work. We adjust the parameters of our quark
mass function calculated in Minkowski-space to agree with Lattice QCD data
obtained in Euclidean space. Results of a calculation of the pion
electromagnetic form factor in the relativistic impulse approximation using the
same mass function are presented and compared with experimental data.
","[{""version"":""v1"",""created"":""Fri, 1 Nov 2013 18:46:27 GMT""},{""version"":""v2"",""created"":""Mon, 24 Mar 2014 12:11:41 GMT""}]","2014-03-25"
"1311.0256","Daniel Hunter","Daniel R. Hunter","Derivation of the anisotropy profile, constraints on the local velocity
  dispersion, and implications for direct detection","Detailed derivation deferred to an appendix. Plots reworked to
  reflect uncertainty in the halo parameters, and some rewording. Same
  procedure and conclusions. Accepted for publication in JCAP. 15 pages, 8
  figures",,"10.1088/1475-7516/2014/02/023",,"astro-ph.CO","http://arxiv.org/licenses/nonexclusive-distrib/1.0/","  We study the implications of a pseudo-phase-space density power-law for the
anisotropy profile of a Milky Way-like dark matter halo. Requiring that the
anisotropy parameter does not take non-physical values within the virial radius
places a maximum value on the local radial velocity dispersion. For a plausible
range of halo parameters, it is possible to take a local total velocity
dispersion of up to about $300\,\mathrm{km/s}$. Making this choice uniquely
specifies the anisotropy and dispersion profiles. We introduce a way to model
the local velocity distribution that incorporates this anisotropy and study the
impact on direct detection.
","[{""version"":""v1"",""created"":""Fri, 1 Nov 2013 18:49:57 GMT""},{""version"":""v2"",""created"":""Thu, 7 Nov 2013 20:26:31 GMT""},{""version"":""v3"",""created"":""Tue, 11 Feb 2014 16:28:29 GMT""}]","2014-02-18"
"1311.0257","Seth Hitefield","Michael D. Adams, Seth D. Hitefield, Bruce Hoy, Michael C. Fowler, T.
  Charles Clancy","Application of Cybernetics and Control Theory for a New Paradigm in
  Cybersecurity","12 pages, 7 figures",,,,"cs.CR","http://arxiv.org/licenses/nonexclusive-distrib/1.0/","  A significant limitation of current cyber security research and techniques is
its reactive and applied nature. This leads to a continuous 'cyber cycle' of
attackers scanning networks, developing exploits and attacking systems, with
defenders detecting attacks, analyzing exploits and patching systems. This
reactive nature leaves sensitive systems highly vulnerable to attack due to
un-patched systems and undetected exploits. Some current research attempts to
address this major limitation by introducing systems that implement moving
target defense. However, these ideas are typically based on the intuition that
a moving target defense will make it much harder for attackers to find and scan
vulnerable systems, and not on theoretical mathematical foundations. The
continuing lack of fundamental science and principles for developing more
secure systems has drawn increased interest into establishing a 'science of
cyber security'. This paper introduces the concept of using cybernetics, an
interdisciplinary approach of control theory, systems theory, information
theory and game theory applied to regulatory systems, as a foundational
approach for developing cyber security principles. It explores potential
applications of cybernetics to cyber security from a defensive perspective,
while suggesting the potential use for offensive applications. Additionally,
this paper introduces the fundamental principles for building non-stationary
systems, which is a more general solution than moving target defenses. Lastly,
the paper discusses related works concerning the limitations of moving target
defense and one implementation based on non-stationary principles.
","[{""version"":""v1"",""created"":""Fri, 1 Nov 2013 19:02:57 GMT""}]","2013-11-04"
"1311.0258","Michael McCoy","Michael B. McCoy, Volkan Cevher, Quoc Tran Dinh, Afsaneh Asaei, and
  Luca Baldassarre","Convexity in source separation: Models, geometry, and algorithms",,,"10.1109/MSP.2013.2296605",,"cs.IT math.IT","http://arxiv.org/licenses/nonexclusive-distrib/1.0/","  Source separation or demixing is the process of extracting multiple
components entangled within a signal. Contemporary signal processing presents a
host of difficult source separation problems, from interference cancellation to
background subtraction, blind deconvolution, and even dictionary learning.
Despite the recent progress in each of these applications, advances in
high-throughput sensor technology place demixing algorithms under pressure to
accommodate extremely high-dimensional signals, separate an ever larger number
of sources, and cope with more sophisticated signal and mixing models. These
difficulties are exacerbated by the need for real-time action in automated
decision-making systems.
  Recent advances in convex optimization provide a simple framework for
efficiently solving numerous difficult demixing problems. This article provides
an overview of the emerging field, explains the theory that governs the
underlying procedures, and surveys algorithms that solve them efficiently. We
aim to equip practitioners with a toolkit for constructing their own demixing
algorithms that work, as well as concrete intuition for why they work.
","[{""version"":""v1"",""created"":""Fri, 1 Nov 2013 19:04:11 GMT""}]","2015-06-17"
"1311.0259","Asger Cronberg Ipsen","Asger C. Ipsen","Error-disturbance relations for finite dimensional systems","welcome. 17 pages. v2: Added references",,,,"quant-ph math-ph math.MP","http://arxiv.org/licenses/nonexclusive-distrib/1.0/","  We propose an error-disturbance relation for general observables on finite
dimensional Hilbert spaces based on operational notions of error and
disturbance. For two-dimensional systems we derive tight inequalities
expressing the trade-off between accuracy and disturbance.
","[{""version"":""v1"",""created"":""Fri, 1 Nov 2013 19:05:32 GMT""},{""version"":""v2"",""created"":""Wed, 20 Nov 2013 14:51:14 GMT""}]","2013-11-21"
"1311.0260","Javier Fernandez","Javier Fernandez and Marcela Zuccalli","A geometric approach to discrete connections on principal bundles","12 pages","J. Geom. Mech. 5 (2013), no. 4, p. 433","10.3934/jgm.2013.5.433",,"math.DG math-ph math.MP","http://arxiv.org/licenses/nonexclusive-distrib/1.0/","  This work revisits, from a geometric perspective, the notion of discrete
connection on a principal bundle, introduced by M. Leok, J. Marsden and A.
Weinstein. It provides precise definitions of discrete connection, discrete
connection form and discrete horizontal lift and studies some of their basic
properties and relationships. An existence result for discrete connections on
principal bundles equipped with appropriate Riemannian metrics is proved.
","[{""version"":""v1"",""created"":""Fri, 1 Nov 2013 19:06:04 GMT""}]","2020-09-22"
"1311.0263","A. Verra","Letizia Pernigotti, Alessandro Verra","On the rationality of the moduli of higher spin curves in low genus","Refereed version. To appear in IMRN, International Mathematics
  Research Notices",,,,"math.AG","http://arxiv.org/licenses/nonexclusive-distrib/1.0/","  The global geometry of the moduli spaces of higher spin curves and their
birational classification is largely unknown for g >= 2 and r > 2. Using quite
related geometric constructions, we almost complete the picture of the known
results in genus g <= 4 showing the rationality of the moduli spaces of even
and odd 4-spin curves of genus 3, of odd spin curves of genus 4 and of 3-spin
curves of genus 4.
","[{""version"":""v1"",""created"":""Fri, 1 Nov 2013 19:06:32 GMT""},{""version"":""v2"",""created"":""Fri, 14 Aug 2015 15:30:25 GMT""}]","2015-08-17"
"1311.0264","Indranil Chattopadhyay","Rajiv Kumar, Indranil Chattopadhyay, Samir Mandal","Radiatively and thermally driven self-consistent bipolar outflows from
  accretion discs around compact objects","18 pages, 11 figures. Accepted for publication in MNRAS on 31 October
  2013",,"10.1093/mnras/stt2117",,"astro-ph.HE","http://arxiv.org/licenses/nonexclusive-distrib/1.0/","  We investigate the role of radiative driving of shock ejected bipolar
outflows from advective accretion discs in a self consistent manner. Radiations
from the inner disc affects the subsonic part of the jet while those from the
pre-shock disc affects the supersonic part, and there by constitutes a multi
stage acceleration process. We show that the radiation from the inner disc not
only accelerate but also increase the mass outflow rate, while the radiation
from the pre-shock disc only increases the kinetic energy of the flow. With
proper proportions of these two radiations, very high terminal speed is
possible. We also estimated the post-shock luminosity from the pre-shock
radiations, and showed that with the increase of viscosity parameter the disc
becomes more luminous, and the resulting jet simultaneously becomes faster.
This mimics the production of steady mildly relativistic but stronger jets as
micro-quasars moves from low hard to intermediate hard spectral states.
","[{""version"":""v1"",""created"":""Fri, 1 Nov 2013 19:19:55 GMT""}]","2015-06-17"
"1311.0265","M. Cristina Rabello-Soares","M. Cristina Rabello-Soares","Recent results in Ring Diagram analysis","Conference proceedings (""Fifty Years of Seismology of the Sun and
  Stars"") will be published by the CONFERENCE SERIES of ASTRONOMICAL SOCIETY OF
  THE PACIFIC",,,,"astro-ph.SR","http://arxiv.org/licenses/nonexclusive-distrib/1.0/","  The ring-diagram technique was developed by Frank Hill 25 years ago and
developed quickly during the late 1990s. It is nowadays one of the most
commonly used techniques in local helioseismology. The method consists in the
power spectral analysis of solar acoustic oscillations on small regions (2 to
30 degrees) of the solar surface. The power spectrum resembles a set of
trumpets nested inside each other and, for a given frequency, it looks like a
ring, hence the technique's name. It provides information on the horizontal
flow field and thermodynamic structure in the layers immediately below the
photosphere. With data regularly provided by MDI (on board SOHO), GONG+ network
and more recently HMI (on SDO), many important results have been achieved. In
recently years, these results include estimations of the meridional circulation
and its evolution with solar cycle; flows associated with active regions, as
well as, flow divergence and vorticity; and thermal structure beneath and
around active regions. Much progress is expected with data now provided by
HMI's high spatial resolution observations and high duty cycle. There are two
data processing pipelines (GONG and HMI) providing free access to the data and
the results of the ring-diagram analysis. Here we will discuss the most recent
results and improvements in the technique, as well as, the many challenges that
still remain.
","[{""version"":""v1"",""created"":""Fri, 1 Nov 2013 19:27:54 GMT""}]","2013-11-04"
"1311.0266","Moataz Emam","Charles A. Canestaro, Moataz H. Emam","The five dimensional universal hypermultiplet and the cosmological
  constant problem",,"Phys. Lett. B726 (2013) 913-917","10.1016/j.physletb.2013.09.055",,"hep-th","http://arxiv.org/licenses/nonexclusive-distrib/1.0/","  We model the universe as a 3-brane embedded in five dimensional spacetime
with N=2 supersymmetry. The presence of the scalar fields of the universal
hypermultiplet in the bulk results in a positive pressure effectively reducing
the value of the cosmological constant and thereby providing a possible answer
as to why the measured value of the cosmological constant is many orders of
magnitude smaller than predicted from the vacuum energy. The solution allows
for any number of parallel branes to exist and relates their cosmological
constants (as well as matter densities and radiation pressures) to the value of
the dilaton in the extra dimension. The results we find can be thought of as
first order approximations, satisfying supersymmetry breaking and the
Bogomol'nyi-Prasad-Sommerfield (BPS) conditions in the bulk only.
","[{""version"":""v1"",""created"":""Fri, 1 Nov 2013 19:27:56 GMT""}]","2013-11-04"
"1311.0267","William Wylie","William Wylie","Sectional curvature for Riemannian manifolds with density","19 pages, The expositiion of the paper has been shortened by a few
  pages and some of the arguments streamlined at the suggestion of the referee.
  Final version, to appear in Geometriae Dedicata",,,,"math.DG","http://arxiv.org/licenses/nonexclusive-distrib/1.0/","  In this paper we introduce two new notions of sectional curvature for
Riemannian manifolds with density. Under both notions of curvature we classify
the constant curvature manifolds. We also prove generalizations of the theorems
of Cartan-Hadamard, Synge, and Bonnet-Myers as well as a generalization of the
(non-smooth) 1/4-pinched sphere theorem. The main idea is to modify the radial
curvature equation and second variation formula and then apply the techniques
of classical Riemannian geometry to these new equations.
","[{""version"":""v1"",""created"":""Fri, 1 Nov 2013 19:30:09 GMT""},{""version"":""v2"",""created"":""Fri, 6 Dec 2013 20:49:10 GMT""},{""version"":""v3"",""created"":""Sat, 24 Jan 2015 20:05:43 GMT""}]","2015-01-27"
"1311.0268","N\'estor Ortiz","N\'estor Ortiz and Olivier Sarbach","Cauchy horizon stability in a collapsing spherical dust cloud I:
  geometric optic approximation and spherically symmetric test fields","15 pages, 7 figures","Class.Quant.Grav. 31 (2014) 075003","10.1088/0264-9381/31/7/075003",,"gr-qc","http://arxiv.org/licenses/nonexclusive-distrib/1.0/","  A spherical dust cloud which is initially at rest and which has a
monotonously decaying density profile collapses and forms a shell-focussing
singularity. Provided the density profile is not too flat, meaning that its
second radial derivative is negative at the center, this singularity is visible
to local, and sometimes even to global observers. According to the strong
cosmic censorship conjecture, such naked singularities should be unstable under
generic, nonspherical perturbations of the initial data or when more realistic
matter models are considered.
  In an attempt to gain some understanding about this stability issue, in this
work we initiate the analysis of a simpler but related problem. We discuss the
stability of test fields propagating in the vicinity of the Cauchy horizon
associated to the naked central singularity. We first study the high-frequency
limit and show that the fields undergo a blueshift as they approach the Cauchy
horizon. However, in contrast to what occurs at inner horizons of black holes,
we show that the blueshift is uniformly bounded along incoming and outgoing
null rays. Motivated by this boundedness result, we take a step beyond the
geometric optic approximation and consider the Cauchy evolution of spherically
symmetric test scalar fields. We prove that under reasonable conditions on the
initial data a suitable rescaled field can be continuously extended to the
Cauchy horizon. In particular, this result implies that the physical field is
everywhere finite on the Cauchy horizon away from the central singularity.
","[{""version"":""v1"",""created"":""Fri, 1 Nov 2013 19:30:11 GMT""}]","2014-06-17"
"1311.0269","Peter Elmer","David Abdurachmanov, Peter Elmer, Giulio Eulisse, Shahzad Muzaffar","Initial explorations of ARM processors for scientific computing","Submitted to proceedings of the 15th International Workshop on
  Advanced Computing and Analysis Techniques in Physics Research (ACAT2013),
  Beijing. arXiv admin note: text overlap with arXiv:1311.1001",,"10.1088/1742-6596/523/1/012009",,"physics.comp-ph cs.DC cs.NA hep-ex","http://arxiv.org/licenses/nonexclusive-distrib/1.0/","  Power efficiency is becoming an ever more important metric for both high
performance and high throughput computing. Over the course of next decade it is
expected that flops/watt will be a major driver for the evolution of computer
architecture. Servers with large numbers of ARM processors, already ubiquitous
in mobile computing, are a promising alternative to traditional x86-64
computing. We present the results of our initial investigations into the use of
ARM processors for scientific computing applications. In particular we report
the results from our work with a current generation ARMv7 development board to
explore ARM-specific issues regarding the software development environment,
operating system, performance benchmarks and issues for porting High Energy
Physics software.
","[{""version"":""v1"",""created"":""Fri, 1 Nov 2013 19:33:35 GMT""},{""version"":""v2"",""created"":""Wed, 22 Jan 2014 09:23:39 GMT""}]","2014-10-24"
"1311.0270","Marie Kratz","Marie Kratz","There is a VaR beyond usual approximations","33 pages, 5 figures",,,,"stat.ME q-fin.RM","http://arxiv.org/licenses/nonexclusive-distrib/1.0/","  Basel II and Solvency 2 both use the Value-at-Risk (VaR) as the risk measure
to compute the Capital Requirements. In practice, to calibrate the VaR, a
normal approximation is often chosen for the unknown distribution of the yearly
log returns of financial assets. This is usually justified by the use of the
Central Limit Theorem (CLT), when assuming aggregation of independent and
identically distributed (iid) observations in the portfolio model. Such a
choice of modeling, in particular using light tail distributions, has proven
during the crisis of 2008/2009 to be an inadequate approximation when dealing
with the presence of extreme returns; as a consequence, it leads to a gross
underestimation of the risks. The main objective of our study is to obtain the
most accurate evaluations of the aggregated risks distribution and risk
measures when working on financial or insurance data under the presence of
heavy tail and to provide practical solutions for accurately estimating high
quantiles of aggregated risks. We explore a new method, called Normex, to
handle this problem numerically as well as theoretically, based on properties
of upper order statistics. Normex provides accurate results, only weakly
dependent upon the sample size and the tail index. We compare it with existing
methods.
","[{""version"":""v1"",""created"":""Fri, 1 Nov 2013 19:34:07 GMT""}]","2013-11-04"
"1311.0271","K. R. Goodearl","K.A. Brown and K.R. Goodearl","Zariski topologies on stratified spectra of quantum algebras","23 pages; 4 xypic diagrams",,,,"math.QA math.RA","http://arxiv.org/licenses/nonexclusive-distrib/1.0/","  A framework is developed to describe the Zariski topologies on the prime and
primitive spectra of a quantum algebra $A$ in terms of the (known) topologies
on strata of these spaces and maps between the collections of closed sets of
different strata. A conjecture is formulated, under which the desired maps
would arise from homomorphisms between certain central subalgebras of localized
factor algebras of $A$. When the conjecture holds, spec $A$ and prim $A$ are
then determined, as topological spaces, by a finite collection of (classical)
affine algebraic varieties and morphisms between them. The conjecture is
verified for ${\cal O}_q(GL_2(k))$, ${\cal O}_q(SL_3(k))$, and ${\cal
O}_q(M_2(k))$ when $q$ is a non-root of unity and the base field $k$ is
algebraically closed.
","[{""version"":""v1"",""created"":""Fri, 1 Nov 2013 19:38:32 GMT""}]","2013-11-04"
"1311.0272","Peter Elmer","Kapil Arya, Gene Cooperman, Andrea Dotti, Peter Elmer","Use of checkpoint-restart for complex HEP software on traditional
  architectures and Intel MIC","Submitted to proceedings of the 15th International Workshop on
  Advanced Computing and Analysis Techniques in Physics Research (ACAT2013),
  Beijing",,"10.1088/1742-6596/523/1/012015",,"physics.comp-ph cs.DC cs.NA hep-ex","http://arxiv.org/licenses/nonexclusive-distrib/1.0/","  Process checkpoint-restart is a technology with great potential for use in
HEP workflows. Use cases include debugging, reducing the startup time of
applications both in offline batch jobs and the High Level Trigger, permitting
job preemption in environments where spare CPU cycles are being used
opportunistically and efficient scheduling of a mix of multicore and
single-threaded jobs. We report on tests of checkpoint-restart technology using
CMS software, Geant4-MT (multi-threaded Geant4), and the DMTCP (Distributed
Multithreaded Checkpointing) package. We analyze both single- and
multi-threaded applications and test on both standard Intel x86 architectures
and on Intel MIC. The tests with multi-threaded applications on Intel MIC are
used to consider scalability and performance. These are considered an indicator
of what the future may hold for many-core computing.
","[{""version"":""v1"",""created"":""Fri, 1 Nov 2013 19:40:39 GMT""},{""version"":""v2"",""created"":""Wed, 22 Jan 2014 08:37:58 GMT""}]","2014-10-24"
"1311.0273","A. Metelmann","A. Metelmann and A. A. Clerk","Quantum-Limited Amplification via Reservoir Engineering","5 pages plus supplementary information","Phys. Rev. Lett. 112, 133904 (2014)","10.1103/PhysRevLett.112.133904",,"cond-mat.mes-hall quant-ph","http://arxiv.org/licenses/nonexclusive-distrib/1.0/","  We describe a new kind of phase-preserving quantum amplifier which utilizes
dissipative interactions in a parametrically-coupled three-mode bosonic system.
The use of dissipative interactions provides a fundamental advantage over
standard cavity-based parametric amplifiers: large photon number gains are
possible with quantum-limited added noise, with no limitation on the
gain-bandwidth product. We show that the scheme is simple enough to be
implemented both in optomechanical systems and in superconducting microwave
circuits.
","[{""version"":""v1"",""created"":""Fri, 1 Nov 2013 19:41:10 GMT""},{""version"":""v2"",""created"":""Tue, 8 Apr 2014 14:52:14 GMT""}]","2014-04-09"
"1311.0274","Adel Javanmard","Adel Javanmard and Andrea Montanari","Nearly Optimal Sample Size in Hypothesis Testing for High-Dimensional
  Regression","21 pages, short version appears in Annual Allerton Conference on
  Communication, Control and Computing, 2013",,,,"math.ST cs.IT cs.LG math.IT stat.ME stat.TH","http://arxiv.org/licenses/nonexclusive-distrib/1.0/","  We consider the problem of fitting the parameters of a high-dimensional
linear regression model. In the regime where the number of parameters $p$ is
comparable to or exceeds the sample size $n$, a successful approach uses an
$\ell_1$-penalized least squares estimator, known as Lasso. Unfortunately,
unlike for linear estimators (e.g., ordinary least squares), no
well-established method exists to compute confidence intervals or p-values on
the basis of the Lasso estimator. Very recently, a line of work
\cite{javanmard2013hypothesis, confidenceJM, GBR-hypothesis} has addressed this
problem by constructing a debiased version of the Lasso estimator. In this
paper, we study this approach for random design model, under the assumption
that a good estimator exists for the precision matrix of the design. Our
analysis improves over the state of the art in that it establishes nearly
optimal \emph{average} testing power if the sample size $n$ asymptotically
dominates $s_0 (\log p)^2$, with $s_0$ being the sparsity level (number of
non-zero coefficients). Earlier work obtains provable guarantees only for much
larger sample size, namely it requires $n$ to asymptotically dominate $(s_0
\log p)^2$.
  In particular, for random designs with a sparse precision matrix we show that
an estimator thereof having the required properties can be computed
efficiently. Finally, we evaluate this approach on synthetic data and compare
it with earlier proposals.
","[{""version"":""v1"",""created"":""Fri, 1 Nov 2013 19:41:42 GMT""}]","2013-11-04"
"1311.0275","Tillmann Baumgratz","T. Baumgratz and M. Cramer and M. B. Plenio","Quantifying Coherence","11 pages, close to published version","Phys. Rev. Lett. 113, 140401 (2014)","10.1103/PhysRevLett.113.140401",,"quant-ph","http://arxiv.org/licenses/nonexclusive-distrib/1.0/","  We introduce a rigorous framework for the quantification of coherence and
identify intuitive and easily computable measures of coherence. We achieve this
by adopting the viewpoint of coherence as a physical resource. By determining
defining conditions for measures of coherence we identify classes of
functionals that satisfy these conditions and other, at first glance natural
quantities, that do not qualify as coherence measure. We conclude with an
outline of the questions that remain to be answered to complete the theory of
coherence as a resource.
","[{""version"":""v1"",""created"":""Fri, 1 Nov 2013 19:42:10 GMT""},{""version"":""v2"",""created"":""Wed, 19 Feb 2014 16:40:04 GMT""},{""version"":""v3"",""created"":""Mon, 6 Oct 2014 10:10:49 GMT""}]","2014-10-07"
