"1311.0293","David Liu","David Liu","Pebbling Arguments for Tree Evaluation",,,,,"cs.CC","http://arxiv.org/licenses/nonexclusive-distrib/1.0/","  The Tree Evaluation Problem was introduced by Cook et al. in 2010 as a
candidate for separating P from L and NL. The most general space lower bounds
known for the Tree Evaluation Problem require a semantic restriction on the
branching programs and use a connection to well-known pebble games to generate
a bottleneck argument. These bounds are met by corresponding upper bounds
generated by natural implementations of optimal pebbling algorithms. In this
paper we extend these ideas to a variety of restricted families of both
deterministic and non-deterministic branching programs, proving tight lower
bounds under these restricted models. We also survey and unify known lower
bounds in our ""pebbling argument"" framework.
","[{""version"":""v1"",""created"":""Fri, 1 Nov 2013 20:13:47 GMT""}]","2013-11-05"
"1311.0294","James Croft Ph.D.","James F. E. Croft and John L. Bohn","Long-Lived Complexes, Ergodicity and Chaos in Ultracold Molecular
  Collisions","9 pages, 7 figures",,"10.1103/PhysRevA.89.012714",,"physics.chem-ph","http://arxiv.org/licenses/nonexclusive-distrib/1.0/","  Estimates for the lifetime of collision complexes formed during ultracold
molecular collisions based on density-of-states arguments are shown to be
consistent with similar estimate based on classical trajectory calculations. In
the classical version, these collisions are shown to exhibit chaos, and their
fractal dimensions are calculated versus collision energy. From these results,
a picture emerges that ultracold collisions are classically ergodic, justifying
the density-of-states estimates for lifetimes. These results point the way
toward using the techniques of classical and quantum chaos to interpret
molecular collisions in the ultracold regime.
","[{""version"":""v1"",""created"":""Fri, 1 Nov 2013 20:19:34 GMT""},{""version"":""v2"",""created"":""Fri, 31 Jan 2014 20:02:22 GMT""}]","2014-02-03"
"1311.0295","James Mayoh","James Mayoh and Antonio M. Garc\'ia-Garc\'ia","Strong enhancement of bulk superconductivity by engineered
  nanogranularity","11 pages, 5 figures","Phys. Rev. B 90, 134513 (2014)","10.1103/PhysRevB.90.134513",,"cond-mat.supr-con cond-mat.mes-hall","http://arxiv.org/licenses/nonexclusive-distrib/1.0/","  It is now well established, both theoretically and experimentally, that very
small changes in the size of isolated nanograins lead to substantial
nonmonotonic variations, and sometimes enhancement, of the mean-field
spectroscopic gap of conventional superconductors. A natural question to ask,
of broad relevance for the theory and applications of superconductivity, is
whether these size effects can also enhance the critical temperature of a bulk
granular material composed of such nanograins. Here we answer this question
affirmatively. We combine mean-field, semiclassical, and percolation techniques
to show that engineered nanoscale granularity in conventional superconductors
can enhance the critical temperature by up to a few times compared to the
nongranular bulk limit. This prediction is valid for three-dimensional and also
quasi-two-dimensional samples, provided the thickness is much larger than the
grain size. Our model takes into account an experimentally realistic
distribution of grain sizes in the array, charging effects, tunnelling by
quasiparticles, and limitations related to the proliferation of thermal
fluctuations for sufficiently small grains.
","[{""version"":""v1"",""created"":""Fri, 1 Nov 2013 20:20:24 GMT""},{""version"":""v2"",""created"":""Sun, 15 Jun 2014 23:35:22 GMT""},{""version"":""v3"",""created"":""Sat, 1 Nov 2014 10:53:10 GMT""}]","2014-11-04"
"1311.0296","Scott J. Kenyon","Scott J. Kenyon and Benjamin C. Bromley","Coagulation Calculations of Icy Planet Formation Around 0.1--0.5~\msun\
  Stars: Super-Earths From Large Planetestimals","32 pages, 16 figures, ApJ accepted",,"10.1088/0004-637X/780/1/4",,"astro-ph.EP","http://arxiv.org/licenses/nonexclusive-distrib/1.0/","  We investigate formation mechanisms for icy super-Earth mass planets orbiting
at 2-20 AU around 0.1-0.5 solar mass stars. A large ensemble of coagulation
calculations demonstrates a new formation channel: disks composed of large
planetesimals with radii of 30-300 km form super-Earths on time scales of
roughly 1 Gyr. In other gas-poor disks, a collisional cascade grinds
planetesimals to dust before the largest planets reach super-Earth masses. Once
icy Earth-mass planets form, they migrate through the leftover swarm of
planetesimals at rates of 0.01-1 AU per Myr. On time scales of 10 Myr to 1 Gyr,
many of these planets migrate through the disk of leftover planetesimals from
semimajor axes of 5-10 AU to 1-2 AU. A few per cent of super-Earths might
migrate to semimajor axes of 0.1-0.2 AU. When the disk has an initial mass
comparable with the minimum mass solar nebula scaled to the mass of the central
star, the predicted frequency of super-Earths matches the observed frequency.
","[{""version"":""v1"",""created"":""Fri, 1 Nov 2013 20:21:58 GMT""}]","2015-06-17"
"1311.0297","Jorge Bruno Dr","Jorge Bruno and Ittay Weiss","Metric axioms: a structural study","Lattices, Embeddings, Metric axioms, Topology, first-order language,
  adjoints, adjunctions",,,,"math.GN","http://arxiv.org/licenses/nonexclusive-distrib/1.0/","  For a fixed set $X$, an arbitrary \textit{weight structure} $d \in
[0,\infty]^{X \times X}$ can be interpreted as a distance assignment between
pairs of points on $X$. Restrictions (i.e. \textit{metric axioms}) on the
behaviour of any such $d$ naturally arise, such as separation, triangle
inequality and symmetry. We present an order-theoretic investigation of various
collections of weight structures, as naturally occurring subsets of
$[0,\infty]^{X \times X}$ satisfying certain metric axioms. Furthermore, we
exploit the categorical notion of adjunctions when investigating connections
between the above collections of weight structures. As a corollary, we present
several lattice-embeddability theorems on a well-known collection of weight
structures on $X$.
","[{""version"":""v1"",""created"":""Fri, 1 Nov 2013 20:26:05 GMT""},{""version"":""v2"",""created"":""Wed, 13 Nov 2013 16:38:40 GMT""},{""version"":""v3"",""created"":""Tue, 21 Oct 2014 18:42:00 GMT""}]","2014-10-22"
"1311.0298","Claude Bourbonnais","M. Poirier, M. de Lafontaine, C. Bourbonnais, and J.-P. Pouget","Charge, spin and lattice effects in the spin-Peierls ground state of
  MEM(TCNQ)$_2$","6 pages, 5 figures",,"10.1103/PhysRevB.88.245134",,"cond-mat.str-el","http://arxiv.org/licenses/nonexclusive-distrib/1.0/","  We report an investigation of charge, spin and lattice effects in the
spin-Peierls state of the organic compound MEM(TCNQ)$_2$. The 16.5 GHz
dielectric function along the chain axis shows an enhancement below the
spin-Peierls transition temperature near 18 K consistent with the charge
coupling to the elastic strain involved in the transition. The velocity of two
elastic modes perpendicular to the chain axis presents anomalies at the
transition which can be explained with a Landau free energy model including a
linear-quadratic coupling energy term between the appropriate elastic strain
$e$ and the spin-Peierls magnetic gap $\Delta_q$. The analysis of the
dielectric and elastic features aims toward an order parameter with an
associated critical exponent $\beta \sim$ 0.36, which is similar to the
three-dimensional behavior seen in other spin-Peierls materials. All these
effects studied in a magnetic field up to 18 Teslas appear also compatible with
a mean-field model of a quasi-one-dimensional spin-Peierls system.
","[{""version"":""v1"",""created"":""Fri, 1 Nov 2013 20:26:39 GMT""}]","2015-06-17"
"1311.0299","Daniel Whiteson","Y. Gershtein, M. Luty, M. Narain, L.-T. Wang, D. Whiteson, K. Agashe,
  L. Apanasevich, G. Artoni, A. Avetisyan, H. Baer, C. Bartels, M. Bauer, D.
  Berge, M. Berggren, S. Bhattacharya, K. Black, T. Bose, J. Brau, R. Brock, E.
  Brownson, M. Cahill-Rowley, A. Cakir, A. Chaus, T. Cohen, B. Coleppa, R.
  Cotta, N. Craig, K. Dienes, B. Dobrescu, D. Duggan, R. Essig, J. Evans, A.
  Drlica-Wagner, S. Funk, J. George, F. Goertz, T. Golling, T. Han, A. Haas, M.
  Hance, D. Hayden, U. Heintz, A. Henrichs, J. Hewett, J. Hirschauer, K. Howe,
  A. Ismail, K. Kaadze, Y. Kats, F. Kling, D. Kolchmeyer, D. Kr""ucker, K.C.
  Kong, A. Kumar, G. Kribs, P. Langacker, A. Lath, S. J. Lee, J. List, T. Lin,
  L. Linssen, T. Liu, Z. Liu, A. Lobanov, J. Loyal, A. Martin, I.
  Melzer-Pellmann, M.M. Nojiri, S. Padhi, N. Parashar, B. Penning, M.
  Perelstein, M. Peskin, A. Pierce, W. Porod, C. Potter, T. Rizzo, G. Sciolla,
  J. Stupak III, S. Su, T.M.P. Tait, T. Tanabe, B. Thomas, S. Thomas, S.
  Upadhyay, N. Varelas, E. Varnes, L. Vecchi, A. Venturini, B. Vormwald, J.
  Wacker, M. Walker, M. Wood, F. Yu, N. Zhou","New Particles Working Group Report of the Snowmass 2013 Community Summer
  Study",,,,,"hep-ex hep-ph","http://arxiv.org/licenses/nonexclusive-distrib/1.0/","  This report summarizes the work of the Energy Frontier New Physics working
group of the 2013 Community Summer Study (Snowmass).
","[{""version"":""v1"",""created"":""Fri, 1 Nov 2013 20:27:39 GMT""}]","2013-11-05"
"1311.0301","Moritz Egert","Moritz Egert, Robert Haller-Dintelmann, and Patrick Tolksdorf","The Kato Square Root Problem follows from an Extrapolation Property of
  the Laplacian","Late upload of the published version",,,,"math.FA","http://arxiv.org/licenses/nonexclusive-distrib/1.0/","  On a domain $\Omega \subseteq \mathbb{R}^d$ we consider second order elliptic
systems in divergence form with bounded complex coefficients, realized via a
sesquilinear form with domain $V \subseteq H^1(\Omega)$. Under very mild
assumptions on $\Omega$ and $V$ we show that the Kato Square Root Problem for
such systems can be reduced to a regularity result for the fractional powers of
the negative Laplacian in the same geometric setting. This extends an earlier
result of McIntosh to non-smooth coefficients.
","[{""version"":""v1"",""created"":""Fri, 1 Nov 2013 20:53:58 GMT""},{""version"":""v2"",""created"":""Thu, 19 Dec 2013 16:59:44 GMT""},{""version"":""v3"",""created"":""Fri, 23 May 2014 18:42:02 GMT""},{""version"":""v4"",""created"":""Mon, 9 Aug 2021 16:59:59 GMT""}]","2021-08-10"
"1311.0302","Moritz Egert","Moritz Egert, Robert Haller-Dintelmann, and Patrick Tolksdorf","The Kato Square Root Problem for Mixed Boundary Conditions","Late upload of the published version",,,,"math.FA","http://arxiv.org/licenses/nonexclusive-distrib/1.0/","  We consider the negative Laplacian subject to mixed boundary conditions on a
bounded domain. We prove under very general geometric assumptions that slightly
above the critical exponent $\frac{1}{2}$ its fractional power domains still
coincide with suitable Sobolev spaces of optimal regularity. In combination
with a reduction theorem recently obtained by the authors, this solves the Kato
Square Root Problem for elliptic second order operators and systems in
divergence form under the same geometric assumptions.
","[{""version"":""v1"",""created"":""Fri, 1 Nov 2013 20:54:46 GMT""},{""version"":""v2"",""created"":""Thu, 19 Dec 2013 16:51:23 GMT""},{""version"":""v3"",""created"":""Mon, 9 Aug 2021 17:10:05 GMT""}]","2021-08-10"
"1311.0303","Brent Cody Mr.","Brent Cody, Sy-David Friedman, Radek Honzik","Easton functions and supercompactness",,,,,"math.LO","http://arxiv.org/licenses/nonexclusive-distrib/1.0/","  Suppose $\kappa$ is $\lambda$-supercompact witnessed by an elementary
embedding $j:V\rightarrow M$ with critical point $\kappa$, and further suppose
that $F$ is a function from the class of regular cardinals to the class of
cardinals satisfying the requirements of Easton's theorem: (1) $\forall\alpha$
$\alpha<\textrm{cf}(F(\alpha))$ and (2) $\alpha<\beta$ $\Longrightarrow$
$F(\alpha)\leq F(\beta)$. In this article we address the question: assuming
GCH, what additional assumptions are necessary on $j$ and $F$ if one wants to
be able to force the continuum function to agree with $F$ globally, while
preserving the $\lambda$-supercompactness of $\kappa$?
  We show that, assuming GCH, if $F$ is any function as above, and in addition
for some regular cardinal $\lambda>\kappa$ there is an elementary embedding
$j:V\rightarrow M$ with critical point $\kappa$ such that $\kappa$ is closed
under $F$, the model $M$ is closed under $\lambda$-sequences,
$H(F(\lambda))\subseteq M$, and for each regular cardinal $\gamma\leq \lambda$
one has $(|j(F)(\gamma)|=F(\gamma))^V$, then there is a cardinal-preserving
forcing extension in which $2^\delta=F(\delta)$ for every regular cardinal
$\delta$ and $\kappa$ remains $\lambda$-supercompact. This answers a question
of B. Cody, M. Magidor, On supercompactness and the continuum function, Ann.
Pure Appl. Logic, (2013).
","[{""version"":""v1"",""created"":""Fri, 1 Nov 2013 20:56:13 GMT""}]","2013-11-05"
"1311.0304","Leonardo Vernazza","Vittorio Del Duca, Giulio Falcioni, Lorenzo Magnea and Leonardo
  Vernazza","High-energy QCD amplitudes at two loops and beyond","17 pages",,"10.1016/j.physletb.2014.03.033","LPN13-086","hep-ph","http://arxiv.org/licenses/nonexclusive-distrib/1.0/","  Recent progress in our understanding of infrared singularities of
multi-parton amplitudes has shown that the simplest form of Regge factorization
for high-energy gauge-theory amplitudes fails starting at
next-to-next-to-leading logarithmic accuracy. We provide a framework to
organize the calculation of parton amplitudes at leading power in t/s, in terms
of factorizing and non-factorizing contributions. This allows us to give
explicit expressions for the leading Reggeization-breaking terms in two-loop
and three-loop quark and gluon amplitudes in QCD. In particular, using only
infrared information, we recover a known non-factorizing, non-logarithmic
double-pole contribution at two-loops, and we compute the leading
non-factorizing single-logarithmic contributions at three loops.
","[{""version"":""v1"",""created"":""Fri, 1 Nov 2013 21:00:41 GMT""}]","2015-06-17"
"1311.0305","John H. Schwarz","John H. Schwarz","Highly Effective Actions","37 pages",,"10.1007/JHEP01(2014)088","CALT-68-2867","hep-th","http://arxiv.org/licenses/nonexclusive-distrib/1.0/","  It is conjectured that the world-volume action of a probe D3-brane in an
$AdS_5 \times S^5$ background of type IIB superstring theory, with one unit of
flux, can be reinterpreted as the exact effective action (or highly effective
action) for U(2), ${\cal N} = 4$ super Yang-Mills theory on the Coulomb branch.
An analogous conjecture for $U(2)_k \times U(2)_{-k} $ ABJM theory is also
presented. The main evidence supporting these conjectures is that the brane
actions have all of the expected symmetries and dualities. Highly effective
actions have general coordinate invariance, even though they describe
nongravitational theories.
","[{""version"":""v1"",""created"":""Fri, 1 Nov 2013 21:01:41 GMT""},{""version"":""v2"",""created"":""Fri, 22 Nov 2013 22:14:58 GMT""}]","2015-06-17"
"1311.0306","Yury Zinoviev M.","Yury M. Zinoviev","The relativistic causal Newton gravity law vs general relativity","18 pages. arXiv admin note: substantial text overlap with
  arXiv:1201.3452",,,"SMI - 2013 - 117","math-ph math.MP","http://arxiv.org/licenses/nonexclusive-distrib/1.0/","  The equations of the relativistic causal Newton gravity law for the planets
of the solar system are studied in the approximation when the Sun rests at the
coordinate origin and the planets do not interact between each other. The
planet orbits of general relativity are also studied in the same approximation.
","[{""version"":""v1"",""created"":""Fri, 1 Nov 2013 21:03:04 GMT""}]","2013-11-05"
"1311.0307","Eric Lock","Eric F. Lock and David B. Dunson","Shared kernel Bayesian screening","Author version of article published in Biometrika; 23 pages, 9
  figures","Biometrika 102(4), 829-842, 2015","10.1093/biomet/asv032",,"stat.ME","http://arxiv.org/licenses/nonexclusive-distrib/1.0/","  This article concerns testing for equality of distribution between groups. We
focus on screening variables with shared distributional features such as common
support, modes and patterns of skewness. We propose a Bayesian testing method
using kernel mixtures, which improves performance by borrowing information
across the different variables and groups through shared kernels and a common
probability of group differences. The inclusion of shared kernels in a finite
mixture, with Dirichlet priors on the weights, leads to a simple framework for
testing that scales well for high-dimensional data. We provide closed
asymptotic forms for the posterior probability of equivalence in two groups and
prove consistency under model misspecification. The method is applied to DNA
methylation array data from a breast cancer study, and compares favorably to
competitors when type I error is estimated via permutation.
","[{""version"":""v1"",""created"":""Fri, 1 Nov 2013 21:03:07 GMT""},{""version"":""v2"",""created"":""Tue, 15 Apr 2014 18:25:38 GMT""},{""version"":""v3"",""created"":""Wed, 17 Feb 2016 22:31:44 GMT""}]","2016-02-19"
"1311.0308","Andrew Boothroyd","Y. F. Guo, A. J. Princep, X. Zhang, P. Manuel, D. Khalyavin, I. I.
  Mazin, Y. G. Shi, A. T. Boothroyd","Coupling of magnetic order to planar Bi electrons in the anisotropic
  Dirac metals AMnBi2 (A = Sr, Ca)","Accepted for publication in Physical Review B. Version 2 includes
  additional sample characterisation and bulk measurements, and ab initio
  electronic structure calculations","Phys. Rev. B 90, 075120 (2014)","10.1103/PhysRevB.90.075120",,"cond-mat.str-el","http://arxiv.org/licenses/nonexclusive-distrib/1.0/","  We report powder and single crystal neutron diffraction measurements of the
magnetic order in AMnBi2 (A = Sr and Ca), two layered manganese pnictides with
anisotropic Dirac fermions on a Bi square net. Both materials are found to
order at TN approx 300 K in k = 0 antiferromagnetic structures, with ordered Mn
moments at T = 10 K of approximately 3.8 muB aligned along the c axis. The
magnetic structures are Neel-type within the Mn--Bi layers but the inter-layer
ordering is different, being antiferromagnetic in SrMnBi2 and ferromagnetic in
CaMnBi2. This allows a mean-field coupling of the magnetic order to Bi
electrons in CaMnBi2 but not in SrMnBi2. We find clear evidence that magnetic
order influences electrical transport. First principles calculations explain
the experimental observations and suggest that the mechanism for different
inter-layer ordering in the two compounds is the competition between the
anteiferromagnetic superexchange and ferromagnetic double exchange carried by
itinerant Bi electrons.
","[{""version"":""v1"",""created"":""Fri, 1 Nov 2013 21:04:01 GMT""},{""version"":""v2"",""created"":""Sat, 26 Jul 2014 13:42:55 GMT""}]","2014-08-20"
"1311.0309","Alexei Yu. Pirkovskii","A. Yu. Pirkovskii","Quantum polydisk, quantum ball, and a q-analog of Poincar\'e's theorem","16 pages",,"10.1088/1742-6596/474/1/012026",,"math.FA math.QA math.RA","http://arxiv.org/licenses/nonexclusive-distrib/1.0/","  The classical Poincar\'e theorem (1907) asserts that the polydisk $\mathbb
D^n$ and the ball $\mathbb B^n$ in $\mathbb C^n$ are not biholomorphically
equivalent for $n\ge 2$. Equivalently, this means that the Fr\'echet algebras
$\mathcal O(\mathbb D^n)$ and $\mathcal O(\mathbb B^n)$ of holomorphic
functions are not topologically isomorphic. Our goal is to prove a
noncommutative version of the above result. Given $q\in\mathbb C\setminus\{
0\}$, we define two noncommutative power series algebras $\mathcal O_q(\mathbb
D^n)$ and $\mathcal O_q(\mathbb B^n)$, which can be viewed as $q$-analogs of
$\mathcal O(\mathbb D^n)$ and $\mathcal O(\mathbb B^n)$, respectively. Both
$\mathcal O_q(\mathbb D^n)$ and $\mathcal O_q(\mathbb B^n)$ are the completions
of the algebraic quantum affine space $\mathcal O_q^{\mathrm{reg}}(\mathbb
C^n)$ w.r.t. certain families of seminorms. In the case where $0<q<1$, the
algebra $\mathcal O_q(\mathbb B^n)$ admits an equivalent definition related to
L. L. Vaksman's algebra of continuous functions on the closed quantum ball. We
show that both $\mathcal O_q(\mathbb D^n)$ and $\mathcal O_q(\mathbb B^n)$ can
be interpreted as Fr\'echet algebra deformations (in a suitable sense) of
$\mathcal O(\mathbb D^n)$ and $\mathcal O(\mathbb B^n)$, respectively. Our main
result is that $\mathcal O_q(\mathbb D^n)$ and $\mathcal O_q(\mathbb B^n)$ are
not isomorphic if $n\ge 2$ and $|q|=1$, but are isomorphic if $|q|\ne 1$.
","[{""version"":""v1"",""created"":""Fri, 1 Nov 2013 21:07:55 GMT""}]","2015-06-17"
"1311.0310","Markus Kromer","M. Kromer, R. Pakmor, S. Taubenberger, G. Pignata, M. Fink, F.K.
  Roepke, I.R. Seitenzahl, S.A. Sim, W. Hillebrandt","SN 2010lp---a Type Ia supernova from a violent merger of two
  carbon--oxygen White Dwarfs","6 pages, 5 figures, accepted for publication in ApJL",,"10.1088/2041-8205/778/1/L18",,"astro-ph.HE astro-ph.SR","http://arxiv.org/licenses/nonexclusive-distrib/1.0/","  SN 2010lp is a subluminous Type Ia supernova (SN Ia) with slowly-evolving
lightcurves. Moreover, it is the only subluminous SN Ia observed so far that
shows narrow emission lines of OI in late-time spectra, indicating unburned
oxygen close to the centre of the ejecta. Most explosion models for SNe Ia
cannot explain the narrow OI emission. Here, we present hydrodynamic explosion
and radiative transfer calculations showing that the violent merger of two
carbon-oxygen white dwarfs of 0.9 and 0.76 solar masses, respectively,
adequately reproduces the early-time observables of SN 2010lp. Moreover, our
model predicts oxygen close to the centre of the explosion ejecta, a
pre-requisite for narrow OI emission in nebular spectra as observed in SN
2010lp.
","[{""version"":""v1"",""created"":""Fri, 1 Nov 2013 21:12:48 GMT""}]","2015-06-17"
"1311.0311","Nadia L. Zakamska","Matthew J. Hill, Nadia L. Zakamska (Johns Hopkins University)","Warm molecular hydrogen in outflows from Ultraluminous Infrared Galaxies","16 pages, MNRAS accepted. Complete data tables and Spitzer spectra
  are available at http://www.pha.jhu.edu/~zakamska/ULIRGS/",,"10.1093/mnras/stu123",,"astro-ph.CO","http://arxiv.org/licenses/nonexclusive-distrib/1.0/","  Ultraluminous infrared galaxies (ULIRGs) show on average three times more
emission in the rotational transitions of molecular hydrogen than expected
based on their star formation rates. Using Spitzer archival data we investigate
the origin of excess warm H_2 emission in 115 ULIRGs of the IRAS 1 Jy sample.
We find a strong correlation between H_2 and [FeII] line luminosities,
suggesting that excess H_2 is produced in shocks propagating within neutral or
partially ionized medium. This view is supported by the correlations between
H_2 and optical line ratios diagnostic of such shocks. The galaxies powered by
star formation and those powered by active nuclei follow the same relationship
between H_2 and [FeII], with emission line width being the major difference
between these classes (about 500 and 1000 km/sec, respectively). We conclude
that excess H_2 emission is produced as the supernovae and active nuclei drive
outflows into the neutral interstellar medium of the ULIRGs. A weak positive
correlation between H_2 and the length of the tidal tails indicates that these
outflows are more likely to be encountered in more advanced mergers, but there
is no evidence for excess H_2 produced as a result of the collision shocks
during the final coalescence.
","[{""version"":""v1"",""created"":""Fri, 1 Nov 2013 21:13:30 GMT""},{""version"":""v2"",""created"":""Fri, 17 Jan 2014 03:43:43 GMT""}]","2015-06-17"
"1311.0312","Massimiliano Gei","Massimiliano Gei, Roberta Springhetti, Eliana Bortot","Performance of soft dielectric laminated composites",,,"10.1088/0964-1726/22/10/104014",,"cond-mat.soft","http://arxiv.org/licenses/nonexclusive-distrib/1.0/","  This paper contains a thorough investigation of the performance of
electrically activated layered soft dielectric composite actuators under plane
deformation. Noting that the activation can be induced controlling either the
voltage or the surface charge, the overall behaviour of the system is obtained
via homogenization at large strains taking either the macroscopic electric
field or the macroscopic electric displacement field as independent electrical
variable. The performance of a two-phase composite actuator compared to that of
the homogeneous case is highlighted for few boundary-value problems and for
different values of stiffness and permittivity ratios between constituents
being significant for applications, where the soft matrix is reinforced by a
relatively small volume fraction of a stiff and high-permittivity phase. For
charge-controlled devices, it is shown that some composite layouts admit, on
one hand, the occurrence of pull-in/snap-through instabilities that can be
exploited to design release-actuated systems, on the other, the possibility of
thickening at increasing surface charge density.
","[{""version"":""v1"",""created"":""Fri, 1 Nov 2013 21:18:58 GMT""}]","2015-06-17"
