"1311.0336","Young Ki Kim Mr","Young-Ki Kim, Bohdan Senyuk, Sung-Tae Shin, Alexandra Kohlmeier, Georg
  H. Mehl, and Oleg D. Lavrentovich","Surface Alignment, Anchoring Transitions, Optical Properties, and
  Topological Defects in the Thermotropic Nematic Phase of an Organo-Siloxane
  Tetrapodes","12 pages, 14 figures",,,,"cond-mat.soft cond-mat.mtrl-sci physics.optics","http://creativecommons.org/licenses/by-nc-sa/3.0/","  We perform optical, surface anchoring, and textural studies of an
organo-siloxane tetrapode material in the broad temperature range of the
nematic phase. The optical, structural, and topological features are compatible
with the uniaxial nematic order rather than with the biaxial nematic order, in
the entire nematic temperature range -25C < T < 46C studied. For homeotropic
alignment, the material experiences surface anchoring transition, but the
director can be realigned into an optically uniaxial texture by applying a
sufficiently strong electric field. The topological features of textures in
cylindrical capillaries, in spherical droplets and around colloidal inclusions
are consistent with the uniaxial character of the long-range nematic order. In
particular, we observe isolated surface point defect-boojums and bulk point
defects-hedgehog that can exist only in the uniaxial nematic.
","[{""version"":""v1"",""created"":""Sat, 2 Nov 2013 03:59:45 GMT""}]","2013-11-05"
"1311.0337","Susanne Stemmer","Clayton A. Jackson and Susanne Stemmer","Interface-induced magnetism in perovskite quantum wells","Accepted for publication as a Rapid Communication in Physical Review
  B","Physical Review B 88, 180403(R) (2013)","10.1103/PhysRevB.88.180403",,"cond-mat.mes-hall cond-mat.mtrl-sci","http://arxiv.org/licenses/nonexclusive-distrib/1.0/","  We investigate the angular dependence of the magnetoresistance of thin (< 1
nm), metallic SrTiO3 quantum wells epitaxially embedded in insulating,
ferrimagnetic GdTiO3 and insulating, antiferromagnetic SmTiO3, respectively.
The SrTiO3 quantum wells contain a high density of mobile electrons (~7x10^14
cm^-2). We show that the longitudinal and transverse magnetoresistance in the
structures with GdTiO3 are consistent with anisotropic magnetoresistance, and
thus indicative of induced ferromagnetism in the SrTiO3, rather than a
nonequilibrium proximity effect. Comparison with the structures with
antiferromagnetic SmTiO3 shows that the properties of thin SrTiO3 quantum wells
can be tuned to obtain magnetic states that do not exist in the bulk material.
","[{""version"":""v1"",""created"":""Sat, 2 Nov 2013 04:18:44 GMT""}]","2013-11-26"
"1311.0338","Robert Roundy","R. C. Roundy, D. Nemirovsky, V. Kagalovsky, and M. E. Raikh","Giant fluctuations of local magnetoresistance of organic spin valves and
  non-hermitian 1D Anderson model","5 pages, 3 figures, supplemental material","Phys. Rev. Lett. 112, 226601 (2014)","10.1103/PhysRevLett.112.226601",,"cond-mat.mes-hall","http://arxiv.org/licenses/nonexclusive-distrib/1.0/","  Motivated by recent experiments, where the tunnel magnetoresitance (TMR) of a
spin valve was measured locally, we theoretically study the distribution of TMR
along the surface of magnetized electrodes. We show that, even in the absence
of interfacial effects (like hybridization due to donor and acceptor
molecules), this distribution is very broad, and the portion of area with
negative TMR is appreciable even if on average the TMR is positive. The origin
of the local sign reversal is quantum interference of subsequent spin-rotation
amplitudes in course of incoherent transport of carriers between the source and
the drain. We find the distribution of local TMR exactly by drawing upon formal
similarity between evolution of spinors in time and of reflection coefficient
along a 1D chain in the Anderson model. The results obtained are confirmed by
the numerical simulations.
","[{""version"":""v1"",""created"":""Sat, 2 Nov 2013 04:31:48 GMT""},{""version"":""v2"",""created"":""Tue, 5 Nov 2013 01:16:27 GMT""}]","2015-06-17"
"1311.0339","Sonali Goyal","Sonali Gupta, Komal Kumar Bhatia","A Novel Term Weighing Scheme Towards Efficient Crawl of Textual
  Databases","12 Pages. IJCEA, 2013",,,,"cs.IR","http://arxiv.org/licenses/nonexclusive-distrib/1.0/","  The Hidden Web is the vast repository of informational databases available
only through search form interfaces, accessible by therein typing a set of
keywords in the search forms. Typically, a Hidden Web crawler is employed to
autonomously discover and download pages from the Hidden Web. Traditional
hidden web crawlers do not provide the search engines with an optimal search
experience because of the excessive number of search requests posed through the
form interface so as to exhaustively crawl and retrieve the contents of the
target hidden web database. Here in our work, we provide a framework to
investigate the problem of optimal search and curtail it by proposing an
effective query term selection approach based on the frequency & distribution
of terms in the document database. The paper focuses on developing a
term-weighing scheme called VarDF (acronym for variable document frequency)
that can ease the identification of optimal terms to be used as queries on the
interface for maximizing the achieved coverage of the crawler which in turn
will facilitate the search engine to have a diversified and expanded index. We
experimentally evaluate the effectiveness of our approach on a manually created
database of documents in the area of Information Retrieval.
","[{""version"":""v1"",""created"":""Sat, 2 Nov 2013 04:45:36 GMT""}]","2013-11-05"
"1311.0340","Shikma Bressler","S. Bressler, L. Moleri, L. Arazi, E. Erdal, A. Rubin, M. Pitt and A.
  Breskin","A concept for laboratory studies of radiation detectors over a broad
  dynamic-range: instabilities evaluation in THGEM-structures",,,"10.1088/1748-0221/9/03/P03005",,"physics.ins-det","http://arxiv.org/licenses/nonexclusive-distrib/1.0/","  A simple methodology for evaluating the dynamic-range of gas avalanche
detectors in the laboratory is presented and discussed. It comprises two tools:
a charge injector of tunable gain which transfers radiation-induced amplified
electron swarms to the investigated detector to mimic events with well defined
primary-ionization spectra, and a systematic approach for measuring the
detector's discharge probability. The methodology, applicable to a broad range
of detectors, is applied here for instability studies in various single-stage
THGEM and THGEM-WELL structures. The results indicate upon a somewhat larger
attainable dynamic range in a single-stage THGEM operated with additional
multiplication in the induction gap.
","[{""version"":""v1"",""created"":""Sat, 2 Nov 2013 04:48:10 GMT""},{""version"":""v2"",""created"":""Tue, 5 Nov 2013 13:00:13 GMT""}]","2015-06-17"
"1311.0341","Tevian Dray","Tevian Dray, Corinne A. Manogue, and Robert A. Wilson","A Symplectic Representation of $\mathrm{E}_7$","12 pages; 2 double figures","Comment. Math. Univ. Carolin. 55, 387-399 (2014)",,,"math.RA","http://arxiv.org/licenses/nonexclusive-distrib/1.0/","  We explicitly construct a particular real form of the Lie algebra
$\mathfrak{e}_7$ in terms of symplectic matrices over the octonions, thus
justifying the identifications $\mathfrak{e}_7\cong\mathfrak{sp}(6,\mathbb{O})$
and, at the group level, $\mathrm{E}_7\cong\mathrm{Sp}(6,\mathbb{O})$. Along
the way, we provide a geometric description of the minimal representation of
$\mathfrak{e}_7$ in terms of rank 3 objects called cubies.
","[{""version"":""v1"",""created"":""Sat, 2 Nov 2013 04:54:43 GMT""}]","2014-08-14"
"1311.0342","Shi-Zeng Lin","Shi-Zeng Lin and Cristian D. Batista","Orbital Magnetism Induced by Heat Currents in Mott insulators","4.3 pages and 3 figures","Phys. Rev. Lett. 111, 166602 (2013)","10.1103/PhysRevLett.111.166602",,"cond-mat.str-el","http://arxiv.org/licenses/nonexclusive-distrib/1.0/","  We derive the effective heat current density operator for the strong-coupling
regime of Mott insulators. Similarly to the case of the electric current
density, the leading contribution to this effective operator is proportional to
the local scalar spin chirality $\hat{\chi}_{jkl}=
\mathbf{S}_l\cdot\left(\mathbf{S}_j\times \mathbf{S}_k\right)$. This common
form of the effective heat and electric current density operators leads to a
novel cross response in Mott insulators. A heat current induces a distribution
of orbital magnetic moments in systems containing loops of an odd number of
hopping terms. The relative orientation of the orbital moments depends on the
particular lattice of magnetic ions. This subtle effect arises from the
symmetries that the heat and electric currents have in common.
","[{""version"":""v1"",""created"":""Sat, 2 Nov 2013 05:05:14 GMT""}]","2013-11-05"
"1311.0343","Robin Willink","R. Willink and B. D. Hall","An extension to GUM methodology: degrees-of-freedom calculations for
  correlated multidimensional estimates","30 pages with 2 embedded figures",,,,"physics.data-an stat.AP stat.ME","http://arxiv.org/licenses/nonexclusive-distrib/1.0/","  The Guide to the Expression of Uncertainty in Measurement advocates the use
of an 'effective number of degrees of freedom' for the calculation of an
interval of measurement uncertainty. However, it does not describe how this
number is to be calculated when (i) the measurand is a vector quantity or (ii)
when the errors in the estimates of the quantities defining the measurand (the
'input quantities') are not incurred independently. An appropriate analysis for
a vector-valued measurand has been described (Metrologia 39 (2002) 361-9), and
a method for a one-dimensional measurand with dependent errors has also been
given (Metrologia 44 (2007) 340-9). This paper builds on those analyses to
present a method for the situation where the problem is multidimensional and
involves correlated errors. The result is an explicit general procedure that
reduces to simpler procedures where appropriate. The example studied is from
the field of radio-frequency metrology, where measured quantities are often
complex-valued and can be regarded as vectors of two elements.
","[{""version"":""v1"",""created"":""Sat, 2 Nov 2013 05:06:06 GMT""}]","2013-11-05"
"1311.0344","Fumitaka Kagawa","F. Kagawa, T. Sato, K. Miyagawa, K. Kanoda, Y. Tokura, K. Kobayashi,
  R. Kumai, Y. Murakami","Charge-cluster glass in an organic conductor","21 pages, 3 figures (supplementary information included)","Nature Phys. 9, 419 (2013)","10.1038/nphys2642",,"cond-mat.str-el","http://arxiv.org/licenses/nonexclusive-distrib/1.0/","  Geometrically frustrated spin systems often do not exhibit long-range
ordering, resulting in either quantum-mechanically disordered states, such as
quantum spin liquids, or classically disordered states, such as spin ices or
spin glasses. Geometric frustration may play a similar role in charge ordering,
potentially leading to unconventional electronic states without long-range
order; however, there are no previous experimental demonstrations of this
phenomenon. Here, we show that a charge-cluster glass evolves upon cooling in
the absence of long-range charge ordering for an organic conductor with a
triangular lattice, theta-(BEDT-TTF)2RbZn(SCN)4. A combination of time-resolved
transport measurements and x-ray diffraction reveal that the charge-liquid
phase has charge clusters that fluctuate extremely slowly (<10-100 Hz) and
heterogeneously. Upon further cooling, the cluster dynamics freeze, and a
charge-cluster glass is formed. Surprisingly, these observations correspond to
recent ideas regarding the structural glass formation of supercooled liquids,
indicating that a glass-forming charge liquid relates correlated-electron
physics to glass physics in soft matter.
","[{""version"":""v1"",""created"":""Sat, 2 Nov 2013 05:12:37 GMT""},{""version"":""v2"",""created"":""Wed, 6 Nov 2013 13:59:12 GMT""}]","2013-11-07"
"1311.0345","Sudev Naduvath","N K Sudev and K A Germina","On the Sparing Number of Certain Graph Structures","12 pages, 5 figures. arXiv admin note: text overlap with
  arXiv:1310.6091","Annals of Pure and Applied Mathematics, Vol. 6 No.2, 2014,
  pp-140-149",,"Kannur Univ/Math/G&S-05/2013","math.CO","http://arxiv.org/licenses/nonexclusive-distrib/1.0/","  An integer additive set-indexer is defined as an injective function
$f:V(G)\rightarrow 2^{\mathbb{N}_0}$ such that the induced function $g_f:E(G)
\rightarrow 2^{\mathbb{N}_0}$ defined by $g_f (uv) = f(u)+ f(v)$ is also
injective. An IASI $f$ is said to be a weak IASI if
$|g_f(uv)|=max(|f(u)|,|f(v)|)$ for all $u,v\in V(G)$. A graph which admits a
weak IASI may be called a weak IASI graph. The set-indexing number of an
element of a graph $G$, a vertex or an edge, is the cardinality of its
set-labels. A mono-indexed element of a graph is an element of $G$ which has
the set-indexing number $1$. The Sparing number of a graph $G$ is the minimum
number of mono-indexed edges required for a graph $G$ to admit a weak IASI. In
this paper, we introduce the notion of conjoined graphs, entwined graphs and
floral graphs and study further about the sparing number of various finite
graph operations as extensions to our earlier studies and provide some useful
results on these types of graph structures.
","[{""version"":""v1"",""created"":""Sat, 2 Nov 2013 05:27:48 GMT""},{""version"":""v2"",""created"":""Thu, 30 Jan 2014 17:27:38 GMT""},{""version"":""v3"",""created"":""Fri, 31 Jan 2014 01:32:24 GMT""},{""version"":""v4"",""created"":""Sat, 1 Mar 2014 16:07:33 GMT""}]","2014-07-03"
"1311.0346","Sang-Koog Kim Prof.","Sang-Koog Kim, Myoung-Woo Yoo, Jehyun Lee, Ha-Youn Lee, Jae-Hyeok Lee,
  Yuri Gaididei, Volodymyr P. Kravchuk, and Denis D. Sheka","Resonantly exited precession motion of three-dimensional vortex core in
  magnetic nanospheres","23 pages, 6 figures",,,,"cond-mat.mes-hall","http://arxiv.org/licenses/nonexclusive-distrib/1.0/","  We found resonantly excited precession motions of a three-dimensional vortex
core in soft magnetic nanospheres and controllable precession frequency with
the sphere diameter 2R, as studied by micromagnetic numerical and analytical
calculations. The precession angular frequency for an applied static field
$H_{DC}$ is given as $\omega_{MV}= \gamma_{eff} H_{DC}$, where $\gamma_{eff} =
\gamma <m_{\Gamma}>$ is the effective gyromagnetic ratio in collective vortex
dynamics, with the gyromagnetic ratio $\gamma$ and the average magnetization
component $<m_{\Gamma}>$ of the ground-state vortex in the core direction.
Fitting to the micromagnetic simulation data for $<m_{\Gamma}>$ yields a simple
explicit form of $<m_{\Gamma}> = (73.6 \pm 3.4)(l_{ex}/2R)^{2.20 \pm 0.14}$,
where $l_{ex}$ is the exchange length of a given material. This dynamic
behavior might serve as a foundation for potential bio-applications of
size-specific resonant excitation of magnetic vortex-state nanoparticles, for
example, magnetic particle resonance imaging.
","[{""version"":""v1"",""created"":""Sat, 2 Nov 2013 05:39:19 GMT""},{""version"":""v2"",""created"":""Wed, 25 Jun 2014 09:37:55 GMT""},{""version"":""v3"",""created"":""Tue, 3 Mar 2015 02:24:00 GMT""}]","2015-03-04"
"1311.0347","Behrouz Jedari","Behrouz Jedari and Feng Xia","A Survey on Routing and Data Dissemination in Opportunistic Mobile
  Social Networks","This paper has been withdrawn by the author due to a crucial sign
  error in figures 4 and 5 25 pages, 12 figures, 12 tables. arXiv admin note:
  previous versions contained much plagiarized material",,"10.1109/SURV.2014.022714.00153",,"cs.NI cs.SI","http://arxiv.org/licenses/nonexclusive-distrib/1.0/","  Opportunistic mobile social networks (MSNs) are modern paradigms of delay
tolerant networks that consist of mobile users with social characteristics. The
users in MSNs communicate with each other to share data objects. In this
setting, humans are the carriers of mobile devices, hence their social features
such as movement patterns, similarities, and interests can be exploited to
design efficient data forwarding algorithms. In this paper, an overview of
routing and data dissemination issues in the context of opportunistic MSNs is
presented, with focus on (1) MSN characteristics, (2) human mobility models,
(3) dynamic community detection methods, and (4) routing and data dissemination
protocols. Firstly, characteristics of MSNs which lead to the exposure of
patterns of interaction among mobile users are examined. Secondly, properties
of human mobility models are discussed and recently proposed mobility models
are surveyed. Thirdly, community detection and evolution analysis algorithms
are investigated. Then, a comparative review of state-of-the-art routing and
data dissemination algorithms for MSNs is presented, with special attention
paid to critical issues like context-awareness and user selfishness. Based on
the literature review, some important open issues are finally discussed.
","[{""version"":""v1"",""created"":""Sat, 2 Nov 2013 05:53:54 GMT""},{""version"":""v2"",""created"":""Wed, 13 Nov 2013 00:32:39 GMT""},{""version"":""v3"",""created"":""Tue, 26 Nov 2013 01:10:20 GMT""},{""version"":""v4"",""created"":""Wed, 5 Mar 2014 02:49:08 GMT""},{""version"":""v5"",""created"":""Tue, 24 Jun 2014 06:54:04 GMT""}]","2014-07-31"
"1311.0348","Zhun Lu","Zhun Lu","Inflation in the Generalized Inverse Power Law Scenario","9 pages, to appear in JCAP",,"10.1088/1475-7516/2013/11/038",,"hep-th astro-ph.CO gr-qc hep-ph","http://arxiv.org/licenses/nonexclusive-distrib/1.0/","  We propose a single field inflationary model by generalizing the inverse
power law potential from the intermediate model. We study the implication of
our model on the primordial anisotropy of cosmological microwave background
radiation. Specifically, we apply the slow-roll approximation to calculate the
scalar spectral tilt $n_s$ and the tensor-to-scalar ratio $r$. The results are
compared with the recent data measured by the Planck satellite. We found that
by choosing proper values for the parameters, our model can well describe the
Planck data.
","[{""version"":""v1"",""created"":""Sat, 2 Nov 2013 06:31:28 GMT""}]","2015-06-17"
"1311.0349","Mark Hoefer Dr.","M. D. Maiden, L. D. Bookman, M. A. Hoefer","Attraction, Merger, Reflection, and Annihilation in Magnetic Droplet
  Soliton Scattering","5 pages, 3 figures","Physical Review B, Rapid Communications, 89, 180409(R) (2014)","10.1103/PhysRevB.89.180409",,"cond-mat.mes-hall nlin.PS","http://arxiv.org/licenses/nonexclusive-distrib/1.0/","  The interaction behavior of solitons are defining characteristics of these
nonlinear, coherent structures. Due to recent experimental observations, thin
ferromagnetic films offer a promising medium in which to study the scattering
properties of two-dimensional magnetic droplet solitons, particle-like,
precessing dipoles. Here, a rich set of two-droplet interaction behaviors are
classified through micromagnetic simulations. Repulsive and attractive
interaction dynamics are generically determined by the relative phase and
speeds of the two droplets and can be classified into four types: (1) merger
into a breather bound state, (2) counterpropagation trapped along the axis of
symmetry, (3) reflection, and (4) violent droplet annihilation into spin wave
radiation and a breather. Utilizing a nonlinear method of images, it is
demonstrated that these dynamics describe repulsive/attractive scattering of a
single droplet off of a magnetic boundary with pinned/free spin boundary
conditions, respectively. These results explain the mechanism by which
propagating and stationary droplets can be stabilized in a confined
ferromagnet.
","[{""version"":""v1"",""created"":""Sat, 2 Nov 2013 06:34:37 GMT""},{""version"":""v2"",""created"":""Wed, 2 Apr 2014 15:04:35 GMT""},{""version"":""v3"",""created"":""Fri, 25 Apr 2014 16:31:29 GMT""}]","2014-07-18"
"1311.0350","Thabet Slimani","Thabet Slimani, Amor Lazzez","Sequential Mining: Patterns and Algorithms Analysis","10 pages","International Journal of Computer and Electronics Research, Volume
  2, Issue 5, October 2013, pp 639-647",,,"cs.DB","http://arxiv.org/licenses/nonexclusive-distrib/1.0/","  This paper presents and analysis the common existing sequential pattern
mining algorithms. It presents a classifying study of sequential pattern-mining
algorithms into five extensive classes. First, on the basis of Apriori-based
algorithm, second on Breadth First Search-based strategy, third on Depth First
Search strategy, fourth on sequential closed-pattern algorithm and five on the
basis of incremental pattern mining algorithms. At the end, a comparative
analysis is done on the basis of important key features supported by various
algorithms. This study gives an enhancement in the understanding of the
approaches of sequential pattern mining.
","[{""version"":""v1"",""created"":""Sat, 2 Nov 2013 06:55:10 GMT""}]","2013-11-05"
"1311.0351","Bin Yang","Bin Yang, Hong Zhao and William Zhu","Rough matroids based on coverings","15pages",,,,"cs.AI","http://arxiv.org/licenses/nonexclusive-distrib/1.0/","  The introduction of covering-based rough sets has made a substantial
contribution to the classical rough sets. However, many vital problems in rough
sets, including attribution reduction, are NP-hard and therefore the algorithms
for solving them are usually greedy. Matroid, as a generalization of linear
independence in vector spaces, it has a variety of applications in many fields
such as algorithm design and combinatorial optimization. An excellent
introduction to the topic of rough matroids is due to Zhu and Wang. On the
basis of their work, we study the rough matroids based on coverings in this
paper. First, we investigate some properties of the definable sets with respect
to a covering. Specifically, it is interesting that the set of all definable
sets with respect to a covering, equipped with the binary relation of inclusion
$\subseteq$, constructs a lattice. Second, we propose the rough matroids based
on coverings, which are a generalization of the rough matroids based on
relations. Finally, some properties of rough matroids based on coverings are
explored. Moreover, an equivalent formulation of rough matroids based on
coverings is presented. These interesting and important results exhibit many
potential connections between rough sets and matroids.
","[{""version"":""v1"",""created"":""Sat, 2 Nov 2013 06:58:46 GMT""},{""version"":""v2"",""created"":""Tue, 5 Nov 2013 01:29:01 GMT""}]","2013-11-06"
"1311.0352","John-John Cabibihan","John-John Cabibihan, Hifza Javed, Marcelo Ang Jr., and Sharifah Mariam
  Aljunied","Why robots? A survey on the roles and benefits of social robots in the
  therapy of children with autism",,"International Journal of Social Robotics, 2013, 5(4), 593-618","10.1007/s12369-013-0202-2",,"cs.RO cs.CY cs.HC","http://creativecommons.org/licenses/by-nc-sa/3.0/","  This paper reviews the use of socially interactive robots to assist in the
therapy of children with autism. The extent to which the robots were successful
in helping the children in their social, emotional, and communication deficits
was investigated. Child-robot interactions were scrutinized with respect to the
different target behaviors that are to be elicited from a child during therapy.
These behaviors were thoroughly examined with respect to a childs development
needs. Most importantly, experimental data from the surveyed works were
extracted and analyzed in terms of the target behaviors and how each robot was
used during a therapy session to achieve these behaviors. The study concludes
by categorizing the different therapeutic roles that these robots were observed
to play, and highlights the important design features that enable them to
achieve high levels of effectiveness in autism therapy.
","[{""version"":""v1"",""created"":""Sat, 2 Nov 2013 07:15:08 GMT""}]","2013-11-05"
"1311.0353","Chi-Te Liang","Chiashain Chuang, Li-Hung Lin, Nobuyuki Aoki, Takahiro Ouchi, Akram M.
  Mahjoub, Tak-Pong Woo, J. P. Bird, Yuichi Ochiai, Shun-Tsung Lo, and Chi-Te
  Liang","Experimental evidence for direct insulator-quantum Hall transition in
  multi-layer graphene","4 figures","Nanoscale Research Letters 8, 214 (2013)","10.1186/1556-276X-8-214",,"cond-mat.mes-hall cond-mat.dis-nn","http://arxiv.org/licenses/nonexclusive-distrib/1.0/","  We have performed magnetotransport measurements on a multi-layer graphene
flake. At the crossing magnetic field Bc, an approximately
temperature-independent point in the measured longitudinal resistivity, which
is ascribed to the direct insulator-quantum Hall (I-QH) transition, is
observed. By analyzing the amplitudes of the magnetoresistivity oscillations,
we are able to measure the quantum mobility of our device. It is found that at
the direct I-QH transition, the product of the quantum mobility and is about
0.37 which is considerably smaller than 1. In contrast, at Bc, the longitudinal
resistivity is close to the Hall resistivity, i.e., the product of the
classical mobility and the crossing field is about 1. Therefore our results
suggest that different mobilities need to be introduced for the direct I-QH
transition observed in multi-layered graphene. Combined with existing
experimental results obtained in various material systems, our data obtained on
graphene suggest that the direct I-QH transition is a universal effect in 2D.
","[{""version"":""v1"",""created"":""Sat, 2 Nov 2013 07:38:00 GMT""}]","2013-11-05"
