"1311.6282","Johannes Pfefferer","Johannes Pfefferer and Klaus Krumbiegel","Superconvergence for Neumann boundary control problems governed by
  semilinear elliptic equations",,,"10.1007/s10589-014-9718-0",,"math.NA math.OC","http://arxiv.org/licenses/nonexclusive-distrib/1.0/","  This paper is concerned with the discretization error analysis of semilinear
Neumann boundary control problems in polygonal domains with pointwise
inequality constraints on the control. The approximations of the control are
piecewise constant functions. The state and adjoint state are discretized by
piecewise linear finite elements. In a postprocessing step approximations of
locally optimal controls of the continuous optimal control problem are
constructed by the projection of the respective discrete adjoint state.
Although the quality of the approximations is in general affected by corner
singularities a convergence order of $h^2|\ln h|^{3/2}$ is proven for domains
with interior angles smaller than $2\pi/3$ using quasi-uniform meshes. For
larger interior angles mesh grading techniques are used to get the same order
of convergence.
","[{""version"":""v1"",""created"":""Mon, 25 Nov 2013 12:47:21 GMT""}]","2015-05-12"
"1311.6283","Andriy Leonov A","A. O. Leonov, U. K. R\""o{\ss}ler, and M. Mostovoy","Target-skyrmions and skyrmion clusters in nanowires of chiral magnets",,"EPJ Web of Conferences 75, 05002 (2014)","10.1051/epjconf/20147505002",,"cond-mat.mes-hall","http://arxiv.org/licenses/nonexclusive-distrib/1.0/","  In bulk non-centrosymmetric magnets the chiral Dzyaloshinskii-Moriya exchange
stabilizes tubular skyrmions with a reversed magnetization in their centers.
While the double-twist is favorable in the center of a skyrmion, it gives rise
to an excess of the energy density at the outskirt. Therefore, magnetic
anisotropies are required to make skyrmions more favorable than the conical
spiral state in bulk materials. Using Monte Carlo simulations, we show that in
magnetic nanowires unusual skyrmions with a doubly twisted core and a number of
concentric helicoidal undulations (target-skyrmions) are thermodynamically
stable even in absence of single-ion anisotropies. Such skyrmions are free of
magnetic charges and, since the angle describing the direction of magnetization
at the surface depends on the radius of the nanowire and an applied magnetic
field, they carry a non-integer skyrmion charge s > 1. This state competes with
clusters of spatially separated s=1 skyrmions. For very small radii, the
target-skyrmion transforms into a skyrmion with s < 1, that resembles the
vortex-like state stabilized by surface-induced anisotropies.
","[{""version"":""v1"",""created"":""Mon, 25 Nov 2013 13:02:04 GMT""}]","2016-08-11"
"1311.6284","Yi-Cheng Huang","Yi-Cheng Huang","Cosmological Constant in the Imaginary-Time Field Theory","21 pages, 6 figures",,,,"gr-qc hep-th quant-ph","http://arxiv.org/licenses/nonexclusive-distrib/1.0/","  The origins of the cosmological constant are discussed from the perspective
of the imaginary-time field theory. The concept of the thermal time, which is
related to the Tolman-Ehrehfest relation, and the conformal invariance of the
actions are applied to account for the relation between the scale factor of the
FRW metric and the temperature of the vacuum. Finite values of the cosmological
constant from the DeWitt-Schwinger representation and the Casimir effect with a
large separation between two plates are derived. The induced energy density is
found to be uniform over the space and independent of the evolution of the
universe, and the equation of state ratio is indeed $w=-1$. From the point of
view presented here, the largest discrepancy of the vacuum energy between the
theoretical and the experimental sides can be conciliated. And the value of the
cosmological constant corresponds to a characteristic temperature of vacuum
determined by the history of the universe.
","[{""version"":""v1"",""created"":""Mon, 25 Nov 2013 13:05:26 GMT""},{""version"":""v2"",""created"":""Wed, 27 Nov 2013 02:41:54 GMT""}]","2013-11-28"
"1311.6285","Gisela Tartaglia","Guillermo Corti\~nas and Gisela Tartaglia","Compact operators and algebraic $K$-theory for groups which act properly
  and isometrically on Hilbert space","Final version, to appear in Journal f\""ur die reine und angewandte
  Mathematik",,,,"math.KT math.AT math.GR math.OA","http://arxiv.org/licenses/nonexclusive-distrib/1.0/","  We prove the $K$-theoretic Farrell-Jones conjecture for groups as in the
title with coefficient rings and $C^*$-algebras which are stable with respect
to compact operators. We use this and Higson-Kasparov's result that the
Baum-Connes conjecture with coefficients holds for such groups, to show that if
$G$ is as in the title then the algebraic and the $C^*$-crossed products of $G$
with a stable $C^*$-algebra have the same $K$-theory.
","[{""version"":""v1"",""created"":""Mon, 25 Nov 2013 13:09:27 GMT""},{""version"":""v2"",""created"":""Mon, 16 Dec 2013 13:36:43 GMT""},{""version"":""v3"",""created"":""Fri, 24 Jan 2014 12:25:08 GMT""},{""version"":""v4"",""created"":""Wed, 7 May 2014 07:15:32 GMT""},{""version"":""v5"",""created"":""Mon, 15 Dec 2014 17:58:22 GMT""}]","2014-12-16"
"1311.6286","Shailesh  Lal","Rajesh Kumar Gupta, Shailesh Lal, Somyadip Thakur","Heat Kernels on the AdS(2) cone and Logarithmic Corrections to Extremal
  Black Hole Entropy","41 pages",,"10.1007/JHEP03(2014)043",,"hep-th gr-qc","http://arxiv.org/licenses/nonexclusive-distrib/1.0/","  We develop new techniques to efficiently evaluate heat kernel coefficients
for the Laplacian in the short-time expansion on spheres and hyperboloids with
conical singularities. We then apply these techniques to explicitly compute the
logarithmic contribution to black hole entropy from an N=4 vector multiplet
about a Z(N) orbifold of the near-horizon geometry of quarter--BPS black holes
in N=4 supergravity. We find that this vanishes, matching perfectly with the
prediction from the microstate counting. We also discuss possible
generalisations of our heat kernel results to higher-spin fields over Z(N)
orbifolds of higher-dimensional spheres and hyperboloids.
","[{""version"":""v1"",""created"":""Mon, 25 Nov 2013 13:09:39 GMT""},{""version"":""v2"",""created"":""Wed, 25 Dec 2013 09:58:45 GMT""}]","2015-06-18"
"1311.6287","Joseph Henson","Fay Dowker, Joe Henson, Petros Wallden","A histories perspective on characterising quantum non-locality","28 pages","New J. Phys. 16 (2014) 033033","10.1088/1367-2630/16/3/033033",,"quant-ph gr-qc","http://arxiv.org/licenses/nonexclusive-distrib/1.0/","  We introduce a framework for studying non-locality and contextuality inspired
by the path integral formulation of quantum theory. We prove that the existence
of a strongly positive joint quantum measure -- the quantum analogue of a joint
probability measure -- on a set of experimental probabilities implies the
Navascues-Pironio-Acin (NPA) condition $Q^1$ and is implied by the stronger NPA
condition $Q^{1+AB}$. A related condition is shown to be equivalent to
$Q^{1+AB}$.
","[{""version"":""v1"",""created"":""Mon, 25 Nov 2013 13:10:44 GMT""}]","2014-03-28"
"1311.6288","Bogdan-Vasile Matioc","Joachim Escher and Bogdan-Vasile Matioc","On the analyticity of periodic gravity water waves with integrable
  vorticity function","13 pages",,,,"math.AP","http://arxiv.org/licenses/nonexclusive-distrib/1.0/","  We prove that the streamlines and the profile of periodic gravity water waves
traveling over a flat bed with wavespeed which exceeds the horizontal velocity
of all fluid particles are real-analytic graphs if the vorticity function is
merely integrable.
","[{""version"":""v1"",""created"":""Mon, 25 Nov 2013 13:15:23 GMT""}]","2013-11-26"
"1311.6289","Tetsuo Hyodo","Tetsuo Hyodo, Tetsuo Hatsuda, Yusuke Nishida","Universal physics of three bosons with isospin","5 pages, 3 figures","Phys.Rev.C89:032201,2014","10.1103/PhysRevC.89.032201","YITP-13-121, RIKEN-QHP-106","hep-ph cond-mat.quant-gas hep-lat nucl-th","http://arxiv.org/licenses/nonexclusive-distrib/1.0/","  We show that there exist two types of universal phenomena for three-boson
systems with isospin degrees of freedom. In the isospin symmetric limit, there
is only one universal three-boson bound state with the total isospin one, whose
binding energy is proportional to that of the two-boson bound state. With large
isospin symmetry breaking, the standard Efimov states of three identical bosons
appear at low energies. Both phenomena can be realized by three pions with the
pion mass appropriately tuned in lattice QCD simulations, or by spin-one bosons
in cold atom experiments. Implication to the in-medium softening of multi-pion
states is also discussed.
","[{""version"":""v1"",""created"":""Mon, 25 Nov 2013 13:16:24 GMT""},{""version"":""v2"",""created"":""Mon, 10 Mar 2014 00:10:50 GMT""}]","2014-03-11"
"1311.6290","Alessandro Fortunati","Alessandro Fortunati and Stephen Wiggins","Normal Form and Nekhoroshev stability for nearly-integrable Hamiltonian
  systems with unconditionally slow aperiodic time dependence","Corrected typo in the title and statement of Lemma 3.8","Regul. Chaotic Dyn., 19(3):363-373, 2014","10.1134/S1560354714030071",,"math.DS","http://arxiv.org/licenses/nonexclusive-distrib/1.0/","  The aim of this paper is to extend the results of Giorgilli and Zehnder for
aperiodic time dependent systems to a case of general nearly-integrable convex
analytic Hamiltonians. The existence of a normal form and then a stability
result are shown in the case of a slow aperiodic time dependence that, under
some smallness conditions, is independent on the size of the perturbation.
","[{""version"":""v1"",""created"":""Mon, 25 Nov 2013 13:21:27 GMT""},{""version"":""v2"",""created"":""Wed, 27 Nov 2013 12:46:00 GMT""},{""version"":""v3"",""created"":""Thu, 19 Dec 2013 16:31:34 GMT""}]","2015-05-15"
"1311.6291","Jan Nyquist Roksvold","Trygve Johnsen, Jan Roksvold, Hugues Verdure","A generalization of weight polynomials to matroids","21 pages",,"10.1016/j.disc.2015.10.005",,"math.CO","http://arxiv.org/licenses/nonexclusive-distrib/1.0/","  Generalizing polynomials previously studied in the context of linear codes,
we define weight polynomials and an enumerator for a matroid $M$. Our main
result is that these polynomials are determined by Betti numbers associated
with graded minimal free resolutions of the Stanley-Reisner ideals of $M$ and
so-called elongations of $M$. Generalizing Greene's theorem from coding theory,
we show that the enumerator of a matroid is equivalent to its Tutte polynomial.
","[{""version"":""v1"",""created"":""Mon, 25 Nov 2013 13:24:12 GMT""},{""version"":""v2"",""created"":""Thu, 12 Nov 2015 13:51:01 GMT""}]","2015-11-13"
"1311.6292","Nicolas Borie","Nicolas Borie","Combinatorics of simple marked mesh patterns in 132-avoiding
  permutations","11 pages, 6 figures, submitted at FPSAC 2014",,,,"math.CO","http://arxiv.org/licenses/nonexclusive-distrib/1.0/","  We present some combinatorial interpretations for coefficients appearing in
series partitioning the permutations avoiding 132 along marked mesh patterns.
We identify for patterns in which only one parameter is non zero the
combinatorial family in bijection with 132-avoiding permutations and also
preserving the statistic counted by the marked mesh pattern.
","[{""version"":""v1"",""created"":""Mon, 25 Nov 2013 13:27:31 GMT""}]","2013-11-26"
"1311.6293","Daniele Ramazzotti","Loes Olde Loohuis, Giulio Caravagna, Alex Graudenzi, Daniele
  Ramazzotti, Giancarlo Mauri, Marco Antoniotti, Bud Mishra","Inferring tree causal models of cancer progression with probability
  raising",,"PLoS ONE 9(10): e108358 (2014)","10.1371/journal.pone.0108358",,"math.ST stat.TH","http://arxiv.org/licenses/nonexclusive-distrib/1.0/","  Existing techniques to reconstruct tree models of progression for
accumulative processes, such as cancer, seek to estimate causation by combining
correlation and a frequentist notion of temporal priority. In this paper, we
define a novel theoretical framework called CAPRESE (CAncer PRogression
Extraction with Single Edges) to reconstruct such models based on the notion of
probabilistic causation defined by Suppes. We consider a general reconstruction
setting complicated by the presence of noise in the data due to biological
variation, as well as experimental or measurement errors. To improve tolerance
to noise we define and use a shrinkage-like estimator. We prove the correctness
of our algorithm by showing asymptotic convergence to the correct tree under
mild constraints on the level of noise. Moreover, on synthetic data, we show
that our approach outperforms the state-of-the-art, that it is efficient even
with a relatively small number of samples and that its performance quickly
converges to its asymptote as the number of samples increases. For real cancer
datasets obtained with different technologies, we highlight biologically
significant differences in the progressions inferred with respect to other
competing techniques and we also show how to validate conjectured biological
relations with progression models.
","[{""version"":""v1"",""created"":""Mon, 25 Nov 2013 13:28:53 GMT""},{""version"":""v2"",""created"":""Wed, 4 Dec 2013 12:43:30 GMT""},{""version"":""v3"",""created"":""Mon, 25 Aug 2014 18:28:24 GMT""}]","2015-05-26"
"1311.6294","Dionisio Bazeia","D. Bazeia, A.S. Lobao Jr, R. Menezes, A.Yu. Petrov, A.J. da Silva","Braneworld solutions for F(R) models with non-constant curvature","9 pages, 7 figures; new version","Phys. Lett. B 729 (2014) 127","10.1016/j.physletb.2014.01.011",,"hep-th gr-qc hep-ph","http://arxiv.org/licenses/nonexclusive-distrib/1.0/","  This work deal with braneworld scenarios with generalized gravity. We
investigate models where the potential of the scalar field is polynomial or
nonpolynomial. We obtain exact and approximated solutions for the scalar field,
warp factor and energy density, in the complex scenario with no restriction on
the scalar curvature. In particular, we describe the case where the brane may
split, engendering internal structure, with the splitting caused by the same
parameter that controls deviation from standard gravity.
","[{""version"":""v1"",""created"":""Mon, 25 Nov 2013 13:30:33 GMT""},{""version"":""v2"",""created"":""Wed, 27 Nov 2013 13:13:37 GMT""},{""version"":""v3"",""created"":""Fri, 24 Jan 2014 01:00:27 GMT""}]","2014-01-27"
"1311.6295","Miloslav Znojil","Raymond F. Bishop and Miloslav Znojil","The coupled-cluster approach to quantum many-body problem in a
  three-Hilbert-space reinterpretation","15 pages","Acta Polytechnica 54 (2014), No. 2, pp. 85 - 92","10.14311/AP.2014.54.0085",,"quant-ph cond-mat.str-el math-ph math.MP nucl-th","http://arxiv.org/licenses/nonexclusive-distrib/1.0/","  The quantum many-body bound-state problem in its computationally successful
coupled cluster method (CCM) representation is reconsidered. In conventional
practice one factorizes the ground-state wave functions $|\Psi\rangle= e^S
|\Phi\rangle$ which live in the ""physical"" Hilbert space ${\cal H}^{(P)}$ using
an elementary ansatz for $|\Phi\rangle$ plus a formal expansion of $S$ in an
operator basis of multi-configurational creation operators. In our paper a
reinterpretation of the method is proposed. Using parallels between the CCM and
the so called quasi-Hermitian, alias three-Hilbert-space (THS), quantum
mechanics, the CCM transition from the known microscopic Hamiltonian (denoted
by usual symbol $H$), which is self-adjoint in ${\cal H}^{(P)}$, to its
effective lower-case isospectral avatar $\hat{h}=e^{-S} H e^S$, is assigned a
THS interpretation. In the opposite direction, a THS-prescribed, non-CCM,
innovative reinstallation of Hermiticity is shown to be possible for the CCM
effective Hamiltonian $\hat{h}$, which only appears manifestly non-Hermitian in
its own (""friendly"") Hilbert space ${\cal H}^{(F)}$. This goal is achieved via
an ad hoc amendment of the inner product in ${\cal H}^{(F)}$, thereby yielding
the third (""standard"") Hilbert space ${\cal H}^{(S)}$. Due to the resulting
exact unitary equivalence between the first and third spaces, ${\cal
H}^{(P)}\sim {\cal H}^{(S)}$, the indistinguishability of predictions
calculated in these alternative physical frameworks is guaranteed.
","[{""version"":""v1"",""created"":""Mon, 25 Nov 2013 13:31:20 GMT""}]","2014-05-02"
"1311.6296","Theodor Schuster","Theodor Schuster","Color ordering in QCD","45 pages, 11 figures","Phys. Rev. D 89, 105022 (2014)","10.1103/PhysRevD.89.105022","HU-EP-13/71","hep-ph hep-th","http://arxiv.org/licenses/nonexclusive-distrib/1.0/","  We derive color decompositions of arbitrary tree and one-loop QCD amplitudes
into color ordered objects called primitive amplitudes. Furthermore, we derive
general fermion flip and reversion identities spanning the null space among the
primitive amplitudes and use them to prove that all color ordered tree
amplitudes of massless QCD can be written as linear combinations of color
ordered tree amplitudes of $\mathcal{N}=4$ super Yang-Mills theory.
","[{""version"":""v1"",""created"":""Mon, 25 Nov 2013 13:35:46 GMT""}]","2014-05-28"
"1311.6297","Sourav Dutta","Sourav Dutta, John Lorenz, Adeel Altaf, D. S. Elliott, and Yong P.
  Chen","Photoassociation of ultracold LiRb* molecules: observation of high
  efficiency and unitarity-limited rate saturation","7 pages","Phys. Rev. A 89, 020702(R) (2014)","10.1103/PhysRevA.89.020702",,"physics.atom-ph cond-mat.quant-gas physics.chem-ph","http://arxiv.org/licenses/nonexclusive-distrib/1.0/","  We report the production of ultracold heteronuclear 7Li85Rb molecules in
excited electronic states by photoassociation (PA) of ultracold 7Li and 85Rb
atoms. PA is performed in a dual-species 7Li-85Rb magneto-optical trap (MOT)
and the PA resonances are detected using trap loss spectroscopy. We identify
several strong PA resonances below the Li (2s 2S1/2) + Rb (5p 2P3/2) asymptote
and experimentally determine the long range C6 dispersion coefficients. We find
a molecule formation rate (P_LiRb) of 3.5x10^7 s^-1 and a PA rate coefficient
(K_PA) of 1.3x10^-10 cm^3/s, the highest among heteronuclear bi-alkali
molecules. At large PA laser intensity, we observe the saturation of the PA
rate coefficient (K_PA) close to the theoretical value at the unitarity limit.
","[{""version"":""v1"",""created"":""Mon, 25 Nov 2013 13:36:21 GMT""},{""version"":""v2"",""created"":""Mon, 5 May 2014 10:02:40 GMT""}]","2014-05-06"
"1311.6298","Jean-Marc Luck","P.L. Krapivsky, J.M. Luck, K. Mallick","Survival of classical and quantum particles in the presence of traps","35 pages, 10 figures, 2 tables. Minor updates","J. Stat. Phys. 154 (2014), 1430-1460","10.1007/s10955-014-0936-8",,"cond-mat.stat-mech cond-mat.dis-nn","http://arxiv.org/licenses/nonexclusive-distrib/1.0/","  We present a detailed comparison of the motion of a classical and of a
quantum particle in the presence of trapping sites, within the framework of
continuous-time classical and quantum random walk. The main emphasis is on the
qualitative differences in the temporal behavior of the survival probabilities
of both kinds of particles. As a general rule, static traps are far less
efficient to absorb quantum particles than classical ones. Several lattice
geometries are successively considered: an infinite chain with a single trap, a
finite ring with a single trap, a finite ring with several traps, and an
infinite chain and a higher-dimensional lattice with a random distribution of
traps with a given density. For the latter disordered systems, the classical
and the quantum survival probabilities obey a stretched exponential asymptotic
decay, albeit with different exponents. These results confirm earlier
predictions, and the corresponding amplitudes are evaluated. In the
one-dimensional geometry of the infinite chain, we obtain a full analytical
prediction for the amplitude of the quantum problem, including its dependence
on the trap density and strength.
","[{""version"":""v1"",""created"":""Mon, 25 Nov 2013 13:41:42 GMT""},{""version"":""v2"",""created"":""Tue, 11 Mar 2014 09:25:37 GMT""}]","2014-03-12"
"1311.6299","Vincent Cros","Eva Grimaldi, Antoine Dussaux, Paolo Bortolotti, Julie Grollier,
  Gregoire Pillet, Akio Fukushima, Hitoshi Kubota, Kay Yakushiji, Shinji Yuasa
  and Vincent Cros","Response to noise of a spin transfer vortex based nano-oscillator","9 pages, 4 figures",,,,"cond-mat.mes-hall","http://arxiv.org/licenses/nonexclusive-distrib/1.0/","  We investigate experimentally and analytically the impact of thermal noise on
the sustained gyrotropic mode of vortex magnetization in spin transfer
nano-oscillators and its consequence on the linewidth broadening due to the
different nonlinear contributions. Performing some time domain measurements, we
are able to extract separately the phase noise and the amplitude noise at room
temperature for several values of dc current and perpendicular field. For a
theoretical description of the experiments, we extend the general model of
nonlinear auto-oscillators to the case of vortex core dynamics and provide some
analytical expressions of the response-to-noise of the system as the coupling
coefficient between the phase and the amplitude of the vortex core dynamics due
to the nonlinearities. From the analysis of our experimental results, we
demonstrate the major role of the amplitude-to-phase noise conversion on the
linewidth broadening, and propose some solutions to improve the spectral
coherence of vortex based spin transfer nano-oscillators.
","[{""version"":""v1"",""created"":""Mon, 25 Nov 2013 13:42:56 GMT""}]","2013-11-26"
"1311.6300","Sebastian Reich","Yuan Cheng and Sebastian Reich","A McKean optimal transportation perspective on Feynman-Kac formulae with
  application to data assimilation","to appear in Frontiers in Applied Dynamical Systems",,,,"math.DS","http://arxiv.org/licenses/nonexclusive-distrib/1.0/","  Data assimilation is the task of combining mathematical models with
observational data. From a mathematical perspective data assimilation leads to
Bayesian inference problems which can be formulated in terms of Feynman-Kac
formulae. In this paper we focus on the sequential nature of many data
assimilation problems and their numerical implementation in form of Monte Carlo
methods. We demonstrate how sequential data assimilation can be interpreted as
time-dependent Markov processes, which is often referred to as the McKean
approach to Feynman-Kac formulae. It is shown that the McKean approach has very
natural links to coupling of random variables and optimal transportation. This
link allows one to propose novel sequential Monte Carlo methods/particle
filters. In combination with localization these novel algorithms have the
potential of beating the curse of dimensionality, which has prevented particle
filters from being applied to spatially extended systems.
","[{""version"":""v1"",""created"":""Mon, 25 Nov 2013 13:44:34 GMT""},{""version"":""v2"",""created"":""Mon, 14 Jul 2014 04:58:22 GMT""}]","2014-07-15"
"1311.6301","Pietro Faccioli","E. Schneider and P.Faccioli","Long-Distance Quantum Transport Dynamics in Macromolecules","Work extended to include an illustrative application","Phys. Rev. B 89, 134305 (2014)","10.1103/PhysRevB.89.134305",,"cond-mat.mes-hall quant-ph","http://arxiv.org/licenses/nonexclusive-distrib/1.0/","  Using renormalization group methods, we develop a rigorous coarse-grained
representation of the dissipative dynamics of quantum excitations propagating
inside open macromolecular systems. We show that, at very low spatial
resolution, this quantum transport theory reduces to a modified Brownian
process, in which quantum delocalization effects are accounted for by means of
an effective term in the Onsager-Machlup functional. Using this formulation, we
derive a simple analytic solution for the time-dependent probability of
observing the quantum excitation at a given point in the macromolecule. This
formula can be used to predict the migration of natural or charged quantum
excitations in a variety of molecular systems including biological and organic
polymers, organic crystalline transistors or photosynthetic complexes. For
illustration purpose, we apply this method to investigate intelastic electornic
hole transport in a long homo-DNA chain.
","[{""version"":""v1"",""created"":""Mon, 25 Nov 2013 13:47:01 GMT""},{""version"":""v2"",""created"":""Thu, 20 Mar 2014 15:55:14 GMT""}]","2014-04-23"
"1311.6302","Sheng-Wen Li","Sheng-Wen Li, Zeng-Zhao Li, C. Y. Cai, C. P. Sun","Probing zero-modes of defect in Kitaev quantum wire","8 pages, 5 figures","Phys. Rev. B 89, 134505 (2014)","10.1103/PhysRevB.89.134505",,"quant-ph cond-mat.mes-hall","http://arxiv.org/licenses/nonexclusive-distrib/1.0/","  The Kitaev quantum wire (KQW) model with open boundary possesses two Majorana
edge modes. When the local chemical potential on a defect site is much higher
than that on other sites and than the hopping energy, the electron hopping is
blocked at this site. We show that the existence of such a defect on a closed
KQW also gives rise to two low-energy modes, which can simulate the edge modes.
The energies of the defect modes vanish to zero as the local chemical potential
of the defect increase to infinity. We develop a quantum Langevin equation to
study the transport of KQW for both open and closed cases. We find that when
the lead is contacted with the site beside the defect, we can observe two
splitted peaks around the zero-bias voltage in the differential conductance
spectrum. While if the lead is contacted with the bulk of the quantum wire far
from the the defect or the open edges, we cannot observe any zero-bias peak.
","[{""version"":""v1"",""created"":""Mon, 25 Nov 2013 13:53:04 GMT""},{""version"":""v2"",""created"":""Mon, 9 Dec 2013 12:10:13 GMT""}]","2014-04-17"
