"1311.6244","Anthony Scemama","Anthony Scemama and Emmanuel Giner","An efficient implementation of Slater-Condon rules","8 pages, 5 figures",,,,"physics.comp-ph","http://arxiv.org/licenses/nonexclusive-distrib/1.0/","  Slater-Condon rules are at the heart of any quantum chemistry method as they
allow to simplify $3N$-dimensional integrals as sums of 3- or 6-dimensional
integrals. In this paper, we propose an efficient implementation of those rules
in order to identify very rapidly which integrals are involved in a matrix
element expressed in the determinant basis set. This implementation takes
advantage of the bit manipulation instructions on x86 architectures that were
introduced in 2008 with the SSE4.2 instruction set. Finding which spin-orbitals
are involved in the calculation of a matrix element doesn't depend on the
number of electrons of the system.
","[{""version"":""v1"",""created"":""Mon, 25 Nov 2013 09:31:14 GMT""}]","2013-11-26"
"1311.6245","Debajyoti Mukhopadhyay Prof.","Debajyoti Mukhopadhyay, Sajeeda Shikalgar","A Model Approach to Build Basic Ontology","12 page, 3 fugures, 2 tables. ICWA 2013 International Conference.
  arXiv admin note: text overlap with arXiv:1207.2606 by other authors without
  attribution",,,,"cs.IR","http://arxiv.org/licenses/nonexclusive-distrib/1.0/","  As todays world grows with the technology on the other hand it seems to be
small with the World Wide Web. With the use of Internet more and more
information can be search from the web. When Users fires a query they want
relevancy in obtained results. In general, search engines perform the ranking
of web pages in an offline mode, which is after the web pages have been
retrieved and stored in the database. But most of the time this method does not
provide relevant results as most of the search engines were using some ranking
algorithms like page Rank, HITS, SALSA and Hilltop. Where these algorithms does
not always provides the results based on the semantic web. So a concept of
Ontology is been introduced in search engines to get more meaningful and
relevant results with respect to the users query.Ontologies are used to capture
knowledge about some domain of interest. Ontology describes the concepts in the
domain and also the relationships that hold between those concepts. Different
ontology languages provide different facilities. The most recent development in
standard ontology languages is OWL (Ontology Web Language) from the World Wide
Web Consortium. OWL makes it possible to describe concept to its full extent
and enables the search engines to provide accurate results to the user.
","[{""version"":""v1"",""created"":""Mon, 25 Nov 2013 09:35:14 GMT""}]","2013-11-26"
"1311.6246","Duncan K. Galloway","Duncan Galloway (1), Sammanani Premachandra (1), Danny Steeghs (2),
  Tom Marsh (2), Jorge Casares (3), R\'emon Cornelisse (3) ((1) Monash Centre
  for Astrophysics, (2) University of Warwick, (3) Instituto de Astrof\^isica,
  Universidad de la Laguna)","Precision ephemerides for gravitational-wave searches: I. Sco X-1","9 pages, 6 figures, accepted by ApJ",,"10.1088/0004-637X/781/1/14",,"astro-ph.HE astro-ph.IM","http://arxiv.org/licenses/nonexclusive-distrib/1.0/","  Rapidly-rotating neutron stars are the only candidates for persistent
high-frequency gravitational wave emission, for which a targeted search can be
performed based on the spin period measured from electromagnetic (e.g. radio
and X-ray) observations. The principal factor determining the sensitivity of
such searches is the measurement precision of the physical parameters of the
system. Neutron stars in X-ray binaries present additional computational
demands for searches due to the uncertainty in the binary parameters. We
present the results of a pilot study with the goal of improving the measurement
precision of binary orbital parameters for candidate gravitational wave
sources. We observed the optical counterpart of Sco X-1 in 2011 June with the
William Herschel Telescope, and also made use of Very Large Telescope
observations in 2011, to provide an additional epoch of radial-velocity
measurements to earlier measurements in 1999. From a circular orbit fit to the
combined dataset, we obtained an improvement of a factor of two in the orbital
period precision, and a factor of 2.5 in the epoch of inferior conjunction
$T_0$. While the new orbital period is consistent with the previous value of
Gottllieb et al. (1975), the new $T_0$ (and the amplitude of variation of the
Bowen line velocities) exhibited a significant shift, which we attribute to
variations in the emission geometry with epoch. We propagate the uncertainties
on these parameters through to the expected Advanced LIGO & VIRGO detector
network observation epochs, and quantify the improvement obtained with
additional optical observations.
","[{""version"":""v1"",""created"":""Mon, 25 Nov 2013 09:42:20 GMT""}]","2015-06-18"
"1311.6247","Songnam Hong Mr.","Song-Nam Hong and Giuseppe Caire","Full-Duplex Relaying with Half-Duplex Relays","Submitted to IEEE Transactions on Information Theory",,,,"cs.IT math.IT","http://arxiv.org/licenses/nonexclusive-distrib/1.0/","  We consider ""virtual"" full-duplex relaying by means of half-duplex relays. In
this configuration, each relay stage in a multi-hop relaying network is formed
by at least two relays, used alternatively in transmit and receive modes, such
that while one relay transmits its signal to the next stage, the other relay
receives a signal from the previous stage. With such a pipelined scheme, the
source is active and sends a new information message in each time slot. We
consider the achievable rates for different coding schemes and compare them
with a cut-set upper bound, which is tight in certain conditions. In
particular, we show that both lattice-based Compute and Forward (CoF) and
Quantize reMap and Forward (QMF) yield attractive performance and can be easily
implemented. In particular, QMF in this context does not require ""long""
messages and joint (non-unique) decoding, if the quantization mean-square
distortion at the relays is chosen appropriately. Also, in the multi-hop case
the gap of QMF from the cut-set upper bound grows logarithmically with the
number of stages, and not linearly as in the case of ""noise level""
quantization. Furthermore, we show that CoF is particularly attractive in the
case of multi-hop relaying, when the channel gains have fluctuations not larger
than 3dB, yielding a rate that does not depend on the number of relaying
stages. In particular, we argue that such architecture may be useful for a
wireless backhaul with line-of-sight propagation between the relays.
","[{""version"":""v1"",""created"":""Mon, 25 Nov 2013 09:54:00 GMT""}]","2013-11-26"
"1311.6248","Sihan Ding","Sihan Ding, Maria Remerova, Rob van der Mei, Bert Zwart","Fluid Approximation of a Call Center Model with Redials and Reconnects",,,,,"math.PR","http://arxiv.org/licenses/nonexclusive-distrib/1.0/","  In many call centers, callers may call multiple times. Some of the calls are
re-attempts after abandonments (redials), and some are re-attempts after
connected calls (reconnects). The combination of redials and reconnects has not
been considered when making staffing decisions, while ignoring them will
inevitably lead to under- or overestimation of call volumes, which results in
improper and hence costly staffing decisions. Motivated by this, in this paper
we study call centers where customers can abandon, and abandoned customers may
redial, and when a customer finishes his conversation with an agent, he may
reconnect. We use a fluid model to derive first order approximations for the
number of customers in the redial and reconnect orbits in the heavy traffic. We
show that the fluid limit of such a model is the unique solution to a system of
three differential equations. Furthermore, we use the fluid limit to calculate
the expected total arrival rate, which is then given as an input to the Erlang
A model for the purpose of calculating service levels and abandonment rates.
The performance of such a procedure is validated in the case of single
intervals as well as multiple intervals with changing parameters.
","[{""version"":""v1"",""created"":""Mon, 25 Nov 2013 09:58:20 GMT""}]","2013-11-26"
"1311.6249","Lutz Prechelt","Julia Schenk, Lutz Prechelt, Stephan Salinger","Distributed-Pair Programming can work well and is not just Distributed
  Pair-Programming",,,,,"cs.SE","http://arxiv.org/licenses/nonexclusive-distrib/1.0/","  Background: Distributed Pair Programming can be performed via screensharing
or via a distributed IDE. The latter offers the freedom of concurrent editing
(which may be helpful or damaging) and has even more awareness deficits than
screen sharing. Objective: Characterize how competent distributed pair
programmers may handle this additional freedom and these additional awareness
deficits and characterize the impacts on the pair programming process. Method:
A revelatory case study, based on direct observation of a single, highly
competent distributed pair of industrial software developers during a 3-day
collaboration. We use recordings of these sessions and conceptualize the
phenomena seen. Results: 1. Skilled pairs may bridge the awareness deficits
without visible obstruction of the overall process. 2. Skilled pairs may use
the additional editing freedom in a useful limited fashion, resulting in
potentially better fluency of the process than local pair programming.
Conclusion: When applied skillfully in an appropriate context, distributed-pair
programming can (not will!) work at least as well as local pair programming.
","[{""version"":""v1"",""created"":""Mon, 25 Nov 2013 10:13:49 GMT""}]","2013-11-26"
"1311.6250","EPTCS","Claudia Carapelle (Leipzig University), Shiguang Feng (Leipzig
  University), Oliver Fern\'andez Gil (Leipzig University), Karin Quaas
  (Leipzig University)","On the Expressiveness of TPTL and MTL over \omega-Data Words","In Proceedings AFL 2014, arXiv:1405.5272","EPTCS 151, 2014, pp. 174-187","10.4204/EPTCS.151.12",,"cs.LO","http://arxiv.org/licenses/nonexclusive-distrib/1.0/","  Metric Temporal Logic (MTL) and Timed Propositional Temporal Logic (TPTL) are
prominent extensions of Linear Temporal Logic to specify properties about data
languages. In this paper, we consider the class of data languages of
non-monotonic data words over the natural numbers. We prove that, in this
setting, TPTL is strictly more expressive than MTL. To this end, we introduce
Ehrenfeucht-Fraisse (EF) games for MTL. Using EF games for MTL, we also prove
that the MTL definability decision problem (""Given a TPTL-formula, is the
language defined by this formula definable in MTL?"") is undecidable. We also
define EF games for TPTL, and we show the effect of various syntactic
restrictions on the expressiveness of MTL and TPTL.
","[{""version"":""v1"",""created"":""Mon, 25 Nov 2013 10:27:10 GMT""},{""version"":""v2"",""created"":""Thu, 22 May 2014 02:13:19 GMT""}]","2014-05-23"
"1311.6251","Rajesh Khaparde Dr","Rajesh B. Khaparde","A Comprehensive Assessment Strategy for Physics Laboratory Courses","7 Pages",,,,"physics.ed-ph","http://arxiv.org/licenses/nonexclusive-distrib/1.0/","  The objective of physics laboratory training is to develop, in students, a
variety of important cognitive and psycho-motor abilities related to
experimental physics. These include conceptual understanding, procedural
understanding, experimental skills and the experimental problem solving
ability. It has been noted that strategies adopted for the assessment of what
students learn and develop through a laboratory course are often inconsistent
with the objectives of the laboratory courses. The author has developed a
comprehensive assessment strategy which can be used at the school, college and
university level. The strategy is based on four tools of assessment, namely,
test on conceptual understanding, test on procedural understanding, an
experimental test, and the continuous assessment. The relative weightage for
each of the four tools depends on the level and emphasis of the laboratory
course. The four tools of assessment, with respect to the type of questions,
design, grading schemes, administration of each tool have been described with a
few sample questions for each tool of assessment. This assessment strategy is
being practiced and its effectiveness studied during a series of special
courses in experimental physics in India. Furthermore, a survey was carried out
with university teachers from across India to check the acceptability and
feasibility of using this strategy for larger number of students in
universities and most of the participating teachers supported the use of this
strategy.
","[{""version"":""v1"",""created"":""Mon, 25 Nov 2013 10:28:33 GMT""}]","2013-11-26"
"1311.6252","David Bugg","D V Bugg","An alternative explanation of the dibaryon suggested by experiments at
  the WASA facility at the FZ Julich Cooler synchrotron","5 pages, 1 figure. This is a revised version which makes use of
  supporting evidence from the recent experiment of Mielke et al. Conclusions
  remain unchanged",,"10.1140/epja/i2014-14014-0","QM 15","nucl-ex hep-ph nucl-th","http://arxiv.org/licenses/nonexclusive-distrib/1.0/","  A series of publications of the WASA collaboration culminates in a recent
paper of Pricking, Bashkanov and Clement [1] claiming a dibaryon resonance at
2370 MeV. However, as explained here, there are logical flaws in this result. A
natural alternative arises from the reaction pd -> N N*(1440)p_s where p_s is a
spectator proton. There is supporting evidence from a recent experiment of
Mielke et al. on dp -> 3He-piplus-piminus
","[{""version"":""v1"",""created"":""Mon, 25 Nov 2013 10:34:02 GMT""},{""version"":""v2"",""created"":""Sun, 23 Feb 2014 19:09:00 GMT""},{""version"":""v3"",""created"":""Fri, 11 Jul 2014 08:32:46 GMT""}]","2014-07-14"
"1311.6253","Filippo Guarnieri","Dario Benedetti, Filippo Guarnieri","One-loop renormalization in a toy model of Horava-Lifshitz gravity","18 pages. v2: corrected some misprints, added 3 references, some
  clarifying comments and a new appendix","JHEP 1403 (2014) 078","10.1007/JHEP03(2014)078","AEI-2013-264","hep-th gr-qc","http://arxiv.org/licenses/nonexclusive-distrib/1.0/","  We present a one loop calculation in the context of Horava-Lifshitz gravity.
Due to the complexity of the calculation in the full theory we focus here on
the study of a toy model, namely the conformal reduction of the z=2 projectable
theory in 2+1 dimensions. For this value of the dimension there are no
gravitons, hence the conformal mode is the only physical degree of freedom, and
thus we expect our toy model to lead to qualitatively correct answers regarding
the perturbative renormalization of the full theory. We find that Newton's
constant (dimensionless in Horava-Lifshitz gravity) is asymptotically free.
However, the DeWitt supermetric approaches its Weyl invariant form with the
same speed and the effective interaction coupling remains constant along the
flow. In other words, the would-be asymptotic freedom associated to the running
Newton's constant is exactly balanced by the strong coupling of the scalar mode
as the Weyl invariant limit is approached. We conclude that in such model the
UV limit is singular at one loop order, and we argue that a similar phenomenon
can be expected in the full theory, even in higher dimensions.
","[{""version"":""v1"",""created"":""Mon, 25 Nov 2013 10:38:00 GMT""},{""version"":""v2"",""created"":""Tue, 11 Mar 2014 09:14:02 GMT""}]","2014-03-25"
"1311.6254","Aleksy Tralle","Maciej Bochenski and Aleksy Tralle","Clifford-Klein forms and a-hyperbolic rank","Slight change of the title and numerous corrections suggested by the
  referee of IMRN, appears in International Mathematics Research Notices, 2014","Internat. Math. Res. Notices, no. 15(2015), 6267-6285","10.1093/imrn/rnu123",,"math.GR","http://arxiv.org/licenses/nonexclusive-distrib/1.0/","  The porpose of this article is to introduce and investigate properties of a
tool (the a-hyperbolic rank) which enables us to obtain new examples of
homogeneous spaces G/H which admit and do not admit almost compact
Clifford-Klein forms. We achieve this goal by exploring in greater detail the
technique of adjoint orbits developed by Okuda combined with the well-known
conditions of Benoist. We find easy-to-check conditions on G and H expressed
directly in terms of the Satake diagrams of the corresponding Lie algebras, in
cases when G is a real form of a complex Lie group of types A, D or E6. One of
the advantages of this approach is the fact that we don't need to know the
embedding of H into G. Using the a-hyperbolic rank we also show that the
homogeneous space G/H of reductive type of the real form of E6 (of the IV type)
admits compact Clifford-Klein forms if and only if H is compact. Inspired by
the work of Okuda on symmetric spaces G/H we classify all 3-symmetric spaces
admitting almost compact Clifford-Klein forms.
","[{""version"":""v1"",""created"":""Mon, 25 Nov 2013 10:40:26 GMT""},{""version"":""v2"",""created"":""Fri, 14 Nov 2014 09:40:15 GMT""}]","2015-08-21"
"1311.6255","Rajesh Khaparde Dr","Rajesh B. Khaparde","A Novel Approach to Encourage Students Independent Thinking in the
  Physics Laboratory","9 pages",,,,"physics.ed-ph","http://arxiv.org/licenses/nonexclusive-distrib/1.0/","  The objectives of physics laboratory courses include fostering conceptual
understanding and development of several important cognitive, psycho-motor,
attitudinal and affective abilities. In most of the Indian colleges and
universities (and probably at many other places all over the world) the usual
practice of performing a set of experiments, in a cook-book mode, seldom helps
students achieve the objectives of the physics laboratory courses and develop
the abilities and skills required to become a successful experimental
physicist. This paper describes the details of an instructional approach
designed and being followed by the author for a past few years, to encourage
students independent thinking in the physics laboratory. This instructional
approach encourages students active participation, independent thinking and
offers an opportunity to learn how to think scientifically during traditional
physics laboratory courses without major curriculum and content changes. Here,
guided problem solving approach is adopted by combining problem-solving and
guided design modes of instruction. In this approach an experiment is presented
as an experimental problem with well thought procedural instructions. During a
typical laboratory session, first an introductory demonstration is presented to
each group of a few students separately for the first twenty minutes by the
mentors as a prelude to the problem and the remaining laboratory time is made
available for students to independently solve the experimental problem. The
paper also illustrates the approach by describing a familiar experimental
problem and the demonstration on Electromagnetic damping with some details of
the experimental arrangement, which is being used by the author for training of
students and teachers at the introductory university level.
","[{""version"":""v1"",""created"":""Mon, 25 Nov 2013 10:43:53 GMT""}]","2013-11-26"
"1311.6256","Kryzhevich Sergey G.","Sergey Kryzhevich","Motion of a rough disc in Newtonian aerodynamics","To appear in Springer Communications in Computer and Information
  Science Proceedings (the issue dedicated to Euro mini conference to
  Optimization in Natural Sciences)",,,,"math.DS","http://arxiv.org/licenses/nonexclusive-distrib/1.0/","  Dynamics of rough discs in a rarified media is considered. We study possible
trajectories of centers of discs. The main result of the paper is the
following: any finite rectifiable curve can be approximated by trajectories of
centers of rough discs, provided the parameters of the system and the rough
structure are specially chosen.
","[{""version"":""v1"",""created"":""Mon, 25 Nov 2013 10:43:55 GMT""},{""version"":""v2"",""created"":""Wed, 19 Mar 2014 21:41:28 GMT""},{""version"":""v3"",""created"":""Sun, 30 Nov 2014 06:56:04 GMT""}]","2014-12-02"
"1311.6257","Samuel Cohen","Samuel N. Cohen and Robert J. Elliott","Filters and smoothers for self-exciting Markov modulated counting
  processes",,,,,"q-fin.CP math.PR q-fin.TR stat.OT","http://arxiv.org/licenses/nonexclusive-distrib/1.0/","  We consider a self-exciting counting process, the parameters of which depend
on a hidden finite-state Markov chain. We derive the optimal filter and
smoother for the hidden chain based on observation of the jump process. This
filter is in closed form and is finite dimensional. We demonstrate the
performance of this filter both with simulated data, and by analysing the
`flash crash' of 6th May 2010 in this framework.
","[{""version"":""v1"",""created"":""Mon, 25 Nov 2013 10:44:53 GMT""}]","2013-11-26"
"1311.6258","Johan Helsing","Johan Helsing and Anders Holst","Variants of an explicit kernel-split panel-based Nystr\""om
  discretization scheme for Helmholtz boundary value problems","21 pages, 3 figures",,,,"math.NA","http://arxiv.org/licenses/nonexclusive-distrib/1.0/","  The incorporation of analytical kernel information is exploited in the
construction of Nystr\""om discretization schemes for integral equations
modeling planar Helmholtz boundary value problems. Splittings of kernels and
matrices, coarse and fine grids, high-order polynomial interpolation, product
integration performed on the fly, and iterative solution are some of the
numerical techniques used to seek rapid and stable convergence of computed
fields in the entire computational domain.
","[{""version"":""v1"",""created"":""Mon, 25 Nov 2013 10:48:33 GMT""},{""version"":""v2"",""created"":""Tue, 21 Jan 2014 12:58:17 GMT""},{""version"":""v3"",""created"":""Mon, 18 Aug 2014 15:51:47 GMT""}]","2014-08-19"
"1311.6259","Zoran Konkoli","Zoran Konkoli and G\""oran Wendin","Toward bio-inspired information processing with networks of nano-scale
  switching elements",,,,,"cs.ET","http://arxiv.org/licenses/nonexclusive-distrib/1.0/","  Unconventional computing explores multi-scale platforms connecting
molecular-scale devices into networks for the development of scalable
neuromorphic architectures, often based on new materials and components with
new functionalities. We review some work investigating the functionalities of
locally connected networks of different types of switching elements as
computational substrates. In particular, we discuss reservoir computing with
networks of nonlinear nanoscale components. In usual neuromorphic paradigms,
the network synaptic weights are adjusted as a result of a training/learning
process. In reservoir computing, the non-linear network acts as a dynamical
system mixing and spreading the input signals over a large state space, and
only a readout layer is trained. We illustrate the most important concepts with
a few examples, featuring memristor networks with time-dependent and history
dependent resistances.
","[{""version"":""v1"",""created"":""Mon, 25 Nov 2013 10:56:38 GMT""}]","2013-11-26"
"1311.6260","Qiyuan Pan","Zixu Zhao, Qiyuan Pan and Jiliang Jing","Notes on analytical study of holographic superconductors with Lifshitz
  scaling in external magnetic field","14 pages, 5 figures","Phys. Lett. B 735 (2014) 438","10.1016/j.physletb.2014.06.065",,"hep-th gr-qc","http://arxiv.org/licenses/nonexclusive-distrib/1.0/","  We employ the matching method to analytically investigate the holographic
superconductors with Lifshitz scaling in an external magnetic field. We discuss
systematically the restricted conditions for the matching method and find that
this analytic method is not always powerful to explore the effect of external
magnetic field on the holographic superconductors unless the matching point is
chosen in an appropriate range and the dynamical exponent $z$ satisfies the
relation $z=d-1$ or $z=d-2$. From the analytic treatment, we observe that
Lifshitz scaling can hinder the condensation to be formed, which can be used to
back up the numerical results. Moreover, we study the effect of Lifshitz
scaling on the upper critical magnetic field and reproduce the well-known
relation obtained from Ginzburg-Landau theory.
","[{""version"":""v1"",""created"":""Mon, 25 Nov 2013 11:02:55 GMT""},{""version"":""v2"",""created"":""Thu, 6 Mar 2014 07:52:08 GMT""},{""version"":""v3"",""created"":""Mon, 21 Jul 2014 07:14:14 GMT""}]","2014-07-22"
"1311.6261","Amarendra Kumar Sarma Dr.","Samit Kumar Gupta and Amarendra K. Sarma","Parity-time-symmetric closed form optical quadrimer waveguides",,"J. Mod. Opt. 61, 227 (2014)","10.1080/09500340.2013.879934",,"physics.optics nlin.PS","http://arxiv.org/licenses/nonexclusive-distrib/1.0/","  A closed form PT symmetric quadrimer optical waveguide structure, reminiscent
of the four-state quantum system found in quantum optics, is studied. The beam
dynamics of the structure is studied numerically. The effect of inclusion of
nonlinearity and dispersion is also briefly investigated and discussed
","[{""version"":""v1"",""created"":""Mon, 25 Nov 2013 11:07:44 GMT""}]","2017-10-25"
