"1311.6193","Tvrtko Tadi\'c","Tvrtko Tadi\'c","Time-like graphical models","146 pages. Typos removed and some technical problems resolved. To
  appear in Memoirs of the American Mathematical Society",,,,"math.PR","http://arxiv.org/licenses/nonexclusive-distrib/1.0/","  We study continuous processes indexed by a special family of graphs.
Processes indexed by vertices of graphs are known as probabilistic graphical
models. Burdzy and Pal in their paper proposed a continuous version of
graphical models -- processes indexed by time-like graphs. We construct a more
general family of continuous processes on a wider family of graphs, find new
properties and solve the conjecture of uniqueness of the distribution for the
process indexed by graphs with infinite number of vertices. We present new
results showing connections to the stochastic heat equation, Markov random
fields, martingales indexed by directed sets and branching Markov processes.
","[{""version"":""v1"",""created"":""Mon, 25 Nov 2013 01:24:38 GMT""},{""version"":""v2"",""created"":""Mon, 10 Feb 2014 02:29:18 GMT""},{""version"":""v3"",""created"":""Fri, 21 Feb 2014 22:02:00 GMT""},{""version"":""v4"",""created"":""Mon, 5 May 2014 18:47:24 GMT""},{""version"":""v5"",""created"":""Sat, 1 Nov 2014 20:47:37 GMT""},{""version"":""v6"",""created"":""Fri, 23 Dec 2016 08:44:29 GMT""}]","2016-12-26"
"1311.6194","Nalini Joshi","Nalini Joshi","An Overview of Geometric Asymptotic Analysis of Continuous and Discrete
  Painlev\'e Equations","14 pages, 2 figures; presented at conferences ""Various Aspects on the
  Painlev\'e Equations"" RIMS Kyoto, Japan (26-30 Nov 2012) and ""Recent progress
  in the theory of Painlev\'e equations"" IRMA Strasbourg, France (4-8 Nov 2013)",,,,"nlin.SI math-ph math.AG math.CA math.DS math.MP","http://arxiv.org/licenses/nonexclusive-distrib/1.0/","  The classical Painlev\'e equations are so well known that it may come as a
surprise to learn that the asymptotic description of its solutions remains
incomplete. The problem lies mainly with the description of families of
solutions in the complex domain. Where asymptotic descriptions are known, they
are stated in the literature as valid for large connected domains, which
include movable poles of families of solutions. However, asymptotic analysis
necessarily assumes that the solutions are bounded and so these domains must be
punctured at locations corresponding to movable poles, leading to asymptotic
results that may not be uniformly valid. To overcome these issues, we recently
carried out asymptotic analysis in Okamoto's geometric space of initial values
for the first and second Painlev\'e equations. In this paper, we review this
method and indicate how it may be extended to the discrete Painlev\'e
equations.
","[{""version"":""v1"",""created"":""Mon, 25 Nov 2013 01:57:36 GMT""}]","2013-11-26"
"1311.6195","Oleg Tretiakov","Adam B. Cahaya, O. A. Tretiakov, Gerrit E. W. Bauer","Spin Seebeck power generators","4+ pages, 3 figures, update to published version","Appl. Phys. Lett. 104, 042402 (2014)","10.1063/1.4863084",,"cond-mat.mes-hall cond-mat.mtrl-sci","http://arxiv.org/licenses/nonexclusive-distrib/1.0/","  We derive expressions for the efficiency and figure of merit of two spin
caloritronic devices based on the spin Seebeck effect (SSE), i.e., the
generation of spin currents by a temperature gradient. The inverse spin Hall
effect is conventionally used to detect the SSE and offers advantages for large
area applications. We also propose a device that converts spin current into
electric one by means of a spin-valve detector, which scales favorably to small
sizes and approaches a figure of merit of 0.5 at room temperature.
","[{""version"":""v1"",""created"":""Mon, 25 Nov 2013 02:03:55 GMT""},{""version"":""v2"",""created"":""Mon, 2 Dec 2013 08:15:14 GMT""},{""version"":""v3"",""created"":""Wed, 29 Jan 2014 09:03:29 GMT""}]","2014-08-18"
"1311.6196","Yong-Geun Oh","Yong-Geun Oh, Rui Wang","Analysis of contact Cauchy-Riemann maps II: canonical neighborhoods and
  exponential convergence for the Morse-Bott case","69 pages, final version to appear in Nagoya Math J, improvement of
  overall presentation",,,,"math.SG","http://arxiv.org/licenses/nonexclusive-distrib/1.0/","  This is a sequel to the papers [OW1], [OW2]. In [OW1], the authors introduced
a canonical affine connection on $M$ associated to the contact triad
$(M,\lambda,J)$. In [OW2], they used the connection to establish a priori
$W^{k,p}$-coercive estimates for maps $w: \dot \Sigma \to M$ satisfying
$\overline{\partial}^\pi w= 0, \, d(w^*\lambda \circ j) = 0$ \emph{without
involving symplectization}. We call such a pair $(w,j)$ a contact instanton. In
this paper, we first prove a canonical neighborhood theorem of the locus $Q$
foliated by closed Reeb orbits of a Morse-Bott contact form. Then using a
general framework of the three-interval method, we establish exponential decay
estimates for contact instantons $(w,j)$ of the triad $(M,\lambda,J)$, with
$\lambda$ a Morse-Bott contact form and $J$ a CR-almost complex structure
adapted to $Q$, under the condition that the asymptotic charge of $(w,j)$ at
the associated puncture vanishes.
  We also apply the three-interval method to the symplectization case and
provide an alternative approach via tensorial calculations to exponential decay
estimates in the Morse-Bott case for the pseudoholomorphic curves on the
symplectization of contact manifolds. This was previously established by
Bourgeois [Bou] (resp. by Bao [Ba]), by using special coordinates, for the
cylindrical (resp. for the asymptotically cylindrical) ends. The exponential
decay result for the Morse-Bott case is an essential ingredient in the set-up
of the moduli space of pseudoholomorphic curves which plays a central role in
contact homology and symplectic field theory (SFT).
","[{""version"":""v1"",""created"":""Mon, 25 Nov 2013 02:13:35 GMT""},{""version"":""v2"",""created"":""Wed, 17 Dec 2014 07:52:44 GMT""},{""version"":""v3"",""created"":""Mon, 16 Jan 2017 06:58:56 GMT""}]","2017-01-17"
"1311.6197","Rufus Willett","Rufus Willett and Guoliang Yu","Geometric Property (T)","Version two corrects some typos and a mistake in the proof of Lemma
  8.8",,,,"math.MG math.GR math.OA","http://arxiv.org/licenses/nonexclusive-distrib/1.0/","  This paper discusses `geometric property (T)'. This is a property of metric
spaces introduced in earlier work of the authors for its applications to
K-theory. Geometric property (T) is a strong form of `expansion property': in
particular for a sequence of finite graphs $(X_n)$, it is strictly stronger
than $(X_n)$ being an expander in the sense that the Cheeger constants $h(X_n)$
are bounded below.
  We show here that geometric property (T) is a coarse invariant, i.e. depends
only on the large-scale geometry of a metric space $X$. We also discuss the
relationships between geometric property (T) and amenability, property (T), and
various coarse geometric notions of a-T-menability. In particular, we show that
property (T) for a residually finite group is characterised by geometric
property (T) for its finite quotients.
","[{""version"":""v1"",""created"":""Mon, 25 Nov 2013 02:14:43 GMT""},{""version"":""v2"",""created"":""Sun, 9 Feb 2014 18:52:26 GMT""},{""version"":""v3"",""created"":""Fri, 25 Apr 2014 15:12:02 GMT""}]","2014-04-28"
"1311.6198","Li-Wei Yu","Li-Wei Yu, Qing Zhao, Mo-Lin Ge","Factorized Three-body S-Matrix Restrained by Yang-Baxter Equation and
  Quantum Entanglements","13 pages, 2 figures",,"10.1016/j.aop.2014.05.014",,"quant-ph","http://arxiv.org/licenses/nonexclusive-distrib/1.0/","  This paper investigates the physical effects of Yang-Baxter equation (YBE) to
quantum entanglements through the 3-body S-matrix in entangling parameter
space. The explicit form of 3-body S-matrix $\breve{R}_{123}(\theta,\varphi)$
based on the 2-body S-matrices is given due to the factorization condition of
YBE. The corresponding chain Hamiltonian has been obtained and diagonalized,
also the Berry phase for 3-body system is given. It turns out that by choosing
different spectral parameters the $\breve{R}(\theta,\varphi)$-matrix gives GHZ
and W state respectively. The extended 1-D Kitaev toy model has been derived.
Examples of the role of the model in entanglement transfer are discussed.
","[{""version"":""v1"",""created"":""Mon, 25 Nov 2013 02:27:38 GMT""}]","2015-06-18"
"1311.6199","Mohammad  Mozumdar","Hen-Geul Yeh and Son H. Doan","Battery Placement on Performance of VAR Controls","Proceedings of Green Energy and Systems Conference 2013, November 25,
  Long Beach, CA, USA",,,,"cs.SY","http://creativecommons.org/licenses/by-nc-sa/3.0/","  Battery's role in the development of smart grid is gaining greater attention
as an energy storage device that can be integrated with a Photovoltaic (PV)
cell in the distribution circuit. As more PVs are connected to the system, real
power injection to the distribution can cause fluctuation in the voltage. Due
to the rapid fluctuation of the voltage, a more advanced volt-ampere reactive
(VAR) power control scheme on a fast time scale is used to minimize the voltage
deviation on the distribution. Employing both global and local dynamic VAR
control schemes in our previous work, we show the effects of battery placement
on the performance of VAR controls in the example of a single branch radial
distribution circuit. Simulations verify that having battery placement at the
rear in the distribution circuit can provide smaller voltage variations and
higher energy savings than front battery placement when used with dynamic VAR
control algorithms.
","[{""version"":""v1"",""created"":""Mon, 25 Nov 2013 02:45:08 GMT""}]","2013-11-26"
"1311.6200","Nick Hand","Nick Hand, Alexie Leauthaud, Sudeep Das, Blake D. Sherwin, Graeme E.
  Addison, J. Richard Bond, Erminia Calabrese, Ald\'ee Charbonnier, Mark J.
  Devlin, Joanna Dunkley, Thomas Erben, Amir Hajian, Mark Halpern, Joachim
  Harnois-D\'eraps, Catherine Heymans, Hendrik Hildebrandt, Adam D. Hincks,
  Jean-Paul Kneib, Arthur Kosowsky, Martin Makler, Lance Miller, Kavilan
  Moodley, Bruno Moraes, Michael D. Niemack, Lyman A. Page, Bruce Partridge,
  Neelima Sehgal, Huanyuan Shan, Jonathan L. Sievers, David N. Spergel, Suzanne
  T. Staggs, Eric R. Switzer, James E. Taylor, Ludovic Van Waerbeke, Charlotte
  Welker, Edward J. Wollack","First Measurement of the Cross-Correlation of CMB Lensing and Galaxy
  Lensing","11 pages, 7 figures. Submitted to PRD. Updates to lensing maps and
  analysis pipeline, with revised results, increased significance",,"10.1103/PhysRevD.91.062001",,"astro-ph.CO","http://arxiv.org/licenses/nonexclusive-distrib/1.0/","  We measure the cross-correlation of cosmic microwave background lensing
convergence maps derived from Atacama Cosmology Telescope data with galaxy
lensing convergence maps as measured by the Canada-France-Hawaii Telescope
Stripe 82 Survey. The CMB-galaxy lensing cross power spectrum is measured for
the first time with a significance of 4.2{\sigma}, which corresponds to a 12%
constraint on the amplitude of density fluctuations at redshifts ~ 0.9. With
upcoming improved lensing data, this novel type of measurement will become a
powerful cosmological probe, providing a precise measurement of the mass
distribution at intermediate redshifts and serving as a calibrator for
systematic biases in weak lensing measurements.
","[{""version"":""v1"",""created"":""Mon, 25 Nov 2013 03:04:02 GMT""},{""version"":""v2"",""created"":""Thu, 11 Dec 2014 21:35:06 GMT""}]","2015-07-15"
"1311.6201","Ashish Kumar Das","Sekhar Jyoti Baishya","On finite groups with nine centralizers","5 pages",,,,"math.GR","http://arxiv.org/licenses/nonexclusive-distrib/1.0/","  Given a finite group $G$, let $Cent(G)$ denote the set of distinct
centralizers of elements of $G$. The group $G$ is called $n$-centralizer if
$|Cent(G)|=n$ and primitive $n$-centralizer if
$|Cent(G)|=|Cent(\frac{G}{Z(G)})|=n$. In this paper, we characterize the
$9$-centralizer and the primitive $9$-centralizer groups.
","[{""version"":""v1"",""created"":""Mon, 25 Nov 2013 03:07:13 GMT""}]","2013-11-26"
"1311.6202","Keying Guan","Keying Guan","Non-trivial Local Attractors of a Three-dimensional Dynamical System","20 pages, 48 figures","John Guckenheimer and Philip Holmes, Nonlinear Oscillations,...,
  Springer-Verlag, New York, 1983 J.C. Sprott, Chaos and Time-series Analysis,
  Oxford University Press, 2003",,,"math.DS nlin.CD","http://arxiv.org/licenses/nonexclusive-distrib/1.0/","  Based on both qualitative method and numerical tests for a series of
particular cases in the parameter region, a=1, 0<b <1, it is shown that the
three-dimensional system (2) may have a series of interesting phenomena on the
non-trivial local attractors, such as the faint attractor (this term is
suggested by the author), the local attractor with complex structure, twin
spatial limit closed orbits, the bifurcation of rotation numbers, and the
spatial limit cycle, etc.. The system (2) is a very rich source in the study of
dynamical system theory.
","[{""version"":""v1"",""created"":""Mon, 25 Nov 2013 03:18:14 GMT""},{""version"":""v2"",""created"":""Sun, 15 Dec 2013 22:00:05 GMT""},{""version"":""v3"",""created"":""Wed, 25 Dec 2013 04:48:21 GMT""}]","2013-12-30"
"1311.6203","Steven Willison","Steven Willison","A Re-examination of the isometric embedding approach to General
  Relativity","28 pages, no figures. v3- some clarifications and minor corrections",,,,"gr-qc math-ph math.AP math.MP","http://arxiv.org/licenses/nonexclusive-distrib/1.0/","  We consider gravitational field equations which are Einstein equations
written in terms of embedding coordinates in some higher dimensional Minkowski
space. Our main focus is to address some tricky issues relating to the Cauchy
problem and possible non-equivalence with the intrinsic Einstein theory. The
well known theory introduced by Regge and Teitelboim in 9+1 dimensions is cast
in Cauchy-Kowalevskaya form and therefore local existence and uniqueness
results follow for \emph{analytic} initial data. In seeking a weakening of the
regularity conditions for initial data, we are led naturally to propose a 13+1
dimensional theory. By imposing an appropriate conserved initial value
constraint we are able, in the neighbourhood of a generic (free) embedding, to
obtain a system of nonlinear hyperbolic differential equations. The questions
of long time or global existence and uniqueness are formidable, but we offer
arguments to suggest that the situation is not hopeless if the theory is
modified in an appropriate way. We also present a modification of the
perturbation method of G\""{u}nther to weighted Sobolev spaces, appropriate to
noncompact initial data surfaces with asymptotic fall-off conditions.
","[{""version"":""v1"",""created"":""Mon, 25 Nov 2013 03:39:59 GMT""},{""version"":""v2"",""created"":""Mon, 9 Dec 2013 13:22:17 GMT""},{""version"":""v3"",""created"":""Sat, 24 May 2014 16:07:03 GMT""}]","2014-05-27"
"1311.6204","Aleksandar Nikolov","Aleksandar Nikolov, Kunal Talwar","Approximating Hereditary Discrepancy via Small Width Ellipsoids",,,,,"cs.DS","http://arxiv.org/licenses/nonexclusive-distrib/1.0/","  The Discrepancy of a hypergraph is the minimum attainable value, over
two-colorings of its vertices, of the maximum absolute imbalance of any
hyperedge. The Hereditary Discrepancy of a hypergraph, defined as the maximum
discrepancy of a restriction of the hypergraph to a subset of its vertices, is
a measure of its complexity. Lovasz, Spencer and Vesztergombi (1986) related
the natural extension of this quantity to matrices to rounding algorithms for
linear programs, and gave a determinant based lower bound on the hereditary
discrepancy. Matousek (2011) showed that this bound is tight up to a
polylogarithmic factor, leaving open the question of actually computing this
bound. Recent work by Nikolov, Talwar and Zhang (2013) showed a polynomial time
$\tilde{O}(\log^3 n)$-approximation to hereditary discrepancy, as a by-product
of their work in differential privacy. In this paper, we give a direct simple
$O(\log^{3/2} n)$-approximation algorithm for this problem. We show that up to
this approximation factor, the hereditary discrepancy of a matrix $A$ is
characterized by the optimal value of simple geometric convex program that
seeks to minimize the largest $\ell_{\infty}$ norm of any point in a ellipsoid
containing the columns of $A$. This characterization promises to be a useful
tool in discrepancy theory.
","[{""version"":""v1"",""created"":""Mon, 25 Nov 2013 03:44:06 GMT""},{""version"":""v2"",""created"":""Wed, 23 Jul 2014 05:20:59 GMT""}]","2014-07-24"
"1311.6205","Changhyun Ahn","Changhyun Ahn","Higher Spin Currents in Wolf Space: Part I","143 pages; Simplified the OPEs using compact notations, manifest
  SU(2) x SU(2) representations are given and to appear in JHEP",,"10.1007/JHEP03(2014)091",,"hep-th","http://arxiv.org/licenses/nonexclusive-distrib/1.0/","  For the N=4 superconformal coset theory described by SU(N+2)/SU(N) (that
contains a Wolf space) with N=3, the N=2 WZW affine current algebra with
constraints is obtained. The 16 generators of the large N=4 linear
superconformal algebra are described by those WZW affine currents explicitly.
By factoring out four spin-1/2 currents and the spin-1 current from these 16
generators, the remaining 11 generators (spin-2 current, four spin-3/2
currents, and six spin-1 currents) corresponding to the large N=4 nonlinear
superconformal algebra are obtained.
  Based on the recent work by Gaberdiel and Gopakumar on the large N=4
holography, the extra 16 currents, with spin contents (1, 3/2, 3/2, 2), (3/2,
2, 2, 5/2), (3/2, 2, 2, 5/2), and (2, 5/2, 5/2, 3) described in terms of N=2
multiplets, are obtained and realized by the WZW affine currents. As a first
step towards N=4 W algebra (which is NOT known so far), the operator product
expansions (OPEs) between the above 11 currents and these extra 16 higher spin
currents are found explicitly. It turns out that the composite fields with
definite U(1) charges, made of above (11+16) currents (which commute with the
Wolf space subgroup SU(N=3) x SU(2) x U(1) currents), occur in the right hand
sides of these OPEs.
","[{""version"":""v1"",""created"":""Mon, 25 Nov 2013 04:21:50 GMT""},{""version"":""v2"",""created"":""Wed, 26 Feb 2014 05:18:30 GMT""}]","2015-06-18"
"1311.6206","Valery Katkov","V.M. Katkov","On structure of the polarization operator in a magnetic field","6 pages",,,,"hep-ph","http://arxiv.org/licenses/nonexclusive-distrib/1.0/","  The polarization operator is investigated at arbitrary photon energy in a
constant and homogeneous magnetic field for the strength H less than the
Schwinger critical value. The effective mass of a real photon with a preset
polarization is considered in the quantum energy region as well as in the
quasiclassical one. Obtained in the quantum region expressions include the
singular terms at the creation threshold of electron and positron on Landau
levels.
","[{""version"":""v1"",""created"":""Mon, 25 Nov 2013 04:38:22 GMT""}]","2013-11-26"
"1311.6207","Aleksej Ber","V. I. Chilin and A. K. Karimov","Interpolation theorems for operators in non-commutative vector-valued
  symmetric spaces","14 pages",,,,"math.OA","http://arxiv.org/licenses/nonexclusive-distrib/1.0/","  We prove the version of interpolation theorem for non-commutative
vector-valued fully symmetric spaces associated with fully symmetric Banach
function spaces and a von Neumann algebra equipped with a faithful semifinite
normal trace.
","[{""version"":""v1"",""created"":""Mon, 25 Nov 2013 04:41:25 GMT""}]","2013-11-26"
"1311.6208","Na-Rae Kim","Nariman Farsad, Na-Rae Kim, Andrew W. Eckford and Chan-Byoung Chae","Channel and Noise Models for Nonlinear Molecular Communication Systems","10 pages, 12 figures",,,,"cs.ET","http://arxiv.org/licenses/nonexclusive-distrib/1.0/","  Recently, a tabletop molecular communication platform has been developed for
transmitting short text messages across a room. The end-to-end system impulse
response for this platform does not follow previously published theoretical
works because of imperfect receiver, transmitter, and turbulent flows.
Moreover, it is observed that this platform resembles a nonlinear system, which
makes the rich body of theoretical work that has been developed by
communication engineers not applicable to this platform. In this work, we first
introduce corrections to the previous theoretical models of the end-to-end
system impulse response based on the observed data from experimentation. Using
the corrected impulse response models, we then formulate the nonlinearity of
the system as noise and show that through simplifying assumptions it can be
represented as Gaussian noise. Through formulating the system's nonlinearity as
the output a linear system corrupted by noise, the rich toolbox of mathematical
models of communication systems, most of which are based on linearity
assumption, can be applied to this platform.
","[{""version"":""v1"",""created"":""Mon, 25 Nov 2013 04:48:08 GMT""}]","2013-11-26"
"1311.6209","Peter Robinson","Khalid Hourani, Hartmut Klauck, William K. Moses Jr., Danupon
  Nanongkai, Gopal Pandurangan, Peter Robinson, Michele Scquizzato","Distributed Algorithms for Large-Scale Graphs","Preliminary version appeared at SODA 2015",,,,"cs.DC cs.DS","http://arxiv.org/licenses/nonexclusive-distrib/1.0/","  Motivated by the increasing need for fast processing of large-scale graphs,
we study a number of fundamental graph problems in a message-passing model for
distributed computing, called $k$-machine model, where we have $k$ machines
that jointly perform computations on $n$-node graphs. The graph is assumed to
be partitioned in a balanced fashion among the $k$ machines, a common
implementation in many real-world systems. Communication is point-to-point via
bandwidth-constrained links, and the goal is to minimize the round complexity,
i.e., the number of communication rounds required to finish a computation.
  We present a generic methodology that allows to obtain efficient algorithms
in the $k$-machine model using distributed algorithms for the classical CONGEST
model of distributed computing. Using this methodology, we obtain algorithms
for various fundamental graph problems such as connectivity, minimum spanning
trees, shortest paths, maximal independent sets, and finding subgraphs, showing
that many of these problems can be solved in $\tilde{O}(n/k)$ rounds; this
shows that one can achieve speedup nearly linear in $k$.
  To complement our upper bounds, we present lower bounds on the round
complexity that quantify the fundamental limitations of solving graph problems
distributively. We first show a lower bound of $\Omega(n/k)$ rounds for
computing a spanning tree of the input graph. This result implies the same
bound for other fundamental problems such as computing a minimum spanning tree,
breadth-first tree, or shortest paths tree. We also show a $\tilde
\Omega(n/k^2)$ lower bound for connectivity, spanning tree verification and
other related problems. The latter lower bounds follow from the development and
application of novel results in a random-partition variant of the classical
communication complexity model.
","[{""version"":""v1"",""created"":""Mon, 25 Nov 2013 05:14:48 GMT""},{""version"":""v2"",""created"":""Wed, 3 Sep 2014 16:44:54 GMT""},{""version"":""v3"",""created"":""Sat, 11 Oct 2014 18:13:20 GMT""},{""version"":""v4"",""created"":""Thu, 6 Nov 2014 05:23:40 GMT""},{""version"":""v5"",""created"":""Mon, 2 Feb 2015 08:28:47 GMT""},{""version"":""v6"",""created"":""Wed, 16 Sep 2015 17:18:40 GMT""},{""version"":""v7"",""created"":""Thu, 9 Feb 2023 03:08:28 GMT""}]","2023-02-10"
"1311.6210","Won-Gi Paeng","Young Moon Goh, Hyun Kyu Lee, Won-Gi Paeng, Yongsung Yoon","Pair Production of Majorana Neutrinos by Annihilation of Charged
  Particles in High Energy Collision","4 pages","J. Korean Phys. Soc. 56, 1884 (2010)","10.3938/jkps.56.1884",,"hep-ph","http://arxiv.org/licenses/nonexclusive-distrib/1.0/","  Assuming that neutrinos have non-vanishing magnetic moments, we discuss the
possibility of pair production through annihilation of charged fermions in
high-energy collisions. Adopting the Pauli interaction for photon-neutrino
coupling, we calculate the neutrino pair production cross section in the photon
channel and compare the result with the standard model in $ Z^{0} $ channel. we
demonstrated that the enhancement of the production rate for Majorana neutrino
pairs over the standard model rate can be possible at the center-of-mass energy
of $10 - 100$ TeV for the Large Hadron Collider or the ultra-high-energy cosmic
Ray when the transition magnetic moment is not smaller than $10^{-9} - 10^{-10}
\mu_B$.
","[{""version"":""v1"",""created"":""Mon, 25 Nov 2013 05:17:52 GMT""}]","2013-11-26"
