"1311.7543","Ankan Das","Liton Majumdar, Ankan Das, Sandip K. Chakrabarti","Spectroscopic characteristics of the cyanomethyl anion and its
  deuterated derivatives","55 pages, 4 figures, accepted for the publication in A&A",,"10.1051/0004-6361/201322473",,"astro-ph.GA physics.chem-ph","http://arxiv.org/licenses/nonexclusive-distrib/1.0/","  It has long been suggested that CH2CN- might be a carrier of one of the many
poorly characterized diffuse interstellar bands. In this paper, our aim is to
study various forms of CH2CN in the interstellar medium. Aim of this paper is
to predict spectroscopic characteristics of various forms of CH2CN and its
deuterated derivatives. Moreover, we would like to model the interstellar
chemistry for making predictions for the column densities of such species
around dark cloud conditions.
  A detailed quantum chemical simulations to present the spectral properties of
various forms of the CH2CN. MP2 theory along with the aug-CCPVTZ basis set is
used to obtain different spectroscopic constants of CH2CN-, CHDCN- and CD2CN-
in the gas phase which are essential to predict rotational spectra of these
species. We performed quantum chemical calculation to find out energetically
the most stable spin states for these species. We have computed IR and
electronic absorption spectra for different forms of CH2CN. Moreover, we have
also implemented a large gas-grain chemical network to predict the column
densities of various forms of the cyanomethyl radical and its related species.
In order to mimic physical conditions around a dense cloud region, the
variation of the visual extinction parameters are considered with respect to
the hydrogen number density of the simulated cloud.
  Our quantum chemical calculation reveals that the singlet spin state is the
most stable form of cyanomethyl anion and its deuterated forms. For the
confirmation of the detection of the cyanomethyl anion and its two deuterated
forms, namely, CHDCN- and CD2CN-, we present the rotational spectral
information of these species in the Appendix. Our chemical model predicts that
the deuterated forms of cyanomethyl radicals (specially the anions) are also
reasonably abundant around the dense region of the molecular cloud.
","[{""version"":""v1"",""created"":""Fri, 29 Nov 2013 12:31:14 GMT""},{""version"":""v2"",""created"":""Sun, 5 Jan 2014 12:35:22 GMT""},{""version"":""v3"",""created"":""Fri, 10 Jan 2014 11:37:40 GMT""}]","2015-06-18"
"1311.7544","Stephane Mischler","St\'ephane Mischler (CEREMADE)","Kac's chaos and Kac's program",,,,,"math.AP","http://arxiv.org/licenses/nonexclusive-distrib/1.0/","  In this note I present the main results about the quantitative and
qualitative propagation of chaos for the Boltzmann-Kac system obtained in
collaboration with C. Mouhot in \cite{MMinvent} which gives a possible answer
to some questions formulated by Kac in \cite{Kac1956}. We also present some
related recent results about Kac's chaos and Kac's program obtained in
\cite{MMWchaos,HaurayMischler,KleberSphere} by K. Carrapatoso, M. Hauray, C.
Mouhot, B. Wennberg and myself.
","[{""version"":""v1"",""created"":""Fri, 29 Nov 2013 12:35:22 GMT""},{""version"":""v2"",""created"":""Mon, 31 Mar 2014 12:37:45 GMT""}]","2014-04-01"
"1311.7545","Christian Maszl","Christian Maszl and Wolfgang Breilmann and Jan Benedikt and Achim von
  Keudell","Origin of the energetic ions at the substrate generated during high
  power pulsed magnetron sputtering of titanium","Intended for Journal of Physics D: Applied Physics, Special issue
  ""Fundamentals of plasma-surface interactions""",,"10.1088/0022-3727/47/22/224002",,"physics.plasm-ph","http://arxiv.org/licenses/nonexclusive-distrib/1.0/","  HiPIMS plasmas generate energetic metal ions at the substrate as a major
difference to conventional direct current magnetron sputtering. The origin of
these ions is still an open issue, which is unraveled by using two fast
diagnostics: time resolved mass spectrometry with a temporal resolution of 2
$\mu$s and phase resolved optical emission spectroscopy with a temporal
resolution of 1 $\mu$s. A power scan from dcMS-like to HiPIMS plasmas was
performed, with a 2-inch magnetron and a titanium target as sputter source and
argon as working gas. Clear differences in the transport as well in the
energetic properties of Ar$^{+}$, Ar$^{2+}$, Ti$^+$ and Ti$^{2+}$ were
observed. For discharges with highest peak power densities a high energetic
group of Ti$^+$ and Ti$^{2+}$ could be identified. A cold group of ions is
always present. It is found that hot ions are observed only, when the plasma
enters the spokes regime, which can be monitored by oscillations in the
IV-characteristics in the MHz range that are picked up by the used VI-probes.
These oscillations are correlated with the spokes phenomenon and are explained
as an amplification of the Hall current inside the spokes as hot ionization
zones. To explain the presence of energetic ions, we propose a double layer
(DL) confining the hot plasma inside a spoke: if an atom becomes ionized inside
the spokes region it is accelerated because of the DL to higher energies
whereas its energy remains unchanged if it is ionized outside. In applying this
DL model to our measurements the observed phenomena as well as several
measurements from other groups can be explained. Only if spokes and a double
layer are present the confined particles can gain enough energy to leave the
magnetic trap. We conclude from our findings that the spoke phenomenon
represents the essence of HiPIMS plasmas, explaining their good performance for
material synthesis applications.
","[{""version"":""v1"",""created"":""Fri, 29 Nov 2013 12:38:51 GMT""},{""version"":""v2"",""created"":""Wed, 15 Jan 2014 15:38:42 GMT""},{""version"":""v3"",""created"":""Wed, 5 Mar 2014 14:52:59 GMT""}]","2021-06-16"
"1311.7546","Guy Trambly de Laissardiere","Guy Trambly de Laissardi\`ere and Didier Mayou","Conductivity of Graphene with Resonant Adsorbates: Beyond the Nearest
  Neighbor Hopping Model","8 pages, 5 figures","Adv. Nat. Sci.: Nanosci. Nanotechnol. 5 (2014) 015007 (4pp)","10.1088/2043-6262/5/1/015007",,"cond-mat.mes-hall cond-mat.mtrl-sci","http://arxiv.org/licenses/nonexclusive-distrib/1.0/","  Adsorbates on graphene can create resonances that lead to efficient electron
scattering and strongly affect the electronic conductivity. Therefore a proper
description of these resonances is important to get a good insight of their
effect on conductivity. The characteristics of the resonance and in particular
its T-matrix depend on the adsorbate itself but also on the electronic
structure of graphene. Here we show that a proper tight-binding model of
graphene which includes hopping beyond the nearest-neighbor lead to sizable
modifications of the scattering properties with respect to the mostly used
nearest neighbor hopping model. We compare results obtained with hopping beyond
the nearest-neighbor to those of our recent work Phys. Rev. Lett. 113, 146601
(2013). We conclude that the universal properties discussed in our recent work
are unchanged but that a detailed comparison with experiments require a
sufficiently precise tight-binding model of the graphene layer.
","[{""version"":""v1"",""created"":""Fri, 29 Nov 2013 12:41:31 GMT""},{""version"":""v2"",""created"":""Mon, 6 Jan 2014 11:07:55 GMT""}]","2014-01-07"
"1311.7547","Nikolay Prodanov V.","Nikolay Prodanov, Wolf B. Dapp, Martin H. M\""user","On the contact area and mean gap of rough, elastic contacts: Dimensional
  analysis, numerical corrections and reference data","16 pages, 13 figures",,,,"cond-mat.soft","http://arxiv.org/licenses/nonexclusive-distrib/1.0/","  The description of elastic, nonadhesive contacts between solids with
self-affine surface roughness seems to necessitate knowledge of a large number
of parameters. However, few parameters suffice to determine many important
interfacial properties as we show by combining dimensional analysis with
numerical simulations. This insight is used to deduce the pressure dependence
of the relative contact area and the mean interfacial separation $\Delta
\bar{u}$ and to present the results in a compact form. Given a proper unit
choice for pressure $p$, i.e., effective modulus $E^*$ times the
root-mean-square gradient $\bar{g}$, the relative contact area mainly depends
on $p$ but barely on the Hurst exponent $H$ even at large $p$. When using the
root-mean-square height $\bar{h}$ as unit of length, $\Delta \bar{u}$
additionally depends on the ratio of the height spectrum cutoffs at short and
long wavelengths. In the fractal limit, where that ratio is zero, solely the
roughness at short wavelengths is relevant for $\Delta \bar{u}$. This limit,
however, should not be relevant for practical applications. Our work contains a
brief summary of the employed numerical method Green's function molecular
dynamics including an illustration of how to systematically overcome numerical
shortcomings through appropriate finite-size, fractal, and discretization
corrections. Additionally, we outline the derivation of Persson theory in
dimensionless units. Persson theory compares well to the numerical reference
data.
","[{""version"":""v1"",""created"":""Fri, 29 Nov 2013 12:42:50 GMT""},{""version"":""v2"",""created"":""Fri, 6 Dec 2013 13:56:12 GMT""}]","2013-12-09"
"1311.7548","Diego Paz\'o","Diego Paz\'o and Juan M. L\'opez and Miguel A. Rodr\'iguez","On the angle between the first and the second Lyapunov vectors in
  spatio-temporal chaos","12 pages","J. Phys A: Math. Theor. 46, 254014 (2013)","10.1088/1751-8113/46/25/254014",,"nlin.CD","http://arxiv.org/licenses/nonexclusive-distrib/1.0/","  In a dynamical system the first Lyapunov vector (LV) is associated with the
largest Lyapunov exponent and indicates ---at some point on the attractor---
the direction of maximal growth in tangent space. The LV corresponding to the
second largest Lyapunov exponent generally points at a different direction, but
tangencies between both vectors can in principle occur. Here we find that the
probability density function (PDF) of the angle \psi spanned by the first and
the second LVs should be expected approximately symmetric around \pi/4 and
peaked at 0 and \pi/2. Moreover, for small angles we uncover a scaling law for
the PDF Q of \psi_l=\ln\psi with the system size L: Q(\psi_l)=L^{-1/2} f(\psi_l
L^{-1/2}). We give a theoretical argument that justifies this scaling form and
also explains why it should be universal (irrespective of the system details)
for spatio-temporal chaos in one spatial dimension.
","[{""version"":""v1"",""created"":""Fri, 29 Nov 2013 12:47:09 GMT""}]","2013-12-02"
"1311.7549","Sven Jarohs","Mouhamed Moustapha Fall and Sven Jarohs","Overdetermined problems with fractional Laplacian",,,,,"math.AP","http://arxiv.org/licenses/nonexclusive-distrib/1.0/","  Let $N\geq 1$ and $s\in (0,1)$. In the present work we characterize bounded
open sets $\Omega$ with $ C^2$ boundary (\textit{not necessarily connected})
for which the following overdetermined problem \begin{equation*} ( -\Delta)^s u
= f(u) \text{ in $\Omega$,} \qquad u=0 \text{ in $\mathbb{R}^N\setminus
\Omega$,} \qquad(\partial_{\eta})_s u=Const. \text{ on $\partial \Omega$}
\end{equation*} has a nonnegative and nontrivial solution, where $\eta $ is the
outer unit normal vectorfield along $\partial\Omega$ and for
$x_0\in\partial\Omega$ \[ \left(\partial_{\eta}\right)_{s}u(x_{0})=-\lim_{t\to
0}\frac{u(x_{0}-t\eta(x_0))}{t^s}. \]
  Under mild assumptions on $f$, we prove that $\Omega$ must be a ball. In the
special case $f\equiv 1$, we obtain an extension of Serrin's result in 1971.
The fact that $\Omega$ is not assumed to be connected is related to the
nonlocal property of the fractional Laplacian.
  The main ingredients in our proof are maximum principles and the method of
moving planes.
","[{""version"":""v1"",""created"":""Fri, 29 Nov 2013 12:48:19 GMT""},{""version"":""v2"",""created"":""Mon, 9 Dec 2013 10:19:45 GMT""},{""version"":""v3"",""created"":""Sun, 12 Oct 2014 13:00:11 GMT""}]","2014-10-14"
"1311.7550","Onur Umucalilar","R. O. Umucalilar, M. Wouters, I. Carusotto","Probing few-particle Laughlin states of photons via correlation
  measurements","11 pages including appendices","Phys. Rev. A 89, 023803 (2014)","10.1103/PhysRevA.89.023803",,"cond-mat.quant-gas","http://arxiv.org/licenses/nonexclusive-distrib/1.0/","  We propose methods to create and observe Laughlin-like states of photons in a
strongly nonlinear optical cavity. Such states of strongly interacting photons
can be prepared by pumping the cavity with a Laguerre-Gauss beam, which has a
well-defined orbital angular momentum per photon. The Laughlin-like states
appear as sharp resonances in the particle-number-resolved transmission
spectrum. Power spectrum and second-order correlation function measurements
yield unambiguous signatures of these few-particle strongly-correlated states.
","[{""version"":""v1"",""created"":""Fri, 29 Nov 2013 12:54:19 GMT""}]","2014-02-12"
"1311.7551","Sidi Mohamed Ould Aly","Kaj Nystr\""om, Sidi Mohamed Ould Aly","A framework for the modeling of order book dynamics based on event sizes",,,,,"math.PR","http://arxiv.org/licenses/nonexclusive-distrib/1.0/","  We propose a modeling framework for the dynamics of a reduced form order book
in event time and based on event sizes. Our framework for the order book is
influenced by [9], but compared to [9] we allow the best bid ask spread to be
larger than one tick. Based on the modeling assumption that the best bid as
well as the best ask price can only move by at most one tick (up or down), when
an event occurs, we show that the dynamics of this simplified order book is
completely described by a non-linear transformation of two processes (X, Y ). A
key challenge in the modeling is the empirical fact that the high frequency
order flow is strongly autocorrelated, a fact we have to deal with in the
modeling of (X, Y ). The core of our framework is a semi linear regression type
model for (X, Y ), influence by more classical ARMA and AR models, and one key
degree of freedom is the potentially non-linear basis functions used in the
regression. We use results from the theory of random iterative function systems
to understand issues concerning stationarity and ergodicity in our models. We
show how to rapidly calibrate the model by inverting block Toeplitz matrices in
an efficient way. All components are worked through and explain in an
application and the predictability of the model for order flows and price moves
are analyzed in the context of a high frequency dataset.
","[{""version"":""v1"",""created"":""Fri, 29 Nov 2013 12:55:17 GMT""},{""version"":""v2"",""created"":""Thu, 20 Feb 2014 13:28:36 GMT""}]","2014-02-21"
"1311.7552","Jenifer Nebreda","J.T. Londergan, J. Nebreda, J.R. Pelaez and A. Szczepaniak","Identification of non-ordinary mesons from the dispersive connection
  between their poles and their Regge trajectories: the f0(500) resonance","8 pages, 4 figures",,"10.1016/j.physletb.2013.12.061",,"hep-ph nucl-th","http://arxiv.org/licenses/nonexclusive-distrib/1.0/","  We show how the Regge trajectory of a resonance can be obtained from its pole
in a scattering process and analytic constraints in the complex angular
momentum plane. The method is suited for resonances that dominate an elastic
scattering amplitude. In particular, from the rho(770) resonance pole in
pion-pion scattering, we obtain its linear Regge trajectory, characteristic of
ordinary quark-antiquark states. In contrast, the f0(500) pole -the sigma
meson- which dominates scalar isoscalar pion-pion scattering, yields a
non-linear trajectory with a much smaller slope at the f0(500) mass.
Conversely, imposing a linear Regge trajectory for the f0(500), with a slope of
typical size, yields an elastic amplitude at odds with the data. This provides
strong support for the non-ordinary nature of the sigma meson.
","[{""version"":""v1"",""created"":""Fri, 29 Nov 2013 13:05:58 GMT""}]","2015-06-18"
"1311.7553","Victor Doroshenko","Victor Doroshenko, Andrea Santangelo, Rozaliya Doroshenko, Isabel
  Caballero, Sergej Tsygankov, Richard Rothschild","XMM-Newton observations of 1A 0535+262 in quiescence","7 pages, 5 figures, accepted for publication in A&A",,"10.1051/0004-6361/201322472",,"astro-ph.HE","http://arxiv.org/licenses/nonexclusive-distrib/1.0/","  Accretion onto magnetized neutron stars is expected to be centrifugally
inhibited at low accretion rates. Several sources, however, are known to
pulsate in quiescence at luminosities below the theoretical limit predicted for
the onset of the centrifugal barrier. The source 1A 0535+262 is one of them.
Here we present the results of an analysis of a ~50 ks long XMM-Newton
observation of 1A 0535+262 in quiescence. At the time of the observation, the
neutron star was close to apastron, and the source had remained quiet for two
orbital cycles. In spite of this, we detected a pulsed X-ray flux of ~3e-11
erg/cm2/s . Several observed properties, including the power spectrum, remained
similar to those observed in the outbursts. Particularly, we have found that
the frequency of the break detected in the quiescent noise power spectrum
follows the same correlation with flux observed when the source is in outburst.
This correlation has been associated with the truncation of the accretion disk
at the magnetosphere boundary. We argue that our result, along with other
arguments previously reported in the literature, suggests that the accretion in
quiescence also proceeds from an accretion disk around the neutron star. The
proposed scenario consistently explains the energy of the cyclotron line
observed in 1A 0535+262, and the timing properties of the source including the
spin frequency evolution within and between the outbursts, and the frequency of
the break in power spectrum.
","[{""version"":""v1"",""created"":""Fri, 29 Nov 2013 13:16:51 GMT""}]","2013-12-02"
"1311.7554","Gorazd Cvetic","Gorazd Cveti\v{c}, C.S. Kim, Jilberto Zamora-Sa\'a","CP violations in $\pi^{\pm}$ Meson Decay","16 pages, 6 figures, v4: new references ([17,18]) added, and ref.[9]
  extended; the version to appear in J.Phys.G",,"10.1088/0954-3899/41/7/075004","USM-TH-316","hep-ph","http://arxiv.org/licenses/nonexclusive-distrib/1.0/","  We study the pion decays with intermediate on-shell neutrinos $N$ into two
electrons and a muon, $\pi^{\pm} \to e^{\pm} N \to e^{\pm} e^{\pm} \mu^{\mp}
\nu$. We investigate the branching ratios ${\rm Br}_{\pm} = [\Gamma(\pi^- \to
e^- e^- \mu^+ \nu) \pm \Gamma(\pi^+ \to e^+e^+\mu^-\nu)]/\Gamma(\pi^- \to {\rm
all})$ and the CP asymmetry ratio ${\cal A}_{\rm CP} = {\rm Br}_{-}/{\rm
Br}_{+}$ for such decays, in the scenario with two different on-shell
neutrinos. If $N$ is Dirac, only the lepton number conserving (LC) decays
contribute (LC: $\nu= {\nu}_e$ or ${\bar \nu}_e$); if $N$ is Majorana, both LC
and lepton number violating (LV) decays contribute (LV: $\nu={\bar \nu}_{\mu}$
or $\nu={\nu}_{\mu}$). The results show that the CP asymmetry ${\cal A}_{\rm
CP}$ is in general very small, but increases and becomes $\sim 1$ when the
masses of the two intermediate neutrinos get closer to each other, i.e., when
their mass difference becomes comparable with their decay width, $\Delta M_N
\not\gg \Gamma_N$. The observation of CP violation in pion decays would be
consistent with the existence of the well-motivated $\nu$MSM model with two
almost degenerate heavy neutrinos.
","[{""version"":""v1"",""created"":""Fri, 29 Nov 2013 13:19:02 GMT""},{""version"":""v2"",""created"":""Fri, 7 Feb 2014 15:06:21 GMT""},{""version"":""v3"",""created"":""Tue, 18 Mar 2014 12:04:06 GMT""},{""version"":""v4"",""created"":""Mon, 31 Mar 2014 17:45:26 GMT""}]","2015-06-18"
"1311.7555","Lucia Caramellino","Vlad Bally, Lucia Caramellino","On the distance between probability density functions",,"Electronic Journal of Probability, 19, no. 110, 1-33, 2014",,,"math.PR","http://arxiv.org/licenses/nonexclusive-distrib/1.0/","  We give estimates of the distance between the densities of the laws of two
functionals $F$ and $G$ on the Wiener space in terms of the Malliavin-Sobolev
norm of $F-G.$ We actually consider a more general framework which allows one
to treat with similar (Malliavin type) methods functionals of a Poisson point
measure (solutions of jump type stochastic equations). We use the above
estimates in order to obtain a criterion which ensures that convergence in
distribution implies convergence in total variation distance; in particular, if
the functionals at hand are absolutely continuous, this implies convergence in
$L^{1}$ of the densities.
","[{""version"":""v1"",""created"":""Fri, 29 Nov 2013 13:25:06 GMT""}]","2016-04-07"
"1311.7556","Leo Goldmakher","Jonathan Bober, Leo Goldmakher","P\'olya-Vinogradov and the least quadratic nonresidue","9 pages; a few small corrections from the previous version",,,,"math.NT","http://arxiv.org/licenses/nonexclusive-distrib/1.0/","  It is well-known that cancellation in short character sums (e.g. Burgess'
estimates) yields bounds on the least quadratic nonresidue. Scant progress has
been made on short character sums since Burgess' work, so it is desirable to
find a new approach to nonresidues. The goal of this note is to demonstrate a
new line of attack via long character sums, a currently active area of
research. Among other results, we demonstrate that improving the constant in
the P\'{o}lya-Vinogradov inequality would lead to significant progress on
nonresidues. Moreover, conditionally on a conjecture on long character sums, we
show that the least nonresidue for any odd primitive character (mod $k$) is
bounded by $(\log k)^{1.4}$.
","[{""version"":""v1"",""created"":""Fri, 29 Nov 2013 13:27:32 GMT""},{""version"":""v2"",""created"":""Mon, 6 Apr 2015 21:58:40 GMT""}]","2015-04-08"
"1311.7557","Vladimir Dobrev","V.K. Dobrev","Classification of Invariant Differential Operators for Non-Compact Lie
  Algebras via Parabolic Relations","25 pages, 16 figures, Talk at the VIII International Symposium
  ""Quantum Theory and Symmetries"", Mexico City, August 5-9, 2013",,"10.1088/1742-6596/512/1/012020",,"hep-th math.RT","http://arxiv.org/licenses/nonexclusive-distrib/1.0/","  In the present paper we review the progress of the project of classification
and construction of invariant differential operators for non-compact semisimple
Lie groups. Our starting points is the class of algebras, which we called
earlier 'conformal Lie algebras' (CLA), which have very similar properties to
the conformal algebras of Minkowski space-time, though our aim is to go beyond
this class in a natural way. For this we introduced recently the new notion of
{\it parabolic relation} between two non-compact semisimple Lie algebras $\cal
G$ and $\cal G'$ that have the same complexification and possess maximal
parabolic subalgebras with the same complexification. Thus, we consider the
exceptional algebra $E_{7(7)}$ which is parabolically related to the CLA
$E_{7(-25)}$. Other interesting examples are the orthogonal algebras $so(p,q)$
all of which are parabolically related to the conformal algebra $so(n,2)$ with
$p+q=n+2$, the parabolic subalgebras including the Lorentz subalgebra
$so(n-1,1)$ and its analogs $so(p-1,q-1)$. Further we consider the algebras
$sl(2n,R)$ and for $n=2k$ the algebras $su^*(4k)$ which are parabolically
related to the CLA $su(n,n)$. Further we consider the algebras $sp(r,r)$ which
are parabolically related to the CLA $sp(2r,R)$. We consider also $E_{6(6)}$
and $E_{6(2)}$ which are parabolically related to the hermitian symmetric case
$E_{6(-14)}$.
","[{""version"":""v1"",""created"":""Fri, 29 Nov 2013 13:30:25 GMT""}]","2015-06-18"
"1311.7558","Sobhan Kazemi Rudsary","N. Behzadi, S. Kazemi Rudsary","Selective transfer of superposition of coherent states by exploiting a
  cavity QED system",,,,,"quant-ph","http://arxiv.org/licenses/nonexclusive-distrib/1.0/","  We propose a scheme on the basis of a N+2 identical single-mode
coupled-cavity QED system for selective transfer of a qubit constructed from
superposition of standard coherent states. The cavities arranged in such way
that the intermediate or channel cavity is connected uniformly to the sender
and N receiver cavities. We consider N different ternary sets of identical QDs
whose QDs have been distributed in the sender, channel and one of the receiver
cavities respectively. We demonstrate a situation in which the dynamics of the
system is confined selectively in a sub sector belongs to one of the ternary
set of QDs. This selective dynamics is able to transfer the coherent
state-constructed qubit (CSCQ) from the sender party to the desired receiver
one reliably. Also, we illustrate that the scheme is optimally robust due to
dissipations arises from photon losses in the cavities.
","[{""version"":""v1"",""created"":""Fri, 29 Nov 2013 13:32:49 GMT""},{""version"":""v2"",""created"":""Thu, 15 May 2014 07:47:07 GMT""}]","2014-05-16"
