"1311.7485","Lei Nie","Lei Nie, Zhiwei Zhang, Daniel Rubin, Jianxiong Chu","Likelihood reweighting methods to reduce potential bias in
  noninferiority trials which rely on historical data to make inference","Published in at http://dx.doi.org/10.1214/13-AOAS655 the Annals of
  Applied Statistics (http://www.imstat.org/aoas/) by the Institute of
  Mathematical Statistics (http://www.imstat.org)","Annals of Applied Statistics 2013, Vol. 7, No. 3, 1796-1813","10.1214/13-AOAS655","IMS-AOAS-AOAS655","stat.AP","http://arxiv.org/licenses/nonexclusive-distrib/1.0/","  It is generally believed that bias is minimized in well-controlled randomized
clinical trials. However, bias can arise in active controlled noninferiority
trials because the inference relies on a previously estimated effect size
obtained from a historical trial that may have been conducted for a different
population. By implementing a likelihood reweighting method through propensity
scoring, a study designed to estimate a treatment effect in one trial
population can be used to estimate the treatment effect size in a different
target population. We illustrate this method in active controlled
noninferiority trials, although it can also be used in other types of studies,
such as historically controlled trials, meta-analyses, and comparative
effectiveness analyses.
","[{""version"":""v1"",""created"":""Fri, 29 Nov 2013 08:47:45 GMT""}]","2013-12-02"
"1311.7486","Antoine Suarez","Antoine Suarez","Covariant vs. non-covariant quantum collapse: Proposal for an
  experimental test","5 pages, 2 figures. The content of this paper has been presented at:
  Coll\`ege de Physique et Philosophie, Institut de France, Paris, May 13,
  2013; and Colloque ""Causalit\'e, temps et origine de l'Univers"", Rencontres
  de Castelvieil, Marseille, November 12, 2013",,,,"quant-ph","http://arxiv.org/licenses/nonexclusive-distrib/1.0/","  Two alternative interpretations of the quantum collapse are proposed: a
time-ordered and a timeless one. The time-ordered interpretation implies that
the speed of light can be defined in an absolute way, while the timeless
quantum collapse implies relativity and can be reckoned as covariant too. An
experiment is proposed to decide between these two interpretations, which may
also be considered a test of Bohm's ""preferred frame"" assumption.
","[{""version"":""v1"",""created"":""Fri, 29 Nov 2013 08:55:28 GMT""},{""version"":""v2"",""created"":""Thu, 16 Jan 2014 09:13:28 GMT""}]","2014-01-17"
"1311.7487","Andrej Dobrotka","A. Dobrotka, S. Mineshige and J.-U. Ness","Resolving different sources of fast X-ray variability of the dwarf nova
  RU Peg in quiescence","accepted for publication in MNRAS, 12 pages, 8 figures, 1 table",,"10.1093/mnras/stt2311",,"astro-ph.SR","http://arxiv.org/licenses/nonexclusive-distrib/1.0/","  We analysed an X-ray light curve of the dwarf nova RU Peg taken by XMM-Newton
with a duration of 46300 s. The power density spectrum has a complicated shape
with two red noise and two white noise components, indicating the presence of
two turbulent regions. We developed a statistical ""toy model"" to study light
curves with variability produced by an unstable turbulent accretion flow from
the inner disc. Our results are consistent with a disc truncation radius
maximally 0.8 x 10^9 cm. We found that any fluctuation of the viscous mass
accretion at the inner disc are visible as UV and X-ray variations with the
same break frequency in the power density spectrum. This process is generating
low frequency variability. A second break suggests the presence of a faster
X-ray variability component which must be generated by another process likely
localised between the inner disc and the white dwarf.
","[{""version"":""v1"",""created"":""Fri, 29 Nov 2013 09:00:10 GMT""}]","2015-06-18"
"1311.7488","Dominik Schulz","Dominik Schulz and Reiner S. Thom\""a","Using Quaternion-Valued Linear Algebra","1st revision: - Section 3.1: added details on the two different kinds
  of ordering in matrix products - Section 5: added details on the relation of
  the left/right inverse - Section 5: added details on the complex inverse -
  Typos corrected - Minor formulation changes - Acknowledgement section added",,,,"math.RA","http://arxiv.org/licenses/nonexclusive-distrib/1.0/","  Linear algebra is usually defined over a field such as the reals or complex
numbers. It is possible to extend this to skew fields such as the quaternions.
However, to the authors' knowledge there is no commonly accepted notation of
linear algebra over skew fields. To this end, we discuss ways of notation that
account for the non-commutativity of the quaternion multiplication.
","[{""version"":""v1"",""created"":""Fri, 29 Nov 2013 09:01:06 GMT""},{""version"":""v2"",""created"":""Thu, 20 Mar 2014 09:28:03 GMT""}]","2014-03-21"
"1311.7489","Anand S. Sengupta","N. Jayaprasad (1), P. Sadani (1), M. Bhalerao (1), Anand S. Sengupta
  (1) and Barun Majumder (1) ((1) Indian Institute of Technology, Gandhinagar)","Exploring viscous damping in undergraduate Physics laboratory using
  electromagnetically coupled oscillators","6 pages, 5 figures",,,,"physics.ed-ph","http://arxiv.org/licenses/nonexclusive-distrib/1.0/","  We design a low-cost, electromagnetically coupled, simple harmonic oscillator
and demonstrate free, damped and forced oscillations in an under-graduate (UG)
Physics laboratory. It consists of a spring-magnet system that can oscillate
inside a cylinder around which copper coils are wound. Such demonstrations can
compliment the traditional way in which a Waves & Oscillations course is taught
and offers a richer pedagogical experience for students. We also show that with
minimal modifications, it can be used to probe the magnitude of viscous damping
forces in liquids by analyzing the oscillations of an immersed magnet. Finally,
we propose some student activities to explore non-linear damping effects and
their characterization using this apparatus.
","[{""version"":""v1"",""created"":""Fri, 29 Nov 2013 09:07:37 GMT""}]","2013-12-02"
"1311.7490","Linlin Zhang","Linlin Zhang","Measurements of Quarkonium Production and Polarization at CMS","to appear in the proceedings of The 6th International Workshop on
  Charm Physics (CHARM 2013)",,,,"hep-ex","http://arxiv.org/licenses/nonexclusive-distrib/1.0/","  The polarizations of Y(nS) (n=1,2,3) and prompt J/\psi and \psi(2S), as well
as the differential cross section of the Y(nS), are measured in proton-proton
collisions at sqrt(s) = 7 TeV, using a dimuon data sample collected by the CMS
experiment at the LHC, corresponding to an integrated luminosity of 4.9 fb-1.
The differential cross section is measured as a function of transverse momentum
of Y(nS). The data show a transition from exponential to power-law behavior in
the neighborhood of 20 GeV, and the power-law exponents for all three states
are consistent. The polarization parameters \lambda\theta, \lambda\phi, and
\lambda\theta\phi, as well as the frame-invariant quantity \lambda, are
measured from the dimuon decay angular distributions in three different
polarization frames. No evidence of large polarizations is seen in these
kinematic regions, which extend much beyond those previously explored.
","[{""version"":""v1"",""created"":""Fri, 29 Nov 2013 09:08:08 GMT""}]","2013-12-02"
"1311.7491","Arash Phirouznia","A. Phirouznia, L. Javadian, J. Poursamad Bonab, K. Jamshidi-Ghaleh","The influence of the surface roughness on dielectric function of
  two-dimensional electron gas",,"Appl. Phys. A (2014) 116:2107","10.1007/s00339-014-8413-4",,"cond-mat.mes-hall","http://arxiv.org/licenses/nonexclusive-distrib/1.0/","  Low field response function calculations have been performed on a
two-dimensional electron gas with well-defined electron-surface roughness
scattering. The Lindhard model was employed to compute the response function.
In particular, detailed investigations were made on the system searching for an
interplay between surface roughness with well-defined correlation function,
(characterizes by asperity height and correlation length) spatial confinement
and the dielectric function. We analyze to what extent the normal behavior and
functionality of dielectric function of two-dimensional devices are modified by
random scattering events caused by the contribution from the surface roughness.
Results of the current work indicate that contribution of the surface roughness
on scattering and absorption process could not be considered as an
underestimating effect. We find, however, that functionality of the dielectric
function seems to be quite independent of the particular roughness features.
","[{""version"":""v1"",""created"":""Fri, 29 Nov 2013 09:08:28 GMT""}]","2014-09-02"
"1311.7492","Heesung Shin","Seunghyun Seo, Heesung Shin","A refined enumeration of $p$-ary labeled trees","7 pages, 4 figures, 2 tables","Korean Journal of Mathematics, 21(4), 495-502, 2013","10.11568/kjm.2013.21.4.495",,"math.CO","http://arxiv.org/licenses/nonexclusive-distrib/1.0/","  Let $\mathcal{T}^{(p)}_n$ be the set of $p$-ary labeled trees on
$\{1,2,\dots,n\}$. A maximal decreasing subtree of an $p$-ary labeled tree is
defined by the maximal $p$-ary subtree from the root with all edges being
decreasing. In this paper, we study a new refinement $\mathcal{T}^{(p)}_{n,k}$
of $\mathcal{T}^{(p)}_n$, which is the set of $p$-ary labeled trees whose
maximal decreasing subtree has $k$ vertices.
","[{""version"":""v1"",""created"":""Fri, 29 Nov 2013 09:09:45 GMT""}]","2022-03-22"
"1311.7493","Andrea Tesi","Riccardo Barbieri, Andrea Tesi","Higgs couplings and electroweak observables: a comparison of precision
  tests","14 pages, 3 figures. v2) one reference added, typos corrected","Phys. Rev. D 89, 055019 (2014)","10.1103/PhysRevD.89.055019",,"hep-ph","http://arxiv.org/licenses/nonexclusive-distrib/1.0/","  Is the weak scale natural? This ever pending question makes the search for
new particle production a highly motivated primary goal of the next LHC phase.
These searches may or may not be successful. While waiting for a needed higher
energy collider to extend the direct exploration, the search for signs of new
physics might be confined to indirect tests for quite some time. In a few fully
calculable models, weakly or semi-strongly interacting, we compare the
significance to measure the Higgs couplings versus the electroweak observables.
","[{""version"":""v1"",""created"":""Fri, 29 Nov 2013 09:19:20 GMT""},{""version"":""v2"",""created"":""Fri, 28 Feb 2014 15:59:16 GMT""}]","2014-03-25"
"1311.7494","Pekka Koskinen Dr","Topi Korhonen and Pekka Koskinen","Electronic Structure Trends of M\""obius Graphene Nanoribbons from
  Minimal-Cell Simulations","7 pages, 5 figures","Computational Materials Science 81, 264, 321 (2013)","10.1016/j.commatsci.2013.08.017",,"cond-mat.mes-hall","http://arxiv.org/licenses/nonexclusive-distrib/1.0/","  Investigating topological effects in materials requires often the modeling of
material systems as a whole. Such modeling restricts system sizes, and makes it
hard to extract systematic trends. Here, we investigate the effect of M\""obius
topology in the electronic structures of armchair graphene nanoribbons. Using
density-functional tight-binding method and minimum-cell simulations through
revised periodic boundary conditions, we extract electronic trends merely by
changing cells' symmetry operations and respective quantum number samplings. It
turns out that for a minimum cell calculation, once geometric and magnetic
contributions are ignored, the effect of the global topology is unexpectedly
short-ranged.
","[{""version"":""v1"",""created"":""Fri, 29 Nov 2013 09:21:36 GMT""}]","2013-12-02"
"1311.7495","Sebastian Slama","Christian Stehle, Claus Zimmermann, and Sebastian Slama","Cooperative coupling of ultracold atoms and surface plasmons","9 pages, 4 figures","Nature Physics 10, 937 (2014)","10.1038/NPHYS3129",,"physics.atom-ph","http://arxiv.org/licenses/nonexclusive-distrib/1.0/","  Cooperative coupling between optical emitters and light fields is one of the
outstanding goals in quantum technology. It is both fundamentally interesting
for the extraordinary radiation properties of the participating emitters and
has many potential applications in photonics. While this goal has been achieved
using high-finesse optical cavities, cavity-free approaches that are broadband
and easy to build have attracted much attention recently. Here we demonstrate
cooperative coupling of ultracold atoms with surface plasmons propagating on a
plane gold surface. While the atoms are moving towards the surface they are
excited by an external laser pulse. Excited surface plasmons are detected via
leakage radiation into the substrate of the gold layer. A maximum Purcell
factor of $\eta_\mathrm{P}=4.9$ is reached at an optimum distance of
$z=250~\mathrm{nm}$ from the surface. The coupling leads to the observation of
a Fano-like resonance in the spectrum.
","[{""version"":""v1"",""created"":""Fri, 29 Nov 2013 09:24:52 GMT""},{""version"":""v2"",""created"":""Tue, 2 Sep 2014 10:03:07 GMT""}]","2014-12-10"
"1311.7496","Fabien Paillusson","Maria Barbi and Fabien Paillusson","Protein-DNA electrostatics: toward a new paradigm for protein sliding","54 pages, 18 figures","Advances in Protein Chemistry and Structural Biology, vol. 92, p.
  253-297 (2013)",,,"physics.bio-ph cond-mat.soft q-bio.BM","http://arxiv.org/licenses/nonexclusive-distrib/1.0/","  Gene expression and regulation rely on an apparently finely tuned set of
reactions between some proteins and DNA. Such DNA-binding proteins have to find
specific sequences on very long DNA molecules and they mostly do so in absence
of any active process. It has been rapidly recognized that to achieve this task
these proteins should be efficient at both searching (i.e. sampling fast
relevant parts of DNA) and finding (i.e. recognizing the specific site). A
two-mode search and variants of it have been suggested since the 70s to explain
either a fast search or an efficient recognition. Combining these two
properties at a phenomenological level is however more difficult as they appear
to have antagonist roles. To overcome this difficulty, one may simply need to
drop the dihcotomic view inherent to the two-mode search and look more
thoroughly at the set of interactions between DNA-binding proteins and a given
DNA segment either specific or non-specific. This chapter demonstrates that, in
doing so in a very generic way, one may indeed find a potential reconciliation
between a fast search and an efficient recognition. Although a lot remains to
be done, this could be the time for a change of paradigm
","[{""version"":""v1"",""created"":""Fri, 29 Nov 2013 09:26:22 GMT""}]","2013-12-02"
"1311.7497","Yitping Kok","Y. Kok, M. J. Ireland, P. G. Tuthill, J. G. Robertson, B. A.
  Warrington, A. C. Rizzuto and W. J. Tango","Phase-referenced Interferometry and Narrow-angle Astrometry with SUSI","35 pages, 51 figures, accepted for publication in JAI",,,,"astro-ph.IM","http://arxiv.org/licenses/nonexclusive-distrib/1.0/","  The Sydney University Stellar Interferometer (SUSI) now incorporates a new
beam combiner, called the Microarcsecond University of Sydney Companion
Astrometry instrument (MUSCA), for the purpose of high precision differential
astrometry of bright binary stars. Operating in the visible wavelength regime
where photon-counting and post-processing fringe tracking is possible, MUSCA
will be used in tandem with SUSI's primary beam combiner, Precision
Astronomical Visible Observations (PAVO), to record high spatial resolution
fringes and thereby measure the separation of fringe packets of binary stars.
In its current phase of development, the dual beam combiner configuration has
successfully demonstrated for the first time a dual-star phase-referencing
operation in visible wavelengths. This paper describes the beam combiner optics
and hardware, the network of metrology systems employed to measure every
non-common path between the two beam combiners and also reports on a recent
narrow-angle astrometric observation of $\delta$ Orionis A (HR 1852) as the
project enters its on-sky testing phase.
","[{""version"":""v1"",""created"":""Fri, 29 Nov 2013 09:26:51 GMT""}]","2013-12-02"
"1311.7498","Jerzy Lukierski","Jerzy Lukierski and Mariusz Woronowicz","Noncommutative Space-time from Quantized Twistors","7 pages; talk given at the Conference in Honour of 90-th Birthday of
  Freeman Dyson at Nanyang Technical University, Singapore,26-29.08.2013; to be
  published in Int.Journ.Mod.Phys.A",,"10.1142/9789814590112_0025",,"hep-th","http://arxiv.org/licenses/nonexclusive-distrib/1.0/","  We consider the relativistic phase space coordinates (x_{\mu},p_{\mu}) as
composite, described by functions of the primary pair of twistor coordinates.
It appears that if twistor coordinates are canonicaly quantized the composite
space-time coordinates are becoming noncommutative. We obtain deformed
Heisenberg algebra which in order to be closed should be enlarged by the
Pauli-Lubanski four-vector components. We further comment on star-product
quantization of derived algebraic structures which permit to introduce
spin-extended deformed Heisenberg algebra.
","[{""version"":""v1"",""created"":""Fri, 29 Nov 2013 09:34:19 GMT""}]","2017-08-23"
"1311.7499","Giovanni Catino","Giovanni Catino and Alix Deruelle and Lorenzo Mazzieri","Uniqueness of asymptotically cylindrical gradient shrinking Ricci
  solitons","There is a gap in the proofs of Theorem 4.2 and 5.3 due to the lack
  of Schauder estimates for the weighted laplacian",,,,"math.DG","http://arxiv.org/licenses/nonexclusive-distrib/1.0/","  In this paper we prove that any asymptotically cylindrical gradient shrinking
Ricci soliton is isometric to a cylinder.
","[{""version"":""v1"",""created"":""Fri, 29 Nov 2013 09:37:03 GMT""},{""version"":""v2"",""created"":""Mon, 2 Dec 2013 10:12:45 GMT""},{""version"":""v3"",""created"":""Tue, 10 Dec 2013 17:32:26 GMT""},{""version"":""v4"",""created"":""Sat, 20 Dec 2014 11:23:43 GMT""}]","2014-12-23"
"1311.7500","Roberto Taverna","Roberto Taverna, Fabio Muleri, Roberto Turolla, Paolo Soffitta, Sergio
  Fabiani, Luciano Nobili","Probing magnetars magnetosphere through X-ray polarization measurements","12 pages, 8 figures, accepted for publication in MNRAS",,"10.1093/mnras/stt2310",,"astro-ph.HE","http://arxiv.org/licenses/nonexclusive-distrib/1.0/","  The study of magnetars is of particular relevance since these objects are the
only laboratories where the physics in ultra-strong magnetic fields can be
directly tested. Until now, spectroscopic and timing measurements at X-ray
energies in soft gamma-repeaters (SGRs) and anomalous X-ray pulsar (AXPs) have
been the main source of information about the physical properties of a magnetar
and of its magnetosphere. Spectral fitting in the ~ 0.5-10 keV range allowed to
validate the ""twisted magnetosphere"" model, probing the structure of the
external field and estimating the density and velocity of the magnetospheric
currents. Spectroscopy alone, however, may fail in disambiguating the two key
parameters governing magnetospheric scattering (the charge velocity and the
twist angle) and is quite insensitive to the source geometry. X-ray
polarimetry, on the other hand, can provide a quantum leap in the field by
adding two extra observables, the linear polarization degree and the
polarization angle. Using the bright AXP 1RXS J170849.0-400910 as a template,
we show that phase-resolved polarimetric measurements can unambiguously
determine the model parameters, even with a small X-ray polarimetry mission
carrying modern photoelectric detectors and existing X-ray optics. We also show
that polarimetric measurements can pinpoint vacuum polarization effects and
thus provide an indirect evidence for ultra-strong magnetic fields.
","[{""version"":""v1"",""created"":""Fri, 29 Nov 2013 09:45:43 GMT""}]","2015-06-18"
"1311.7501","Gerard Clement","G\'erard Cl\'ement","Bertotti-Robinson solutions in five--dimensional quadratic gravity","16 pages. References added. Version to be published in Classical and
  Quantum Gravity","Class. Quantum Grav. 31 (2014) 075001","10.1088/0264-9381/31/7/075001","LAPTH-068/13","gr-qc hep-th","http://arxiv.org/licenses/nonexclusive-distrib/1.0/","  We construct new solutions of five-dimensional quadratic gravity as direct
products of a constant curvature two-surface with a solution of
three-dimensional new massive gravity with constant scalar curvature. These
solutions could represent near-horizon limits of five-dimensional
asymptotically flat black strings or black rings. A number of these
non-asymptotically flat solutions are themselves black strings or rings. A
by-product of our analysis is the construction of new solutions of
four-dimensional quadratic gravity obtained by toroidal reduction of the
five-dimensional solutions with flat transverse space. These again include
black strings or rings, and an $AdS_2\times T^2$ solution of $f(R)$ gravity for
a specific relation between the model parameters.
","[{""version"":""v1"",""created"":""Fri, 29 Nov 2013 09:49:58 GMT""},{""version"":""v2"",""created"":""Wed, 5 Feb 2014 09:35:11 GMT""}]","2015-06-18"
"1311.7502","Horia Cornean","Horia D. Cornean, Arne Jensen, Gheorghe Nenciu","Metastable states when the Fermi Golden Rule constant vanishes","To appear in Commun. Math. Phys","Commun. Math. Phys. 334(3), 1189-1218 (2015)","10.1007/s00220-014-2127-5",,"math-ph math.MP","http://arxiv.org/licenses/nonexclusive-distrib/1.0/","  Resonances appearing by perturbation of embedded non-degenerate eigenvalues
are studied in the case when the Fermi Golden Rule constant vanishes. Under
appropriate smoothness properties for the resolvent of the unperturbed
Hamiltonian, it is proved that the first order Rayleigh-Schr\""odinger expansion
exists. The corresponding metastable states are constructed using this
truncated expansion. We show that their exponential decay law has both the
decay rate and the error term of order $\varepsilon^4$, where $\varepsilon$ is
the perturbation strength.
","[{""version"":""v1"",""created"":""Fri, 29 Nov 2013 09:50:06 GMT""},{""version"":""v2"",""created"":""Fri, 28 Feb 2014 13:49:12 GMT""}]","2015-07-23"
"1311.7503","Sergey Rybakov","Sergey Rybakov","DG-modules over de Rham DG-algebra","21 pages",,,,"math.AG","http://arxiv.org/licenses/nonexclusive-distrib/1.0/","  For a morphism of smooth schemes over a regular affine base we define
functors of derived direct image and extraordinary inverse image on coderived
categories of DG-modules over de Rham DG-algebras. Positselski proved that for
a smooth algebraic variety $X$ over a field $k$ of characteristic zero the
coderived category of DG-modules over $\Omega^\bullet_{X/k}$ is equivalent to
the unbounded derived category of quasi-coherent right ${\mathscr
D}_X$-modules. We prove that our functors correspond to the functors of the
same name for ${\mathscr D}_X$-modules under Positselski equivalence.
","[{""version"":""v1"",""created"":""Fri, 29 Nov 2013 09:51:10 GMT""}]","2013-12-02"
"1311.7504","Chrisphin Karthick","Chrisphin Karthick. M, Angel R.Lopez-Sanchez, D.K. Sahu, B.B. Sanwal,
  Shuchi Bisht","Photometric and spectroscopic studies of star-forming regions within
  Wolf-Rayet galaxies","22 Pages, 14 Figures, accepted for publication in MNRAS",,"10.1093/mnras/stt2301",,"astro-ph.CO","http://arxiv.org/licenses/nonexclusive-distrib/1.0/","  We present a study of the properties of star-forming regions within a sample
of 7 Wolf-Rayet (WR) galaxies. We analyze their morphologies, colours,
star-formation rate (SFR), metallicities, and stellar populations combining
broad-band and narrow-band photometry with low-resolution optical spectroscopy.
The $UBVRI$ observations were made through the 2m HCT (Himalayan Chandra
Telescope) and 1m ARIES telescope. The spectroscopic data were obtained using
the Hanle Faint Object Spectrograph Camera (HFOSC) mounted on the 2m HCT. The
observed galaxies are NGC 1140, IRAS 07164+5301, NGC 3738, UM 311, NGC 6764,
NGC 4861 and NGC 3003. The optical spectra have been used to search for the
faint WR features, to confirm that the ionization of the gas is consequence of
the massive stars, and to quantify the oxygen abundance of each galaxy using
several and independent empirical calibrations. We detected the broad features
originated by WR stars in NGC 1140 and NGC 4861 and used them to derive their
population of massive stars. Using our H$\alpha$ images we have identified tens
of regions within these galaxies, for which we derived the SFR. For all regions
we found that the most recent star-formation event is 3 - 6 Myr old. We used
the optical broad-band colours in combination with Starburst99 models to
estimate the internal reddening and the age of the dominant underlying stellar
population within all these regions. Knots in NGC 3738, NGC 6764 and NGC 3003
generally show the presence of an important old (400 - 1000 Myr) stellar
population. However, the optical colours are not able to detect stars older
than 20 - 50 Myr in the knots of the other four galaxies. This fact suggests
both the intensity of the starbursts and that the star-formation activity has
been ongoing for at least some few tens of million years in these objects.
","[{""version"":""v1"",""created"":""Fri, 29 Nov 2013 09:55:33 GMT""}]","2013-12-02"
