"1311.7427","Fernando Quir\'os","Juan Luis V\'azquez, Arturo de Pablo, Fernando Quir\'os and Ana
  Rodr\'iguez","Classical solutions and higher regularity for nonlinear fractional
  diffusion equations","28 pages, 1 figure",,,,"math.AP","http://arxiv.org/licenses/nonexclusive-distrib/1.0/","  We study the regularity properties of the solutions to the nonlinear equation
with fractional diffusion $$ \partial_tu+(-\Delta)^{\sigma/2}\varphi(u)=0, $$
posed for $x\in \mathbb{R}^N$, $t>0$, with $0<\sigma<2$, $N\ge1$. If the
nonlinearity satisfies some not very restrictive conditions: $\varphi\in
C^{1,\gamma}(\mathbb{R})$, $1+\gamma>\sigma$, and $\varphi'(u)>0$ for every
$u\in\mathbb{R}$, we prove that bounded weak solutions are classical solutions
for all positive times. We also explore sufficient conditions on the
non-linearity to obtain higher regularity for the solutions, even $C^\infty$
regularity. Degenerate and singular cases, including the power nonlinearity
$\varphi(u)=|u|^{m-1}u$, $m>0$, are also considered, and the existence of
classical solutions in the power case is proved.
","[{""version"":""v1"",""created"":""Thu, 28 Nov 2013 21:12:09 GMT""}]","2013-12-02"
"1311.7428","Ilya Agapov","I. Agapov","Potential of a longitudinally focusing insertion for a storage ring
  X-ray FEL",,,,,"physics.acc-ph","http://arxiv.org/licenses/nonexclusive-distrib/1.0/","  In present work we investigate the potential of a longitudinally focusing
device to compress bunches passing an undulator for a synchrotron storage ring.
If integrated into a storage ring similar to PETRAIII such device could
potentially produce continuous $\sim$1ps pulses of photons in the $nm$ range
with peak pulse powers of tens of GW. Even without operating in FEL saturation
mode the longitudinal focusing can provide means to increase the brightness and
shorten the photon pulse length.
","[{""version"":""v1"",""created"":""Thu, 28 Nov 2013 21:17:01 GMT""}]","2013-12-02"
"1311.7429","Jean-Christophe Pain","Jean-Christophe Pain, Franck Gilleron, Quentin Porcherot and Thomas
  Blenski","The Hybrid Detailed / Statistical Opacity Code SCO-RCG: New Developments
  and Applications","Proceedings of the 18th APiP (Atomic Processes in Plasmas) conference
  (Auburn, AL, USA, October 7-10th 2013); submitted to AIP Conf. Proc",,"10.1063/1.4975753",,"physics.atom-ph physics.plasm-ph","http://arxiv.org/licenses/nonexclusive-distrib/1.0/","  We present the hybrid opacity code SCO-RCG which combines statistical
approaches with fine-structure calculations. Radial integrals needed for the
computation of detailed transition arrays are calculated by the code SCO
(Super-configuration Code for Opacity), which calculates atomic structure at
finite temperature and density, taking into account plasma effects on the
wave-functions. Levels and spectral lines are then computed by an adapted RCG
routine of R. D. Cowan. SCO-RCG now includes the Partially Resolved Transition
Array model, which allows one to replace a complex transition array by a
small-scale detailed calculation preserving energy and variance of the genuine
transition array and yielding improved high-order moments. An approximate
method for studying the impact of strong magnetic field on opacity and
emissivity was also recently implemented.
","[{""version"":""v1"",""created"":""Thu, 28 Nov 2013 21:30:09 GMT""}]","2019-04-30"
"1311.7430","Przemys{\l}aw Spurek","P. Spurek, A. Chaikouskaya, J. Tabor, E. Zaj\k{a}c","A local Gaussian filter and adaptive morphology as tools for completing
  partially discontinuous curves",,,,,"cs.GR","http://arxiv.org/licenses/nonexclusive-distrib/1.0/","  This paper presents a method for extraction and analysis of curve--type
structures which consist of disconnected components. Such structures are found
in electron--microscopy (EM) images of metal nanograins, which are widely used
in the field of nanosensor technology.
  The topography of metal nanograins in compound nanomaterials is crucial to
nanosensor characteristics. The method of completing such templates consists of
three steps. In the first step, a local Gaussian filter is used with different
weights for each neighborhood. In the second step, an adaptive morphology
operation is applied to detect the endpoints of curve segments and connect
them. In the last step, pruning is employed to extract a curve which optimally
fits the template.
","[{""version"":""v1"",""created"":""Thu, 28 Nov 2013 21:45:10 GMT""}]","2013-12-02"
"1311.7431","Jacob Khurgin B","Jacob Khurgin, Yamac Dikmelik, Andreas Hugi, Jerome Faist","Coherent Frequency Combs produced by Self Frequency Modulation in
  Quantum Cascade Lasers",,"Applied Physics Letters 104, 081118 (2014);","10.1063/1.4866868",,"physics.optics","http://arxiv.org/licenses/nonexclusive-distrib/1.0/","  One salient characteristic of Quantum Cascade Laser (QCL) is its very shor
gain recovery time that so far thwarted the attempts to achieve self-mode
locking of the device into a train of single pulses. We show theoretically that
four wave mixing, combined with the short gain recovery time causes QCL to
operate in the self-frequency-modulated regime characterized by a constant
power in time domain and stable coherent comb in the frequency domain.Coherent
frequency comb may enable many potential applications of QCL in sensing and
measurement.
","[{""version"":""v1"",""created"":""Thu, 28 Nov 2013 21:47:26 GMT""}]","2014-03-21"
"1311.7432","Remo Ruffini","R. Ruffini, Jorge A. Rueda, C. Barbarino, C.L. Bianco, H. Dereli, M.
  Enderli, L. Izzo, M. Muccino, A.V. Penacchioni, G.B. Pisani, Y. Wang","Induced Gravitational Collapse in the BATSE era: the case of GRB 970828","25 pages, 5 figures, submitted to Astron.Rep",,"10.1134/S1063772915070094",,"astro-ph.HE astro-ph.CO","http://arxiv.org/licenses/nonexclusive-distrib/1.0/","  Following the recently established ""Binary-driven HyperNova"" (BdHN) paradigm,
we here interpret GRB 970828 in terms of the four episodes typical of such a
model. The ""Episode 1"", up to 40 s after the trigger time t_0, with a time
varying thermal emission and a total energy of E_{iso,1st} = 2.60 x 10^{53}
erg, is interpreted as due to the onset of an hyper-critical accretion process
onto a companion neutron star, triggered by the companion star, an FeCO core
approaching a SN explosion. The ""Episode 2"", observed up t_0+90 s, is
interpreted as a canonical gamma ray burst, with an energy of E^{e^+e^-}_{tot}
= 1.60 x 10^{53} erg, a baryon load of B = 7 x 10^{-3} and a bulk Lorentz
factor at transparency of \Gamma = 142.5. From this Episode 2, we infer that
the GRB exploded in an environment with a large average particle density <n>
\approx 10^3 particles/cm^3 and dense clouds characterized by typical
dimensions of (4 \div 8) x 10^{14} cm and \delta n / n ~ 10. The ""Episode 3"" is
identified from t_0+90 s all the way up to 10^{5-6} s: despite the paucity of
the early X-ray data, typical in the BATSE, pre-Swift era, we find extremely
significant data points in the late X-ray afterglow emission of GRB 970828,
which corresponds to the ones observed in all BdHNe sources. The ""Episode 4"",
related to the Supernova emission, does not appear to be observable in this
source, due to the presence of darkening from the large density of the GRB
environment, also inferred from the analysis of the Episode 2.
","[{""version"":""v1"",""created"":""Thu, 28 Nov 2013 21:55:42 GMT""},{""version"":""v2"",""created"":""Mon, 24 Nov 2014 15:21:32 GMT""}]","2017-03-08"
"1311.7433","Ramon Grima","Ramon Grima, Nils Walter and Santiago Schnell","Single molecule enzymology a la Michaelis-Menten","Review article, 32 pages, 4 figures; accepted for publication in FEBS
  Journal",,,,"q-bio.SC","http://arxiv.org/licenses/nonexclusive-distrib/1.0/","  In the past one hundred years, deterministic rate equations have been
successfully used to infer enzyme-catalysed reaction mechanisms and to estimate
rate constants from reaction kinetics experiments conducted in vitro. In recent
years, sophisticated experimental techniques have been developed that allow the
measurement of enzyme- catalysed and other biopolymer-mediated reactions inside
single cells at the single molecule level. Time course data obtained by these
methods are considerably noisy because molecule numbers within cells are
typically quite small. As a consequence, the interpretation and analysis of
single cell data requires stochastic methods, rather than deterministic rate
equations. Here we concisely review both experimental and theoretical
techniques which enable single molecule analysis with particular emphasis on
the major developments in the field of theoretical stochastic enzyme kinetics,
from its inception in the mid-twentieth century to its modern day status. We
discuss the differences between stochastic and deterministic rate equation
models, how these depend on enzyme molecule numbers and substrate inflow into
the reaction compartment and how estimation of rate constants from single cell
data is possible using recently developed stochastic approaches.
","[{""version"":""v1"",""created"":""Thu, 28 Nov 2013 22:09:18 GMT""}]","2013-12-02"
"1311.7434","Stefano Soatto","Joshua Hernandez, Konstantine Tsotsos and Stefano Soatto","Observability, Identifiability and Sensitivity of Vision-Aided
  Navigation",,,,"Technical Report UCLA CSD TR130022, Aug. 20, 2013 (Revised Nov. 12,
  2013 and May 10, 2014)","cs.RO","http://arxiv.org/licenses/nonexclusive-distrib/1.0/","  We analyze the observability of motion estimates from the fusion of visual
and inertial sensors. Because the model contains unknown parameters, such as
sensor biases, the problem is usually cast as a mixed identification/filtering,
and the resulting observability analysis provides a necessary condition for any
algorithm to converge to a unique point estimate. Unfortunately, most models
treat sensor bias rates as noise, independent of other states including biases
themselves, an assumption that is patently violated in practice. When this
assumption is lifted, the resulting model is not observable, and therefore past
analyses cannot be used to conclude that the set of states that are
indistinguishable from the measurements is a singleton. In other words, the
resulting model is not observable. We therefore re-cast the analysis as one of
sensitivity: Rather than attempting to prove that the indistinguishable set is
a singleton, which is not the case, we derive bounds on its volume, as a
function of characteristics of the input and its sufficient excitation. This
provides an explicit characterization of the indistinguishable set that can be
used for analysis and validation purposes.
","[{""version"":""v1"",""created"":""Thu, 28 Nov 2013 22:28:47 GMT""},{""version"":""v2"",""created"":""Wed, 14 May 2014 22:40:25 GMT""},{""version"":""v3"",""created"":""Sun, 26 Apr 2015 20:09:39 GMT""}]","2015-04-28"
"1311.7435","Liang Wang Ph.D Candidate","Liang Wang, Jussi Kangasharju","Experimenting with BitTorrent on a Cluster: A Good or a Bad Idea?","15 pages",,,,"cs.DC","http://arxiv.org/licenses/nonexclusive-distrib/1.0/","  Evaluation of large-scale network systems and applications is usually done in
one of three ways: simulations, real deployment on Internet, or on an emulated
network testbed such as a cluster. Simulations can study very large systems but
often abstract out many practical details, whereas real world tests are often
quite small, on the order of a few hundred nodes at most, but have very
realistic conditions. Clusters and other dedicated testbeds offer a middle
ground between the two: large systems with real application code. They also
typically allow configuring the testbed to enable repeatable experiments. In
this paper we explore how to run large BitTorrent experiments in a cluster
setup. We have chosen BitTorrent because the source code is available and it
has been a popular target for research. Our contribution is twofold. First, we
show how to tweak and configure the BitTorrent client to allow for a maximum
number of clients to be run on a single machine, without running into any
physical limits of the machine. Second, our results show that the behavior of
BitTorrent can be very sensitive to the configuration and we revisit some
existing BitTorrent research and consider the implications of our findings on
previously published results. As we show in this paper, BitTorrent can change
its behavior in subtle ways which are sometimes ignored in published works.
","[{""version"":""v1"",""created"":""Thu, 28 Nov 2013 22:34:11 GMT""}]","2013-12-02"
"1311.7436","Maximilian Wilfling","Max Wilfling and Christof Gattringer","A test of Taylor- and modified Taylor-expansion","Two typos corrected; results unchanged",,,,"hep-lat","http://arxiv.org/licenses/nonexclusive-distrib/1.0/","  We compare Taylor expansion and a modified variant of Taylor expansion, which
incorporates features of the fugacity series, for expansions in the chemical
potential around a zero-density lattice field theory. As a first test we apply
both series to the cases of free fermions and free bosons. Convergence and
other properties are analyzed.
","[{""version"":""v1"",""created"":""Thu, 28 Nov 2013 22:43:23 GMT""},{""version"":""v2"",""created"":""Tue, 8 Apr 2014 19:48:13 GMT""}]","2014-04-09"
"1311.7437","Gady Kozma","Gady Kozma and Vladas Sidoravicius","Lower bound for the escape probability in the Lorentz Mirror Model on
  the lattice","2 pages. Really, just 2 pages",,,,"math.PR","http://arxiv.org/licenses/nonexclusive-distrib/1.0/","  We show that in the Lorentz mirror model, at any density of mirrors, the
probability of a particle starting at the origin to reach distance n is at
least 1/(2n+1).
","[{""version"":""v1"",""created"":""Thu, 28 Nov 2013 22:47:59 GMT""}]","2013-12-02"
"1311.7438","Alex Hayat","Alex Hayat, Amir Feizpour, and Aephraim M. Steinberg","Enhanced Probing of Fermion Interaction Using Weak Value Amplification",,,"10.1103/PhysRevA.88.062301",,"quant-ph cond-mat.mes-hall","http://arxiv.org/licenses/nonexclusive-distrib/1.0/","  We propose a scheme for enhanced probing of an interaction between two single
fermions based on weak-value amplification. The scheme is applied to measuring
the anisotropic electron-hole exchange interaction strength in semiconductor
quantum dots, where both spin and energy are mapped onto emitted photons. We
study the effect of dephasing of the probe on the weak-value-enhanced
measurement. We find that in the limit of slow noise, weak-value amplification
provides a unique tool for enhanced-precision measurement of few-fermion
systems.
","[{""version"":""v1"",""created"":""Thu, 28 Nov 2013 22:52:36 GMT""}]","2015-06-18"
"1311.7439","Tal Orenshtein","Gady Kozma and Tal Orenshtein and Igor Shinkar","Excited random walk with periodic cookies","31 pages, no figures. Incorporating several corrections","Annales de l'Institut Henri Poincar\'e - Probabilit\'es et
  Statistiques 2016, Vol. 52, No. 3, 1023-1049","10.1214/15-AIHP669",,"math.PR","http://arxiv.org/licenses/nonexclusive-distrib/1.0/","  In this paper we consider an excited random walk on $\mathbb{Z}$ in
identically piled periodic environment. This is a discrete time process on
$\mathbb{Z}$ defined by parameters $(p_1,\dots p_M) \in [0,1]^M$ for some
positive integer $M$, where the walker upon the $i$-th visit to $z \in
\mathbb{Z}$ moves to $z+1$ with probability $p_{i\pmod M}$, and moves to $z-1$
with probability $1-p_{i \pmod M}$. We give an explicit formula in terms of the
parameters $(p_1,\dots,p_M)$ which determines whether the walk is recurrent,
transient to the left, or transient to the right. In particular, in the case
that $\frac{1}{M}\sum_{i=1}^{M}p_{i}=\frac {1}{2}$ all behaviors are possible,
and may depend on the order of the $p_i$. Our framework allows us to reprove
some known results on ERW with no additional effort.
","[{""version"":""v1"",""created"":""Thu, 28 Nov 2013 22:59:38 GMT""},{""version"":""v2"",""created"":""Sat, 20 Dec 2014 09:30:49 GMT""}]","2018-04-05"
"1311.7440","Benoit Blossier","D. Becirevic, B. Blossier, A. Gerardin, A. Le Yaouanc, F. Sanfilippo","B decays to radially excited D","7 pages, 3 figures. Proceedings of the 31st International Symposium
  on Lattice Field Theory (Lattice 2013), 29 July - 3 August 2013, Mainz,
  Germany",,,,"hep-lat hep-ph","http://arxiv.org/licenses/nonexclusive-distrib/1.0/","  We discuss the possibility to measure in present experiments, especially
LHCb, the non leptonic decay branching ratio $B \to D' \pi$, and emphasize
phenomenological implications on $B \to D' l \nu$ semileptonic decay. We have
estimated by lattice QCD the $D'$ decay constant $f_{D'}$ that parameterizes
the $D'$ emission contribution to the Class-III non leptonic decay $B^- \to D^0
\pi^-$. In addition, we provide a new estimate of the decay constants
$f_{D_{s,q}}$ which read $f_{D_{s}}=252(3)$ MeV and
$f_{D_{s}}/f_{D}=1.23(1)(1)$.
","[{""version"":""v1"",""created"":""Thu, 28 Nov 2013 23:03:18 GMT""}]","2013-12-02"
"1311.7441","Walter  Ferrer","Andr\'es Abella, Walter Ferrer Santos","Almost involutive Hopf algebras",,,,,"math.RA","http://arxiv.org/licenses/nonexclusive-distrib/1.0/","  We define the concept of \emph{companion automorphism} of a Hopf algebra $H$
as an automorphism $\sigma:H \rightarrow H$: $\sigma^2=S^2$ --where $S$ denotes
the antipode--. A Hopf algebra is said to be \emph{almost involutive} (AI) if
it admits a companion automorphism that can be viewed as a special additional
symmetry. We present examples and study some of the basic properties and
constructions of AI-Hopf algebras centering the attention in the finite
dimensional case. In particular we show that within the family of Hopf algebras
of dimension smaller or equal than 15, only in dimension eight and twelve,
there are non almost involutive Hopf algebras.
","[{""version"":""v1"",""created"":""Thu, 28 Nov 2013 23:03:32 GMT""}]","2013-12-02"
"1311.7442","Virgil Griffith","Virgil Griffith and Jonathan Harel","Irreducibility is Minimum Synergy Among Parts","15 pages, 6 figures. Only minor changes from v1",,,,"cs.IT math.IT","http://arxiv.org/licenses/nonexclusive-distrib/1.0/","  For readers already familiar with Partial Information Decomposition (PID), we
show that PID's definition of synergy enables quantifying at least four
different notions of irreducibility. First, we show four common notions of
""parts"" give rise to a spectrum of four distinct measures of irreducibility.
Second, we introduce a nonnegative expression based on PID for each notion of
irreducibility. Third, we delineate these four notions of irreducibility with
exemplary binary circuits. This work will become more useful once the
complexity community has converged on a palatable $\operatorname{I}_{\cap}$ or
$\operatorname{I}_{\cup}$ measure.
","[{""version"":""v1"",""created"":""Thu, 28 Nov 2013 23:10:59 GMT""},{""version"":""v2"",""created"":""Thu, 12 Dec 2013 18:08:34 GMT""}]","2013-12-13"
"1311.7443","D.D. Sarma","S. K. Panda, I. Dasgupta, E. Sasioglu, S. Blugel, and D. D. Sarma","NiS - An unusual self-doped, nearly compensated antiferromagnetic metal",,"Scientific Reports 3, 2995 (2013)",,,"cond-mat.str-el","http://arxiv.org/licenses/nonexclusive-distrib/1.0/","  NiS, exhibiting a text-book example of a first-order transition with many
unusual properties at low temperatures, has been variously described in terms
of conflicting descriptions of its ground state during the past several
decades. We calculate these physical properties within first-principle
approaches based on the density functional theory and conclusively establish
that all experimental data can be understood in terms of a rather unusual
ground state of NiS that is best described as a self-doped, nearly compensated,
antiferromagnetic metal, resolving the age-old controversy. We trace the origin
of this novel ground state to the specific details of the crystal structure,
band dispersions and a sizable Coulomb interaction strength that is still
sub-critical to drive the system in to an insulating state. We also show how
the specific antiferromagnetic structure is a consequence of the less-discussed
90 degree and less than 90 degree superexchange interactions built in to such
crystal structures.
","[{""version"":""v1"",""created"":""Thu, 28 Nov 2013 23:29:01 GMT""}]","2013-12-02"
"1311.7444","Alex Meistrenko","Alex Meistrenko, Christian Wesp, Hendrik van Hees and Carsten Greiner","Nonequilibrium dynamics and transport near the chiral phase transition
  of a quark-meson model","5 pages, 3 figures, to appear in the proceedings of FAIRNESS, 15-21
  September 2013, Berlin, Germany",,"10.1088/1742-6596/503/1/012003",,"hep-ph","http://arxiv.org/licenses/nonexclusive-distrib/1.0/","  Based on the 2PI quantum effective action of the linear sigma model with
constituent quarks, we develop a transport approach to study systems out of
equilibrium. In particular, we focus on the chiral phase transition as well as
the critical point, where nonequilibrium effects near the phase transition give
rise to critical behavior such as the fluctuation of the baryon number density.
Predictions for long-range correlations and fluctuations of observables in our
model could be used to study fundamental properties of the QCD phase
transition. In the previous version of our transport model the chiral fields
are implemented as mean fields, whereas quarks are treated as on-shell
particles in the Vlasov equation with a dynamical force term. The current
update includes also the distribution functions of sigma mesons and pions in a
self-consistent way. On this basis a dissipation kernel between the mean fields
and particle modes can be implemented.
","[{""version"":""v1"",""created"":""Thu, 28 Nov 2013 23:34:40 GMT""}]","2015-06-18"
"1311.7445","Daniel Davis","Daniel G. Davis","Homotopy fixed points for profinite groups emulate homotopy fixed points
  for discrete groups","16 pages, the tex file uses the style file of the New York Journal of
  Mathematics","New York Journal of Mathematics, 19 (2013), 909-924",,,"math.AT","http://arxiv.org/licenses/nonexclusive-distrib/1.0/","  If K is a discrete group and Z is a K-spectrum, then the homotopy fixed point
spectrum Z^{hK} is Map_*(EK_+, Z)^K, the fixed points of a familiar expression.
Similarly, if G is a profinite group and X is a discrete G-spectrum, then
X^{hG} is often given by (H_{G,X})^G, where H_{G,X} is a certain explicit
construction given by a homotopy limit in the category of discrete G-spectra.
Thus, in each of two common equivariant settings, the homotopy fixed point
spectrum is equal to the fixed points of an explicit object in the ambient
equivariant category. We enrich this pattern by proving in a precise sense that
the discrete G-spectrum H_{G,X} is just ""a profinite version"" of Map_*(EK_+,
Z): at each stage of its construction, H_{G,X} replicates in the setting of
discrete G-spectra the corresponding stage in the formation of Map_*(EK_+, Z)
(up to a certain natural identification).
","[{""version"":""v1"",""created"":""Thu, 28 Nov 2013 23:50:57 GMT""}]","2013-12-02"
"1311.7446","Gabriela Weitze-Schmithuesen","Jan-Christoph Schlage-Puchta and Gabriela Weitze-Schmithuesen","Finite translation surfaces with maximal number of translations","11 pages, 5 figures",,,,"math.GT math.GR","http://arxiv.org/licenses/nonexclusive-distrib/1.0/","  The natural automorphism group of a translation surface is its group of
translations. For finite translation surfaces of genus g > 1 the order of this
group is naturally bounded in terms of g due to a Riemann-Hurwitz formula
argument. In analogy with classical Hurwitz surfaces, we call surfaces which
achieve the maximal bound Hurwitz translation surfaces. We study for which g
there exist Hurwitz translation surfaces of genus g.
","[{""version"":""v1"",""created"":""Thu, 28 Nov 2013 23:57:55 GMT""}]","2013-12-02"
"1311.7447","Cristina Stoica","Tanya Schmah and Cristina Stoica","Normal forms for Lie symmetric cotangent bundle systems with free and
  proper actions","33 pages. 2 figures",,,,"math.DS math-ph math.DG math.MP nlin.SI","http://arxiv.org/licenses/nonexclusive-distrib/1.0/","  We consider free and proper cotangent-lifted symmetries of Hamiltonian
systems. For the special case of G = SO(3), we construct symplectic slice
coordinates around an arbitrary point. We thus obtain a parametrisation of the
phase space suitable for the study of dynamics near relative equilibria, in
particular for the Birkhoff-Poincare normal form method. For a general symmetry
group, we observe that for the calculation of the truncated normal forms, one
does not need an explicit coordinate transformation but only its higher
derivatives at the relative equilibrium. We outline an iterative scheme using
these derivatives for the computation of truncated Birkhoff-Poincare normal
forms.
","[{""version"":""v1"",""created"":""Fri, 29 Nov 2013 00:00:45 GMT""}]","2013-12-02"
