"1305.0066","Hidehiro Yonezawa Dr","Kohjiro Iwasawa, Kenzo Makino, Hidehiro Yonezawa, Mankei Tsang,
  Aleksandar Davidovic, Elanor Huntington, and Akira Furusawa","Quantum-Limited Mirror-Motion Estimation",,"Phys. Rev. Lett. 111, 163602 (2013)","10.1103/PhysRevLett.111.163602",,"quant-ph","http://arxiv.org/licenses/nonexclusive-distrib/1.0/","  We experimentally demonstrate optomechanical motion and force measurements
near the quantum precision limits set by the quantum Cram\'er-Rao bounds
(QCRBs). Optical beams in coherent and phase-squeezed states are used to
measure the motion of a mirror under an external stochastic force. Utilizing
optical phase tracking and quantum smoothing techniques, we achieve position,
momentum, and force estimation accuracies close to the QCRBs with the coherent
state, while estimation using squeezed states shows clear quantum enhancements
beyond the coherent-state bounds.
","[{""version"":""v1"",""created"":""Wed, 1 May 2013 01:35:30 GMT""}]","2013-10-24"
"1305.0067","Qingwen Wu","Qingwen Wu (HUST), Xinwu Cao (SHAO), Luis C. Ho (Carnegie Obs.), and
  Ding-Xiong Wang (HUST)","A Physical Link Between Jet Formation and Hot Plasma in Active Galactic
  Nuclei","Accepted by ApJ, 8 pages, 3 figures",,"10.1088/0004-637X/770/1/31",,"astro-ph.HE","http://arxiv.org/licenses/nonexclusive-distrib/1.0/","  Recent observations suggest that in black hole X-ray binaries jet/outflow
formation is related to the hot plasma in the vicinity of the black hole,
either in the form of an advection-dominated accretion flow at low accretion
rates or in a disk corona at high accretion rates. We test the viability of
this scenario for supermassive black holes using two samples of active galactic
nuclei distinguished by the presence (radio-strong) and absence (radio-weak) of
well-collimated, relativistic jets. Each is centered on a narrow range of black
hole mass but spans a very broad range of Eddington ratios, effectively
simulating, in a statistical manner, the behavior of a single black hole
evolving across a wide spread in accretion states. Unlike the relationship
between the radio and optical luminosity, which shows an abruptly break between
high- and low-luminosity sources at an Eddington ratio of ~1, the radio
emission-a measure of the jet power-varies continuously with the hard X-ray
(2-10 keV) luminosity, roughly as L_R \propto L_X^(0.6-0.75). This relation,
which holds for both radio-weak and radio-strong active galaxies, is similar to
the one seen in X-ray binaries. Jet/outflow formation appears to be closely
linked to the conditions that give rise to the hot, optically thin coronal
emission associated with accretion flows, both in the regime of low and high
accretion rates.
","[{""version"":""v1"",""created"":""Wed, 1 May 2013 01:50:01 GMT""}]","2015-06-15"
"1305.0068","Lukas Helt","L. G. Helt, M. J. Steel, and J. E. Sipe","Parasitic nonlinearities in photon pair generation via integrated
  spontaneous four-wave mixing: critical problem or distraction?",,"Appl.Phys.Lett. 102 (2013) 201106:1-5","10.1063/1.4807503",,"quant-ph physics.optics","http://arxiv.org/licenses/nonexclusive-distrib/1.0/","  We consider integrated photon pair sources based on spontaneous four-wave
mixing and derive expressions for the pump powers at which various nonlinear
processes become relevant for a variety of source materials and structures.
These expressions serve as rules of thumb in identifying reasonable parameter
regimes for the design of such sources. We demonstrate that if pump powers are
kept low enough to suppress cross-phase modulation, multi-pair events as well
as many other nonlinear effects are often also constrained to negligible
levels.
","[{""version"":""v1"",""created"":""Wed, 1 May 2013 02:06:56 GMT""}]","2013-08-15"
"1305.0069","Martin Fink","Martin Fink and Sergey Pupyrev","Ordering Metro Lines by Block Crossings",,,,,"cs.DS","http://arxiv.org/licenses/nonexclusive-distrib/1.0/","  A problem that arises in drawings of transportation networks is to minimize
the number of crossings between different transportation lines. While this can
be done efficiently under specific constraints, not all solutions are visually
equivalent. We suggest merging crossings into block crossings, that is,
crossings of two neighboring groups of consecutive lines. Unfortunately,
minimizing the total number of block crossings is NP-hard even for very simple
graphs. We give approximation algorithms for special classes of graphs and an
asymptotically worst-case optimal algorithm for block crossings on general
graphs. That is, we bound the number of block crossings that our algorithm
needs and construct worst-case instances on which the number of block crossings
that is necessary in any solution is asymptotically the same as our bound.
","[{""version"":""v1"",""created"":""Wed, 1 May 2013 02:14:19 GMT""},{""version"":""v2"",""created"":""Sat, 22 Jun 2013 13:22:52 GMT""}]","2013-06-25"
"1305.0070","Jia-Shu Lu","Chun Liu and Jia-Shu Lu","Dark Matter and Gauge Coupling Unification in A Supersymmetry Model with
  Vector-like Matter","19 pages, 1 figure. Accepted for publication in JHEP",,"10.1007/JHEP05(2013)040",,"hep-ph","http://arxiv.org/licenses/nonexclusive-distrib/1.0/","  WIMP dark matter and gauge coupling unification are considered in an R-parity
violating MSSM with vector-like matter. Dark matter is contained in an
additional vector-like SU(2)$_L$ doublet which possesses a new U(1) gauge
symmetry. The Higgs fields are extended to be in a ${\bf 5\oplus \bar{5}}$
representation of SU(5). The stability of dark matter is a result of gauge
symmetries, and the mass of the dark matter particle is between (1.1-1.5) TeV.
Dark matter has a very small cross section with nucleis, thus the model is
consistent with current dark matter direct detection experiments such as
Xenon100. The model also predicts new charged and colored particles to be
observed at LHC.
","[{""version"":""v1"",""created"":""Wed, 1 May 2013 02:29:12 GMT""}]","2013-05-14"
"1305.0071","Renjun Xu","Andrei Mikhailov, Albert Schwarz, Renjun Xu","Cohomology ring of the BRST operator associated to the sum of two pure
  spinors","5 pages","Mod. Phys. Lett. A, Vol. 28, No. 23 (2013) 1350107","10.1142/S0217732313501071",,"hep-th math-ph math.MP","http://arxiv.org/licenses/nonexclusive-distrib/1.0/","  In the study of the Type II superstring, it is useful to consider the BRST
complex associated to the sum of two pure spinors. The cohomology of this
complex is an infinite-dimensional vector space. It is also a
finite-dimensional algebra over the algebra of functions of a single pure
spinor. In this paper we study the multiplicative structure.
","[{""version"":""v1"",""created"":""Wed, 1 May 2013 02:34:05 GMT""}]","2013-07-22"
"1305.0072","Qingwen Wu","Qingwen Wu (HUST), Hao Yan (HUST), and Zhu Yi (HUST)","Warping of accretion disk and launching of jet by a spinning black hole
  in NGC 4258","Accepted by MNRAS, improved with the help of referee's comments and
  main conclusions are unchanged!",,"10.1093/mnras/stt1655",,"astro-ph.HE","http://arxiv.org/licenses/nonexclusive-distrib/1.0/","  We fit the most updated broadband spectral energy distribution from radio to
X-rays for NGC 4258 with a coupled accretion-jet model that surrounding a Kerr
black hole (BH), where both the jet and the warped H_2O maser disk are assumed
to be triggered by a spinning BH through Blandford-Znajek mechanism and
Bardeen-Petterson effect respectively. The accretion flow consists with an
inner radiatively inefficient accretion flow (RIAF) and an outer truncated
standard thin disk, where the transition radius R_tr~3*10^3Rg for NGC 4258
based on the width and variability of its narrow Fe K$\alpha$ line. The hybrid
jet formation model, as a variant of Blandford-Znajek model, is used to model
the jet power. Therefore, we can estimate the accretion rate and BH spin
through the two observed quantities--X-ray emission and jet power, where the
observed jet power is estimated from the low-frequency radio emission. Through
this method, we find that the BH of NGC 4258 should be mildly spinning with
dimensionless spin parameter a_*=0.7\pm0.2. The outer thin disk mainly radiates
at near infrared waveband and the jet contributes predominantly at radio
waveband. Using above estimated BH spin and the inferred accretion rate at the
region of the maser disk based on the physical existence of the H_2 O maser, we
find that the warp radius is ~8.6*10^4 R_g if it is driven by the
Bardeen-Petterson effect, which is consistent with the observational result
very well.
","[{""version"":""v1"",""created"":""Wed, 1 May 2013 02:35:28 GMT""},{""version"":""v2"",""created"":""Wed, 4 Sep 2013 04:13:13 GMT""}]","2015-06-15"
"1305.0073","Jorge Mastache","Jorge Mastache, Axel de la Macorra, Jorge L. Cervantes-Cota","Dark Matter Phase Transition Constrained at O(0.1) eV with LSB Rotation
  Curves","6 pages, 2 figures, Conference 8th International Workshop on the Dark
  Side of the Universe : DSU 2012. CNUM: C12-06-10","J.Mastache, A. de la Macorra, J.L. Cervantes-Cota, PoS DSU 2012,
  024 (2012)",,"CNUM: C12-06-10","astro-ph.CO","http://arxiv.org/licenses/nonexclusive-distrib/1.0/","  In order to unravel the nature of the dark matter (DM) we have proposed a
particle-physics motivated model called Bound Dark Matter (BDM) that consist in
DM massless particles above a threshold energy Ec that acquire mass below it
due to nonperturbative methods. Therefore, the BDM model describes DM particles
which are relativistic, hot dark matter (HDM) in the denser (inner) regions of
galaxies and describes nonrelativistic, cold dark matter (CDM) where halo
density is below rho_c = Ec^4. We test this model by fitting rotation curves
from Low Surface Brightness (LSB) galaxies from The HI Nearby Galaxy Survey
(THINGS). We use a particular DM cored profile that contains three parameters:
a typical scale length (rs) and density (rho_0) of the halo, and a core radius
(rc) stemming from the relativistic nature of the BDM model. Since the energy
Ec parameterizes the phase transition due to the underlying particle physics
model, it is independent on the details of galaxy and/or structure formation
and therefore the DM profile parameters rs, rc, Ec are constrained, leaving
only two free parameters. Through the results we agree with previous ones
implying that cored profiles are preferred over the N-body motivated cuspy
profiles. We also compute 2D likelihoods of the BDM parameters rc and Ec for
the different galaxies and matter contents, and find an average galaxy core
radius rc = 1.48kpc and a transition energy between hot and cold dark matter at
Ec = 0.06 eV. The phase transition scale Ec is a new fundamental scale for our
DM model well motivated theoretical origin from gauge group dynamics.
","[{""version"":""v1"",""created"":""Wed, 1 May 2013 02:45:44 GMT""}]","2013-05-02"
"1305.0074","Naoto Yotsutani","Mamoru Doi, Naoto Yotsutani","Doubling construction of Calabi-Yau threefolds","22 pages, to appear in ""New York Journal of Mathematics""",,,,"math.DG math.AG","http://arxiv.org/licenses/nonexclusive-distrib/1.0/","  We give a differential-geometric construction and examples of Calabi-Yau
threefolds, at least one of which is {\it{new}}. Ingredients in our
construction are {\it admissible pairs}, which were dealt with by Kovalev in
\cite{K03} and further studied by Kovalev and Lee in \cite{KL11}. An admissible
pair $(\overline{X},D)$ consists of a three-dimensional compact K\""{a}hler
manifold $\overline{X}$ and a smooth anticanonical $K3$ divisor $D$ on
$\overline{X}$. If two admissible pairs $(\overline{X}_1,D_1)$ and
$(\overline{X}_2,D_2)$ satisfy the {\it gluing condition}, we can glue
$\overline{X}_1\setminus D_1$ and $\overline{X}_2\setminus D_2$ together to
obtain a Calabi-Yau threefold $M$. In particular, if $(\overline{X}_1,D_1)$ and
$(\overline{X}_2,D_2)$ are identical to an admissible pair $(\overline{X},D)$,
then the gluing condition holds automatically, so that we can {\it always}
construct a Calabi-Yau threefold from a {\it single} admissible pair
$(\overline{X},D)$ by {\it doubling} it. Furthermore, we can compute all Betti
and Hodge numbers of the resulting Calabi-Yau threefolds in the doubling
construction.
","[{""version"":""v1"",""created"":""Wed, 1 May 2013 03:02:34 GMT""},{""version"":""v2"",""created"":""Tue, 4 Jun 2013 14:16:46 GMT""},{""version"":""v3"",""created"":""Thu, 13 Nov 2014 11:17:23 GMT""}]","2014-11-14"
"1305.0075","Maxim Kharitonov","Maxim Kharitonov and Gabriel Kotliar","Kondo effect in monolayer and bilayer graphene: physical realizations of
  the multi-channel Kondo models","5 pages main text, 3 pages supplementary material, 1 fig","Phys. Rev. B 88, 201103(R) (2013)","10.1103/PhysRevB.88.201103",,"cond-mat.str-el","http://arxiv.org/licenses/nonexclusive-distrib/1.0/","  We perform a general group-theoretical study of the Kondo problem in
monolayer and bilayer graphene around the charge neutrality point. Utilizing
the group representation theory, we derive from symmetry considerations a
family of the Kondo models for all symmetric placements with either 3- or
6-fold rotational axis of an impurity atom in an arbitrary orbital state. We
find six possible classes of the partially anisotropic four-channel Kondo
model. As the key result, we argue several possibilities to realize the regime
of the dominant channel-symmetric two-channel Kondo effect, protected by the
local symmetry and specifics of the graphene band structure. Our findings open
prospects for the observation of the rich multi-channel Kondo physics in
graphene and the associated non-Fermi-liquid behavior.
","[{""version"":""v1"",""created"":""Wed, 1 May 2013 03:10:11 GMT""}]","2013-11-11"
"1305.0076","Yoshiaki Hagiwara","Yoshiaki Hagiwara, Makoto Miyoshi, Akihiro Doi, and Shinji Horiuchi","Submillimeter H2O Maser in Circinus Galaxy - A New Probe for the
  Circumnuclear Region of Active Galactic Nuclei","6 pages, 4 figures","2013 ApJ ,768, L38","10.1088/2041-8205/768/2/L38",,"astro-ph.GA astro-ph.CO","http://arxiv.org/licenses/nonexclusive-distrib/1.0/","  We present the first detection of extragalactic submillimeter H2O maser in
the 321 GHz transition toward the center of Circinus galaxy, the nearby Type 2
Seyfert using the Atacama Large Millimeter/Submillimeter Array. We find that
Doppler features of the detected 321 GHz H2O maser straddle the systemic
velocity of the galaxy as seen in the spectrum of the known 22 GHz H2O maser in
the galaxy. By comparing the velocities of the maser features in both
transitions, it can be deduced that the 321 GHz maser occurs in a region
similar to that of the 22 GHz maser, where the sub-parsec-scale distribution of
the 22 GHz maser was revealed by earlier very long baseline interferometry
observations. The detected maser features remain unresolved at the synthesized
beam of ~0"".66 (~15 pc) and coincide with the 321 GHz continuum peak within
small uncertainties. We also present a tentative detection of the highest
velocity feature (redshifts up to ~635 km/s) in the galaxy. If this
high-velocity feature arises from a Keplerian rotating disk well established in
this galaxy, it is located at a radius of ~0.018 pc (~1.2 x 10^5 Schwarzschild
radii), which might probe molecular material closest to the central engine.
","[{""version"":""v1"",""created"":""Wed, 1 May 2013 03:23:18 GMT""}]","2013-05-02"
"1305.0077","Xiangwen Zhang","Pengfei Guan, Zhizhang Wang, Xiangwen Zhang","A proof of the Alexanderov's uniqueness theorem for convex surfaces in
  $\mathbb R^3$",,,,,"math.AP","http://arxiv.org/licenses/nonexclusive-distrib/1.0/","  We give a new proof of a classical uniqueness theorem of Alexandrov using the
weak uniqueness continuation theorem of Bers-Nirenberg. We prove a version of
this theorem with the minimal regularity assumption: the spherical hessians of
the corresponding convex bodies as Radon measures are nonsingular.
","[{""version"":""v1"",""created"":""Wed, 1 May 2013 03:25:38 GMT""}]","2013-05-02"
"1305.0078","Agnid Banerjee","Agnid Banerjee, John L. Lewis","Gradient bounds for p-harmonic systems with vanishing neumann data in a
  convex domain",,,,,"math.AP","http://arxiv.org/licenses/nonexclusive-distrib/1.0/","  Let $ \ti \Om $ be a bounded convex domain in Euclidean $ n $ space, $ \hat x
\in \ar \ti \Om, $ and $ r > 0. $ Let $ \ti u = (\ti u^1, \ti u^2, \dots, \ti
u^N) $ be a weak solution to \[\nabla \cdot \left (|\nabla \ti u |^{p-2} \nabla
\ti u \right) = 0 \mbox{in} \ti \Om \cap B (\hat x, 4 r) \mbox{with} |\nabla
\ti u|^{p-2} \, \ti u_\nu = 0 \mbox{on} \ar \ti \Om \cap B (\hat x, 4 r). \] We
show that sub solution type arguments for certain uniformly elliptic systems
can be used to deduce that $ | \nabla \ti u | $ is bounded in $ \ti \Om \cap B
(\hat x, r)$ with constants depending only on $ n, p, N. $ and $ \frac{r^n}{|
\ti \Om \cap B (\hat x, r) |}.$ Our argument replaces an argument based on
level sets in recent important work of [CM], [CM1], [GS], [M], [M1], involving
similar problems.
","[{""version"":""v1"",""created"":""Wed, 1 May 2013 03:27:41 GMT""}]","2013-05-02"
"1305.0079","Alexander  Kruger","Alexander Y. Kruger and Nguyen H. Thao","About uniform regularity of collections of sets",,"Serdica Math. J. 39 (2013), 287-312",,,"math.OC","http://arxiv.org/licenses/nonexclusive-distrib/1.0/","  We further investigate the uniform regularity property of collections of sets
via primal and dual characterizing constants. These constants play an important
role in determining convergence rates of projection algorithms for solving
feasibility problems.
","[{""version"":""v1"",""created"":""Wed, 1 May 2013 03:44:22 GMT""},{""version"":""v2"",""created"":""Mon, 21 Oct 2013 23:22:55 GMT""}]","2015-01-20"
"1305.0080","Andre Nies","Yuki Maehara","Describing groups using first-order language",,,,,"math.GR","http://arxiv.org/licenses/nonexclusive-distrib/1.0/","  We investigate two notions about descriptions of groups using first-order
language: quasi-finite axiomatizability, concerning infinite groups, and
polylogarithmic compressibility, concerning classes of finite groups.
","[{""version"":""v1"",""created"":""Wed, 1 May 2013 03:56:54 GMT""}]","2013-05-02"
"1305.0081","David A. Kessler","Eli Barkai and David A. Kessler","Transport and the first passage time problem with application to cold
  atoms in optical traps","This manuscript is partially an extension of arXiv:1202.0701",,,,"cond-mat.stat-mech","http://arxiv.org/licenses/nonexclusive-distrib/1.0/","  Measurements of spatial diffusion of cold atoms in optical lattices have
revealed anomalous super-diffusion, which is controlled by the depth of the
optical lattice. We use first passage time statistics to derive the diffusion
front of the atoms. In particular, the distributions of areas swept under the
first passage curve till its first arrival, and of areas under the Bessel
excursion are shown to be powerful tools in the analysis of the atomic cloud. A
rather general relation between first passage time statistics and diffusivity
is discussed, showing that first passage time analysis is a useful tool in the
calculation of transport coefficients. A brief introduction to the
semi-classical description of Sisyphus cooling is provided which yields a rich
phase diagram for the dynamics.
","[{""version"":""v1"",""created"":""Wed, 1 May 2013 04:11:05 GMT""}]","2014-01-17"
"1305.0082","Amanda Weinstein","Amanda Weinstein, Jonathan Dumm, Lucy Fortson, Reshmi Mukherjee","The impact of astrophysical particle acceleration on searches for
  beyond-the-Standard-Model physics","Input for Snowmass 2013. Minor additions and corrections including
  corrected references to other whitepapers",,,,"astro-ph.HE","http://arxiv.org/licenses/nonexclusive-distrib/1.0/","  A brief white paper is provided, discussing how the particle acceleration
mechanisms taking place within astrophysical sources may mimic or mask
signatures of new physics and the role that will be played by next-generation
gamma-ray observatories, such as the Cherenkov Telescope Array, in improving
our understanding of these phenomena.
","[{""version"":""v1"",""created"":""Wed, 1 May 2013 04:50:29 GMT""},{""version"":""v2"",""created"":""Sun, 28 Jul 2013 23:29:45 GMT""}]","2013-07-30"
"1305.0083","Ajit Kumar","Srivatsan Rajagopal and Ajit Kumar","Quantization of B-I electrodynamics and B-I modified gravity using
  Faddeev-Popov gauge-fixing procedure",,,,,"gr-qc","http://arxiv.org/licenses/nonexclusive-distrib/1.0/","  We investigate the quantized versions of Born Infeld electrodynamics and Born
Infeld Gravity. We derive Feynman rules for B-I electrodynamics by deriving an
effective Lagrangian with the square root removed using the Faddeev-Popov
method. In the case of B-I gravity, the square root in the Lagrangian is
removed by the introduction of the Vierbien fields. This approach has the
advantage that SO(3,1) can be consistently regarded to be the gauge group of
gravity. Finally, using a rough argument, the quantum fluctuations of the radii
of spatial hypersurfaces in flat space are shown to undergo accelerated
increase with time.
","[{""version"":""v1"",""created"":""Wed, 1 May 2013 04:51:33 GMT""}]","2013-05-02"
"1305.0084","Satoshi Shirai","Masahiro Ibe, Shigeki Matsumoto, Satoshi Shirai and Tsutomu T.
  Yanagida","AMS-02 Positrons from Decaying Wino in the Pure Gravity Mediation Model","19 pages, 3 figures, version to appear in JHEP",,"10.1007/JHEP07(2013)063","IPMU-13-0084, ICRR-Report-652-2013-1","hep-ph","http://arxiv.org/licenses/nonexclusive-distrib/1.0/","  The AMS-02 collaboration has recently reported an excess of the cosmic-ray
positron fraction, which turned out to be consistent with previous results
reported by the PAMELA and Fermi-LAT collaborations. A decaying dark matter
with the mass around 1 TeV can be responsible for the excess of the positron
fraction when it is interpreted as a dark matter signal. Interestingly, the
pure gravity mediation model provides such a dark matter, namely an almost pure
neutral wino dark matter, when a tiny R-parity violation through $LLE^c$
interactions is introduced. We show that the decaying wino dark matter well
reproduces the energy spectrum of the fraction with being consistent with
constraints from cosmic-ray anti-proton and gamma-ray observations.
","[{""version"":""v1"",""created"":""Wed, 1 May 2013 04:53:34 GMT""},{""version"":""v2"",""created"":""Wed, 8 May 2013 19:01:03 GMT""},{""version"":""v3"",""created"":""Wed, 10 Jul 2013 09:47:52 GMT""}]","2017-02-22"
"1305.0085","Renato Paes Leme","Michal Feldman and David Kempe and Brendan Lucier and Renato Paes Leme","Pricing Public Goods for Private Sale","accepted to EC'13",,,,"cs.GT","http://arxiv.org/licenses/nonexclusive-distrib/1.0/","  We consider the pricing problem faced by a seller who assigns a price to a
good that confers its benefits not only to its buyers, but also to other
individuals around them. For example, a snow-blower is potentially useful not
only to the household that buys it, but also to others on the same street.
Given that the seller is constrained to selling such a (locally) public good
via individual private sales, how should he set his prices given the
distribution of values held by the agents?
  We study this problem as a two-stage game. In the first stage, the seller
chooses and announces a price for the product. In the second stage, the agents
(each having a private value for the good) decide simultaneously whether or not
they will buy the product. In the resulting game, which can exhibit a
multiplicity of equilibria, agents must strategize about whether they will
themselves purchase the good to receive its benefits.
  In the case of a fully public good (where all agents benefit whenever any
agent purchases), we describe a pricing mechanism that is approximately
revenue-optimal (up to a constant factor) when values are drawn from a regular
distribution. We then study settings in which the good is only ""locally""
public: agents are arranged in a network and share benefits only with their
neighbors. We describe a pricing method that approximately maximizes revenue,
in the worst case over equilibria of agent behavior, for any $d$-regular
network. Finally, we show that approximately optimal prices can be found for
general networks in the special case that private values are drawn from a
uniform distribution. We also discuss some barriers to extending these results
to general networks and regular distributions.
","[{""version"":""v1"",""created"":""Wed, 1 May 2013 05:14:41 GMT""}]","2013-05-02"
