"1305.0143","Thomas Machon","Thomas Machon, Gareth P. Alexander","Nematics, Knots and Non-orientable Surfaces","6 pages, 5 figures","Proc. Natl. Acad. Sci. USA 110(35), 14174-14179 (2013)","10.1073/pnas.1308225110",,"cond-mat.soft","http://arxiv.org/licenses/nonexclusive-distrib/1.0/","  Knots and knotted fields enrich physical phenomena ranging from DNA and
molecular chemistry to the vortices of fluid flows and textures of ordered
media. Liquid crystals provide an ideal setting for exploring such topological
phenomena through control of their characteristic defects. The use of colloids
in generating defects and knotted configurations in liquid crystals has been
demonstrated for spherical and toroidal particles and shows promise for the
development of novel photonic devices. Extending this existing work, we
describe the full topological implications of colloids representing
non-orientable surfaces and use it to construct torus knots and links of type
($p$,2) around multiply-twisted M\""obius strips.
","[{""version"":""v1"",""created"":""Wed, 1 May 2013 11:12:07 GMT""}]","2014-02-28"
"1305.0144","Raphael Hauser A","Raphael Hauser, Vijay Krishnamurthy and Reha T\""ut\""unc\""u","Relative Robust Portfolio Optimization",,,,,"q-fin.PM math.OC q-fin.CP","http://arxiv.org/licenses/nonexclusive-distrib/1.0/","  Considering mean-variance portfolio problems with uncertain model parameters,
we contrast the classical absolute robust optimization approach with the
relative robust approach based on a maximum regret function. Although the
latter problems are NP-hard in general, we show that tractable inner and outer
approximations exist in several cases that are of central interest in asset
management.
","[{""version"":""v1"",""created"":""Wed, 1 May 2013 11:12:47 GMT""},{""version"":""v2"",""created"":""Fri, 10 May 2013 21:14:10 GMT""}]","2013-05-14"
"1305.0145","Heiko Dumlich","Heiko Dumlich, John Robertson, and Stephanie Reich","Nanotube caps on Ni, Fe, and NiFe nano particles: A path to chirality
  selective growth","25 pages, 3 figures, ~10000 words",,,,"cond-mat.mtrl-sci","http://arxiv.org/licenses/nonexclusive-distrib/1.0/","  Carbon nanotubes have properties depending on the arrangement of carbon atoms
on the tube walls, called chirality. Also it has been tried to grow nanotubes
of only one chirality for more than a decade it is still not possible today. A
narrowing of the distribution of chiralities, however, which is a first step
towards chirality control, has been observed for the growth of nanotubes on
catalysts composed of nickel and iron. In this paper, we have calculated
carbon-metal bond energies, adhesion energies and charge distributions of
carbon nanotube caps on Ni, Fe and NiFe alloy clusters using density functional
theory. A growth model using the calculated energies was able to reproduce the
experimental data of the nanotube growth on the alloy catalysts. The electronic
charge was found to be redistributed from the catalyst particles to the edges
of the nanotube caps in dependence of the chiral angles of the caps increasing
the reactivity of the edge atoms. Our study develops an explanation for the
chirality enrichment in the carbon nanotube growth on alloy catalyst particles.
","[{""version"":""v1"",""created"":""Wed, 1 May 2013 11:23:21 GMT""}]","2013-05-02"
"1305.0146","Luis Anchordoqui","Luis A. Anchordoqui, Haim Goldberg, Brian Vlcek","Tracing the Interplay between Non-Thermal Dark Matter and Right-Handed
  Dirac Neutrinos with LHC Data","To be published in Proceedings of the 33rd International Cosmic Ray
  Conference (ICRC2013), Rio de Janeiro, Brazil, 2-9 July, 2013. Paper Id: 638",,,,"astro-ph.CO hep-ph","http://arxiv.org/licenses/nonexclusive-distrib/1.0/","  Llight-element abundances probing big bang nucleosynthesis and precision data
from cosmology probing the cosmic microwave background decoupling epoch have
hinted at the presence of extra relativistic degrees of freedom. This is widely
referred to as ""dark radiation"", suggesting the need for new light states in
the UV completion of the standard model. We provide a brief and concise
overview of the current observational status of such dark radiation and
investigate the interplay between two possible interpretations of the extra
light states: the right-handed partners of three Dirac neutrinos (which
interact with all fermions through the exchange of a new heavy vector meson)
and dark matter particles that were produced through a non-thermal mechanism,
such us late time decays of massive relics. This model ties together
cosmological indications of extra light states and the production of the heavy
vector particle at the LHC.
","[{""version"":""v1"",""created"":""Wed, 1 May 2013 11:24:36 GMT""}]","2013-05-02"
"1305.0147","Ryo Takahasi","Naoyuki Haba and Ryo Takahashi","Constraints on neutrino mass ordering and degeneracy from Planck and
  neutrino-less double beta decay","9 pages, 7 figures, published version",,"10.5506/APhysPolB.45.61","EPHOU-13-004","hep-ph astro-ph.CO hep-ex","http://arxiv.org/licenses/nonexclusive-distrib/1.0/","  We investigate constraints on neutrino mass ordering and degeneracy by
considering the first cosmological result based on Planck measurements of the
cosmic microwave background. It is shown that the result at 95% CL rejects a
neutrino mass degeneracy larger than 85% (82.5%) for the normal (inverted)
hierarchical case. We can also find some regions where the neutrino mass
ordering will be able to be distinguished by combining a value of sum of the
neutrino masses with an effective neutrino mass determined by neutrino-less
double beta decay experiments.
","[{""version"":""v1"",""created"":""Wed, 1 May 2013 11:27:25 GMT""},{""version"":""v2"",""created"":""Thu, 30 May 2013 09:11:49 GMT""},{""version"":""v3"",""created"":""Fri, 13 Dec 2013 05:23:14 GMT""}]","2015-06-15"
"1305.0148","Jens Biegert","J. Dura, N. Camus, A. Thai, A. Britz, M. Hemmer, M. Baudisch, A.
  Senftleben, C.D. Schr\""oter, J. Ullrich, R. Moshammer, J. Biegert","Enabling high-precision 3D strong-field measurements - Ionization with
  low-frequency fields in the tunneling regime",,,,,"physics.atom-ph","http://arxiv.org/licenses/nonexclusive-distrib/1.0/","  Ionization of an atom or molecule presents surprising richness beyond our
current understanding: strong-field ionization with low-frequency fields
recently revealed unexpected kinetic energy structures (1, 2). A solid grasp on
electron dynamics is however pre-requisite for attosecond-resolution
recollision imaging (3), orbital tomography (4), for coherent sources of keV
light (5), or to produce zeptosecond-duration x-rays (6). We present a
methodology that enables scrutinizing strong-field dynamics at an unprecedented
level. Our method provides high-precision measurements only 1 meV above the
threshold despite 5 orders higher ponderomotive energies. Such feat was
realized with a specifically developed ultrafast mid-IR light source in
combination with a reaction microscope. We observe electron dynamics in the
tunneling regime ({\gamma} = 0.3) and show first 3D momentum distributions
demonstrating surprising new observations of near-zero momentum electrons and
low momentum structures, below the eV, despite quiver energies of 95 eV.
","[{""version"":""v1"",""created"":""Wed, 1 May 2013 11:39:55 GMT""}]","2013-05-02"
"1305.0149","Konstantinos N. Gourgouliatos","K.N. Gourgouliatos, A. Cumming, M. Lyutikov and A. Reisenegger","Hall Equilibria: Solutions with toroidal and poloidal magnetic fields in
  Neutron Star Crusts","Conference Proceedings, Magnetic Fields in the Universe IV (2013)",,,,"astro-ph.SR","http://arxiv.org/licenses/nonexclusive-distrib/1.0/","  We present Hall equilibrium solutions for neutron stars crusts containing
toroidal and poloidal magnetic field. Some simple cases are solved analytically
while more complicated configurations are found numerically through a
Gauss-Seidel elliptic partial differential equation solver.
","[{""version"":""v1"",""created"":""Wed, 1 May 2013 11:48:03 GMT""}]","2013-05-02"
"1305.0150","Tanmoy Banerjee","Tanmoy Banerjee, Debabrata Biswas","Amplitude death and synchronized states in nonlinear time-delay systems
  coupled through mean-field diffusion","13 Figures; Final version accepted in CHAOS:An Interdisciplinary
  Journal of Nonlinear Science (AIP)","Chaos 23, 043101 (2013)","10.1063/1.4823599",,"nlin.CD","http://arxiv.org/licenses/nonexclusive-distrib/1.0/","  We explore and experimentally demonstrate the phenomena of amplitude death
(AD) and the corresponding transitions through synchronized states that lead to
AD in coupled {\it intrinsic time-delayed} hyperchaotic oscillators interacting
through mean-field diffusion. We identify a novel synchronization transition
scenario leading to AD, namely transitions among AD, generalized anticipatory
synchronization (GAS), complete synchronization (CS), and generalized lag
synchronization (GLS). This transition is mediated by variation of the
difference of {\it intrinsic time-delays} associated with the individual
systems, and has no analogue in non-delayed systems or coupled oscillators with
{\it coupling time-delay}. We further show that, for equal intrinsic
time-delays, increasing coupling strength results in a transition from the
unsynchronized state to AD state via in-phase (complete) synchronized states.
Using Krasovskii--Lyapunov theory, we derive the stability conditions that
predict the parametric region of occurrence of GAS, GLS, and CS; also, using a
linear stability analysis we derive the condition of occurrence of AD. We use
the error function of proper synchronization manifold and a modified form of
the similarity function to provide the quantitative support to GLS and GAS. We
demonstrate all the scenarios in an electronic circuit experiment; the
experimental time-series, phase-plane plots, and generalized autocorrelation
function computed from the experimental time series data are used to confirm
the occurrence of all the phenomena in the coupled oscillators.
","[{""version"":""v1"",""created"":""Wed, 1 May 2013 12:06:42 GMT""},{""version"":""v2"",""created"":""Thu, 15 May 2014 10:19:36 GMT""}]","2014-05-16"
"1305.0151","Sergio Lukic","Sergio Lukic","A note on the space of evolutionary operators in population genetics and
  folding dynamics","26 pages, 7 figures, 2 tables, introduction and conclusion updated",,,,"math.DS math.CO q-bio.PE","http://creativecommons.org/licenses/by/3.0/","  Discrete dynamical systems defined by the iteration of a polynomial map of
the unit simplex to itself appear in the context of population genetic systems
evolving under mutation, recombination and weak selection. Although exceptional
progress has been made in finding particular solutions to these systems, our
knowledge of the general properties of the space of all possible dynamical
systems of this kind is still limited. We prove that the space of
bounded-degree polynomial maps of the unit simplex to itself is a compact and
convex subset of a Euclidean space. We provide an explicit characterization of
such a space and of its boundary. A special class of maps in the boundary, the
folding maps, which generalize the logistic map for any dimension and degree
are defined and constructed. Finally, we use numerical methods to study the
ergodic and mixing properties of maps in the neighborhood of several of these
folding maps.
","[{""version"":""v1"",""created"":""Wed, 1 May 2013 12:07:57 GMT""},{""version"":""v2"",""created"":""Fri, 12 Jul 2013 14:40:56 GMT""}]","2013-07-15"
"1305.0152","Federico Sacerdoti MSc","Federico D. Sacerdoti","The Software Garden","9 pages, 6 figures",,,,"cs.SE","http://arxiv.org/licenses/nonexclusive-distrib/1.0/","  This paper describes a practical method of developing custom HPC software
products using a store of libraries and tools independent from the OS called a
""garden"". All dependencies from the product to libraries of the underlying OS
distribution are carefully severed, isolating the package from instability due
to system upgrades and ensuring repeatable deterministic builds on different
flavors of Linux. The method also guarantees multiple versions of a software
product may exist together and function correctly, greatly facilitating upgrade
and rollback. The method is the first known system to expose all past software
versions to the designer, and support deterministic single-package rollback
without affecting other installed software. An application of this method for
building a high performance trading system in C++ is presented.
","[{""version"":""v1"",""created"":""Wed, 1 May 2013 12:14:14 GMT""}]","2013-05-02"
"1305.0153","Junting Chen","Junting Chen and Vincent K. N. Lau","Convergence Analysis of Mixed Timescale Cross-Layer Stochastic
  Optimization",,,,,"cs.SY cs.IT math.IT","http://arxiv.org/licenses/nonexclusive-distrib/1.0/","  This paper considers a cross-layer optimization problem driven by
multi-timescale stochastic exogenous processes in wireless communication
networks. Due to the hierarchical information structure in a wireless network,
a mixed timescale stochastic iterative algorithm is proposed to track the
time-varying optimal solution of the cross-layer optimization problem, where
the variables are partitioned into short-term controls updated in a faster
timescale, and long-term controls updated in a slower timescale. We focus on
establishing a convergence analysis framework for such multi-timescale
algorithms, which is difficult due to the timescale separation of the algorithm
and the time-varying nature of the exogenous processes. To cope with this
challenge, we model the algorithm dynamics using stochastic differential
equations (SDEs) and show that the study of the algorithm convergence is
equivalent to the study of the stochastic stability of a virtual stochastic
dynamic system (VSDS). Leveraging the techniques of Lyapunov stability, we
derive a sufficient condition for the algorithm stability and a tracking error
bound in terms of the parameters of the multi-timescale exogenous processes.
Based on these results, an adaptive compensation algorithm is proposed to
enhance the tracking performance. Finally, we illustrate the framework by an
application example in wireless heterogeneous network.
","[{""version"":""v1"",""created"":""Wed, 1 May 2013 12:17:01 GMT""}]","2013-05-02"
"1305.0154","R\'emi Rhodes","R\'emi Rhodes, Vincent Vargas","Spectral dimension of Liouville quantum gravity","18 pages",,"10.1007/s00023-013-0308-y",,"math.PR math-ph math.MP","http://arxiv.org/licenses/nonexclusive-distrib/1.0/","  This paper is concerned with computing the spectral dimension of 2d-Liouville
quantum gravity. As a warm-up, we first treat the simple case of boundary
Liouville quantum gravity. We prove that the spectral dimension is 1 via an
exact expression for the boundary Liouville Brownian motion and heat kernel.
Then we treat the 2d-case via a decomposition of time integral transforms of
the Liouville heat kernel into Gaussian multiplicative chaos of Brownian
bridges. We show that the spectral dimension is 2 in this case, as announced by
physicists (see Ambj\orn and al. in \cite{amb}) fifteen years ago.
","[{""version"":""v1"",""created"":""Wed, 1 May 2013 12:17:59 GMT""}]","2015-06-15"
"1305.0155","Jonathan Marshall","C. Eiroa, J.P. Marshall, A. Mora, B. Montesinos, O. Absil, J. Ch.
  Augereau, A. Bayo, G. Bryden, W. Danchi, C. del Burgo, S. Ertel, M. Fridlund,
  A.M. Heras, A.V. Krivov, R. Launhardt, R. Liseau, T. L\""ohne, J. Maldonado,
  G.L. Pilbratt, A. Roberge, J. Rodmann, J. Sanz-Forcada, E. Solano, K.
  Stapelfeldt, P. Th\'ebault, S. Wolf, D. Ardila, M. Ar\'evalo, C. Beichmann,
  V. Faramaz, B.M. Gonz\'alez-Garc\'ia, R. Guti\'errez, J. Lebreton, R.
  Mart\'inez-Arn\'aiz, G. Meeus, D. Montes, G. Olofsson, K.Y.L. Su, G.J. White,
  D. Barrado, M. Fukagawa, E. Gr\""un, I. Kamp, R. Lorente, A. Morbidelli, S.
  M\""uller, H. Mutschke, T. Nakagawa, I. Ribas and H. Walker","DUst Around NEarby Stars. The survey observational results",,,"10.1051/0004-6361/201321050",,"astro-ph.SR","http://arxiv.org/licenses/nonexclusive-distrib/1.0/","  Debris discs are a consequence of the planet formation process and constitute
the fingerprints of planetesimal systems. Their solar system's counterparts are
the asteroid and Edgeworth-Kuiper belts. The DUNES survey aims at detecting
extra-solar analogues to the Edgeworth-Kuiper belt around solar-type stars,
putting in this way the solar system into context. The survey allows us to
address some questions related to the prevalence and properties of planetesimal
systems. We used {\it Herschel}/PACS to observe a sample of nearby FGK stars.
Data at 100 and 160 $\mu$m were obtained, complemented in some cases with
observations at 70 $\mu$m, and at 250, 350 and 500 $\mu$m using SPIRE. The
observing strategy was to integrate as deep as possible at 100 $\mu$m to detect
the stellar photosphere. Debris discs have been detected at a fractional
luminosity level down to several times that of the Edgeworth-Kuiper belt. The
incidence rate of discs around the DUNES stars is increased from a rate of
$\sim$ 12.1% $\pm$ 5% before \emph{Herschel} to $\sim$ 20.2% $\pm$ 2%. A
significant fraction ($\sim$ 52%) of the discs are resolved, which represents
an enormous step ahead from the previously known resolved discs. Some stars are
associated with faint far-IR excesses attributed to a new class of cold discs.
Although it cannot be excluded that these excesses are produced by coincidental
alignment of background galaxies, statistical arguments suggest that at least
some of them are true debris discs. Some discs display peculiar SEDs with
spectral indexes in the 70-160$\mu$m range steeper than the Rayleigh-Jeans one.
An analysis of the debris disc parameters suggests that a decrease might exist
of the mean black body radius from the F-type to the K-type stars. In addition,
a weak trend is suggested for a correlation of disc sizes and an
anticorrelation of disc temperatures with the stellar age.
","[{""version"":""v1"",""created"":""Wed, 1 May 2013 12:23:03 GMT""},{""version"":""v2"",""created"":""Mon, 6 May 2013 15:57:49 GMT""}]","2015-06-15"
"1305.0156","Alastair Craw","Raf Bocklandt, Alastair Craw and Alexander Quintero Velez","Geometric Reid's recipe for dimer models","29 pages, 5 figures, final version","Mathematische Annalen 361 (2015), 689-723; correction
  Mathematische Annalen 380 (2021), 911-913",,,"math.AG hep-th","http://arxiv.org/licenses/nonexclusive-distrib/1.0/","  Crepant resolutions of three-dimensional toric Gorenstein singularities are
derived equivalent to noncommutative algebras arising from consistent dimer
models. By choosing a special stability parameter and hence a distinguished
crepant resolution $Y$, this derived equivalence generalises the Fourier-Mukai
transform relating the $G$-Hilbert scheme and the skew group algebra
$\CC[x,y,z]\ast G$ for a finite abelian subgroup of $\SL(3,\CC)$. We show that
this equivalence sends the vertex simples to pure sheaves, except for the zero
vertex which is mapped to the dualising complex of the compact exceptional
locus. This generalises results of Cautis-Logvinenko and Cautis-Craw-Logvinenko
to the dimer setting, though our approach is different in each case. We also
describe some of these pure sheaves explicitly and compute the support of the
remainder, providing a dimer model analogue of results from Logvinenko.
","[{""version"":""v1"",""created"":""Wed, 1 May 2013 12:26:28 GMT""},{""version"":""v2"",""created"":""Mon, 28 Jul 2014 14:19:03 GMT""}]","2021-06-01"
"1305.0157","Jiangfeng Du","Jingwei Zhou, Pu Huang, Qi Zhang, Zixiang Wang, Tian Tan, Xiangkun Xu,
  Fazhan Shi, Xing Rong, S. Ashhab, Jiangfeng Du","Observation of Time-domain Rabi Oscillations in the Landau-Zener Regime
  with a Single Electronic Spin",,"Phys. Rev. Lett. 112, 010503 (2014)","10.1103/PhysRevLett.112.010503",,"quant-ph cond-mat.mes-hall","http://arxiv.org/licenses/nonexclusive-distrib/1.0/","  Under resonant conditions, a long sequence of landau-zener transitions can
lead to Rabi oscillations. Using a nitrogen-vacancy (NV) center spin in
diamond, we investigated the interference between more than 100 Landau-Zener
processes. We observed the new type of Rabi oscillations of the electron spin
resulting from the interference between successive Landau-Zener processes in
various regimes, including both slow and fast passages. The combination of the
control techniques and the favorable coherent properties of NV centers provides
an excellent experimental platform to study a variety of quantum dynamical
phenomena.
","[{""version"":""v1"",""created"":""Wed, 1 May 2013 12:43:34 GMT""}]","2014-05-09"
"1305.0158","Joachim Wabnig","J. Wabnig, D. Bitauld, H. W. Li, A. Laing, J. L. O'Brien, A. O.
  Niskanen","Demonstration of Free-space Reference Frame Independent Quantum Key
  Distribution",,"New J. Phys. 15 (2013) 073001","10.1088/1367-2630/15/7/073001",,"quant-ph","http://arxiv.org/licenses/nonexclusive-distrib/1.0/","  Quantum key distribution (QKD) is moving from research laboratories towards
applications. As computing becomes more mobile, cashless as well as cardless
payment solutions are introduced, and a need arises for incorporating QKD in a
mobile device. Handheld devices present a particular challenge as the
orientation and the phase of a qubit will depend on device motion. This problem
is addressed by the reference frame independent (RFI) QKD scheme. The scheme
tolerates an unknown phase between logical states that varies slowly compared
to the rate of particle repetition. Here we experimentally demonstrate the
feasibility of RFI QKD over a free-space link in a prepare and measure scheme
using polarisation encoding. We extend the security analysis of the RFI QKD
scheme to be able to deal with uncalibrated devices and a finite number of
measurements. Together these advances are an important step towards mass
production of handheld QKD devices.
","[{""version"":""v1"",""created"":""Wed, 1 May 2013 12:48:05 GMT""}]","2013-07-04"
"1305.0159","Anthony J Cox","Lilian Janin and Giovanna Rosone and Anthony J. Cox","Adaptive reference-free compression of sequence quality scores","Accepted paper for HiTSeq 2013, to appear in Bioinformatics.
  Bioinformatics should be considered the original place of publication of this
  work, please cite accordingly",,,,"q-bio.GN cs.DS","http://arxiv.org/licenses/nonexclusive-distrib/1.0/","  Motivation:
  Rapid technological progress in DNA sequencing has stimulated interest in
compressing the vast datasets that are now routinely produced. Relatively
little attention has been paid to compressing the quality scores that are
assigned to each sequence, even though these scores may be harder to compress
than the sequences themselves. By aggregating a set of reads into a compressed
index, we find that the majority of bases can be predicted from the sequence of
bases that are adjacent to them and hence are likely to be less informative for
variant calling or other applications. The quality scores for such bases are
aggressively compressed, leaving a relatively small number at full resolution.
Since our approach relies directly on redundancy present in the reads, it does
not need a reference sequence and is therefore applicable to data from
metagenomics and de novo experiments as well as to resequencing data.
  Results:
  We show that a conservative smoothing strategy affecting 75% of the quality
scores above Q2 leads to an overall quality score compression of 1 bit per
value with a negligible effect on variant calling. A compression of 0.68 bit
per quality value is achieved using a more aggressive smoothing strategy, again
with a very small effect on variant calling.
  Availability:
  Code to construct the BWT and LCP-array on large genomic data sets is part of
the BEETL library, available as a github respository at
http://git@github.com:BEETL/BEETL.git .
","[{""version"":""v1"",""created"":""Wed, 1 May 2013 12:51:10 GMT""}]","2013-05-02"
"1305.0160","Anthony J Cox","Markus J. Bauer and Anthony J. Cox and Giovanna Rosone and Marinella
  Sciortino","Lightweight LCP Construction for Next-Generation Sequencing Datasets","Springer LNCS (Lecture Notes in Computer Science) should be
  considered as the original place of publication, please cite accordingly. The
  final version of this manuscript is available at
  http://link.springer.com/chapter/10.1007/978-3-642-33122-0_26","Lecture Notes in Computer Science Volume 7534, 2012, pp 326-337","10.1007/978-3-642-33122-0_26",,"cs.DS q-bio.GN","http://arxiv.org/licenses/nonexclusive-distrib/1.0/","  The advent of ""next-generation"" DNA sequencing (NGS) technologies has meant
that collections of hundreds of millions of DNA sequences are now commonplace
in bioinformatics. Knowing the longest common prefix array (LCP) of such a
collection would facilitate the rapid computation of maximal exact matches,
shortest unique substrings and shortest absent words. CPU-efficient algorithms
for computing the LCP of a string have been described in the literature, but
require the presence in RAM of large data structures. This prevents such
methods from being feasible for NGS datasets.
  In this paper we propose the first lightweight method that simultaneously
computes, via sequential scans, the LCP and BWT of very large collections of
sequences. Computational results on collections as large as 800 million
100-mers demonstrate that our algorithm scales to the vast sequence collections
encountered in human whole genome sequencing experiments.
","[{""version"":""v1"",""created"":""Wed, 1 May 2013 12:51:45 GMT""}]","2013-05-02"
