"1304.8129","Mary Wootters","Brett Hemenway, Rafail Ostrovsky and Mary Wootters","Local Correctability of Expander Codes",,,,,"cs.IT math.IT","http://arxiv.org/licenses/nonexclusive-distrib/1.0/","  In this work, we present the first local-decoding algorithm for expander
codes. This yields a new family of constant-rate codes that can recover from a
constant fraction of errors in the codeword symbols, and where any symbol of
the codeword can be recovered with high probability by reading $N^\epsilon$
symbols from the corrupted codeword, where $N$ is the block-length of the code.
  Expander codes, introduced by Sipser and Spielman, are formed from an
expander graph $G = (V,E)$ of degree $d$, and an inner code of block-length $d$
over an alphabet $\Sigma$. Each edge of the expander graph is associated with a
symbol in $\Sigma$. A string in $\Sigma^{E}$ will be a codeword if for each
vertex in $V$, the symbols on the adjacent edges form a codeword in the inner
code.
  We show that if the inner code has a smooth reconstruction algorithm in the
noiseless setting, then the corresponding expander code has an efficient
local-correction algorithm in the noisy setting. Instantiating our construction
with inner codes based on finite geometries, we obtain novel locally decodable
codes with rate approaching one. This provides an alternative to the
multiplicity codes of Kopparty, Saraf and Yekhanin (STOC '11) and the lifted
codes of Guo, Kopparty and Sudan (ITCS '13).
","[{""version"":""v1"",""created"":""Tue, 30 Apr 2013 19:40:30 GMT""},{""version"":""v2"",""created"":""Wed, 7 Jan 2015 17:33:37 GMT""}]","2015-01-08"
"1304.8130","Vitaly Bornyakov","V. G. Bornyakov, V. K. Mitrjushkin and R. N. Rogalyov","Infinite volume and continuum limits for gluon propagator in 3d SU(2)
  lattice gauge theory","7 pages, 5 figures. arXiv admin note: substantial text overlap with
  arXiv:1112.4975","Phys. Rev. D 89, 054504 (2014)","10.1103/PhysRevD.89.054504",,"hep-lat","http://arxiv.org/licenses/nonexclusive-distrib/1.0/","  We study the Landau gauge gluon propagator D(p) in the 3d SU(2) lattice gauge
theory. We show that in the infinite-volume limit the expectation values over
the Gribov region \Omega, are different (in the infrared) from that calculated
in the fundamental modular region \Gamma. Also we show that this conclusion
does not change when spacing $a$ tends to zero.
","[{""version"":""v1"",""created"":""Tue, 30 Apr 2013 19:41:21 GMT""}]","2014-03-26"
"1304.8131","Kwang Sik Jeong","Kwang Sik Jeong, Fuminobu Takahashi","Suppressing Isocurvature Perturbations of QCD Axion Dark Matter","6 pages, 2 figures; v3: discussion extended, references added, to
  appear in PLB","Phys. Lett. B 727, 448 (2013)","10.1016/j.physletb.2013.10.061","TU-935","hep-ph","http://arxiv.org/licenses/nonexclusive-distrib/1.0/","  We propose a novel mechanism to suppress the isocurvature perturbations of
the QCD axion. The point is that the QCD interactions become strong at an
intermediate or high energy scale in the very early Universe, if the Higgs
field has a sufficiently large expectation value. The effective QCD scale can
be even higher in the presence of extra colored particles. We show that the QCD
axion then becomes so heavy during inflation that its isocurvature
perturbations are significantly suppressed, thereby relaxing the constraint on
the inflation scale.
","[{""version"":""v1"",""created"":""Tue, 30 Apr 2013 19:57:04 GMT""},{""version"":""v2"",""created"":""Thu, 2 May 2013 08:19:18 GMT""},{""version"":""v3"",""created"":""Mon, 18 Nov 2013 16:48:28 GMT""}]","2015-06-15"
"1304.8132","Zeyuan Allen Zhu","Zeyuan Allen Zhu and Silvio Lattanzi and Vahab Mirrokni","Local Graph Clustering Beyond Cheeger's Inequality","An extended abstract of this paper has appeared in the proceedings of
  the 30th International Conference on Machine Learning (ICML 2013)",,,,"cs.DS cs.LG stat.ML","http://arxiv.org/licenses/nonexclusive-distrib/1.0/","  Motivated by applications of large-scale graph clustering, we study
random-walk-based LOCAL algorithms whose running times depend only on the size
of the output cluster, rather than the entire graph. All previously known such
algorithms guarantee an output conductance of $\tilde{O}(\sqrt{\phi(A)})$ when
the target set $A$ has conductance $\phi(A)\in[0,1]$. In this paper, we improve
it to $$\tilde{O}\bigg( \min\Big\{\sqrt{\phi(A)},
\frac{\phi(A)}{\sqrt{\mathsf{Conn}(A)}} \Big\} \bigg)\enspace, $$ where the
internal connectivity parameter $\mathsf{Conn}(A) \in [0,1]$ is defined as the
reciprocal of the mixing time of the random walk over the induced subgraph on
$A$.
  For instance, using $\mathsf{Conn}(A) = \Omega(\lambda(A) / \log n)$ where
$\lambda$ is the second eigenvalue of the Laplacian of the induced subgraph on
$A$, our conductance guarantee can be as good as
$\tilde{O}(\phi(A)/\sqrt{\lambda(A)})$. This builds an interesting connection
to the recent advance of the so-called improved Cheeger's Inequality [KKL+13],
which says that global spectral algorithms can provide a conductance guarantee
of $O(\phi_{\mathsf{opt}}/\sqrt{\lambda_3})$ instead of
$O(\sqrt{\phi_{\mathsf{opt}}})$.
  In addition, we provide theoretical guarantee on the clustering accuracy (in
terms of precision and recall) of the output set. We also prove that our
analysis is tight, and perform empirical evaluation to support our theory on
both synthetic and real data.
  It is worth noting that, our analysis outperforms prior work when the cluster
is well-connected. In fact, the better it is well-connected inside, the more
significant improvement (both in terms of conductance and accuracy) we can
obtain. Our results shed light on why in practice some random-walk-based
algorithms perform better than its previous theory, and help guide future
research about local clustering.
","[{""version"":""v1"",""created"":""Tue, 30 Apr 2013 19:57:36 GMT""},{""version"":""v2"",""created"":""Thu, 7 Nov 2013 18:25:15 GMT""}]","2013-11-08"
"1304.8133","Francesco Hautmann","F. Hautmann","Soft Gluons and Jets at the LHC","17 pages. Based on talks at conferences ISMD 2012, Physics at the LHC
  2011, QCD at Cosmic Energies 2012",,,,"hep-ph","http://arxiv.org/licenses/nonexclusive-distrib/1.0/","  We address aspects of jet physics at the Large Hadron Collider focusing on
features of recent jet measurements which challenge the theory. We discuss
examples illustrating the role of QCD parton showers, nonperturbative
corrections, soft multi-gluon emission.
","[{""version"":""v1"",""created"":""Tue, 30 Apr 2013 19:58:22 GMT""}]","2013-05-01"
"1304.8134","Passemar Emilie","Mario Antonelli, Vincenzo Cirigliano, Alberto Lusiani and Emilie
  Passemar","Predicting the tau strange branching ratios and implications for V_{us}","20 pages, 3 figures",,"10.1007/JHEP10(2013)070","LA-UR-13-22949","hep-ph hep-ex","http://arxiv.org/licenses/nonexclusive-distrib/1.0/","  Hadronic tau decays provide several ways to extract the
Cabbibo-Kobashi-Maskawa (CKM) matrix element V_{us}. The most precise
determination involves using inclusive tau decays and requires as input the
total branching ratio into strange final states. Recent results from
B-factories have led to a discrepancy of about 3.4 sigma from the value of
V_{us} implied by CKM unitarity and direct determination from Kaon
semi-leptonic modes. In this paper we predict the three leading strange tau
branching ratios, using dispersive parameterizations of the hadronic form
factors and taking as experimental input the measured Kaon decay rates and the
tau -> K pi nu_tau decay spectrum. We then use our results to reevaluate
V_{us}, for which we find |V_{us}|=0.2207 \pm 0.0027, in better agreement with
CKM unitarity.
","[{""version"":""v1"",""created"":""Tue, 30 Apr 2013 19:58:39 GMT""}]","2015-06-15"
"1304.8135","Shay Solomon","Shay Solomon","From Hierarchical Partitions to Hierarchical Covers: Optimal
  Fault-Tolerant Spanners for Doubling Metrics",,,,,"cs.DS cs.CG","http://arxiv.org/licenses/nonexclusive-distrib/1.0/","  In this paper we devise an optimal construction of fault-tolerant spanners
for doubling metrics. Specifically, for any $n$-point doubling metric, any
$\eps > 0$, and any integer $0 \le k \le n-2$, our construction provides a
$k$-fault-tolerant $(1+\eps)$-spanner with optimal degree $O(k)$ within optimal
time $O(n \log n + k n)$.
  We then strengthen this result to provide near-optimal (up to a factor of
$\log k$) guarantees on the diameter and weight of our spanners, namely,
diameter $O(\log n)$ and weight $O(k^2 + k \log n) \cdot \omega(MST)$, while
preserving the optimal guarantees on the degree $O(k)$ and the running time
$O(n \log n + k n)$.
  Our result settles several fundamental open questions in this area,
culminating a long line of research that started with the STOC'95 paper of Arya
et al.\ and the STOC'98 paper of Levcopoulos et al.
  On the way to this result we develop a new technique for constructing
spanners in doubling metrics. Our spanner construction is based on a novel
\emph{hierarchical cover} of the metric, whereas most previous constructions of
spanners for doubling and Euclidean metrics (such as the net-tree spanner) are
based on \emph{hierarchical partitions} of the metric. We demonstrate the power
of hierarchical covers in the context of geometric spanners by improving the
state-of-the-art results in this area.
","[{""version"":""v1"",""created"":""Tue, 30 Apr 2013 19:58:41 GMT""},{""version"":""v2"",""created"":""Wed, 8 May 2013 19:52:23 GMT""}]","2013-05-09"
"1305.0002","Felix Kling","Baradhwaj Coleppa, Felix Kling and Shufang Su","Constraining Type II 2HDM in Light of LHC Higgs Searches","34 pages, 18 figures","JHEP 1401, 161 (2014)","10.1007/JHEP01(2014)161",,"hep-ph","http://arxiv.org/licenses/nonexclusive-distrib/1.0/","  We study the implication of the LHC Higgs search results on the Type II Two
Higgs-Doublet Model. In particular, we explore the scenarios in which the
observed 126 GeV Higgs signal is interpreted as either the light CP-even Higgs
$h^0$ or the heavy CP-even Higgs $H^0$. Imposing both theoretical and
experimental constraints, we analyze the surviving parameter regions in $m_H$
($m_h$), $m_A$, $m_{H^\pm}$, $\tan\beta$ and $\sin(\beta - \alpha)$. We further
identify the regions that could accommodate a 126 GeV Higgs with cross sections
consistent with the observed Higgs signal. We find that in the $h^0$-126 case,
we are restricted to narrow regions of $\sin(\beta-\alpha) \approx \pm 1$ with
$\tan\beta$ up to 4, or an extended region with $0.55 < \sin(\beta-\alpha) <
0.9$ and $1.5 < \tan\beta < 4$. The values of $m_H$, $m_A$ and $m_{H^\pm}$,
however, are relatively unconstrained. In the $H^0$-126 case, we are restricted
to a narrow region of $\sin(\beta-\alpha) \sim 0$ with $\tan\beta$ up to about
8, or an extended region of $\sin(\beta-\alpha) $ between $-0.8$ to $-0.05$,
with $\tan\beta$ extended to 30 or higher. $m_A$ and $m_{H^\pm}$ are nearly
degenerate due to $\Delta\rho$ constraints. Imposing flavor constraints shrinks
the surviving parameter space significantly for the $H^0$-126 case, limiting
$\tan\beta \lesssim 10$, but has little effect in the $h^0$-126 case. We also
investigate the correlation between $\gamma\gamma$, $VV$ and $bb/\tau\tau$
channels. $\gamma\gamma$ and $VV$ channels are most likely to be highly
correlated with $\gamma\gamma:VV \sim 1$ for the normalized cross sections.
","[{""version"":""v1"",""created"":""Tue, 30 Apr 2013 20:00:01 GMT""},{""version"":""v2"",""created"":""Fri, 14 Mar 2014 23:35:07 GMT""}]","2014-03-18"
"1305.0003","Sebastian Eggert","Xue-Feng Zhang and Sebastian Eggert","Chiral edge states and fractional charge separation in interacting
  bosons on a Kagome lattice","5 pages and 4 figutes. For more information and the final version see
  http://www.physik.uni-kl.de/eggert/papers/index.html","Phys. Rev. Lett. 111, 147201 (2013)","10.1103/PhysRevLett.111.147201",,"cond-mat.quant-gas cond-mat.str-el","http://arxiv.org/licenses/nonexclusive-distrib/1.0/","  We consider the extended hard-core Bose-Hubbard model on a Kagome lattice
with boundary conditions on two edges. We find that the sharp edges lift the
degeneracy and freeze the system into a striped order at 1/3 and 2/3 filling
for zero hopping. At small hopping strengths, holes spontaneously appear and
separate into fractional charges which move to the edges of the system. This
leads to a novel edge liquid phase, which is characterized by fractional
charges near the edges and a finite edge compressibility but no superfluid
density. The compressibility is due to excitations on the edge which display a
chrial symmetry breaking that is reminiscent of the quantum Hall effect and
topological insulators. Large scale Monte Carlo simulations confirm the
analytical considerations.
","[{""version"":""v1"",""created"":""Tue, 30 Apr 2013 20:00:01 GMT""}]","2013-10-02"
"1305.0004","David Poland","A. Liam Fitzpatrick, Jared Kaplan, David Poland","Conformal Blocks in the Large D Limit","14 pages, 2 figures","JHEP 1308 (2013) 107","10.1007/JHEP08(2013)107",,"hep-th","http://arxiv.org/licenses/nonexclusive-distrib/1.0/","  We derive conformal blocks in an inverse spacetime dimension expansion. In
this large D limit, the blocks are naturally written in terms of a new
combination of conformal cross-ratios. We comment on the implications for the
conformal bootstrap at large D.
","[{""version"":""v1"",""created"":""Tue, 30 Apr 2013 20:00:01 GMT""}]","2014-07-31"
"1305.0005","Andra Stroe","A. Stroe, R. J. van Weeren, H. T. Intema, H. J. A. R\""ottgering, M.
  Br\""uggen and M. Hoeft","Discovery of spectral curvature in the shock downstream region: CIZA
  J2242.8+5301","19 pages, 23 figures; accepted for publication in Astronomy and
  Astrophysics; Version with high resolution images:
  http://home.strw.leidenuniv.nl/~astroe/doc/CIZA_gmrt_wsrt_review.pdf",,"10.1051/0004-6361/201321267",,"astro-ph.CO","http://arxiv.org/licenses/nonexclusive-distrib/1.0/","  Giant cluster radio relics are thought to form at shock fronts in the course
of collisions between galaxy clusters. Via processes that are still poorly
understood, these shocks accelerate or re-accelerate cosmic-ray electrons and
might amplify magnetic fields. The best object to study this phenomenon is the
galaxy cluster CIZA J2242.8+5301 as it shows the most undisturbed relic. By
means of Giant Metrewave Radio Telescope (GMRT) and Westerbork Synthesis Radio
Telescope (WSRT) data at seven frequencies spanning from 153 MHz to 2272 MHz,
we study the synchrotron emission in this cluster. We aim at distinguishing
between theoretical injection and acceleration models proposed for the
formation of radio relics. We also study the head-tail radio sources to reveal
the interplay between the merger and the cluster galaxies. We produced spectral
index, curvature maps and radio colour-colour plots and compared our data with
predictions from models. We present one of the deepest 153 MHz maps of a
cluster ever produced, reaching a noise level of 1.5 mJy/beam. We derive
integrated spectra for four relics in the cluster, discovering extremely steep
spectrum diffuse emission concentrated in multiple patches. We find a possible
radio phoenix embedded in the relic to the south of the cluster. The spectral
index of the northern relic retains signs of steepening from the front towards
the back of the shock also at the radio frequencies below 600 MHz. The spectral
curvature in the same relic also increases in the downstream area. The data is
consistent with the Komissarov-Gubanov injection models, meaning that the
emission we observe is produced by a single burst of spectrally-aged
accelerated radio electrons.
","[{""version"":""v1"",""created"":""Tue, 30 Apr 2013 20:00:02 GMT""}]","2015-06-15"
"1305.0006","Philip Phillips","Philip W. Phillips, Brandon W. Langley, and Jimmy A. Hutasoit","Un-Fermi Liquids: Unparticles in Strongly Correlated Electron Matter","10 pages 2 figures: Updated version to appear in Phys. Rev. B","Phys. Rev. B vol. 88, 115129 (2013)","10.1103/PhysRevB.88.115129",,"cond-mat.str-el hep-th","http://arxiv.org/licenses/nonexclusive-distrib/1.0/","  Since any non-trivial infrared dynamics in strongly correlated electron
matter must be controlled by a critical fixed point, we argue that the form of
the single-particle propagator can be deduced simply by imposing scale
invariance. As a consequence, the unparticle picture proposed by
Georgi\cite{georgi} is the natural candidate to describe such dynamics.
Unparticle stuff is scale-invariant matter with no particular mass. Scale
invariance dictates that the propagator has an algebraic form which can admit
zeros and hence is a candidate to explain the ubiquitous pseudogap state of the
cuprates. The non-perturbative electronic state formed out of unparticles we
refer to as an un-Fermi liquid. We show that the underlying action of the
continuous mass formulation of unparticles can be recast exactly as an action
in anti de Sitter space. We find that this mapping fixes the scaling dimension
of the unparticle to be $d_U=d/2+\sqrt{d^2+4}/2$ and ensures that the
corresponding propagator has zeros with $d$ the spacetime dimension of the
unparticle field. Should $d=2+1$, unparticles acquire the non-trivial phase
$2\pi d_U$ upon interchange. Because $d_U$ is non-integer and in general not
half-integer, clockwise and counterclockwise interchange of unparticles do not
lead to the same phase and time reversal symmetry is broken spontaneously as
reported in numerous experiments in the pseudogap phase of the cuprates. The
possible relevance of this mechanism to such experiments is discussed. We then
formulate the analogous BCS gap using unparticles and find that in contrast to
the Fermi liquid case, the transition temperature increases as the attractive
interaction strength decreases, indicating that unparticles are highly
susceptible to a superconducting instability.
","[{""version"":""v1"",""created"":""Tue, 30 Apr 2013 20:00:02 GMT""},{""version"":""v2"",""created"":""Thu, 29 Aug 2013 20:00:05 GMT""}]","2013-12-17"
"1305.0007","Andrew Larkoski","Andrew J. Larkoski, Gavin P. Salam, Jesse Thaler","Energy Correlation Functions for Jet Substructure","45 pages, 28 figures, update to JHEP version, some minor typos fixed,
  added discussion at end of section 3",,"10.1007/JHEP06(2013)108","MIT-CTP 4446, CERN-PH-TH/2013-066, LPN13-026","hep-ph","http://arxiv.org/licenses/nonexclusive-distrib/1.0/","  We show how generalized energy correlation functions can be used as a
powerful probe of jet substructure. These correlation functions are based on
the energies and pair-wise angles of particles within a jet, with (N+1)-point
correlators sensitive to N-prong substructure. Unlike many previous jet
substructure methods, these correlation functions do not require the explicit
identification of subjet regions. In addition, the correlation functions are
better probes of certain soft and collinear features that are masked by other
methods. We present three Monte Carlo case studies to illustrate the utility of
these observables: 2-point correlators for quark/gluon discrimination, 3-point
correlators for boosted W/Z/Higgs boson identification, and 4-point correlators
for boosted top quark identification. For quark/gluon discrimination, the
2-point correlator is particularly powerful, as can be understood via a
next-to-leading logarithmic calculation. For boosted 2-prong resonances the
benefit depends on the mass of the resonance.
","[{""version"":""v1"",""created"":""Tue, 30 Apr 2013 20:00:03 GMT""},{""version"":""v2"",""created"":""Thu, 2 May 2013 04:19:19 GMT""},{""version"":""v3"",""created"":""Wed, 10 Jul 2013 22:09:49 GMT""}]","2015-06-15"
"1305.0008","Ignacy Sawicki","Mariele Motta (U. Campinas and U. Heidelberg, ITP), Ignacy Sawicki (U.
  Heidelberg, ITP), Ippocratis D. Saltas (Nottingham U.), Luca Amendola (U.
  Heidelberg, ITP) and Martin Kunz (U. Geneva and African Inst. Math. Sci.,
  Cape Town)","Probing Dark Energy through Scale Dependence","11 pages; v2 reflect version accepted for publication in PRD. Minor
  additions discussing the feasibility of proposed tests and describing effect
  of more than one degree of freedom for dark energy","Phys. Rev. D 88, 124035 (2013)","10.1103/PhysRevD.88.124035",,"astro-ph.CO gr-qc","http://arxiv.org/licenses/nonexclusive-distrib/1.0/","  We consider the consequences of having no prior knowledge of the true dark
energy model for the interpretation of cosmological observations. The magnitude
of redshift-space distortions and weak-lensing shear is determined by the
metric on the geodesics of which galaxies and light propagate. We show that,
given precise enough observations, we can use these data to completely
reconstruct the metric on our past lightcone and therefore to measure the
scale- and time-dependence of the anisotropic stress and the evolution of the
gravitational potentials in a model-independent manner. Since both dark matter
and dark energy affect the visible sector only through the gravitational field
they produce, they are inseparable without a model for dark energy: galaxy bias
cannot be measured and therefore the distribution of dark matter determined;
the peculiar velocity of dark matter can be identified with that of the
galaxies only when the equivalence principle holds. Given these limitations, we
show how one can nonetheless build tests for classes of dark energy models
which depend on making measurements at multiple scales at a particular
redshift. They are null tests on the model-independent observables, do not
require modeling evolution in time and do not require any parametrization of
the free functions of these models, such as the sound speed. We show how one
can rule out or constrain the whole class of the most-general scalar-tensor
theories even without assuming the quasi-static limit.
","[{""version"":""v1"",""created"":""Tue, 30 Apr 2013 20:00:03 GMT""},{""version"":""v2"",""created"":""Wed, 20 Nov 2013 20:56:49 GMT""}]","2013-12-17"
"1305.0009","Julien Lesgourgues","B. Audren, D. Blas, J. Lesgourgues, S. Sibiryakov","Cosmological constraints on Lorentz violating dark energy","17 pages, 5 figures",,"10.1088/1475-7516/2013/08/039","CERN-PH-TH/2013-085, LAPTH-022/13","astro-ph.CO gr-qc hep-ph hep-th","http://arxiv.org/licenses/nonexclusive-distrib/1.0/","  The role of Lorentz invariance as a fundamental symmetry of nature has been
lately reconsidered in different approaches to quantum gravity. It is thus
natural to study whether other puzzles of physics may be solved within these
proposals. This may be the case for the cosmological constant problem. Indeed,
it has been shown that breaking Lorentz invariance provides Lagrangians that
can drive the current acceleration of the universe without experiencing large
corrections from ultraviolet physics. In this work, we focus on the simplest
model of this type, called ThetaCDM, and study its cosmological implications in
detail. At the background level, this model cannot be distinguished from
LambdaCDM. The differences appear at the level of perturbations. We show that
in ThetaCDM, the spectrum of CMB anisotropies and matter fluctuations may be
affected by a rescaling of the gravitational constant in the Poisson equation,
by the presence of extra contributions to the anisotropic stress, and finally
by the existence of extra clustering degrees of freedom. To explore these
modifications accurately, we modify the Boltzmann code CLASS. We then use the
parameter inference code Monte Python to confront ThetaCDM with data from
WMAP-7, SPT and WiggleZ. We obtain strong bounds on the parameters accounting
for deviations from LambdaCDM. In particular, we find that the discrepancy
between the gravitational constants appearing in the Poisson and Friedmann
equations is constrained at the level 1.8%.
","[{""version"":""v1"",""created"":""Tue, 30 Apr 2013 20:00:04 GMT""}]","2015-06-15"
"1305.0010","Cornelius Rampf","Cornelius Rampf and Gerasimos Rigopoulos","Initial conditions for cold dark matter particles and General Relativity","Title adjusted, added a table for clarity, matches published version","Phys. Rev. D 87, 123525 (2013)","10.1103/PhysRevD.87.123525","TTK-13-12, TUM 888/13","astro-ph.CO gr-qc","http://arxiv.org/licenses/nonexclusive-distrib/1.0/","  We describe the irrotational dust component of the universe in terms of a
relativistic gradient expansion and transform the resulting synchronous metric
to a Newtonian coordinate system. The two metrics are connected via a
space-like displacement field and a time-like perturbation, providing a
relativistic generalization of the transformation from Lagrangian to Eulerian
coordinates. The relativistic part of the displacement field generates already
at initial time a non-local density perturbation at second order. This is a
purely relativistic effect since it originates from space-time mixing. We give
two options, the passive and the active approach, on how to include the
relativistic corrections for example in N-body simulations. In the passive
approach we treat the corrections as a non-Gaussian modification of the initial
Gaussian field (primordial non-Gaussianity could be incorporated as well). The
induced non-Gaussianity depends on scale and the redshift at which initial
conditions are set, with f_NL ~ few for small enough scales and redshifts. In
the active approach we show how to use the relativistic trajectory to obtain
the initial displacement and velocity of particles for N-body simulations
without modifying the initial Gaussian field.
","[{""version"":""v1"",""created"":""Tue, 30 Apr 2013 20:00:04 GMT""},{""version"":""v2"",""created"":""Mon, 5 Aug 2013 09:49:08 GMT""}]","2013-08-06"
