"1305.4421","Eran Shmaya","Alvaro Sandroni and Eran Shmaya","A prequential test for exchangeable theories",,,"10.3934/jdg.2014.1.497",,"math.ST stat.TH","http://arxiv.org/licenses/nonexclusive-distrib/1.0/","  We construct a prequential test of probabilistic forecasts that does not
reject correct forecasts when the data-generating processes is exchangeable and
is not manipulable by a false forecaster.
","[{""version"":""v1"",""created"":""Mon, 20 May 2013 01:50:36 GMT""}]","2014-07-21"
"1305.4422","Dmitry Ostrovsky Dr","Dmitry Ostrovsky","Theory of Barnes Beta Distributions","15 pages, published version (removed Th. 4.5 and Section 5, updated
  references)","Electron. Commun. Probab. 18 no 59 (2013) 1-16",,,"math.PR","http://arxiv.org/licenses/nonexclusive-distrib/1.0/","  A new family of probability distributions $\beta_{M, N},$ $M=0\cdots N,$
$N\in\mathbb{N}$ on the unit interval $(0, 1]$ is defined by the Mellin
transform. The Mellin transform of $\beta_{M, N}$ is characterized in terms of
products of ratios of Barnes multiple gamma functions, shown to satisfy a
functional equation, and a Shintani-type infinite product factorization. The
distribution $\log\beta_{M, N}$ is infinitely divisible. If $M<N,$
$-\log\beta_{M, N}$ is compound Poisson, if $M=N,$ $\log\beta_{M, N}$ is
absolutely continuous. The integral moments of $\beta_{M, N}$ are expressed as
Selberg-type products of multiple gamma functions. The asymptotic behavior of
the Mellin transform is derived and used to prove an inequality involving
multiple gamma functions and establish positivity of a class of alternating
power series. For application, the Selberg integral is interpreted
probabilistically as a transformation of $\beta_{1, 1}$ into a product of
$\beta^{-1}_{2, 2}s.$
","[{""version"":""v1"",""created"":""Mon, 20 May 2013 01:57:09 GMT""},{""version"":""v2"",""created"":""Tue, 25 Feb 2014 15:53:47 GMT""}]","2014-02-26"
"1305.4423","Hai  Bui Xuan","Bui Xuan Hai, Mai Hoang Bien, Trinh Thanh Deo","On linear groups over weakly locally finite division rings","13 pages; accepted for publication in Algebra Colloquium",,,,"math.RA","http://arxiv.org/licenses/nonexclusive-distrib/1.0/","  In this paper, we give the definition of {\em weakly locally finite} division
rings and we show that the class of these rings strictly contains the class of
locally finite division rings. Further, we study multiplicative subgroups in
these rings. Some skew linear groups are also considered. Our new obtained
results generalize previous results for centrally finite case.
","[{""version"":""v1"",""created"":""Mon, 20 May 2013 02:11:04 GMT""}]","2013-05-21"
"1305.4424","Eric Mart\'inez-Pascual","E. Mart\'inez-Pascual","Refined algebraic quantisation in a system with nonconstant gauge
  invariant structure functions","15 pages v2. Minor comments and clarifications added","J. Math. Phys. 54, 082101 (2013)","10.1063/1.4817485",,"gr-qc hep-th math-ph math.MP","http://arxiv.org/licenses/nonexclusive-distrib/1.0/","  In a previous work [J. Math. Phys. 52, 123504 (2011)], refined algebraic
quantisation (RAQ) within a family of classically equivalent constrained
Hamiltonian systems that are related to each other by rescaling one
momentum-type constraint was investigated. In the present work, the first steps
to generalise this analysis to cases where more constraints occur are
developed. The system under consideration contains two momentum-type
constraints, originally abelian, where rescalings of these constraints by a
non-vanishing function of the coordinates are allowed. These rescalings induce
structure functions at the level of the gauge algebra. Providing a specific
parametrised family of real-valued scaling functions, the implementation of the
corresponding rescaled quantum momentum-type constraints is performed using RAQ
when the gauge algebra: (i) remains abelian and (ii) undergoes into an algebra
of a nonunimodular group with nonconstant gauge invariant structure functions.
Case (ii) becomes the first example known to the author where an open algebra
is handled in refined algebraic quantisation. Challenging issues that arise in
the presence of non-gauge invariant structure functions are also addressed.
","[{""version"":""v1"",""created"":""Mon, 20 May 2013 02:20:20 GMT""},{""version"":""v2"",""created"":""Wed, 30 Oct 2013 01:51:25 GMT""}]","2015-06-16"
"1305.4425","Sung-Hoon Lee","Sung-Hoon Lee, Jongseob Kim, Sae-Jin Kim, Sungjin Kim, and Gyeong-Su
  Park","Hidden Structural Order in Orthorhombic Tantalum Pentoxide (Ta$_2$O$_5$)","5 pages, 3 figures","Phys. Rev. Lett. 110, 235502 (2013)","10.1103/PhysRevLett.110.235502",,"cond-mat.mtrl-sci","http://arxiv.org/licenses/nonexclusive-distrib/1.0/","  We investigate using first-principles calculations the atomic structure of
the orthorhombic phase of Ta$_2$O$_5$. Although this structure has been studied
for decades, the correct structural model is controversial owing to the
complication of structural disorder. We identify a new low-energy high-symmetry
structural model where all Ta and O atoms have correct formal oxidation states
of +5 and -2, respectively, and the experimentally reported triangular lattice
symmetry of the Ta sublattice appears dynamically at finite temperatures. To
understand the complex atomic structure of the Ta$_2$O$_3$ plane, a triangular
graph-paper representation is devised and used alongside oxidation state
analysis to reveal infinite variations of the low-energy structural model. The
structural disorder of Ta$_2$O$_5$ observed in experiments is attributed to the
intrinsic structural variations, and oxygen vacancies that drive collective
relaxation of the O sublattice.
","[{""version"":""v1"",""created"":""Mon, 20 May 2013 02:23:42 GMT""}]","2013-06-18"
"1305.4426","Guoyuan Chen","Guoyuan Chen and Youquan Zheng","Concentration phenomenon for fractional nonlinear Schr\""{o}dinger
  equations",,,,,"math.AP math.FA","http://arxiv.org/licenses/nonexclusive-distrib/1.0/","  We study the concentration phenomenon for solutions of the fractional
nonlinear Schr\""{o}dinger equation, which is nonlocal. We mainly use the
Lyapunov-Schmidt reduction method. Precisely, consider the nonlinear equation
\begin{equation}\label{e:abstract}
(-\varepsilon^2\Delta)^sv+Vv-|v|^{\alpha}v=0\quad\mbox{in}\quad\mathbf R^n,
\end{equation} where $n =1, 2, 3$, $\max\{\frac{1}{2}, \frac{n}{4}\}< s < 1$,
$1 \leq \alpha < \alpha_*(s,n)$, $V\in C^3_{b}(\mathbf{R}^n)$. Here the
exponent $\alpha_*(s,n)=\frac{4s}{n-2s}$ for $0 < s < \frac{n}{2}$ and
$\alpha_*(s,n)=\infty$ for $s \geq\frac{n}{2}$. Then for each non-degenerate
critical point $z_0$ of $V$, there is a nontrivial solution of equation
(\ref{e:abstract}) concentrating to $z_0$ as $\varepsilon\to 0$.
","[{""version"":""v1"",""created"":""Mon, 20 May 2013 02:38:30 GMT""}]","2013-05-21"
"1305.4427","Takuya Nomoto","Takuya Nomoto, Hiroaki Ikeda","Effect of magnetic criticality and Fermi-surface topology on the
  magnetic penetration depth","5 pages, 4 figures","Phys. Rev. Lett. 111, 167001 (2013)","10.1103/PhysRevLett.111.167001",,"cond-mat.supr-con cond-mat.str-el","http://arxiv.org/licenses/nonexclusive-distrib/1.0/","  We investigate the effect of anti-ferromagnetic (AF) quantum criticality on
the magnetic penetration depth $\lambda(T)$ in line-nodal superconductors,
including the cuprates, the iron pnictides, and the heavy-fermion
superconductors. The critical magnetic fluctuation renormalizes the current
vertex and drastically enhances zero-temperature penetration depth
$\lambda(0)$, which is more remarkable in the iron-pnictide case due to the
Fermi-surface topology. Additional temperature ($T$) dependence of the current
renormalization makes the expected $T$-linear behavior at low temperatures
approaching to $T^{1.5}$ asymptotically. These anomalous behaviors are well
consistent with experimental observations. We stress that $\lambda(T)$ is a
good probe to detect the AF quantum critical point in the superconducting
state.
","[{""version"":""v1"",""created"":""Mon, 20 May 2013 02:46:07 GMT""}]","2013-12-12"
"1305.4428","Deep Jariwala","Mariana C. Prado, Deep Jariwala, Tobin J. Marks, and Mark C. Hersam","Optimization of graphene dry etching conditions via combined microscopic
  and spectroscopic analysis","manuscript+supporting information","APPLIED PHYSICS LETTERS 102, 193111 (2013)","10.1063/1.4807425",,"cond-mat.mtrl-sci cond-mat.mes-hall","http://arxiv.org/licenses/nonexclusive-distrib/1.0/","  Single-layer graphene structures and devices are commonly defined using
reactive ion etching and plasma etching with O2 or Ar as the gaseous etchants.
Although optical microscopy and Raman spectroscopy are widely used to determine
the appropriate duration of dry etching, additional characterization with
atomic force microscopy (AFM) reveals that residual graphene and/or etching
byproducts persist beyond the point where the aforementioned methods suggest
complete graphene etching. Recognizing that incomplete etching may have
deleterious effects on devices and/or downstream processing, AFM
characterization is used here to determine optimal etching conditions that
eliminate graphene dry etching residues.
","[{""version"":""v1"",""created"":""Mon, 20 May 2013 03:03:37 GMT""}]","2013-05-21"
"1305.4429","Youfang Lin","Youfang Lin, Xuguang Jia, Mingjie Lin, Steve Gregory, Huaiyu Wan,
  Zhihao Wu","Inferring High Quality Co-Travel Networks","20 pages, 23 figures",,,,"cs.SI physics.soc-ph","http://arxiv.org/licenses/nonexclusive-distrib/1.0/","  Social networks provide a new perspective for enterprises to better
understand their customers and have attracted substantial attention in
industry. However, inferring high quality customer social networks is a great
challenge while there are no explicit customer relations in many traditional
OLTP environments. In this paper, we study this issue in the field of passenger
transport and introduce a new member to the family of social networks, which is
named Co-Travel Networks, consisting of passengers connected by their co-travel
behaviors. We propose a novel method to infer high quality co-travel networks
of civil aviation passengers from their co-booking behaviors derived from the
PNRs (Passenger Naming Records). In our method, to accurately evaluate the
strength of ties, we present a measure of Co-Journey Times to count the
co-travel times of complete journeys between passengers. We infer a high
quality co-travel network based on a large encrypted PNR dataset and conduct a
series of network analyses on it. The experimental results show the
effectiveness of our inferring method, as well as some special characteristics
of co-travel networks, such as the sparsity and high aggregation, compared with
other kinds of social networks. It can be expected that such co-travel networks
will greatly help the industry to better understand their passengers so as to
improve their services. More importantly, we contribute a special kind of
social networks with high strength of ties generated from very close and high
cost travel behaviors, for further scientific researches on human travel
behaviors, group travel patterns, high-end travel market evolution, etc., from
the perspective of social networks.
","[{""version"":""v1"",""created"":""Mon, 20 May 2013 03:04:23 GMT""}]","2013-05-21"
"1305.4430","Jonathan Miller","Jonathan Miller and Roman Pasechnik","Quasi-classical Gravity effect on neutrino oscillations in a
  gravitational field of an heavy astrophysical object","25 pages, 4 figures, minor revision with clarifications, main
  conclusions are unchanged","Adv. High Energy Phys. 2015 (2015) 381569",,,"hep-ph gr-qc hep-th","http://arxiv.org/licenses/nonexclusive-distrib/1.0/","  In the framework of quantum field theory, a graviton interacts locally with a
quantum state having definite mass, i.e. the gravitational mass eigenstate,
while a weak boson interacts with a state having definite flavor, i.e. the
flavor eigenstate. An interaction of a neutrino with an energetic graviton may
trigger the collapse of the neutrino to a definite mass eigenstate with
probability expressed in terms of PMNS mixing matrix elements. Thus, gravitons
would induce quantum decoherence of a coherent neutrino flavor state similarly
to how weak bosons induce quantum decoherence of a neutrino in a definite mass
state. We demonstrate that such an essentially quantum gravity effect may have
strong consequences for neutrino oscillation phenomena in astrophysics due to
relatively large scattering cross sections of relativistic neutrinos undergoing
large-angle radiation of energetic gravitons in gravitational field of a
classical massive source (i.e. the quasi-classical case of gravitational
Bethe-Heitler scattering). This graviton-induced {\it decoherence} is compared
to {\it decoherence} due to propagation in the presence of the Earth matter
effect. Based on this study, we propose a new technique for the indirect
detection of energetic gravitons by measuring the flavor composition of
astrophysical neutrinos.
","[{""version"":""v1"",""created"":""Mon, 20 May 2013 03:45:39 GMT""},{""version"":""v2"",""created"":""Wed, 10 Jul 2013 15:06:23 GMT""},{""version"":""v3"",""created"":""Sat, 14 Dec 2013 03:26:39 GMT""},{""version"":""v4"",""created"":""Fri, 23 May 2014 19:31:45 GMT""},{""version"":""v5"",""created"":""Fri, 14 Nov 2014 23:19:47 GMT""},{""version"":""v6"",""created"":""Fri, 2 Oct 2015 17:17:10 GMT""}]","2015-10-05"
"1305.4431","Daisuke Nomura","Gi-Chol Cho, Daisuke Nomura and Yoshiko Ohno","Constraints on radion in a warped extra dimension model from Higgs boson
  searches at the LHC","10 pages, 3 figures. v2: References added. Discussions added in
  Section 5. Results unchanged. v3: typos corrected, accepted for publication
  in Mod. Phys. Lett. A",,"10.1142/S0217732313501484","OCHA-PP-315, TU-936","hep-ph","http://arxiv.org/licenses/nonexclusive-distrib/1.0/","  We study constraints on the radion mass and couplings in the Randall-Sundrum
model from the recent LHC data on the Standard Model (SM) Higgs boson searches.
When the radion is heavy enough so that it can decay into a pair of on-shell
Z-bosons, we find that the ZZ channel gives a stringent constraint. For
example, if the radion mass m_\phi is 200 GeV, the scale \Lambda_\phi which
characterizes the interactions of the radion with the SM fields must be larger
than 5 TeV. Even for m_\phi=1 TeV, we find that the lower bound on \Lambda_\phi
is 2 TeV.
","[{""version"":""v1"",""created"":""Mon, 20 May 2013 03:56:36 GMT""},{""version"":""v2"",""created"":""Tue, 27 Aug 2013 02:58:51 GMT""},{""version"":""v3"",""created"":""Fri, 30 Aug 2013 04:29:26 GMT""}]","2013-10-04"
"1305.4432","Feng Wang","M. Iakhnenko, V. Feyer, N. Tsud, O. Plekan, F. Wang, M. Ahmed, O.
  Slobodyanyuk, R. G. Acres, V. Matol\'in and K. C. Prince","Adsorption of cytosine and aza derivatives of cytidine on Au single
  crystal surfaces","40 pages, 3 tables and 8 figures",,,,"physics.chem-ph cond-mat.mtrl-sci","http://arxiv.org/licenses/nonexclusive-distrib/1.0/","  The adsorption of cytosine on the Au(111) and Au(110) surfaces has been
studied using both aqueous deposition and evaporation in vacuum to prepare the
samples. Soft X-ray photoelectron spectroscopy (XPS) and near edge X-ray
absorption fine structure spectroscopy (NEXAFS) were used to determine the
electronic structure and orientation of the adsorbates. In addition, three
derivatives of cytosine, 6-azacytosine, 6-azacytidine and 5- azacytidine, were
studied. Monolayer films of the latter three samples were adsorbed on Au(111)
from aqueous solution, and the nature of bonding was determined. Spectra have
been interpreted in the light of published calculations of free cytosine
molecules and new ab initio calculations of the other compounds. Surface core
level shifts of Au 4f imply that all of these compounds are chemisorbed.
Cytosine adsorbs as a single tautomer, but in two chemical states with
different surface-molecule bonding. For deposition in vacuum, a flat-lying
molecular state bonded through the N(3) atom of the pyrimidine ring dominates,
but a second state is also present. For deposition from solution, the second
state dominates, with the molecular plane no longer parallel to the surface.
This state also bonds through the N(3) atom, but in addition interacts with the
surface via the amino group. Two tautomers of 6-azacytosine were observed, and
they and 6-azacytidine adsorb with similar geometries, chemically bonding via
the azacytosine ring. The ribose ring does not appear to perturb the adsorption
of azacytidine compared with azacytosine. The azacytosine ring is nearly but
not perfectly parallel to the surface, like 5-azacytidine, which adsorbs as an
imino tautomer. ...
","[{""version"":""v1"",""created"":""Mon, 20 May 2013 03:59:33 GMT""}]","2013-05-21"
"1305.4433","Xiangnan Kong","Xiangnan Kong, Bokai Cao, Philip S. Yu, Ying Ding and David J. Wild","Meta Path-Based Collective Classification in Heterogeneous Information
  Networks",,,,,"cs.LG stat.ML","http://arxiv.org/licenses/nonexclusive-distrib/1.0/","  Collective classification has been intensively studied due to its impact in
many important applications, such as web mining, bioinformatics and citation
analysis. Collective classification approaches exploit the dependencies of a
group of linked objects whose class labels are correlated and need to be
predicted simultaneously. In this paper, we focus on studying the collective
classification problem in heterogeneous networks, which involves multiple types
of data objects interconnected by multiple types of links. Intuitively, two
objects are correlated if they are linked by many paths in the network.
However, most existing approaches measure the dependencies among objects
through directly links or indirect links without considering the different
semantic meanings behind different paths. In this paper, we study the
collective classification problem taht is defined among the same type of
objects in heterogenous networks. Moreover, by considering different linkage
paths in the network, one can capture the subtlety of different types of
dependencies among objects. We introduce the concept of meta-path based
dependencies among objects, where a meta path is a path consisting a certain
sequence of linke types. We show that the quality of collective classification
results strongly depends upon the meta paths used. To accommodate the large
network size, a novel solution, called HCC (meta-path based Heterogenous
Collective Classification), is developed to effectively assign labels to a
group of instances that are interconnected through different meta-paths. The
proposed HCC model can capture different types of dependencies among objects
with respect to different meta paths. Empirical studies on real-world networks
demonstrate that effectiveness of the proposed meta path-based collective
classification approach.
","[{""version"":""v1"",""created"":""Mon, 20 May 2013 04:05:23 GMT""}]","2013-05-21"
"1305.4434","Jun He Dr.","Yin Huang, Jun He, Hong-Fei Zhang, Xu-Rong Chen","Discovery potential of hidden charm baryon resonances via
  photoproduction","14 pages,7 figures,3 tables",,"10.1088/0954-3899/41/11/115004",,"nucl-th hep-ex hep-ph nucl-ex","http://arxiv.org/licenses/nonexclusive-distrib/1.0/","  In this work, we study the possibility to find $N^*_{c\bar{c}}$ and
$\Lambda^*_{c\bar{c}}$ resonances with hidden charm with mass above 4 GeV in
the photon-induced production. The cross sections for the photoproductions of
hidden charmed baryons are predicted in the effective Lagrangian approach with
the vector meson dominance mechanism. The $N^*(4412)$ can be produced directly
by photon excitation with total cross section about 1 nb. The $N^*(4412)$
provides a obvious peak near threshold for $J/\psi$ photoproduction, which is
promising to be checked by the future high precision experiment at JLab 12 GeV.
The results will be helpful to the experimental search for the hidden-charmed
baryon resonances in the coming experiment at JLab 12 GeV, such as SoLID, and
the proposed electron-ion colliders at FAIR and HIAF.
","[{""version"":""v1"",""created"":""Mon, 20 May 2013 04:18:46 GMT""},{""version"":""v2"",""created"":""Mon, 1 Sep 2014 14:13:27 GMT""}]","2015-06-16"
"1305.4435","Zach Teitler","Zach Teitler","Software for multiplier ideals","7 pages. Comments welcome","JSAG 7 (2015), no. 1, 1--8","10.2140/jsag.2015.7.1",,"math.AG math.AC","http://arxiv.org/licenses/nonexclusive-distrib/1.0/","  We describe a new software package for computing multiplier ideals in certain
cases, including monomial ideals, monomial curves, generic determinantal
ideals, and hyperplane arrangements. In these cases we take advantage of
combinatorial formulas for multiplier ideals given by results of Howald,
Thompson, and Johnson. The package uses Normaliz. It is available as a library
for Macaulay2.
","[{""version"":""v1"",""created"":""Mon, 20 May 2013 04:20:40 GMT""}]","2015-06-17"
"1305.4436","Yusuke Tsukamoto","Yusuke Tsukamoto, Kazunari Iwasaki and Shu-ichiro Inutsuka","An explicit scheme for ohmic dissipation with smoothed particle
  magneto-hydrodynamics","10 pages, 9 figures, accepted for publication in MNRAS. We newly
  added gravitional collapse tests with and without Ohmic resistivity in this
  version",,"10.1093/mnras/stt1205",,"astro-ph.SR astro-ph.EP astro-ph.IM","http://arxiv.org/licenses/nonexclusive-distrib/1.0/","  In this paper, we present an explicit scheme for Ohmic dissipation with
smoothed particle magneto-hydrodynamics (SPMHD). We propose a SPH
discretization of Ohmic dissipation and solve Ohmic dissipation part of
induction equation with the supertime-stepping method (STS) which allows us to
take a longer time-step than Courant-Friedrich-Levy stability condition. Our
scheme is second-order accurate in space and first-order accurate in time. Our
numerical experiments show that optimal choice of the parameters of STS for
Ohmic dissipation of SPMHD is {\nu}sts ~ 0.01 and Nsts ~ 5.
","[{""version"":""v1"",""created"":""Mon, 20 May 2013 04:52:41 GMT""},{""version"":""v2"",""created"":""Mon, 1 Jul 2013 02:43:55 GMT""}]","2015-06-16"
"1305.4437","Inasa Nakamura","Inasa Nakamura","Satellites of an oriented surface link and their local moves","16 pages, 12 figures. Theorem 6.4 is changed to Remark 6.4. Proofs of
  Theorem 5.5 and Lemma 8.3 are rewritten","Topology Appl. 164 (2014), 113--124","10.1016/j.topol.2013.12.010",,"math.GT","http://arxiv.org/licenses/nonexclusive-distrib/1.0/","  For an oriented surface link $F$ in $\mathbb{R}^4$, we consider a satellite
construction of a surface link, called a 2-dimensional braid over $F$, which is
in the form of a covering over $F$. We introduce the notion of an $m$-chart on
a surface diagram $\pi(F)\subset \mathbb{R}^3$ of $F$, which is a finite graph
on $\pi(F)$ satisfying certain conditions and is an extended notion of an
$m$-chart on a 2-disk presenting a surface braid. A 2-dimensional braid over
$F$ is presented by an $m$-chart on $\pi(F)$. It is known that two surface
links are equivalent if and only if their surface diagrams are related by a
finite sequence of ambient isotopies of $\mathbb{R}^3$ and local moves called
Roseman moves. We show that Roseman moves for surface diagrams with $m$-charts
can be well-defined.
","[{""version"":""v1"",""created"":""Mon, 20 May 2013 04:55:39 GMT""},{""version"":""v2"",""created"":""Sat, 1 Feb 2014 03:55:44 GMT""}]","2014-02-04"
"1305.4438","Chan-Gyung Park","Edward J. Kim, Seyen Kouwn, Phillial Oh, Chan-Gyung Park","Dark aspects of massive spinor electrodynamics","15 pages, 1 figure. Accepted for publication in JCAP",,"10.1088/1475-7516/2014/07/001",,"astro-ph.CO gr-qc hep-th","http://arxiv.org/licenses/nonexclusive-distrib/1.0/","  We investigate the cosmology of massive spinor electrodynamics when torsion
is non-vanishing. A non-minimal interaction is introduced between the torsion
and the vector field and the coupling constant between them plays an important
role in subsequential cosmology. It is shown that the mass of the vector field
and torsion conspire to generate dark energy and pressureless dark matter, and
for generic values of the coupling constant, the theory effectively provides an
interacting model between them with an additional energy density of the form
$\sim 1/a^6$. The evolution equations mimic $\Lambda$CDM behavior up to $1/a^3$
term and the additional term represents a deviation from $\Lambda$CDM. We show
that the deviation is compatible with the observational data, if it is very
small. We find that the non-minimal interaction is responsible for generating
an effective cosmological constant which is directly proportional to the mass
squared of the vector field and the mass of the photon within its current
observational limit could be the source of the dark energy.
","[{""version"":""v1"",""created"":""Mon, 20 May 2013 04:56:20 GMT""},{""version"":""v2"",""created"":""Tue, 25 Mar 2014 14:54:36 GMT""},{""version"":""v3"",""created"":""Wed, 11 Jun 2014 01:42:50 GMT""}]","2015-06-16"
"1305.4439","Shin Sasaki","Tetsuji Kimura, Shin Sasaki","Worldsheet Instanton Corrections to 522-brane Geometry","17 pages, version appears in JHEP",,"10.1007/JHEP08(2013)126","RUP-13-5","hep-th","http://arxiv.org/licenses/nonexclusive-distrib/1.0/","  We study worldsheet instanton corrections to the exotic 522-brane geometry in
type II string theory. The BPS vortices in the N=(4,4) gauged linear sigma
model modify the geometry of the 522-brane. We find that the modification of
the geometry is understood by the localization in the T-dualized winding
direction.
","[{""version"":""v1"",""created"":""Mon, 20 May 2013 05:14:28 GMT""},{""version"":""v2"",""created"":""Fri, 24 May 2013 05:08:58 GMT""},{""version"":""v3"",""created"":""Thu, 12 Sep 2013 04:15:20 GMT""}]","2015-06-16"
