"1305.4460","Feng-Yu Wang","Feng-Yu wang","Criteria of Spectral Gap for Markov Operators","16pages",,,,"math.FA","http://arxiv.org/licenses/nonexclusive-distrib/1.0/","  Let $(E,\mathcal F,\mu)$ be a probability space, and let $P$ be a Markov
operator on $L^2(\mu)$ with $1$ a simple eigenvalue such that $\mu P=\mu$ (i.e.
$\mu$ is an invariant probability measure of $P$). Then $\hat P:=\ff 1 2
(P+P^*)$ has a spectral gap, i.e. $1$ is isolated in the spectrum of $\hat P$,
if and only if $$\|P\|_\tau:=\lim_{R\to\infty} \sup_{\mu(f^2)\le
1}\mu\big(f(Pf-R)^+\big)<1.$$ This strengthens a conjecture of Simon and
H$\phi$egh-Krohn on the spectral gap for hyperbounded operators solved recently
by L. Miclo in \cite{M}. Consequently, for a symmetric, conservative,
irreducible Dirichlet form on $L^2(\mu)$, a Poincar\'e/log-Sobolev type
inequality holds if and only if so does the corresponding defective inequality.
Extensions to sub-Markov operators and non-conservative Dirichlet forms are
also presented.
","[{""version"":""v1"",""created"":""Mon, 20 May 2013 08:10:53 GMT""},{""version"":""v2"",""created"":""Thu, 23 May 2013 14:52:33 GMT""},{""version"":""v3"",""created"":""Wed, 11 Sep 2013 17:47:32 GMT""},{""version"":""v4"",""created"":""Thu, 19 Sep 2013 13:44:22 GMT""},{""version"":""v5"",""created"":""Wed, 30 Oct 2013 01:52:38 GMT""},{""version"":""v6"",""created"":""Sat, 16 Nov 2013 03:13:51 GMT""}]","2013-11-19"
"1305.4461","Jianwei Mei","Jianwei Mei","Fluctuating Black Hole Horizons","References added, nature of boundary stress tensor clarified,
  discussion of statistics refined and a mistake with Hawking temperature
  corrected, 16 pages; version to appear in journal",,"10.1007/JHEP10(2013)195",,"gr-qc hep-th","http://arxiv.org/licenses/nonexclusive-distrib/1.0/","  In this paper we treat the black hole horizon as a physical boundary to the
spacetime and study its dynamics following from the Gibbons-Hawking-York
boundary term. Using the Kerr black hole as an example we derive an effective
action that describes, in the large wave number limit, a massless Klein-Gordon
field living on the average location of the boundary. Complete solutions can be
found in the small rotation limit of the black hole. The formulation suggests
that the boundary can be treated in the same way as any other matter
contributions. In particular, the angular momentum of the boundary matches
exactly with that of the black hole, suggesting an interesting possibility that
all charges (including the entropy) of the black hole are carried by the
boundary. Using this as input, we derive predictions on the Planck scale
properties of the boundary.
","[{""version"":""v1"",""created"":""Mon, 20 May 2013 08:32:58 GMT""},{""version"":""v2"",""created"":""Tue, 21 May 2013 19:57:42 GMT""},{""version"":""v3"",""created"":""Mon, 7 Oct 2013 11:22:18 GMT""}]","2015-06-16"
"1305.4462","Thorsten Kurth","T. Kurth, N. Ishii, T. Doi, S. Aoki and T. Hatsuda","Phase shifts in I=2 {\pi}{\pi}-scattering from two lattice approaches","Version 2, consistent with published version","JHEP12(2013)015","10.1007/JHEP12(2013)015","WUB/13-06, UTCCS-P-73, RIKEN-QHP-84, YITP-13-27","hep-lat","http://arxiv.org/licenses/nonexclusive-distrib/1.0/","  We present a lattice QCD study of the phase shift of $I{=}2$ $\pi\pi$
scattering on the basis of two different approaches: the standard finite volume
approach by Luscher and the recently introduced HAL QCD potential method.
Quenched QCD simulations are performed on lattices with extents
$N_s{=}16,24,32,48$ and $N_t{=}128$ as well as lattice spacing
$a{\sim}0.115\,\mathrm{fm}$ and a pion mass of $m_\pi{\sim}940\,\mathrm{MeV}$.
The phase shift and the scattering length are calculated in these two methods.
In the potential method, the error is dominated by the systematic uncertainty
associated with the violation of rotational symmetry due to finite lattice
spacing. In Luscher's approach, such systematic uncertainty is difficult to be
evaluated and thus is not included in this work. A systematic uncertainty
attributed to the quenched approximation, however, is not evaluated in both
methods. In case of the potential method, the phase shift can be calculated for
arbitrary energies below the inelastic threshold. The energy dependence of the
phase shift is also obtained from Luscher's method using different volumes
and/or nonrest-frame extension of it. The results are found to agree well with
the potential method.
","[{""version"":""v1"",""created"":""Mon, 20 May 2013 08:34:11 GMT""},{""version"":""v2"",""created"":""Thu, 5 Dec 2013 18:56:03 GMT""}]","2013-12-06"
"1305.4463","Andrea Tosin","Luisa Fermo, Andrea Tosin","Fundamental diagrams for kinetic equations of traffic flow","14 pages","Discrete Contin. Dyn. Syst. Ser. S, 7(3):449-462, 2014","10.3934/dcdss.2014.7.449",,"math-ph math.MP","http://arxiv.org/licenses/nonexclusive-distrib/1.0/","  In this paper we investigate the ability of some recently introduced discrete
kinetic models of vehicular traffic to catch, in their large time behavior,
typical features of theoretical fundamental diagrams. Specifically, we address
the so-called ""spatially homogeneous problem"" and, in the representative case
of an exploratory model, we study the qualitative properties of its solutions
for a generic number of discrete microstates. This includes, in particular,
asymptotic trends and equilibria, whence fundamental diagrams originate.
","[{""version"":""v1"",""created"":""Mon, 20 May 2013 08:43:07 GMT""}]","2014-03-25"
"1305.4464","Naoya Kitajima","Masahiro Kawasaki, Naoya Kitajima and Shuichiro Yokoyama","Gravitational waves from a curvaton model with blue spectrum","24 pages, 7 figures, version accepted for publication in JCAP","JCAP08(2013)042","10.1088/1475-7516/2013/08/042","ICRR-Report-649-2012-38; IPMU 13-0100","astro-ph.CO gr-qc hep-ph","http://arxiv.org/licenses/nonexclusive-distrib/1.0/","  We investigate the gravitational wave background induced by the first order
scalar perturbations in the curvaton models. We consider the quadratic and
axion-like curvaton potential which can generate the blue-tilted power spectrum
of curvature perturbations on small scales and derive the maximal amount of
gravitational wave background today. We find the power spectrum of the induced
gravitational wave background has a characteristic peak at the frequency
corresponding to the scale reentering the horizon at the curvaton decay, in the
case where the curvaton does not dominate the energy density of the Universe.
We also find the enhancement of the amount of the gravitational waves in the
case where the curvaton dominates the energy density of the Universe. Such
induced gravitational waves would be detectable by the future space-based
gravitational wave detectors or pulsar timing observations.
","[{""version"":""v1"",""created"":""Mon, 20 May 2013 08:50:58 GMT""},{""version"":""v2"",""created"":""Fri, 6 Sep 2013 04:23:56 GMT""}]","2013-09-09"
"1305.4465","Man Ho Chan","Man Ho Chan","Scaling relations of the slightly self-interacting cold dark matter in
  galaxies and clusters","4 pages, accepted by MNRAS","MNRAS, 433, 2310 (2013)","10.1093/mnras/stt897",,"astro-ph.CO","http://arxiv.org/licenses/nonexclusive-distrib/1.0/","  Recent observations in galaxies and clusters indicate dark matter density
profiles exhibit core-like structures which contradict to the numerical
simulation results of collisionless cold dark matter. The idea of
self-interacting cold dark matter (SICDM) has been invoked to solve the
discrepancies between the observations and numerical simulations. In this
article, I derive some important scaling relations in galaxies and clusters by
using the long-range SICDM model. These scaling relations give good agreements
with the empirical fittings from observational data in galaxies and clusters if
the dark matter particles are only slightly self-interacting. Also, there may
exist a universal critical optical depth $\tau_c$ that characterizes the
core-like structures. These results generally support the idea of SICDM to
tackle the long-lasting dark matter problem.
","[{""version"":""v1"",""created"":""Mon, 20 May 2013 08:53:56 GMT""}]","2015-06-16"
"1305.4466","Chiu Fan Lee","Fernando Peruani and Chiu Fan Lee","Fluctuations and the role of collision duration in reaction-diffusion
  systems",,"EPL 102, 58001 (2013)","10.1209/0295-5075/102/58001",,"cond-mat.soft","http://arxiv.org/licenses/nonexclusive-distrib/1.0/","  In a reaction-diffusion system, fluctuations in both diffusion and reaction
events, have important effects on the steady-state statistics of the system.
Here, we argue through extensive lattice simulations, mean-field type
arguments, and the Doi-Peliti formalism that the collision duration statistics
-- i.e., the time two particles stay together in a lattice site -- plays a
leading role in determining the steady state of the system. We obtain
approximate expressions for the average densities of the chemical species and
for the critical diffusion coefficient required to sustain the reaction.
","[{""version"":""v1"",""created"":""Mon, 20 May 2013 09:03:15 GMT""}]","2013-06-12"
"1305.4467","Francesco Giacosa","Francesco Giacosa","Energy uncertainty of the final state of a decay process","10 pages, 4 figures. To appear in Phys. Rev. A","Phys. Rev. A 88, 052131 (2013)","10.1103/PhysRevA.88.052131",,"quant-ph hep-ph nucl-th","http://arxiv.org/licenses/nonexclusive-distrib/1.0/","  We derive the expression for the energy uncertainty of the final state of a
decay of an unstable quantum state prepared at the initial time $t=0$. This
expression is function of the time $t$ at which a measurement is performed to
determine if the state has decayed and, if yes, in which one of the infinitely
many possible final states. For large times the energy spread is, as expected,
given by the decay width $\Gamma$ of the initial unstable state. However, if
the measurement of the final state is performed at a time $t$ comparable to (or
smaller than) the mean lifetime of the state $1/\Gamma$, then the uncertainty
on the energy of the final state is much larger than the decay width $\Gamma$.
Namely, for short times an uncertainty of the type $1/t$ dominates, while at
large times the usual spread $\Gamma$ is recovered. Then, we turn to a generic
two-body decay process and describe the energy uncertainty of each one of the
two outgoing particles. We apply these formulas to the two-body decays of the
neutral and charged pions and to the spontaneous emission process of an excited
atom. As a last step, we study a case in which the non-exponential decay is
realized ad show that for short times eventual asymmetric terms are enhanced in
the spectrum.
","[{""version"":""v1"",""created"":""Mon, 20 May 2013 09:07:53 GMT""},{""version"":""v2"",""created"":""Fri, 15 Nov 2013 09:00:25 GMT""}]","2013-12-04"
"1305.4468","Themistoklis Charalambous","Charalambos D. Charalambous, Themistoklis Charalambous and
  Christoforos N. Hadjicostis","Team and Person-by-Person Optimality Conditions of Differential Decision
  Systems","8 pages, 1 figure. arXiv admin note: text overlap with
  arXiv:1302.3452, arXiv:1304.3246",,,,"math.OC","http://arxiv.org/licenses/nonexclusive-distrib/1.0/","  In this paper, we derive team and person-by-person optimality conditions for
distributed differential decision systems with different or decentralized
information structures. The necessary conditions of optimality are given in
terms of Hamiltonian system of equations consisting of a coupled backward and
forward differential equations and a Hamiltonian projected onto the subspace
generated by the decentralized information structures. Under certain global
convexity conditions it is shown that the optimality conitions are also
sufficient.
","[{""version"":""v1"",""created"":""Mon, 20 May 2013 09:14:16 GMT""}]","2013-05-21"
"1305.4469","Masayuki Ohzeki","Masayuki Ohzeki","A challenge for critical point of spin glass in ground state","7 pages, 2 figures, to appear in Proceedings of 4th YSM-SPIP (Sendai,
  14-16 December 2012)",,,,"cond-mat.dis-nn cond-mat.stat-mech quant-ph","http://arxiv.org/licenses/nonexclusive-distrib/1.0/","  We show several calculations to identify the critical point in the ground
state in random spin systems including spin glasses on the basis of the duality
analysis. The duality analysis is a profound method to obtain the precise
location of the critical point in finite temperature even for spin glasses. We
propose a single equality for identifying the critical point in the ground
state from several speculations. The equality can indeed give the exact
location of the critical points for the bond-dilution Ising model on several
lattices and provides insight on further analysis on the ground state in spin
glasses.
","[{""version"":""v1"",""created"":""Mon, 20 May 2013 09:26:13 GMT""}]","2013-05-21"
"1305.4470","Jon Chkareuli","J.L. Chkareuli","On emergent SUSY gauge theories","13 pages, to appear in Proceedings of the 16th Bled Workshop ""What
  Comes Beyond Standard Models"" (14--21 July 2013, Bled, Slovenia)",,,,"hep-ph hep-th","http://arxiv.org/licenses/nonexclusive-distrib/1.0/","  We present the basic features of emergent SUSY gauge theories where an
emergence of gauge bosons as massless vector Nambu-Goldstone modes is triggered
by the spontaneously broken supersymmetry rather than the physically manifested
Lorentz violation. We start considering the supersymmetric QED model extended
by an arbitrary polynomial potential of massive vector superfield that induces
the spontaneous SUSY violation in the visible sector. As a consequence, a
massless photon appears as a companion of a massless photino emerging as a
goldstino in the tree approximation, and remains massless due to the
simultaneously generated special gauge invariance. This invariance is only
restricted by the supplemented vector field constraint invariant under
supergauge transformations. Meanwhile, photino being mixed with another
goldstino appearing from a spontaneous SUSY violation in the hidden sector
largely turns into the light pseudo-goldstino. Such pseudo-goldstonic photinos
considered in an extended supersymmetric Standard Model framework are of a
special observational interest that, apart from some indication of the QED
emergence nature, may appreciably extend the scope of SUSY breaking physics
being actively studied in recent years.
","[{""version"":""v1"",""created"":""Mon, 20 May 2013 09:28:35 GMT""},{""version"":""v2"",""created"":""Sun, 20 Oct 2013 17:14:53 GMT""}]","2013-10-22"
"1305.4471","Fran\c{c}ois Boulogne","Fran\c{c}ois Boulogne, Ludovic Pauchard, Fr\'ed\'erique
  Giorgiutti-Dauphin\'e","Annular cracks in thin films of nanoparticle suspensions drying on a
  fiber","Accepted in EPL",,"10.1209/0295-5075/102/39002",,"cond-mat.soft cond-mat.mtrl-sci","http://creativecommons.org/licenses/by/3.0/","  We report an experimental study of the crack pattern formed during the drying
of a colloidal suspension. A horizontal fiber, which provides a one
dimensional, boundary-free substrate, is coated by a film of micronic
thickness. The geometry imposes a remarkable annular crack pattern and allowing
precise measurements of the crack spacing over a short range of film thickness
(between 2 and 10 $\mu$m) which varies linearly with the film height. We
compare our experimental data with a model proposed by Kitsunezaki which
suggests that the variation of the crack spacing with the film thickness
depends on the ratio between a critical stress at cracking and a critical
stress for slipping on the substrate. By measuring the friction force of the
colloidal gels on a hydrophobic surface through a cantilever technique, we can
deduce the critical crack stress for these colloidal gels simply by measuring
the crack spacing of the pattern.
","[{""version"":""v1"",""created"":""Mon, 20 May 2013 09:31:16 GMT""}]","2014-09-30"
"1305.4472","Qing Chen","Qing Chen, Sixia Yu, Chengjie Zhang, C. H. Lai, C. H. Oh","Test of Genuine Multipartite Nonlocality Without Inequality","6 pages, 1 appendix","Phys. Rev. Lett. 112, 140404 (2014)","10.1103/PhysRevLett.112.140404",,"quant-ph","http://arxiv.org/licenses/nonexclusive-distrib/1.0/","  In this letter we propose a set of conditions on the joint probabilities as a
test of genuine multipartite nonlocality without inequality. Our test is failed
by all non-signaling local models in which even nonlocal correlations among
some observables (not all) are allowed as long as these correlations respect
the non-signaling principle. A pass of our test by a state therefore indicates
that this state cannot be simulated by any non-signaling local models, i.e.,
the state exhibits genuine multipartite nonlocality. It turns out that all
entangled symmetric n-qubit ($n \geq 3$) states pass our test and therefore are
n-way nonlocal. Also we construct two Bell-type inequalities from our proposed
test whose violations indicate genuine multipartite nonlocal correlations.
","[{""version"":""v1"",""created"":""Mon, 20 May 2013 09:34:13 GMT""}]","2014-04-16"
"1305.4473","N. P. Landsman","N.P. Landsman","Spontaneous Symmetry Breaking in Quantum Systems: Emergence or
  Reduction?","32 pages. Final version, to appear in SHPMP. Minor revision",,,,"math-ph math.MP","http://arxiv.org/licenses/nonexclusive-distrib/1.0/","  Beginning with Anderson (1972), spontaneous symmetry breaking (SSB) in
infinite quantum systems is often put forward as an example of (asymptotic)
emergence in physics, since in theory no finite system should display it. Even
the correspondence between theory and reality is at stake here, since numerous
real materials show SSB in their ground states (or equilibrium states at low
temperature), although they are finite. Thus against what is sometimes called
`Earman's Principle', a genuine physical effect (viz. SSB) seems theoretically
recovered only in some idealization (namely the thermodynamic limit),
disappearing as soon as the the idealization is removed. We review the
well-known arguments that (at first sight) no finite system can exhibit SSB,
using the formalism of algebraic quantum theory in order to control the
thermodynamic limit and unify the description of finite- and infinite-volume
systems. Using the striking mathematical analogy between the thermodynamic
limit and the classical limit, we show that a similar situation obtains in
quantum mechanics (which typically forbids SSB) versus classical mechanics
(which allows it). This discrepancy between formalism and reality is quite
similar to the measurement problem, and hence we address it in the same way,
adapting an argument of the author and Reuvers (2013) that was originally
intended to explain the collapse of the wave-function within conventional
quantum mechanics. Namely, exponential sensitivity to (asymmetric)
perturbations of the (symmetric) dynamics as the system size increases causes
symmetry breaking already in finite but very large quantum systems. This
provides continuity between finite- and infinite-volume descriptions of quantum
systems featuring SSB and hence restores Earman's Principle (at least in this
particularly threatening case).
","[{""version"":""v1"",""created"":""Mon, 20 May 2013 09:35:18 GMT""},{""version"":""v2"",""created"":""Fri, 2 Aug 2013 09:58:32 GMT""}]","2013-08-05"
"1305.4474","Ilaria Cardinali","Ilaria Cardinali and Antonio Pasini","On certain submodules of Weyl modules for SO(2n+1,F) with char(F) = 2",,,,,"math.RT","http://arxiv.org/licenses/nonexclusive-distrib/1.0/","  For $k = 1, 2,...,n-1$ let $V_k = V(\lambda_k)$ be the Weyl module for the
special orthogonal group $G = \mathrm{SO}(2n+1,\F)$ with respect to the $k$-th
fundamental dominant weight $\lambda_k$ of the root system of type $B_n$ and
put $V_n = V(2\lambda_n)$. It is well known that all of these modules are
irreducible when $\mathrm{char}(\F) \neq 2$ while when $\mathrm{char}(\F) = 2$
they admit many proper submodules. In this paper, assuming that
$\mathrm{char}(\F) = 2$, we prove that $V_k$ admits a chain of submodules $V_k
= M_k \supset M_{k-1}\supset ... \supset M_1\supset M_0 \supset M_{-1} = 0$
where $M_i \cong V_i$ for $1,..., k-1$ and $M_0$ is the trivial 1-dimensional
module. We also show that for $i = 1, 2,..., k$ the quotient $M_i/M_{i-2}$ is
isomorphic to the so called $i$-th Grassmann module for $G$. Resting on this
fact we can give a geometric description of $M_{i-1}/M_{i-2}$ as a submodule of
the $i$-th Grassmann module. When $\F$ is perfect $G\cong \mathrm{Sp}(2n,\F)$
and $M_i/M_{i-1}$ is isomorphic to the Weyl module for $\mathrm{Sp}(2n,\F)$
relative to the $i$-th fundamental dominant weight of the root system of type
$C_n$. All irreducible sections of the latter modules are known. Thus, when
$\F$ is perfect, all irreducible sections of $V_k$ are known as well.
","[{""version"":""v1"",""created"":""Mon, 20 May 2013 09:37:48 GMT""}]","2013-05-21"
"1305.4475","Claudia Benedetti","Claudia Benedetti, Alexander P. Shurupov, Matteo G. A. Paris, Giorgio
  Brida, Marco Genovese","Experimental estimation of quantum discord for polarization qubit and
  the use of fidelity to assess quantum correlations",,"Phys. Rev. A 87, 052136 (2013)","10.1103/PhysRevA.87.052136",,"quant-ph","http://arxiv.org/licenses/nonexclusive-distrib/1.0/","  We address the experimental determination of entropic quantum discord for
systems made of a pair of polarization qubits. We compare results from full and
partial tomography and found that the two determinations are statistically
compatible, with partial tomography leading to a smaller value of discord for
depolarized states. Despite the fact that our states are well described, in
terms of fidelity, by families of depolarized or phase-damped states, their
entropic discord may be largely different from that predicted for these classes
of states, such that no reliable estimation procedure beyond tomography may be
effectively implemented. Our results, together with the lack of an analytic
formula for the entropic discord of a generic two-qubit state, demonstrate that
the estimation of quantum discord is an intrinsically noisy procedure. Besides,
we question the use of fidelity as a figure of merit to assess quantum
correlations.
","[{""version"":""v1"",""created"":""Mon, 20 May 2013 09:45:54 GMT""},{""version"":""v2"",""created"":""Tue, 21 May 2013 09:14:44 GMT""}]","2013-05-31"
"1305.4476","Xiaoping Zhang","Xiaoping Zhang (for the STAR Collaboration)","Beam energy dependence of strange hadron production from STAR at RHIC","4 pages, 2 figures, Quark Matter 2012 proceedings",,"10.1016/j.nuclphysa.2013.02.072",,"nucl-ex","http://arxiv.org/licenses/nonexclusive-distrib/1.0/","  We present STAR measurements of K^{0}_{S}, \phi, \Lambda, \Xi, and \Omega at
mid-rapidity from Au+Au collisions at \sqrt{s_{NN}} = 7.7, 11.5, 19.6, 27, and
39 GeV from the Beam Energy Scan (BES) program at the BNL Relativistic Heavy
Ion Collider (RHIC). Nuclear modification factors and baryon-to-meson ratios
are measured to understand recombination and parton energy loss mechanisms.
Implications on partonic versus hadronic dynamics at low beam energies are
discussed.
","[{""version"":""v1"",""created"":""Mon, 20 May 2013 09:46:14 GMT""}]","2015-06-16"
"1305.4477","Andrew McRae","Andrew T. T. McRae and Colin J. Cotter","Energy- and enstrophy-conserving schemes for the shallow-water
  equations, based on mimetic finite elements","25 pages, 14 figures, submitted to QJRMS; parts of sections 3 and 4
  rewritten for clarification, assorted typo fixes",,"10.1002/qj.2291",,"math.NA physics.ao-ph","http://arxiv.org/licenses/nonexclusive-distrib/1.0/","  This paper presents a family of spatial discretisations of the nonlinear
rotating shallow-water equations that conserve both energy and potential
enstrophy. These are based on two-dimensional mixed finite element methods and
hence, unlike some finite difference methods, do not require an orthogonal
grid. Numerical verification of the aforementioned properties is also provided.
","[{""version"":""v1"",""created"":""Mon, 20 May 2013 09:50:14 GMT""},{""version"":""v2"",""created"":""Mon, 2 Sep 2013 08:33:38 GMT""}]","2015-06-16"
"1305.4478","Aydin Gezer Dr.","Aydin Gezer, Lokman Bilen, Ali Cakmak","Properties of modified Riemannian extensions",,,,,"math.DG","http://arxiv.org/licenses/nonexclusive-distrib/1.0/","  Let $M$ be an $n-$dimensional differentiable manifold with a symmetric
connection $\nabla $ and $T^{\ast}M$ be its cotangent bundle. In this paper, we
study some properties of the modified Riemannian extension $%
\widetilde{g}_{\nabla,c}$ on $T^{\ast}M$ defined by means of a symmetric $%
(0,2)$-tensor field $c$ on $M.$ We get the conditions under which $T^{\ast}M $
endowed with the horizontal lift $^{H}J$ of an almost complex structure $J$ and
with the metric $\widetilde{g}_{\nabla,c}$ is a K\""{a}hler-Norden manifold.
Also curvature properties of the Levi-Civita connection and another metric
connection of the metric $\widetilde{g}_{\nabla,c}$ are presented.
","[{""version"":""v1"",""created"":""Mon, 20 May 2013 09:52:43 GMT""},{""version"":""v2"",""created"":""Sun, 26 May 2013 12:37:43 GMT""}]","2013-05-28"
