"1305.4376","Lukasz Swierczewski","Lukasz Swierczewski","3DES ECB Optimized for Massively Parallel CUDA GPU Architecture","4 pages, 4 figures",,,,"cs.DC","http://creativecommons.org/licenses/by/3.0/","  Modern computers have graphics cards with much higher theoretical efficiency
than conventional CPU. The paper presents application possibilities GPU CUDA
acceleration for encryption of data using the new architecture tailored to the
3DES algorithm, characterized by increased security compared to the normal DES.
The algorithm used in ECB mode (Electronic Codebook), in which 64-bit data
blocks are encrypted independently by stream processors (CUDA cores).
","[{""version"":""v1"",""created"":""Sun, 19 May 2013 16:02:42 GMT""}]","2013-05-21"
"1305.4377","Victor Przyjalkowski","Victor Przyjalkowski, Constantin Shramov","On Hodge numbers of complete intersections and Landau--Ginzburg models","23 pages, some misprints are corrected and improvements are made,
  comments are welcome","Int. Math. Res. Not. IMRN 2015, no. 21, 11302-11332",,,"math.AG","http://arxiv.org/licenses/nonexclusive-distrib/1.0/","  We prove that the Hodge number $h^{1,N-1}(X)$ of an $N$-dimensional
($N\geqslant 3$) Fano complete intersection $X$ is less by one then the number
of irreducible components of the central fiber of (any) Calabi--Yau
compactification of Givental's Landau--Ginzburg model for $X$.
","[{""version"":""v1"",""created"":""Sun, 19 May 2013 16:16:30 GMT""},{""version"":""v2"",""created"":""Tue, 19 Aug 2014 15:30:24 GMT""},{""version"":""v3"",""created"":""Mon, 24 Nov 2014 19:17:07 GMT""},{""version"":""v4"",""created"":""Wed, 11 Feb 2015 08:31:18 GMT""},{""version"":""v5"",""created"":""Fri, 17 Mar 2017 14:07:05 GMT""}]","2017-03-20"
"1305.4378","Klajdi Karanxha","Klajdi Karanxha, Kapies Vallipuram, Herman Sonfack, Gustavo Barbieri
  Pereira","Software Requirements Specification - Softbody Simulation System","arXiv admin note: text overlap with arXiv:1212.6250 by other authors",,,,"cs.SE","http://arxiv.org/licenses/nonexclusive-distrib/1.0/","  The purpose of this document is to give the vision for interactive computer
graphics physical based simulation systems. It focuses on the needs of
stakeholders and the reasons for such needs.
","[{""version"":""v1"",""created"":""Sun, 19 May 2013 16:20:12 GMT""}]","2013-05-21"
"1305.4379","Hadi Susanto","J.H.P. Dawes and H. Susanto","Variational approximation and the use of collective coordinates","To appear in PRE (2013)",,"10.1103/PhysRevE.87.063202",,"nlin.PS","http://arxiv.org/licenses/nonexclusive-distrib/1.0/","  We consider propagating, spatially localised waves in a class of equations
that contain variational and non-variational terms. The dynamics of the waves
is analysed through a collective coordinate approach. Motivated by the
variational approximation, we show that there is a natural choice of projection
onto collective variables for reducing the governing (nonlinear) partial
differential equation (PDE) to coupled ordinary differential equations (ODEs).
This projection produces ODEs whose solutions are exactly the stationary states
of the effective Lagrangian that would be considered from applying the
variational approximation method. We illustrate our approach by applying it to
a modified Fisher equation for a travelling front, containing a
non-constant-coefficient nonlinear term. We present numerical results that show
that our proposed projection captures both the equilibria and the dynamics of
the PDE much more closely than previously proposed projections.
","[{""version"":""v1"",""created"":""Sun, 19 May 2013 16:29:32 GMT""}]","2015-06-16"
"1305.4380","Fernando Moreno","Fernando Moreno, Antonio Cabrera-Lavers, Ovidiu Vaduvescu, Javier
  Licandro, and Francisco Pozuelos","The dust environment of Main-Belt Comet P/2012 T1 (PANSTARRS)","Accepted for publication in The Astrophysical Journal Letters",,"10.1088/2041-8205/770/2/L30",,"astro-ph.EP","http://arxiv.org/licenses/nonexclusive-distrib/1.0/","  Main-Belt Comet P/2012 T1 (PANSTARRS) has been imaged using the 10.4m Gran
Telescopio Canarias (GTC) and the 4.2m William Herschel Telescope (WHT) at six
epochs in the period from November 2012 to February 2013, with the aim of
monitoring its dust environment. The dust tails brightness and morphology are
best interpreted in terms of a model of sustained dust emission spanning 4 to 6
months. The total dust mass ejected is estimated at $\sim$6--25$\times10^6$ kg.
We assume a time-independent power-law size distribution function, with
particles in the micrometer to centimeter size range. Based on the quality of
the fits to the isophote fields, an anisotropic emission pattern is favored
against an isotropic one, in which the particle ejection is concentrated toward
high latitudes ($\pm45^\circ$ to $\pm90^\circ$) in a high obliquity object
($I$=80$^\circ$). This seasonally-driven ejection behavior, along with the
modeled particle ejection velocities, are in remarkable agreement to those we
found for P/2010 R2 (La Sagra) \citep{Moreno11a}.
","[{""version"":""v1"",""created"":""Sun, 19 May 2013 16:52:48 GMT""}]","2015-06-16"
"1305.4381","Eleftherios Nikolidakis","Eleftherios Nikolidakis","The Bellman function of the dyadic maximal operator related to
  Kolmogorov's inequality","19 pages",,,,"math.FA","http://arxiv.org/licenses/nonexclusive-distrib/1.0/","  We precisely compute the Bellman function of two variables of the dyadic
maximal operator in relation to Kolmogorov inequality. In this way we give an
alternative proof of the results in [5].Additionally, we characterize the
sequences of functions that are extremal for this Bellman function.The proof of
this is based on that is given in this paper for the Bellman function we are
interested in.
","[{""version"":""v1"",""created"":""Sun, 19 May 2013 17:08:25 GMT""},{""version"":""v2"",""created"":""Mon, 29 Jul 2013 11:57:19 GMT""},{""version"":""v3"",""created"":""Sat, 29 Mar 2014 13:27:09 GMT""}]","2014-04-01"
"1305.4382","Craig Cowan T","Craig Cowan","Stability of entire solutions to supercritical elliptic problems
  involving advection","20 pages",,,,"math.AP","http://arxiv.org/licenses/nonexclusive-distrib/1.0/","  We examine the equation given by \begin{equation} \label{eq_abstract} -\Delta
u + a(x) \cdot \nabla u = u^p \qquad \mbox{in $ \IR^N$,} \end{equation} where
$p>1$ and $ a(x)$ is a smooth vector field satisfying some decay conditions. We
show that for $ p < p_c$, the Joseph-Lundgren exponent, that there is no
positive stable solution of (\ref{eq_abstract}) provided one imposes a
smallness condition on $a$ along with a divergence free condition. In the other
direction we show that for $ N \ge 4$ and $ p > \frac{N-1}{N-3}$ there exists a
positive solution of (\ref{eq_abstract}) provided $a$ satisfies a smallness
condition. For $ p>p_c$ we show the existence of a positive stable solution of
(\ref{eq_abstract}) provided $a$ is divergence free and satisfies a smallness
condition.
","[{""version"":""v1"",""created"":""Sun, 19 May 2013 17:46:57 GMT""}]","2013-05-21"
"1305.4383","Saurabh  Mani Tripathi","Saurabh Mani Tripathi, Arun Kumar, Wojtek J. Bock and Predrag Mikulic","A wide-range temperature immune ultra-sensitive refractive index sensor
  using concatenated LPGs","4 pages, 3 figures",,,,"physics.optics","http://arxiv.org/licenses/nonexclusive-distrib/1.0/","  Compensating the temperature induced phase-changes of concatenated
dual-resonance long-period-gratings by a suitably chosen inter-grating material
and space we report wide-range temperature insensitivity along with extremely
high refractive-index sensitivity, on either side of turn-around wavelength.
","[{""version"":""v1"",""created"":""Sun, 19 May 2013 17:51:11 GMT""}]","2013-05-21"
"1305.4384","St\'ephane Roux","S.G. Roux and M. Clausel and B. Vedel and S. Jaffard and P. Abry","Self-Similar Anisotropic Texture Analysis: the Hyperbolic Wavelet
  Transform Contribution",,,"10.1109/TIP.2013.2272515",,"physics.data-an","http://arxiv.org/licenses/nonexclusive-distrib/1.0/","  Textures in images can often be well modeled using self-similar processes
while they may at the same time display anisotropy. The present contribution
thus aims at studying jointly selfsimilarity and anisotropy by focusing on a
specific classical class of Gaussian anisotropic selfsimilar processes. It will
first be shown that accurate joint estimates of the anisotropy and
selfsimilarity parameters are performed by replacing the standard 2D-discrete
wavelet transform by the hyperbolic wavelet transform, which permits the use of
different dilation factors along the horizontal and vertical axis. Defining
anisotropy requires a reference direction that needs not a priori match the
horizontal and vertical axes according to which the images are digitized, this
discrepancy defines a rotation angle. Second, we show that this rotation angle
can be jointly estimated. Third, a non parametric bootstrap based procedure is
described, that provides confidence interval in addition to the estimates
themselves and enables to construct an isotropy test procedure, that can be
applied to a single texture image. Fourth, the robustness and versatility of
the proposed analysis is illustrated by being applied to a large variety of
different isotropic and anisotropic self-similar fields. As an illustration, we
show that a true anisotropy built-in self-similarity can be disentangled from
an isotropic self-similarity to which an anisotropic trend has been
superimposed.
","[{""version"":""v1"",""created"":""Sun, 19 May 2013 17:56:11 GMT""}]","2015-06-16"
"1305.4385","David A. Smith","The Fermi-LAT collaboration","The Second Fermi Large Area Telescope Catalog of Gamma-ray Pulsars","145 pages. Online files at
  http://fermi.gsfc.nasa.gov/ssc/data/access/lat/2nd_PSR_catalog/ A typo in the
  value of the photon flux for CTA 1 (PSR J0007+7303) has been corrected in
  Table 9. NASA ADS at http://cdsads.u-strasbg.fr/abs/2013ApJS..208...17A","Astrophysical Journal Supplement 208, 17 (2013)","10.1088/0067-0049/208/2/17",,"astro-ph.HE","http://arxiv.org/licenses/nonexclusive-distrib/1.0/","  This catalog summarizes 117 high-confidence > 0.1 GeV gamma-ray pulsar
detections using three years of data acquired by the Large Area Telescope (LAT)
on the Fermi satellite. Half are neutron stars discovered using LAT data,
through periodicity searches in gamma-ray and radio data around LAT
unassociated source positions. The 117 pulsars are evenly divided into three
groups: millisecond pulsars, young radio-loud pulsars, and young radio-quiet
pulsars. We characterize the pulse profiles and energy spectra and derive
luminosities when distance information exists. Spectral analysis of the
off-peak phase intervals indicates probable pulsar wind nebula emission for
four pulsars, and off-peak magnetospheric emission for several young and
millisecond pulsars. We compare the gamma-ray properties with those in the
radio, optical, and X-ray bands. We provide flux limits for pulsars with no
observed gamma-ray emission, highlighting a small number of gamma-faint,
radio-loud pulsars. The large, varied gamma-ray pulsar sample constrains
emission models. Fermi's selection biases complement those of radio surveys,
enhancing comparisons with predicted population distributions.
","[{""version"":""v1"",""created"":""Sun, 19 May 2013 17:57:51 GMT""},{""version"":""v2"",""created"":""Thu, 23 May 2013 08:52:23 GMT""},{""version"":""v3"",""created"":""Tue, 24 Sep 2013 13:11:03 GMT""}]","2013-09-25"
"1305.4386","Sergei Merenkov","Sergei Merenkov","On the Cauchy transform of the Bergman space","8 pages","Mat. Fiz. Anal. Geom., 7 (2000), no. 1, 119-127",,,"math.CV","http://arxiv.org/licenses/nonexclusive-distrib/1.0/","  The range of the Bergman space B_2(G) under the Cauchy transform K is
described for a large class of domains. For a quasidisk G the relation
K(B_2^*(G))=B_2^1(\mathbb C\setminus\bar{G}) is proved.
","[{""version"":""v1"",""created"":""Sun, 19 May 2013 18:20:12 GMT""}]","2013-05-21"
"1305.4387","Sergei Merenkov","Sergei Merenkov","Equivalence of domains with isomorphic semigroups of endomorphisms","14 pages","Proc. Amer. Math. Soc., 130 (2002), no. 6, 1743-1753",,,"math.CV","http://arxiv.org/licenses/nonexclusive-distrib/1.0/","  For two bounded domains in the complex plane whose semigroups of analytic
endomorphisms are isomorphic, Eremenko proved in 1993 that the isomorphism is
given as a conjugation by a conformal or anticonformal map. In the present
paper we prove an analogue of this result for the case of bounded domains in
\mathbb C^n.
","[{""version"":""v1"",""created"":""Sun, 19 May 2013 18:21:25 GMT""}]","2013-05-21"
"1305.4388","Pierre Vuillermot","Ana Bela Cruzeiro and Pierre-A. Vuillermot","Forward-backward systems of stochastic differential equations generated
  by Bernstein diffusions","Research announcement",,,,"math.AP math.PR","http://arxiv.org/licenses/nonexclusive-distrib/1.0/","  In this short article we present new results that bring about hitherto
unknown relations between certain Bernstein diffusions wandering in bounded
convex domains of Euclidean space on the one hand, and processes which
typically occur in forward-backward systems of stochastic differential
equations on the other hand. A key point in establishing such relations lies in
the fact that the Bernstein diffusions we consider are actually reversible
It\^o diffusions.
","[{""version"":""v1"",""created"":""Sun, 19 May 2013 18:23:13 GMT""}]","2013-05-21"
"1305.4389","Igor Sergeev","Igor S. Sergeev","Implementation of linear maps with circulant matrices via modulo 2
  rectifier circuits of bounded depth","3 pages, in English; 4 pages, in Russian",,,,"cs.DS","http://arxiv.org/licenses/nonexclusive-distrib/1.0/","  In the present note we show that for any positive integer k an arbitrary
Boolean circulant matrix can be implemented via modulo 2 rectifier circuit of
depth 2k-1 and complexity O(n^{1+1/k}), and also via circuit of depth 2k and
complexity O(n^{1+1/k} log^{-1/k} n).
","[{""version"":""v1"",""created"":""Sun, 19 May 2013 18:29:11 GMT""}]","2013-05-21"
"1305.4390","Libo Sun","Libo Sun, Chihoon Lee, and Jennifer A. Hoeting","A penalized simulated maximum likelihood approach in parameter
  estimation for stochastic differential equations","23 pages, 4 figures, 3 tables","Computational Statistics & Data Analysis 84 (2015): 54-67","10.1016/j.csda.2014.11.007",,"stat.ME stat.AP stat.CO","http://arxiv.org/licenses/nonexclusive-distrib/1.0/","  We consider the problem of estimating parameters of stochastic differential
equations (SDEs) with discrete-time observations that are either completely or
partially observed. The transition density between two observations is
generally unknown. We propose an importance sampling approach with an auxiliary
parameter when the transition density is unknown. We embed the auxiliary
importance sampler in a penalized maximum likelihood framework which produces
more accurate and computationally efficient parameter estimates. Simulation
studies in three different models illustrate promising improvements of the new
penalized simulated maximum likelihood method. The new procedure is designed
for the challenging case when some state variables are unobserved and moreover,
observed states are sparse over time, which commonly arises in ecological
studies. We apply this new approach to two epidemics of chronic wasting disease
in mule deer.
","[{""version"":""v1"",""created"":""Sun, 19 May 2013 18:42:46 GMT""},{""version"":""v2"",""created"":""Tue, 3 Dec 2013 17:03:19 GMT""},{""version"":""v3"",""created"":""Wed, 21 May 2014 02:41:56 GMT""},{""version"":""v4"",""created"":""Tue, 8 Sep 2015 18:24:06 GMT""}]","2015-09-09"
"1305.4391","Jennifer Raaf","Super-Kamiokande Collaboration: K. Abe, Y. Hayato, T. Iida, K. Iyogi,
  J. Kameda, Y. Koshio, Y. Kozuma, Ll. Marti, M. Miura, S. Moriyama, M.
  Nakahata, S. Nakayama, Y. Obayashi, H. Sekiya, M. Shiozawa, Y. Suzuki, A.
  Takeda, Y. Takenaga, K. Ueno, K. Ueshima, S. Yamada, T. Yokozawa, C.
  Ishihara, H. Kaji, T. Kajita, K. Kaneyuki, K. P. Lee, T. McLachlan, K.
  Okumura, Y. Shimizu, N. Tanimoto, E. Kearns, M. Litos, J. L. Raaf, J. L.
  Stone, L. R. Sulak, M. Goldhaber, K. Bays, W. R. Kropp, S. Mine, C. Regis, A.
  Renshaw, M. B. Smy, H. W. Sobel, K. S. Ganezer, J. Hill, W. E. Keig, J. S.
  Jang, J. Y. Kim, I. T. Lim, J. B. Albert, K. Scholberg, C. W. Walter, R.
  Wendell, T. M. Wongjirad, T. Ishizuka, S. Tasaka, J. G. Learned, S. Matsuno,
  S. N. Smith, T. Hasegawa, T. Ishida, T. Ishii, T. Kobayashi, T. Nakadaira, K.
  Nakamura, K. Nishikawa, Y. Oyama, K. Sakashita, T. Sekiguchi, T. Tsukamoto,
  A. T. Suzuki, Y. Takeuchi, M. Ikeda, A. Minamino, T. Nakaya, Y. Fukuda, Y.
  Itow, G. Mitsuka, T. Tanaka, C. K. Jung, G. D. Lopez, I. Taylor, C.
  Yanagisawa, H. Ishino, A. Kibayashi, S. Mino, T. Mori, M. Sakuda, H. Toyota,
  Y. Kuno, M. Yoshida, S. B. Kim, B. S. Yang, H. Okazawa, Y. Choi, K.
  Nishijima, M. Koshiba, M. Yokoyama, Y. Totsuka, K. Martens, J. Schuemann, M.
  R. Vagins, S. Chen, Y. Heng, Z. Yang, H. Zhang, D. Kielczewska, P.
  Mijakowski, K. Connolly, M. Dziomba, E. Thrane, R. J. Wilkes","A Search for Nucleon Decay via $n \rightarrow \bar{\nu} \pi^{0}$ and $p
  \rightarrow \bar{\nu} \pi^{+}$ in Super-Kamiokande","6 pages, 5 figures, submitted to Physical Review Letters","Phys. Rev. Lett. 113, 121802 (2014)","10.1103/PhysRevLett.113.121802",,"hep-ex","http://arxiv.org/licenses/nonexclusive-distrib/1.0/","  We present the results of searches for nucleon decay via bound neutron to
antineutrino plus pizero and proton to antineutrino plus piplus using data from
a combined 172.8 kiloton-years exposure of Super-Kamiokande-I, -II, and -III.
We set lower limits on the partial lifetime for each of these modes. For
antineutrino pizero, the partial lifetime is >1.1x10^{33} years; for
antineutrino piplus, the partial lifetime is >3.9x10^{32} years at 90%
confidence level.
","[{""version"":""v1"",""created"":""Sun, 19 May 2013 18:43:46 GMT""}]","2014-09-24"
"1305.4392","Pierre Vuillermot","Pierre-A. Vuillermot and Jean-C. Zambrini","Bernstein diffusions for a class of linear parabolic partial
  differential equations",,,"10.1007/s10959-012-0426-3",,"math.AP math.PR","http://arxiv.org/licenses/nonexclusive-distrib/1.0/","  In this article we prove the existence of Bernstein processes which we
associate in a natural way with a class of linear parabolic initial-and final
boundary value problems defined in bounded convex subsets of Euclidean space of
arbitrary dimension. Under certain conditions regarding their endpoint
distributions, we also prove that such processes become reversible Markov
diffusions. Furthermore we show that those diffusions satisfy two It\^o
equations for some suitably constructed Wiener processes, and from that
analysis derive Feynman-Kac representations for the solutions to the given
equations. We then illustrate some of our results by considering the heat
equation with Neumann boundary conditions both in a one-dimensional bounded
interval and in a two-dimensional disk.
","[{""version"":""v1"",""created"":""Sun, 19 May 2013 18:50:05 GMT""}]","2013-05-21"
"1305.4393","Uttam Singh","Uttam Singh and Arun Kumar Pati","Weak measurement induced super discord can resurrect lost quantumness","Latex, 5 pages",,,"HRI-P-14-05-002","quant-ph","http://arxiv.org/licenses/nonexclusive-distrib/1.0/","  The projective measurement usually destroys the quantum correlation between
two subsystems of a composite system, thereby making the measured state useless
for any efficient quantum information processing and quantum computation task.
The weak measurement acts gently on quantum system and do not force the system
state to decohere completely, thus revealing the super quantum discord, which
can take value more than that of the normal quantum discord. Remarkably, we
prove that the super quantum discord in the post measured state is equal to the
difference between the super quantum discord and the normal quantum discord in
the original state. Thus, the weak measurement has the ability to resurrect the
lost quantumness of any composite quantum state. This suggests a conservation
law for the extra quantum correlation in any composite state. The amount of
extra quantum correlation which is destroyed by the projective measurement in
the original state is equal to the amount of extra quantum correlation captured
by the weak measurement in the post-measured state.
","[{""version"":""v1"",""created"":""Sun, 19 May 2013 18:56:54 GMT""}]","2014-05-02"
"1305.4394","Chokri Abdelkefi c.a","Chokri Abdelkefi and Mongi Rachdi","Classes of operators on weighted function spaces in Dunkl analysis","17 pages. arXiv admin note: substantial text overlap with
  arXiv:1301.6267, arXiv:1208.5034",,,,"math.AP","http://arxiv.org/licenses/nonexclusive-distrib/1.0/","  For indices p and q, 1 < p <= q < infini and a linear operator L satisfying
some weak-type boundedness conditions on suitable function spaces, we give in
the Dunkl setting sufficient conditions on nonnegative pairs of weight
functions to obtain weighted norm inequalities for the operator L. We apply our
results to obtain weighted (Lp, Lq) boundedness of the Riesz potentials and of
the related fractional maximal operators for the Dunkl transform. Finally, we
prove a weighted generalized Sobolev inequality.
","[{""version"":""v1"",""created"":""Sun, 19 May 2013 18:57:44 GMT""},{""version"":""v2"",""created"":""Sat, 2 Nov 2013 19:06:56 GMT""}]","2013-11-05"
"1305.4395","Michel Balazard","Michel Balazard (IML), Bruno Martin (LMPA)","Sur l'autocorr\'elation multiplicative de la fonction ""partie
  fractionnaire"" et une fonction d\'efinie par J. R. Wilton",,,,,"math.NT","http://arxiv.org/licenses/nonexclusive-distrib/1.0/","  We describe the points of diff erentiability of the multiplicative
autocorrelation function of the ""fractional part"" function. In connection with
this question, we study series involving the fi rst Bernoulli function, the
arithmetical function ""number of divisors"", and the Gauss map from the theory
of continued fractions. A key role is played by a function defi ned in 1933 by
J. R. Wilton, similar to the Brjuno function of dynamical systems theory. A
unifying theme of our exposition is the use of functional equations involving
the Gauss map, allowing us to reprove and re fine a theorem of Wilton, la
Bret\`eche and Tenenbaum.
","[{""version"":""v1"",""created"":""Sun, 19 May 2013 18:58:35 GMT""}]","2013-05-21"
"1305.4396","Jean-Baptiste Gouere","Jean-Baptiste Gou\'er\'e (MAPMO)","Branching brownian motion seen from its left-most particule",,,,,"math.PR","http://arxiv.org/licenses/nonexclusive-distrib/1.0/","  This paper is a review of the recent progresses on the branching brownian
motion seen from its left-most particule. We describe in particular the recent
works by Arguin-Bovier-Kistler and A\""id\'ekon-Berestycki-Brunet-Shi. This is
the text in french of a Bourbaki seminar given in March 2013.
","[{""version"":""v1"",""created"":""Sun, 19 May 2013 18:59:21 GMT""}]","2013-05-21"
"1305.4397","Junyan  Cao","Junyan Cao (IF)","A remark on compact K\""ahler manifolds with nef anticanonical bundles
  and its applications","21 pages, Proposition 2.1 added, several references added",,,,"math.AG","http://arxiv.org/licenses/nonexclusive-distrib/1.0/","  Let $(X, \omega_X)$ be a compact K\""ahler manifold such that the
anticanonical bundle $-K_X$ is nef. We prove that the slopes of the
Harder-Narasimhan filtration of the tangent bundle with respect to a
polarization of the form $\omega_X^{n-1}$ are semi-positive. As an application,
we give a characterization of rationally connected compact K\""ahler manifolds
with nef anticanonical bundles. As another application, we give a simple proof
of the surjectivity of the Albanese map.
","[{""version"":""v1"",""created"":""Sun, 19 May 2013 18:59:50 GMT""},{""version"":""v2"",""created"":""Wed, 26 Feb 2014 02:12:50 GMT""}]","2014-02-27"
"1305.4398","Adam  Towsley","Ekaterina Amerik, Par Kurlberg, Khoa Nguyen, Adam Towsley, Bianca
  Viray, and Jose Felipe Voloch","Evidence for the Dynamical Brauer-Manin Criterion",,,,,"math.NT math.AG","http://arxiv.org/licenses/nonexclusive-distrib/1.0/","  Let f:X->X be a morphism of a variety over a number field K. We consider
local conditions and a ""Bruaer-Manin"" condition, defined by Hsia and Silverman,
for the orbit of a point P in X(K) to be disjoint from a subvariety V of X,
i.e., the intersection of the orbit of P with V is empty. We provide evidence
that the dynamical Brauer-Manin condition is sufficient to explain the lack of
points in the intersection of the orbit of P with V; this evidence stems from a
probabilistic argument as well as unconditional results in the case of etale
maps.
","[{""version"":""v1"",""created"":""Sun, 19 May 2013 19:02:39 GMT""},{""version"":""v2"",""created"":""Wed, 23 Oct 2013 19:01:21 GMT""}]","2013-10-24"
