"1305.4520","Justin Dressel","Justin Dressel, Kevin Lyons, Andrew N. Jordan, Trent M. Graham, Paul
  G. Kwiat","Strengthening weak value amplification with recycled photons","13 pages, 8 figures","Phys. Rev. A 88, 023821 (2013)","10.1103/PhysRevA.88.023821",,"physics.optics quant-ph","http://arxiv.org/licenses/nonexclusive-distrib/1.0/","  We consider the use of cyclic weak measurements to improve the sensitivity of
weak-value amplification precision measurement schemes. Previous weak-value
experiments have used only a small fraction of events, while discarding the
rest through the process of ""post-selection"". We extend this idea by
considering recycling of events which are typically unused in a weak
measurement. Here we treat a sequence of polarized laser pulses effectively
trapped inside an interferometer using a Pockels cell and polarization optics.
In principle, all photons can be post-selected, which will improve the
measurement sensitivity. We first provide a qualitative argument for the
expected improvements from recycling photons, followed by the exact result for
the recycling of collimated beam pulses, and numerical calculations for
diverging beams. We show that beam degradation effects can be mitigated via
profile flipping or Zeno reshaping. The main advantage of such a recycling
scheme is an effective power increase, while maintaining an amplified
deflection.
","[{""version"":""v1"",""created"":""Mon, 20 May 2013 13:10:56 GMT""}]","2013-08-23"
"1305.4521","Hiroaki Sugiyama","Shinya Kanemura (Toyama U.), Toshinori Matsui (Toyama U.), Hiroaki
  Sugiyama (Kyoto Sangyo U.)","Loop Suppression of Dirac Neutrino Mass in the Neutrinophilic Two Higgs
  Doublet Model","15 pages, 2 figures, published in Physics Letters B","Phys. Lett. B727, 151 (2013)","10.1016/j.physletb.2013.09.061","UT-HET-081, MISC-2013-05","hep-ph","http://arxiv.org/licenses/nonexclusive-distrib/1.0/","  We extend the scalar sector of the neutrinophilic two Higgs doublet model,
where small masses of Dirac neutrinos are obtained via a small vacuum
expectation value v_nu of the neutrinophilic SU(2)_L-doublet scalar field which
has a Yukawa interaction with only right-handed neutrinos. A global U(1)_X
symmetry is used for the neutrinophilic nature of the second SU(2)_L-doublet
scalar field and also for eliminating Majorana mass terms of neutrinos. By
virtue of an appropriate assignment of the U(1)_X-charges to new particles, our
model has an unbroken Z_2 symmetry, under which the lightest Z_2-odd scalar
boson can be a dark matter candidate. In our model, v_nu is generated by the
one-loop diagram to which Z_2-odd particles contribute. We briefly discuss a
possible signature of our model at the LHC.
","[{""version"":""v1"",""created"":""Mon, 20 May 2013 13:16:52 GMT""},{""version"":""v2"",""created"":""Sun, 10 Nov 2013 18:57:13 GMT""}]","2015-06-16"
"1305.4522","Francisco C. Alcaraz","Francisco C. Alcaraz and Vladimir Rittenberg","Nonlocal Asymmetric exclusion process on a ring and conformal invariance","26 pages 26 figures","J. Stat. Mech. JSTAT (2013) P09010","10.1088/1742-5468/2013/09/P09010",,"cond-mat.stat-mech","http://arxiv.org/licenses/nonexclusive-distrib/1.0/","  We present a one-dimensional nonlocal hopping model with exclusion on a ring.
The model is related to the Raise and Peel growth model. A nonnegative
parameter $u$ controls the ratio of the local backwards and nonlocal forwards
hopping rates. The phase diagram and consequently the values of the current,
depend on $u$ and the density of particles. In the special case of half-filling
and $u = 1$ the system is conformal invariant and an exact value of the current
for any size $L$ of the system is conjectured and checked for large lattice
sizes in Monte Carlo simulations. For $u > 1$ the current has a non-analytic
dependence on the density when the latter approaches the half-filling value.
","[{""version"":""v1"",""created"":""Mon, 20 May 2013 13:21:28 GMT""},{""version"":""v2"",""created"":""Wed, 7 Aug 2013 18:17:20 GMT""}]","2013-09-16"
"1305.4523","Tal Perri","Tal Perri","A model theoretic construction for layered semifields",,,,,"math.AG","http://arxiv.org/licenses/nonexclusive-distrib/1.0/","  In this paper we introduce a model theoretic construction for the theories of
uniform layered domains and semifields introduced in the paper of Izhakian,
Knebusch and Rowen. We prove that, for a given layering semiring L, the theory
of uniform L-layered divisibly closed semifields is complete. In the process of
doing so, we prove that this theory has quantifier elimination and consequently
is model complete. Model completeness of uniform L-layered divisibly closed has
some important consequences regarding the uniform L-layered semifields theory.
One example involves equating polynomials. Namely, model completeness insures
us that if two polynomials are equal over a divisibly closed uniform L-layered
semifield, then they are equal over any divisibly closed uniform L-layered
extension of that semifield, and thus over any uniform L-layered domain
extending the semifield (as it is contained in its divisible closure of its
semifield of fractions). At the end of this paper we apply our results to the
theory of max-plus algebras as a special case of uniform L -layered domains.
","[{""version"":""v1"",""created"":""Mon, 20 May 2013 13:25:00 GMT""}]","2013-05-21"
"1305.4524","Andrew J. S. Hamilton","A. J. S. Hamilton","The Black Hole Particle Accelerator as a Machine to make Baby Universes","7 pages, 2 figures. NO honorable mention in the 2013 Essay
  Competition of the Gravity Research Foundation",,,,"gr-qc","http://arxiv.org/licenses/nonexclusive-distrib/1.0/","  General relativity predicts that the inner horizon of an astronomically
realistic rotating black hole is subject to the mass inflation instability. The
inflationary instability acts like a gravity-powered particle accelerator of
extraordinary power, accelerating accreted streams of particles along the
principal outgoing and ingoing null directions at the inner horizon to
collision energies that would, if nothing intervened, typically exceed
exponentially the Planck energy. The inflationary instability is fueled by
ongoing accretion, and is occurring inevitably in essentially every black hole
in our Universe. This extravagant machine, the Black Hole Particle Accelerator,
has the hallmarks of a device to make baby universes. Since collisions are most
numerous inside supermassive black holes, reproductive efficiency requires our
Universe to make supermassive black holes efficiently, as is observed.
","[{""version"":""v1"",""created"":""Mon, 20 May 2013 13:25:36 GMT""}]","2013-05-21"
"1305.4525","Miron Kursa","Miron B. Kursa","Robustness of Random Forest-based gene selection methods",,,,,"cs.LG q-bio.QM","http://arxiv.org/licenses/nonexclusive-distrib/1.0/","  Gene selection is an important part of microarray data analysis because it
provides information that can lead to a better mechanistic understanding of an
investigated phenomenon. At the same time, gene selection is very difficult
because of the noisy nature of microarray data. As a consequence, gene
selection is often performed with machine learning methods. The Random Forest
method is particularly well suited for this purpose. In this work, four
state-of-the-art Random Forest-based feature selection methods were compared in
a gene selection context. The analysis focused on the stability of selection
because, although it is necessary for determining the significance of results,
it is often ignored in similar studies.
  The comparison of post-selection accuracy in the validation of Random Forest
classifiers revealed that all investigated methods were equivalent in this
context. However, the methods substantially differed with respect to the number
of selected genes and the stability of selection. Of the analysed methods, the
Boruta algorithm predicted the most genes as potentially important.
  The post-selection classifier error rate, which is a frequently used measure,
was found to be a potentially deceptive measure of gene selection quality. When
the number of consistently selected genes was considered, the Boruta algorithm
was clearly the best. Although it was also the most computationally intensive
method, the Boruta algorithm's computational demands could be reduced to levels
comparable to those of other algorithms by replacing the Random Forest
importance with a comparable measure from Random Ferns (a similar but
simplified classifier). Despite their design assumptions, the minimal optimal
selection methods, were found to select a high fraction of false positives.
","[{""version"":""v1"",""created"":""Mon, 20 May 2013 13:39:03 GMT""},{""version"":""v2"",""created"":""Fri, 27 Sep 2013 23:12:50 GMT""},{""version"":""v3"",""created"":""Fri, 18 Oct 2013 15:30:45 GMT""}]","2013-10-21"
"1305.4526","Andrzej Okolow","Andrzej Okolow","Variables suitable for constructing quantum states for the Teleparallel
  Equivalent of General Relativity I","34 pages, 5 figures, Latex2e","Gen. Rel. Grav. 46: 1620 (2014)","10.1007/s10714-013-1620-z",,"gr-qc hep-th math-ph math.MP","http://arxiv.org/licenses/nonexclusive-distrib/1.0/","  We present the first part of an analysis aimed at introducing variables which
are suitable for constructing a space of quantum states for the Teleparallel
Equivalent of General Relativity via projective techniques - the space is meant
to be applied in a canonical quantization of the theory. We show that natural
configuration variables on the phase space of the theory can be used to
construct a space of quantum states which however possesses an undesired
property. We introduce then a family of new variables such that some elements
of the family can be applied to build a space of quantum states free of that
property.
","[{""version"":""v1"",""created"":""Mon, 20 May 2013 13:39:49 GMT""},{""version"":""v2"",""created"":""Wed, 12 Jun 2013 11:54:09 GMT""},{""version"":""v3"",""created"":""Mon, 3 Mar 2014 10:26:28 GMT""}]","2014-03-04"
"1305.4527","Leonardo Banchi","Leonardo Banchi, Paolo Giorda, and Paolo Zanardi","Quantum information-geometry of dissipative quantum phase transitions","5+6 pages, 2 figures, presentation improved, new results and
  references added","Phys. Rev. E 89, 022102 (2014)","10.1103/PhysRevE.89.022102",,"quant-ph cond-mat.stat-mech","http://arxiv.org/licenses/nonexclusive-distrib/1.0/","  A general framework for analyzing the recently discovered phase transitions
in the steady state of dissipation-driven open quantum systems is still
missing. In order to fill this gap we extend the so-called fidelity approach to
quantum phase transitions to open systems whose steady state is a Gaussian
Fermionic state. We endow the manifold of correlations matrices of
steady-states with a metric tensor g measuring the distinguishability distance
between solutions corresponding to different set of control parameters. The
phase diagram can be then mapped out in terms of the scaling-behavior of g and
connections with the Liouvillean gap and the model correlation functions
unveiled. We argue that the fidelity approach, thanks to its
differential-geometric and information-theoretic nature, provides novel
insights on dissipative quantum critical phenomena as well as a general and
powerful strategy to explore them.
","[{""version"":""v1"",""created"":""Mon, 20 May 2013 13:48:20 GMT""},{""version"":""v2"",""created"":""Fri, 20 Sep 2013 17:27:38 GMT""}]","2014-02-12"
"1305.4528","Yu Gao","Y. Gao, T. Sakurai, H. Zhang, K. Kuzanyan, D. Sokoloff","Statistical distribution of current helicity in solar active regions
  over the magnetic cycle",,,"10.1093/mnras/stt838",,"astro-ph.SR","http://arxiv.org/licenses/nonexclusive-distrib/1.0/","  The current helicity in solar active regions derived from vector magnetograph
observations for more than 20 years indicates the so-called hemispheric sign
rule; the helicity is predominantly negative in the northern hemisphere and
positive in the southern hemisphere. In this paper we revisit this property and
compare the statistical distribution of current helicity with Gaussian
distribution using the method of normal probability paper. The data sample
comprises 6630 independent magnetograms obtained at Huairou Solar Observing
Station, China, over 1988-2005 which correspond to 983 solar active regions. We
found the following. (1) For the most of cases in time-hemisphere domains the
distribution of helicity is close to Gaussian. (2) At some domains (some years
and hemispheres) we can clearly observe significant departure of the
distribution from a single Gaussian, in the form of two- or multi-component
distribution. (3) For the most non-single-Gaussian parts of the dataset we see
co-existence of two or more components, one of which (often predominant) has a
mean value very close to zero, which does not contribute much to the
hemispheric sign rule. The other component has relatively large value of
helicity that often determines agreement or disagreement with the hemispheric
sign rule in accord with the global structure of helicity reported by Zhang et
al. (2010).
","[{""version"":""v1"",""created"":""Mon, 20 May 2013 13:57:14 GMT""}]","2015-06-16"
"1305.4530","Arman Shafieloo","Santanu Das, Arman Shafieloo, Tarun Souradeep","ISW effect as probe of features in the expansion history of the Universe","20 pages, 11 figures, 2 tables, discussions extended, references
  added, results unchanged, matches final version published in JCAP","JCAP 10 (2013) 016","10.1088/1475-7516/2013/10/016",,"astro-ph.CO","http://arxiv.org/licenses/nonexclusive-distrib/1.0/","  In this paper, using and implementing a new line of sight CMB code, called
CMBAns [1], that allows us to modify H(z) for any given feature at any redshift
we study the effect of changes in the expansion history of the Universe on the
CMB power spectrum. Motivated by the detailed analytical calculations of the
effects of the changes in H(z) on ISW plateau and CMB low multipoles, we study
two phenomenological parametric form of the expansion history using WMAP data
and through MCMC analysis. Our MCMC analysis shows that the standard LCDM
cosmological model is consistent with the CMB data allowing the expansion
history of the Universe vary around this model at different redshifts. However,
our analysis also shows that a decaying dark energy model proposed in [2] has
in fact a marginally better fit than the standard cosmological constant model
to CMB data. Concordance of our studies here with the previous analysis showing
that Baryon Acoustic Oscillation (BAO) and supernovae data (SN Ia) also prefer
mildly this decaying dark energy model to LCDM, makes this finding interesting
and worth further investigation.
","[{""version"":""v1"",""created"":""Mon, 20 May 2013 13:58:44 GMT""},{""version"":""v2"",""created"":""Fri, 11 Oct 2013 06:50:51 GMT""}]","2013-10-14"
"1305.4531","Robert Lipton Ph.D.","Robert Lipton","Dynamic Brittle Fracture as a Small Horizon Limit of Peridynamics","26 pages, 2 figures, typos and references added",,,,"math.AP","http://arxiv.org/licenses/nonexclusive-distrib/1.0/","  We consider the nonlocal formulation of continuum mechanics described by
peridynamics. We provide a link between peridynamic evolution and brittle
fracture evolution for a broad class of peridynamic potentials associated with
unstable peridynamic constitutive laws. Distinguished limits of peridynamic
evolutions are identified that correspond to vanishing peridynamic horizon. The
limit evolution is associated with dynamic brittle fracture and satisfies a
dynamic energy inequality expressed in terms of the kinetic energy of the
motion together with a bulk elastic energy and a Griffith surface energy. It
corresponds to the simultaneous evolution of elastic displacement and brittle
fracture with displacement fields satisfying the wave equation inside the
cracking domain. The wave equation provides the dynamic coupling between
elastic waves and the evolving fracture path inside the media. The elastic
moduli, wave speed and energy release rate for the evolution are explicitly
determined by moments of the peridynamic influence function and the peridynamic
potential energy.
","[{""version"":""v1"",""created"":""Mon, 20 May 2013 14:01:54 GMT""},{""version"":""v2"",""created"":""Sun, 2 Jun 2013 16:27:50 GMT""},{""version"":""v3"",""created"":""Tue, 18 Jun 2013 23:09:30 GMT""}]","2013-06-20"
"1305.4533","Wei Zuo","Jianmin Dong, Wei Zuo and Jianzhong Gu","Magnetization of neutron star matter","6 pages, 3 figures","Phys. Rev. D 87, 103010 (2013)","10.1103/PhysRevD.87.103010",,"astro-ph.SR nucl-th","http://arxiv.org/licenses/nonexclusive-distrib/1.0/","  The magnetization of neutron star matter in magnetic fields is studied by
employing the FSUGold interaction. It is found that the magnetic
susceptibilities of the charged particles (proton, electron and muon) can be
larger than that of neutron. The effects of the anomalous magnetic moments
(AMM) of each component on the magnetic susceptibility are examined in detail.
It is found that the proton and electron AMM affect their respective magnetic
susceptibility evidently in strong magnetic fields. In addition, they are the
protons instead of the electrons that contribute most significantly to the
magnetization of the neutron star matter in a relative weak magnetic field, and
the induced magnetic field due to the magnetization can be appear to be very
large. Finally, the effect of the density-dependent symmetry energy on the
magnetization is discussed.
","[{""version"":""v1"",""created"":""Mon, 20 May 2013 14:10:16 GMT""}]","2013-05-23"
"1305.4534","Wei Zuo","Peng Yin, Jianmin Dong and Wei Zuo","Effect of tensor correlations on the depletion of nuclear Fermi sea
  within the extended BHF approach","5 pages, 3 figures. arXiv admin note: text overlap with
  arXiv:1301.3218",,,,"nucl-th nucl-ex","http://arxiv.org/licenses/nonexclusive-distrib/1.0/","  We have investigated the effect of tensor correlations on the depletion of
nuclear Fermi sea in symmetric nuclear matter within the framework of the
extended Brueckner-Hartree-Fock approach by adopting the AV18 two-body
interaction and a microscopic three-body force. The contributions from various
partial wave channels including the isospin-singlet T=0 channel, the
isospin-triplet T=1 channel and the T=0 tensor 3SD1 channel have been
calculated. The T=0 neutron-proton correlations play a dominated role in
causing the depletion of nuclear Fermi sea. The T=0 correlation-induced
depletion turns out to stem almost completely from the $^3SD_1$ tensor channel.
The isospin-singlet T=0 3SD1 tensor correlations is shown to response for most
of the depletion, which amounts to more than 70 percent out of the total
depletion in the density region considered. The TBF turns out to leads to an
enhancement of the depletion at high densities well above the empirical
saturation density and its effect increases as a function of density.
","[{""version"":""v1"",""created"":""Mon, 20 May 2013 14:10:48 GMT""}]","2013-05-21"
"1305.4535","Daisuke Iono","D. Iono, T. Saito, M. S. Yun, R. Kawabe, D. Espada, Y. Hagiwara, M.
  Imanishi, T. Izumi, K. Kohno, K. Motohara, K. Nakanishi, H. Sugai, K.
  Tateuchi, Y. Tamura, J. Ueda, Y. Yoshii","Active Galactic Nucleus and Extended Starbursts in a Mid-stage Merger
  VV114","5 pages, 4 figures, PASJ Letters accepted",,"10.1093/pasj/65.3.L7",,"astro-ph.GA astro-ph.CO","http://arxiv.org/licenses/nonexclusive-distrib/1.0/","  High resolution (0.4 arcsec) Atacama Large Millimeter/submillimeter Array
(ALMA) Cycle 0 observations of HCO+(4-3) and HCN(4-3) toward a mid-stage
infrared bright merger VV114 have revealed compact nuclear (<200 pc) and
extended (3 - 4 kpc) dense gas distribution across the eastern part of the
galaxy pair. We find a significant enhancement of HCN(4-3) emission in an
unresolved compact and broad (290km/s) component found in the eastern nucleus
of VV114, and we suggest dense gas associated with the surrounding material
around an Active Galactic Nucleus (AGN), with a mass upper limit of < 4 x 10^8
Msun. The extended dense gas is distributed along a filamentary structure with
resolved dense gas concentrations (230pc; 10^6 Msun) separated by a mean
projected distance of 600 pc, many of which are generally consistent with the
location of star formation traced in Pa alpha emission. Radiative transfer
calculations suggest moderately dense (10^5 - 10^6 cm^-3) gas averaged over the
entire emission region. These new ALMA observations demonstrate the strength of
the dense gas tracers in identifying both the AGN and star formation activity
in a galaxy merger, even in the most dust enshrouded environments in the local
universe.
","[{""version"":""v1"",""created"":""Mon, 20 May 2013 14:11:25 GMT""}]","2015-06-16"
"1305.4536","Haimiao Chen","Haimiao Chen","Counting homotopy classes of mappings via Dijkgraaf-Witten invariants","7 pages","Topology and its applications 161 (2014), no. 1, 316-320",,,"math.AT math.GN","http://arxiv.org/licenses/nonexclusive-distrib/1.0/","  Suppose $\Gamma$ is a finite group acting freely on $S^{n}$ ($n\geqslant 3$
being odd) and $M$ is any closed oriented $n$-manifold. We show that, given an
integer $k$, the set $\deg^{-1}(k)$ of based homotopy classes of mappings with
degree $k$ is finite and its cardinality depends only on the congruence class
of $k$ modulo $\#\Gamma$; moreover, $\#\deg^{-1}(k)$ can be expressed in terms
of the Dijkgraaf-Witten invariants of $M$.
","[{""version"":""v1"",""created"":""Mon, 20 May 2013 14:15:59 GMT""},{""version"":""v2"",""created"":""Thu, 22 Oct 2015 01:06:06 GMT""}]","2015-10-23"
"1305.4537","Nenad Marku\v{s}","Nenad Marku\v{s} and Miroslav Frljak and Igor S. Pand\v{z}i\'c and
  J\""orgen Ahlberg and Robert Forchheimer","Object Detection with Pixel Intensity Comparisons Organized in Decision
  Trees",,,,,"cs.CV","http://arxiv.org/licenses/nonexclusive-distrib/1.0/","  We describe a method for visual object detection based on an ensemble of
optimized decision trees organized in a cascade of rejectors. The trees use
pixel intensity comparisons in their internal nodes and this makes them able to
process image regions very fast. Experimental analysis is provided through a
face detection problem. The obtained results are encouraging and demonstrate
that the method has practical value. Additionally, we analyse its sensitivity
to noise and show how to perform fast rotation invariant object detection.
Complete source code is provided at https://github.com/nenadmarkus/pico.
","[{""version"":""v1"",""created"":""Mon, 20 May 2013 14:35:47 GMT""},{""version"":""v2"",""created"":""Mon, 21 Oct 2013 14:06:09 GMT""},{""version"":""v3"",""created"":""Wed, 29 Jan 2014 11:15:48 GMT""},{""version"":""v4"",""created"":""Thu, 27 Mar 2014 00:23:44 GMT""},{""version"":""v5"",""created"":""Tue, 19 Aug 2014 15:38:23 GMT""}]","2014-08-20"
"1305.4538","V\'ictor Valls","V\'ictor Valls and Douglas J. Leith","Proportional Fair MU-MIMO in 802.11 WLANs",,,"10.1109/WCL.2014.020314.130884",,"cs.NI","http://arxiv.org/licenses/nonexclusive-distrib/1.0/","  We consider the proportional fair rate allocation in an 802.11 WLAN that
supports multi-user MIMO (MU-MIMO) transmission by one or more stations. We
characterise, for the first time, the proportional fair allocation of MU-MIMO
spatial streams and station transmission opportunities. While a number of
features carry over from the case without MU-MIMO, in general neither flows nor
stations need to be allocated equal airtime when MU-MIMO is available.
","[{""version"":""v1"",""created"":""Mon, 20 May 2013 14:36:17 GMT""},{""version"":""v2"",""created"":""Wed, 16 Apr 2014 10:38:55 GMT""},{""version"":""v3"",""created"":""Wed, 23 Apr 2014 10:24:33 GMT""}]","2014-04-24"
