"1310.6198","Timo Scheib","HADES Collaboration: G. Agakishiev, D. Belver, A. Blanco, M. B\""ohmer,
  J. L. Boyard, P. Cabanelas, E. Castro, S. Chernenko, M. Destefanis, F.
  Dohrmann, A. Dybczak, E. Epple, L. Fabbietti, O. Fateev, P. Finocchiaro, P.
  Fonte, J. Friese, I. Fr\""ohlich, T. Galatyuk, J. A. Garz\'on, R.
  Gernh\""auser, C. Gilardi, M. Golubeva, D. Gonz\'alez-D\'iaz, F. Guber, M.
  Gumberidze, T. Heinz, T. Hennino, R. Holzmann, I. Iori, A. Ivashkin, M.
  Jurkovic, B. K\""ampfer, T. Karavicheva, I. Koenig, W. Koenig, B. W. Kolb, R.
  Kotte, A. Kr\'asa, F. Krizek, R. Kr\""ucken, H. Kuc, W. K\""uhn, A. Kugler, A.
  Kurepin, S. Lang, J. S. Lange, K. Lapidus, T. Liu, L. Lopes, M. Lorenz, L.
  Maier, A. Mangiarotti, J. Markert, V. Metag, B. Michalska, J. Miche, E.
  Morini\`ere, J. Mousa, C. M\""untz, L. Naumann, Y. C. Pachmayer, M. Palka, V.
  Pechenov, O. Pechenova, J. Pietraszko, W. Przygoda, B. Ramstein, L. Rehnisch,
  A. Reshetin, A. Rustamov, A. Sadovsky, P. Salabura, T. Scheib, A. Schmah, H.
  Schuldes, E. Schwab, J. Siebenson, Yu. G. Sobolev, S. Spatarof, B. Spruck, H.
  Str\""obele, J. Stroth, C. Sturm, A. Tarantola, K. Teilab, P. Tlusty, M.
  Traxler, R. Trebacz, H. Tsertos, V. Wagner, M. Weber, C. Wendisch, M.
  Wisniowski, J. W\""ustenfeld, S. Yurevich, Y. Zanevsky","An upper limit on hypertriton production in collisions of Ar(1.76
  AGeV)+KCl",,,,,"nucl-ex hep-ex","http://arxiv.org/licenses/nonexclusive-distrib/1.0/","  A high-statistic data sample of Ar(1.76 AGeV)+KCl events recorded with HADES
is used to search for a hypertriton signal. An upper production limit per
centrality-triggered event of $1.04$ x $10^{-3}$ on the $3\sigma$ level is
derived. Comparing this value with the number of successfully reconstructed
$\Lambda$ hyperons allows to determine an upper limit on the ratio
$N_{_{\Lambda}^3H}/N_{\Lambda}$, which is confronted with statistical and
coalescence-type model calculations.
","[{""version"":""v1"",""created"":""Wed, 23 Oct 2013 12:10:37 GMT""},{""version"":""v2"",""created"":""Fri, 25 Oct 2013 13:07:05 GMT""},{""version"":""v3"",""created"":""Fri, 15 Nov 2013 13:23:52 GMT""}]","2013-11-18"
"1310.6199","Francois Rigaut Dr","Francois Rigaut, Benoit Neichel, Maxime Boccas, C\'eline d'Orgeville,
  Fabrice Vidal, Marcos A. van Dam, Gustavo Arriagada, Vincent Fesquet, Ramon
  L. Galvez, Gaston Gausachs, Chad Cavedoni, Angelic W. Ebbers, Stan Karewicz,
  Eric James, Javier L\""uhrs, Vanessa Montes, Gabriel Perez, William N.
  Rambold, Roberto Rojas, Shane Walker, Matthieu Bec, Gelys Trancho, Michael
  Sheehan, Benjamin Irarrazaval, Corinne Boyer, Brent L. Ellerbroek, Ralf
  Flicker, Damien Gratadour, Aurea Garcia-Rissmann, Felipe Daruich","Gemini multi-conjugate adaptive optics system review I: Design,
  trade-offs and integration","17 pages, 7 figures, Accepted for publication in MNRAS",,"10.1093/mnras/stt2054",,"astro-ph.IM","http://arxiv.org/licenses/nonexclusive-distrib/1.0/","  The Gemini Multi-conjugate adaptive optics System (GeMS) at the Gemini South
telescope in Cerro Pach{\'o}n is the first sodium-based multi-Laser Guide Star
(LGS) adaptive optics system. It uses five LGSs and two deformable mirrors to
measure and compensate for atmospheric distortions. The GeMS project started in
1999, and saw first light in 2011. It is now in regular operation, producing
images close to the diffraction limit in the near infrared, with uniform
quality over a field of view of two square arcminutes. The present paper (I) is
the first one in a two-paper review of GeMS. It describes the system, explains
why and how it was built, discusses the design choices and trade-offs, and
presents the main issues encountered during the course of the project. Finally,
we briefly present the results of the system first light.
","[{""version"":""v1"",""created"":""Wed, 23 Oct 2013 12:12:19 GMT""}]","2015-06-17"
"1310.6200","Eric Barnes","Eric I. Barnes and Robert J. Ragan","Dynamics of One-dimensional Self-gravitating Systems Using
  Hermite-Legendre Polynomials","12 pages, accepted for publication in MNRAS",,"10.1093/mnras/stt2051",,"astro-ph.GA","http://arxiv.org/licenses/nonexclusive-distrib/1.0/","  The current paradigm for understanding galaxy formation in the universe
depends on the existence of self-gravitating collisionless dark matter.
Modeling such dark matter systems has been a major focus of astrophysicists,
with much of that effort directed at computational techniques. Not
surprisingly, a comprehensive understanding of the evolution of these
self-gravitating systems still eludes us, since it involves the collective
nonlinear dynamics of many-particle systems interacting via long-range forces
described by the Vlasov equation. As a step towards developing a clearer
picture of collisionless self-gravitating relaxation, we analyze the linearized
dynamics of isolated one-dimensional systems near thermal equilibrium by
expanding their phase space distribution functions f(x,v) in terms of Hermite
functions in the velocity variable, and Legendre functions involving the
position variable. This approach produces a picture of phase-space evolution in
terms of expansion coefficients, rather than spatial and velocity variables. We
obtain equations of motion for the expansion coefficients for both
test-particle distributions and self-gravitating linear perturbations of
thermal equilibrium. N-body simulations of perturbed equilibria are performed
and found to be in excellent agreement with the expansion coefficient approach
over a time duration that depends on the size of the expansion series used.
","[{""version"":""v1"",""created"":""Wed, 23 Oct 2013 12:20:51 GMT""}]","2015-06-17"
"1310.6201","Luca Costa","Luca Costa and Mario S. Rodrigues and N\'uria Benseny-Cases and
  V\'eronique Mayeaux and Jo\""el Chevrier and Fabio Comin","Spectroscopic investigation of local mechanical impedance of living
  cells","8 pages, 8 figures","PLoS ONE 9(7): e101687 (2014)","10.1371/journal.pone.0101687",,"physics.bio-ph","http://arxiv.org/licenses/nonexclusive-distrib/1.0/","  The mechanical properties of PC12 living cells have been studied at the
nanoscale with a Force Feedback Microscope using two experimental approaches.
Firstly, the local mechanical impedance of the cell membrane has been mapped
simultaneously to the cell morphology at constant force. As the force of the
interaction is gradually increased, we observed the appearance of the
sub-membrane cytoskeleton. We shall compare the results obtained with this
method with the measurement of other existing techniques. Secondly, a
spectroscopic investigation has been performed varying the indentation of the
tip in the cell membrane and consequently the force applied on it. In contrast
with conventional dynamic atomic force microscopy techniques, here the small
oscillation amplitude of the tip is not necessarily imposed at the cantilever
first eigenmode. This allows the user to arbitrarily choose the excitation
frequency in developing spectroscopic AFM techniques. The mechanical response
of the PC12 cell membrane is found to be frequency dependent in the 1 kHz - 10
kHz range. The damping coefficient is reproducibly observed to decrease when
the excitation frequency is increased.
","[{""version"":""v1"",""created"":""Wed, 23 Oct 2013 12:21:11 GMT""}]","2014-07-08"
"1310.6202","Felix Schwenninger","Felix Schwenninger, Hans Zwart","Less than one implies zero","Corrected the previous version (in particular, a mistake in Lemma
  2.1), streamlined and added recent references (see Introduction). 6 pages","Studia Mathematica 229(2): 181-188, 2015","10.4064/sm8218-12-2015",,"math.FA","http://arxiv.org/licenses/nonexclusive-distrib/1.0/","  In this paper we show that from the estimate $\sup_{t \geq 0}\|C(t) -
\cos(at)I\| <1$ we can conclude that $C(t)$ equals $\cos(at) I$. Here
$\left(C(t)\right)_{t \geq 0}$ is a strongly continuous cosine family on a
Banach space.
","[{""version"":""v1"",""created"":""Wed, 23 Oct 2013 12:24:25 GMT""},{""version"":""v2"",""created"":""Fri, 13 Feb 2015 12:50:46 GMT""}]","2016-09-29"
"1310.6203","Jacob D. Bekenstein","Jacob D. Bekenstein","If vacuum energy can be negative, why is mass always positive?: Uses of
  the subdominant trace energy condition","LaTeX, 19 pages, added references and some clarifying remarks.
  Conclusions unchanged","Physical Review D 88, 125005 (2013)","10.1103/PhysRevD.88.125005",,"quant-ph gr-qc hep-th","http://arxiv.org/licenses/nonexclusive-distrib/1.0/","  Diverse calculations have shown that a relativistic field confined to a
cavity by well defined boundary conditions can have a negative Casimir or
vacuum energy. Why then can one not make a finite system with negative mass by
confining the field in a some way? We recall, and justify in detail, the not so
familiar subdominant trace energy condition for ordinary (baryon-electron
nonrelativistic) matter. With its help we show, in two ways, that the
mass-energy of the cavity structure necessary to enforce the boundary
conditions must exceed the magnitude of the negative vacuum energy, so that all
systems of the type envisaged necessarily have positive mass-energy.
","[{""version"":""v1"",""created"":""Wed, 23 Oct 2013 12:27:33 GMT""},{""version"":""v2"",""created"":""Wed, 20 Nov 2013 10:57:43 GMT""}]","2015-06-17"
"1310.6204","Himanshu Pandey","Himanshu Pandey, P. K. Rout, Anupam, P. C. Joshi, Z. Hossain, and R.
  C. Budhani","Magnetoelastic coupling induced magnetic anisotropy in Co$_2$(Fe/Mn)Si
  thin films","5 pages, 4 figures","Appl. Phys. Lett. 104, 022402 (2014)","10.1063/1.4861777",,"cond-mat.mtrl-sci","http://arxiv.org/licenses/nonexclusive-distrib/1.0/","  The influence of epitaxial strain on uniaxial magnetic anisotropy of
Co$_{2}$FeSi (CFS) and Co$_{2}$MnSi (CMS) Heusler alloy thin films grown on
(001) SrTiO$_3$ (STO) and MgO is reported. The in-plane biaxial strain is
susceptible to tune by varying the thickness of the films on STO, while on MgO
the films show in-plane easy axis for magnetization (\overrightarrow{M})
irrespective of their thickness. A variational analysis of magnetic free energy
functional within the Stoner-Wohlfarth coherent rotation model with
out-of-plane uniaxial anisotropy for the films on STO showed the presence of
magnetoelastic anisotropy with magnetostriction constant $\approx$
(12.22$\pm$0.07)$\times 10^{-6}$ and (2.02$\pm$0.06)$\times 10^{-6}$, in
addition to intrinsic magnetocrystalline anisotropy $\approx$ -1.72$\times
10^{6}$ erg/cm$^{3}$ and -3.94$\times 10^{6}$ erg/cm$^{3}$ for CFS and CMS,
respectively. The single-domain phase diagram reveals a gradual transition from
in-plane to out-of-plane orientation of magnetization with the decreasing film
thickness. A maximum canting angle of 41.5$^{\circ}$ with respect to film plane
is predicted for the magnetization of the thinnest (12 nm) CFS film on STO. The
distinct behaviour of \overrightarrow{M} in the films with lower thickness on
STO is attributed to strain-induced tetragonal distortion.
","[{""version"":""v1"",""created"":""Wed, 23 Oct 2013 12:31:46 GMT""}]","2014-01-14"
"1310.6205","Nicolas Trotignon","St\'ephan Thomass\'e, Nicolas Trotignon, Kristina Vuskovi\'c","Parameterized algorithm for weighted independent set problem in
  bull-free graphs",,"Parameterized algorithm for weighted independent set problem in
  bull-free graphs. Algorithmica, November 2015, 1--23","10.1007/s00453-015-0083-x",,"cs.DM","http://arxiv.org/licenses/nonexclusive-distrib/1.0/","  The maximum stable set problem is NP-hard, even when restricted to
triangle-free graphs. In particular, one cannot expect a polynomial time
algorithm deciding if a bull-free graph has a stable set of size $k$, when $k$
is part of the instance. Our main result in this paper is to show the existence
of an FPT algorithm when we parameterize the problem by the solution size $k$.
A polynomial kernel is unlikely to exist for this problem. We show however that
our problem has a polynomial size Turing-kernel. More precisely, the hard cases
are instances of size $O(k^5)$. As a byproduct, if we forbid odd holes in
addition to the bull, we show the existence of a polynomial time algorithm for
the stable set problem. We also prove that the chromatic number of a bull-free
graph is bounded by a function of its clique number and the maximum chromatic
number of its triangle-free induced subgraphs. All our results rely on a
decomposition theorem of bull-free graphs due to Chudnovsky which is modified
here, allowing us to provide extreme decompositions, adapted to our
computational purpose.
","[{""version"":""v1"",""created"":""Wed, 23 Oct 2013 12:36:51 GMT""},{""version"":""v2"",""created"":""Fri, 21 Nov 2014 12:43:57 GMT""}]","2015-11-20"
"1310.6206","Lorenzo Maccone","Lorenzo Maccone, Cosimo C. Rusconi","State estimation: direct state measurement vs. tomography","4 pages, 4 figures","L. Maccone, C.C. Rusconi, ""State estimation: A comparison between
  direct state measurement and tomography"", Phys. Rev. A 89, 022122 (2014)","10.1103/PhysRevA.89.022122",,"quant-ph","http://arxiv.org/licenses/nonexclusive-distrib/1.0/","  We compare direct state measurement (DST or weak state tomography) to
conventional state reconstruction (tomography) through accurate Monte-Carlo
simulations. We show that DST is surprisingly robust to its inherent bias. We
propose a method to estimate such bias (which introduces an unavoidable error
in the reconstruction) from the experimental data. As expected we find that DST
is much less precise than tomography. We consider both finite and
infinite-dimensional states of the DST pointer, showing that they provide
comparable reconstructions.
","[{""version"":""v1"",""created"":""Wed, 23 Oct 2013 12:37:01 GMT""}]","2014-07-02"
"1310.6207","Chris Stock","R. A. Cowley, W. J. L. Buyers, C. Stock, Z. Yamani, C. Frost, J. W.
  Taylor, and D. Prabhakaran","Neutron scattering measurements of $dd$ and spin-orbit excitations below
  the Mott-Hubbard gap in CoO","(14 pages, 9 figures, to be published in Phys. Rev. B)","Phys. Rev. B 88, 205117 (2013)","10.1103/PhysRevB.88.205117",,"cond-mat.str-el","http://arxiv.org/licenses/nonexclusive-distrib/1.0/","  Neutron scattering is used to investigate the single-ion spin and orbital
excitations below the Mott-Hubbard gap in CoO. Three excitations are reported
at 0.870 $\pm$ 0.009 eV, 1.84 $\pm$ 0.03, and 2.30 $\pm$ 0.15 eV. These were
parameterized within a weak crystal field scheme with an intra-orbital exchange
of $J(dd)$=1.3 $\pm$ 0.2 eV and a crystal field splitting 10Dq=0.94 $\pm$ 0.10
eV. A reduced spin-orbit coupling of \lambda=-0.016 $\pm$ 0.003 eV is derived
from dilute samples of Mg$_{0.97}$Co$_{0.03}$O, measured to remove
complications due to spin exchange and structural distortion parameters which
split the cubic phase degeneracy of the orbital excitations complicating the
inelastic spectrum. The 1.84 eV, while reported using resonant x-ray and
optical techniques, was absent or weak for non resonant x-ray experiments and
overlaps with the expected position of a $^{4}A_{2}$ level. This transition is
absent in the dipolar approximation but expected to have a finite quadrupolar
matrix element that can be observed with neutron scattering techniques at
larger momentum transfers. Our results agree with a crystal field analysis (in
terms of Racah parameters and Tanabe-Sugano diagrams) and with previous
calculations performed using local-density band theory for Mott insulating
transition metal oxides. The results also demonstrate the use of neutron
scattering for measuring dipole forbidden transitions in transition metal oxide
systems.
","[{""version"":""v1"",""created"":""Wed, 23 Oct 2013 12:41:22 GMT""}]","2015-06-17"
"1310.6208","Yury Kochetkov","Yury Kochetkov","Enumeration of one class of plane weighted trees","10 pages, 5 figures",,,,"math.CO","http://arxiv.org/licenses/nonexclusive-distrib/1.0/","  By weighted tree we understand such connected tree,that: a) each its vertex
and each edge have a positive integer weight; b) the weight of each vertex is
equal to the sum of weights of outgoing edges. Each tree has a binary structure
--- we can color its vertices in two colors, black and white so, that adjacent
vertices have different colors. A type is a set of pairwise non-isotopic plane
weighted trees with a given list of weights of white vertices and a given list
of weights of black vertices. In this work we present a method for computing
the cardinality of a given type.
","[{""version"":""v1"",""created"":""Wed, 23 Oct 2013 12:51:25 GMT""}]","2013-10-24"
"1310.6209","Oliver Gressel","Oliver Gressel, Detlef Elstner and Udo Ziegler","Toward a hybrid dynamo model for the Milky Way","12 pages, 12 figures, 2 tables, accepted for publication in A&A",,"10.1051/0004-6361/201322349",,"astro-ph.GA","http://arxiv.org/licenses/nonexclusive-distrib/1.0/","  (Abridged) Based on the rapidly increasing all-sky data of Faraday rotation
measures and polarised synchrotron radiation, the Milky Way's magnetic field is
now modelled with an unprecedented level of detail and complexity. We aim to
complement this heuristic approach with a physically motivated, quantitative
Galactic dynamo model -- a model that moreover allows for the evolution of the
system as a whole, instead of just solving the induction equation for a fixed
static disc. Building on the framework of mean-field magnetohydrodynamics and
extending it to the realm of a hybrid evolution, we perform three-dimensional
global simulations of the Galactic disc. Closure coefficients embodying the
mean-field dynamo are calibrated against resolved box simulations of
supernova-driven interstellar turbulence. The emerging dynamo solutions
comprise a mixture of the dominant axisymmetric S0 mode, with even parity, and
a subdominant A0 mode, with odd parity. Notably, such a superposition of modes
creates a strong localised vertical field on one side of the Galactic disc. We
moreover find significant radial pitch angles, which decay with radius --
explained by flaring of the disc. In accordance with previous work, magnetic
instabilities appear to be restricted to the less-stirred outer Galactic disc.
Their main effect is to create strong fields at large radii such that the
radial scale length of the magnetic field increases from 4 kpc (for the case of
a mean-field dynamo alone) to about 10 kpc in the hybrid models. There remain
aspects (e.g., spiral arms, X-shaped halo fields, fluctuating fields) that are
not captured by the current model and that will require further development
towards a fully dynamical evolution. Nevertheless, the work presented
demonstrates that a hybrid modelling of the Galactic dynamo is feasible and can
serve as a foundation for future efforts.
","[{""version"":""v1"",""created"":""Wed, 23 Oct 2013 12:55:35 GMT""}]","2015-06-17"
"1310.6210","Daniel K\""orner","Bjoern H. Wellegehausen, Daniel Koerner and Andreas Wipf","Finetuning the continuum limit in low-dimensional supersymmetric
  theories","7 pages, 12 figures, presented at the 31st International Symposium on
  Lattice Field Theory (Lattice 2013), 29 July - 3 August 2013, Mainz, Germany",,,,"hep-lat hep-ph hep-th","http://arxiv.org/licenses/nonexclusive-distrib/1.0/","  Supersymmetry is a prominent candidate for physics beyond the standard model.
In order to compute the spectrum of supersymmetric theories, we employ
nonperturbative lattice QFT techniques which due to the discretisation of
spacetime violate supersymmetry at finite lattice spacings. Care has to be
taken then to restore supersymmetry in the continuum limit. We discuss a
discretisation of the supersymmetric Nonlinear O(N) Sigma model in two
dimensions and argue that supersymmetry may be restored by finetuning of a
single parameter. Furthermore, we show preliminary results for the vacuum
physics of N = 2 Super-Yang-Mills theory in three dimensions.
","[{""version"":""v1"",""created"":""Wed, 23 Oct 2013 12:58:51 GMT""}]","2013-10-24"
"1310.6211","Min Kyu Kim","Min Kyu Kim, Hyeonmi Lee","Crystal $\Bla$ in $B(\infty)$ for $G_2$ type Lie Algebra","13 pages, submitted",,,,"math.RT math.QA","http://arxiv.org/licenses/nonexclusive-distrib/1.0/","  A previous work gave a combinatorial description of the crystal $B(\infty)$,
in terms of certain simple Young tableaux referred to as the marginally large
tableaux, for finite dimensional simple Lie algebras. Using this result, we
present an explicit description of the crystal $B(\lambda)$, in terms of the
marginally large tableaux, for the $G_2$ Lie algebra type. We also provide a
new description of $B(\la)$, in terms of Nakajima monomials, that is in natural
correspondence with our tableau description.
","[{""version"":""v1"",""created"":""Wed, 23 Oct 2013 13:01:29 GMT""}]","2013-10-24"
"1310.6212","Swagata Sarkar Dr.","Samik Basu, Goutam Mukherjee, Swagata Sarkar","Some Computations in Equivariant cobordism in relation to Milnor
  manifolds",,,,,"math.AT","http://arxiv.org/licenses/nonexclusive-distrib/1.0/","  Let $\mathcal{N}_*$ be the unoriented cobordism algebra, let $G=(\Z_2)^n$ and
let $Z_*(G)$ denote the equivariant cobordism algebra of $G$-manifolds with
finite stationary point sets. Let $\epsilon_* :Z_*(G) \to \mathcal{N}_*$ be the
homomorphism which forgets the $G$-action. We use Milnor manifolds (degree 1
hypersurfaces in $\R P^m\times \R P^n$) to construct non-trivial elements in
$Z_*(G)$. We prove that these elements give rise to indecomposable elements in
$Z_*(G)$ in degrees up to $2^n - 5$. Moreover, in most cases these elements can
be arranged to be in $\mathit{Ker}(\epsilon_*)$.
","[{""version"":""v1"",""created"":""Wed, 23 Oct 2013 13:06:27 GMT""}]","2013-10-24"
"1310.6213","Ulrich Aschauer","Ulrich Aschauer and Nicola A. Spaldin","Competition and cooperation between antiferrodistortive and
  ferroelectric instabilities in SrTiO$_3$","7 pages, 9 figures",,"10.1088/0953-8984/26/12/122203",,"cond-mat.mtrl-sci","http://arxiv.org/licenses/nonexclusive-distrib/1.0/","  We use density functional theory to explore the interplay between octahedral
rotations and ferroelectricity in the model compound SrTiO$_3$. We find that
over the experimentally relevant range octahedral rotations suppress
ferroelectricity as is generally assumed in the literature. Somewhat
surprisingly we observe that at larger angles the previously weakened
ferroelectric instability strengthens significantly. By analysing geometry
changes, energetics, force constants and charges, we explain the mechanisms
behind this transition from competition to cooperation with increasing
octahedral rotation angle.
","[{""version"":""v1"",""created"":""Wed, 23 Oct 2013 13:06:28 GMT""}]","2016-05-10"
"1310.6214","Christoph Weber","Timo Hanke, Christoph A. Weber and Erwin Frey","Understanding Collective Dynamics of Soft Active Colloids by Binary
  Scattering","19 pages, 12 figures","Phys. Rev. E 88, 052309 (2013)","10.1103/PhysRevE.88.052309",,"cond-mat.soft","http://arxiv.org/licenses/nonexclusive-distrib/1.0/","  Collective motion in actively propelled particle systems is triggered on the
very local scale by nucleation of coherently moving units consisting of just a
handful of particles. These units grow and merge over time, ending up in a
long-range ordered, coherently-moving state. So far, there exists no bottom-up
understanding of how the microscopic dynamics and interactions between the
constituents are related to the system's ordering instability. In this paper,
we study a class of models for propelled colloids allowing an explicit
treatment of the microscopic details of the collision process. Specifically,
the model equations are Newtonian equations of motion with separate force terms
for particles' driving, dissipation and interaction forces. Focusing on dilute
particle systems, we analyze the binary scattering behavior for these models,
and determine-based on the microscopic dynamics-the corresponding
collision-rule, i.e., the mapping of pre-collisional velocities and impact
parameter on post-collisional velocities. By studying binary scattering we also
find that the considered models for active colloids share the same principle
for parallel alignment: the first incoming particle (with respect to the center
of collision) is aligned to the second particle as a result of the encounter.
This behavior is distinctively different to alignment in non-driven dissipative
gases. Moreover, the obtained collision rule lends itself as a starting point
to apply kinetic theory for propelled particle systems in order to determine
the phase boundary to a long-range ordered, coherently-moving state. The
microscopic origin of the collision rule offers the opportunity to
quantitatively scrutinize the predictions of kinetic theory for propelled
particle systems through direct comparison with multi-particle simulations.
","[{""version"":""v1"",""created"":""Wed, 23 Oct 2013 13:15:09 GMT""}]","2013-11-26"
