"1310.6120","Robert Suris","R. A. Suris","Correlation between Trion and Hole in Fermi Distribution in Process of
  Trion Photo-excitation in Doped QWs","17 pages, 7 figures","Optical Properties of 2D Systems with Interacting Electrons, Ed.
  by W. Ossau and R. Suris, NATO Scientific Series, Kluwer Academic Publishers,
  2003, pp. 111-124, NATO Science Series, II. Mathematics, Physics and
  Chemistry - Vol 119",,,"cond-mat.mes-hall","http://arxiv.org/licenses/nonexclusive-distrib/1.0/","  The problem of correlation between a trion and a hole in the electron Fermi
distribution created in the process of trion photo-excitation in doped quantum
wells is under consideration. The hole in the Fermi distribution appears in the
trion creation process consisting of picking of the Fermi Sea electron up by
the exciton created in virtual state due to photon absorption. It is
demonstrated that the interaction results in formation of a correlated state of
the trion and the hole in the Fermi Sea. The state has excitation energy which
is less then trion energy minus Fermi energy that can be obtained as a lower
edge of trion excitation band using the simple energy conservation low in the
picture of independent trion and electrons. The wave function of the correlated
state is real and decreases with increase of distance between the trion and the
Fermi Sea hole, r, as 1/r^3/2. The wave function can be normalized to unity and
it corresponds to correlated state of the trion and Fermi Sea hole. In contrast
to this state, the states with excitation energies in the absorption band
between the trion energy and the trion energy minus Fermi energy have complex
wave functions that decrease as 1/r^1/2. These states correspond to the trion
and the Fermi Sea hole that is running away from the trion. The correlated
state described above is supposed to be responsible for the narrow trion
absorption line that was observed experimentally.
","[{""version"":""v1"",""created"":""Wed, 23 Oct 2013 06:13:08 GMT""}]","2013-10-24"
"1310.6121","Xavier Warin","Xavier Warin","Some non monotone schemes for time dependent Hamilton-Jacobi-Bellman
  equations in stochastic control","23 pages, 3 figures",,,,"math.OC","http://arxiv.org/licenses/nonexclusive-distrib/1.0/","  We introduce some approximation schemes for linear and fully non-linear
diffusion equations of Bellman-Isaacs type. Although they are not monotone one
can prove their convergence to the viscosity solution of the problem. Effective
implementation of these scheme is discussed and they are extensively tested.
","[{""version"":""v1"",""created"":""Wed, 23 Oct 2013 06:15:59 GMT""},{""version"":""v2"",""created"":""Thu, 13 Feb 2014 12:04:14 GMT""},{""version"":""v3"",""created"":""Wed, 21 Jan 2015 13:26:55 GMT""}]","2015-01-22"
"1310.6122","Renata Jora","Renata Jora and Salah Nasri","About the role of scalars in a gauge theory","manuscript edited",,,,"hep-ph hep-th","http://arxiv.org/licenses/nonexclusive-distrib/1.0/","  We consider a new effective symmetry that acts on a gauge invariant
Lagrangian. We show that the standard model after spontaneous symmetry
breakdown is invariant under this symmetry which identifies up to a scale
factor the gauge parameter with the elementary or composite scalars in the
theory. We discuss some of the consequences of this symmetry in the abelian and
non-abelian sectors of the standard model.
","[{""version"":""v1"",""created"":""Wed, 23 Oct 2013 06:35:43 GMT""},{""version"":""v2"",""created"":""Sat, 7 Dec 2013 13:28:47 GMT""}]","2013-12-10"
"1310.6123","Maria Kirsanova S.","Maria S. Kirsanova, Dmitry S. Wiebe, Andrej M. Sobolev, Christian
  Henkel, Alexander P. Tsivilev","Physical conditions in star forming regions around S235","17 pages, 9 figures, accepted to MNRAS",,"10.1093/mnras/stt1991",,"astro-ph.GA","http://arxiv.org/licenses/nonexclusive-distrib/1.0/","  Gas density and temperature in star forming regions around Sh2-235 are
derived from ammonia line observations. This information is used to evaluate
formation scenarios and to determine evolutionary stages of the young embedded
clusters S235 East1, S235 East2, and S235 Central. We also estimate the gas
mass in the embedded clusters and its ratio to the stellar mass. S235 East1
appears to be less evolved than S235 East2 and S235 Central. In S235 East1 the
molecular gas mass exceeds that in the other clusters. Also, this cluster is
more embedded in the parent gas cloud than the other two. Comparison with a
theoretical model shows that the formation of these three clusters could have
been stimulated by the expansion of the Sh2-235 HII region (hereafter S235) via
a collect-and-collapse process, provided the density in the surrounding gas
exceeds $3\cdot10^3$ cm$^{-3}$, or via collapse of pre-existing clumps. The
expansion of S235 cannot be responsible for star formation in the southern S235
A-B region. However, formation of the massive stars in this region might have
been triggered by a large-scale supernova shock. Thus, triggered star formation
in the studied region may come in three varieties, namely collect-and-collapse
and collapse of pre-existing clumps, both initiated by expansion of the local
HII regions, and triggering by an external large-scale shock. We argue that the
C235 A HII region expands into a highly non-uniform medium with increasing
density. It is too young to trigger star formation in its vicinity by a
collect-and-collapse process. There is an age spread inside the S235 A-B
region. Massive stars in the S235 A-B region are considerably younger than
lower mass stars in the same area. This follows from the estimates of their
ages and the ages of associated HII regions.
","[{""version"":""v1"",""created"":""Wed, 23 Oct 2013 06:38:27 GMT""}]","2015-06-17"
"1310.6124","Mikko Laine","Y. Burnier, M. Laine","Temporal mesonic correlators at NLO for any quark mass","7 pages. To appear in the Proceedings of the 31st International
  Symposium on Lattice Field Theory, July 29 - August 3, 2013, Mainz, Germany",,,,"hep-lat hep-ph","http://arxiv.org/licenses/nonexclusive-distrib/1.0/","  We present NLO results for thermal imaginary-time correlators in the vector
and scalar channels as a function of the quark mass. The range of quark masses
for which a non-relativistic approximation works in the temperature range
considered is estimated, and charm quarks turn out to be a borderline case.
Comparing with simulation data from fine lattices, we find good agreement in
the vector channel but a substantial discrepancy in the scalar one. An
explanation for the discrepancy is suggested in terms of physics of the
quark-antiquark threshold region. Perturbative predictions for the bottom
scalar spectral function around the threshold are also briefly reviewed.
","[{""version"":""v1"",""created"":""Wed, 23 Oct 2013 06:48:41 GMT""}]","2013-10-24"
"1310.6125","Shesh  Nath","S Nath, D P Foster, D Giri, and S Kumar","Single polymer gating of channels under a solvent gradient","5 Pages, 7 Figures, Accepted in Phys. Rev. E (2013)",,"10.1103/PhysRevE.88.054601",,"cond-mat.soft","http://arxiv.org/licenses/nonexclusive-distrib/1.0/","  We study the effect of a gradient of solvent quality on the coil-globule
transition for a polymer in a narrow pore. A simple self-attracting
self-avoiding walk model of a polymer in solution shows that the variation in
the strength of interaction across the pore leads the system to go from one
regime (good solvent) to the other (poor solvent) across the channel. This may
be thought analogous to thermophoresis, where the polymer goes from the hot
region to the cold region under the temperature gradient. The behavior of short
chains is studied using exact enumeration whilst the behavior of long chains is
studied using transfer matrix techniques. The distribution of the monomer
density across the layer suggests that a gate-like effect can be created, with
potential applications as a sensor.
","[{""version"":""v1"",""created"":""Wed, 23 Oct 2013 06:49:27 GMT""},{""version"":""v2"",""created"":""Mon, 28 Oct 2013 13:07:33 GMT""}]","2015-06-17"
"1310.6126","Sara Saeedi Madani","Dariush Kiani, Sara Saeedi Madani","The regularity of binomial edge ideals of graphs","11 pages, 1 figure",,,,"math.AC math.CO","http://arxiv.org/licenses/nonexclusive-distrib/1.0/","  We prove two recent conjectures on some upper bounds for the
Castelnuovo-Mumford regularity of the binomial edge ideals of some different
classes of graphs. We prove the conjecture of Matsuda and Murai for graphs
which has a cut edge or a simplicial vertex, and hence for chordal graphs. We
determine the regularity of the binomial edge ideal of the join of graphs in
terms of the regularity of the original graphs, and consequently prove the
conjecture of Matsuda and Murai for such a graph, and hence for complete
$t$-partite graphs. We also generalize some results of Schenzel and Zafar about
complete $t$-partite graphs. We also prove the conjecture due to the authors
for a class of chordal graphs.
","[{""version"":""v1"",""created"":""Wed, 23 Oct 2013 06:52:27 GMT""},{""version"":""v2"",""created"":""Sun, 17 Nov 2013 12:10:59 GMT""}]","2013-11-19"
"1310.6127","Amrit De","Amrit De","A Couped-Qubit Tavis Cummings Scheme for Prolonging Quantum Coherence",,,,,"cond-mat.mes-hall cond-mat.supr-con physics.atm-clus physics.optics quant-ph","http://arxiv.org/licenses/nonexclusive-distrib/1.0/","  Qubit-qubit interactions can significantly boost quantum coherence times for
Bell states. The coherence-time-enhancements are however not monotonic and
there exists a phase where further increasing the interaction is unhelpful. A
resonator in a suggested circuit QED type implementation of the
Tavis-Cummings(Dicke) model, is shown to shift this transition point depending
on the number of loaded photons. This allows the resonator to amplify the
coherence enhancements in certain regimes. The interactions also induce unusual
collapse and revival type behavior for the entanglement dynamics. A new and
exact open quantum systems formalism -- the quasi-Hamiltonians for the Dicke
model thus reveals how a Bell state in a resonator can be protected against
$1/f$ noise from randomly fluctuating two level systems. Simple circuit level
details are given for flux qubits.
","[{""version"":""v1"",""created"":""Wed, 23 Oct 2013 06:59:40 GMT""},{""version"":""v2"",""created"":""Thu, 20 Nov 2014 09:21:54 GMT""}]","2014-11-21"
"1310.6128","Andrej Zlatos","Andrej Zlatos","Exponential growth of the vorticity gradient for the Euler equation on
  the torus",,,,,"math.AP","http://arxiv.org/licenses/nonexclusive-distrib/1.0/","  We prove that there are solutions to the Euler equation on the torus with
$C^{1,\alpha}$ vorticity and smooth except at one point such that the vorticity
gradient grows in $L^\infty$ at least exponentially as $t\to\infty$. The same
result is shown to hold for the vorticity Hessian and smooth solutions. Our
proofs use a version of a recent result by Kiselev and Sverak.
","[{""version"":""v1"",""created"":""Wed, 23 Oct 2013 07:01:07 GMT""},{""version"":""v2"",""created"":""Wed, 8 Oct 2014 02:13:27 GMT""}]","2014-10-09"
"1310.6129","Tao Pei","Tao Pei, Stanislav Sobolevsky, Carlo Ratti, Shih-Lung Shaw, Chenghu
  Zhou","A New Insight into Land Use Classification Based on Aggregated Mobile
  Phone Data","35 pages, 7 figures",,,,"cs.CY","http://creativecommons.org/licenses/by/3.0/","  Land use classification is essential for urban planning. Urban land use types
can be differentiated either by their physical characteristics (such as
reflectivity and texture) or social functions. Remote sensing techniques have
been recognized as a vital method for urban land use classification because of
their ability to capture the physical characteristics of land use. Although
significant progress has been achieved in remote sensing methods designed for
urban land use classification, most techniques focus on physical
characteristics, whereas knowledge of social functions is not adequately used.
Owing to the wide usage of mobile phones, the activities of residents, which
can be retrieved from the mobile phone data, can be determined in order to
indicate the social function of land use. This could bring about the
opportunity to derive land use information from mobile phone data. To verify
the application of this new data source to urban land use classification, we
first construct a time series of aggregated mobile phone data to characterize
land use types. This time series is composed of two aspects: the hourly
relative pattern, and the total call volume. A semi-supervised fuzzy c-means
clustering approach is then applied to infer the land use types. The method is
validated using mobile phone data collected in Singapore. Land use is
determined with a detection rate of 58.03%. An analysis of the land use
classification results shows that the accuracy decreases as the heterogeneity
of land use increases, and increases as the density of cell phone towers
increases.
","[{""version"":""v1"",""created"":""Wed, 23 Oct 2013 07:23:02 GMT""}]","2013-10-24"
"1310.6130","Sudipta Roy Barman","Sunil Wilfred D'Souza, Tufan Roy, Sudipta Roy Barman and Aparna
  Chakrabarti","Magnetic properties and electronic structure of Mn-Ni-Ga magnetic shape
  memory alloys","10 pages, 5 figures",,"10.1088/0953-8984/26/50/506001",,"cond-mat.mtrl-sci","http://arxiv.org/licenses/nonexclusive-distrib/1.0/","  Influence of disorder, antisite defects, martensite transition and
compositional variation on the magnetic properties and electronic structure of
Mn$_2$NiGa and Mn$_{1+x}$Ni$_{2-x}$Ga magnetic shape memory alloys have been
studied by using full potential spin-polarized scalar relativistic
Korringa-Kohn-Rostocker (FP-SPRKKR) method. Mn$_2$NiGa is ferrimagnetic and its
total spin moment increases when disorder in the occupancy of Mn$_{\rm Ni}$ (Mn
atom in Ni position) is considered. The moment further increases when Mn-Ga
antisite defect[1] is included in the calculation. A reasonable estimate of
$T_C$ for Mn$_2$NiGa is obtained from the exchange parameters for the
disordered structure. Disorder influences the electronic structure of
Mn$_2$NiGa through overall broadening of the density of states and a decrease
in the exchange splitting. Inclusion of antisite defects marginally broaden the
minority spin partial DOS (PDOS), while the majority spin PDOS is hardly
affected. For Mn$_{1+x}$Ni$_{2-x}$Ga where 1$\geq$$x$$\geq$0, as $x$ decreases,
Mn$_{\rm Mn}$ moment increases while Mn$_{\rm Ni}$ moment decreases in both
austenite and martensite phases. For $x$$\geq$ 0.25, the total moment of the
martensite phase is smaller compared to the austenite phase, which indicates
possible occurrence of inverse magnetocaloric effect. We find that the
redistribution of Ni 3$d$- Mn$_{\rm Ni}$ 3$d$ minority spin electron states
close to the Fermi level is primarily responsible for the stability of the
martensite phase in Mn-Ni-Ga.
","[{""version"":""v1"",""created"":""Wed, 23 Oct 2013 07:24:47 GMT""},{""version"":""v2"",""created"":""Mon, 30 Jun 2014 06:18:12 GMT""}]","2015-06-17"
"1310.6131","Rapha\""el Ponge","Raphael Ponge, Hang Wang","Index map, $\sigma$-connections, and Connes-Chern character in the
  setting of twisted spectral triples","35 pages; v3: minor changes to the exposition on $\sigma$-connections","Kyoto J. Math. 56, no. 2 (2016), 347-399","10.1215/21562261-3478907",,"math.OA math.DG math.KT","http://arxiv.org/licenses/nonexclusive-distrib/1.0/","  Twisted spectral triples are a twisting of the notion of spectral triple
aiming at dealing with some type III geometric situations. In the first part of
the paper, we give a geometric construction of the index map of a twisted
spectral triple in terms of $\sigma$-connections on finitely generated
projective modules. This makes it more transparent the analogy with the indices
of Dirac operators with coefficients in vector bundles. In the second part, we
give a direct construction of the Connes-Chern character of a twisted spectral,
both in the invertible and non-invertible cases. Combining these two parts we
obtain an analogue the Atiyah-Singer index formula for twisted spectral
triples.
","[{""version"":""v1"",""created"":""Wed, 23 Oct 2013 07:25:39 GMT""},{""version"":""v2"",""created"":""Thu, 13 Nov 2014 20:49:53 GMT""},{""version"":""v3"",""created"":""Wed, 10 Dec 2014 10:33:14 GMT""}]","2016-06-08"
"1310.6132","Ronen Dar","Ronen Dar, Meir Feder, Antonio Mecozzi, and Mark Shtaif","Time varying ISI model for nonlinear interference noise","Submitted to the optical fiber communication conference (OFC), 2014",,,,"physics.optics cs.IT math.IT","http://arxiv.org/licenses/nonexclusive-distrib/1.0/","  We show that the effect of nonlinear interference in WDM systems is
equivalent to slowly varying inter-symbol-interference (ISI), and hence its
cancellation can be carried out by means of adaptive linear filtering. We
characterize the ISI coefficients and discuss the potential gain following from
their cancellation.
","[{""version"":""v1"",""created"":""Wed, 23 Oct 2013 07:26:50 GMT""}]","2013-10-24"
"1310.6133","Marius Potgiieter","Marius S. Potgieter","Very local interstellar spectra for galactic electrons, protons and
  helium","Presented as a highlight talk by the author at the 33rd ICRC in Rio
  de Janeiro, Brazil. Submitted for publication in the proceedings of this
  conference, to be published in the Brazilian Journal of Physics","Braz J Phys 44, 581, 2014","10.1007/s13538-014-0238-2","icrc2013-1300","astro-ph.SR astro-ph.HE","http://arxiv.org/licenses/nonexclusive-distrib/1.0/","  The local interstellar spectra (LIS) for cosmic rays at energies below about
30 GeV/nuc are increasingly obscured from view at Earth by solar modulation,
the lower the energy. These charged particles encounter significant changes in
the heliosphere, over an 11-year cycle, which include processes such as
convection, diffusion, adiabatic energy losses and gradient, curvature and
current sheet drifts. Particle drifts cause chargesign dependent modulation and
a 22-year cycle, adding complexity to determining the respective very LIS from
observations only at Earth. However, with measurements now made by the Voyager
1 spacecraft in the vicinity of the heliopause, it is possible to determine a
very LIS for galactic electrons between about 5 MeV and about 120 MeV. At these
low energies also galactic protons observed in the outer heliosphere had been
completely obscured by the so-call anomalous component which is accelerated
inside the heliosheath. Since August 2012, these anomalous cosmic rays are
substantially depleted at Voyager 1 so that also for cosmic ray ions it is now
possible to obtain a lower limit to their very LIS. Combining numerical
modelling of solar modulation with the accurate measurements by the PAMELA
mission and with Voyager observations, the lower limit of the very LIS for
electrons, protons and helium, and other ions, can be determined from about 5
MeV and above. These spectra are called heliopause spectra, considered to be
the lowest possible very LIS. Also from an astrophysics point of view, the
determination of what can be called a very LIS, not just an averaged galactic
spectrum, is encouraging. The mentioned aspects are discussed, focussing on a
comparison of recent heliospheric observations and corresponding solar
modulation modelling.
","[{""version"":""v1"",""created"":""Wed, 23 Oct 2013 07:26:56 GMT""}]","2015-06-25"
"1310.6134","Andres Castellanos-Gomez","Andres Castellanos-Gomez","A simple method to characterize the electrical and mechanical properties
  of micro-fibers","4 figures + 1 appendix","European Journal of Physics 34 (6) 1547-1554 (2013)","10.1088/0143-0807/34/6/1547",,"physics.ed-ph cond-mat.mtrl-sci physics.ins-det","http://arxiv.org/licenses/nonexclusive-distrib/1.0/","  A procedure to characterize the electrical and mechanical properties of
micro-fibers is presented here. As the required equipment can be found in many
teaching laboratories, it can be carried out by physics and
mechanical/electrical engineering students. The electrical resistivity, mass
density and Young's modulus of carbon micro-fibers have been determined using
this procedure, obtaining values in very good agreement with the reference
values. The Young's modulus has been obtained by measuring the resonance
frequency of carbon fiber based cantilevers. In this way, one can avoid common
approaches based on tensile or bending tests which are difficult to implement
for microscale materials. Despite the simplicity of the experiments proposed
here, they can be used to trigger in the students interest on the electrical
and mechanical properties of microscale materials.
","[{""version"":""v1"",""created"":""Wed, 23 Oct 2013 07:27:29 GMT""}]","2013-10-24"
"1310.6135","Kazumi Suematsu","Kazumi Suematsu","Molecular Weight Dependence of Excluded Volume Effects","3 pages, 2 figures, 1 table",,,,"cond-mat.soft","http://arxiv.org/licenses/nonexclusive-distrib/1.0/","  Molecular weight dependence of excluded volume effects is examined. The
swollen-to-unperturbed coil transition point shifts to lower concentration
range with increasing molecular weight (Mw). It is shown that in the limit of
the infinite molecular weight, the excluded volume effects should vanish in all
concentration range, except for the only one point, Co = 0. Quite in contrast,
for short chains, the excluded volume effects never disappear even at the melt
state.
","[{""version"":""v1"",""created"":""Wed, 23 Oct 2013 07:27:36 GMT""},{""version"":""v2"",""created"":""Sun, 26 Jan 2014 12:20:17 GMT""}]","2014-01-28"
"1310.6136","Takayoshi Sano","Takayoshi Sano, Tsuyoshi Inoue, Katsunobu Nishihara","Critical Magnetic Field Strength for Suppression of the
  Richtmyer-Meshkov Instability in Plasmas","5 pages, 3 figures, accepted for publication in PRL",,"10.1103/PhysRevLett.111.205001",,"physics.plasm-ph astro-ph.HE","http://arxiv.org/licenses/nonexclusive-distrib/1.0/","  The critical strength of a magnetic field required for the suppression of the
Richtmyer-Meshkov instability (RMI) is investigated numerically by using a
two-dimensional single-mode analysis. For the cases of MHD parallel shocks, the
RMI can be stabilized as a result of the extraction of vorticity from the
interface. A useful formula describing a critical condition for MHD RMI has
been introduced, and which is successfully confirmed by the direct numerical
simulations. The critical field strength is found to be largely depending on
the Mach number of the incident shock. If the shock is strong enough, even
low-$\beta$ plasmas can be subject to the growth of the RMI.
","[{""version"":""v1"",""created"":""Wed, 23 Oct 2013 07:30:21 GMT""},{""version"":""v2"",""created"":""Fri, 25 Oct 2013 15:22:53 GMT""}]","2015-06-17"
"1310.6137","Ronen Dar","Ronen Dar, Meir Feder, Antonio Mecozzi, and Mark Shtaif","Accumulation of nonlinear interference noise in fiber-optic systems",,,"10.1364/OE.22.014199",,"physics.optics","http://arxiv.org/licenses/nonexclusive-distrib/1.0/","  Through a series of extensive system simulations we show that all of the
previously not understood discrepancies between the Gaussian noise (GN) model
and simulations can be attributed to the omission of an important, recently
reported, fourth-order noise (FON) term, that accounts for the statistical
dependencies within the spectrum of the interfering channel. We examine the
importance of the FON term as well as the dependence of NLIN on modulation
format with respect to link-length and number of spans. A computationally
efficient method for evaluating the FON contribution, as well as the overall
NLIN power is provided.
","[{""version"":""v1"",""created"":""Wed, 23 Oct 2013 07:36:05 GMT""},{""version"":""v2"",""created"":""Wed, 4 Dec 2013 21:18:12 GMT""},{""version"":""v3"",""created"":""Thu, 16 Jan 2014 20:59:31 GMT""},{""version"":""v4"",""created"":""Mon, 17 Mar 2014 20:01:15 GMT""},{""version"":""v5"",""created"":""Wed, 7 May 2014 07:16:09 GMT""}]","2015-06-17"
"1310.6138","Rapha\""el Ponge","Rapha\""el Ponge, Hang Wang","Noncommutative Geometry and Conformal Geometry. III. Vafa-Witten
  Inequality and Poincar\'e Duality","Final version. 38 pages","Adv. Math. 272 (2015) 761-819","10.1016/j.aim.2014.12.009",,"math.DG math.OA","http://arxiv.org/licenses/nonexclusive-distrib/1.0/","  This paper is the the third part of a series of paper whose aim is to use of
the framework of \emph{twisted spectral triples} to study conformal geometry
from a noncommutive geometric viewpoint. In this paper we reformulate the
inequality of Vafa-Witten \cite{VW:CMP84} in the setting of twisted spectral
triples. This involves a notion of Poincar\'e duality for twisted spectral
triples. Our main results have various consequences. In particular, we obtain a
version in conformal geometry of the original inequality of Vafa-Witten, in the
sense of an explicit control of the Vafa-Witten bound under conformal changes
of metric. This result has several noncommutative manifestations for conformal
deformations of ordinary spectral triples, spectral triples associated to
conformal weights on noncommutative tori, and spectral triples associated to
duals of torsion-free discrete cocompact subgroups satisfying the Baum-Connes
conjecture.
","[{""version"":""v1"",""created"":""Wed, 23 Oct 2013 07:42:42 GMT""},{""version"":""v2"",""created"":""Sun, 11 Jan 2015 15:16:50 GMT""}]","2015-01-13"
