"1310.6047","Michael A. Fedderke","Michael A. Fedderke, Edward W. Kolb, Tongyan Lin, Lian-Tao Wang","Gamma-ray constraints on dark-matter annihilation to electroweak gauge
  and Higgs bosons","61 pages, 38 figures","JCAP01(2014)001","10.1088/1475-7516/2014/01/001",,"hep-ph astro-ph.CO","http://arxiv.org/licenses/nonexclusive-distrib/1.0/","  Dark-matter annihilation into electroweak gauge and Higgs bosons results in
$\gamma$-ray emission. We use observational upper limits on the fluxes of both
line and continuum $\gamma$-rays from the Milky Way Galactic Center and from
Milky Way dwarf companion galaxies to set exclusion limits on allowed
dark-matter masses. (Generally, Galactic Center $\gamma$-ray line search limits
from the Fermi-LAT and the H.E.S.S. experiments are most restrictive.) Our
limits apply under the following assumptions: a) the dark matter species is a
cold thermal relic with present mass density equal to the measured dark-matter
density of the universe; b) dark-matter annihilation to standard-model
particles is described in the non-relativistic limit by a single effective
operator ${\cal O} \propto J_{DM}\cdot J_{SM}$, where $J_{DM}$ is a
standard-model singlet current consisting of dark-matter fields (Dirac fermions
or complex scalars), and $J_{SM}$ is a standard-model singlet current
consisting of electroweak gauge and Higgs bosons; and c) the dark-matter mass
is in the range 5 GeV to 20 TeV. We consider, in turn, the 34 possible
operators with mass dimension 8 or lower with non-zero s-wave annihilation
channels satisfying the above assumptions. Our limits are presented in a large
number of figures, one for each of the 34 possible operators; these limits can
be grouped into 13 classes determined by the field content and structure of the
operators. We also identify three classes of operators (coupling to the Higgs
and $SU(2)_L$ gauge bosons) that can supply a 130 GeV line with the desired
strength to fit the putative line signal in Fermi data, while saturating the
relic density and satisfying all other indirect constraints we consider.
","[{""version"":""v1"",""created"":""Tue, 22 Oct 2013 20:00:31 GMT""}]","2014-01-06"
"1310.6048","Andres Jordan","Andr\'es Jord\'an, N\'estor Espinoza, Markus Rabus, Susana
  Eyheramendy, David K. Sing, Jean-Michel D\'esert, G\'asp\'ar \'A. Bakos,
  Jonathan J. Fortney, Mercedes L\'opez-Morales, Pierre F.L. Maxted, Amaury
  H.M.J. Triaud, Andrew Szentgyorgyi","A Ground-based Optical Transmission Spectrum of WASP-6b","15 pages, 10 figures, accepted for publication in the Astrophysical
  Journal",,"10.1088/0004-637X/778/2/184",,"astro-ph.EP","http://arxiv.org/licenses/nonexclusive-distrib/1.0/","  We present a ground based optical transmission spectrum of the inflated
sub-Jupiter mass planet WASP-6b. The spectrum was measured in twenty spectral
channels from 480 nm to 860nm using a series of 91 spectra over a complete
transit event. The observations were carried out using multi-object
differential spectrophotometry with the IMACS spectrograph on the Baade
telescope at Las Campanas Observatory. We model systematic effects on the
observed light curves using principal component analysis on the comparison
stars, and allow for the presence of short and long memory correlation
structure in our Monte Carlo Markov Chain analysis of the transit light curves
for WASP-6. The measured transmission spectrum presents a general trend of
decreasing apparent planetary size with wavelength and lacks evidence for broad
spectral features of Na and K predicted by clear atmosphere models. The
spectrum is consistent with that expected for scattering that is more efficient
in the blue, as could be caused by hazes or condensates in the atmosphere of
WASP-6b. WASP-6b therefore appears to be yet another massive exoplanet with
evidence for a mostly featureless transmission spectrum, underscoring the
importance that hazes and condensates can have in determining the transmission
spectra of exoplanets.
","[{""version"":""v1"",""created"":""Tue, 22 Oct 2013 20:03:14 GMT""}]","2015-06-17"
"1310.6049","Paul Fendley","Paul Fendley","Free parafermions","44 pages. v2: minor rewriting, added several references","J. Phys. A 47 (2014) 075001","10.1088/1751-8113/47/7/075001",,"cond-mat.stat-mech cond-mat.str-el hep-th math-ph math.MP","http://arxiv.org/licenses/nonexclusive-distrib/1.0/","  The spectrum of the quantum Ising chain can be found by expressing the spins
in terms of free fermions. An analogous transformation exists for clock chains
with $Z_n$ symmetry, but is of less use because the resulting parafermionic
operators remain interacting. Nonetheless, Baxter showed that a certain
non-hermitian (but PT-symmetric) clock Hamiltonian is ""free"", in the sense that
the entire spectrum is found in terms of independent energy levels, with the
striking feature that there are $n$ possibilities for occupying each level.
Here I show this directly explicitly finding shift operators obeying a $Z_n$
generalization of the Clifford algebra. I also find higher Hamiltonians that
commute with Baxter's and prove their spectrum comes from the same set of
energy levels. This thus provides an explicit notion of a ""free parafermion"". A
byproduct is an elegant method for the solution of the Ising/Kitaev chain with
spatially varying couplings.
","[{""version"":""v1"",""created"":""Tue, 22 Oct 2013 20:03:37 GMT""},{""version"":""v2"",""created"":""Mon, 18 Nov 2013 20:49:09 GMT""}]","2015-06-17"
"1310.6050","Peter Watson","Peter Watson, Hugo Reinhardt","Quark gap equation in an external magnetic field","19 pages, 7 figures","Phys. Rev. D 89, 045008 (2014)","10.1103/PhysRevD.89.045008",,"hep-ph hep-lat hep-th","http://arxiv.org/licenses/nonexclusive-distrib/1.0/","  The nonperturbative quark gap equation under the rainbow truncation and with
two versions of a phenomenological one-gluon exchange interaction is studied in
the presence of a uniform external magnetic field, with emphasis on the small
field limit. The chiral quark condensate, magnetic moment and susceptibility
are calculated and compared to recent lattice data.
","[{""version"":""v1"",""created"":""Tue, 22 Oct 2013 20:07:55 GMT""}]","2014-02-19"
"1310.6051","Lucila Kraiselburd","Lucila Kraiselburd, Susana J. Landau, Marcelo Salgado and Daniel
  Sudarsky","Equivalence Principle in Chameleon Models: first approach","Proceedings of the conference ""Varying fundamental constants and
  dynamical dark energy"", Sexten Center of Astrophysics,Sexten Primary School -
  Via Panorama 6, Sexten, Italy, July 2013","Memorie de lla Societa Astronomica Italiana, vol85,32, 2014",,,"gr-qc","http://arxiv.org/licenses/nonexclusive-distrib/1.0/","  Most theories that predict time and/or space variation of fundamental
constants also predict violations of the Weak Equivalence Principle (WEP).
Khoury and Weltmann proposed the chameleon model in 2004 and claimed that this
model avoids experimental bounds on WEP. We present a contrasting view based on
an approximate calculation of the two body problem for the chameleon field and
show that the force depends on the test body composition. Furthermore, we
compare the prediction of the force on a test body with E\""otv\""os type
experiments and find that the chameleon field effect cannot account for current
bounds.
","[{""version"":""v1"",""created"":""Tue, 22 Oct 2013 20:11:26 GMT""},{""version"":""v2"",""created"":""Tue, 3 Dec 2013 11:47:14 GMT""},{""version"":""v3"",""created"":""Fri, 10 Jun 2016 17:37:43 GMT""}]","2016-06-13"
"1310.6052","Willy Fischler","Tom Banks and Willy Fischler","Holographic Space-time and Newton's Law","10 pages, no figures, missing appendix added, acknowledgments updated",,,,"hep-th gr-qc","http://arxiv.org/licenses/nonexclusive-distrib/1.0/","  We derive Newton's Law from the formalism of Holographic Space-Time (HST).
More precisely, we show that for a large class of Hamiltonians of the type
proposed previously for the HST description of a geodesic in Minkowski space,
the eikonal for scattering of two massless particles at large impact parameter
scales as expected with the impact parameter and the energies of the particles
in the center of mass (CM) frame. We also discuss the criteria for black hole
production in this collision, and find an estimate, purely within the HST
framework, for the impact parameter at which it sets in, which coincides with
the estimate based on general relativity.
","[{""version"":""v1"",""created"":""Tue, 22 Oct 2013 20:20:45 GMT""},{""version"":""v2"",""created"":""Fri, 25 Oct 2013 16:16:41 GMT""}]","2013-10-28"
"1310.6053","Tyler Volkoff","T.J. Volkoff and K.B. Whaley","Measurement- and comparison-based sizes of Schr\""{o}dinger cat states of
  light",,"Phys. Rev. A 89, 012122 (2014)","10.1103/PhysRevA.89.012122",,"quant-ph physics.optics","http://arxiv.org/licenses/nonexclusive-distrib/1.0/","  We extend several measurement-based definitions of effective ""cat-size"" to
coherent state superpositions with branches composed of either single coherent
states or tensor products of coherent states. These effective cat-size measures
depend on determining the maximal quantum distinguishability of certain states
associated with the superposition state: e.g., in one measure, the maximal
distinguishability of the branches of the superposition is considered as in
quantum binary decision theory; in another measure, the maximal
distinguishability of the initial superposition and its image after a
one-parameter evolution generated by a local Hermitian operator is of interest.
The cat-size scaling with the number of modes and mode intensity (i.e., photon
number) is compared to the scaling derived directly from the Wigner function of
the superposition and to that estimated experimentally from decoherence. We
also apply earlier comparison-based methods for determining macroscopic
superposition size that require a reference GHZ state. The case of a
hierarchical Schr\""{o}dinger cat state with branches composed of smaller
superpositions is also analyzed from a measurement-based perspective.
","[{""version"":""v1"",""created"":""Tue, 22 Oct 2013 20:35:16 GMT""}]","2014-01-29"
"1310.6054","Jesus Perez Rios","J. P\'erez-R\'ios and A. S. Sanz","How does a magnetic trap work?","24 pages, 5 figures","Am. J. Phys. 81, 836 (2013)","10.1119/1.4819167",,"cond-mat.quant-gas physics.atom-ph physics.chem-ph quant-ph","http://arxiv.org/licenses/nonexclusive-distrib/1.0/","  Magnetic trapping is a cornerstone for modern ultracold physics and its
applications (e.g., quantum information processing, quantum metrology, quantum
optics, or high-resolution spectroscopies). Here a comprehensive analysis and
discussion of the basic physics behind the most commonly used magnetic traps in
Bose-Einstein condensation is presented. This analysis includes the quadrupole
trap, the time-averaged orbiting potential trap, and the Ioffe-Pritchard trap.
It is shown how the trapping conditions and efficiency of these devices can be
determined from simple derivations based on classical electromagnetism, even
though they operate on quantum objects.
","[{""version"":""v1"",""created"":""Tue, 22 Oct 2013 20:35:56 GMT""}]","2013-10-24"
"1310.6055","Adrian Sandu","Michael Guenther and Adrian Sandu","Multirate generalized additive Runge Kutta methods",,,,"Computational Science Laboratory Technical Report CSL-TR-6/2013","cs.NA math.NA","http://arxiv.org/licenses/nonexclusive-distrib/1.0/","  This work constructs a new class of multirate schemes based on the recently
developed generalized additive Runge-Kutta (GARK) methods (Sandu and Guenther,
2013). Multirate schemes use different step sizes for different components and
for different partitions of the right-hand side based on the local activity
levels. We show that the new multirate GARK family includes many well-known
multirate schemes as special cases. The order conditions theory follows
directly from the GARK accuracy theory. Nonlinear stability and monotonicity
investigations show that these properties are inherited from the base schemes
provided that additional coupling conditions hold.
","[{""version"":""v1"",""created"":""Tue, 22 Oct 2013 20:49:26 GMT""}]","2013-10-24"
"1310.6056","Bumkyu Cho","Bumkyu Cho","On the number of representations of integers by quadratic forms with
  congruence conditions","submitted for publication",,,,"math.NT","http://arxiv.org/licenses/nonexclusive-distrib/1.0/","  We characterize the generating function of the number of representations
described in the title in terms of the theory of modular forms. Appealing to
this characterization we obtain explicit formulas for the representation
numbers as examples.
","[{""version"":""v1"",""created"":""Tue, 22 Oct 2013 21:09:10 GMT""},{""version"":""v2"",""created"":""Tue, 18 Mar 2014 23:57:43 GMT""}]","2014-03-20"
"1310.6057","Eva Bayer","Eva Bayer-Fluckiger and Piotr Maciak","Upper bounds for the Euclidean minima of abelian fields of odd prime
  power conductor","To appear in Mathematische Annalen",,,,"math.NT","http://arxiv.org/licenses/nonexclusive-distrib/1.0/","  The aim of this paper is to give upper bounds for the Euclidean minima of
abelian fields of odd prime conductor. In particular, these bounds imply
Minkowski's conjecture for totally real number fields of conductor p^r, where p
is an odd prime and r is at least 2.
","[{""version"":""v1"",""created"":""Tue, 22 Oct 2013 21:14:10 GMT""}]","2013-10-24"
"1310.6058","Elisabetta Caffau","E. Caffau (1,2), M. Steffen (3,2), P. Bonifacio (2), H.-G. Ludwig
  (1,2), L. Monaco (4), G. Lo Curto (5), I. Kamp (6) ((1) LSW-ZAH, (2) GEPI,
  (3) AIP, (4) ESO-Chile, (5) ESO-Germany, (6) KAI Groningen)","Isotope Spectroscopy","AIP Thinkshop 10 ""High resolution optical spectroscopy"", invited
  talk, AN in press",,"10.1002/asna.201312010",,"astro-ph.SR","http://arxiv.org/licenses/nonexclusive-distrib/1.0/","  The measurement of isotopic ratios provides a privileged insight both into
nucleosynthesis and into the mechanisms operating in stellar envelopes, such as
gravitational settling. In this article, we give a few examples of how isotopic
ratios can be determined from high-resolution, high-quality stellar spectra. We
consider examples of the lightest elements, H and He, for which the isotopic
shifts are very large and easily measurable, and examples of heavier elements
for which the determination of isotopic ratios is more difficult. The presence
of 6Li in the stellar atmospheres causes a subtle extra depression in the red
wing of the 7Li 670.7 nm doublet which can only be detected in spectra of the
highest quality. But even with the best spectra, the derived $^6$Li abundance
can only be as good as the synthetic spectra used for their interpretation. It
is now known that 3D non-LTE modelling of the lithium spectral line profiles is
necessary to account properly for the intrinsic line asymmetry, which is
produced by convective flows in the atmospheres of cool stars, and can mimic
the presence of 6Li. We also discuss briefly the case of the carbon isotopic
ratio in metal-poor stars, and provide a new determination of the nickel
isotopic ratios in the solar atmosphere.
","[{""version"":""v1"",""created"":""Tue, 22 Oct 2013 21:15:44 GMT""}]","2015-06-17"
"1310.6059","James Shepherd","James J. Shepherd and Andreas Gr\""uneis","Many-body quantum chemistry for the electron gas: convergent
  perturbative theories","Comments welcome. arXiv admin note: text overlap with arXiv:1208.6103","Phys. Rev. Lett. 110, 226401 (2013)","10.1103/PhysRevLett.110.226401",,"physics.chem-ph cond-mat.mtrl-sci cond-mat.other cond-mat.quant-gas","http://arxiv.org/licenses/nonexclusive-distrib/1.0/","  We investigate the accuracy of a number of wavefunction based methods at the
heart of quantum chemistry for metallic systems. Using Hartree-Fock as a
reference, perturbative (M{\o}ller-Plesset, MP) and coupled cluster (CC)
theories are used to study the uniform electron gas model. Our findings suggest
that non-perturbative coupled cluster theories are acceptable for modelling
electronic interactions in metals whilst perturbative coupled cluster theories
are not. Using screened interactions, we propose a simple modification to the
widely-used coupled-cluster singles and doubles plus perturbative triples
method (CCSD(T)) that lifts the divergent behaviour and is shown to give very
accurate correlation energies for the homogeneous electron gas.
","[{""version"":""v1"",""created"":""Tue, 22 Oct 2013 21:21:46 GMT""}]","2013-10-24"
"1310.6060","Fernando Nicacio Ph.D.","Fernando Nicacio and Marcos Cesar de Oliveira","Tight Bounds for the Entanglement of Formation of Gaussian States","4 pages, 1 figure","Phys. Rev. A 89, 012336 (2014)","10.1103/PhysRevA.89.012336",,"quant-ph","http://arxiv.org/licenses/nonexclusive-distrib/1.0/","  We establish tight upper and lower bounds for the Entanglement of Formation
of an arbitrary two-mode Gaussian state employing necessary properties of
Gaussian channels. Both bounds are strictly given by the Entanglement of
Formation of symmetric Gaussian states, which are simply constructed from the
reduced states obtained by partial trace of the original one.
","[{""version"":""v1"",""created"":""Tue, 22 Oct 2013 21:23:23 GMT""},{""version"":""v2"",""created"":""Fri, 31 Jan 2014 11:32:16 GMT""}]","2014-06-09"
"1310.6061","Bohua Li","Bohua Li, Tanja Rindler-Daller, Paul R. Shapiro","Cosmological Constraints on Bose-Einstein-Condensed Scalar Field Dark
  Matter","21 pages, 6 figures, minor updates to accord with the published
  version in Phys. Rev. D","Phys. Rev. D 89, 083536 (2014)","10.1103/PhysRevD.89.083536",,"astro-ph.CO gr-qc hep-ph","http://arxiv.org/licenses/nonexclusive-distrib/1.0/","  (Abridged) Despite the success of Cold Dark Matter (CDM) in explaining a wide
range of observations, the microscopic nature of dark matter is still unknown.
Attempts to detect WIMPs, the most commonly studied form, have not yet
succeeded. Some predictions are even in apparent conflict with observations
(e.g. cuspy-cored halos and `missing satellite problem'). Therefore, it is
important to consider different forms of CDM. We focus on dark matter comprised
of ultralight bosons that form a Bose-Einstein Condensate (BEC), described by a
complex scalar field, and solve the Klein-Gordon and Einstein field equations
to evolve the Friedmann-Robertson-Walker universe. We find, in addition to
phases of radiation-, matter- and \Lambda-domination, an earlier phase of
scalar-field-domination. Moreover, while WIMP CDM is non-relativistic at all
times after it decouples, BEC scalar field dark matter (SFDM) is relativistic
at early times, evolving from stiff to radiation-like, before it becomes
non-relativistic (CDM-like) at late times. The timing of transitions between
these phases yields fundamental constraints on SFDM model parameters, particle
mass m and self-interaction coupling strength \lambda. We derive the range of
particle parameters required to match observations of the evolving background
universe, including the CMB and abundances of light elements produced by BBN,
characterized by N_eff, the effective number of neutrino species, and the epoch
of matter-radiation equality z_eq. This yields m >= 2.4*10^{-21} eV/c^2 and
9.5*10^{-19} eV^{-1}cm^3 <= \lambda/(mc^2)^2 <= 4*10^{-17} eV^{-1}cm^3. Our
model accommodates current observations in which N_eff at BBN is higher than at
z_eq, as probed by the CMB, otherwise unexplained by WIMP CDM. SFDM without
self-interaction (`Fuzzy Dark Matter') cannot satisfy current BBN constraints
within 68% confidence and is therefore disfavored.
","[{""version"":""v1"",""created"":""Tue, 22 Oct 2013 21:25:21 GMT""},{""version"":""v2"",""created"":""Wed, 29 Oct 2014 21:51:12 GMT""}]","2014-10-31"
"1310.6062","Piotr Pokarowski","Piotr Pokarowski and Jan Mielniczuk","Combined l_1 and greedy l_0 penalized least squares for linear model
  selection",,,,,"stat.ML","http://arxiv.org/licenses/nonexclusive-distrib/1.0/","  We introduce a computationally effective algorithm for a linear model
selection consisting of three steps: screening--ordering--selection (SOS).
Screening of predictors is based on the thresholded Lasso that is l_1 penalized
least squares. The screened predictors are then fitted using least squares (LS)
and ordered with respect to their t statistics. Finally, a model is selected
using greedy generalized information criterion (GIC) that is l_0 penalized LS
in a nested family induced by the ordering. We give non-asymptotic upper bounds
on error probability of each step of the SOS algorithm in terms of both
penalties. Then we obtain selection consistency for different (n, p) scenarios
under conditions which are needed for screening consistency of the Lasso. For
the traditional setting (n >p) we give Sanov-type bounds on the error
probabilities of the ordering--selection algorithm. Its surprising consequence
is that the selection error of greedy GIC is asymptotically not larger than of
exhaustive GIC. We also obtain new bounds on prediction and estimation errors
for the Lasso which are proved in parallel for the algorithm used in practice
and its formal version.
","[{""version"":""v1"",""created"":""Tue, 22 Oct 2013 21:27:18 GMT""}]","2013-10-24"
"1310.6063","Sayantan Sarkar","Sayantan Sarkar","Word Spotting in Cursive Handwritten Documents using Modified Character
  Shape Codes","10 Pages Advances In Computing And Information Technology:
  Proceedings Of The Second International Conference On Advances In Computing
  And Information Technology, July, 2012. ISBN13: 9783642315992",,,,"cs.CV","http://creativecommons.org/licenses/by/3.0/","  There is a large collection of Handwritten English paper documents of
Historical and Scientific importance. But paper documents are not recognized
directly by computer. Hence the closest way of indexing these documents is by
storing their document digital image. Hence a large database of document images
can replace the paper documents. But the document and data corresponding to
each image cannot be directly recognized by the computer.
  This paper applies the technique of word spotting using Modified Character
Shape Code to Handwritten English document images for quick and efficient query
search of words on a database of document images. It is different from other
Word Spotting techniques as it implements two level of selection for word
segments to match search query. First based on word size and then based on
character shape code of query. It makes the process faster and more efficient
and reduces the need of multiple pre-processing.
","[{""version"":""v1"",""created"":""Tue, 22 Oct 2013 21:39:25 GMT""}]","2013-10-24"
"1310.6064","Zi Yang Meng","Zi Yang Meng, Hsiang-Hsuan Hung and Thomas C. Lang","The characterization of topological properties in Quantum Monte Carlo
  simulations of the Kane-Mele-Hubbard model","35 pages, 16 figures, brief review for Mod. Phys. Lett B","Mod. Phys. Lett B, Vol 28, No 1 (2014) 143001","10.1142/S0217984914300014",,"cond-mat.str-el","http://arxiv.org/licenses/nonexclusive-distrib/1.0/","  Topological insulators present a bulk gap, but allow for dissipationless spin
transport along the edges. These exotic states are characterized by the $Z_2$
topological invariant and are protected by time-reversal symmetry. The
Kane-Mele model is one model to realize this topological class in two
dimensions, also called the quantum spin Hall state. In this review, we provide
a pedagogical introduction to the influence of correlation effects in the
quantum spin Hall states, with special focus on the half-filled
Kane-Mele-Hubbard model, solved by means of unbiased determinant quantum Monte
Carlo (QMC) simulations. We explain the idea of identifying the topological
insulator via $\pi$-flux insertion, the $Z_2$ invariant and the associated
behavior of the zero-frequency Green's function, as well as the spin Chern
number in parameter-driven topological phase transitions. The examples
considered are two descendants of the Kane-Mele-Hubbard model, the generalized
and dimerized Kane-Mele-Hubbard model. From the $Z_2$ index, spin Chern numbers
and the Green's function behavior, one can observe that correlation effects
induce shifts of the topological phase boundaries. Although the implementation
of these topological quantities has been successfully employed in QMC
simulations to describe the topological phase transition, we also point out
their limitations as well as suggest possible future directions in using
numerical methods to characterize topological properties of strongly correlated
condensed matter systems.
","[{""version"":""v1"",""created"":""Tue, 22 Oct 2013 21:43:39 GMT""},{""version"":""v2"",""created"":""Sat, 7 Dec 2013 19:26:56 GMT""}]","2013-12-10"
