"1308.2386","Daniel Kabat","Norihiro Iizuka and Daniel Kabat","On the Mutual Information in Hawking Radiation","4 pages, LaTeX, 1 figure","Phys. Rev. D 88, 084010 (2013)","10.1103/PhysRevD.88.084010","YITP-13-73","hep-th gr-qc","http://arxiv.org/licenses/nonexclusive-distrib/1.0/","  We compute the mutual information of two Hawking particles emitted
consecutively by an evaporating black hole. Following Page, we find that the
mutual information is of order exp(-S) where S is the entropy of the black
hole. We speculate on implications for black hole unitarity, in particular on a
possible failure of locality at large distances.
","[{""version"":""v1"",""created"":""Sun, 11 Aug 2013 12:25:58 GMT""}]","2013-10-30"
"1308.2387","Aiping Liu","Ai-Ping Liu, Xiao Xiong, Xi-Feng Ren, Yong-Jing Cai, Guang-Hao Rui,
  Qi-Wen Zhan, Guang-Can Guo, and Guo-Ping Guo","Detecting orbital angular momentum through division-of-amplitude
  interference with a circular plasmonic lens","5 pages, 4 figures, 1 table",,"10.1038/srep02402",,"physics.optics","http://arxiv.org/licenses/nonexclusive-distrib/1.0/","  We demonstrate a novel detection scheme for the orbital angular momentum
(OAM) of light using circular plasmonic lens. Owing to a division-of-amplitude
interference phenomenon between the surface plasmon waves and directly
transmitted light, specific intensity distributions are formed near the
plasmonic lens surface under different OAM excitations. Due to different phase
behaviors of the evanescent surface plasmon wave and the direct transmission,
interference patterns rotate as the observation plane moves away from the lens
surface. The rotation direction is a direct measure of the sign of OAM, while
the amount of rotation is linked to the absolute value of the OAM. This OAM
detection scheme is validated experimentally and numerically. Analytical
expressions are derived to provide insights and explanations of this detection
scheme. This work forms the basis for the realization of a compact and
integrated OAM detection architect that may significantly benefit optical
information processing with OAM states.
","[{""version"":""v1"",""created"":""Sun, 11 Aug 2013 12:40:24 GMT""},{""version"":""v2"",""created"":""Wed, 14 Aug 2013 00:43:55 GMT""}]","2013-08-15"
"1308.2388","Maksim Kouza M","Jacek Wabik and Sebastian Kmiecik and Dominik Gront and Maksim Kouza
  and Andrzej Kolinski","Combining Coarse-Grained Protein Models with Replica-Exchange All-Atom
  Molecular Dynamics","12 pages, 4 figures","Int. J. Mol. Sci 2013, 14, 9893-9905","10.3390/ijms14059893",,"physics.bio-ph q-bio.BM","http://arxiv.org/licenses/nonexclusive-distrib/1.0/","  We describe a combination of all-atom simulations with CABS, a
well-established coarse-grained protein modeling tool, into a single multiscale
protocol. The simulation method has been tested on the C-terminal beta hairpin
of protein G, a model system of protein folding. After reconstructing atomistic
details, conformations derived from the CABS simulation were subjected to
replica-exchange molecular dynamics simulations with OPLS-AA and AMBER99sb
force fields in explicit solvent. Such a combination accelerates system
convergence several times in comparison with all-atom simulations starting from
the extended chain conformation, demonstrated by the analysis of melting
curves, the number of native-like conformations as a function of time and
secondary structure propagation. The results strongly suggest that the proposed
multiscale method could be an efficient and accurate tool for high-resolution
studies of protein folding dynamics in larger systems.
","[{""version"":""v1"",""created"":""Sun, 11 Aug 2013 12:45:14 GMT""}]","2013-08-13"
"1308.2389","Chaoyuan Jin","Chao-Yuan Jin, and Osamu Wada","Photonic switching devices based on semiconductor nanostructures","26 pages, 8 figures","J. Phys. D: Appl. Phys. 47 (2014) 133001","10.1088/0022-3727/47/13/133001",,"cond-mat.mes-hall physics.optics quant-ph","http://arxiv.org/licenses/nonexclusive-distrib/1.0/","  Focusing and guiding light into semiconductor nanostructures can deliver
revolutionary concepts for photonic devices, which offer a practical pathway
towards next-generation power-efficient optical networks. In this review, we
consider the prospects for photonic switches using semiconductor quantum dots
(QDs) and photonic cavities which possess unique properties based on their low
dimensionality. The optical nonlinearity of such photonic switches is
theoretically analyzed by introducing the concept of a field enhancement
factor. This approach reveals drastic improvement in both power-density and
speed, which is able to overcome the limitations that have beset conventional
photonic switches for decades. In addition, the overall power consumption is
reduced due to the atom-like nature of QDs as well as the nano-scale footprint
of photonic cavities. Based on this theoretical perspective, the current
state-of-the-art of QD/cavity switches is reviewed in terms of various optical
nonlinearity phenomena which have been utilized to demonstrate photonic
switching. Emerging techniques, enabled by cavity nonlinear effects such as
wavelength tuning, Purcell-factor tuning and plasmonic effects are also
discussed.
","[{""version"":""v1"",""created"":""Sun, 11 Aug 2013 12:45:37 GMT""},{""version"":""v2"",""created"":""Sun, 18 Aug 2013 21:38:26 GMT""},{""version"":""v3"",""created"":""Wed, 15 Jan 2014 23:18:02 GMT""},{""version"":""v4"",""created"":""Wed, 26 Feb 2014 14:28:46 GMT""}]","2014-03-11"
"1308.2390","Santanu Sarma","Santanu Sarma","Adaptive Technique for Computationally Efficient Time Delay and
  Magnitude Estimation of Sinusoidal Signals","7 pages, 7 figures",,,,"cs.SY","http://arxiv.org/licenses/nonexclusive-distrib/1.0/","  An online, adaptive method of time delay and magnitude estimation for
sinusoidal signals is presented. The method is based on an adaptive gradient
descent algorithm that directly determines the time delay and magnitudes of two
noisy sinusoidal signals. The new estimator uses a novel quadrature carrier
generator to produce the carriers for an adaptive quadrature phase detector,
which in turn uses an arc tan function to compute the time delay. The proposed
method is quite robust and can adapt to significant variation in input signal
characteristics like magnitude and frequency imposing no requirement on the
magnitudes of the two signals. It even works effectively when the signals have
time-varying magnitudes. The convergence analysis of the proposed technique
shows that estimate converges exponentially fast to their nominal values. In
addition, if the technique is implemented in the continuous time domain, the
delay estimation accuracy will not be constrained by the sampling frequency as
observed in some of the classical techniques. Extensive simulations show that
the proposed method provides very accurate estimates of the time delay
comparable to that of the popular methods like Sinc-based estimator, Lagrange
estimator, and the Quadrature estimator, as well the magnitude estimate of the
input signals at lower signal to noise ratio at appreciably reduced
computational cost.
","[{""version"":""v1"",""created"":""Sun, 11 Aug 2013 13:07:14 GMT""}]","2013-08-13"
"1308.2391","Christian Weber","C.T.M. Weber, N. Leefer, D. Budker","Investigation of ac-Stark shifts in excited states of dysprosium
  relevant to testing fundamental symmetries","10 pages, 8 figures",,"10.1103/PhysRevA.88.062503",,"physics.atom-ph","http://arxiv.org/licenses/nonexclusive-distrib/1.0/","  We report on measurements of the differential polarizability between the
nearly degenerate, opposite parity states in atomic dysprosium at 19797.96
cm$^{-1}$. The differential scalar and tensor polarizabilities due to
additional states were measured for the $|M| = 7,...,10$ sublevels in
$^{164}$Dy and $^{162}$Dy and determined to be
$\bar{\boldsymbol\alpha}_{\scriptscriptstyle BA}^{(0)} =
180\,(45)_\text{stat}\,(8)_\text{sys}$ $\text{mHz}/(\mathrm{V}/\mathrm{cm})^2$
and $\bar{\boldsymbol\alpha}_{\scriptscriptstyle BA}^{(2)} =
-163\,(65)_\text{stat}\,(5)_\text{sys}$
$\text{mHz}/(\mathrm{V}/\mathrm{cm})^2$, respectively. The average blackbody
radiation induced Stark shift of the Zeeman spectrum was measured around 300 K
and found to be $-34(4)$ mHz/K and $+29(4)$ mHz/K for $^{164}$Dy and
$^{162}$Dy, respectively. We conclude that ac-Stark related systematics will
not limit a search for variation of the fine-structure constant, using
dysprosium, down to the level of $|\dot{\alpha}/\alpha|=2.6\times10^{-17}$
yr$^{-1}$, for two measurements of the transition frequency one year apart.
","[{""version"":""v1"",""created"":""Sun, 11 Aug 2013 13:09:11 GMT""},{""version"":""v2"",""created"":""Sun, 17 Nov 2013 04:31:50 GMT""},{""version"":""v3"",""created"":""Wed, 20 Nov 2013 03:40:40 GMT""}]","2015-06-16"
"1308.2392","Heiko Kr\""oner","Heiko Kr\""oner","Finite element approximation of power mean curvature flow","20 pages",,,,"math.NA","http://arxiv.org/licenses/nonexclusive-distrib/1.0/","  In [21] the evolution of hypersurfaces in $\mathbb{R}^{n+1}$ with normal
speed equal to a power $k>1$ of the mean curvature is considered and the
levelset solution $u$ of the flow is obtained as the $C^0$-limit of a sequence
$u^{\epsilon}$ of smooth functions solving the regularized levelset equations.
  We prove a rate for this convergence.
  Then we triangulate the domain by using a tetraeder mesh and consider
continuous finite elements, which are polynomials of degree $\le 2$ on each
tetraeder of the triangulation. We show in the case $n=1$ (i.e. the evolving
hypersurfaces are curves), that there are solutions $u^{\epsilon}_h$ of the
above regularized equations in the finite element sense, and estimate the
approximation error between $u^{\epsilon}_h$ and $u$.
  Our method can be extended to the case $n>1$, if one uses higher order finite
elements.
","[{""version"":""v1"",""created"":""Sun, 11 Aug 2013 13:17:08 GMT""}]","2013-08-13"
"1308.2393","Suresh Jaganathan","Suresh Jaganathan and Srinivasan Arulanadam and Damodaram Avula","An Efficient Transport Protocol for delivery of Multimedia An Efficient
  Transport Protocol for delivery of Multimedia Content in Wireless Grids","20 pages, 15 figures, Peer Reviewed Journal",,,,"cs.MM cs.NI","http://arxiv.org/licenses/nonexclusive-distrib/1.0/","  A grid computing system is designed for solving complicated scientific and
commercial problems effectively,whereas mobile computing is a traditional
distributed system having computing capability with mobility and adopting
wireless communications. Media and Entertainment fields can take advantage from
both paradigms by applying its usage in gaming applications and multimedia data
management. Multimedia data has to be stored and retrieved in an efficient and
effective manner to put it in use. In this paper, we proposed an application
layer protocol for delivery of multimedia data in wireless girds i.e.
multimedia grid protocol (MMGP). To make streaming efficient a new video
compression algorithm called dWave is designed and embedded in the proposed
protocol. This protocol will provide faster, reliable access and render an
imperceptible QoS in delivering multimedia in wireless grid environment and
tackles the challenging issues such as i) intermittent connectivity, ii) device
heterogeneity, iii) weak security and iv) device mobility.
","[{""version"":""v1"",""created"":""Sun, 11 Aug 2013 13:29:06 GMT""}]","2013-08-13"
"1308.2394","Saharon Shelah","Saharon Shelah","Indecomposable explicit abelian group","Proof incorrect",,,"Sh:1023","math.LO","http://arxiv.org/licenses/nonexclusive-distrib/1.0/","  (withdrawn.) For every lambda we give an explicit construction of an Abelian
group with no non-trivial automorphisms. In particular the group absolutely has
no non-trivial automorphisms, hence is absolutely indecomposable. Earlier we
knew a stronger existence theorem but only up to a quite large cardinal which
was a necessary restriction. In another direction the construction does not use
the axiom of choice.
","[{""version"":""v1"",""created"":""Sun, 11 Aug 2013 13:38:12 GMT""},{""version"":""v2"",""created"":""Sun, 8 Sep 2019 17:27:39 GMT""}]","2019-09-10"
"1308.2395","Tillmann Baumgratz","Tillmann Baumgratz, Alexander N\""u{\ss}eler, Marcus Cramer, Martin B.
  Plenio","A Scalable Maximum Likelihood Method for Quantum State Tomography","14 pages, 4 figures, replaced with published version","New J. Phys. 15, 125004 (2013)","10.1088/1367-2630/15/12/125004",,"quant-ph","http://arxiv.org/licenses/nonexclusive-distrib/1.0/","  The principle of maximum likelihood reconstruction has proven to yield
satisfactory results in the context of quantum state tomography for many-body
systems of moderate system sizes. Until recently, however, quantum state
tomography has been considered to be infeasible for systems consisting of a
large number of subsystems due to the exponential growth of the Hilbert space
dimension with the number of constituents. Several reconstruction schemes have
been proposed since then to overcome the two main obstacles in quantum
many-body tomography: experiment time and postprocessing resources. Here we
discuss one strategy to address these limitations for the maximum likelihood
principle by adopting a particular state representation to merge a well
established reconstruction algorithm maximizing the likelihood with techniques
known from quantum many-body theory.
","[{""version"":""v1"",""created"":""Sun, 11 Aug 2013 13:44:14 GMT""},{""version"":""v2"",""created"":""Tue, 28 Jan 2014 13:12:18 GMT""}]","2014-01-29"
"1308.2396","Elisabeth Remm","Yuri Bahturin, Michel Goze, Elisabeth Remm","Group gradings on filiform Lie algebras","21 pages",,,,"math.RA","http://arxiv.org/licenses/nonexclusive-distrib/1.0/","  We classify, up to isomorphism, gradings by abelian groups on nilpotent
filiform Lie algebras of nonzero rank. In case of rank 0, we describe
conditions to obtain non trivial $\Z_k$-gradings.
","[{""version"":""v1"",""created"":""Sun, 11 Aug 2013 13:44:50 GMT""}]","2013-08-13"
"1308.2397","Igor Bandos A.","Igor A. Bandos","Non-Abelian tensor hierarchy in (1,0) D=6 superspace","1+10 pages, no figures. V2: New section added, discussion extended,
  1+19 pages, to appear in JHEP",,"10.1007/JHEP11(2013)203",,"hep-th gr-qc math-ph math.MP","http://arxiv.org/licenses/nonexclusive-distrib/1.0/","  We present a set of constraints on superfield strengths of the non-Abelian
p-form potentials in D=6 (1,0) superspace which reproduces, as their
selfconsistency conditions, the equations of motion of the recently proposed
(1,0) superconformal theory. These include the anti-self-duality conditions for
the field strength of the non-Abelian 2-form potential, duality between field
strengths of the non-Abelian vectors and 3-forms as well as of the non-Abelian
four forms and scalar fields.
","[{""version"":""v1"",""created"":""Sun, 11 Aug 2013 13:50:45 GMT""},{""version"":""v2"",""created"":""Tue, 26 Nov 2013 18:00:40 GMT""}]","2015-06-16"
"1308.2398","Preethi Krishnamoorthy","K. Preethi, S. B. Gudennavar, S. G. Bubbly, Jayant Murthy and Noah
  Brosch","Photometric Identification of Objects from Galaxy Evolution Explorer
  Survey and Sloan Digital Sky Survey","10 pages, 11 figures",,"10.1093/mnras/stt1935",,"astro-ph.GA astro-ph.CO","http://arxiv.org/licenses/nonexclusive-distrib/1.0/","  We have used GALEX and SDSS observations to extract 7 band photometric
magnitudes for over 80,000 objects in the vicinity of the North Galactic Pole.
Although these had been identified as stars by the SDSS pipeline, we found
through fitting with model SEDs that most were, in fact, of extragalactic
origin. Only about 9% of these objects turned out to be main sequence stars and
about 11% were white dwarfs and red giants collectively, while galaxies and
quasars contributed to the remaining 80% of the data. We have classified these
objects into different spectral types (for the stars) and into different
galactic types (for the galaxies). As part of our fitting procedure, we derive
the distance and extinction to each object and the photometric redshift towards
galaxies and quasars. This method easily allows for the addition of any number
of observations to cover a more diverse range of wavelengths, as well as the
addition of any number of model templates. The primary objective of this work
is to eventually derive a 3-dimensional extinction map of the Milky Way galaxy.
","[{""version"":""v1"",""created"":""Sun, 11 Aug 2013 13:52:15 GMT""}]","2013-11-13"
"1308.2399","Dinesh Kumar","Dinesh Kumar","On dynamics of semiconjugated entire functions","6 pages, accepted for publication in J.Ind.Math.Soc. arXiv admin
  note: substantial text overlap with arXiv:1307.5785",,,,"math.DS","http://arxiv.org/licenses/nonexclusive-distrib/1.0/","  Let $g$ and $h$ be transcendental entire functions and let $f$ be a
continuous map of the complex plane into itself with $f\circ g=h\circ f.$ Then
$g$ and $h$ are said to be semiconjugated by $f$ and $f$ is called a
semiconjugacy. We consider the dynamical properties of semiconjugated
transcendental entire functions $g$ and $h$ and provide several conditions
under which the semiconjugacy $f$ carries Fatou set of one entire function into
the Fatou set of other entire function appearing in the semiconjugation. We
have also shown that under certain condition on the growth of entire functions
appearing in the semiconjugation, the set of asymptotic values of the
derivative of composition of the entire functions is bounded.
","[{""version"":""v1"",""created"":""Sun, 11 Aug 2013 13:59:59 GMT""},{""version"":""v2"",""created"":""Thu, 15 Aug 2013 07:23:55 GMT""},{""version"":""v3"",""created"":""Sun, 18 May 2014 11:27:22 GMT""}]","2014-05-20"
"1308.2400","Niraj Singh","Niraj Kumar Singh, Soubhik Chakraborty, Dheeresh Kumar Mallick","An Adaptable Fast Matrix Multiplication Algorithm, Going Beyond the Myth
  of Decimal War","No of tables is 1. No of diagrams is 01",,,,"cs.DS","http://arxiv.org/licenses/nonexclusive-distrib/1.0/","  In this paper we present an adaptable fast matrix multiplication (AFMM)
algorithm, for two nxn dense matrices which computes the product matrix with
average complexity Tavg(n) = d1d2n3 with the acknowledgement that the average
count is obtained for addition as the basic operation rather than
multiplication which is probably the unquestionable choice for basic operation
in existing matrix multiplication algorithms.
","[{""version"":""v1"",""created"":""Sun, 11 Aug 2013 14:55:14 GMT""}]","2013-08-13"
"1308.2401","Tiancheng Li","Tiancheng Li, Shudong Sun, Juan M. Corchado, Tariq P. Sattar and
  Shubin Si","Numerical Fitting-based Likelihood Calculation to Speed up the Particle
  Filter","42 pages, 17 figures, 4 tables and 1 appendix. This paper is a
  draft/preprint of one paper submitted to the IEEE Transactions","Int. J. Adapt. Control Signal Process. vol. 30, pp.1583-1602
  (2016)","10.1002/acs.2656",,"cs.IT cs.NA math.IT","http://arxiv.org/licenses/nonexclusive-distrib/1.0/","  The likelihood calculation of a vast number of particles is the computational
bottleneck for the particle filter in applications where the observation
information is rich. For fast computing the likelihood of particles, a
numerical fitting approach is proposed to construct the Likelihood Probability
Density Function (Li-PDF) by using a comparably small number of so-called
fulcrums. The likelihood of particles is thereby analytically inferred,
explicitly or implicitly, based on the Li-PDF instead of directly computed by
utilizing the observation, which can significantly reduce the computation and
enables real time filtering. The proposed approach guarantees the estimation
quality when an appropriate fitting function and properly distributed fulcrums
are used. The details for construction of the fitting function and fulcrums are
addressed respectively in detail. In particular, to deal with multivariate
fitting, the nonparametric kernel density estimator is presented which is
flexible and convenient for implicit Li-PDF implementation. Simulation
comparison with a variety of existing approaches on a benchmark 1-dimensional
model and multi-dimensional robot localization and visual tracking demonstrate
the validity of our approach.
","[{""version"":""v1"",""created"":""Sun, 11 Aug 2013 15:12:56 GMT""},{""version"":""v2"",""created"":""Wed, 6 Aug 2014 22:40:06 GMT""},{""version"":""v3"",""created"":""Thu, 16 Oct 2014 17:37:17 GMT""}]","2017-07-31"
"1308.2402","Rahbar Virk","R. Virk","Graded tensoring and crystals","minor typos fixed",,,,"math.RT math.CO math.QA","http://arxiv.org/licenses/nonexclusive-distrib/1.0/","  An action of the $\mathfrak{sl}_2$-crystal category on graded/mixed
(integral) category $\mathcal{O}$ `lifting' the usual tensor product is
defined.
","[{""version"":""v1"",""created"":""Sun, 11 Aug 2013 15:37:57 GMT""},{""version"":""v2"",""created"":""Tue, 27 Aug 2013 12:33:42 GMT""},{""version"":""v3"",""created"":""Sun, 29 Dec 2013 00:33:02 GMT""}]","2013-12-31"
"1308.2403","Subhadeep Mukhopadhyay","Subhadeep Mukhopadhyay","CDfdr: A Comparison Density Approach to Local False Discovery Rate
  Estimation",,,,,"stat.ME math.ST stat.AP stat.ML stat.TH","http://arxiv.org/licenses/nonexclusive-distrib/1.0/","  Efron et al. (2001) proposed empirical Bayes formulation of the frequentist
Benjamini and Hochbergs False Discovery Rate method (Benjamini and
Hochberg,1995). This article attempts to unify the `two cultures' using
concepts of comparison density and distribution function. We have also shown
how almost all of the existing local fdr methods can be viewed as proposing
various model specification for comparison density - unifies the vast
literature of false discovery methods under one concept and notation.
","[{""version"":""v1"",""created"":""Sun, 11 Aug 2013 15:46:36 GMT""}]","2013-08-13"
"1308.2404","Daniel Beller","Marcello Cavallaro Jr., Mohamed A. Gharbi, Daniel A. Beller, Simon
  \v{C}opar, Zheng Shi, Tobias Baumgart, Shu Yang, Randall D. Kamien, Kathleen
  J. Stebe","Exploiting imperfections: Directed assembly of surface colloids via bulk
  topological defects","11 pages, 5 figures, submitted to PNAS","PNAS 110 (2013) 18804","10.1073/pnas.1313551110",,"cond-mat.soft","http://arxiv.org/licenses/nonexclusive-distrib/1.0/","  We exploit the long-ranged elastic fields inherent to confined nematic liquid
crystals to assemble colloidal particles trapped at the liquid crystal
interface into reconfigurable structures with complex symmetries and packings.
Spherical colloids with homeotropic anchoring trapped at the interface between
air and the nematic liquid crystal 5CB create quadrupolar distortions in the
director field causing particles to repel and consequently form close-packed
assemblies with a triangular habit. Here we report on complex, open structures
organized via interactions with defects in the bulk. Specifically, by confining
the nematic liquid crystal in an array of microposts with homeotropic anchoring
conditions, we cause defect rings to form at well-defined locations in the bulk
of the sample. These defects source elastic deformations that direct the
assembly of the interfacially-trapped colloids into ring-like assemblies, which
recapitulate the defect geometry even when the microposts are completely
immersed in the nematic. When the surface density of the colloids is high, they
form a ring near the defect and a hexagonal lattice far from it. Since
topographically complex substrates are easily fabricated and liquid crystal
defects are readily reconfigured, this work lays the foundation for a new,
robust mechanism to dynamically direct assembly over large areas by controlling
surface anchoring and associated bulk defect structure.
","[{""version"":""v1"",""created"":""Sun, 11 Aug 2013 15:57:03 GMT""},{""version"":""v2"",""created"":""Tue, 24 Sep 2013 23:00:03 GMT""}]","2015-06-16"
"1412.6010","Edward Kapuscik","Edward Kapu\'scik","On a fatal error in tachyonic physics",,,"10.1007/s10773-014-2458-1",,"physics.gen-ph","http://arxiv.org/licenses/nonexclusive-distrib/1.0/","  A fatal error in the famous paper on tachyons by Gerald Feinberg is pointed
out. The correct expressions for energy and momentum of tachyons are derived.
","[{""version"":""v1"",""created"":""Sat, 10 Aug 2013 18:10:49 GMT""}]","2015-06-23"
