"1308.2344","Steven Miller","Steven J. Miller and Kevin Vissuet","Most Subsets are Balanced in Finite Groups","Version 2.0, 11 pages, 2 figures",,,,"math.NT","http://arxiv.org/licenses/nonexclusive-distrib/1.0/","  The sumset is one of the most basic and central objects in additive number
theory. Many of the most important problems (such as Goldbach's conjecture and
Fermat's Last theorem) can be formulated in terms of the sumset $S + S = \{x+y
: x,y\in S\}$ of a set of integers $S$. A finite set of integers $A$ is
sum-dominated if $|A+A| > |A-A|$. Though it was believed that the percentage of
subsets of $\{0,...,n\}$ that are sum-dominated tends to zero, in 2006 Martin
and O'Bryant proved a very small positive percentage are sum-dominated if the
sets are chosen uniformly at random (through work of Zhao we know this
percentage is approximately $4.5 \cdot 10^{-4}$). While most sets are
difference-dominated in the integer case, this is not the case when we take
subsets of many finite groups. We show that if we take subsets of larger and
larger finite groups uniformly at random, then not only does the probability of
a set being sum-dominated tend to zero but the probability that $|A+A|=|A-A|$
tends to one, and hence a typical set is balanced in this case. The cause of
this marked difference in behavior is that subsets of $\{0,..., n\}$ have a
fringe, whereas finite groups do not. We end with a detailed analysis of
dihedral groups, where the results are in striking contrast to what occurs for
subsets of integers.
","[{""version"":""v1"",""created"":""Sat, 10 Aug 2013 21:46:21 GMT""},{""version"":""v2"",""created"":""Sun, 19 Jan 2014 05:51:20 GMT""}]","2014-01-21"
"1308.2345","David Hornidge","David Hornidge","Asymmetries for neutral pion photoproduction in the threshold region","7 pages, 3 figures, Proceedings of the 7th International Workshop on
  Chiral Dynamics, August 6-10, 2012, JLab, Newport News, VA, USA","PoS CD12 070 (2013)",,,"nucl-ex","http://arxiv.org/licenses/nonexclusive-distrib/1.0/","  We report on two pion-photoproduction measurements in the threshold region
conducted in the A2 collaboration at MAMI with the almost 4{\pi} Crystal Ball
detector. The first was with a linearly polarized photon beam and unpolarized
liquid-hydrogen target. The data analysis is now complete and the linearly
polarized beam asymmetry along with differential cross sections provide the
most stringent test to date of the predictions of Chiral Perturbation Theory
and its energy region of convergence. More recently, a measurement was
performed using both circularly polarized photons and a transversely polarized
butanol frozen-spin target, with the goal of extracting both the target and
beam-target asymmetries. From these we intend to extract {\pi}N scattering
sensitive information for the first time in photo-pion reactions. This will be
used to test isospin conservation and further test dynamics of chiral symmetry
breaking in QCD as calculated at low energies by Chiral Perturbation Theory.
","[{""version"":""v1"",""created"":""Sat, 10 Aug 2013 21:48:46 GMT""}]","2013-08-13"
"1308.2346","Marcelo Chiapparini Dr.","Ana Maria Endler, S\'ergio Barbosa Duarte, Hil\'ario Rodrigues,
  Marcelo Chiapparini","Gravitational Wave Generation in Rotating Compact Stars","Contribution for the Conference Proceedings of the Compact Stars in
  the QCD Phase Diagram III (CSQCD III) conference, December 12-15, 2012,
  Guaruj\'a, Brazil. http://www.astro.iag.usp.br/~foton/CSQCD3",,,,"astro-ph.SR gr-qc","http://arxiv.org/licenses/nonexclusive-distrib/1.0/","  We present a simplified description of a rotating neutron star emitting
gravitational waves. We describe the system by an uniformly rotating triaxial
homogeneous ellipsoid to catch the main aspects of the evolution. We construct
an effective Lagrangian model, in which the kinetic energy associated to the
breath mode and rotation are explicitly determined. The rate of gravitational
waves radiation is determined in the framework of the weak field limit
approximation of Einstein equations. We then solve numerically the equations of
motion for the nascent neutron star, incorporating the diffusion of neutrinos
in the calculation.
","[{""version"":""v1"",""created"":""Sat, 10 Aug 2013 21:53:21 GMT""}]","2013-08-13"
"1308.2347","Martina Balagovic","Martina Balagovic","Degeneration of trigonometric dynamical difference equations for quantum
  loop algebras to trigonometric Casimir equations for Yangians",,"Communications in Mathematical Physics 2015, 334(2), 629-659","10.1007/s00220-014-2284-6",,"math.RT","http://arxiv.org/licenses/nonexclusive-distrib/1.0/","  We show that, under Drinfeld's degeneration of quantum loop algebras to
Yangians, the trigonometric dynamical difference equations for the quantum
affine algebra degenerate to the trigonometric Casimir differential equations
for Yangians.
","[{""version"":""v1"",""created"":""Sat, 10 Aug 2013 22:30:31 GMT""},{""version"":""v2"",""created"":""Mon, 8 Aug 2016 08:43:20 GMT""}]","2016-08-17"
"1308.2348","Jean Pierre Gazeau","Jean Pierre Gazeau, Herve Bergeron","Integral quantizations with two basic examples","36 pages","Annals of Physics (NY) 344 43-68 (2014)","10.1016/j.aop.2014.02.008",,"quant-ph math-ph math.MP","http://arxiv.org/licenses/nonexclusive-distrib/1.0/","  The paper is devoted to integral quantization, a procedure based on
operator-valued measure and resolution of the identity. We insist on covariance
properties in the important case where group representation theory is involved.
We also insist on the inherent probabilistic aspects of this classical-quantum
map. The approach includes and generalizes coherent state quantization. Two
applications based on group representation are carried out. The first one
concerns the Weyl-Heisenberg group and the euclidean plane viewed as the
corresponding phase space. We show that there exists a world of quantizations
which yield the canonical commutation rule and the usual quantum spectrum of
the harmonic oscillator. The second one concerns the affine group of the real
line and gives rise to an interesting regularization of the dilation origin in
the half-plane viewed as the corresponding phase space.
","[{""version"":""v1"",""created"":""Sat, 10 Aug 2013 22:40:27 GMT""},{""version"":""v2"",""created"":""Fri, 22 Nov 2013 15:02:03 GMT""}]","2019-11-06"
"1308.2349","Rohit Chadha","Remi Bonnet (LSV, ENS Cachan and CNRS), Rohit Chadha (University of
  Missouri), Mahesh Viswanathan (University of Illinois), P. Madhusudan
  (University of Illinois)","Reachability under Contextual Locking","A preliminary version appears in TACAS 2012","Logical Methods in Computer Science, Volume 9, Issue 3 (September
  17, 2013) lmcs:762","10.2168/LMCS-9(3:21)2013",,"cs.LO","http://arxiv.org/licenses/nonexclusive-distrib/1.0/","  The pairwise reachability problem for a multi-threaded program asks, given
control locations in two threads, whether they can be simultaneously reached in
an execution of the program. The problem is important for static analysis and
is used to detect statements that are concurrently enabled. This problem is in
general undecidable even when data is abstracted and when the threads (with
recursion) synchronize only using a finite set of locks. Popular programming
paradigms that limit the lock usage patterns have been identified under which
the pairwise reachability problem becomes decidable. In this paper, we consider
a new natural programming paradigm, called contextual locking, which ties the
lock usage to calling patterns in each thread: we assume that locks are
released in the same context that they were acquired and that every lock
acquired by a thread in a procedure call is released before the procedure
returns. Our main result is that the pairwise reachability problem is
polynomial-time decidable for this new programming paradigm as well. The
problem becomes undecidable if the locks are reentrant; reentrant locking is a
\emph{recursive locking} mechanism which allows a thread in a multi-threaded
program to acquire the reentrant lock multiple times.
","[{""version"":""v1"",""created"":""Sat, 10 Aug 2013 22:43:03 GMT""},{""version"":""v2"",""created"":""Mon, 16 Sep 2013 18:23:01 GMT""},{""version"":""v3"",""created"":""Fri, 20 Sep 2013 18:52:34 GMT""}]","2015-07-01"
"1308.2350","Bonny Banerjee","Jayanta K. Dutta, Bonny Banerjee","Learning Features and their Transformations by Spatial and Temporal
  Spherical Clustering",,,,,"cs.NE cs.AI cs.CV cs.LG q-bio.NC","http://arxiv.org/licenses/nonexclusive-distrib/1.0/","  Learning features invariant to arbitrary transformations in the data is a
requirement for any recognition system, biological or artificial. It is now
widely accepted that simple cells in the primary visual cortex respond to
features while the complex cells respond to features invariant to different
transformations. We present a novel two-layered feedforward neural model that
learns features in the first layer by spatial spherical clustering and
invariance to transformations in the second layer by temporal spherical
clustering. Learning occurs in an online and unsupervised manner following the
Hebbian rule. When exposed to natural videos acquired by a camera mounted on a
cat's head, the first and second layer neurons in our model develop simple and
complex cell-like receptive field properties. The model can predict by learning
lateral connections among the first layer neurons. A topographic map to their
spatial features emerges by exponentially decaying the flow of activation with
distance from one neuron to another in the first layer that fire in close
temporal proximity, thereby minimizing the pooling length in an online manner
simultaneously with feature learning.
","[{""version"":""v1"",""created"":""Sat, 10 Aug 2013 22:56:26 GMT""}]","2020-12-14"
"1308.2351","Yuriy Pogorelov","Yuriy G. Pogorelov, Mario C. Santos, Vadim M. Loktev","Impurity effects on electronic transport in ferropnictide
  superconductors","8 pages, 4 figures","Phys. Rev. B 88, 224518 (2013)","10.1103/PhysRevB.88.224518",,"cond-mat.supr-con","http://arxiv.org/licenses/nonexclusive-distrib/1.0/","  Effects of impurities and disorder on transport properties by electronic
quasiparticles in superconducting iron pnictides are theoretically considered.
The most prominent new features compared to the case of pure material should
appear at high enough impurity concentration when a specific narrow band of
conducting quasiparticle states can develop within the superconducting gap,
around the position of localized impurity level by a single impurity center.
The predicted specific threshold effects in the frequency dependent optical
conductivity and temperature dependent thermal conductivity and also in Seebeck
and Peltier coefficients can have interesting potentialities for practical
applications.
","[{""version"":""v1"",""created"":""Sat, 10 Aug 2013 23:21:59 GMT""},{""version"":""v2"",""created"":""Mon, 19 Aug 2013 00:59:52 GMT""},{""version"":""v3"",""created"":""Tue, 20 Aug 2013 01:59:02 GMT""}]","2014-01-08"
"1308.2352","Francisco J. Beron-Vera","G. Haller, F. J. Beron-Vera","Coherent Lagrangian vortices: The black holes of turbulence","To appear in JFM Rapids",,"10.1017/jfm.2013.391",,"physics.ao-ph math-ph math.DS math.MP nlin.CD physics.flu-dyn","http://arxiv.org/licenses/nonexclusive-distrib/1.0/","  We introduce a simple variational principle for coherent material vortices in
two-dimensional turbulence. Vortex boundaries are sought as closed stationary
curves of the averaged Lagrangian strain. Solutions to this problem turn out to
be mathematically equivalent to photon spheres around black holes in cosmology.
The fluidic photon spheres satisfy explicit differential equations whose
outermost limit cycles are optimal Lagrangian vortex boundaries. As an
application, we uncover super-coherent material eddies in the South Atlantic,
which yield specific Lagrangian transport estimates for Agulhas rings.
","[{""version"":""v1"",""created"":""Sat, 10 Aug 2013 23:57:17 GMT""}]","2015-06-16"
"1308.2353","Yannan Qiu","Yannan Qiu","The Whittaker period formula on Metaplectic SL(2)","The revised version to appear in Transactions of AMS, 33 pages",,,,"math.NT","http://arxiv.org/licenses/nonexclusive-distrib/1.0/","  The Whittaker period formula on metaplectic $SL(2)$ was previously
established only when the base field $F$ is totally real. We present a new
simple proof that works for all base number fields. Our local argument is
uniform at every local place of $F$, based on the isometry property of
quadratic Fourier transform and the estimates of matrix coefficients and
Whittaker functions imposed by the unitariness of the local representations.
","[{""version"":""v1"",""created"":""Sun, 11 Aug 2013 00:10:53 GMT""},{""version"":""v2"",""created"":""Sun, 15 Dec 2013 12:16:24 GMT""},{""version"":""v3"",""created"":""Wed, 12 Apr 2017 23:58:10 GMT""}]","2017-04-14"
"1308.2354","Srijith Ravikumar","Srijith Ravikumar, Kartik Talamadupula, Raju Balakrishnan, Subbarao
  Kambhampati","RAProp: Ranking Tweets by Exploiting the Tweet/User/Web Ecosystem and
  Inter-Tweet Agreement","11 pages",,,,"cs.IR","http://arxiv.org/licenses/nonexclusive-distrib/1.0/","  The increasing popularity of Twitter renders improved trustworthiness and
relevance assessment of tweets much more important for search. However, given
the limitations on the size of tweets, it is hard to extract measures for
ranking from the tweets' content alone. We present a novel ranking method,
called RAProp, which combines two orthogonal measures of relevance and
trustworthiness of a tweet. The first, called Feature Score, measures the
trustworthiness of the source of the tweet. This is done by extracting features
from a 3-layer twitter ecosystem, consisting of users, tweets and the pages
referred to in the tweets. The second measure, called agreement analysis,
estimates the trustworthiness of the content of the tweet, by analyzing how and
whether the content is independently corroborated by other tweets. We view the
candidate result set of tweets as the vertices of a graph, with the edges
measuring the estimated agreement between each pair of tweets. The feature
score is propagated over this agreement graph to compute the top-k tweets that
have both trustworthy sources and independent corroboration. The evaluation of
our method on 16 million tweets from the TREC 2011 Microblog Dataset shows that
for top-30 precision we achieve 53% higher than current best performing method
on the Dataset and over 300% over current Twitter Search. We also present a
detailed internal empirical evaluation of RAProp in comparison to several
alternative approaches proposed by us.
","[{""version"":""v1"",""created"":""Sun, 11 Aug 2013 00:56:59 GMT""}]","2013-08-13"
"1308.2355","Kuo-Wei Huang","Kuo-Wei Huang","Weyl Anomaly Induced Stress Tensors in General Manifolds","15 pages","Nucl.Phys. B879 (2014) 370-381","10.1016/j.nuclphysb.2013.12.013",,"hep-th","http://arxiv.org/licenses/nonexclusive-distrib/1.0/","  Considering arbitrary conformal field theories in general (non-conformally
flat) backgrounds, we adopt a dimensional regularization approach to obtain
stress tensors from Weyl anomalies. The results of type A anomaly-induced
stress tensors in four and six-dimensions generalize the previous results
calculated in a conformally flat background. On the other hand, regulators are
needed to have well-defined type B anomaly-induced stress tensors. We also
discuss ambiguities related to type D anomalies, Weyl invariants and order of
limit issues.
","[{""version"":""v1"",""created"":""Sun, 11 Aug 2013 00:59:27 GMT""}]","2015-06-16"
"1308.2356","Boris Gutkin","Boris Gutkin, Vladimir Al. Osipov","Universality in spectral statistics of ""open"" quantum graphs","4 pages, 5 figures",,,,"nlin.CD math-ph math.MP","http://arxiv.org/licenses/nonexclusive-distrib/1.0/","  The unitary evolution maps in closed chaotic quantum graphs are known to have
universal spectral correlations, as predicted by random matrix theory. In
chaotic graphs with absorption the quantum maps become non-unitary. We show
that their spectral statistics exhibit universality at the ""soft"" edges of the
spectrum. The same spectral behavior is observed in many classical non-unitary
ensembles of random matrices with rotationally invariant measures.
","[{""version"":""v1"",""created"":""Sun, 11 Aug 2013 01:02:56 GMT""}]","2013-08-13"
"1308.2357","Amitav Mukherjee","Amitav Mukherjee and A. Lee Swindlehurst","On the Detection of Passive Eavesdroppers in the MIMO Wiretap Channel",,,,,"cs.IT math.IT","http://arxiv.org/licenses/nonexclusive-distrib/1.0/","  The classic MIMO wiretap channel comprises a passive eavesdropper that
attempts to intercept communications between an authorized transmitter-receiver
pair, each node being equipped with multiple antennas. In a dynamic network, it
is imperative that the presence of an eavesdropper be determined before the
transmitter can deploy robust secrecyencoding schemes as a countermeasure. This
is a difficult task in general, since by definition the eavesdropper is passive
and never transmits. In this work we adopt a method that allows the legitimate
nodes to detect the passive eavesdropper from the local oscillator power that
is inadvertently leaked from its RF front end. We examine the performance of
non-coherent energy detection and optimal coherent detection, followed by
composite GLRT detection methods that account for unknown parameters. Numerical
experiments demonstrate that the proposed detectors allow the legitimate nodes
to increase the secrecy rate of the MIMO wiretap channel.
","[{""version"":""v1"",""created"":""Sun, 11 Aug 2013 01:31:24 GMT""}]","2013-08-13"
"1308.2358","Levent Alpoge","Levent Alpoge","Proof of a conjecture of Stanley-Zanello","7 pages. To appear in Journal of Combinatorial Theory, Series A",,,,"math.CO math.NT","http://arxiv.org/licenses/nonexclusive-distrib/1.0/","  We prove that the number of partitions of an integer into at most b distinct
parts of size at most n forms a unimodal sequence for n sufficiently large with
respect to b. This resolves a recent conjecture of Stanley and Zanello.
","[{""version"":""v1"",""created"":""Sun, 11 Aug 2013 01:51:58 GMT""},{""version"":""v2"",""created"":""Tue, 4 Mar 2014 13:32:21 GMT""}]","2014-03-05"
"1308.2359","Arun Maiya","Arun S. Maiya, John P. Thompson, Francisco Loaiza-Lemos, Robert M.
  Rolfe","Exploratory Analysis of Highly Heterogeneous Document Collections","9 pages; KDD 2013: 19th ACM SIGKDD Conference on Knowledge Discovery
  and Data Mining",,,,"cs.CL cs.HC cs.IR","http://arxiv.org/licenses/nonexclusive-distrib/1.0/","  We present an effective multifaceted system for exploratory analysis of
highly heterogeneous document collections. Our system is based on intelligently
tagging individual documents in a purely automated fashion and exploiting these
tags in a powerful faceted browsing framework. Tagging strategies employed
include both unsupervised and supervised approaches based on machine learning
and natural language processing. As one of our key tagging strategies, we
introduce the KERA algorithm (Keyword Extraction for Reports and Articles).
KERA extracts topic-representative terms from individual documents in a purely
unsupervised fashion and is revealed to be significantly more effective than
state-of-the-art methods. Finally, we evaluate our system in its ability to
help users locate documents pertaining to military critical technologies buried
deep in a large heterogeneous sea of information.
","[{""version"":""v1"",""created"":""Sun, 11 Aug 2013 02:28:11 GMT""}]","2013-08-13"
"1308.2360","Chonghui Huang","Chonghui Huang","Syzygy Modules and Injective Cogenerators for Noether Rings",,,,,"math.RA math.KT","http://arxiv.org/licenses/nonexclusive-distrib/1.0/","  In this paper, we focus on $n$-syzygy modules and the injective cogenerator
determined by the minimal injective resolution of a noether ring. We study the
properties of $n$-syzygy modules and a category $R_n(\mod R)$ which includes
the category consisting of all $n$-syzygy modules and their applications on
Auslander-type rings. Then, we investigate the injective cogenerators
determined by the minimal injective resolution of $R$. We show that $R$ is
Gorenstein with finite self-injective dimension at most $n$ if and only if $\id
R\leq n$ and $\fd \bigoplus_{i=0}^n I_i(R)< \infty$. Some known results can be
our corollaries.
","[{""version"":""v1"",""created"":""Sun, 11 Aug 2013 03:08:07 GMT""}]","2013-08-13"
"1308.2361","Chongying Dong","Chongying Dong and Xingjun Lin","Unitary vertex operator algebras","31 pages",,,,"math.QA","http://arxiv.org/licenses/nonexclusive-distrib/1.0/","  Unitary vertex operator algebras are introduced and studied. It is proved
that most well-known rational vertex operator algebras are unitary. The
classification of unitary vertex operator algebras with central charge c less
than or equal to 1 is also discussed.
","[{""version"":""v1"",""created"":""Sun, 11 Aug 2013 03:14:17 GMT""}]","2013-08-13"
"1308.2362","Bo young Lim","Yunsik Jake Jang, Bo young Lim","Harmonization among national cyber security and cybercrime response
  organizations: New challenges of cybercrime","4th Asian Criminology Conference (2012)",,,,"cs.CY","http://creativecommons.org/licenses/by/3.0/","  This paper will discuss the need for national-level organizational strategies
to effectively combat cyber security threats and cybercrime. In many countries,
new agencies have been established and/or new roles have been allotted to
existing agencies to cope with the needs for cyber security or fighting against
cybercrime. The two pillars of organizational structure and functions (i.e.,
security vs. law enforcement) have given new challenges to us, especially in
the context of traditional criminal justice system. To illustrate the
challenges, a case study examining the responses to major security incidents
followed by nationwide debates and remarkable organizational changes in Korea
will be given.
","[{""version"":""v1"",""created"":""Sun, 11 Aug 2013 03:28:07 GMT""}]","2013-08-13"
"1308.2363","Nicolas Privault","Nicolas Privault, Xiangfeng Yang, Jean-Claude Zambrini","Feynman-Kac formula for Levy processes and semiclassical (Euclidean)
  momentum representation",,,,,"math.PR math-ph math.MP","http://arxiv.org/licenses/nonexclusive-distrib/1.0/","  We prove a version of the Feynman-Kac formula for Levy processes and
integro-differential operators, with application to the momentum representation
of suitable quantum (Euclidean) systems whose Hamiltonians involve
L\'{e}vy-type potentials. Large deviation techniques are used to obtain the
limiting behavior of the systems as the Planck constant approaches zero. It
turns out that the limiting behavior coincides with fresh aspects of the
semiclassical limit of (Euclidean) quantum mechanics. Non-trivial examples of
Levy processes are considered as illustrations and precise asymptotics are
given for the terms in both configuration and momentum representations.
","[{""version"":""v1"",""created"":""Sun, 11 Aug 2013 04:41:41 GMT""}]","2013-08-13"
"1308.2364","Weidong Gao","Weidong Gao, Yuanlin Li and Jiangtao Peng","An upper bound for Davenport constant of finite groups","arXiv admin note: text overlap with arXiv:1211.2614 by other authors",,,,"math.NT","http://arxiv.org/licenses/nonexclusive-distrib/1.0/","  Let $G$ be a finite (not necessarily abelian) group and let $p=p(G)$ be the
smallest prime number dividing $|G|$. We prove that $d(G)\leq
\frac{|G|}{p}+9p^2-10p$, where $d(G)$ denotes the small Davenport constant of
$G$ which is defined as the maximal integer $\ell$ such that there is a
sequence over $G$ of length $\ell$ contains no nonempty one-product
subsequence.
","[{""version"":""v1"",""created"":""Sun, 11 Aug 2013 05:03:02 GMT""}]","2013-08-13"
"1308.2365","Weidong Gao","Xingwu Xia and Weidong Gao","On n-sum of an abelian group of order n",,,,,"math.NT","http://arxiv.org/licenses/nonexclusive-distrib/1.0/","  Let $G$ be an additive finite abelian group of order $n$, and let $S$ be a
sequence of $n+k$ elements in $G$, where $k\geq 1$. Suppose that $S$ contains
$t$ distinct elements. Let $\sum_n(S)$ denote the set that consists of all
elements in $G$ which can be expressed as the sum over a subsequence of length
$n$. In this paper we prove that, either $0\in \sum_n(S)$ or $|\sum_n(S)|\geq
k+t-1.$ This confirms a conjecture by Y.O. Hamidoune in 2000.
","[{""version"":""v1"",""created"":""Sun, 11 Aug 2013 05:07:57 GMT""}]","2013-08-13"
"1308.2366","Enrico Brambilla","E. Brambilla, O. Jedrkiewicz, P. Di Trapani, and A. Gatti","Space-time coupling in the up-conversion of broadband down-converted
  light","12 pages, 10 figures",,,,"quant-ph physics.optics","http://arxiv.org/licenses/nonexclusive-distrib/1.0/","  We investigate the up-conversion process of broadband light from parametric
down-conversion (PDC), focusing on the spatio-temporal spectral properties of
the sum-frequency generated (SFG) radiation. We demonstrate that the incoherent
component of the SFG spectrum is characterized by a skewed cigar-shaped
geometry in space-time due to the compensation of spatial walk-off and
group-velocity mismatch between the fundamental and the generated SFG fields.
The results are illustrated both by a theoretical modeling of the optical
system and by experimental measurements.
","[{""version"":""v1"",""created"":""Sun, 11 Aug 2013 05:58:08 GMT""}]","2013-08-13"
