"1308.2221","Davood Momeni Dr","Adnan Aslam, Mubasher Jamil, Davood Momeni, Ratbay Myrzakulov, Muneer
  Ahmad Rashid, Muhammad Raza","Noether gauge symmetry approach in quintom cosmology","23 Pages, 4 Figures, Published in ""Astrophysics and Space Science""","Astrophys Space Sci (2013) 348:533-540","10.1007/s10509-013-1569-0",,"astro-ph.CO","http://arxiv.org/licenses/nonexclusive-distrib/1.0/","  In literature usual point like symmetries of the Lagrangian have been
introduced to study the symmetries and the structure of the fields. This kind
of Noether symmetry is a subclass of a more general family of symmetries,
called Noether Gauge Symmetries (NGS). Motivated by this mathematical tool, in
this article, we discuss the generalized Noether symmetry of Quintom model of
dark energy, which is a two component fluid model of quintessence and phantom
fields. Our model is a generalization of the Noether symmetries of a single and
multiple components which have been investigated in detail before. We found the
general form of the quintom potential in which the whole dynamical system has a
point like symmetry. We investigated different possible solutions of the system
for diverse family of gauge function. Specially, we discovered two family of
potentials, one corresponds to a free quintessence (phantom) and the second is
in the form of quadratic interaction between two components. These two families
of potential functions are proposed from the symmetry point of view, but in the
quintom models they are used as phenomenological models without clear
mathematical justification. From integrability point of view, we found two
forms of the scale factor: one is power law and second is de-Sitter. Some
cosmological implications of the solutions have been investigated
","[{""version"":""v1"",""created"":""Sun, 11 Aug 2013 08:30:52 GMT""}]","2013-11-08"
"1308.2325","David Rubin","David L. Rubin","CESR Test Accelerator",,,,,"physics.acc-ph","http://arxiv.org/licenses/nonexclusive-distrib/1.0/","  The Cornell Electron Storage Ring (CESR) was reconfigured in 2008 as a test
accelerator to investigate the physics of ultra-low emittance damping rings.
During the approximately 40 days/year available for dedicated operation as a
test accelerator, specialized instrumentation is used to measure growth and
mitigation of the electron cloud, emittance growth due to electron cloud,
intra-beam scattering, and ions, and single and multi-bunch instabilities
generated by collective effects. The flexibility of the CESR guide field optics
and the integration of accelerator modeling codes with the control system have
made possible an extraordinary range of experiments. Findings at CesrTA with
respect to electron cloud effects, emittance tuning techniques, and beam
instrumentation for measuring electron cloud, beam sizes, and beam positions
are the basis for much of the design of the ILC damping rings as documented in
the ILC-Technical Design Report. The program has allowed the Cornell group to
cultivate the kind of talent and expertise that will be absolutely essential to
the final engineering design, and commissioning of the damping rings for a
linear collider.
","[{""version"":""v1"",""created"":""Sat, 10 Aug 2013 17:04:28 GMT""}]","2013-08-13"
"1308.2326","Sergey Nadtochiy","Peter Carr and Sergey Nadtochiy","Local Variance Gamma and Explicit Calibration to Option Prices",,,,,"q-fin.PR math.AP math.PR","http://arxiv.org/licenses/nonexclusive-distrib/1.0/","  In some options markets (e.g. commodities), options are listed with only a
single maturity for each underlying. In others, (e.g. equities, currencies),
options are listed with multiple maturities. In this paper, we provide an
algorithm for calibrating a pure jump Markov martingale model to match the
market prices of European options of multiple strikes and maturities. This
algorithm only requires solutions of several one-dimensional root-search
problems, as well as application of elementary functions. We show how to
construct a time-homogeneous process which meets a single smile, and a
piecewise time-homogeneous process which can meet multiple smiles.
","[{""version"":""v1"",""created"":""Sat, 10 Aug 2013 17:44:18 GMT""},{""version"":""v2"",""created"":""Fri, 31 Jan 2014 16:08:20 GMT""}]","2014-02-03"
"1308.2327","Bakhrom Yavidov Ya","B. Ya. Yavidov","An effect of the uniaxial strain on the temperature of Bose-Einstein
  condensation of the intersite bipolarons","6 pages, 3 figures","Physica C, vol. 471, issues 3-4, pp. 71-76 (2011)","10.1016/j.physc.2010.12.008",,"cond-mat.str-el cond-mat.supr-con","http://arxiv.org/licenses/nonexclusive-distrib/1.0/","  We have studied an effect of uniaxial strain to the temperature of
Bose-Einstein condensation of intersite bipolarons within the framework of
Extended Holstein-Hubbard model. Uniaxial lattice strains are taken into an
account by introducing a generalized density-displacement type force for
electron-lattice interaction. Associating the superconducting critical
temperature $T_c$ with the temperature of Bose-Einstein condensation $T_{BEC}$
of intersite bipolarons we have calculated strain derivatives of $T_{BEC}$ and
satisfactorily explained the results of the experiments on La-based high-$T_c$
films.
","[{""version"":""v1"",""created"":""Sat, 10 Aug 2013 18:08:56 GMT""}]","2013-08-13"
"1308.2328","Christof Gattringer","Dmitri Diakonov, Victor Petrov, Hans-Peter Schadler and Christof
  Gattringer","Effective Lagrangian for the Polyakov line on a lattice","Comments and references added. Version to appear in JHEP",,"10.1007/JHEP11(2013)207",,"hep-lat hep-ph","http://arxiv.org/licenses/nonexclusive-distrib/1.0/","  We formulate a method for computing the effective Lagrangian of the Polyakov
line on the lattice. Using mean field approximation we calculate the effective
potential for high temperatures. The result agrees with recent lattice
simulations. We reveal a new type of ultraviolet divergence (coming from
longitudinal gluons) which dominates the effective potential and explains the
discrepancy of the lattice simulations and standard perturbative calculations
performed in covariant gauges.
","[{""version"":""v1"",""created"":""Sat, 10 Aug 2013 18:15:51 GMT""},{""version"":""v2"",""created"":""Mon, 25 Nov 2013 19:41:12 GMT""}]","2015-06-16"
"1308.2329","Maxwell Grazier G'Sell","Max Grazier G'Sell, Shai S. Shen-Orr, Robert Tibshirani","Sensitivity Analysis for Inference with Partially Identifiable
  Covariance Matrices","19 pages, 8 figures. Submitted to Computational Statistics",,,,"stat.ME","http://arxiv.org/licenses/nonexclusive-distrib/1.0/","  In some multivariate problems with missing data, pairs of variables exist
that are never observed together. For example, some modern biological tools can
produce data of this form. As a result of this structure, the covariance matrix
is only partially identifiable, and point estimation requires that identifying
assumptions be made. These assumptions can introduce an unknown and potentially
large bias into the inference. This paper presents a method based on
semidefinite programming for automatically quantifying this potential bias by
computing the range of possible equal-likelihood inferred values for convex
functions of the covariance matrix. We focus on the bias of missing value
imputation via conditional expectation and show that our method can give an
accurate assessment of the true error in cases where estimates based on
sampling uncertainty alone are overly optimistic.
","[{""version"":""v1"",""created"":""Sat, 10 Aug 2013 18:24:51 GMT""}]","2013-08-13"
"1308.2330","Bakhrom Yavidov Ya","B.Ya. Yavidov, Sh.S. Djumanov E. Karimboev","An approach for studying the influence of uniaxial strain (pressure) on
  the temperature of the Bose-Einstein condensation of intersite bipolarons:
  possible implementation for RBa$_2$Cu$_3$O$_{7-\delta}$ cuprates","18 pages, 3 figures","Physica B: Condensed Matter, volume 407, issue 13, pp.2490-2494
  (2012)","10.1016/j.physb.2012.03.051",,"cond-mat.str-el cond-mat.supr-con","http://arxiv.org/licenses/nonexclusive-distrib/1.0/","  A universal approach is proposed to study the influence of strain (pressure)
on the temperature of Bose-Einstein condensation of intersite bipolarons within
the extended Holstein model. It is shown that uniaxial strain (pressure)
derivatives of the temperature of such a Bose-Einstein condensation strongly
depend on the arrangement of ions in the lattice. In particular, they may be
positive or negative. A connection between the theoretically obtained results,
along with the experimental data, on the influence of uniaxial pressure
(strain) on $T_c$ of RBa$_2$Cu$_3$O$_{7-\delta}$ family cuprates is discussed.
","[{""version"":""v1"",""created"":""Sat, 10 Aug 2013 18:27:14 GMT""}]","2013-08-13"
"1308.2331","Bakhrom Yavidov Ya","B.Yavidov, A.Kurmantayev, D.Alimov, B.Kurbanbekov and Sh.Ramonkulov","Effect of screening of the electron-phonon interaction on the
  temperature of Bose-Einstein condensation of intersite bipolarons","6 pages, 4 figures","Eur. Phys. Jour. B, vol. 86, issue 7, p. 312 (2013)","10.1140/epjb/e2013-40037-0",,"cond-mat.str-el cond-mat.supr-con","http://arxiv.org/licenses/nonexclusive-distrib/1.0/","  Here we consider an interacting electron-phonon system within the framework
of extended Holstein-Hubbard model at strong enough electron-phonon interaction
limit in which (bi)polarons are the essential quasiparticles of the system. It
is assumed that the electron-phonon interaction is screened and its potential
has Yukawa-type analytical form. An effect of screening of the electron-phonon
interaction on the temperature of Bose-Einstein condensation of the intersite
bipolarons is studied for the first time. It is revealed that the temperature
of Bose-Einstein condensation of intersite bipolarons is higher in the system
with the more screened electron-phonon interaction.
","[{""version"":""v1"",""created"":""Sat, 10 Aug 2013 18:38:24 GMT""}]","2013-08-13"
"1308.2332","Alexander Sorin","P. Fre, A.S. Sorin","Inflation and Integrable one-field Cosmologies embedded in Rheonomic
  Supergravity","26 pages, LaTex, 3 eps figures; v3: misprints corrected",,"10.1002/prop.201300030",,"hep-th astro-ph.CO gr-qc hep-ph math-ph math.MP","http://arxiv.org/licenses/nonexclusive-distrib/1.0/","  In this paper we show that the new approach to the embedding of the
inflationary potentials into supergravity, presented in a quite recent paper
[11] of Ferrara, Kallosh, Linde and Porrati can be formulated within the
framework of standard matter coupled supergravity, without the use of the new
minimal auxiliary set and of conformal compensators. The only condition is the
existence of a translational Peccei Quinn isometry of the scalar Kahler
manifold. We suggest that this embedding strategy based on a nilpotent gauging
amounts to a profound Copernican Revolution. The properties of the inflaton
potential are encoded in the geometry of some homogeneous one-dimensional
Kahler manifolds that now should be regarded as the primary object, possibly
providing a link with microscopic physics. We present a simple and elegant
formula for the curvature of the Kahler manifold in terms of the potential.
Most relevant consequence of the new strategy is that all the integrable
potentials quite recently classified in a paper [7] that we have coauthored,
are automatically embedded into supergravity and their associated Kahler
manifolds demand urgent study. In particular one integrable potential that
provides the best fit to PLANCK data seems to have inspiring geometrical
properties deserving further study.
","[{""version"":""v1"",""created"":""Sat, 10 Aug 2013 18:57:50 GMT""},{""version"":""v2"",""created"":""Mon, 16 Sep 2013 10:37:28 GMT""},{""version"":""v3"",""created"":""Sat, 26 Oct 2013 09:17:15 GMT""}]","2016-01-20"
"1308.2333","Denis Khomitsky","D.V. Khomitsky, A.I. Malyshev, E.Ya. Sherman, and M. Di Ventra","Spin Chaos Manifestation in a Driven Quantum Billiard with Spin-Orbit
  Coupling","6 pages, 4 figures","Physical Review B 88, 195407 (2013)","10.1103/PhysRevB.88.195407",,"cond-mat.mes-hall nlin.CD quant-ph","http://arxiv.org/licenses/nonexclusive-distrib/1.0/","  The coupling of orbital and spin degrees of freedom is the source of many
interesting phenomena. Here, we study the electron dynamics in a quantum
billiard --a mesoscopic rectangular quantum dot-- with spin-orbit coupling
driven by a periodic electric field. We find that both the spatial and temporal
profiles of the observables demonstrate the transition to chaotic dynamics with
qualitative modifications of the power spectra and patterns of probability and
spin density. The time dependence of the wavefunctions and spin density
distributions indicates spin-charge separation {seen in the decay of the
spin-charge density correlators}. This new spin chaos effect can be
experimentally verified leading to a better understanding of the interplay
between spin and spatial degrees of freedom, relevant to fundamental and
applied quantum physics.
","[{""version"":""v1"",""created"":""Sat, 10 Aug 2013 19:06:17 GMT""},{""version"":""v2"",""created"":""Tue, 12 Nov 2013 17:42:24 GMT""}]","2013-11-13"
"1308.2334","Zhe Han","Han Zhe","Homotopy categories of injective modules over derived discrete algebras","19 pages",,,,"math.RT","http://arxiv.org/licenses/nonexclusive-distrib/1.0/","  We study the homotopy category $ K(\Inj A)$ of all injective modules over a
finite dimensional algebra $A$ with discrete derived category. We give a
classification of the indecomposable objects of $ K(\Inj A)$ for any radical
square zero self-injective algebra $A$. In particular, every indecomposable
object is endofinite.
","[{""version"":""v1"",""created"":""Sat, 10 Aug 2013 19:29:11 GMT""}]","2013-08-13"
"1308.2335","Joshua Ducey","Joshua E. Ducey, Deelan M. Jalil","Integer invariants of abelian Cayley graphs","8 pages. Many small changes, mostly to make references more precise
  and to explain notation and terminology. The biggest changes are to Section
  3, where we are now more careful with the statements of the theorems and
  their proofs",,,,"math.CO math.SP","http://arxiv.org/licenses/nonexclusive-distrib/1.0/","  Let $G$ be a finite abelian group, let $E$ be a subset of $G$, and form the
Cayley (directed) graph of $G$ with connecting set $E$. We explain how, for
various matrices associated to this graph, the spectrum can be used to give
information on the Smith normal form. This technique is applied to several
interesting examples, including matrices in the Bose-Mesner algebra of the
Hamming association scheme $H(n,q)$. We also recover results of Bai and
Jacobson-Niedermaier-Reiner on the critical group of a Cartesian product of
complete graphs.
","[{""version"":""v1"",""created"":""Sat, 10 Aug 2013 19:36:14 GMT""},{""version"":""v2"",""created"":""Thu, 12 Dec 2013 17:18:52 GMT""}]","2013-12-13"
"1308.2336","Zhe Han","Han Zhe","Generically trivial derived categories","10 pages",,,,"math.RT","http://arxiv.org/licenses/nonexclusive-distrib/1.0/","  We study generic objects in triangulated categories and characterize the
finite dimensional algebras $A$ such that the derived categories $D(\Mod A)$
are generically trivial. This is an analogue of a result of Crawley-Boevey for
module categories. As a consequence, we show that $D(\Mod A)$ is generically
trivial if and only if the category of perfect complexes $K^b(\proj A)$ is
locally finite.
","[{""version"":""v1"",""created"":""Sat, 10 Aug 2013 19:36:24 GMT""},{""version"":""v2"",""created"":""Tue, 2 Dec 2014 08:40:50 GMT""}]","2014-12-03"
"1308.2337","Simone Giombi","Simone Giombi, Igor R. Klebanov","One Loop Tests of Higher Spin AdS/CFT","20 pages. v3: minor corrections, version published in JHEP",,"10.1007/JHEP12(2013)068","PUTP-2451","hep-th","http://arxiv.org/licenses/nonexclusive-distrib/1.0/","  Vasiliev's type A higher spin theories in AdS4 have been conjectured to be
dual to the U(N) or O(N) singlet sectors in 3-d conformal field theories with
N-component scalar fields. We compare the O(N^0) correction to the 3-sphere
free energy F in the CFTs with corresponding calculations in the higher spin
theories. This requires evaluating a regularized sum over one loop vacuum
energies of an infinite set of massless higher spin gauge fields in Euclidean
AdS4. For the Vasiliev theory including fields of all integer spin and a scalar
with Delta=1 boundary condition, we show that the regularized sum vanishes.
This is in perfect agreement with the vanishing of subleading corrections to F
in the U(N) singlet sector of the theory of N free complex scalar fields. For
the minimal Vasiliev theory including fields of only even spin, the regularized
sum remarkably equals the value of F for one free real scalar field. This
result may agree with the O(N) singlet sector of the theory of N real scalar
fields, provided the coupling constant in the Vasiliev theory is identified as
G_N ~ 1/(N-1). Similarly, consideration of the USp(N) singlet sector for N
complex scalar fields, which we conjecture to be dual to the husp(2;0|4)
Vasiliev theory, requires G_N ~ 1/(N+1). We also test the higher spin AdS3/CFT2
conjectures by calculating the regularized sum over one loop vacuum energies of
higher spin fields in AdS3. We match the result with the O(N^0) term in the
central charge of the W_N minimal models; this requires a certain truncation of
the CFT operator spectrum so that the bulk theory contains two real scalar
fields with the same boundary conditions.
","[{""version"":""v1"",""created"":""Sat, 10 Aug 2013 19:42:23 GMT""},{""version"":""v2"",""created"":""Mon, 16 Sep 2013 17:24:59 GMT""},{""version"":""v3"",""created"":""Wed, 18 Dec 2013 02:26:20 GMT""}]","2015-06-16"
"1308.2338","Hongbo Si","Hongbo Si, O. Ozan Koyluoglu, and Sriram Vishwanath","Lossy Compression of Exponential and Laplacian Sources using Expansion
  Coding","8 pages, 3 figures",,,,"cs.IT math.IT","http://arxiv.org/licenses/nonexclusive-distrib/1.0/","  A general method of source coding over expansion is proposed in this paper,
which enables one to reduce the problem of compressing an analog
(continuous-valued source) to a set of much simpler problems, compressing
discrete sources. Specifically, the focus is on lossy compression of
exponential and Laplacian sources, which is subsequently expanded using a
finite alphabet prior to being quantized. Due to decomposability property of
such sources, the resulting random variables post expansion are independent and
discrete. Thus, each of the expanded levels corresponds to an independent
discrete source coding problem, and the original problem is reduced to coding
over these parallel sources with a total distortion constraint. Any feasible
solution to the optimization problem is an achievable rate distortion pair of
the original continuous-valued source compression problem. Although finding the
solution to this optimization problem at every distortion is hard, we show that
our expansion coding scheme presents a good solution in the low distrotion
regime. Further, by adopting low-complexity codes designed for discrete source
coding, the total coding complexity can be tractable in practice.
","[{""version"":""v1"",""created"":""Sat, 10 Aug 2013 19:55:23 GMT""}]","2013-08-13"
"1308.2339","Eugene Mishchenko","E. G. Mishchenko","Dipole-induced localized plasmon modes and resonant surface plasmon
  scattering","5 pages, 4 figures; final version","Phys. Rev. B 88, 115436 (2013)","10.1103/PhysRevB.88.115436",,"cond-mat.mes-hall","http://arxiv.org/licenses/nonexclusive-distrib/1.0/","  A metal film supports the continuum of propagating surface plasmon waves. The
interaction of these waves with a dipole (nanoparticle) positioned some
distance from the surface of the film can produce well defined localized
plasmon modes whose frequency nonetheless resides inside the continuum. This
leads to the resonant enhancement of scattering of surface plasmons off the
dipole. The maximum of scattering is found to occur when the distance from the
dipole to the surface of the film is equal to one half of the film thickness.
The possibility of controllable plasmon scattering could be advantageous for
the field of nanoplasmonics.
","[{""version"":""v1"",""created"":""Sat, 10 Aug 2013 20:33:56 GMT""},{""version"":""v2"",""created"":""Mon, 30 Sep 2013 20:32:30 GMT""}]","2013-10-02"
"1308.2340","Aaron Hill","Su Gao and Aaron Hill","A model for rank one measure preserving transformations",,,,,"math.DS math.LO","http://arxiv.org/licenses/nonexclusive-distrib/1.0/","  We define a model for rank one measure preserving transformations in the
sense of [2]. This is done by defining a new Polish topology on the space of
codes, which are infinite rank one words, for symbolic rank one systems. We
establish that this space of codes has the same generic dynamical properties as
the space of (rank one) measure preserving transformations on the unit
interval.
","[{""version"":""v1"",""created"":""Sat, 10 Aug 2013 20:50:17 GMT""}]","2013-08-14"
"1308.2341","Woo Seok Choi","Woo Seok Choi, Hyoungjeen Jeen, Jun Hee Lee, S. S. Ambrose Seo,
  Valentino R. Cooper, Karin M. Rabe, and Ho Nyung Lee","Reversal of the lattice structure in SrCoOx epitaxial thin films studied
  by real-time optical spectroscopy and first-principles calculations","18 pages, 5 figures, to be published in Phys. Rev. Lett","Phys Rev. Lett. 111, 097401 (2013)","10.1103/PhysRevLett.111.097401",,"cond-mat.str-el cond-mat.mtrl-sci","http://arxiv.org/licenses/nonexclusive-distrib/1.0/","  Using real-time spectroscopic ellipsometry, we directly observed a reversible
lattice and electronic structure evolution in SrCoOx (x = 2.5 - 3) epitaxial
thin films. Drastically different electronic ground states, which are extremely
susceptible to the oxygen content x, are found in the two topotactic phases,
i.e. the brownmillerite SrCoO2.5 and the perovskite SrCoO3. First principles
calculations confirmed substantial differences in the electronic structure,
including a metal-insulator transition, which originates from the modification
in the Co valence states and crystallographic structures. More interestingly,
the two phases can be reversibly controlled by changing the ambient pressure at
greatly reduced temperatures. Our finding provides an important pathway to
understanding the novel oxygen-content-dependent phase transition uniquely
found in multivalent transition metal oxides.
","[{""version"":""v1"",""created"":""Sat, 10 Aug 2013 21:13:57 GMT""}]","2013-08-29"
"1308.2342","Lauren McGough","Lauren McGough and Herman Verlinde","Bekenstein-Hawking Entropy as Topological Entanglement Entropy","15 pages, 3 figures; typos corrected, references added",,"10.1007/JHEP11(2013)208",,"hep-th","http://arxiv.org/licenses/nonexclusive-distrib/1.0/","  Black holes in 2+1 dimensions enjoy long range topological interactions
similar to those of non-abelian anyon excitations in a topologically ordered
medium. Using this observation, we compute the topological entanglement entropy
of BTZ black holes, via the established formula S_top = log(S^a_0), with S_b^a
the modular S-matrix of the Virasoro characters chi_a(tau). We find a precise
match with the Bekenstein-Hawking entropy. This result adds a new twist to the
relationship between quantum entanglement and the interior geometry of black
holes. We generalize our result to higher spin black holes, and again find a
detailed match. We comment on a possible alternative interpretation of our
result in terms of boundary entropy.
","[{""version"":""v1"",""created"":""Sat, 10 Aug 2013 21:24:43 GMT""},{""version"":""v2"",""created"":""Thu, 19 Sep 2013 20:25:02 GMT""}]","2015-06-16"
"1308.2343","Jiadong Zang","Lingyao Kong, and Jiadong Zang","Dynamics of an Insulating Skyrmion under a Temperature Gradient","7 pages, 5 figures","Phys. Rev. Lett. 111, 067203 (2013)","10.1103/PhysRevLett.111.067203",,"cond-mat.mes-hall cond-mat.str-el","http://arxiv.org/licenses/nonexclusive-distrib/1.0/","  We study the Skyrmion dynamics in thin films under a temperature gradient.
Our numerical simulations show that both single and multiple Skyrmions in a
crystal move towards the high temperature region, which is contrary to particle
diffusion. Noticing a similar effect in the domain wall motion, we employ a
theory based on magnon dynamics to explain this counterintuitive phenomenon.
Unlike the temperature driven domain wall motion, the Skyrmion's topological
charge plays an important role, and a transverse Skyrmion motion is observed.
Our theory turns out to be in agreement with numerical simulations, both
qualitatively and quantitatively. Our calculation indicated that a very
promising Skyrmion dynamic phenomenon can be observed in experiments.
","[{""version"":""v1"",""created"":""Sat, 10 Aug 2013 21:25:51 GMT""}]","2015-06-16"
