"1308.2367","Yoshiki Toba","Yoshiki Toba, Shinki Oyabu, Hideo Matsuhara, Matthew A. Malkan,
  Daisuke Ishihara, Takehiko Wada, Youichi Ohyama, Satoshi Takita, and Chisato
  Yamauchi","The 9 and 18 Micron Luminosity Function of Various Types of Galaxies
  with AKARI: Implication for the Dust Torus Structure of AGN","38 pages, 19 figures, and 7 tables, accepted for publication in PASJ",,"10.1093/pasj/65.5.113",,"astro-ph.CO","http://arxiv.org/licenses/nonexclusive-distrib/1.0/","  We present the 9 and 18 micron luminosity functions (LFs) of galaxies at
0.006 < z < 0.8 (with an average redshift of ~ 0.04) using the AKARI
mid-infrared all-sky survey catalog. We selected 243 galaxies at 9 micron and
255 galaxies at 18 micron from the Sloan Digital Sky Survey (SDSS) spectroscopy
region. These galaxies were then classified by their optical emission lines,
such as the line width of H_alpha or by their emission line ratios of
[OIII]/H_beta and [NII]/H_alpha into five types: Type 1 active galactic nuclei
(AGN) (Type 1); Type 2 AGN (Type 2); low-ionization narrow emission line
galaxies (LINER); galaxies with both star formation and narrow-line AGN
activity (composite galaxies); and star-forming galaxies (SF). We found that
(i) the number density ratio of Type 2 to Type 1 AGNs is 1.73 +/- 0.36, which
is larger than a result obtained from the optical LF and (ii) this ratio
decreases with increasing 18 micron luminosity.
","[{""version"":""v1"",""created"":""Sun, 11 Aug 2013 06:41:07 GMT""}]","2015-06-16"
"1308.2368","Akira Kamibeppu","Akira Kamibeppu","Bounds for the boxicity of Mycielski graphs","17 pages, 5 figures",,,,"math.CO math.MG","http://arxiv.org/licenses/nonexclusive-distrib/1.0/","  A box in Euclidean $k$-space is the Cartesian product $I_1\times I_2\times
\cdots \times I_k$, where $I_j$ is a closed interval on the real line. The
boxicity of a graph $G$, denoted by $\text{box}(G)$, is the minimum nonnegative
integer $k$ such that $G$ can be isomorphic to the intersection graph of a
family of boxes in Euclidean $k$-space. Mycielski introduced an interesting
graph operation that extends a graph $G$ to a new graph $M(G)$, called the
Mycielski graph of $G$. In this paper, we observe behavior of the boxicity of
Mycielski graphs. The inequality $\text{box}(M(G))\geq \text{box}(G)$ holds for
a graph $G$, and hence we are interested in whether the boxicity of the
Mycielski graph of $G$ is more than that of $G$ or not. Here we give bounds for
the boxicity of Mycielski graphs: for a graph $G$ with $l$ universal vertices,
the inequalities $\text{box}(G)+\left \lceil \frac{l}{2}\right \rceil \leq
\text{box}(M(G))\leq \theta (\overline{G})+\left\lceil \frac{l}{2}\right\rceil
+1$ hold, where $\theta (\overline{G})$ is the edge clique cover number of the
complement $\overline{G}$. Further observations determine the boxicity of the
Mycielski graph $M(G)$, if $G$ has no universal vertices or odd universal
vertices and satisfies $\text{box}(G)=\theta (\overline{G})$. We also present
relations between the Mycielski graph $M(G)$ and its analogous ones $M_3(G)$
and $M_r(G)$ in the context of boxicity, which will encourage us to calculate
the boxicity of $M(G)$ or $M_3(G)$.
","[{""version"":""v1"",""created"":""Sun, 11 Aug 2013 07:17:00 GMT""},{""version"":""v2"",""created"":""Fri, 6 Sep 2013 08:43:47 GMT""},{""version"":""v3"",""created"":""Sun, 16 Feb 2014 03:25:24 GMT""},{""version"":""v4"",""created"":""Wed, 26 Feb 2014 06:10:48 GMT""},{""version"":""v5"",""created"":""Tue, 4 Mar 2014 05:57:28 GMT""},{""version"":""v6"",""created"":""Tue, 11 Mar 2014 14:20:59 GMT""},{""version"":""v7"",""created"":""Thu, 13 Mar 2014 11:09:18 GMT""},{""version"":""v8"",""created"":""Wed, 5 Aug 2015 09:48:36 GMT""}]","2015-08-06"
"1308.2369","Mustafa Hajij","Mustafa Hajij","The tail of a quantum spin network","34 Pages, 19 figures",,,,"math.GT math.CO math.NT","http://arxiv.org/licenses/nonexclusive-distrib/1.0/","  The tail of a sequence $\{P_n(q)\}_{n \in \mathbb{N}}$ of formal power series
in $\mathbb{Z}[[q]]$ is the formal power series whose first $n$ coefficients
agree up to a common sign with the first $n$ coefficients of $P_n$. This paper
studies the tail of a sequence of admissible trivalent graphs with edges
colored $n$ or $2n$. We use local skein relations to understand and compute the
tail of these graphs. We also give product formulas for the tail of such
trivalent graphs. Furthermore, we show that our skein theoretic techniques
naturally lead to a proof for the Andrews-Gordon identities for the two
variable Ramanujan theta function as well to corresponding identities for the
false theta function.
","[{""version"":""v1"",""created"":""Sun, 11 Aug 2013 07:23:16 GMT""},{""version"":""v2"",""created"":""Thu, 24 Oct 2013 00:24:50 GMT""},{""version"":""v3"",""created"":""Wed, 14 May 2014 14:39:47 GMT""},{""version"":""v4"",""created"":""Mon, 1 Sep 2014 09:45:54 GMT""}]","2014-09-02"
"1308.2370","Wojciech Broniowski","Wojciech Broniowski, Piotr Bozek","Flow in p-Pb collisions at the LHC","5 pages, presented at Excited QCD 2013, 3-9 February 2013, Bjelasnica
  Mountain, Sarajevo",,,,"nucl-th nucl-ex","http://arxiv.org/licenses/nonexclusive-distrib/1.0/","  We present the predictions of a hydrodynamic model for the flow observables
recently measured in the highest-multiplicity p+Pb collisions at the LHC. We
focus o the ridge phenomenon, which provides an important probe of the
long-range dynamics and may be used to support the collective interpretation of
the p+A data.
","[{""version"":""v1"",""created"":""Sun, 11 Aug 2013 07:26:53 GMT""}]","2013-08-13"
"1308.2371","Yao Sun","Yao Sun","Signature-Based Gr\""obner Basis Algorithms --- Extended MMM Algorithm
  for computing Gr\""obner bases",,,,,"cs.SC","http://arxiv.org/licenses/nonexclusive-distrib/1.0/","  Signature-based algorithms is a popular kind of algorithms for computing
Gr\""obner bases, and many related papers have been published recently. In this
paper, no new signature-based algorithms and no new proofs are presented.
Instead, a view of signature-based algorithms is given, that is,
signature-based algorithms can be regarded as an extended version of the famous
MMM algorithm. By this view, this paper aims to give an easier way to
understand signature-based Gr\""obner basis algorithms.
","[{""version"":""v1"",""created"":""Sun, 11 Aug 2013 07:35:14 GMT""}]","2013-08-13"
"1308.2372","Seyed Pooya Shariatpanahi Dr.","Seyed Pooya Shariatpanahi, Hamed Shah-Mansouri, Babak Hossein Khalaj","Throughput of One-Hop Wireless Networks with Noisy Feedback Channel","6 pages, 1 figure, conference",,,,"cs.IT math.IT","http://arxiv.org/licenses/nonexclusive-distrib/1.0/","  In this paper, we consider the effect of feedback channel error on the
throughput of one-hop wireless networks under the random connection model. The
transmission strategy is based on activating source-destination pairs with
strongest direct links. While these activated pairs are identified based on
Channel State Information (CSI) at the receive side, the transmit side will be
provided with a noisy version of this information via the feedback channel.
Such error will degrade network throughput, as we investigate in this paper.
Our results show that if the feedback error probability is below a given
threshold, network can tolerate such error without any significant throughput
loss. The threshold value depends on the number of nodes in the network and the
channel fading distribution. Such analysis is crucial in design of error
correction codes for feedback channel in such networks.
","[{""version"":""v1"",""created"":""Sun, 11 Aug 2013 07:52:40 GMT""}]","2013-08-13"
"1308.2373","Fulvio Ricci","Paolo Ciatti, Michael G. Cowling, Fulvio Ricci","Hardy and uncertainty inequalities on stratified Lie groups","19 pages",,,,"math.FA","http://arxiv.org/licenses/nonexclusive-distrib/1.0/","  We prove various Hardy-type and uncertainty inequalities on a stratified Lie
group $G$. In particular, we show that the operators $T_\alpha: f \mapsto
|.|^{-\alpha} L^{-\alpha/2} f$, where $|.|$ is a homogeneous norm, $0 < \alpha
< Q/p$, and $L$ is the sub-Laplacian, are bounded on the Lebesgue space
$L^p(G)$. As consequences, we estimate the norms of these operators
sufficiently precisely to be able to differentiate and prove a logarithmic
uncertainty inequality. We also deduce a general version of the
Heisenberg-Pauli-Weyl inequality, relating the $L^p$ norm of a function $f$ to
the $L^q$ norm of $|.|^\beta f$ and the $L^r$ norm of $L^{\delta/2} f$.
","[{""version"":""v1"",""created"":""Sun, 11 Aug 2013 08:11:39 GMT""}]","2013-08-13"
"1308.2374","Giovanni Catino","Giovanni Catino and Carlo Mantegazza and Lorenzo Mazzieri","Locally conformally flat ancient Ricci flows","Final version, to appear on Anal. PDE","Anal. PDE 8 (2015) 365-371","10.2140/apde.2015.8.365",,"math.DG","http://arxiv.org/licenses/nonexclusive-distrib/1.0/","  We show that any locally conformally flat ancient solution to the Ricci flow
must be rotationally symmetric. As a by-product, we prove that any locally
conformally flat Ricci soliton is a gradient soliton in the shrinking and
steady cases as well as in the expanding case, provided the soliton has
nonnegative curvature.
","[{""version"":""v1"",""created"":""Sun, 11 Aug 2013 08:16:22 GMT""},{""version"":""v2"",""created"":""Thu, 15 Aug 2013 18:58:21 GMT""},{""version"":""v3"",""created"":""Fri, 16 Aug 2013 17:39:09 GMT""},{""version"":""v4"",""created"":""Tue, 1 Oct 2013 15:14:12 GMT""},{""version"":""v5"",""created"":""Wed, 11 Feb 2015 11:18:06 GMT""}]","2016-01-20"
"1308.2375","Christian Napoli","Francesco Bonanno, Giacomo Capizzi, Christian Napoli, Giorgio Graditi,
  Giuseppe Marco Tina","A radial basis function neural network based approach for the electrical
  characteristics estimation of a photovoltaic module",,"F. Bonanno, G. Capizzi, G. Graditi, C. Napoli, G.M. Tina, Applied
  Energy, Vol. 97, pp. 956-961 (2012)","10.1016/j.apenergy.2011.12.085",,"cs.NE","http://arxiv.org/licenses/nonexclusive-distrib/1.0/","  The design process of photovoltaic (PV) modules can be greatly enhanced by
using advanced and accurate models in order to predict accurately their
electrical output behavior. The main aim of this paper is to investigate the
application of an advanced neural network based model of a module to improve
the accuracy of the predicted output I--V and P--V curves and to keep in
account the change of all the parameters at different operating conditions.
Radial basis function neural networks (RBFNN) are here utilized to predict the
output characteristic of a commercial PV module, by reading only the data of
solar irradiation and temperature. A lot of available experimental data were
used for the training of the RBFNN, and a backpropagation algorithm was
employed. Simulation and experimental validation is reported.
","[{""version"":""v1"",""created"":""Sun, 11 Aug 2013 08:17:35 GMT""}]","2013-08-13"
"1308.2376","Shiqing Zhang","Xiang Yu and Shiqing Zhang","Saari's Conjecture for Elliptical Type $N$-Body Problem and An
  Application","arXiv admin note: substantial text overlap with arXiv:1306.1047; and
  text overlap with arXiv:0909.4991 by other authors",,,,"math-ph math.MP","http://creativecommons.org/licenses/by/3.0/","  By using an arithmetic fact, we will firstly prove Saari's conjecture in a
particular case, which is called the Elliptical Type N-Body Problem, and then
we apply it to prove that the variational minimal solution of the planar
Newtonian N-body problem is precisely a relative equilibrium solution whose
configuration minimizes the function $IU^2$, it's worth noticing that we don't
need the hypothesis of Finiteness of Central Configurations. In the Planetary
Restricted Problem (which ignore all the mutual gravitational interactions
between the planets), the corresponding Saari's conjecture is stated and
proved.
","[{""version"":""v1"",""created"":""Sun, 11 Aug 2013 08:49:26 GMT""},{""version"":""v2"",""created"":""Mon, 18 Nov 2013 13:00:47 GMT""}]","2013-11-19"
"1308.2377","Cecilia Clivati","Claudio Calosso, Elio K. Bertacco, Davide Calonico, Cecilia Clivati,
  Giovanni A. Costanzo, Matteo Frittelli, Filippo Levi, Alberto Mura, Aldo
  Godone","Frequency transfer via a two-way optical phase comparison on a
  multiplexed fiber network",,"Opt. Lett. 39, p. 1177-1180 (2013)","10.1364/OL.39.001177",,"physics.optics","http://arxiv.org/licenses/nonexclusive-distrib/1.0/","  We performed a two-way remote optical phase comparison on optical fiber. Two
optical frequency signals were launched in opposite directions in an optical
fiber and their phases were simultaneously measured at the other end. In this
technique, the fiber noise was passively cancelled, and we compared two optical
frequencies at the ultimate 1E-21 stability level. The experiment was performed
on a 47 km fiber that is part of the metropolitan network for Internet traffic.
The technique relies on the synchronous measurement of the optical phases at
the two ends of the link, that is made possible by the use of digital
electronics. This scheme offers several advantages with respect to active noise
cancellation, and can be upgraded to perform more complex tasks.
","[{""version"":""v1"",""created"":""Sun, 11 Aug 2013 09:33:05 GMT""},{""version"":""v2"",""created"":""Fri, 25 Oct 2013 08:36:54 GMT""},{""version"":""v3"",""created"":""Tue, 1 Jul 2014 16:34:00 GMT""}]","2015-06-16"
"1308.2378","Yaacov Kraus","Yaacov E. Kraus, Zohar Ringel and Oded Zilberberg","Comment on ""Topological equivalence of crystal and quasicrystal band
  structures""","3 pages",,,,"cond-mat.mes-hall cond-mat.str-el","http://arxiv.org/licenses/nonexclusive-distrib/1.0/","  Madsen et al. [arXiv:1307.2577] claim that one-dimensional insulating
crystals and one-dimensional insulating quasicrystals are topologically
equivalent and, thus, trivial. In this comment, we clarify that in topological
classification of one-dimensional systems, quasiperiodicity plays a role
similar to that of a symmetry. Hence, periodic systems are out of the
quasiperiodic topological space, and the equivalence between quasicrystals and
crystals becomes immaterial.
","[{""version"":""v1"",""created"":""Sun, 11 Aug 2013 09:55:36 GMT""}]","2013-08-13"
"1308.2379","Hendrik S\""uss","Hendrik S\""u{\ss}","Fano threefolds with 2-torus action - a picture book","26 pages, 44 figures; includes a correction to the published version","Documenta Mathematica, 19 (2014), pages 905-940",,,"math.AG","http://arxiv.org/licenses/nonexclusive-distrib/1.0/","  Following the work of Altmann and Hausen we give a combinatorial description
in terms for smooth Fano threefolds admitting a 2-torus action. We show that a
whole variety of properties and invariants can be read off from this
description. As an application we prove and disprove the existence of
Kahler-Einstein metrics for some of these Fano threefolds, calculate their Cox
rings and some of their toric canonical degenerations.
","[{""version"":""v1"",""created"":""Sun, 11 Aug 2013 11:14:26 GMT""},{""version"":""v2"",""created"":""Wed, 10 Oct 2018 08:18:38 GMT""}]","2018-10-11"
"1308.2380","Maksim Kouza M","Maksim Kouza","Numerical Simulation of Folding and Unfolding of Proteins","PhD thesis by Maksim Kouza defended at Institute of Physics Polish
  Academy of Sciences in 2009 (supervisor Prof. Mai Suan Li) 123 pages, 55
  figures, 6 tables. arXiv admin note: text overlap with arXiv:cond-mat/9706125
  by other authors",,,,"physics.bio-ph q-bio.BM","http://arxiv.org/licenses/nonexclusive-distrib/1.0/","  The thesis examines in detail the folding and unfolding processes of a number
of proteins including hbSBD, DDLNF4, single and multi Ubiquitin. Using
simplified coarse-grained off-lattice Go model and CD experiments we have shown
the two-state behavior of hbSBD protein. It was shown that refolding pathways
of single Ubiquitin depend on what end is anchored to the surface. Namely, the
fixation of the N-terminal changes refolding pathways but anchoring the
C-terminal leaves them unchanged. Interestingly, the end fixation has no effect
on multi-domain Ubiquitin. Using the Go modeling and all-atom models with
explicit water, we have studied the mechanical unfolding mechanism of DDFLN4 in
detail. We predict that, contrary to the AFM experiments, an additional
unfolding peak would occur at the end-to-end $\Delta R \approx 1.5 $nm in the
force-extension curve. Our study reveals the important role of non-native
interactions which are responsible for a peak located at $\Delta R \approx 22
$nm. This peak can not be encountered by the Go models in which the non-native
interactions are neglected. Our finding may stimulate further experimental and
theoretical studies on this protein. The cooperativity of denaturation
transition was investigated using lattice and off-latice models. Our studies
reveal that the sharpness of the transition enhances as the number of amino
acids grows. The corresponding scaling behavior is governed by an universal
critical exponent. A new force replica exchange (RE) method was developed for
efficient configuration sampling of biomolecules pulled by an external
mechanical force. Contrary to the standard temperature RE, the exchange is
carried out between different forces (replicas). Our method was successfully
applied to study thermodynamics of a three-domain Ubiquitin.
","[{""version"":""v1"",""created"":""Sun, 11 Aug 2013 11:15:47 GMT""}]","2013-08-13"
"1308.2381","Xing-Gang Wu","Xu-Chang Zheng, Xing-Gang Wu, Sheng-Quan Wang, Jian-Ming Shen,
  Qiong-Lian Zhang","Reanalysis of the BFKL Pomeron at the next-to-leading logarithmic
  accuracy","18 pages, 6 figures. References updated and discussions improved","JHEP 1310 (2013) 117","10.1007/JHEP10(2013)117",,"hep-ph","http://arxiv.org/licenses/nonexclusive-distrib/1.0/","  We apply the principle of maximum conformality (PMC) to the
Balitsky-Fadin-Kuraev-Lipatov (BFKL) Pomeron intercept at the next-to-leading
logarithmic (NLL) accuracy. The PMC eliminates the conventional renormalization
scale ambiguity by absorbing the non-conformal $\{\beta_i\}$-terms into the
running coupling, and a more accurate pQCD estimation can be obtained. After
PMC scale setting, the QCD perturbative convergence can be greatly improved due
to the elimination of renormalon terms in pQCD series, and the BFKL Pomeron
intercept has a weak dependence on the virtuality of the reggeized gluon. For
example, by taking the Fried-Yennie gauge, we obtain $\omega_{\rm MOM}^{\rm
PMC}(Q^{2},0)\in [0.149,0.176]$ for $Q^2\in[1,100]\;{\rm GeV}^2$. This is a
good property to apply to the high-energy phenomenology. Further more, to
compare with the data, it is found that the physical ${\rm MOM}$-scheme is more
reliable than the $\overline{\rm MS}$-scheme. The ${\rm MOM}$-scheme is gauge
dependent, which can also be greatly suppressed after PMC scale setting. We
discuss the MOM-scheme gauge dependence for the Pomeron intercept by adopting
three gauges, i.e. the Landau gauge, the Feynman gauge and the Fried-Yennie
gauge, and we obtain $\omega_{\rm MOM}^{\rm PMC}(Q^{2}=15\;{\rm GeV}^2,0) =
0.166^{+0.010}_{-0.017}$; i.e. about $10\%$ gauge dependence is observed. We
apply the BFKL Pomeron intercept to the photon-photon collision process, and
compare the theoretical predictions with the data from the OPAL and L3
experiments.
","[{""version"":""v1"",""created"":""Sun, 11 Aug 2013 11:17:26 GMT""},{""version"":""v2"",""created"":""Thu, 12 Sep 2013 02:43:48 GMT""}]","2013-10-31"
"1308.2382","Paul Gough Prof","Michael Paul Gough","A Dynamic Dark Information Energy Consistent with Planck Data","15 pages, 3 figures, 2 tables",,"10.3390/e16041902",,"astro-ph.CO","http://arxiv.org/licenses/nonexclusive-distrib/1.0/","  The 2013 cosmology results from the European Space Agency Planck spacecraft
provide new limits to the dark energy equation of state parameter. Here we show
that Holographic Dark Information Energy (HDIE), a dynamic dark energy model,
achieves an optimal fit to the published datasets where Planck data is combined
with other astrophysical measurements. HDIE uses Landauer's principle to
account for dark energy by the energy equivalent of information, or entropy, of
stellar heated gas and dust. Combining Landauer's principle with the
Holographic principle yields an equation of state parameter determined solely
by star formation history, effectively solving the 'cosmic coincidence
problem'. While HDIE mimics a cosmological constant at low red-shifts, z<1, the
small difference from a cosmological constant expected at higher red-shifts
will only be resolved by the next generation of dark energy instrumentation.
The HDIE model is shown to provide a viable alternative to the main
cosmological constant/vacuum energy and scalar field/quintessence explanations.
","[{""version"":""v1"",""created"":""Sun, 11 Aug 2013 11:21:28 GMT""},{""version"":""v2"",""created"":""Tue, 27 Aug 2013 11:12:21 GMT""},{""version"":""v3"",""created"":""Sun, 16 Feb 2014 18:04:33 GMT""}]","2015-06-16"
"1308.2383","Shahram Jalalzadeh","M. Hashemi, S. Jalalzadeh and S. Vasheghani Farahani","Hawking temperature and the emergent cosmic space","9 pages, many improvements, to appear in Gen. Relativ. Gravit",,,,"gr-qc hep-th","http://arxiv.org/licenses/nonexclusive-distrib/1.0/","  The aim of this work is to model the evolution of the cosmic space based on
thermodynamical parameters. The universe is considered to have an apparent
horizon radius with a Kodama-Hayward temperature assigned to it. The method is
founded on the fact proposed by Padmanabhan [1,2] that the subtraction of the
surface and bulk degrees of freedom provides information on the cosmic space
emergence. The fact of the matter is that in this approach the Raychaudhuri
equation could even be obtained by the consideration of only thermodynamical
parameters. As such, the standard general relativity is taken as the starting
point where by implementing the standard cosmological equations we obtain a
generalized evolutionary equation supporting emergence of the cosmic space. The
method proposed in this work would provide basis for other cosmological models
to have an emergent perspective.
","[{""version"":""v1"",""created"":""Sun, 11 Aug 2013 11:49:07 GMT""},{""version"":""v2"",""created"":""Sun, 29 Mar 2015 19:49:15 GMT""}]","2015-03-31"
"1308.2384","Christian Wiesendanger","C. Wiesendanger","A Renormalizable Theory of Quantum Gravity: Renormalization Proof of the
  Gauge Theory of Volume Preserving Diffeomorphisms","37 pages",,"10.4236/jmp.2014.510099",,"math-ph gr-qc hep-th math.MP","http://arxiv.org/licenses/nonexclusive-distrib/1.0/","  Inertial and gravitational mass or energy-momentum need not be the same for
virtual quantum states. Separating their roles naturally leads to the gauge
theory of volume-preserving diffeomorphisms of an inner four-dimensional space.
The gauge-fixed action and the path integral measure occurring in the
generating functional for the quantum Green functions of the theory are shown
to obey a BRST-type symmetry. The related Zinn-Justin-type equation restricting
the corresponding quantum effective action is established. This equation limits
the infinite parts of the quantum effective action to have the same form as the
gauge-fixed Lagrangian of the theory proving its spacetime renormalizability.
The inner space integrals occurring in the quantum effective action which are
divergent due to the gauge group's infinite volume are shown to be
regularizable in a way consistent with the symmetries of the theory
demonstrating as a byproduct that viable quantum gauge field theories are not
limited to finite-dimensional compact gauge groups as is commonly assumed.
","[{""version"":""v1"",""created"":""Sun, 11 Aug 2013 11:59:24 GMT""},{""version"":""v2"",""created"":""Thu, 10 Oct 2013 14:18:26 GMT""},{""version"":""v3"",""created"":""Sun, 23 Mar 2014 16:15:59 GMT""}]","2015-06-16"
"1308.2385","Christian Wiesendanger","C. Wiesendanger","General Relativity as the Classical Limit of the Renormalizable Gauge
  Theory of Volume Preserving Diffeomorphisms","16 pages",,"10.4236/jmp.2014.510098",,"gr-qc hep-th math-ph math.MP","http://arxiv.org/licenses/nonexclusive-distrib/1.0/","  The different roles and natures of spacetime appearing in a quantum field
theory and in classical physics are analyzed implying that a quantum theory of
gravitation is not necessarily a quantum theory of curved spacetime. Developing
an alternative approach to quantum gravity starts with the postulate that
inertial and gravitational energy-momentum need not be the same for virtual
quantum states. Separating their roles naturally leads to the quantum gauge
field theory of volume-preserving diffeomorphisms of an inner four-dimensional
space. The classical limit of this theory coupled to a quantized scalar field
is derived for an on-shell particle where inertial and gravitational
energy-momentum coincide. In that process the symmetry under volume-preserving
diffeomorphisms disappears and a new symmetry group emerges: the group of
coordinate transformations of four-dimensional spacetime and with it General
Relativity coupled to a classical relativistic point particle.
","[{""version"":""v1"",""created"":""Sun, 11 Aug 2013 12:10:16 GMT""},{""version"":""v2"",""created"":""Thu, 10 Oct 2013 14:14:39 GMT""}]","2015-06-16"
