"1308.5362","Danhua Wang","Danhua Wang, Alejandro B. Aceves","Modulation theory in PT-Symmetric Magnetic Metamaterial Arrays in the
  continuum limit",,"Phys. Rev. A 88, 043831: 1--7, 2013","10.1103/PhysRevA.88.043831",,"physics.optics","http://arxiv.org/licenses/nonexclusive-distrib/1.0/","  We present results on the dynamics of split-ring dimers having both gain and
loss in one dimensional nonlinear parity-time- (PT-)symmetric magnetic
metamaterials. For the longwave (continuum) limit approximation and in the
weakly nonlinear limit, we show analytic results on the existence of gap
soliton solutions and on symmetry breaking phenomenon at a critical value of
the gain/loss term.
","[{""version"":""v1"",""created"":""Sat, 24 Aug 2013 21:35:34 GMT""},{""version"":""v2"",""created"":""Fri, 18 Oct 2013 20:54:32 GMT""}]","2013-10-22"
"1308.5363","Fedor Soloviev","Boris Khesin, Fedor Soloviev","The geometry of dented pentagram maps","32 pages, 9 figures, Section 2.3 on dimensions of invariant tori in
  3D is updated. To appear in JEMS",,,,"math.DS math.SG nlin.SI","http://arxiv.org/licenses/nonexclusive-distrib/1.0/","  We propose a new family of natural generalizations of the pentagram map from
2D to higher dimensions and prove their integrability on generic twisted and
closed polygons. In dimension $d$ there are $d-1$ such generalizations called
dented pentagram maps, and we describe their geometry, continuous limit, and
Lax representations with a spectral parameter. We prove algebraic-geometric
integrability of the dented pentagram maps in the 3D case and compare the
dimensions of invariant tori for the dented maps with those for the higher
pentagram maps constructed with the help of short diagonal hyperplanes. When
restricted to corrugated polygons, the dented pentagram maps coincide between
themselves and with the corresponding corrugated pentagram map. Finally, we
prove integrability for a variety of pentagram maps for generic and partially
corrugated polygons in higher dimensions.
","[{""version"":""v1"",""created"":""Sat, 24 Aug 2013 21:39:19 GMT""},{""version"":""v2"",""created"":""Sun, 2 Mar 2014 22:35:13 GMT""},{""version"":""v3"",""created"":""Mon, 8 Dec 2014 01:30:16 GMT""}]","2014-12-09"
"1308.5364","Hoda Farahani","J. Sadeghi, M. Khurshudyan, M. Hakobyan and H. Farahani","Phenomenological Fluids from Interacting Tachyonic Scalar Fields","12 pages","Int. J. Theor. Phys. 53 (2014) 2246","10.1007/s10773-014-2025-9",,"gr-qc","http://arxiv.org/licenses/nonexclusive-distrib/1.0/","  In this paper we are interested to consider mathematical ways to obtain
different phenomenological fluids from two-component Tachyonic scalar fields.
We consider interaction between components and investigate problem numerically.
Statefinder diagnostics and validity of the generalized second law of
thermodynamics performed and checked. We suppose that our Universe bounded by
Hubble horizon.
","[{""version"":""v1"",""created"":""Sat, 24 Aug 2013 22:13:54 GMT""}]","2014-07-10"
"1308.5365","Shweta Bansal","Eric Mooring and Shweta Bansal","Increasing Herd Immunity with Influenza Revaccination",,,,,"q-bio.PE","http://creativecommons.org/licenses/by-nc-sa/3.0/","  Seasonal influenza is a significant public health concern in the United
States and globally. While influenza vaccines are the single most effective
intervention to reduce influenza morbidity and mortality, there is considerable
debate surrounding the merits and consequences of repeated seasonal
vaccination. Here, we describe a two-season influenza epidemic contact network
model and use it to demonstrate that increasing the level of continuity in
vaccination across seasons reduces the burden on public health. We show that
revaccination reduces the influenza attack rate not only because it reduces the
overall number of susceptible individuals, but also because it better protects
highly-connected individuals, who would otherwise make a disproportionately
large contribution to influenza transmission. Our work thus contributes a
population-level perspective to debates about the merits of repeated influenza
vaccination and advocates for public health policy to incorporate individual
vaccine histories.
","[{""version"":""v1"",""created"":""Sat, 24 Aug 2013 22:40:07 GMT""},{""version"":""v2"",""created"":""Tue, 6 Jan 2015 02:13:01 GMT""}]","2015-01-07"
"1308.5366","Bang-Yen Chen","Bang-Yen Chen","Classification of spherical Lagrangian submanifolds in complex Euclidean
  spaces","11 pages",,,,"math.DG","http://arxiv.org/licenses/nonexclusive-distrib/1.0/","  An isometric immersion $f:M^n\to \tilde M^n$ from a Riemannian $n$-manifold
$M^n$ into a K\""ahler $n$-manifold $\tilde M^n$ is called {\it Lagrangian} if
the complex structure $J$ of the ambient manifold $\tilde M^n$ interchanges
each tangent space of $M^n$ with the corresponding normal space. In this paper,
we completely classify spherical Lagrangian submanifolds in complex Euclidean
spaces. Furthermore, we also provide two corresponding classification theorems
for Lagrangian submanifolds in the complex pseudo-Euclidean spaces with
arbitrary complex index.
","[{""version"":""v1"",""created"":""Sun, 25 Aug 2013 00:03:03 GMT""}]","2013-08-27"
"1308.5367","Xu Zhiping","Ning Wei and Zhiping Xu","Breakdown of Fast Water Transport in Graphene Oxides",,"Physical Review E 89 (1), 012113 (2014)","10.1103/PhysRevE.89.012113",,"cond-mat.mes-hall cond-mat.stat-mech","http://arxiv.org/licenses/nonexclusive-distrib/1.0/","  Fast slip flow was reported for water inside the interlayer gallery between
graphene layers or carbon nanotubes. We report here that this flow rate
enhancement (over two orders) breaks down with the presence of chemical
functionalization and relaxation of the nanoconfinement in graphene oxides.
Molecular dynamics simulation results show that hydrodynamics applies in this
circumstance, even at length scales down to nanometers. However, corrections on
the slip boundary condition and viscosity of nanoconfined flow must be included
to make quantitative predictions. These results were discussed with structural
characteristics of the liquid water and hydrogen bond networks.
","[{""version"":""v1"",""created"":""Sun, 25 Aug 2013 00:27:34 GMT""}]","2014-06-05"
"1308.5368","Xu Zhiping","Yilun Liu and Zhiping Xu","Enhancing Graphene-derived Materials through Multimodal and
  Self-healable Interfaces",,,,,"cond-mat.mtrl-sci cond-mat.soft","http://arxiv.org/licenses/nonexclusive-distrib/1.0/","  Recent studies have shown that graphene-derived materials not only feature
outstandingly multifunctional properties, but also act as model materials to
implant nanoscale structural engineering insights into their macroscopic
performance optimization. Functionalizing the interfaces between graphene
sheets by interlayer crosslinks has been proven to be an effective route to
tune the mechanical properties. Here we explore the graphene-derived material
with a layer-by-layer structure and multiple crosslinking mechanisms. The
effects of multimodal and self-healable crosslinks are assessed in terms of
interlayer loading transfer capability. The results show that the
brick-and-motar hierarchy and synergetic effects from different crosslinks
enable synergetic enhancement in the strength and toughness. The findings here
could shed light on the development of high-performance paper-, fiber- or
film-like macroscopic materials from monolayer nanosheets with nanoengineerable
interfaces.
","[{""version"":""v1"",""created"":""Sun, 25 Aug 2013 00:31:09 GMT""}]","2013-08-27"
"1308.5369","Quan Yuan","Quan Yuan and George Yin","Analyzing Convergence and Rates of Convergence of Particle Swarm
  Optimization Algorithms Using Stochastic Approximation Methods","This paper has been accepted by IEEE Transactions on Automatic
  Control and will appear in July, 2015. The title has been changed from
  ""Particle Swarm Optimization: A Stochastic Approximation Approach"" to
  ""Analyzing Convergence and Rates of Convergence of Particle Swarm
  Optimization Algorithms Using Stochastic Approximation Methods""",,"10.1109/TAC.2014.2381454",,"math.OC","http://arxiv.org/licenses/nonexclusive-distrib/1.0/","  Recently, much progress has been made on particle swarm optimization (PSO). A
number of works have been devoted to analyzing the convergence of the
underlying algorithms. Nevertheless, in most cases, rather simplified
hypotheses are used. For example, it often assumes that the swarm has only one
particle. In addition, more often than not, the variables and the points of
attraction are assumed to remain constant throughout the optimization process.
In reality, such assumptions are often violated. Moreover, there are no
rigorous rates of convergence results available to date for the particle swarm,
to the best of our knowledge. In this paper, we consider a general form of PSO
algorithms, and analyze asymptotic properties of the algorithms using
stochastic approximation methods. We introduce four coefficients and rewrite
the PSO procedure as a stochastic approximation type iterative algorithm. Then
we analyze its convergence using weak convergence method. It is proved that a
suitably scaled sequence of swarms converge to the solution of an ordinary
differential equation. We also establish certain stability results. Moreover,
convergence rates are ascertained by using weak convergence method. A centered
and scaled sequence of the estimation errors is shown to have a diffusion
limit.
","[{""version"":""v1"",""created"":""Sun, 25 Aug 2013 01:09:42 GMT""},{""version"":""v2"",""created"":""Fri, 12 Dec 2014 17:44:47 GMT""}]","2016-11-15"
"1308.5370","Ryan Allured","Ryan Allured, Randall L. McEntaffer","Analytical Alignment Tolerances for Off-Plane Reflection Grating
  Spectroscopy","16 pages, 14 figures, Submitted to Experimental Astronomy",,"10.1007/s10686-013-9349-y",,"astro-ph.IM","http://arxiv.org/licenses/nonexclusive-distrib/1.0/","  Future NASA X-ray Observatories will shed light on a variety of high-energy
astrophysical phenomena. Off-plane reflection gratings can be used to provide
high throughput and spectral resolution in the 0.3--1.5 keV band, allowing for
unprecedented diagnostics of energetic astrophysical processes. A grating
spectrometer consists of multiple aligned gratings intersecting the converging
beam of a Wolter-I telescope. Each grating will be aligned such that the
diffracted spectra overlap at the focal plane. Misalignments will degrade both
spectral resolution and effective area. In this paper we present an analytical
formulation of alignment tolerances that define grating orientations in all six
degrees of freedom. We verify our analytical results with raytrace simulations
to fully explore the alignment parameter space. We also investigate the effect
of misalignments on diffraction efficiency.
","[{""version"":""v1"",""created"":""Sun, 25 Aug 2013 01:37:55 GMT""}]","2015-06-17"
"1308.5371","Zsolt Patakfalvi","Zsolt Patakfalvi","On subadditivity of Kodaira dimension in positive characteristic","24 pages, comments are welcomed",,,,"math.AG","http://arxiv.org/licenses/nonexclusive-distrib/1.0/","  We show that for a surjective, separable morphism f of smooth projective
varieties over an algebraically closed field of positive characteristic such
that $f_* \mathcal{O}_X = \mathcal{O}_Y$ subadditivity of Kodaira dimension
holds, provided the base is of general type and the Hasse-Witt matrix of the
geometric general fiber is not nilpotent.
","[{""version"":""v1"",""created"":""Sun, 25 Aug 2013 01:43:28 GMT""},{""version"":""v2"",""created"":""Thu, 29 Aug 2013 18:43:06 GMT""},{""version"":""v3"",""created"":""Wed, 5 Mar 2014 16:54:57 GMT""}]","2014-03-06"
"1308.5372","J. Davy Kirkpatrick","J. Davy Kirkpatrick, Michael C. Cushing, Christopher R. Gelino,
  Charles A. Beichman, C. G. Tinney, Jacqueline K. Faherty, Adam Schneider, and
  Gregory N. Mace","Discovery of the Y1 Dwarf WISE J064723.23-623235.5","26 pages, 7 figures; accepted for publication in The Astrophysical
  Journal",,"10.1088/0004-637X/776/2/128",,"astro-ph.SR","http://arxiv.org/licenses/nonexclusive-distrib/1.0/","  We present the discovery of a very cold, very low mass, nearby brown dwarf
using data from the NASA Wide-field Infrared Survey Explorer (WISE). The
object, WISE J064723.23-623235.5, has a very red WISE color of W1-W2 > 3.77 mag
and a very red Spitzer Space Telescope color of ch1-ch2 = 2.82+/-0.09 mag. In
J_MKO-ch2 color (7.58+/-0.27 mag) it is one of the two or three reddest brown
dwarfs known. Our grism spectrum from the Hubble Space Telescope (HST) confirms
it to be the seventeenth Y dwarf discovered, and its spectral type of Y1+/-0.5
makes it one of the four latest-type Y dwarfs classified. Astrometric imaging
from Spitzer and HST, combined with data from WISE, provides a preliminary
parallax of pi = 115+/-12 mas (d = 8.7+/-0.9 pc) and proper motion of mu =
387+/-25 mas/yr based on 2.5 years of monitoring. The spectrum implies a blue
J-H color, for which model atmosphere calculations suggest a relatively low
surface gravity. The best fit to these models indicates an effective
temperature of 350-400K and a mass of ~5-30 M_Jup. Kinematic analysis hints
that this object may belong to the Columba moving group, which would support an
age of ~30 Myr and thus an even lower mass of <2 M_Jup, but verification would
require a radial velocity measurement not currently possible for a J=22.7 mag
brown dwarf.
","[{""version"":""v1"",""created"":""Sun, 25 Aug 2013 02:03:07 GMT""}]","2015-06-17"
"1308.5373","Cunsheng Ding","Cunsheng Ding, Ying Gao, and Zhengchun Zhou","Five Families of Three-Weight Ternary Cyclic Codes and Their Duals",,,,,"cs.IT math.IT","http://arxiv.org/licenses/nonexclusive-distrib/1.0/","  As a subclass of linear codes, cyclic codes have applications in consumer
electronics, data storage systems, and communication systems as they have
efficient encoding and decoding algorithms. In this paper, five families of
three-weight ternary cyclic codes whose duals have two zeros are presented. The
weight distributions of the five families of cyclic codes are settled. The
duals of two families of the cyclic codes are optimal.
","[{""version"":""v1"",""created"":""Sun, 25 Aug 2013 03:31:07 GMT""}]","2013-08-27"
"1308.5374","Daniel Schwartz","Daniel G. Schwartz","Dynamic Reasoning Systems",,,,,"cs.AI cs.LO","http://arxiv.org/licenses/nonexclusive-distrib/1.0/","  A {\it dynamic reasoning system} (DRS) is an adaptation of a conventional
formal logical system that explicitly portrays reasoning as a temporal
activity, with each extralogical input to the system and each inference rule
application being viewed as occurring at a distinct time step. Every DRS
incorporates some well-defined logic together with a controller that serves to
guide the reasoning process in response to user inputs. Logics are generic,
whereas controllers are application-specific. Every controller does,
nonetheless, provide an algorithm for nonmonotonic belief revision. The general
notion of a DRS comprises a framework within which one can formulate the logic
and algorithms for a given application and prove that the algorithms are
correct, i.e., that they serve to (i) derive all salient information and (ii)
preserve the consistency of the belief set. This paper illustrates the idea
with ordinary first-order predicate calculus, suitably modified for the present
purpose, and two examples. The latter example revisits some classic
nonmonotonic reasoning puzzles (Opus the Penguin, Nixon Diamond) and shows how
these can be resolved in the context of a DRS, using an expanded version of
first-order logic that incorporates typed predicate symbols. All concepts are
rigorously defined and effectively computable, thereby providing the foundation
for a future software implementation.
","[{""version"":""v1"",""created"":""Sun, 25 Aug 2013 03:48:08 GMT""}]","2013-08-27"
"1308.5375","Xing-Gang Wu","Gu Chen, Xing-Gang Wu, Zhan Sun, Sheng-Quan Wang and Jian-Ming Shen","Exclusive charmonium production from $e^+ e^-$ annihilation round the
  $Z^0$ peak","19 pages, 9 figures. References and discussions updated. To be
  published in Phys.Rev.D","Phys. Rev. D 88, 074021 (2013)","10.1103/PhysRevD.88.074021",,"hep-ph","http://arxiv.org/licenses/nonexclusive-distrib/1.0/","  We make a comparative and comprehensive study on the charmonium exclusive
productions at the $e^+e^-$ collider with the collision energy either round the
$Z^0$-boson mass for a super $Z$ factory or equals to 10.6 GeV for the $B$
factories as Belle and BABAR. We study the total cross sections for the
charmonium production via the exclusive processes $e^+e^- \to \gamma^*/Z^0 \to
H_{1}+H_{2}$ and $e^+e^- \to \gamma^*/Z^0 \to H_{1} +\gamma$, where $H_{1}$ and
$H_{2}$ represent the dominant color-singlet $S$-wave and $P$-wave charmonium
states respectively. Total cross sections versus the $e^+e^-$ collision energy
$\sqrt{s}$, together with their uncertainties, are presented, which clearly
show the relative importance of these channels. At the $B$ factory, the
production channels via the virtual $\gamma^*$ propagator are dominant over the
channels via the $Z^0$ propagator by about four orders. While, at the super $Z$
factory, due to the $Z^0$-boson resonance effect, the $Z^0$ boson channels
shall provide sizable or even dominant contributions in comparison to the
channels via the $\gamma^*$ propagator. Sizable exclusive charmonium events can
be produced at the super $Z$ factory with high luminocity up to $10^{36}{\rm
cm}^{-2}{\rm s}^{-1}$, especially for the channel of $e^+e^- \to Z^0 \to H_{1}
+\gamma$, e.g. by taking $m_c=1.50\pm0.20$ GeV, we shall have
$(5.0^{+0.8}_{-0.6})\times10^4$ $J/\psi$, $(7.5^{+1.1}_{-0.9})\times10^3$
$\eta_c$, $(6.2^{+3.3}_{-1.9})\times10^3$ $h_{c}$,
$(3.1^{+1.7}_{-0.9})\times10^2$ $\chi_{c0}$, $(2.2^{+1.0}_{-0.4})\times10^3$
$\chi_{c1}$, and $(7.7^{+4.1}_{-2.4})\times10^2$ $\chi_{c2}$ events by one
operation year. Thus, in addition to the $B$ factories as BABAR and Belle, such
a super $Z$ factory shall provide another useful platform for studying the
heavy quarkonium properties and for testing QCD theories.
","[{""version"":""v1"",""created"":""Sun, 25 Aug 2013 04:57:16 GMT""},{""version"":""v2"",""created"":""Thu, 3 Oct 2013 02:19:14 GMT""}]","2013-10-22"
"1308.5376","Ting Kam Leonard Wong","Soumik Pal and Ting-Kam Leonard Wong","Energy, entropy, and arbitrage","21 pages, 7 figures. Substantially revised",,,,"q-fin.PM math.PR","http://arxiv.org/licenses/nonexclusive-distrib/1.0/","  We introduce a pathwise approach to analyze the relative performance of an
equity portfolio with respect to a benchmark market portfolio. In this
energy-entropy framework, the relative performance is decomposed into three
components: a volatility term, a relative entropy term measuring the distance
between the portfolio weights and the market capital distribution, and another
entropy term that can be controlled by the investor by adopting a suitable
rebalancing strategy. This framework leads to a class of portfolio strategies
that allows one to outperform, in the long run, a market that is diverse and
sufficiently volatile in the sense of stochastic portfolio theory. The
framework is illustrated with several empirical examples.
","[{""version"":""v1"",""created"":""Sun, 25 Aug 2013 05:07:57 GMT""},{""version"":""v2"",""created"":""Fri, 1 Jan 2016 20:32:41 GMT""}]","2016-01-05"
"1308.5377","Sibo Zheng","Sibo Zheng","MSSM with $m_{h}=125$ GeV in High-Scale Gauge Mediation","12pp, more discussions added","Eur. Phys. J. C 74 (2014) 2724","10.1140/epjc/s10052-014-2724-7",,"hep-ph hep-ex","http://creativecommons.org/licenses/by/3.0/","  After the discovery of SM-like Higgs with $m_{h}=125$ GeV, it is increasingly
urgent to explore a solution to the hierarchy problem. In the context of MSSM
from gauge-mediated SUSY breaking, the lower bound on gluino mass suggests that
the messenger scale $M$ is probably large if the magnitude of $\Lambda\sim 100$
TeV. In this paper, we study $\overline{\mathbf{5}}+ \mathbf{5}$ model with
$M\sim 10^{8}-10^{12}$ GeV and $\Lambda\simeq 100$ TeV. For moderate
Higgs-messenger coupling, it will be shown a viable model with moderate fine
tuning. In this model, $\mu\sim 800$ GeV and $B_{\mu}$ nearly vanishes at input
scale, which can be constructed in microscopic model.
","[{""version"":""v1"",""created"":""Sun, 25 Aug 2013 05:26:58 GMT""},{""version"":""v2"",""created"":""Mon, 2 Sep 2013 05:00:46 GMT""},{""version"":""v3"",""created"":""Tue, 3 Sep 2013 03:27:55 GMT""},{""version"":""v4"",""created"":""Sun, 8 Sep 2013 09:59:04 GMT""},{""version"":""v5"",""created"":""Mon, 14 Oct 2013 15:02:12 GMT""},{""version"":""v6"",""created"":""Tue, 10 Dec 2013 07:38:37 GMT""}]","2014-02-11"
"1308.5378","Laleh Sadeghian","Laleh Sadeghian","Star Clusters and Dark Matter as Probes of the Spacetime Geometry of
  Massive Black Holes","PhD Dissertation, Submitted to the Washington University in St.
  Louis. arXiv admin note: text overlap with arXiv:astro-ph/0508106,
  arXiv:0910.3538, arXiv:1208.3931, arXiv:1211.7090, arXiv:hep-ph/0404175 by
  other authors",,,,"gr-qc","http://arxiv.org/licenses/nonexclusive-distrib/1.0/","  This thesis includes two main projects. In the first part, we assess the
feasibility of a recently suggested strong-field general relativity test, in
which future observations of a hypothetical class of stars orbiting very close
to the supermassive black hole at the center of our galaxy, known as Sgr A*,
could provide tests of the so-called no-hair theorem of general relativity
through the measurement of precessions of their orbital planes. By considering
how a distribution of stars and stellar mass black holes in the central cluster
would perturb the orbits of those hypothetical stars, we show that for stars
within about 0.2 milliparsecs (about 6 light-hours) of the black hole, the
relativistic precessions dominate, leaving a potential window for tests of
no-hair theorems. Our results are in agreement with N-body simulation results.
  In the second part, we develop a fully general relativistic phase-space
formulation to consider the effects of the Galactic center supermassive black
hole Sgr A* on the dark-matter density profile and its applications in the
indirect detection of dark matter. We find significant differences from the
non-relativistic result of Gondolo and Silk (1999), including a higher density
for the spike and a larger degree of central concentration. Having the dark
matter profile density in the presence of the massive black hole, we calculate
its perturbing effect on the orbital motions of stars in the Galactic center,
and find that for the stars of interest, relativistic effects related to the
hair on the black hole will dominate the effects of dark matter.
","[{""version"":""v1"",""created"":""Sun, 25 Aug 2013 05:44:36 GMT""}]","2013-08-27"
"1308.5379","Jean-Marc Richard","Jean-Marc Richard and Tai Tsun Wu","Scalar Quarks at the Large Hadron Collider","7 pages, 1 figure",,,"CERN-PH-TH/2013-200","hep-ph hep-ex","http://arxiv.org/licenses/nonexclusive-distrib/1.0/","  The properties of scalar quarks are studied, especially the formation of
fermionic mesons with an anti-quark. On the basis of this theoretical
investigation together with the experimental data, both from last year and from
this year, of the ATLAS Collaboration and the CMS Collaboration at the Large
Hadron Collider, it is proposed that the standard model of Glashow, Weinberg,
and Salam should be augmented by scalar quarks, scalar leptons, and additional
fermions. If these scalar quarks and scalar leptons are in one-to-one
correspondence with the ordinary quarks and ordinary leptons, either in number
or in the degrees of freedom, then there may be a fermion-boson symmetry. The
fermion-boson symmetry obtained this way is of a different nature from that of
supersymmetry.
","[{""version"":""v1"",""created"":""Sun, 25 Aug 2013 06:00:01 GMT""}]","2013-08-27"
