"1308.5401","Gopal Datt","Gopal Datt, Sanjay Kumar","Normality and Sharing Functions",,"Indian Journal of Pure and Applied Mathematics, 46 (6) 2015, pp
  853--864","10.1007/s13226-015-0155-2.",,"math.CV","http://arxiv.org/licenses/nonexclusive-distrib/1.0/","  In this article, we prove a normality criterion for a family of meromorphic
functions which involves sharing of holomorphic functions. Our result
generalizes some of the results of H. H. Chen, M. L. Fang and M. Han, Y. Gu.
","[{""version"":""v1"",""created"":""Sun, 25 Aug 2013 11:54:58 GMT""}]","2016-01-14"
"1308.5402","Shabbir Ghulam","Ghulam Shabbir, M. Ramzan and Suhail Khan","Classification of non conformally flat cylindrically symmetric non
  static space-times according to their proper conformal motions","9 pages",,,,"gr-qc","http://arxiv.org/licenses/nonexclusive-distrib/1.0/","  In this paper we considered the most general form of non conformally flat
cylindrically symmetric non-static space-times to study proper conformal
motions using direct integration technique. We have shown that very special
classes for cylindrically symmetric space-times admit proper conformal motions.
This classification also covers non-static and static plane symmetric
space-times. In [9] it was claimed that non conformally flat plane symmetric
static space-times do not admit proper conformal motion. Here it is also shown
that static and non static plane symmetric space-times admit proper conformal
motions. We also discuss the Lie algebra in each case.
","[{""version"":""v1"",""created"":""Sun, 25 Aug 2013 12:49:19 GMT""}]","2013-08-27"
"1308.5403","Brian Dolan","Brian P. Dolan","The compressibility of rotating black holes in D-dimensions","14 pages, 2 figures; discussion of extensive/intensive thermodynamic
  variables added, and minor typos corrected, in v2",,"10.1088/0264-9381/31/3/035022","DIAS-STP-13-08","gr-qc hep-th","http://arxiv.org/licenses/nonexclusive-distrib/1.0/","  Treating the cosmological constant as a pressure, in the context of black
hole thermodynamics, a thermodynamic volume for the black hole can be defined
as being the thermodynamic variable conjugate to the pressure, in the sense of
a Legendre transform. The thermodynamic volume is explicitly calculated, as the
Legendre transform of the pressure in the enthalpy for a rotating
asymptotically anti-de Sitter Myers-Perry black hole in D space-time
dimensions. The volume obtained is shown to agree with previous calculations
using the Smarr relation. The compressibility is calculated and shown to be
non-negative and bounded.
  Taking the limit of zero cosmological constant, the compressibility of a
rotating black hole in asymptotically flat space-times is determined and the
corresponding speed of sound computed. The latter is bounded above and has an
elegant expression purely in terms of the angular momenta, in the form of
quartic and quadratic Casimirs of the rotation group, SO(D-1).
","[{""version"":""v1"",""created"":""Sun, 25 Aug 2013 12:54:55 GMT""},{""version"":""v2"",""created"":""Mon, 23 Dec 2013 15:16:58 GMT""}]","2015-06-17"
"1308.5404","Lukasz Czekaj","L. Czekaj, A. Grudka, M. Horodecki, P. Horodecki, M. Markiewicz","Universal scheme for violation of local realism from quantum advantage
  in one-way communication complexity","9 pages, 3 figures, The paper is superseded by arXiv:1502.01058",,,,"quant-ph","http://arxiv.org/licenses/nonexclusive-distrib/1.0/","  We consider relations between communication complexity problems and detecting
correlations (violating local realism) with no local hidden variable model. We
show first universal equivalence between characteristics of protocols used in
that type of problems and non-signaling correlations. We construct non linear
bipartite Bell type inequalities and strong nonlocality test with binary
observables by providing general method of Bell inequalities construction and
showing that existence of gap between quantum and classical complexity leads to
violation of these inequalities. We obtain, first to our knowledge, explicit
Bell inequality with binary observables and exponential violation.
","[{""version"":""v1"",""created"":""Sun, 25 Aug 2013 12:55:35 GMT""},{""version"":""v2"",""created"":""Thu, 15 Oct 2015 18:58:23 GMT""}]","2015-10-16"
"1308.5405","Vadim Zotev","Vadim Zotev, Raquel Phillips, Kymberly D. Young, Wayne C. Drevets,
  Jerzy Bodurka","Prefrontal control of the amygdala during real-time fMRI neurofeedback
  training of emotion regulation","17 pages, 7 figures, submitted","PLoS ONE 8 (2013) e79184","10.1371/journal.pone.0079184",,"physics.med-ph","http://arxiv.org/licenses/nonexclusive-distrib/1.0/","  We observed in a previous study (PLoS ONE 6:e24522) that the self-regulation
of amygdala activity via real-time fMRI neurofeedback (rtfMRI-nf) with positive
emotion induction was associated, in healthy participants, with an enhancement
in the functional connectivity between the left amygdala (LA) and six regions
of the prefrontal cortex. These regions included the left rostral anterior
cingulate cortex (rACC), bilateral dorsomedial prefrontal cortex (DMPFC),
bilateral superior frontal gyrus (SFG), and right medial frontopolar cortex
(MFPC). Together with the LA, these six prefrontal regions thus formed the
functional neuroanatomical network engaged during the rtfMRI-nf procedure. Here
we perform a structural vector autoregression (SVAR) analysis of the effective
connectivity for this network. The SVAR analysis demonstrates that the left
rACC plays an important role during the rtfMRI-nf training, modulating the LA
and the other network regions. According to the analysis, the rtfMRI-nf
training leads to a significant enhancement in the time-lagged effect of the
left rACC on the LA. The training is also accompanied by significant increases
in the instantaneous (contemporaneous) effects of the left rACC on four other
regions - the bilateral DMPFC, the right MFPC, and the left SFG. The
instantaneous effects of the LA on the bilateral DMPFC are also significantly
enhanced. Our results are consistent with a broad literature supporting the
role of the rACC in emotion processing and regulation. Our analysis provides,
for the first time, insights into the causal relationships within the network
of regions engaged during the rtfMRI-nf procedure targeting the amygdala. It
suggests that the rACC may constitute a promising target for rtfMRI-nf training
along with the amygdala in patients with affective disorders, particularly
posttraumatic stress disorder (PTSD).
","[{""version"":""v1"",""created"":""Sun, 25 Aug 2013 13:19:24 GMT""}]","2013-11-19"
"1308.5406","Morgan Deal","M. Deal, S. Deheuvels, G. Vauclair, S. Vauclair, and F. C. Wachlin","Accretion from debris disks onto white dwarfs : Fingering (thermohaline)
  instability and derived accretion rates",,"Astronomy & Astrophysics, 2013, Volume 557, id.L12, 4 pp","10.1051/0004-6361/201322206",,"astro-ph.SR","http://arxiv.org/licenses/nonexclusive-distrib/1.0/","  Recent observations of a large number of DA and DB white dwarfs show evidence
of debris disks, which are the remnants of old planetary systems. The infrared
excess detected with \emph{Spitzer} and the lines of heavy elements observed in
their atmospheres with high-resolution spectroscopy converge on the idea that
planetary material accretes onto these stars. Accretion rates have been derived
by several authors with the assumption of a steady state between accretion and
gravitational settling. The results are unrealistically different for DA and DB
white dwarfs. When heavy matter is accreted onto stars, it induces an inverse
$\mu$-gradient that leads to fingering (thermohaline) convection. The aim of
this letter is to study the impact of this specific process on the derived
accretion rates in white dwarfs and on the difference between DA and DB. We
solve the diffusion equation for the accreted heavy elements with a
time-dependent method. The models we use have been obtained both with the IRAP
code, which computes static models, and the La Plata code, which computes
evolutionary sequences. Computations with pure gravitational settling are
compared with computations that include fingering convection. The most
important result is that fingering convection has very important effects on DAs
but is inefficient in DBs. When only gravitational settling is taken into
account, the time-dependent computations lead to a steady state, as postulated
by previous authors. When fingering convection is added, this steady state
occurs much later. The surprising difference found in the past for the
accretion rates derived for DA and DB white dwarfs disappears. The derived
accretion rates for DAs are increased when fingering convection is taken into
account, whereas those for DBs are not modified. More precise and developed
results will be given in a forthcoming paper.
","[{""version"":""v1"",""created"":""Sun, 25 Aug 2013 14:03:39 GMT""},{""version"":""v2"",""created"":""Tue, 17 Sep 2013 09:14:43 GMT""}]","2015-06-17"
"1308.5407","Mark W. Meckes","Mark W. Meckes","Magnitude, diversity, capacities, and dimensions of metric spaces","v2: Minor changes in exposition. To appear in Potential Analysis","Potential Anal. 42 (2015) no. 2, 549-572","10.1007/s11118-014-9444-3",,"math.MG math.CA math.FA","http://arxiv.org/licenses/nonexclusive-distrib/1.0/","  Magnitude is a numerical invariant of metric spaces introduced by Leinster,
motivated by considerations from category theory. This paper extends the
original definition for finite spaces to compact spaces, in an equivalent but
more natural and direct manner than in previous works by Leinster, Willerton,
and the author. The new definition uncovers a previously unknown relationship
between magnitude and capacities of sets. Exploiting this relationship, it is
shown that for a compact subset of Euclidean space, the magnitude dimension
considered by Leinster and Willerton is equal to the Minkowski dimension.
","[{""version"":""v1"",""created"":""Sun, 25 Aug 2013 14:11:29 GMT""},{""version"":""v2"",""created"":""Tue, 30 Sep 2014 18:12:01 GMT""}]","2015-07-22"
"1308.5408","Hiroaki Ishizuka Mr.","Hiroaki Ishizuka, Yukitoshi Motome","Spontaneous Spatial Inversion Symmetry Breaking and Spin Hall Effect in
  a Spin-ice Double-exchange Model on a Pyrochlore Lattice","5 pages, 4 figures, accepted for publication in Rapid Communication
  section of Phys. Rev. B","Phys. Rev. B 88, 100402(R) (2013)","10.1103/PhysRevB.88.100402",,"cond-mat.str-el","http://arxiv.org/licenses/nonexclusive-distrib/1.0/","  A formation of tetrahedral spin clusters is discovered by Monte Carlo
simulation for a spin-ice type double-exchange model on a pyrochlore lattice.
The spin-cluster phase is magnetically disordered, but breaks spatial inversion
symmetry spontaneously by developing noncoplanar four-spin molecules
periodically on the pyrochlore lattice. We find that the system exhibits a
nonzero spin Hall conductivity in the spin-cluster phase. The result suggests
that an intersite-multipole order induces the unconventional spin Hall state
without the spin-orbit interaction.
","[{""version"":""v1"",""created"":""Sun, 25 Aug 2013 14:23:31 GMT""}]","2014-08-29"
"1308.5409","Ola Mahmoud","Marcelo Fiore and Ola Mahmoud","Second-Order Algebraic Theories",,"In Lecture Notes in Computer In Proceedings of the 35th
  International Symposium on Mathematical Foundations of Computer Science (MFCS
  2010), LNCS 6281, pp. 368-380, Springer Verlag, May 2010",,,"cs.LO math.CT","http://arxiv.org/licenses/nonexclusive-distrib/1.0/","  Fiore and Hur recently introduced a conservative extension of universal
algebra and equational logic from first to second order. Second-order universal
algebra and second-order equational logic respectively provide a model theory
and a formal deductive system for languages with variable binding and
parameterised metavariables. This work completes the foundations of the subject
from the viewpoint of categorical algebra. Specifically, the paper introduces
the notion of second-order algebraic theory and develops its basic theory. Two
categorical equivalences are established: at the syntactic level, that of
second-order equational presentations and second-order algebraic theories; at
the semantic level, that of second-order algebras and second-order functorial
models. Our development includes a mathematical definition of syntactic
translation between second-order equational presentations. This gives the first
formalisation of notions such as encodings and transforms in the context of
languages with variable binding.
","[{""version"":""v1"",""created"":""Sun, 25 Aug 2013 14:23:54 GMT""}]","2013-08-27"
"1308.5410","Ali Chamseddine","Ali H. Chamseddine and Viatcheslav Mukhanov","Mimetic Dark Matter","5 pages","JHEP 1311 (2013) 135","10.1007/JHEP11(2013)135",,"astro-ph.CO hep-th","http://arxiv.org/licenses/nonexclusive-distrib/1.0/","  We reformulate Einstein's theory of gravity, isolating the conformal degree
of freedom in a covariant way. This is done by introducing a physical metric
defined in terms of an auxiliary metric and a scalar field appearing through
its first derivatives. The resulting equations of motion split into a traceless
equation obtained through variation with respect to the auxiliary metric and an
additional differential equation for the trace part. As a result the conformal
degree of freedom becomes dynamical even in the absence of matter. We show that
this extra degree of freedom can mimic cold dark matter.
","[{""version"":""v1"",""created"":""Sun, 25 Aug 2013 14:32:41 GMT""}]","2013-12-02"
"1308.5411","Antti J Harju","Antti J. Harju","Analysis of Twisted Supercharge Families on Product Manifolds","Final version, J. Math. Phys",,,,"math.KT math-ph math.MP","http://arxiv.org/licenses/nonexclusive-distrib/1.0/","  Twisted supercharge families on product manifolds $\mathbb{T} \times M$ have
been applied in the analysis of the odd twisted K-theory. We shall suspend
these families to the even twisted K-theory and solve their twisted families
index problem. This is applied to give analytic representatives of the twisted
K-theory classes on tori - including all the torsion classes.
","[{""version"":""v1"",""created"":""Sun, 25 Aug 2013 14:32:42 GMT""},{""version"":""v2"",""created"":""Sun, 29 Jun 2014 08:03:37 GMT""},{""version"":""v3"",""created"":""Sun, 5 Apr 2015 14:04:22 GMT""}]","2015-04-07"
"1308.5412","Volker Wilhelm Th\""urey","Volker W. Th\""urey","The Complex Angle in Normed Spaces","21 pages",,"10.1088/1742-6596/490/1/012038",,"math.FA","http://arxiv.org/licenses/nonexclusive-distrib/1.0/","  We consider a generalized angle in complex normed vector spaces. Its
definition corresponds to the definition of the well known Euclidean angle in
real inner product spaces. Not surprisingly it yields complex values as
`angles'. This `angle' has some simple properties, which are known from the
usual angle in real inner product spaces. But to do ordinary Euclidean geometry
real angles are necessary. We show that even in a complex normed space there
are many pure real valued `angles'. The situation improves yet in inner product
spaces. There we can use the known theory of orthogonal systems to find many
pairs of vectors with real angles, and to do geometry which is based on the
Greeks 2000 years ago.
","[{""version"":""v1"",""created"":""Sun, 25 Aug 2013 14:40:50 GMT""}]","2015-06-17"
"1308.5413","Tohru Tanaka","Tohru Tanaka, Yukihiro Ota, Mitsunori Kanazawa, Gen Kimura, Hiromichi
  Nakazato, Franco Nori","Determining eigenvalues of a density matrix with minimal information in
  a single experimental setting","5 pages, 2 figures","Phys. Rev. A 89, 012117 (2014)","10.1103/PhysRevA.89.012117",,"quant-ph","http://arxiv.org/licenses/nonexclusive-distrib/1.0/","  Eigenvalues of a density matrix characterize well the quantum state's
properties, such as coherence and entanglement. We propose a simple method to
determine all the eigenvalues of an unknown density matrix of a
finite-dimensional system in a single experimental setting. Without fully
reconstructing a quantum state, eigenvalues are determined with the minimal
number of parameters obtained by a measurement of a single observable.
Moreover, its implementation is illustrated in linear optical and
superconducting systems.
","[{""version"":""v1"",""created"":""Sun, 25 Aug 2013 14:47:36 GMT""},{""version"":""v2"",""created"":""Mon, 25 Nov 2013 10:32:52 GMT""}]","2014-01-24"
"1308.5414","Alejandro C\'orsico","Enrique Garc\'ia-Berro, Santiago Torres, Leandro G. Althaus, Alejandro
  H. C\'orsico, Pablo Lor\'en-Aguilar, Alejandra D. Romero, and Jordi Isern","White dwarf constraints on a varying $G$","6 pages, 3 figures. To be published in the proceedings of the
  conference ""Varying fundamental constants and dynamical dark energy"" (8 - 13
  July 2013, Sexten Center for Astrophysics)",,,,"astro-ph.SR hep-ph","http://arxiv.org/licenses/nonexclusive-distrib/1.0/","  A secular variation of $G$ modifies the structure and evolutionary time
scales of white dwarfs. Using an state-of-the-art stellar evolutionary code, an
up-to-date pulsational code, and a detailed population synthesis code we
demonstrate that the effects of a running $G$ are obvious both in the
properties of individual white dwarfs, and in those of the white dwarf
populations in clusters. Specifically, we show that the white dwarf
evolutionary sequences depend on both the value of $\dot G/G$, and on the value
of $G$ when the white dwarf was born. We show as well that the pulsational
properties of variable white dwarfs can be used to constrain $\dot G/G$.
Finally, we also show that the ensemble properties of of white dwarfs in
clusters can also be used to set upper bounds to $\dot G/G$. Precisely, the
tightest bound --- $\dot G/G \sim -1.8 10^{-12}$ yr$^{-1}$ --- is obtained
studying the population of the old, metal-rich, well populated, open cluster
NGC 6791. Less stringent upper limits can be obtained comparing the theoretical
results obtained taking into account the effects of a running $G$ with the
measured rates of change of the periods of two well studied pulsating white
dwarfs, G117--B15A and R548. Using these white dwarfs we obtain $\dot G/G\sim
-1.8\times 10^{-10}$ yr$^{-1}$, and $\dot G/G\sim -1.3\times 10^{-10}$
yr$^{-1}$, respectively, which although less restrictive than the previous
bound, can be improved measuring the rate of change of the period of massive
white dwarfs.
","[{""version"":""v1"",""created"":""Sun, 25 Aug 2013 15:08:12 GMT""}]","2013-08-27"
"1308.5415","Nikoloz Kervalishvili","N.A. Kervalishvili","Formation and Dynamics of Vortex Structures in Pure and Gas-Discharge
  Nonneutral Collisionless Electron Plasmas","15 pages, 14 figures","J. Georgian Geophysical Society 15B (2012) 120-136",,,"physics.plasm-ph","http://arxiv.org/licenses/nonexclusive-distrib/1.0/","  The comparative analysis of the results of experimental investigations of the
processes of formation, interaction and dynamics of vortex structures in pure
electron and gas-discharge electron nonneutral plasmas taking place for the
period of time much less than the electron-neutral collision time has been
given. The general processes of formation and behavior of vortex structures in
these two plasmas were considered. The phenomena, taking place only in one of
these plasmas were also considered. It is shown that the existing difference in
behavior of vortex structures is caused by different initial states of
nonneutral electron plasmas. The role of vortex structures in the processes
taking place in nonneutral electron plasma is discussed.
","[{""version"":""v1"",""created"":""Sun, 25 Aug 2013 15:18:20 GMT""}]","2013-08-27"
"1308.5416","Ryan Causey","Ryan Causey","Estimation of the Szlenk index of reflexive Banach spaces using
  generalized Baernstein spaces","arXiv admin note: text overlap with arXiv:1212.5576",,,,"math.FA","http://arxiv.org/licenses/nonexclusive-distrib/1.0/","  For each ordinal $\alpha< \omega_1$, we prove the existence of a separable,
reflexive Banach space with a basis and Szlenk index $\omega^{\alpha+1}$ which
is universal for the class of separable, reflexive Banach spaces $X$ such that
the Szlenk indices $Sz(X), Sz(X^*)$ do not exceed $\omega^\alpha$.
","[{""version"":""v1"",""created"":""Sun, 25 Aug 2013 15:25:05 GMT""}]","2013-08-27"
"1308.5417","Vladimir Matveev","Keith Burns and Vladimir S. Matveev","Open problems and questions about geodesics","This is the final version of the paper","Ergod. Th. Dynam. Sys. 41 (2021) 641-684","10.1017/etds.2019.73",,"math.DG math.DS","http://arxiv.org/licenses/nonexclusive-distrib/1.0/","  The paper surveys open problems and questions related to geodesics defined by
Riemannian, Finsler, semi Riemannian and magnetic structures on manifolds.
","[{""version"":""v1"",""created"":""Sun, 25 Aug 2013 15:36:51 GMT""},{""version"":""v2"",""created"":""Mon, 8 Sep 2014 12:24:56 GMT""},{""version"":""v3"",""created"":""Tue, 3 Sep 2019 17:25:33 GMT""}]","2021-02-03"
"1308.5418","Gabor Szabo","Gabor Szabo","The Rokhlin dimension of topological Z^m-actions","27 pages; with minor corrections in some proofs","Proc. London Math. Soc. (2015) 110 (3): 673-694","10.1112/plms/pdu065",,"math.OA math.DS","http://arxiv.org/licenses/nonexclusive-distrib/1.0/","  We study the topological variant of Rokhlin dimension for topological
dynamical systems (X,{\alpha},Z^m) in the case where X is assumed to have
finite covering dimension. Finite Rokhlin dimension in this sense is a property
that implies finite Rokhlin dimension of the induced action on C*-algebraic
level, as was discussed in a recent paper by Ilan Hirshberg, Wilhelm Winter and
Joachim Zacharias. In particular, it implies under these conditions that the
transformation group C*-algebra has finite nuclear dimension. Generalizing a
result of Yonatan Gutman, we show that free Z^m-actions on finite dimensional
spaces satisfy a strengthened version of the so-called marker property, which
yields finite Rokhlin dimension for said actions.
","[{""version"":""v1"",""created"":""Sun, 25 Aug 2013 15:51:47 GMT""},{""version"":""v2"",""created"":""Tue, 27 Aug 2013 13:51:25 GMT""},{""version"":""v3"",""created"":""Mon, 14 Oct 2013 08:48:53 GMT""},{""version"":""v4"",""created"":""Mon, 13 Jan 2014 15:03:27 GMT""}]","2015-03-13"
"1308.5419","Moritz Guthoff","Moritz Guthoff, Wim de Boer, Steffen M\""uller","Simulation of beam induced lattice defects of diamond detectors using
  FLUKA",,,"10.1016/j.nima.2013.08.083",,"physics.ins-det","http://arxiv.org/licenses/nonexclusive-distrib/1.0/","  Diamond is more and more used as detector material for particle detection.
One argument for diamond is its higher radiation hardness compared to silicon.
Since various particles have different potential for radiation damage at
different energies a scaling rule is necessary for the prediction of radiation
damage. For silicon detectors the non-ionising energy loss (NIEL) is used for
scaling the effects of different particles. A different way of predicting the
radiation damage is based on the Norget-Robinson-Torrens theorem to predict the
number of displacements per atom (DPA). This provides a better scaling rule
since recombination effects are taken into account. This model is implemented
in the FLUKA Monte Carlo simulations package for protons, neutrons and pions.
We compare simulation results of NIEL and DPA for diamond and silicon material
exposed to protons, neutrons and pions for a wide range of energies.
","[{""version"":""v1"",""created"":""Sun, 25 Aug 2013 15:59:30 GMT""}]","2015-06-17"
"1308.5989","Xu Zhiping","Yanlei Wang, Zhigong Song and Zhiping Xu","Characterizing thermal conduction in polycrystalline graphene",,"Journal of Materials Research 29 (3), 362-372 (2014)","10.1557/jmr.2013.380",,"cond-mat.mtrl-sci","http://arxiv.org/licenses/nonexclusive-distrib/1.0/","  Thermal conduction was explored and discussed through a combined theoretical
and simulation approach in this work. The thermal conductivity k of
polycrystalline graphene was calculated by molecular dynamics simulations based
on a hexagonal patch model in close consistence with microstructural
characterization in experiments. The effects of grain size, alignment, and
temperature were identified with discussion on the microscopic phonon
scattering mechanisms. The effective thermal conductivity is found to increase
with the grain size and decrease with the mismatch angle and dislocation
density at the grain boundaries. The 1/T temperature dependence of k is
significantly weakened in the polycrystals. The effect of grain boundaries in
modifying thermal transport properties of graphene was characterized by their
effective width and thermal conductivity as an individual phase, which was
later included in a predictive effective medium model that showed degraded
reduction in thermal conductivity for grain larger than a few microns.
","[{""version"":""v1"",""created"":""Sun, 25 Aug 2013 05:17:21 GMT""}]","2014-06-05"
