"1308.5380","Qi Xu","Qi Xu, Baohua Mao, Xujie Feng, Jia Feng","Effects of Crowding Perception on Self-organized Pedestrian Flows Using
  Adaptive Agent-based Model","This paper has been withdrawn by the author due to a crucial citation
  error in the sentence 11 in the second paragraph of Section 2.1 on page 8. In
  fact, the referred paper published by PNAS, the circle of radius is r=m/320,
  available at http://www.pnas.org/content/108/17/6884.full. However, our
  manuscript published in arXiv.org, the circle of radius is r=m/160",,,,"cs.MA","http://arxiv.org/licenses/nonexclusive-distrib/1.0/","  Pedestrian behavior has much more complicated characteristics in a dense
crowd and thus attracts the widespread interest of scientists and engineers.
However, even successful modeling approaches such as pedestrian models based on
particle systems are still not fully considered the perceptive mechanism
underlying collective pedestrian behavior. This paper extends a behavioral
heuristics-based pedestrian model to an adaptive agent-based model, which
explicitly considers the crowding effect of neighboring individuals and
perception anisotropy on the representation of a pedestrians visual
information. The adaptive agents with crowding perception are constructed to
investigate complex, selforganized collective dynamics of pedestrian motion.
The proposed model simulates selforganized pedestrian flows in good
quantitative agreement with empirical data. The selforganized phenomena include
lane formation in bidirectional flow and fundamental diagrams of unidirectional
flow. Simulation results show that the emergence of lane formation in
bidirectional flow can be well reproduced. To investigate this further,
increasing view distance has a significant effect on reducing the number of
lanes, increasing lane width, and stabilizing the self-organized lanes. The
paper also discusses phase transitions of fundamental diagrams of pedestrian
crowds with unidirectional flow. It is found that the heterogeneity of how
pedestrians perceive crowding in the population has a remarkable impact on the
flow quality, which results in the buildup of congestion and rapidly decreases
the efficiency of pedestrian flows. It also indicates that the concept of
heterogeneity may be used to explain the instability of phase transitions.
","[{""version"":""v1"",""created"":""Sun, 25 Aug 2013 06:28:32 GMT""},{""version"":""v2"",""created"":""Fri, 8 Nov 2013 14:01:14 GMT""},{""version"":""v3"",""created"":""Thu, 10 Apr 2014 06:11:05 GMT""}]","2014-04-11"
"1308.5381","Shigenori Matsumoto","Shigenori Matsumoto","New proofs of theorems of Kathryn Mann","4 pages",,,,"math.GT","http://arxiv.org/licenses/nonexclusive-distrib/1.0/","  We give a shorter proof of the following theorem of Kathryn Mann \cite{M}:
the identity component of the group of the compactly supported $C^r$
diffeomorphisms of $\R^n$ cannot admit a nontrivial $C^p$-action on $S^1$,
provided $n\geq2$, $r\neq n+1$ and $p\geq2$. We also give a new proof of
another theorem of Mann: any nontrivial endomorphism of the group of the
orientation preserving $C^r$ diffeomorphisms of the circle is the conjugation
by a $C^r$ diffeomorphism, if $r\geq3$.
","[{""version"":""v1"",""created"":""Sun, 25 Aug 2013 06:34:08 GMT""},{""version"":""v2"",""created"":""Fri, 6 Sep 2013 04:55:38 GMT""}]","2013-09-09"
"1308.5382","K. V. Krishna","Jitender Kumar and K. V. Krishna","The Large Rank of a Finite Semigroup using Prime Subsets","Semigroup Forum, To appear",,,,"math.RA","http://arxiv.org/licenses/nonexclusive-distrib/1.0/","  The \emph{large rank} of a finite semigroup $\Gamma$, denoted by
$r_5(\Gamma)$, is the least number $n$ such that every subset of $\Gamma$ with
$n$ elements generates $\Gamma$. Howie and Ribeiro showed that $r_5(\Gamma) =
|V| + 1$, where $V$ is a largest proper subsemigroup of $\Gamma$. This work
considers the complementary concept of subsemigroups, called \emph{prime
subsets}, and gives an alternative approach to find the large rank of a finite
semigroup. In this connection, the paper provides a shorter proof of Howie and
Ribeiro's result about the large rank of Brandt semigroups. Further, this work
obtains the large rank of the semigroup of order-preserving singular selfmaps.
","[{""version"":""v1"",""created"":""Sun, 25 Aug 2013 07:24:45 GMT""},{""version"":""v2"",""created"":""Fri, 10 Jan 2014 10:24:46 GMT""}]","2014-01-13"
"1308.5383","Willy Hereman","Willy Hereman","Shallow Water Waves and Solitary Waves","27 pages, 8 figures. Updated article to appear in the 2013 online and
  2015 print editions of the Encyclopedia of Complexity and Applied System
  Science, edited by Robert A. Meyers, Springer-Verlag, Heidelberg, 2013","Original article was published in the Encyclopedia of Complexity
  and Applied System Science, ed. Robert A. Meyers, Entry 480, pp. 8112-8125,
  Springer-Verlag, Heidelberg, 2009, ISBN 978-0-387-75888-6",,,"nlin.SI physics.flu-dyn","http://arxiv.org/licenses/nonexclusive-distrib/1.0/","  Encyclopedic article covering shallow water wave models used in oceanography
and atmospheric science. Sections: Definition of the Subject; Introduction and
Historical Perspective; Completely Integrable Shallow Water Wave Equations;
Shallow Water Wave Equations of Geophysical Fluid Dynamics; Computation of
Solitary Wave Solutions; Numerical Methods; Water Wave Experiments and
Observations; Future Directions, and Bibliography.
","[{""version"":""v1"",""created"":""Sun, 25 Aug 2013 07:29:23 GMT""}]","2013-08-27"
"1308.5384","Alexey Nenashev","Alexey V. Nenashev","Derivation of the Born rule based on the minimal set of assumptions","13 pages, 4 figures",,,,"quant-ph","http://arxiv.org/licenses/nonexclusive-distrib/1.0/","  The Born rule for probabilities of measurement results is deduced from the
set of five assumptions. The assumptions state that: (a) the state vector fully
determines the probabilities of all measurement results; (b) between
measurements, any quantum system is governed by that part of standard quantum
mechanics, which does not refer to measurements; (c) probabilities of
measurement results obey the rules of the classical theory of probability; (d)
no information transfer is possible without interaction; (e) if two spin-1/2
particles are in the entangled state (sqrt(1-\lambda)|up>|up> +
sqrt(\lambda)|down>|down>), and one of spins is measured by the Stern-Gerlach
apparatus, then the state of the other spin after this measurement will be
either |up> or |down>, corresponding to the measurement result. No one of these
assumptions can be omitted. The method of the derivation is based on Zurek's
idea of environment-assisted invariance [PRL 90, 120404 (2003)], though taken
in rather modified form. Entanglement plays a crucial role in our approach
(like in Zurek's one), so the probabilities are first considered in the case
when the measured quantum system is entangled with some environment.
Probabilities in pure states appear then as a particular case. The method of
the present paper can be applied to both ideal and non-ideal measuring devices,
irrespective to their constructions and principles of operation.
","[{""version"":""v1"",""created"":""Sun, 25 Aug 2013 07:51:32 GMT""}]","2013-08-27"
"1308.5385","Dachun Yang","Jun Cao, Der-Chen Chang, Huoxiong Wu and Dachun Yang","Weak Hardy Spaces $WH_L^p({\mathbb R}^n)$ Associated to Operators
  Satisfying $k$-Davies-Gaffney Estimates","46 pages; J. Nonlinear Convex Anal. (to appear)",,,,"math.CA math.FA","http://arxiv.org/licenses/nonexclusive-distrib/1.0/","  Let $L$ be a one-to-one operator of type $\omega$ having a bounded $H_\infty$
functional calculus and satisfying the $k$-Davies-Gaffney estimates with
$k\in{\mathbb N}$. In this paper, the authors introduce the weak Hardy space
$WH_L^p(\mathbb{R}^n)$ associated to $L$ for $p\in (0,\,1]$ via the
non-tangential square function $S_L$ and establish a weak molecular
characterization of $WH_L^p(\mathbb{R}^n)$. Typical examples of such operators
include the $2k$-order divergence form homogeneous elliptic operator
$L_1:=(-1)^k\sum_{|\alpha|=k=|\beta|}\partial^\beta(a_{\alpha,\beta}\partial^\alpha)$,
where $\{a_{\alpha,\beta}\}_{|\alpha|=k=|\beta|}$ are complex bounded
measurable functions, and the $2k$-order Schr\""odinger type operator $L_2:=
(-\Delta)^k+V^k$, where $\Delta$ is the Laplacian operator and $0\le V\in
L^k_{\mathop\mathrm{loc}}(\mathbb{R}^n)$. As applications, for $i\in\{1,\,2\}$
and $p\in(\frac{n}{n+k},\,1]$, the authors prove that the associated Riesz
transform $\nabla^k (L_i^{-1/2})$ is bounded from $WH^p_{L_i}(\mathbb{R}^n)$ to
the classical weak Hardy space $WH^p(\mathbb{R}^n)$ and, for all $0<p<r\le1$
and $\alpha=n(\frac{1}{p}-\frac{1}{r})$, the fractional power
$L_i^{-\frac{\alpha}{2k}}$ is bounded from $WH_{L_i}^p(\mathbb{R}^n)$ to
$WH_{L_i}^r(\mathbb{R}^n)$. Furthermore, the authors find the dual space of
$WH_L^p(\mathbb{R}^n)$ for $p\in(0,\,1]$, which can be defined via mean
oscillations based on some subtle coverings of bounded open sets and, even when
$L:=-\Delta$, are also previously unknown. In particular, if $L$ is a
nonnegative self-adjoint operator in $L^2({\mathbb R}^n)$ satisfying the
Davies-Gaffney estimates, the authors further establish the weak atomic
characterization of $WH_L^p(\mathbb{R}^n)$.
","[{""version"":""v1"",""created"":""Sun, 25 Aug 2013 08:01:48 GMT""},{""version"":""v2"",""created"":""Sun, 30 Nov 2014 07:48:26 GMT""}]","2014-12-02"
"1308.5386","Jingcheng Dong","Jingcheng Dong, Li Dai","On integral fusion categories with low-dimensional simple objects","6 pages, t6o appear in Communications in Algebra","Communications in Algebra, 42:11, 4955-4961, 2014",,,"math.QA","http://arxiv.org/licenses/nonexclusive-distrib/1.0/","  Let $k$ be an algebraically closedfield of characteristic zero. In this paper
we consider an integral fusion category over $k$ in which the Frobenius-Perron
dimensions of its simple objects are at most 3. We prove that such fusion
category is of Frobenius type. In addition, we also prove that such fusion
category is not simple.
","[{""version"":""v1"",""created"":""Sun, 25 Aug 2013 08:06:25 GMT""}]","2016-05-31"
"1308.5387","Yinan Fang","Y. N. Fang, Yusuf Turek, J. Q. You, and C. P. Sun","Entanglement of spin-orbit qubits induced by Coulomb interaction","6 pages, 4 figures",,"10.1140/epjb/e2014-50172-7",,"cond-mat.mes-hall quant-ph","http://arxiv.org/licenses/nonexclusive-distrib/1.0/","  Spin-orbit qubit (SOQ) is the dressed spin by the orbital degree of freedom
through a strong spin-orbit coupling. We show that Coulomb interaction between
two electrons in quantum dots located separately in two nanowires can
efficiently induce quantum entanglement between two SOQs. The physical
mechanism to achieve such quantum entanglement is based on the feasibility of
the SOQ responding to the external electric field via an intrinsic electric
dipole spin resonance.
","[{""version"":""v1"",""created"":""Sun, 25 Aug 2013 08:06:49 GMT""}]","2015-06-17"
"1308.5388","Mordehai Milgrom","Mordehai Milgrom (Weizmann Institute)","Gravitational waves in bimetric MOND","5 pages, version to be published in Phys. Rev. D","Phys. Rev. D 89, 024027 (2014)","10.1103/PhysRevD.89.024027",,"gr-qc astro-ph.CO hep-ph","http://arxiv.org/licenses/nonexclusive-distrib/1.0/","  I consider the weak field limit (WFL) of bimetric MOND (BIMOND): the lowest
order in the small departures Hmn and H'mn from double Minkowski space-time. In
particular, I look at propagating solutions, for a favorite subclass of BIMOND.
The WFL splits into two sectors for two linear combinations, Hmn+ and Hmn-, of
Hmn and H'mn. The Hmn+ sector is equivalent to the WFL of general relativity
(GR), with its gauge freedom, and has the same vacuum gravitational waves. The
Hmn- sector is fully nonlinear even for the weakest Hmn-, and inherits none of
the coordinate gauge freedom. The equations of motion are scale invariant in
the deep-MOND limit of purely gravitational systems. In these last two regards,
the BIMOND WFL is greatly different from that of other bimetric theories
studied to date. Despite the strong nonlinearity, an arbitrary pair of harmonic
GR wave packets of Hmn and H'mn moving in the same direction, is a solution of
the (vacuum) BIMOND WFL.
","[{""version"":""v1"",""created"":""Sun, 25 Aug 2013 08:37:35 GMT""},{""version"":""v2"",""created"":""Wed, 8 Jan 2014 10:24:39 GMT""}]","2014-01-23"
"1308.5389","Borge ten Hagen","Xu Zheng, Borge ten Hagen, Andreas Kaiser, Meiling Wu, Haihang Cui,
  Zhanhua Silber-Li, Hartmut L\""owen","Non-Gaussian statistics for the motion of self-propelled Janus
  particles: experiment versus theory","12 pages, 10 figures, 1 table","Phys. Rev. E 88, 032304 (2013)","10.1103/PhysRevE.88.032304",,"cond-mat.soft cond-mat.stat-mech","http://arxiv.org/licenses/nonexclusive-distrib/1.0/","  Spherical Janus particles are one of the most prominent examples for active
Brownian objects. Here, we study the diffusiophoretic motion of such
microswimmers in experiment and in theory. Three stages are found: simple
Brownian motion at short times, super-diffusion at intermediate times, and
finally diffusive behavior again at long times. These three regimes observed in
the experiments are compared with a theoretical model for the Langevin dynamics
of self-propelled particles with coupled translational and rotational motion.
Besides the mean square displacement also higher displacement moments are
addressed. In particular, theoretical predictions regarding the non-Gaussian
behavior of self-propelled particles are verified in the experiments.
Furthermore, the full displacement probability distribution is analyzed, where
in agreement with Brownian dynamics simulations either an extremely broadened
peak or a pronounced double-peak structure is found depending on the
experimental conditions.
","[{""version"":""v1"",""created"":""Sun, 25 Aug 2013 08:55:41 GMT""}]","2013-10-08"
"1308.5390","Yi Yu","Yang Feng and Yi Yu","The restricted consistency property of leave-$n_v$-out cross-validation
  for high-dimensional variable selection",,,,,"stat.ME","http://arxiv.org/licenses/nonexclusive-distrib/1.0/","  Cross-validation (CV) methods are popular for selecting the tuning parameter
in the high-dimensional variable selection problem. We show the mis-alignment
of the CV is one possible reason of its over-selection behavior. To fix this
issue, we propose a version of leave-$n_v$-out cross-validation (CV($n_v$)),
for selecting the optimal model among the restricted candidate model set for
high-dimensional generalized linear models. By using the same candidate model
sequence and a proper order of construction sample size $n_c$ in each CV split,
CV($n_v$) avoids the potential hurdles in developing theoretical properties.
CV($n_v$) is shown to enjoy the restricted model selection consistency property
under mild conditions. Extensive simulations and real data analysis support the
theoretical results and demonstrate the performances of CV($n_v$) in terms of
both model selection and prediction.
","[{""version"":""v1"",""created"":""Sun, 25 Aug 2013 08:58:12 GMT""},{""version"":""v2"",""created"":""Sun, 14 Jan 2018 16:33:40 GMT""},{""version"":""v3"",""created"":""Tue, 16 Jan 2018 07:16:30 GMT""}]","2018-01-17"
"1308.5391","Enza Orlandi","Nicolas Dir and Enza Orlandi","Uniqueness of the minimizer for a random nonlocal functional with
  double-well potential in $d\le2$","30 pages",,,,"math-ph math.AP math.MP","http://arxiv.org/licenses/nonexclusive-distrib/1.0/","  We consider a small random perturbation of the energy functional $$
[u]^2_{H^s(\Lambda, R^d)} + \int_\Lambda W(u(x)) dx $$ for $s \in (0,1),$ where
the non-local part $ [u]^2_{H^s(\Lambda,R^d)}$ denotes the total contribution
from $\Lambda \subset R^d$ in the $H^s (R^d)$ Gagliardo semi-norm of $u$ and
$W$ is a double well potential. We show that there exists, as $\Lambda $
invades $ R^d$, for almost all realizations of the random term a minimizer
under compact perturbations, which is unique when $d=2$, $s \in (\frac 12,1)$
and when $d=1$, $s \in [\frac 14, 1).$ This uniqueness is a consequence of the
randomness. When the random term is absent, there are two minimizers which are
invariant under translations in space, $u = \pm 1$.
","[{""version"":""v1"",""created"":""Sun, 25 Aug 2013 09:35:08 GMT""}]","2013-08-27"
"1308.5392","Jasmin Matz","Jasmin Matz","Bounds for global coefficients in the fine geometric expansion of
  Arthur's trace formula for GL(n)","43 pages",,,,"math.RT math.NT","http://arxiv.org/licenses/nonexclusive-distrib/1.0/","  We give upper bounds for the absolute value of the global coefficients
appearing in the fine geometric expansion of Arthur's trace formula for GL(n).
","[{""version"":""v1"",""created"":""Sun, 25 Aug 2013 10:00:01 GMT""},{""version"":""v2"",""created"":""Tue, 22 Oct 2013 07:49:03 GMT""}]","2013-10-23"
"1308.5393","Va\v{s}ek Chv\'atal","Pierre Aboulker, Adrian Bondy, Xiaomin Chen, Ehsan Chiniforooshan,
  Va\v{s}ek Chv\'atal, Peihan Miao","Number of lines in hypergraphs",,"Discrete Applied Mathematics 171 (2014) 137-140",,,"math.CO","http://arxiv.org/licenses/nonexclusive-distrib/1.0/","  Chen and Chv\'atal introduced the notion of lines in hypergraphs; they proved
that every 3-uniform hypergraph with $n$ vertices either has a line that
consists of all $n$ vertices or else has at least $\log_2 n$ distinct lines. We
improve this lower bound by a factor of $2-o(1)$.
","[{""version"":""v1"",""created"":""Sun, 25 Aug 2013 10:17:07 GMT""}]","2021-10-26"
"1308.5394","Jasmin Matz","Jasmin Matz","Zeta Functions for the Adjoint Action of GL(n) and density of residues
  of Dedekind zeta functions","50 pages",,,,"math.NT","http://arxiv.org/licenses/nonexclusive-distrib/1.0/","  We define zeta functions for the adjoint action of GL(n) on its Lie algebra
and study their analytic properties. For n<4 we are able to fully analyse these
functions, and recover the Shintani zeta function for the prehomogeneous vector
space of binary quadratic forms for n=2. Our construction naturally yields a
regularisation, which is necessary for the improvement of the properties of
these zeta function, in particular for the analytic continuation if n>2.
  We further obtain upper and lower bounds on the mean value X^{-5/2}\sum_{E}
\res_{s=1}\zeta_E(s) as X->\infty, where E runs over totally real cubic number
fields whose second successive minimum of the trace form on its ring of
integers is bounded by X. To prove the upper bound we use our new zeta function
for GL(3). These asymptotic bounds are a first step towards a generalisation of
density results obtained by Datskovsky in case of quadratic field extensions.
","[{""version"":""v1"",""created"":""Sun, 25 Aug 2013 10:20:46 GMT""}]","2013-08-27"
"1308.5395","Bob Allen","Robert B. Allen","Toward an Interactive Directory for Norfolk, Nebraska: 1899-1900",,"IFLA Newspaper and Genealogy Section Meeting, Singapore, Aug 2013",,,"cs.DL","http://creativecommons.org/licenses/by/3.0/","  We describe steps toward an interactive directory for the town of Norfolk,
Nebraska for the years 1899 and 1900. This directory would extend the
traditional city directory by including a wider range of entities being
described, much richer information about the entities mentioned and linkages to
mentions of the entities in material such as digitized historical newspapers.
Such a directory would be useful to readers who browse the historical
newspapers by providing structured summaries of the entities mentioned. We
describe the occurrence of entities in two years of the Norfolk Weekly News,
focusing on several individuals to better understand the types of information
which can be gleaned from historical newspapers and other historical materials.
We also describe a prototype program which coordinates information about
entities from the traditional city directories, the federal census, and from
newspapers. We discuss the structured coding for these entities, noting that
richer coding would increasingly include descriptions of events and scenarios.
We propose that rich content about individuals and communities could eventually
be modeled with agents and woven into historical narratives.
","[{""version"":""v1"",""created"":""Sun, 25 Aug 2013 10:40:34 GMT""}]","2023-03-07"
"1308.5396","Dominique Perrin","Val\'erie Berth\'e and Clelia De Felice and Francesco Dolce and and
  Julien Leroy and Dominique Perrin and Christophe Reutenauer and Giuseppina
  Rindone","Maximal bifix decoding","arXiv admin note: text overlap with arXiv:1305.0127","Discrete Math. 338 (2015)725-742",,,"math.CO","http://arxiv.org/licenses/nonexclusive-distrib/1.0/","  We introduce a class of sets of words which is a natural common
generalization of Sturmian sets and of interval exchange sets. This class of
sets consists of the uniformly recurrent tree sets, where the tree sets are
defined by a condition on the possible extensions of bispecial factors. We
prove that this class is closed under maximal bifix decoding. The proof uses
the fact that the class is also closed under decoding with respect to return
words.
","[{""version"":""v1"",""created"":""Sun, 25 Aug 2013 10:43:57 GMT""},{""version"":""v2"",""created"":""Tue, 24 Dec 2013 14:30:19 GMT""},{""version"":""v3"",""created"":""Fri, 28 Feb 2014 09:51:32 GMT""},{""version"":""v4"",""created"":""Mon, 23 Feb 2015 21:16:36 GMT""}]","2015-02-25"
"1308.5397","Kyeong Soo (Joseph) Kim","Luke Farmer and Kyeong Soo Kim","Cooperative ISP Traffic Shaping Schemes in Broadband Shared Access
  Networks","5 pages, 2 figures; accepted for presentation at FOAN 2013, Jul. 19,
  2013",,"10.1109/FOAN.2013.6648820",,"cs.NI","http://arxiv.org/licenses/nonexclusive-distrib/1.0/","  Traffic shaping is a mechanism used by Internet Service Providers (ISPs) to
limit subscribers' traffic based on their service contracts. This paper
investigates the current implementation of traffic shaping based on the token
bucket filter (TBF), discusses its advantages and disadvantages, and proposes a
cooperative TBF that can improve subscribers' quality of service (QoS)/quality
of experience (QoE) without compromising business aspects of the service
contract model by proportionally allocating excess bandwidth from inactive
subscribers to active ones based on the long-term bandwidths per their service
contracts.
","[{""version"":""v1"",""created"":""Sun, 25 Aug 2013 11:12:36 GMT""}]","2014-03-25"
"1308.5398","Antonio M. Garcia-Garcia","Antonio M. Garc\'ia-Garc\'ia, Hua Bi Zeng and Hai Qing Zhang","A thermal quench induces spatial inhomogeneities in a holographic
  superconductor","corrected typos, added references and new results for a different
  quench",,"10.1007/JHEP07(2014)096",,"hep-th cond-mat.supr-con","http://arxiv.org/licenses/nonexclusive-distrib/1.0/","  Holographic duality is a powerful tool to investigate the far-from
equilibrium dynamics of superfluids and other phases of quantum matter. For
technical reasons it is usually assumed that, after a quench, the far-from
equilibrium fields are still spatially uniform. Here we relax this assumption
and study the time evolution of a holographic superconductor after a
temperature quench but allowing spatial variations of the order parameter. Even
though the initial state and the quench are spatially uniform we show the order
parameter develops spatial oscillations with an amplitude that increases with
time until it reaches a stationary value. The free energy of these
inhomogeneous solutions is lower than that of the homogeneous ones. Therefore
the former corresponds to the physical configuration that could be observed
experimentally.
","[{""version"":""v1"",""created"":""Sun, 25 Aug 2013 11:14:19 GMT""},{""version"":""v2"",""created"":""Fri, 6 Sep 2013 23:42:30 GMT""},{""version"":""v3"",""created"":""Fri, 7 Feb 2014 15:51:51 GMT""}]","2015-06-17"
"1308.5399","Damir Yeliussizov","Askar Dzhumadil'daev and Damir Yeliussizov","Stirling permutations on multisets","Accepted for publication in the European Journal of Combinatorics. 17
  pages, 4 figures",,,,"math.CO","http://arxiv.org/licenses/nonexclusive-distrib/1.0/","  A permutation $\sigma$ of a multiset is called Stirling permutation if
$\sigma(s)\ge \sigma(i)$ as soon as $\sigma(i)=\sigma(j)$ and $i<s<j.$ In our
paper we study Stirling polynomials that arise in the generating function for
descent statistics on Stirling permutations of any multiset. We develop
generalizations of the classical Stirling numbers and present their
combinatorial interpretations. Particularly, we apply the theory of
$P$-partitions. Using certain specifications we also introduce the Stirling
numbers of odd type and generalizations of the central factorial numbers.
","[{""version"":""v1"",""created"":""Sun, 25 Aug 2013 11:20:44 GMT""}]","2013-08-27"
"1308.5400","Juergen Herzog","J\""urgen Herzog, Takayuki Hibi","Bounding the socles of powers of squarefree monomial ideals",,,,,"math.AC","http://arxiv.org/licenses/nonexclusive-distrib/1.0/","  Let $S=K[x_1,\ldots,x_n]$ be the polynomial ring in $n$ variables over a
field $K$ and $I\subset S$ a squarefree monomial ideal. In the present paper we
are interested in the monomials $u \in S$ belonging to the socle
$\Soc(S/I^{k})$ of $S/I^{k}$, i.e., $u \not\in I^{k}$ and $ux_{i} \in I^{k}$
for $1 \leq i \leq n$. We prove that if a monomial $x_1^{a_1}\cdots x_n^{a_n}$
belongs to $\Soc(S/I^{k})$, then $a_i\leq k-1$ for all $1 \leq i \leq n$. We
then discuss squarefree monomial ideals $I \subset S$ for which $x_{[n]}^{k-1}
\in \Soc(S/I^{k})$, where $x_{[n]} = x_{1}x_{2}\cdots x_{n}$. Furthermore, we
give a combinatorial characterization of finite graphs $G$ on $[n] = \{1,
\ldots, n\}$ for which $\depth S/(I_{G})^{2}=0$, where $I_{G}$ is the edge
ideal of $G$.
","[{""version"":""v1"",""created"":""Sun, 25 Aug 2013 11:40:03 GMT""}]","2013-08-27"
