"1308.5344","Marco de Cesare","Marco de Cesare","The Gribov phenomenon in flat and curved spaces","87 pages, 8 figures",,,,"hep-th","http://arxiv.org/licenses/nonexclusive-distrib/1.0/","  The quantization of Yang-Mills theories relies on the gauge-fixing procedure.
However, in the non-Abelian case this procedure leads to the well known Gribov
ambiguity. In order to solve the ambiguity a modification of the functional
integral formula must be introduced. As a consequence of this, the Green
functions get deep modifications in the infrared. We consider in particular the
SU (N) case and show that in the pure gauge case the ghost propagator is
enhanced, while the gluon propagator is suppressed in this limit, therefore the
study of the Gribov ambiguity may shed some light on the mass gap problem and
on colour confinement. We discuss some recent developments on the subject in
the case of a curved background. We argue that the concurrent presence of a
spacetime curvature and the Gribov ambiguity may introduce further
modifications to the Green functions in the infrared.
","[{""version"":""v1"",""created"":""Sat, 24 Aug 2013 16:24:45 GMT""}]","2013-08-27"
"1308.5345","Jing Wang","Jing Wang, Biao Lian, Shou-Cheng Zhang","Universal Scaling of Quantum Anomalous Hall Plateau Transition","8 pages, 4 figures. Published version","Phys. Rev. B 89, 085106 (2014)","10.1103/PhysRevB.89.085106",,"cond-mat.mes-hall cond-mat.str-el","http://arxiv.org/licenses/nonexclusive-distrib/1.0/","  We study the critical properties of the quantum anomalous Hall (QAH) plateau
transition in magnetic topological insulators. We introduce a microscopic model
for the plateau transition in QAH effect at the coercive field and then map it
to the network model of quantum percolation in the integer quantum Hall effect
plateau transition. Generally, an intermediate plateau with zero Hall
conductance could occur at the coercive field. $\sigma_{xx}$ would have double
peaks at the coercivity while $\rho_{xx}$ only has single peak. Remarkably,
this theoretical prediction is already borne out in experiment. Universal
scaling of the transport coefficients $\rho_{xy}$ and $\rho_{xx}$ are
predicted.
","[{""version"":""v1"",""created"":""Sat, 24 Aug 2013 16:36:24 GMT""},{""version"":""v2"",""created"":""Fri, 7 Feb 2014 22:53:39 GMT""}]","2014-02-11"
"1308.5346","Tong Li","Yi Cai, Tong Li","Singlet Dark Matter in Type II Two Higgs Doublet Model","18 pages, 6 figures","Phys. Rev. D 88, 115004 (2013)","10.1103/PhysRevD.88.115004",,"hep-ph","http://arxiv.org/licenses/nonexclusive-distrib/1.0/","  Inspired by the dark matter searches in the low mass region, we study the
Type II two Higgs doublet model with a light gauge singlet WIMP stabilized by a
Z_2 symmetry. The real singlet is required to only couple to the non-Standard
Model Higgs. We investigate singlet candidates with different spins as well as
isospin violating effect. The parameter space favored by LHC data in two Higgs
doublet model and hadronic uncertainties in WIMP-nucleon elastic scattering are
also taken into account. We find only the scalar singlet in the isospin
conserving case leads to a major overlap with the region of interests of most
direct detection experiments.
","[{""version"":""v1"",""created"":""Sat, 24 Aug 2013 16:36:52 GMT""}]","2013-12-16"
"1308.5347","Brian Vlcek","Brian J. Vlcek","Beyond the Standard Model: LHC Phenomenology, Cosmology from
  Post-Inflationary Sources, and Dark Matter Physics","Doctoral Dissertation, successfully defended on 12 Aug 2013",,,,"hep-ph","http://arxiv.org/licenses/nonexclusive-distrib/1.0/","  It is the goal of this dissertation to demonstrate that beyond the standard
model, certain theories exist which solve conflicts between observation and
theory -- conflicts such as massive neutrinos, dark matter, unstable Higgs
vacuum, and recent Planck observations of excess relativistic degrees of
freedom in the early universe. Theories explored include a D-brane inspired
construct of U(3) X Sp(1) X U(1) X U(1) extension of the standard model, in
which we demonstrate several possible observables that may be detected at the
LHC, and an ability to stabilize the Higgs mechanism. The extended model can
also explain recent Planck data which, when added to HST data gives an excess
of relativistic degrees of freedom of \Delta N = 0.574 +- 0.25 above the
standard result. Also explored is a possible non-thermal dark matter model for
explanation of this result. Recent observations of Fermi bubble results
indicate a signal of a 50 GeV dark matter particle annihilating into b b-bar,
with a thermally averaged annihilation cross section corresponding to < \sigma
v> = 8 X 10^(-27) cm^3/s, spurs interest in a Higgs portal model suggested by
Steven Weinberg. Other implications of this model are also explored such as its
ability to explain dark matter direct detection results along with LHC Higgs
data, and Planck data. Particle physics is complimented by possible stochastic
gravitational wave searches for which a model of second order global phase
transitions is explored. These transitions generate gravitational wave spectra
with amplitudes of order \Omega_{gw} h^2 = 10^(-24) - 10^(-15). Furthermore,
techniques into such calculations are investigated in hopes to improve the
stability required in such lattice simulations.
","[{""version"":""v1"",""created"":""Sat, 24 Aug 2013 16:57:39 GMT""}]","2013-08-27"
"1308.5348","Brett D. Wick","Sandra Pott, Maria Carmen Reguera, Eric T. Sawyer, Brett D. Wick","Composition of Dyadic Paraproducts","v1: 26 pages","Adv. Math. 298 (2016), 581-611",,,"math.CA math.AP math.CV","http://arxiv.org/licenses/nonexclusive-distrib/1.0/","  We obtain necessary and sufficient conditions to characterize the boundedness
of the composition of dyadic paraproduct operators.
","[{""version"":""v1"",""created"":""Sat, 24 Aug 2013 17:33:04 GMT""}]","2016-10-10"
"1308.5349","Brett D. Wick","Sandra Pott, Maria Carmen Reguera, Eric T. Sawyer, Brett D. Wick","The Linear Bound for the Natural Weighted Resolution of the Haar Shift","v1: 21 pages; v2: 22 pages, typos corrected, main results slightly
  modified",,,,"math.CA math.CV","http://arxiv.org/licenses/nonexclusive-distrib/1.0/","  The Hilbert transform has a linear bound in the $A_{2}$ characteristic on
weighted $L^{2}$, \begin{equation*} \left\Vert H\right\Vert
_{L^{2}(w)\rightarrow L^{2}(w)}\lesssim \left[ w \right] _{A_{2}},
\end{equation*} and we extend this linear bound to the nine constituent
operators in the natural weighted resolution of the conjugation
$M_{w^{\frac{1}{2}}}\mathcal{S }M_{w^{-\frac{1}{2}}}$ induced by the canonical
decomposition of a multiplier into paraproducts:% \begin{equation*}
M_{f}=P_{f}^{-}+P_{f}^{0}+P_{f}^{+}. \end{equation*} The main tools used are
composition of paraproducts, a product formula for Haar coefficients, the
Carleson Embedding Theorem, and the linear bound for the square function.
","[{""version"":""v1"",""created"":""Sat, 24 Aug 2013 17:45:06 GMT""},{""version"":""v2"",""created"":""Sun, 12 Jan 2014 23:29:35 GMT""}]","2014-01-14"
"1308.5350","Moneesh Upmanyu","Changjian Wang and Moneesh Upmanyu","Effect of solute segregation on shear-induced grain boundary motion","4 pages, 4 figures",,,,"cond-mat.mtrl-sci","http://arxiv.org/licenses/nonexclusive-distrib/1.0/","  Atomic-scale simulations are performed to study the effect of solute
segregation on the shear-induced motion of select grain boundaries in the
classical $\alpha$-Fe/C system. At shear rates larger than the solute diffusion
rate, we observe a transition from coupled motion to sliding. Below a critical
solute excess, the boundaries break away from the solute cloud and move in a
coupled motion. At smaller shear rates, we observe extrinsic coupled motion at
small stresses indicating that the coupling is aided by convective solute
diffusion along the boundary. Our studies underscore the role of solutes in
modifying the bicrystallography, temperature and rate dependence of shear
accommodation at grain boundaries.
","[{""version"":""v1"",""created"":""Sat, 24 Aug 2013 17:53:35 GMT""}]","2013-08-27"
"1308.5351","Mohamed M S Nasser","Mohamed M. S. Nasser","Fast solution of boundary integral equations with the generalized
  Neumann kernel",,"Electronic Transactions on Numerical Analysis, 44 (2015) 189--229",,,"math.NA","http://arxiv.org/licenses/nonexclusive-distrib/1.0/","  A fast method for solving boundary integral equations with the generalized
Neumann kernel and the adjoint generalized Neumann kernel is presented. The
method is based on discretizing the integral equations by the Nystr\""om method
with the trapezoidal rule to obtain $(m+1)n\times(m+1)n$ linear systems where
$m+1$ is the multiplicity of the multiply connected domain and $n$ is the
number of nodes in the discretization of each boundary component. The obtained
linear systems are solved by the generalized minimal residual (GMRES) method.
Each iteration of the GMRES method requires a matrix-vector product which can
be computed using the Fast Multipole Method (FMM). The complexity of the
presented method is $O((m+1)n\ln n)$ for the integral equation with the
generalized Neumann kernel and $O((m+1)n)$ for the integral equation with the
adjoint generalized Neumann kernel. The presented numerical results illustrate
that the presented method gives accurate results even for domains with high
connectivity, domains with piecewise smooth boundaries, and domains with close
boundaries.
","[{""version"":""v1"",""created"":""Sat, 24 Aug 2013 18:29:42 GMT""},{""version"":""v2"",""created"":""Sat, 5 Oct 2013 18:45:36 GMT""},{""version"":""v3"",""created"":""Fri, 27 Dec 2013 15:43:07 GMT""},{""version"":""v4"",""created"":""Sun, 26 Jan 2014 21:25:15 GMT""},{""version"":""v5"",""created"":""Fri, 14 Mar 2014 07:33:44 GMT""}]","2015-04-10"
"1308.5352","Asaf Shapira","Guy Moshkovitz and Asaf Shapira","A Short Proof of Gowers' Lower Bound for the Regularity Lemma",,,,,"math.CO","http://arxiv.org/licenses/nonexclusive-distrib/1.0/","  A celebrated result of Gowers states that for every \epsilon > 0 there is a
graph G so that every \epsilon-regular partition of G (in the sense of
Szemeredi's regularity lemma) has order given by a tower of exponents of height
polynomial in 1/\epsilon. In this note we give a new proof of this result that
uses a construction and proof of correctness that are significantly simpler and
shorter.
","[{""version"":""v1"",""created"":""Sat, 24 Aug 2013 18:29:45 GMT""}]","2013-08-27"
"1308.5353","Tomas Dahlen","Tomas Dahlen, Bahram Mobasher, Sandra M. Faber, Henry C. Ferguson,
  Guillermo Barro, Steven L. Finkelstein, Kristian Finlator, Adriano Fontana,
  Ruth Gruetzbauch, Seth Johnson, Janine Pforr, Mara Salvato, Tommy Wiklind,
  Stijn Wuyts, Viviana Acquaviva, Mark E. Dickinson, Yicheng Guo, Jiasheng
  Huang, Kuang-Han Huang, Jeffrey A. Newman, Eric F. Bell, Christopher J.
  Conselice, Audrey Galametz, Eric Gawiser, Mauro Giavalisco, Norman A. Grogin,
  Nimish Hathi, Dale Kocevski, Anton M. Koekemoer, David C. Koo, Kyoung-Soo
  Lee, Elizabeth J. McGrath, Casey Papovich, Michael Peth, Russell Ryan, Rachel
  Somerville, Benjamin Weiner, and Grant Wilson","A Critical Assessment of Photometric Redshift Methods: A CANDELS
  Investigation","26 pages, 15 figures, ApJ in press",,"10.1088/0004-637X/775/2/93",,"astro-ph.CO","http://arxiv.org/licenses/nonexclusive-distrib/1.0/","  We present results from the Cosmic Assembly Near-infrared Deep Extragalactic
Legacy Survey (CANDELS) photometric redshift methods investigation. In this
investigation, the results from eleven participants, each using a different
combination of photometric redshift code, template spectral energy
distributions (SEDs) and priors, are used to examine the properties of
photometric redshifts applied to deep fields with broad-band multi-wavelength
coverage. The photometry used includes U-band through mid-infrared filters and
was derived using the TFIT method. Comparing the results, we find that there is
no particular code or set of template SEDs that results in significantly better
photometric redshifts compared to others. However, we find codes producing the
lowest scatter and outlier fraction utilize a training sample to optimize
photometric redshifts by adding zero-point offsets, template adjusting or
adding extra smoothing errors. These results therefore stress the importance of
the training procedure. We find a strong dependence of the photometric redshift
accuracy on the signal-to-noise ratio of the photometry. On the other hand, we
find a weak dependence of the photometric redshift scatter with redshift and
galaxy color. We find that most photometric redshift codes quote redshift
errors (e.g., 68% confidence intervals) that are too small compared to that
expected from the spectroscopic control sample. We find that all codes show a
statistically significant bias in the photometric redshifts. However, the bias
is in all cases smaller than the scatter, the latter therefore dominates the
errors. Finally, we find that combining results from multiple codes
significantly decreases the photometric redshift scatter and outlier fraction.
We discuss different ways of combining data to produce accurate photometric
redshifts and error estimates.
","[{""version"":""v1"",""created"":""Sat, 24 Aug 2013 18:37:56 GMT""}]","2015-06-17"
"1308.5354","Cagdas Bilen","Cagdas Bilen (INRIA - IRISA), Gilles Puy, R\'emi Gribonval (INRIA -
  IRISA), Laurent Daudet","Convex Optimization Approaches for Blind Sensor Calibration using
  Sparsity",,"IEEE Transactions on Signal Processing 62, 18 (2014) 4847-4856","10.1109/TSP.2014.2342651",,"cs.IT math.IT","http://arxiv.org/licenses/nonexclusive-distrib/1.0/","  We investigate a compressive sensing framework in which the sensors introduce
a distortion to the measurements in the form of unknown gains. We focus on
blind calibration, using measures performed on multiple unknown (but sparse)
signals and formulate the joint recovery of the gains and the sparse signals as
a convex optimization problem. We divide this problem in 3 subproblems with
different conditions on the gains, specifially (i) gains with different
amplitude and the same phase, (ii) gains with the same amplitude and different
phase and (iii) gains with different amplitude and phase. In order to solve the
first case, we propose an extension to the basis pursuit optimization which can
estimate the unknown gains along with the unknown sparse signals. For the
second case, we formulate a quadratic approach that eliminates the unknown
phase shifts and retrieves the unknown sparse signals. An alternative form of
this approach is also formulated to reduce complexity and memory requirements
and provide scalability with respect to the number of input signals. Finally
for the third case, we propose a formulation that combines the earlier two
approaches to solve the problem. The performance of the proposed algorithms is
investigated extensively through numerical simulations, which demonstrates that
simultaneous signal recovery and calibration is possible with convex methods
when sufficiently many (unknown, but sparse) calibrating signals are provided.
","[{""version"":""v1"",""created"":""Sat, 24 Aug 2013 18:53:16 GMT""},{""version"":""v2"",""created"":""Wed, 19 Mar 2014 19:15:09 GMT""},{""version"":""v3"",""created"":""Tue, 22 Jul 2014 17:40:39 GMT""},{""version"":""v4"",""created"":""Mon, 25 Aug 2014 17:31:45 GMT""}]","2014-08-26"
"1308.5355","Joseph H. Silverman","Michael Joyce, Shu Kawaguchi, Joseph H. Silverman","Landen transforms as families of (commuting) rational self-maps of
  projective space","35 pages","Bull Inst. Math. Academia Sinica 9 (2014), 547-584",,,"math.AG math.DS math.NT","http://arxiv.org/licenses/nonexclusive-distrib/1.0/","  The classical (m,k)-Landen transform F_{m,k} is a self-map of the field of
rational functions C(z) obtained by forming a weighted average of a rational
function over twists by m'th roots of unity. Identifying the set of rational
maps of degree d with an affine open subset of P^{2d+1}, we prove that F_{m,0}
induces a dominant rational self-map R_{d,m,0} of P^{2d+1} of algebraic degree
m, and for 0 < k < m, the transform F_{m,k} induces a dominant rational
self-map R_{d,m,k} of algebraic degree m of a certain hyperplane in P^{2d+1}.
We show in all cases that R_{d,m,k} extends nicely to a map of P^{2d+1} over
Spec(Z), and that {R_{d,m,0} : m \ge 0} is a commuting family of maps.
","[{""version"":""v1"",""created"":""Sat, 24 Aug 2013 19:36:15 GMT""}]","2017-08-29"
"1308.5356","Katla Satyanarayana","Satyanarayana Katla, Abhinov Balagoni","Technological and Cost based Analysis of Future-Proof Fiber Access
  Passive Networks: GPON and WDM PON","This paper has been withdrawn by the author due to a crucial sign
  error",,,,"cs.NI","http://arxiv.org/licenses/nonexclusive-distrib/1.0/","  This paper discusses the key principles of Gigabit Passive Optical Network
(GPON) which is based on Time Division Multiplexing Passive Optical Network
(TDM PON) and Wavelength Division Multiplexing Passive Optical Network (WDM
PON), which is considered to be next generation passive optical network. In the
present day scenario, access to broad- band is increasing at a rapid pace.
Because of the advantages of fiber access in terms of capacity and cost, most
of the countries have started deploying GPON access as an important part of
national strategy. Though GPON is promising, it has few limitations. On the
other hand WDM PON, a next generation network, is quite promising unlike GPON,
it is easily scalable and interoperable with different vendors. This paper
provides an overview of GPON, WDM PON and its key dissimilarities based on
technicalities and cost.
","[{""version"":""v1"",""created"":""Sat, 24 Aug 2013 19:39:46 GMT""},{""version"":""v2"",""created"":""Thu, 7 Nov 2013 13:00:07 GMT""},{""version"":""v3"",""created"":""Tue, 12 Nov 2013 18:00:29 GMT""},{""version"":""v4"",""created"":""Wed, 9 Apr 2014 11:22:11 GMT""},{""version"":""v5"",""created"":""Thu, 10 Apr 2014 14:52:00 GMT""}]","2014-04-11"
"1308.5357","Sudip Chakravarty","Chen-Hsuan Hsu, Sudip Chakravarty","Superconducting phase within the hidden-order state of the heavy-fermion
  material $\mathrm{URu_{2}Si_{2}}$","Version accepted in Phys. Rev. B","Phys. Rev. B 90, 134507 (2014)","10.1103/PhysRevB.90.134507",,"cond-mat.str-el cond-mat.supr-con","http://arxiv.org/licenses/nonexclusive-distrib/1.0/","  An unconventional pairing mechanism in the heavy-fermion material
$\mathrm{URu_{2}Si_{2}}$ is studied. We propose a mixed singlet-triplet
$d$-density wave to be the hidden-order state in $\mathrm{URu_{2}Si_{2}}$. The
exotic order is topologically nontrivial and supports a charge $2e$ skyrmionic
spin texture, which is assumed to fractionalize into merons and antimerons at
the deconfined quantum critical point. The interaction between these fractional
particles results in a (pseudo)spin-singlet chiral $d$-wave superconducting
state, which breaks time reversal symmetry. Therefore, it is highly likely to
produce a nonzero signal of the polar Kerr effect at the onset of the
superconductivity, consistent with recent experiments. In addition, the nodal
structures of the possible pairing functions in our model are consistent with
the thermodynamic experiments in $\mathrm{URu_{2}Si_{2}}$.
","[{""version"":""v1"",""created"":""Sat, 24 Aug 2013 19:49:04 GMT""},{""version"":""v2"",""created"":""Fri, 16 May 2014 00:09:27 GMT""},{""version"":""v3"",""created"":""Fri, 11 Jul 2014 09:33:07 GMT""},{""version"":""v4"",""created"":""Wed, 24 Sep 2014 20:59:04 GMT""}]","2014-10-20"
"1308.5358","Mason A. Porter","Jasvir K. Grewal, Cameron L. Hall, Mason A. Porter, and Marian S.
  Dawkins","Formation of Dominance Relationships via Strategy Updating in an
  Asymmetric Hawk-Dove Game","20 pages, 3 figures (some with multiple parts)",,,,"q-bio.PE math.DS nlin.AO","http://arxiv.org/licenses/nonexclusive-distrib/1.0/","  We develop a model to describe the development of dominance relations between
social animals as they use past experiences to inform future interactions.
Using the game-theoretic framework of a Hawk-Dove game with asymmetric
resource-holding potentials (RHPs), we derive a simple model that describes the
social interactions of animals that compete for resources. We then consider a
game-playing strategy in which animals acquire information about their RHP
asymmetry from the results of their previous contests and subsequently use
their asymmetry assessment to inform their behavior in future contests. We
examine how directly incorporating the fact that animals have incomplete
information in their interactions can lead to outcomes that differ from what
would be expected if one considers the situation as a static game in which the
animals have perfect information about the asymmetry size. We thereby obtain
results that are consistent with observations of dominance-hierarchy formation
in social animals. We also discuss how increased interactions between animals
can speed up the asymmetry assessment process and how this can explain why
aggression can sometimes decrease as the number of interactions between animals
increases over time.
","[{""version"":""v1"",""created"":""Sat, 24 Aug 2013 19:54:42 GMT""}]","2013-08-27"
"1308.5359","Sahar Alipour","F. Benatti, S. Alipour, and A. T. Rezakhani","Dissipative quantum metrology in manybody systems of identical particles","9 pages, 2 figures","New. J. Phys. 16, 015023 (2014)","10.1088/1367-2630/16/1/015023",,"quant-ph","http://arxiv.org/licenses/nonexclusive-distrib/1.0/","  Estimation of physical parameters is a must in almost any part of science and
technology. The enhancement of the performances in this task, e.g., beating the
standard classical shot-noise limit, using available physical resources is a
major goal in metrology. Quantum metrology in closed systems has indicated that
entanglement in such systems may be a useful resource. However, it is not yet
fully understood whether in open quantum systems such enhancements may still
show up. Here, we consider a dissipative (open) quantum system of identical
particles in which a parameter of the open dynamics itself is to be estimated.
We employ a recently-developed dissipative quantum metrology framework, and
investigate whether the entanglement produced in the course of the dissipative
dynamics may help the estimation task. Specifically, we show that even in a
Markovian dynamics, in which states become less distinguishable in time, at
small enough times entanglement generated by the dynamics may offer some
advantage over the classical shot-noise limit.
","[{""version"":""v1"",""created"":""Sat, 24 Aug 2013 20:03:12 GMT""}]","2014-01-29"
"1308.5360","Arun I B","Arun I B, T.G. Venkatesh","Adaptive Backoff Algorithm for IEEE 802.11 DCF under MPR Wireless
  Channels","7 pages, 8 figures, Proceedings of 22nd International Conference on
  Computer Communications and Networks (ICCCN) 2013, Nassau, Bahamas",,,,"cs.NI","http://arxiv.org/licenses/nonexclusive-distrib/1.0/","  As a result of the recent advances in physical (PHY) layer communication
techniques, it is possible to receive multiple packets at the receiver
concurrently. This capability of a receiver to decode multiple simultaneous
transmissions is known as multi-packet reception (MPR). In this paper, we
propose a simple Medium Access Control (MAC) protocol for an MPR wireless
channel, where we modify the backoff procedure as a function of number of
ongoing transmissions in the channel. Our protocol is backward compatible with
the IEEE 802.11 DCF protocol. The performance analysis of the proposed protocol
is carried out using extensive simulations and it is compared with some of the
existing MPR MAC protocols. The proposed mechanism improves the throughput and
delay performance of the IEEE 802.11 DCF.
","[{""version"":""v1"",""created"":""Sat, 24 Aug 2013 20:46:47 GMT""}]","2013-08-27"
"1308.5361","Christos Mias","George Christou and Christos Mias","The Chimaerical Quest for the Optical Plasmonic Superlens",,,,,"physics.optics","http://arxiv.org/licenses/nonexclusive-distrib/1.0/","  This commentary aims to expose the fallacy of claiming that a plasmonic
silver film superlens is capable to image real subwavelength objects. This lens
was proposed by the Berkeley's group who, in their misleading experiment,
inappropriately regarded subwavelength apertures as the objects to be imaged
whereas the main function of these apertures was to transform free space laser
light into an evanescent field necessary for exciting the surface plasmon
resonance phenomenon in silver. In addition, the apertures also determined the
constrained effective area on the silver film where the phenomenon could occur.
We provide a fresh insightful physical explanation of how this phenomenon is
excited and what it entails. We emphasize the phenomenon's important effect of
subwavelength conversion (reduction) of the generated surface plasmons and
their associated bound enhanced evanescent fields.
","[{""version"":""v1"",""created"":""Sat, 24 Aug 2013 21:17:58 GMT""},{""version"":""v2"",""created"":""Sun, 24 Nov 2013 18:20:40 GMT""},{""version"":""v3"",""created"":""Fri, 27 Dec 2013 17:04:01 GMT""},{""version"":""v4"",""created"":""Fri, 4 Apr 2014 12:54:16 GMT""}]","2014-04-07"
